,number,value,datetime_start,datetime_complete,duration,params_class_weight,params_max_depth,params_max_features,params_n_estimators,state
2050,2050,0.7304789168263889,2022-11-30 04:35:57.823246,2022-11-30 04:36:18.979174,0 days 00:00:21.155928,"{0: 1, 1: 10}",6.0,1.0,660,COMPLETE
2051,2051,0.7301941651221258,2022-11-30 04:36:19.222693,2022-11-30 04:36:42.914376,0 days 00:00:23.691683,"{0: 1, 1: 10}",6.0,,760,COMPLETE
2052,2052,0.7151554469584477,2022-11-30 04:36:43.152262,2022-11-30 04:37:06.008032,0 days 00:00:22.855770,"{0: 1, 1: 10}",17.0,,710,COMPLETE
2053,2053,0.7157875286170319,2022-11-30 04:37:06.261637,2022-11-30 04:37:27.898842,0 days 00:00:21.637205,"{0: 1, 1: 10}",38.0,,660,COMPLETE
2054,2054,0.5345760059152244,2022-11-30 04:37:28.141925,2022-11-30 04:37:37.129523,0 days 00:00:08.987598,"{0: 1, 1: 10}",30.0,log2,760,COMPLETE
2055,2055,0.7293124363109553,2022-11-30 04:37:37.369091,2022-11-30 04:37:59.786955,0 days 00:00:22.417864,"{0: 1, 1: 10}",6.0,,710,COMPLETE
2056,2056,0.7157566993218664,2022-11-30 04:38:00.029944,2022-11-30 04:38:25.312862,0 days 00:00:25.282918,"{0: 1, 1: 10}",35.0,,810,COMPLETE
2057,2057,0.7159839574585932,2022-11-30 04:38:25.545430,2022-11-30 04:38:44.796048,0 days 00:00:19.250618,"{0: 1, 1: 10}",4.0,,660,COMPLETE
2058,2058,0.7306149061895006,2022-11-30 04:38:45.035746,2022-11-30 04:39:05.073327,0 days 00:00:20.037581,"{0: 1, 1: 10}",6.0,0.9,660,COMPLETE
2059,2059,0.716308466433521,2022-11-30 04:39:05.309210,2022-11-30 04:39:26.386393,0 days 00:00:21.077183,"{0: 1, 1: 10}",14.0,0.8,760,COMPLETE
2060,2060,0.7298931040871268,2022-11-30 04:39:26.634489,2022-11-30 04:39:48.992023,0 days 00:00:22.357534,"{0: 1, 1: 10}",6.0,,710,COMPLETE
2061,2061,0.7134593589120836,2022-11-30 04:39:49.228606,2022-11-30 04:40:11.004180,0 days 00:00:21.775574,"{0: 1, 1: 10}",24.0,,660,COMPLETE
2062,2062,0.7115929661203535,2022-11-30 04:40:11.240899,2022-11-30 04:40:34.135260,0 days 00:00:22.894361,"{0: 1, 1: 10}",39.0,,710,COMPLETE
2063,2063,0.7324123983187186,2022-11-30 04:40:34.378055,2022-11-30 04:40:57.946555,0 days 00:00:23.568500,"{0: 1, 1: 10}",6.0,,760,COMPLETE
2064,2064,0.7183060895246552,2022-11-30 04:40:58.191940,2022-11-30 04:41:19.925102,0 days 00:00:21.733162,"{0: 1, 1: 10}",21.0,,660,COMPLETE
2065,2065,0.7350572656923268,2022-11-30 04:41:20.173170,2022-11-30 04:41:43.834105,0 days 00:00:23.660935,"{0: 1, 1: 10}",6.0,,760,COMPLETE
2066,2066,0.7115958126071382,2022-11-30 04:41:44.067648,2022-11-30 04:42:08.149781,0 days 00:00:24.082133,"{0: 1, 1: 10}",19.0,,760,COMPLETE
2067,2067,0.7266327659475156,2022-11-30 04:42:08.401549,2022-11-30 04:42:33.673659,0 days 00:00:25.272110,"{0: 1, 1: 10}",8.0,,810,COMPLETE
2068,2068,0.7180690648833,2022-11-30 04:42:33.919120,2022-11-30 04:42:58.070552,0 days 00:00:24.151432,"{0: 1, 1: 10}",28.0,,760,COMPLETE
2069,2069,0.7346614123564308,2022-11-30 04:42:58.308625,2022-11-30 04:43:21.703579,0 days 00:00:23.394954,"{0: 1, 1: 10}",6.0,,760,COMPLETE
2070,2070,0.7119337386413754,2022-11-30 04:43:21.953840,2022-11-30 04:43:46.130356,0 days 00:00:24.176516,"{0: 1, 1: 10}",32.0,,760,COMPLETE
2071,2071,0.7068504826930317,2022-11-30 04:43:46.376856,2022-11-30 04:44:04.235391,0 days 00:00:17.858535,"{0: 1, 1: 10}",13.0,0.6,760,COMPLETE
2072,2072,0.7318110892643939,2022-11-30 04:44:04.476631,2022-11-30 04:44:29.245676,0 days 00:00:24.769045,"{0: 1, 1: 10}",6.0,,810,COMPLETE
2073,2073,0.7331305868462868,2022-11-30 04:44:29.482706,2022-11-30 04:44:53.069035,0 days 00:00:23.586329,"{0: 1, 1: 10}",6.0,,760,COMPLETE
2074,2074,0.6770147339865112,2022-11-30 04:44:53.309718,2022-11-30 04:45:09.548026,0 days 00:00:16.238308,"{0: 1, 1: 10}",2.0,,810,COMPLETE
2075,2075,0.716922681684978,2022-11-30 04:45:09.788475,2022-11-30 04:45:33.834681,0 days 00:00:24.046206,"{0: 1, 1: 10}",20.0,,760,COMPLETE
2076,2076,0.7333222054368145,2022-11-30 04:45:34.090505,2022-11-30 04:45:57.903740,0 days 00:00:23.813235,"{0: 1, 1: 10}",7.0,,760,COMPLETE
2077,2077,0.7167468215686177,2022-11-30 04:45:58.145970,2022-11-30 04:46:23.518279,0 days 00:00:25.372309,"{0: 1, 1: 10}",29.0,1.0,810,COMPLETE
2078,2078,0.717789545054174,2022-11-30 04:46:23.771634,2022-11-30 04:46:46.566091,0 days 00:00:22.794457,"{0: 1, 1: 10}",12.0,,710,COMPLETE
2079,2079,0.7193496881466339,2022-11-30 04:46:46.805695,2022-11-30 04:47:11.119563,0 days 00:00:24.313868,"{0: 1, 1: 10}",15.0,,760,COMPLETE
2080,2080,0.7323645678807962,2022-11-30 04:47:11.359289,2022-11-30 04:47:36.039607,0 days 00:00:24.680318,"{0: 1, 1: 10}",6.0,,810,COMPLETE
2081,2081,0.7331579994010051,2022-11-30 04:47:36.281130,2022-11-30 04:47:59.897757,0 days 00:00:23.616627,"{0: 1, 1: 10}",6.0,,760,COMPLETE
2082,2082,0.7136164817263014,2022-11-30 04:48:00.137907,2022-11-30 04:48:23.069227,0 days 00:00:22.931320,"{0: 1, 1: 10}",22.0,,710,COMPLETE
2083,2083,0.733578137716841,2022-11-30 04:48:23.301551,2022-11-30 04:48:46.813274,0 days 00:00:23.511723,"{0: 1, 1: 10}",6.0,,760,COMPLETE
2084,2084,0.7347254803734641,2022-11-30 04:48:47.056390,2022-11-30 04:49:09.330208,0 days 00:00:22.273818,"{0: 1, 1: 10}",6.0,,710,COMPLETE
2085,2085,0.5291997119171579,2022-11-30 04:49:09.584895,2022-11-30 04:49:18.578765,0 days 00:00:08.993870,"{0: 1, 1: 10}",,log2,710,COMPLETE
2086,2086,0.7288284086747528,2022-11-30 04:49:18.819608,2022-11-30 04:49:38.392466,0 days 00:00:19.572858,"{0: 1, 1: 10}",6.0,0.8,710,COMPLETE
2087,2087,0.5919358408939803,2022-11-30 04:49:38.632869,2022-11-30 04:49:49.602614,0 days 00:00:10.969745,"{0: 1, 1: 10}",1.0,0.9,710,COMPLETE
2088,2088,0.7305332886867004,2022-11-30 04:49:49.851536,2022-11-30 04:50:12.353529,0 days 00:00:22.501993,"{0: 1, 1: 10}",6.0,,710,COMPLETE
2089,2089,0.7138901557582676,2022-11-30 04:50:12.585245,2022-11-30 04:50:35.342311,0 days 00:00:22.757066,"{0: 1, 1: 10}",23.0,,710,COMPLETE
2090,2090,0.7204768303831622,2022-11-30 04:50:35.579558,2022-11-30 04:50:58.450584,0 days 00:00:22.871026,"{0: 1, 1: 10}",9.0,,710,COMPLETE
2091,2091,0.7344049132325509,2022-11-30 04:50:58.683728,2022-11-30 04:51:20.926341,0 days 00:00:22.242613,"{0: 1, 1: 10}",6.0,,710,COMPLETE
2092,2092,0.7333728508248789,2022-11-30 04:51:21.161126,2022-11-30 04:51:43.728431,0 days 00:00:22.567305,"{0: 1, 1: 10}",6.0,,710,COMPLETE
2093,2093,0.7311942861427894,2022-11-30 04:51:43.970253,2022-11-30 04:52:06.386421,0 days 00:00:22.416168,"{0: 1, 1: 10}",6.0,,710,COMPLETE
2094,2094,0.7126661303720184,2022-11-30 04:52:06.629987,2022-11-30 04:52:25.496833,0 days 00:00:18.866846,"{0: 1, 1: 10}",3.0,,760,COMPLETE
2095,2095,0.7109527351330771,2022-11-30 04:52:25.738794,2022-11-30 04:52:48.479271,0 days 00:00:22.740477,"{0: 1, 1: 10}",33.0,,710,COMPLETE
2096,2096,0.7305329767901559,2022-11-30 04:52:48.719182,2022-11-30 04:53:12.383310,0 days 00:00:23.664128,"{0: 1, 1: 10}",6.0,,760,COMPLETE
2097,2097,0.7201539815472647,2022-11-30 04:53:12.624691,2022-11-30 04:53:35.566429,0 days 00:00:22.941738,"{0: 1, 1: 10}",34.0,,710,COMPLETE
2098,2098,0.7102672344483232,2022-11-30 04:53:35.811790,2022-11-30 04:53:53.751339,0 days 00:00:17.939549,"{0: 1, 1: 10}",26.0,0.6,760,COMPLETE
2099,2099,0.7339541594256029,2022-11-30 04:53:53.984594,2022-11-30 04:54:16.381481,0 days 00:00:22.396887,"{0: 1, 1: 10}",6.0,,710,COMPLETE
2100,2100,0.7189583774644229,2022-11-30 04:54:16.614357,2022-11-30 04:54:40.740847,0 days 00:00:24.126490,"{0: 1, 1: 10}",10.0,,760,COMPLETE
2101,2101,0.7327987343590865,2022-11-30 04:54:40.985751,2022-11-30 04:55:06.787684,0 days 00:00:25.801933,"{0: 1, 1: 10}",6.0,,860,COMPLETE
2102,2102,0.7167098815279798,2022-11-30 04:55:07.034052,2022-11-30 04:55:29.941899,0 days 00:00:22.907847,"{0: 1, 1: 10}",25.0,,710,COMPLETE
2103,2103,0.7336739080675024,2022-11-30 04:55:30.182526,2022-11-30 04:55:53.864226,0 days 00:00:23.681700,"{0: 1, 1: 10}",6.0,,760,COMPLETE
2104,2104,0.7153839745425378,2022-11-30 04:55:54.114256,2022-11-30 04:56:17.033425,0 days 00:00:22.919169,"{0: 1, 1: 10}",31.0,,710,COMPLETE
2105,2105,0.7145111735775747,2022-11-30 04:56:17.277722,2022-11-30 04:56:42.688305,0 days 00:00:25.410583,"{0: 1, 1: 10}",37.0,1.0,810,COMPLETE
2106,2106,0.7137981018406919,2022-11-30 04:56:42.920455,2022-11-30 04:57:05.882678,0 days 00:00:22.962223,"{0: 1, 1: 10}",36.0,,710,COMPLETE
2107,2107,0.7321358705537582,2022-11-30 04:57:06.123441,2022-11-30 04:57:29.647188,0 days 00:00:23.523747,"{0: 1, 1: 10}",6.0,,760,COMPLETE
2108,2108,0.7146348948749313,2022-11-30 04:57:29.883087,2022-11-30 04:57:53.947834,0 days 00:00:24.064747,"{0: 1, 1: 10}",27.0,,760,COMPLETE
2109,2109,0.7330570846273355,2022-11-30 04:57:54.198076,2022-11-30 04:58:16.703875,0 days 00:00:22.505799,"{0: 1, 1: 10}",6.0,,710,COMPLETE
2110,2110,0.7146404056088865,2022-11-30 04:58:16.949184,2022-11-30 04:58:41.133346,0 days 00:00:24.184162,"{0: 1, 1: 10}",16.0,,760,COMPLETE
2111,2111,0.6292866635190422,2022-11-30 04:58:41.384568,2022-11-30 04:58:51.881876,0 days 00:00:10.497308,"{0: 1, 1: 10}",6.0,log2,810,COMPLETE
2112,2112,0.731749592502854,2022-11-30 04:58:52.140291,2022-11-30 04:59:15.610623,0 days 00:00:23.470332,"{0: 1, 1: 10}",6.0,,760,COMPLETE
2113,2113,0.7328336571052662,2022-11-30 04:59:15.852036,2022-11-30 04:59:38.242840,0 days 00:00:22.390804,"{0: 1, 1: 10}",6.0,,710,COMPLETE
2114,2114,0.7164402876174917,2022-11-30 04:59:38.490073,2022-11-30 05:00:01.559329,0 days 00:00:23.069256,"{0: 1, 1: 10}",18.0,,710,COMPLETE
2115,2115,0.7182521198339762,2022-11-30 05:00:01.802199,2022-11-30 05:00:27.042725,0 days 00:00:25.240526,"{0: 1, 1: 10}",30.0,,810,COMPLETE
2116,2116,0.7153028986480339,2022-11-30 05:00:27.281438,2022-11-30 05:00:48.434590,0 days 00:00:21.153152,"{0: 1, 1: 10}",38.0,0.8,760,COMPLETE
2117,2117,0.7248486587558738,2022-11-30 05:00:48.682903,2022-11-30 05:01:06.966768,0 days 00:00:18.283865,"{0: 1, 1: 10}",6.0,0.7,710,COMPLETE
2118,2118,0.7168981691150446,2022-11-30 05:01:07.215569,2022-11-30 05:01:31.744615,0 days 00:00:24.529046,"{0: 1, 1: 10}",24.0,,760,COMPLETE
2119,2119,0.7133114637218915,2022-11-30 05:01:31.963180,2022-11-30 05:01:52.413578,0 days 00:00:20.450398,"{0: 1, 1: 10}",35.0,0.9,660,COMPLETE
2120,2120,0.7136892488598471,2022-11-30 05:01:52.651768,2022-11-30 05:02:15.492529,0 days 00:00:22.840761,"{0: 1, 1: 10}",17.0,,710,COMPLETE
2121,2121,0.7181627375315047,2022-11-30 05:02:15.734430,2022-11-30 05:02:41.087128,0 days 00:00:25.352698,"{0: 1, 1: 10}",14.0,,810,COMPLETE
2122,2122,0.7330911752994864,2022-11-30 05:02:41.327968,2022-11-30 05:03:02.573383,0 days 00:00:21.245415,"{0: 1, 1: 10}",6.0,,660,COMPLETE
2123,2123,0.629610383101904,2022-11-30 05:03:02.814082,2022-11-30 05:03:12.230866,0 days 00:00:09.416784,"{0: 1, 1: 10}",21.0,sqrt,760,COMPLETE
2124,2124,0.7337121192294559,2022-11-30 05:03:12.477929,2022-11-30 05:03:34.762755,0 days 00:00:22.284826,"{0: 1, 1: 10}",6.0,,710,COMPLETE
2125,2125,0.7160021477678331,2022-11-30 05:03:35.017088,2022-11-30 05:03:59.155783,0 days 00:00:24.138695,"{0: 1, 1: 10}",39.0,,760,COMPLETE
2126,2126,0.7146472852523351,2022-11-30 05:03:59.387512,2022-11-30 05:04:21.189637,0 days 00:00:21.802125,"{0: 1, 1: 10}",11.0,,660,COMPLETE
2127,2127,0.730819380358797,2022-11-30 05:04:21.432933,2022-11-30 05:04:43.683949,0 days 00:00:22.251016,"{0: 1, 1: 10}",6.0,,710,COMPLETE
2128,2128,0.6998632091050412,2022-11-30 05:04:43.925341,2022-11-30 05:04:58.610358,0 days 00:00:14.685017,"{0: 1, 1: 10}",4.0,0.6,660,COMPLETE
2129,2129,0.7327770210391058,2022-11-30 05:04:58.860038,2022-11-30 05:05:22.566912,0 days 00:00:23.706874,"{0: 1, 1: 10}",6.0,,760,COMPLETE
2130,2130,0.7162854318018254,2022-11-30 05:05:22.810160,2022-11-30 05:05:45.794476,0 days 00:00:22.984316,"{0: 1, 1: 10}",32.0,,710,COMPLETE
2131,2131,0.6804415454962578,2022-11-30 05:05:46.026108,2022-11-30 05:06:00.373333,0 days 00:00:14.347225,"{0: 1, 1: 10}",2.0,,660,COMPLETE
2132,2132,0.7166952983583748,2022-11-30 05:06:00.617922,2022-11-30 05:06:27.249078,0 days 00:00:26.631156,"{0: 1, 1: 10}",28.0,,860,COMPLETE
2133,2133,0.7163196568621084,2022-11-30 05:06:27.483322,2022-11-30 05:06:51.498971,0 days 00:00:24.015649,"{0: 1, 1: 10}",19.0,,760,COMPLETE
2134,2134,0.7239092953500561,2022-11-30 05:06:51.743335,2022-11-30 05:07:16.978595,0 days 00:00:25.235260,"{0: 1, 1: 10}",8.0,,810,COMPLETE
2135,2135,0.7297980545627486,2022-11-30 05:07:17.219457,2022-11-30 05:07:39.683526,0 days 00:00:22.464069,"{0: 1, 1: 10}",6.0,,710,COMPLETE
2136,2136,0.733878042134185,2022-11-30 05:07:39.930122,2022-11-30 05:08:01.244252,0 days 00:00:21.314130,"{0: 1, 1: 10}",6.0,1.0,660,COMPLETE
2137,2137,0.7279728883539205,2022-11-30 05:08:01.491733,2022-11-30 05:08:25.377937,0 days 00:00:23.886204,"{0: 1, 1: 10}",7.0,,760,COMPLETE
2138,2138,0.7169112389955121,2022-11-30 05:08:25.621708,2022-11-30 05:08:51.084220,0 days 00:00:25.462512,"{0: 1, 1: 10}",13.0,,810,COMPLETE
2139,2139,0.7164370705113621,2022-11-30 05:08:51.316422,2022-11-30 05:09:12.848405,0 days 00:00:21.531983,"{0: 1, 1: 10}",29.0,,660,COMPLETE
2140,2140,0.7165543395864216,2022-11-30 05:09:13.095073,2022-11-30 05:09:35.949580,0 days 00:00:22.854507,"{0: 1, 1: 10}",12.0,,710,COMPLETE
2141,2141,0.7145528895972386,2022-11-30 05:09:36.191577,2022-11-30 05:09:59.086554,0 days 00:00:22.894977,"{0: 1, 1: 10}",15.0,,710,COMPLETE
2142,2142,0.7327893575346652,2022-11-30 05:09:59.321667,2022-11-30 05:10:22.963465,0 days 00:00:23.641798,"{0: 1, 1: 10}",6.0,,760,COMPLETE
2143,2143,0.6173780853908457,2022-11-30 05:10:23.198893,2022-11-30 05:10:32.846639,0 days 00:00:09.647746,"{0: 1, 1: 10}",6.0,log2,660,COMPLETE
2144,2144,0.7310009165878018,2022-11-30 05:10:33.086998,2022-11-30 05:10:55.388755,0 days 00:00:22.301757,"{0: 1, 1: 10}",6.0,,710,COMPLETE
2145,2145,0.7303550497802505,2022-11-30 05:10:55.632852,2022-11-30 05:11:16.192179,0 days 00:00:20.559327,"{0: 1, 1: 10}",6.0,0.8,760,COMPLETE
2146,2146,0.716864942877985,2022-11-30 05:11:16.436876,2022-11-30 05:11:40.139609,0 days 00:00:23.702733,"{0: 1, 1: 10}",,0.9,810,COMPLETE
2147,2147,0.7194518568179274,2022-11-30 05:11:40.377960,2022-11-30 05:12:02.087745,0 days 00:00:21.709785,"{0: 1, 1: 10}",22.0,,660,COMPLETE
2148,2148,0.7328886186646435,2022-11-30 05:12:02.322698,2022-11-30 05:12:24.690933,0 days 00:00:22.368235,"{0: 1, 1: 10}",6.0,,710,COMPLETE
2149,2149,0.7122360618369564,2022-11-30 05:12:24.925118,2022-11-30 05:12:44.302017,0 days 00:00:19.376899,"{0: 1, 1: 10}",20.0,0.7,760,COMPLETE
2150,2150,0.7125029932982512,2022-11-30 05:12:44.536473,2022-11-30 05:13:06.232967,0 days 00:00:21.696494,"{0: 1, 1: 10}",23.0,,660,COMPLETE
2151,2151,0.731216066702451,2022-11-30 05:13:06.478977,2022-11-30 05:13:27.594134,0 days 00:00:21.115157,"{0: 1, 1: 10}",6.0,,660,COMPLETE
2152,2152,0.6611324621711345,2022-11-30 05:13:27.836587,2022-11-30 05:13:36.511670,0 days 00:00:08.675083,"{0: 1, 1: 10}",6.0,sqrt,710,COMPLETE
2153,2153,0.5805249696246836,2022-11-30 05:13:36.757201,2022-11-30 05:13:48.556300,0 days 00:00:11.799099,"{0: 1, 1: 10}",1.0,,760,COMPLETE
2154,2154,0.7331191341130501,2022-11-30 05:13:48.788578,2022-11-30 05:14:12.421514,0 days 00:00:23.632936,"{0: 1, 1: 10}",6.0,,760,COMPLETE
2155,2155,0.7240381450950568,2022-11-30 05:14:12.666042,2022-11-30 05:14:39.049448,0 days 00:00:26.383406,"{0: 1, 1: 10}",9.0,,860,COMPLETE
2156,2156,0.7324696248211426,2022-11-30 05:14:39.284585,2022-11-30 05:15:03.872945,0 days 00:00:24.588360,"{0: 1, 1: 10}",6.0,,810,COMPLETE
2157,2157,0.7105100680267589,2022-11-30 05:15:04.115100,2022-11-30 05:15:27.142819,0 days 00:00:23.027719,"{0: 1, 1: 10}",33.0,,710,COMPLETE
2158,2158,0.7062606688086774,2022-11-30 05:15:27.386588,2022-11-30 05:15:43.812557,0 days 00:00:16.425969,"{0: 1, 1: 10}",26.0,0.6,660,COMPLETE
2159,2159,0.7154229069771193,2022-11-30 05:15:44.058165,2022-11-30 05:16:06.982947,0 days 00:00:22.924782,"{0: 1, 1: 10}",27.0,,710,COMPLETE
2160,2160,0.7117590834562184,2022-11-30 05:16:07.225078,2022-11-30 05:16:26.063842,0 days 00:00:18.838764,"{0: 1, 1: 10}",3.0,,760,COMPLETE
2161,2161,0.7344028770076249,2022-11-30 05:16:26.307828,2022-11-30 05:16:47.454889,0 days 00:00:21.147061,"{0: 1, 1: 10}",6.0,,660,COMPLETE
2162,2162,0.7158356423302814,2022-11-30 05:16:47.694139,2022-11-30 05:17:12.940196,0 days 00:00:25.246057,"{0: 1, 1: 10}",34.0,,810,COMPLETE
2163,2163,0.7145424464380389,2022-11-30 05:17:13.182942,2022-11-30 05:17:34.968297,0 days 00:00:21.785355,"{0: 1, 1: 10}",10.0,,660,COMPLETE
2164,2164,0.7327177635258317,2022-11-30 05:17:35.212581,2022-11-30 05:17:58.749356,0 days 00:00:23.536775,"{0: 1, 1: 10}",6.0,,760,COMPLETE
2165,2165,0.7171028980136882,2022-11-30 05:17:58.989033,2022-11-30 05:18:21.886911,0 days 00:00:22.897878,"{0: 1, 1: 10}",36.0,,710,COMPLETE
2166,2166,0.7333891823491098,2022-11-30 05:18:22.128723,2022-11-30 05:18:44.617759,0 days 00:00:22.489036,"{0: 1, 1: 10}",6.0,1.0,710,COMPLETE
2167,2167,0.7182862445827032,2022-11-30 05:18:44.861184,2022-11-30 05:19:08.936603,0 days 00:00:24.075419,"{0: 1, 1: 10}",25.0,,760,COMPLETE
2168,2168,0.7162983626355459,2022-11-30 05:19:09.172817,2022-11-30 05:19:30.755484,0 days 00:00:21.582667,"{0: 1, 1: 10}",31.0,,660,COMPLETE
2169,2169,0.7336762665575518,2022-11-30 05:19:30.994837,2022-11-30 05:19:53.539028,0 days 00:00:22.544191,"{0: 1, 1: 10}",6.0,,710,COMPLETE
2170,2170,0.7304068238349307,2022-11-30 05:19:53.778534,2022-11-30 05:20:15.082339,0 days 00:00:21.303805,"{0: 1, 1: 10}",6.0,,660,COMPLETE
2171,2171,0.7125042726471942,2022-11-30 05:20:15.324642,2022-11-30 05:20:39.537887,0 days 00:00:24.213245,"{0: 1, 1: 10}",37.0,,760,COMPLETE
2172,2172,0.5869091999308116,2022-11-30 05:20:39.779586,2022-11-30 05:20:48.352821,0 days 00:00:08.573235,"{0: 1, 1: 10}",16.0,log2,660,COMPLETE
2173,2173,0.7332997014925712,2022-11-30 05:20:48.597644,2022-11-30 05:21:12.108822,0 days 00:00:23.511178,"{0: 1, 1: 10}",6.0,,760,COMPLETE
2174,2174,0.7333738816998482,2022-11-30 05:21:12.351143,2022-11-30 05:21:37.196056,0 days 00:00:24.844913,"{0: 1, 1: 10}",6.0,,810,COMPLETE
2175,2175,0.714860325777788,2022-11-30 05:21:37.435939,2022-11-30 05:22:00.449729,0 days 00:00:23.013790,"{0: 1, 1: 10}",11.0,,710,COMPLETE
2176,2176,0.7134587752230186,2022-11-30 05:22:00.692130,2022-11-30 05:22:19.822559,0 days 00:00:19.130429,"{0: 1, 1: 10}",35.0,0.8,660,COMPLETE
2177,2177,0.7114341251331593,2022-11-30 05:22:20.056038,2022-11-30 05:22:41.645648,0 days 00:00:21.589610,"{0: 1, 1: 10}",18.0,0.9,710,COMPLETE
2178,2178,0.7338996165465442,2022-11-30 05:22:41.887052,2022-11-30 05:23:04.247579,0 days 00:00:22.360527,"{0: 1, 1: 10}",6.0,,710,COMPLETE
2179,2179,0.7093549199317017,2022-11-30 05:23:04.481370,2022-11-30 05:23:24.106193,0 days 00:00:19.624823,"{0: 1, 1: 10}",17.0,0.7,760,COMPLETE
2180,2180,0.7347255461481653,2022-11-30 05:23:24.350281,2022-11-30 05:23:48.960058,0 days 00:00:24.609777,"{0: 1, 1: 10}",6.0,,810,COMPLETE
2181,2181,0.7175029479358002,2022-11-30 05:23:49.204875,2022-11-30 05:24:12.416568,0 days 00:00:23.211693,"{0: 1, 1: 10}",4.0,,860,COMPLETE
2182,2182,0.7345583426351177,2022-11-30 05:24:12.666580,2022-11-30 05:24:37.395835,0 days 00:00:24.729255,"{0: 1, 1: 10}",6.0,,810,COMPLETE
2183,2183,0.7155500011444514,2022-11-30 05:24:37.636622,2022-11-30 05:25:04.000074,0 days 00:00:26.363452,"{0: 1, 1: 10}",38.0,,860,COMPLETE
2184,2184,0.6634021758054195,2022-11-30 05:25:04.244615,2022-11-30 05:25:13.155085,0 days 00:00:08.910470,"{0: 1, 1: 10}",6.0,sqrt,760,COMPLETE
2185,2185,0.7160129381779029,2022-11-30 05:25:13.397814,2022-11-30 05:25:38.795943,0 days 00:00:25.398129,"{0: 1, 1: 10}",39.0,,810,COMPLETE
2186,2186,0.7137775959627464,2022-11-30 05:25:39.037866,2022-11-30 05:26:04.571528,0 days 00:00:25.533662,"{0: 1, 1: 10}",14.0,,810,COMPLETE
2187,2187,0.7325082715015979,2022-11-30 05:26:04.812057,2022-11-30 05:26:29.679790,0 days 00:00:24.867733,"{0: 1, 1: 10}",6.0,,810,COMPLETE
2188,2188,0.7115641357712141,2022-11-30 05:26:29.928743,2022-11-30 05:26:55.450261,0 days 00:00:25.521518,"{0: 1, 1: 10}",21.0,,810,COMPLETE
2189,2189,0.7193098706985295,2022-11-30 05:26:55.692465,2022-11-30 05:27:22.206774,0 days 00:00:26.514309,"{0: 1, 1: 10}",24.0,,860,COMPLETE
2190,2190,0.7055503261648929,2022-11-30 05:27:22.440396,2022-11-30 05:27:41.919282,0 days 00:00:19.478886,"{0: 1, 1: 10}",19.0,0.6,860,COMPLETE
2191,2191,0.7348574105339304,2022-11-30 05:27:42.163491,2022-11-30 05:28:06.894793,0 days 00:00:24.731302,"{0: 1, 1: 10}",6.0,,810,COMPLETE
2192,2192,0.717435388888064,2022-11-30 05:28:07.137440,2022-11-30 05:28:33.921570,0 days 00:00:26.784130,"{0: 1, 1: 10}",30.0,,860,COMPLETE
2193,2193,0.7151998152007859,2022-11-30 05:28:34.158679,2022-11-30 05:29:00.797152,0 days 00:00:26.638473,"{0: 1, 1: 10}",32.0,,860,COMPLETE
2194,2194,0.7232116881602264,2022-11-30 05:29:01.037696,2022-11-30 05:29:27.268593,0 days 00:00:26.230897,"{0: 1, 1: 10}",8.0,,860,COMPLETE
2195,2195,0.7315474375717541,2022-11-30 05:29:27.509543,2022-11-30 05:29:52.148283,0 days 00:00:24.638740,"{0: 1, 1: 10}",6.0,1.0,810,COMPLETE
2196,2196,0.6769651768420193,2022-11-30 05:29:52.390245,2022-11-30 05:30:08.774311,0 days 00:00:16.384066,"{0: 1, 1: 10}",2.0,,810,COMPLETE
2197,2197,0.7150089486737922,2022-11-30 05:30:09.005787,2022-11-30 05:30:34.324016,0 days 00:00:25.318229,"{0: 1, 1: 10}",13.0,,810,COMPLETE
2198,2198,0.7331345881641668,2022-11-30 05:30:34.561003,2022-11-30 05:30:59.323399,0 days 00:00:24.762396,"{0: 1, 1: 10}",6.0,,810,COMPLETE
2199,2199,0.7334632549180472,2022-11-30 05:30:59.579622,2022-11-30 05:31:25.645280,0 days 00:00:26.065658,"{0: 1, 1: 10}",6.0,,860,COMPLETE
2200,2200,0.7315580889031414,2022-11-30 05:31:25.889468,2022-11-30 05:31:50.969695,0 days 00:00:25.080227,"{0: 1, 1: 10}",7.0,,810,COMPLETE
2201,2201,0.7119624712441777,2022-11-30 05:31:51.204698,2022-11-30 05:32:17.710743,0 days 00:00:26.506045,"{0: 1, 1: 10}",15.0,,860,COMPLETE
2202,2202,0.5431623072280295,2022-11-30 05:32:17.947902,2022-11-30 05:32:27.233143,0 days 00:00:09.285241,"{0: 1, 1: 10}",28.0,log2,810,COMPLETE
2203,2203,0.7169958160991476,2022-11-30 05:32:27.466299,2022-11-30 05:32:52.779870,0 days 00:00:25.313571,"{0: 1, 1: 10}",29.0,,810,COMPLETE
