,number,value,datetime_start,datetime_complete,duration,params_class_weight,params_max_depth,params_max_features,params_n_estimators,state
321,321,0.5376038903486366,2022-11-29 20:06:07.603379,2022-11-29 20:06:16.638336,0 days 00:00:09.034957,"{0: 1, 1: 10}",33.0,log2,760,COMPLETE
322,322,0.6658011616377826,2022-11-29 20:06:16.821099,2022-11-29 20:06:30.026638,0 days 00:00:13.205539,balanced,37.0,0.6,510,COMPLETE
323,323,0.6935394805436782,2022-11-29 20:06:30.194799,2022-11-29 20:06:37.277325,0 days 00:00:07.082526,"{0: 1, 1: 10}",10.0,0.9,60,COMPLETE
324,324,0.6479073450837278,2022-11-29 20:06:37.464271,2022-11-29 20:06:44.506991,0 days 00:00:07.042720,balanced,39.0,sqrt,110,COMPLETE
325,325,0.6536318039323299,2022-11-29 20:06:44.709756,2022-11-29 20:07:01.403001,0 days 00:00:16.693245,balanced,35.0,1.0,510,COMPLETE
326,326,0.70993916693706,2022-11-29 20:07:01.570129,2022-11-29 20:07:22.363150,0 days 00:00:20.793021,"{0: 1, 1: 10}",38.0,0.8,710,COMPLETE
327,327,0.6720355083113779,2022-11-29 20:07:22.545217,2022-11-29 20:07:37.444064,0 days 00:00:14.898847,,,0.6,360,COMPLETE
328,328,0.7104642477557848,2022-11-29 20:07:37.622861,2022-11-29 20:07:57.702991,0 days 00:00:20.080130,"{0: 1, 1: 10}",29.0,0.6,860,COMPLETE
329,329,0.6949171029134942,2022-11-29 20:07:57.881468,2022-11-29 20:08:14.678206,0 days 00:00:16.796738,,4.0,1.0,460,COMPLETE
330,330,0.6745129411353507,2022-11-29 20:08:14.863630,2022-11-29 20:08:21.785383,0 days 00:00:06.921753,"{0: 1, 1: 10}",19.0,0.8,10,COMPLETE
331,331,0.6484592785573832,2022-11-29 20:08:22.005164,2022-11-29 20:08:36.838201,0 days 00:00:14.833037,balanced,12.0,0.9,460,COMPLETE
332,332,0.6720805261291544,2022-11-29 20:08:37.013536,2022-11-29 20:08:47.887848,0 days 00:00:10.874312,,17.0,0.6,210,COMPLETE
333,333,0.6749211446269273,2022-11-29 20:08:48.066129,2022-11-29 20:09:21.217103,0 days 00:00:33.150974,,14.0,0.9,760,COMPLETE
334,334,0.6468439712005971,2022-11-29 20:09:21.405935,2022-11-29 20:09:35.399841,0 days 00:00:13.993906,balanced,11.0,0.8,460,COMPLETE
335,335,0.6247912506193857,2022-11-29 20:09:35.586311,2022-11-29 20:09:44.458593,0 days 00:00:08.872282,"{0: 1, 1: 100}",11.0,0.6,260,COMPLETE
336,336,0.6701292953685625,2022-11-29 20:09:44.657018,2022-11-29 20:09:52.680143,0 days 00:00:08.023125,"{0: 1, 1: 100}",25.0,sqrt,510,COMPLETE
337,337,0.5795403428430012,2022-11-29 20:09:52.858715,2022-11-29 20:09:59.754603,0 days 00:00:06.895888,"{0: 1, 1: 100}",6.0,,60,COMPLETE
338,338,0.7221768575322632,2022-11-29 20:09:59.930988,2022-11-29 20:10:14.684127,0 days 00:00:14.753139,"{0: 1, 1: 10}",10.0,1.0,360,COMPLETE
339,339,0.6040726614603661,2022-11-29 20:10:14.855801,2022-11-29 20:10:24.679469,0 days 00:00:09.823668,balanced,3.0,log2,910,COMPLETE
340,340,0.5255014903261319,2022-11-29 20:10:24.854154,2022-11-29 20:10:33.187190,0 days 00:00:08.333036,"{0: 1, 1: 10}",39.0,log2,610,COMPLETE
341,341,0.5971938124770737,2022-11-29 20:10:33.360991,2022-11-29 20:10:42.339495,0 days 00:00:08.978504,,7.0,log2,710,COMPLETE
342,342,0.5923929514375514,2022-11-29 20:10:42.530294,2022-11-29 20:10:49.407179,0 days 00:00:06.876885,"{0: 1, 1: 100}",10.0,,10,COMPLETE
343,343,0.6507357052810921,2022-11-29 20:10:49.580703,2022-11-29 20:11:07.011210,0 days 00:00:17.430507,"{0: 1, 1: 100}",22.0,0.8,760,COMPLETE
344,344,0.669012773507706,2022-11-29 20:11:07.173041,2022-11-29 20:11:14.095412,0 days 00:00:06.922371,balanced,3.0,,10,COMPLETE
345,345,0.6131902722654351,2022-11-29 20:11:14.266300,2022-11-29 20:11:22.107549,0 days 00:00:07.841249,"{0: 1, 1: 100}",36.0,log2,510,COMPLETE
346,346,0.5942897286721591,2022-11-29 20:11:22.269102,2022-11-29 20:11:31.030870,0 days 00:00:08.761768,"{0: 1, 1: 100}",4.0,,210,COMPLETE
347,347,0.6226991668636053,2022-11-29 20:11:31.210328,2022-11-29 20:11:39.083301,0 days 00:00:07.872973,,4.0,sqrt,510,COMPLETE
348,348,0.6593347607150475,2022-11-29 20:11:39.258001,2022-11-29 20:11:51.721704,0 days 00:00:12.463703,balanced,27.0,0.7,410,COMPLETE
349,349,0.6033147750369845,2022-11-29 20:11:51.900641,2022-11-29 20:12:00.822489,0 days 00:00:08.921848,"{0: 1, 1: 100}",5.0,0.7,260,COMPLETE
350,350,0.6746455708567269,2022-11-29 20:12:01.005551,2022-11-29 20:12:42.592787,0 days 00:00:41.587236,,28.0,,910,COMPLETE
351,351,0.6127375618773725,2022-11-29 20:12:42.762903,2022-11-29 20:12:49.835317,0 days 00:00:07.072414,"{0: 1, 1: 10}",24.0,sqrt,260,COMPLETE
352,352,0.6697500483434201,2022-11-29 20:12:50.022428,2022-11-29 20:12:56.879189,0 days 00:00:06.856761,"{0: 1, 1: 10}",12.0,0.9,10,COMPLETE
353,353,0.638823085054854,2022-11-29 20:12:57.066913,2022-11-29 20:13:11.907352,0 days 00:00:14.840439,"{0: 1, 1: 100}",17.0,0.7,660,COMPLETE
354,354,0.5699536843980904,2022-11-29 20:13:12.118695,2022-11-29 20:13:18.997493,0 days 00:00:06.878798,"{0: 1, 1: 100}",8.0,0.9,10,COMPLETE
355,355,0.646645925439629,2022-11-29 20:13:19.184745,2022-11-29 20:13:35.617419,0 days 00:00:16.432674,"{0: 1, 1: 100}",27.0,0.7,760,COMPLETE
356,356,0.6542018804173434,2022-11-29 20:13:35.800168,2022-11-29 20:13:54.558617,0 days 00:00:18.758449,balanced,15.0,1.0,610,COMPLETE
357,357,0.6297083492634654,2022-11-29 20:13:54.756336,2022-11-29 20:14:04.153044,0 days 00:00:09.396708,,1.0,0.7,560,COMPLETE
358,358,0.7182736949802958,2022-11-29 20:14:04.326804,2022-11-29 20:14:29.415087,0 days 00:00:25.088283,"{0: 1, 1: 10}",39.0,1.0,760,COMPLETE
359,359,0.6655614622264403,2022-11-29 20:14:29.596663,2022-11-29 20:14:37.503272,0 days 00:00:07.906609,"{0: 1, 1: 10}",4.0,sqrt,510,COMPLETE
360,360,0.6009120154153522,2022-11-29 20:14:37.677765,2022-11-29 20:14:47.921502,0 days 00:00:10.243737,"{0: 1, 1: 100}",4.0,0.8,360,COMPLETE
361,361,0.6085925049114785,2022-11-29 20:14:48.114019,2022-11-29 20:14:56.499666,0 days 00:00:08.385647,balanced,4.0,log2,460,COMPLETE
362,362,0.5742382058492732,2022-11-29 20:14:56.685998,2022-11-29 20:15:05.913553,0 days 00:00:09.227555,,14.0,log2,810,COMPLETE
363,363,0.6975560320933704,2022-11-29 20:15:06.095036,2022-11-29 20:15:25.615113,0 days 00:00:19.520077,"{0: 1, 1: 10}",3.0,0.8,910,COMPLETE
364,364,0.6661827227620097,2022-11-29 20:15:25.789043,2022-11-29 20:15:32.763933,0 days 00:00:06.974890,"{0: 1, 1: 100}",26.0,sqrt,260,COMPLETE
365,365,0.7158056392286773,2022-11-29 20:15:32.939660,2022-11-29 20:15:42.491292,0 days 00:00:09.551632,"{0: 1, 1: 10}",30.0,1.0,160,COMPLETE
366,366,0.6737253092931879,2022-11-29 20:15:42.676915,2022-11-29 20:16:09.963408,0 days 00:00:27.286493,,26.0,0.8,660,COMPLETE
367,367,0.7323989901701862,2022-11-29 20:16:10.137140,2022-11-29 20:16:28.478046,0 days 00:00:18.340906,"{0: 1, 1: 10}",6.0,1.0,510,COMPLETE
368,368,0.6537023513545581,2022-11-29 20:16:28.658681,2022-11-29 20:16:47.465204,0 days 00:00:18.806523,balanced,39.0,,610,COMPLETE
369,369,0.5801041594094487,2022-11-29 20:16:47.642618,2022-11-29 20:16:55.781361,0 days 00:00:08.138743,"{0: 1, 1: 10}",18.0,log2,510,COMPLETE
370,370,0.6424469462577418,2022-11-29 20:16:55.985853,2022-11-29 20:17:13.761681,0 days 00:00:17.775828,"{0: 1, 1: 100}",20.0,0.7,860,COMPLETE
371,371,0.6749963373499398,2022-11-29 20:17:13.958181,2022-11-29 20:17:45.700874,0 days 00:00:31.742693,,29.0,,660,COMPLETE
372,372,0.64725665405232,2022-11-29 20:17:45.924778,2022-11-29 20:18:05.995378,0 days 00:00:20.070600,"{0: 1, 1: 100}",37.0,0.8,910,COMPLETE
373,373,0.6487942786030644,2022-11-29 20:18:06.182418,2022-11-29 20:18:13.113326,0 days 00:00:06.930908,"{0: 1, 1: 10}",7.0,sqrt,60,COMPLETE
374,374,0.6414578570186814,2022-11-29 20:18:13.289226,2022-11-29 20:18:34.745539,0 days 00:00:21.456313,"{0: 1, 1: 100}",30.0,1.0,860,COMPLETE
375,375,0.6757595985317046,2022-11-29 20:18:34.914742,2022-11-29 20:19:07.222986,0 days 00:00:32.308244,,18.0,0.7,910,COMPLETE
376,376,0.666057493484001,2022-11-29 20:19:07.376949,2022-11-29 20:19:15.165321,0 days 00:00:07.788372,"{0: 1, 1: 100}",19.0,sqrt,460,COMPLETE
377,377,0.7122243370569007,2022-11-29 20:19:15.347937,2022-11-29 20:19:36.398272,0 days 00:00:21.050335,"{0: 1, 1: 10}",15.0,1.0,610,COMPLETE
378,378,0.6566191634075139,2022-11-29 20:19:36.570216,2022-11-29 20:19:43.449270,0 days 00:00:06.879054,balanced,33.0,0.7,60,COMPLETE
379,379,0.6295929867419537,2022-11-29 20:19:43.619425,2022-11-29 20:19:52.721423,0 days 00:00:09.101998,"{0: 1, 1: 100}",8.0,sqrt,910,COMPLETE
380,380,0.5885187339627951,2022-11-29 20:19:52.896533,2022-11-29 20:20:01.856571,0 days 00:00:08.960038,,31.0,sqrt,660,COMPLETE
381,381,0.6478664836016343,2022-11-29 20:20:02.054462,2022-11-29 20:20:21.347187,0 days 00:00:19.292725,"{0: 1, 1: 100}",24.0,0.9,810,COMPLETE
382,382,0.658659297840549,2022-11-29 20:20:21.520809,2022-11-29 20:20:28.297259,0 days 00:00:06.776450,"{0: 1, 1: 10}",17.0,0.8,10,COMPLETE
383,383,0.6559701806139112,2022-11-29 20:20:28.478073,2022-11-29 20:20:48.411805,0 days 00:00:19.933732,balanced,,1.0,660,COMPLETE
384,384,0.6130748936657618,2022-11-29 20:20:48.590454,2022-11-29 20:20:58.243304,0 days 00:00:09.652850,"{0: 1, 1: 100}",39.0,log2,910,COMPLETE
385,385,0.6047717645014491,2022-11-29 20:20:58.423985,2022-11-29 20:21:08.522939,0 days 00:00:10.098954,"{0: 1, 1: 100}",4.0,0.6,410,COMPLETE
386,386,0.6821075396553827,2022-11-29 20:21:08.691745,2022-11-29 20:21:17.899933,0 days 00:00:09.208188,"{0: 1, 1: 10}",2.0,,260,COMPLETE
387,387,0.6667185362199133,2022-11-29 20:21:18.082256,2022-11-29 20:21:25.195258,0 days 00:00:07.113002,"{0: 1, 1: 100}",30.0,sqrt,260,COMPLETE
388,388,0.6332513435511828,2022-11-29 20:21:25.380963,2022-11-29 20:21:34.695884,0 days 00:00:09.314921,"{0: 1, 1: 10}",17.0,sqrt,810,COMPLETE
389,389,0.5584868904717034,2022-11-29 20:21:34.877877,2022-11-29 20:21:42.647560,0 days 00:00:07.769683,,18.0,log2,460,COMPLETE
390,390,0.7028316894635482,2022-11-29 20:21:42.825902,2022-11-29 20:21:49.760896,0 days 00:00:06.934994,"{0: 1, 1: 10}",12.0,0.7,60,COMPLETE
391,391,0.6339240625437179,2022-11-29 20:21:49.947503,2022-11-29 20:22:05.240800,0 days 00:00:15.293297,balanced,9.0,,460,COMPLETE
392,392,0.648106232114924,2022-11-29 20:22:05.412497,2022-11-29 20:22:19.757254,0 days 00:00:14.344757,balanced,16.0,,410,COMPLETE
393,393,0.6587656230598046,2022-11-29 20:22:19.936196,2022-11-29 20:22:27.518529,0 days 00:00:07.582333,"{0: 1, 1: 10}",5.0,sqrt,410,COMPLETE
394,394,0.6368727540947712,2022-11-29 20:22:27.698069,2022-11-29 20:22:34.615468,0 days 00:00:06.917399,balanced,22.0,0.8,10,COMPLETE
395,395,0.6881782228158084,2022-11-29 20:22:34.782054,2022-11-29 20:22:51.998107,0 days 00:00:17.216053,balanced,4.0,0.6,860,COMPLETE
396,396,0.6409967834496141,2022-11-29 20:22:52.168982,2022-11-29 20:23:13.360536,0 days 00:00:21.191554,"{0: 1, 1: 100}",,,860,COMPLETE
397,397,0.6683653906655528,2022-11-29 20:23:13.558993,2022-11-29 20:23:23.118460,0 days 00:00:09.559467,"{0: 1, 1: 100}",32.0,sqrt,860,COMPLETE
398,398,0.5739384634149248,2022-11-29 20:23:23.317180,2022-11-29 20:23:38.551708,0 days 00:00:15.234528,"{0: 1, 1: 100}",2.0,,810,COMPLETE
399,399,0.5983152960850534,2022-11-29 20:23:38.731478,2022-11-29 20:23:56.079478,0 days 00:00:17.348000,"{0: 1, 1: 100}",3.0,0.9,910,COMPLETE
400,400,0.5312759582300047,2022-11-29 20:23:56.263438,2022-11-29 20:24:03.151546,0 days 00:00:06.888108,,5.0,sqrt,10,COMPLETE
401,401,0.7161484339059554,2022-11-29 20:24:03.330350,2022-11-29 20:24:27.859655,0 days 00:00:24.529305,"{0: 1, 1: 10}",31.0,0.9,810,COMPLETE
402,402,0.6428719070049367,2022-11-29 20:24:28.034984,2022-11-29 20:24:47.442747,0 days 00:00:19.407763,"{0: 1, 1: 100}",24.0,1.0,760,COMPLETE
403,403,0.6572027504139698,2022-11-29 20:24:47.615910,2022-11-29 20:25:13.056977,0 days 00:00:25.441067,balanced,37.0,,910,COMPLETE
404,404,0.6367957122214263,2022-11-29 20:25:13.233727,2022-11-29 20:25:20.603717,0 days 00:00:07.369990,"{0: 1, 1: 100}",29.0,0.8,110,COMPLETE
405,405,0.6511762688967224,2022-11-29 20:25:20.780310,2022-11-29 20:25:27.632637,0 days 00:00:06.852327,balanced,16.0,sqrt,160,COMPLETE
406,406,0.6747170475593209,2022-11-29 20:25:27.835964,2022-11-29 20:25:57.387478,0 days 00:00:29.551514,,20.0,0.9,660,COMPLETE
407,407,0.7167110971467668,2022-11-29 20:25:57.574770,2022-11-29 20:26:22.182910,0 days 00:00:24.608140,"{0: 1, 1: 10}",29.0,0.9,810,COMPLETE
408,408,0.6173453679591323,2022-11-29 20:26:22.370200,2022-11-29 20:26:30.867531,0 days 00:00:08.497331,"{0: 1, 1: 100}",30.0,log2,660,COMPLETE
409,409,0.6507224500604909,2022-11-29 20:26:31.048209,2022-11-29 20:26:40.076319,0 days 00:00:09.028110,balanced,16.0,,160,COMPLETE
410,410,0.6201318050962343,2022-11-29 20:26:40.251367,2022-11-29 20:26:48.730379,0 days 00:00:08.479012,"{0: 1, 1: 100}",34.0,log2,660,COMPLETE
411,411,0.7083731886939854,2022-11-29 20:26:48.909627,2022-11-29 20:26:57.931121,0 days 00:00:09.021494,"{0: 1, 1: 10}",4.0,0.7,210,COMPLETE
412,412,0.6613566398763917,2022-11-29 20:26:58.108847,2022-11-29 20:27:05.489498,0 days 00:00:07.380651,"{0: 1, 1: 100}",17.0,sqrt,310,COMPLETE
413,413,0.664571402679944,2022-11-29 20:27:05.663385,2022-11-29 20:27:13.237424,0 days 00:00:07.574039,"{0: 1, 1: 100}",,sqrt,410,COMPLETE
414,414,0.6355852723410406,2022-11-29 20:27:13.416969,2022-11-29 20:27:32.620017,0 days 00:00:19.203048,balanced,9.0,0.8,760,COMPLETE
415,415,0.6260039618378954,2022-11-29 20:27:32.791608,2022-11-29 20:27:50.811593,0 days 00:00:18.019985,"{0: 1, 1: 100}",14.0,,710,COMPLETE
416,416,0.6002132763795773,2022-11-29 20:27:50.991450,2022-11-29 20:27:58.926717,0 days 00:00:07.935267,balanced,25.0,log2,510,COMPLETE
417,417,0.592526616886907,2022-11-29 20:27:59.110019,2022-11-29 20:28:07.397762,0 days 00:00:08.287743,balanced,6.0,log2,560,COMPLETE
418,418,0.5585096974089762,2022-11-29 20:28:07.575885,2022-11-29 20:28:16.823752,0 days 00:00:09.247867,"{0: 1, 1: 10}",25.0,log2,860,COMPLETE
419,419,0.691556997290217,2022-11-29 20:28:16.999824,2022-11-29 20:28:25.787017,0 days 00:00:08.787193,"{0: 1, 1: 10}",3.0,0.8,210,COMPLETE
420,420,0.580342100124283,2022-11-29 20:28:25.962938,2022-11-29 20:28:32.932095,0 days 00:00:06.969157,"{0: 1, 1: 100}",30.0,,10,COMPLETE
421,421,0.6535553070576561,2022-11-29 20:28:33.111800,2022-11-29 20:28:39.957060,0 days 00:00:06.845260,"{0: 1, 1: 10}",25.0,1.0,10,COMPLETE
422,422,0.7126852890000782,2022-11-29 20:28:40.132767,2022-11-29 20:29:01.232941,0 days 00:00:21.100174,"{0: 1, 1: 10}",33.0,0.9,660,COMPLETE
423,423,0.6056180860887034,2022-11-29 20:29:01.429280,2022-11-29 20:29:09.305661,0 days 00:00:07.876381,"{0: 1, 1: 100}",15.0,log2,460,COMPLETE
424,424,0.576728702782963,2022-11-29 20:29:09.487664,2022-11-29 20:29:16.555399,0 days 00:00:07.067735,,18.0,sqrt,160,COMPLETE
425,425,0.6740530098303633,2022-11-29 20:29:16.742590,2022-11-29 20:29:42.785677,0 days 00:00:26.043087,,26.0,0.9,560,COMPLETE
426,426,0.6407780176145842,2022-11-29 20:29:42.991594,2022-11-29 20:29:57.886671,0 days 00:00:14.895077,"{0: 1, 1: 100}",30.0,,510,COMPLETE
427,427,0.6575825172239386,2022-11-29 20:29:58.084273,2022-11-29 20:30:05.599603,0 days 00:00:07.515330,balanced,24.0,sqrt,360,COMPLETE
428,428,0.6450739011816049,2022-11-29 20:30:05.789990,2022-11-29 20:30:20.975668,0 days 00:00:15.185678,"{0: 1, 1: 100}",23.0,0.7,660,COMPLETE
429,429,0.7155804373798766,2022-11-29 20:30:21.143956,2022-11-29 20:30:36.417509,0 days 00:00:15.273553,"{0: 1, 1: 10}",18.0,0.9,410,COMPLETE
430,430,0.6404392059951595,2022-11-29 20:30:36.606015,2022-11-29 20:30:54.310972,0 days 00:00:17.704957,"{0: 1, 1: 100}",36.0,1.0,660,COMPLETE
431,431,0.668562120405163,2022-11-29 20:30:54.487117,2022-11-29 20:31:04.257109,0 days 00:00:09.769992,,36.0,0.6,160,COMPLETE
432,432,0.7207226953645052,2022-11-29 20:31:04.453018,2022-11-29 20:31:21.597944,0 days 00:00:17.144926,"{0: 1, 1: 10}",8.0,0.7,610,COMPLETE
433,433,0.7090816871698546,2022-11-29 20:31:21.768030,2022-11-29 20:31:35.387607,0 days 00:00:13.619577,"{0: 1, 1: 10}",32.0,0.7,410,COMPLETE
434,434,0.5969040341049348,2022-11-29 20:31:35.567101,2022-11-29 20:31:47.363642,0 days 00:00:11.796541,"{0: 1, 1: 100}",6.0,0.9,410,COMPLETE
435,435,0.5761944075459159,2022-11-29 20:31:47.547744,2022-11-29 20:31:56.045346,0 days 00:00:08.497602,"{0: 1, 1: 10}",20.0,log2,660,COMPLETE
436,436,0.673015569639673,2022-11-29 20:31:56.230932,2022-11-29 20:32:16.810420,0 days 00:00:20.579488,,17.0,0.7,510,COMPLETE
437,437,0.6571455197501573,2022-11-29 20:32:16.981956,2022-11-29 20:32:35.796098,0 days 00:00:18.814142,balanced,21.0,,610,COMPLETE
438,438,0.7143226160221096,2022-11-29 20:32:35.980511,2022-11-29 20:32:49.479313,0 days 00:00:13.498802,"{0: 1, 1: 10}",26.0,1.0,310,COMPLETE
439,439,0.6744635568874859,2022-11-29 20:32:49.671939,2022-11-29 20:33:07.544691,0 days 00:00:17.872752,,27.0,,310,COMPLETE
440,440,0.651349749411742,2022-11-29 20:33:07.719540,2022-11-29 20:33:28.193304,0 days 00:00:20.473764,balanced,5.0,0.8,860,COMPLETE
441,441,0.5393313034030827,2022-11-29 20:33:28.398083,2022-11-29 20:33:35.756717,0 days 00:00:07.358634,"{0: 1, 1: 10}",29.0,log2,360,COMPLETE
442,442,0.7164081596414975,2022-11-29 20:33:35.935441,2022-11-29 20:34:06.170226,0 days 00:00:30.234785,"{0: 1, 1: 10}",30.0,,960,COMPLETE
443,443,0.658865602143285,2022-11-29 20:34:06.364958,2022-11-29 20:34:19.797942,0 days 00:00:13.432984,balanced,35.0,0.7,460,COMPLETE
444,444,0.64133094065893,2022-11-29 20:34:19.984618,2022-11-29 20:34:37.563694,0 days 00:00:17.579076,"{0: 1, 1: 100}",27.0,1.0,660,COMPLETE
445,445,0.6619910168290845,2022-11-29 20:34:37.726941,2022-11-29 20:34:47.493596,0 days 00:00:09.766655,balanced,25.0,sqrt,860,COMPLETE
446,446,0.6776807894594022,2022-11-29 20:34:47.682244,2022-11-29 20:34:57.835171,0 days 00:00:10.152927,,33.0,1.0,110,COMPLETE
447,447,0.6733613976072805,2022-11-29 20:34:58.026528,2022-11-29 20:35:14.135381,0 days 00:00:16.108853,,24.0,,260,COMPLETE
448,448,0.716852890742324,2022-11-29 20:35:14.314088,2022-11-29 20:35:32.949454,0 days 00:00:18.635366,"{0: 1, 1: 10}",14.0,,510,COMPLETE
449,449,0.7078704304662982,2022-11-29 20:35:33.130884,2022-11-29 20:35:49.111577,0 days 00:00:15.980693,"{0: 1, 1: 10}",10.0,0.6,610,COMPLETE
450,450,0.7113670326334963,2022-11-29 20:35:49.286351,2022-11-29 20:36:05.259514,0 days 00:00:15.973163,"{0: 1, 1: 10}",11.0,0.6,610,COMPLETE
451,451,0.6666731113050582,2022-11-29 20:36:05.436731,2022-11-29 20:36:13.786260,0 days 00:00:08.349529,balanced,17.0,sqrt,560,COMPLETE
452,452,0.6750737864566839,2022-11-29 20:36:13.967385,2022-11-29 20:36:35.871901,0 days 00:00:21.904516,,16.0,,410,COMPLETE
453,453,0.6746395210911724,2022-11-29 20:36:36.045939,2022-11-29 20:37:10.021813,0 days 00:00:33.975874,,37.0,0.8,860,COMPLETE
454,454,0.6710317196412834,2022-11-29 20:37:10.203412,2022-11-29 20:37:20.503396,0 days 00:00:10.299984,,36.0,0.7,160,COMPLETE
455,455,0.7082839356774002,2022-11-29 20:37:20.667007,2022-11-29 20:37:34.137352,0 days 00:00:13.470345,"{0: 1, 1: 10}",9.0,0.6,460,COMPLETE
456,456,0.6223372101765706,2022-11-29 20:37:34.322625,2022-11-29 20:37:41.638586,0 days 00:00:07.315961,"{0: 1, 1: 10}",35.0,sqrt,310,COMPLETE
457,457,0.5336155355419838,2022-11-29 20:37:41.814425,2022-11-29 20:37:48.724553,0 days 00:00:06.910128,"{0: 1, 1: 10}",26.0,log2,60,COMPLETE
458,458,0.6736197228325564,2022-11-29 20:37:48.894427,2022-11-29 20:38:12.396993,0 days 00:00:23.502566,,26.0,0.7,610,COMPLETE
459,459,0.709758711822903,2022-11-29 20:38:12.597292,2022-11-29 20:38:24.929013,0 days 00:00:12.331721,"{0: 1, 1: 10}",27.0,,260,COMPLETE
460,460,0.6685925323346443,2022-11-29 20:38:25.105930,2022-11-29 20:38:39.305288,0 days 00:00:14.199358,balanced,19.0,0.7,510,COMPLETE
461,461,0.5770824243714772,2022-11-29 20:38:39.489801,2022-11-29 20:38:46.447095,0 days 00:00:06.957294,,27.0,sqrt,110,COMPLETE
462,462,0.715390976743143,2022-11-29 20:38:46.625104,2022-11-29 20:39:05.393583,0 days 00:00:18.768479,"{0: 1, 1: 10}",11.0,0.9,560,COMPLETE
463,463,0.5689271751307061,2022-11-29 20:39:05.582052,2022-11-29 20:39:12.521278,0 days 00:00:06.939226,balanced,31.0,log2,110,COMPLETE
464,464,0.6663521464117391,2022-11-29 20:39:12.697754,2022-11-29 20:39:21.575714,0 days 00:00:08.877960,balanced,17.0,0.6,210,COMPLETE
465,465,0.5877638678156338,2022-11-29 20:39:21.763824,2022-11-29 20:39:32.297578,0 days 00:00:10.533754,"{0: 1, 1: 100}",5.0,1.0,310,COMPLETE
466,466,0.6975855793482786,2022-11-29 20:39:32.485388,2022-11-29 20:39:39.423099,0 days 00:00:06.937711,"{0: 1, 1: 10}",8.0,0.6,60,COMPLETE
467,467,0.6757591401864357,2022-11-29 20:39:39.601523,2022-11-29 20:39:57.547657,0 days 00:00:17.946134,,23.0,,310,COMPLETE
468,468,0.6574029087351696,2022-11-29 20:39:57.724907,2022-11-29 20:40:13.624143,0 days 00:00:15.899236,balanced,28.0,0.9,510,COMPLETE
469,469,0.6760147068994706,2022-11-29 20:40:13.788826,2022-11-29 20:40:20.641415,0 days 00:00:06.852589,,,0.7,10,COMPLETE
470,470,0.5915008490358151,2022-11-29 20:40:20.812612,2022-11-29 20:40:34.286031,0 days 00:00:13.473419,"{0: 1, 1: 10}",1.0,,960,COMPLETE
471,471,0.6911703644155993,2022-11-29 20:40:34.468914,2022-11-29 20:40:44.367220,0 days 00:00:09.898306,,2.0,1.0,310,COMPLETE
472,472,0.6531821442763512,2022-11-29 20:40:44.544387,2022-11-29 20:40:59.103687,0 days 00:00:14.559300,balanced,30.0,1.0,410,COMPLETE
473,473,0.6364966604714271,2022-11-29 20:40:59.273011,2022-11-29 20:41:16.983844,0 days 00:00:17.710833,"{0: 1, 1: 100}",14.0,0.6,960,COMPLETE
474,474,0.5993875645635593,2022-11-29 20:41:17.162614,2022-11-29 20:41:25.063611,0 days 00:00:07.900997,balanced,10.0,log2,410,COMPLETE
475,475,0.6950527578535103,2022-11-29 20:41:25.243560,2022-11-29 20:41:32.195034,0 days 00:00:06.951474,"{0: 1, 1: 10}",22.0,0.8,60,COMPLETE
476,476,0.6535325740939663,2022-11-29 20:41:32.367942,2022-11-29 20:41:40.894601,0 days 00:00:08.526659,balanced,6.0,0.6,210,COMPLETE
477,477,0.5954588120365193,2022-11-29 20:41:41.092760,2022-11-29 20:41:48.791452,0 days 00:00:07.698692,,12.0,sqrt,410,COMPLETE
478,478,0.7089717813918638,2022-11-29 20:41:48.970185,2022-11-29 20:41:58.675364,0 days 00:00:09.705179,"{0: 1, 1: 10}",19.0,,160,COMPLETE
479,479,0.6276000450938815,2022-11-29 20:41:58.852976,2022-11-29 20:42:07.507479,0 days 00:00:08.654503,"{0: 1, 1: 10}",19.0,sqrt,610,COMPLETE
