,number,value,datetime_start,datetime_complete,duration,params_class_weight,params_max_depth,params_max_features,params_n_estimators,state
1585,1585,0.7159032563846909,2022-11-30 01:46:28.734621,2022-11-30 01:46:50.202169,0 days 00:00:21.467548,"{0: 1, 1: 10}",37.0,,660,COMPLETE
1586,1586,0.7308483824570752,2022-11-30 01:46:50.436103,2022-11-30 01:47:09.291066,0 days 00:00:18.854963,"{0: 1, 1: 10}",6.0,,560,COMPLETE
1587,1587,0.7307583569797227,2022-11-30 01:47:09.512954,2022-11-30 01:47:29.650789,0 days 00:00:20.137835,"{0: 1, 1: 10}",6.0,,610,COMPLETE
1588,1588,0.7313625978832483,2022-11-30 01:47:29.882390,2022-11-30 01:47:49.259779,0 days 00:00:19.377389,"{0: 1, 1: 10}",5.0,,610,COMPLETE
1589,1589,0.7098342617891645,2022-11-30 01:47:49.489046,2022-11-30 01:48:08.811821,0 days 00:00:19.322775,"{0: 1, 1: 10}",16.0,,560,COMPLETE
1590,1590,0.7330175494585055,2022-11-30 01:48:09.037727,2022-11-30 01:48:30.204749,0 days 00:00:21.167022,"{0: 1, 1: 10}",6.0,,660,COMPLETE
1591,1591,0.7161316116156601,2022-11-30 01:48:30.433464,2022-11-30 01:48:50.916140,0 days 00:00:20.482676,"{0: 1, 1: 10}",18.0,,610,COMPLETE
1592,1592,0.721326908528062,2022-11-30 01:48:51.144455,2022-11-30 01:49:10.435095,0 days 00:00:19.290640,"{0: 1, 1: 10}",11.0,,560,COMPLETE
1593,1593,0.7358180822040333,2022-11-30 01:49:10.627707,2022-11-30 01:49:30.608535,0 days 00:00:19.980828,"{0: 1, 1: 10}",6.0,,610,COMPLETE
1594,1594,0.7147758561661134,2022-11-30 01:49:30.841344,2022-11-30 01:49:51.245304,0 days 00:00:20.403960,"{0: 1, 1: 10}",38.0,,610,COMPLETE
1595,1595,0.7138635648046738,2022-11-30 01:49:51.481293,2022-11-30 01:50:11.978078,0 days 00:00:20.496785,"{0: 1, 1: 10}",17.0,,610,COMPLETE
1596,1596,0.7149535256855233,2022-11-30 01:50:12.209756,2022-11-30 01:50:32.727255,0 days 00:00:20.517499,"{0: 1, 1: 10}",35.0,,610,COMPLETE
1597,1597,0.7147760992198486,2022-11-30 01:50:32.960764,2022-11-30 01:50:54.580617,0 days 00:00:21.619853,"{0: 1, 1: 10}",30.0,,660,COMPLETE
1598,1598,0.734104167423504,2022-11-30 01:50:54.813644,2022-11-30 01:51:15.921790,0 days 00:00:21.108146,"{0: 1, 1: 10}",6.0,,660,COMPLETE
1599,1599,0.7153915661872252,2022-11-30 01:51:16.151575,2022-11-30 01:51:37.663832,0 days 00:00:21.512257,"{0: 1, 1: 10}",14.0,,660,COMPLETE
1600,1600,0.7304004962363855,2022-11-30 01:51:37.901718,2022-11-30 01:52:00.234687,0 days 00:00:22.332969,"{0: 1, 1: 10}",6.0,,710,COMPLETE
1601,1601,0.730887804364684,2022-11-30 01:52:00.461876,2022-11-30 01:52:22.795925,0 days 00:00:22.334049,"{0: 1, 1: 10}",6.0,,710,COMPLETE
1602,1602,0.7155524672423841,2022-11-30 01:52:23.029058,2022-11-30 01:52:44.772080,0 days 00:00:21.743022,"{0: 1, 1: 10}",24.0,,660,COMPLETE
1603,1603,0.7163540178710344,2022-11-30 01:52:44.997560,2022-11-30 01:53:06.774786,0 days 00:00:21.777226,"{0: 1, 1: 10}",39.0,,660,COMPLETE
1604,1604,0.7165207020699358,2022-11-30 01:53:07.003608,2022-11-30 01:53:26.095145,0 days 00:00:19.091537,"{0: 1, 1: 10}",4.0,,660,COMPLETE
1605,1605,0.7160706427118275,2022-11-30 01:53:26.326918,2022-11-30 01:53:49.154201,0 days 00:00:22.827283,"{0: 1, 1: 10}",21.0,,710,COMPLETE
1606,1606,0.7318955866099516,2022-11-30 01:53:49.391052,2022-11-30 01:54:10.492276,0 days 00:00:21.101224,"{0: 1, 1: 10}",6.0,,660,COMPLETE
1607,1607,0.7332408170857491,2022-11-30 01:54:10.721961,2022-11-30 01:54:31.902302,0 days 00:00:21.180341,"{0: 1, 1: 10}",6.0,,660,COMPLETE
1608,1608,0.7106308138881848,2022-11-30 01:54:32.132663,2022-11-30 01:54:53.712694,0 days 00:00:21.580031,"{0: 1, 1: 10}",32.0,,660,COMPLETE
1609,1609,0.7122862008152606,2022-11-30 01:54:53.942195,2022-11-30 01:55:15.634645,0 days 00:00:21.692450,"{0: 1, 1: 10}",19.0,,660,COMPLETE
1610,1610,0.7327578403686481,2022-11-30 01:55:15.863120,2022-11-30 01:55:35.945257,0 days 00:00:20.082137,"{0: 1, 1: 10}",6.0,,610,COMPLETE
1611,1611,0.7133503346728407,2022-11-30 01:55:36.168402,2022-11-30 01:55:59.152018,0 days 00:00:22.983616,"{0: 1, 1: 10}",28.0,,710,COMPLETE
1612,1612,0.7324369721153865,2022-11-30 01:55:59.470971,2022-11-30 01:56:20.695722,0 days 00:00:21.224751,"{0: 1, 1: 10}",6.0,,660,COMPLETE
1613,1613,0.7295590078021263,2022-11-30 01:56:20.923376,2022-11-30 01:56:41.279083,0 days 00:00:20.355707,"{0: 1, 1: 10}",5.0,,660,COMPLETE
1614,1614,0.7296502938567349,2022-11-30 01:56:41.511028,2022-11-30 01:57:04.240455,0 days 00:00:22.729427,"{0: 1, 1: 10}",7.0,,710,COMPLETE
1615,1615,0.7130800964262608,2022-11-30 01:57:04.475444,2022-11-30 01:57:25.024608,0 days 00:00:20.549164,"{0: 1, 1: 10}",12.0,,610,COMPLETE
1616,1616,0.7159542972192465,2022-11-30 01:57:25.253584,2022-11-30 01:57:45.624341,0 days 00:00:20.370757,"{0: 1, 1: 10}",15.0,,610,COMPLETE
1617,1617,0.6777318291978642,2022-11-30 01:57:45.851081,2022-11-30 01:57:59.399571,0 days 00:00:13.548490,"{0: 1, 1: 10}",2.0,,610,COMPLETE
1618,1618,0.7313132426776752,2022-11-30 01:57:59.623958,2022-11-30 01:58:20.854203,0 days 00:00:21.230245,"{0: 1, 1: 10}",6.0,,660,COMPLETE
1619,1619,0.7168031378428127,2022-11-30 01:58:21.088761,2022-11-30 01:58:42.735613,0 days 00:00:21.646852,"{0: 1, 1: 10}",20.0,,660,COMPLETE
1620,1620,0.7125879031157479,2022-11-30 01:58:42.965834,2022-11-30 01:59:03.386833,0 days 00:00:20.420999,"{0: 1, 1: 10}",29.0,,610,COMPLETE
1621,1621,0.7143607721955914,2022-11-30 01:59:03.625303,2022-11-30 01:59:24.018519,0 days 00:00:20.393216,"{0: 1, 1: 10}",22.0,,610,COMPLETE
1622,1622,0.7282428868204434,2022-11-30 01:59:24.254752,2022-11-30 01:59:44.061043,0 days 00:00:19.806291,"{0: 1, 1: 10}",6.0,,610,COMPLETE
1623,1623,0.7146219914001496,2022-11-30 01:59:44.292027,2022-11-30 02:00:05.958520,0 days 00:00:21.666493,"{0: 1, 1: 10}",13.0,,660,COMPLETE
1624,1624,0.7281816335672529,2022-11-30 02:00:06.195740,2022-11-30 02:00:26.103073,0 days 00:00:19.907333,"{0: 1, 1: 10}",6.0,,610,COMPLETE
1625,1625,0.7154230752228938,2022-11-30 02:00:26.339570,2022-11-30 02:00:46.785240,0 days 00:00:20.445670,"{0: 1, 1: 10}",,,610,COMPLETE
1626,1626,0.7327268555427077,2022-11-30 02:00:47.015809,2022-11-30 02:01:08.204087,0 days 00:00:21.188278,"{0: 1, 1: 10}",6.0,,660,COMPLETE
1627,1627,0.733312410917914,2022-11-30 02:01:08.436060,2022-11-30 02:01:30.607892,0 days 00:00:22.171832,"{0: 1, 1: 10}",6.0,,710,COMPLETE
1628,1628,0.7320978523413625,2022-11-30 02:01:30.835757,2022-11-30 02:01:52.040502,0 days 00:00:21.204745,"{0: 1, 1: 10}",6.0,,660,COMPLETE
1629,1629,0.7135653747266039,2022-11-30 02:01:52.274248,2022-11-30 02:02:12.835863,0 days 00:00:20.561615,"{0: 1, 1: 10}",23.0,,610,COMPLETE
1630,1630,0.5927589764912876,2022-11-30 02:02:13.071001,2022-11-30 02:02:23.590489,0 days 00:00:10.519488,"{0: 1, 1: 10}",1.0,,610,COMPLETE
1631,1631,0.728624546732964,2022-11-30 02:02:23.821393,2022-11-30 02:02:43.717901,0 days 00:00:19.896508,"{0: 1, 1: 10}",6.0,,610,COMPLETE
1632,1632,0.7195982119364415,2022-11-30 02:02:43.950122,2022-11-30 02:03:05.661369,0 days 00:00:21.711247,"{0: 1, 1: 10}",9.0,,660,COMPLETE
1633,1633,0.7313250355392026,2022-11-30 02:03:05.886017,2022-11-30 02:03:25.097034,0 days 00:00:19.211017,"{0: 1, 1: 10}",5.0,,610,COMPLETE
1634,1634,0.7306849852959144,2022-11-30 02:03:25.320007,2022-11-30 02:03:46.433370,0 days 00:00:21.113363,"{0: 1, 1: 10}",6.0,,660,COMPLETE
1635,1635,0.7287336269820825,2022-11-30 02:03:46.663481,2022-11-30 02:04:06.579664,0 days 00:00:19.916183,"{0: 1, 1: 10}",6.0,,610,COMPLETE
1636,1636,0.7104778165476068,2022-11-30 02:04:06.811303,2022-11-30 02:04:22.954140,0 days 00:00:16.142837,"{0: 1, 1: 10}",3.0,,610,COMPLETE
1637,1637,0.7137859338931529,2022-11-30 02:04:23.180545,2022-11-30 02:04:44.765279,0 days 00:00:21.584734,"{0: 1, 1: 10}",33.0,,660,COMPLETE
1638,1638,0.7311518159790849,2022-11-30 02:04:45.007311,2022-11-30 02:05:07.384516,0 days 00:00:22.377205,"{0: 1, 1: 10}",6.0,,710,COMPLETE
1639,1639,0.7144715143758595,2022-11-30 02:05:07.622285,2022-11-30 02:05:28.085791,0 days 00:00:20.463506,"{0: 1, 1: 10}",26.0,,610,COMPLETE
1640,1640,0.7138803800378289,2022-11-30 02:05:28.316671,2022-11-30 02:05:49.828340,0 days 00:00:21.511669,"{0: 1, 1: 10}",34.0,,660,COMPLETE
1641,1641,0.7170360437709029,2022-11-30 02:05:50.074503,2022-11-30 02:06:10.377836,0 days 00:00:20.303333,"{0: 1, 1: 10}",27.0,,610,COMPLETE
1642,1642,0.7207478239975091,2022-11-30 02:06:10.609170,2022-11-30 02:06:29.888299,0 days 00:00:19.279129,"{0: 1, 1: 10}",10.0,,560,COMPLETE
1643,1643,0.7301737197263365,2022-11-30 02:06:30.120613,2022-11-30 02:06:50.129566,0 days 00:00:20.008953,"{0: 1, 1: 10}",6.0,,610,COMPLETE
1644,1644,0.7167578985537372,2022-11-30 02:06:50.358821,2022-11-30 02:07:11.921569,0 days 00:00:21.562748,"{0: 1, 1: 10}",36.0,,660,COMPLETE
1645,1645,0.7310094713342871,2022-11-30 02:07:12.145999,2022-11-30 02:07:30.952161,0 days 00:00:18.806162,"{0: 1, 1: 10}",6.0,,560,COMPLETE
1646,1646,0.7159623430996899,2022-11-30 02:07:31.183222,2022-11-30 02:07:51.622567,0 days 00:00:20.439345,"{0: 1, 1: 10}",31.0,,610,COMPLETE
1647,1647,0.7326420492918326,2022-11-30 02:07:51.846961,2022-11-30 02:08:12.961077,0 days 00:00:21.114116,"{0: 1, 1: 10}",6.0,,660,COMPLETE
1648,1648,0.7322095607174379,2022-11-30 02:08:13.187449,2022-11-30 02:08:33.297285,0 days 00:00:20.109836,"{0: 1, 1: 10}",6.0,,610,COMPLETE
1649,1649,0.7313863002586827,2022-11-30 02:08:33.520740,2022-11-30 02:08:53.538168,0 days 00:00:20.017428,"{0: 1, 1: 10}",6.0,,610,COMPLETE
1650,1650,0.7166547294071063,2022-11-30 02:08:53.761644,2022-11-30 02:09:13.082861,0 days 00:00:19.321217,"{0: 1, 1: 10}",25.0,,560,COMPLETE
1651,1651,0.7129574771869676,2022-11-30 02:09:13.320698,2022-11-30 02:09:35.054670,0 days 00:00:21.733972,"{0: 1, 1: 10}",16.0,,660,COMPLETE
1652,1652,0.7189974295084862,2022-11-30 02:09:35.284376,2022-11-30 02:09:58.027635,0 days 00:00:22.743259,"{0: 1, 1: 10}",18.0,,710,COMPLETE
1653,1653,0.7150621011001784,2022-11-30 02:09:58.258716,2022-11-30 02:10:18.572641,0 days 00:00:20.313925,"{0: 1, 1: 10}",37.0,,610,COMPLETE
1654,1654,0.724395413534,2022-11-30 02:10:18.802385,2022-11-30 02:10:39.295051,0 days 00:00:20.492666,"{0: 1, 1: 10}",5.0,,660,COMPLETE
1655,1655,0.7170078247511731,2022-11-30 02:10:39.522515,2022-11-30 02:10:58.728886,0 days 00:00:19.206371,"{0: 1, 1: 10}",11.0,,560,COMPLETE
1656,1656,0.7145546938666862,2022-11-30 02:10:58.955556,2022-11-30 02:11:19.397835,0 days 00:00:20.442279,"{0: 1, 1: 10}",30.0,,610,COMPLETE
1657,1657,0.7311222224736382,2022-11-30 02:11:19.631339,2022-11-30 02:11:40.836775,0 days 00:00:21.205436,"{0: 1, 1: 10}",6.0,,660,COMPLETE
1658,1658,0.7320351246925239,2022-11-30 02:11:41.060803,2022-11-30 02:12:00.972076,0 days 00:00:19.911273,"{0: 1, 1: 10}",6.0,,610,COMPLETE
1659,1659,0.7167561327910027,2022-11-30 02:12:01.209143,2022-11-30 02:12:20.560921,0 days 00:00:19.351778,"{0: 1, 1: 10}",17.0,,560,COMPLETE
1660,1660,0.7090740859069554,2022-11-30 02:12:20.800674,2022-11-30 02:12:39.968212,0 days 00:00:19.167538,"{0: 1, 1: 10}",35.0,,560,COMPLETE
1661,1661,0.7147225791615959,2022-11-30 02:12:40.200994,2022-11-30 02:13:00.612028,0 days 00:00:20.411034,"{0: 1, 1: 10}",14.0,,610,COMPLETE
1662,1662,0.7300097930142293,2022-11-30 02:13:00.855556,2022-11-30 02:13:22.186924,0 days 00:00:21.331368,"{0: 1, 1: 10}",6.0,,660,COMPLETE
1663,1663,0.7308697271704908,2022-11-30 02:13:22.417232,2022-11-30 02:13:42.407209,0 days 00:00:19.989977,"{0: 1, 1: 10}",6.0,,610,COMPLETE
1664,1664,0.7299522426815374,2022-11-30 02:13:42.636208,2022-11-30 02:14:05.178419,0 days 00:00:22.542211,"{0: 1, 1: 10}",6.0,,710,COMPLETE
1665,1665,0.7129118198644733,2022-11-30 02:14:05.402064,2022-11-30 02:14:24.497389,0 days 00:00:19.095325,"{0: 1, 1: 10}",38.0,,560,COMPLETE
1666,1666,0.7231516689880767,2022-11-30 02:14:24.727636,2022-11-30 02:14:43.910535,0 days 00:00:19.182899,"{0: 1, 1: 10}",4.0,,660,COMPLETE
1667,1667,0.7157476368680501,2022-11-30 02:14:44.142708,2022-11-30 02:15:04.700091,0 days 00:00:20.557383,"{0: 1, 1: 10}",21.0,,610,COMPLETE
1668,1668,0.7161729254151753,2022-11-30 02:15:04.927780,2022-11-30 02:15:25.431351,0 days 00:00:20.503571,"{0: 1, 1: 10}",24.0,,610,COMPLETE
1669,1669,0.7301598395173341,2022-11-30 02:15:25.674641,2022-11-30 02:15:44.579479,0 days 00:00:18.904838,"{0: 1, 1: 10}",6.0,,560,COMPLETE
1670,1670,0.7181268163635295,2022-11-30 02:15:44.814674,2022-11-30 02:16:05.280473,0 days 00:00:20.465799,"{0: 1, 1: 10}",19.0,,610,COMPLETE
1671,1671,0.7171732383681386,2022-11-30 02:16:05.510265,2022-11-30 02:16:27.148168,0 days 00:00:21.637903,"{0: 1, 1: 10}",39.0,,660,COMPLETE
1672,1672,0.7144401472020807,2022-11-30 02:16:27.373238,2022-11-30 02:16:47.842702,0 days 00:00:20.469464,"{0: 1, 1: 10}",32.0,,610,COMPLETE
1673,1673,0.7142002971076501,2022-11-30 02:16:48.077064,2022-11-30 02:17:07.284918,0 days 00:00:19.207854,"{0: 1, 1: 10}",28.0,,560,COMPLETE
1674,1674,0.7304255368074271,2022-11-30 02:17:07.519998,2022-11-30 02:17:28.779909,0 days 00:00:21.259911,"{0: 1, 1: 10}",6.0,,660,COMPLETE
1675,1675,0.7315025200363477,2022-11-30 02:17:29.008789,2022-11-30 02:17:47.839907,0 days 00:00:18.831118,"{0: 1, 1: 10}",6.0,,560,COMPLETE
1676,1676,0.7334093844846113,2022-11-30 02:17:48.080522,2022-11-30 02:18:07.452137,0 days 00:00:19.371615,"{0: 1, 1: 10}",5.0,,610,COMPLETE
1677,1677,0.7307969217615761,2022-11-30 02:18:07.687728,2022-11-30 02:18:27.716097,0 days 00:00:20.028369,"{0: 1, 1: 10}",6.0,,610,COMPLETE
1678,1678,0.716297652236831,2022-11-30 02:18:27.939969,2022-11-30 02:18:49.720321,0 days 00:00:21.780352,"{0: 1, 1: 10}",20.0,,660,COMPLETE
1679,1679,0.718483605893628,2022-11-30 02:18:49.954428,2022-11-30 02:19:10.439598,0 days 00:00:20.485170,"{0: 1, 1: 10}",15.0,,610,COMPLETE
1680,1680,0.7145348332206192,2022-11-30 02:19:10.678922,2022-11-30 02:19:33.469849,0 days 00:00:22.790927,"{0: 1, 1: 10}",13.0,,710,COMPLETE
1681,1681,0.7192183460581713,2022-11-30 02:19:33.698781,2022-11-30 02:19:55.328869,0 days 00:00:21.630088,"{0: 1, 1: 10}",29.0,,660,COMPLETE
1682,1682,0.7324756549379172,2022-11-30 02:19:55.560657,2022-11-30 02:20:14.353490,0 days 00:00:18.792833,"{0: 1, 1: 10}",6.0,,560,COMPLETE
1683,1683,0.7302260427191835,2022-11-30 02:20:14.583670,2022-11-30 02:20:34.477537,0 days 00:00:19.893867,"{0: 1, 1: 10}",6.0,,610,COMPLETE
1684,1684,0.7341038077241129,2022-11-30 02:20:34.709842,2022-11-30 02:20:55.888518,0 days 00:00:21.178676,"{0: 1, 1: 10}",6.0,,660,COMPLETE
1685,1685,0.6793744229394357,2022-11-30 02:20:56.117981,2022-11-30 02:21:09.149249,0 days 00:00:13.031268,"{0: 1, 1: 10}",2.0,,560,COMPLETE
1686,1686,0.7306752057302149,2022-11-30 02:21:09.381669,2022-11-30 02:21:29.421184,0 days 00:00:20.039515,"{0: 1, 1: 10}",6.0,,610,COMPLETE
1687,1687,0.712905920305096,2022-11-30 02:21:29.655035,2022-11-30 02:21:48.872450,0 days 00:00:19.217415,"{0: 1, 1: 10}",22.0,,560,COMPLETE
1688,1688,0.5844788587429788,2022-11-30 02:21:49.118982,2022-11-30 02:21:59.642536,0 days 00:00:10.523554,"{0: 1, 1: 10}",1.0,,610,COMPLETE
1689,1689,0.7298713032140947,2022-11-30 02:21:59.878392,2022-11-30 02:22:21.275769,0 days 00:00:21.397377,"{0: 1, 1: 10}",7.0,,660,COMPLETE
1690,1690,0.7169468733649051,2022-11-30 02:22:21.499273,2022-11-30 02:22:41.906907,0 days 00:00:20.407634,"{0: 1, 1: 10}",12.0,,610,COMPLETE
1691,1691,0.728087008210825,2022-11-30 02:22:42.145594,2022-11-30 02:23:01.018290,0 days 00:00:18.872696,"{0: 1, 1: 10}",6.0,,560,COMPLETE
1692,1692,0.7202392986869889,2022-11-30 02:23:01.251458,2022-11-30 02:23:23.963873,0 days 00:00:22.712415,"{0: 1, 1: 10}",9.0,,710,COMPLETE
1693,1693,0.7317553792789409,2022-11-30 02:23:24.192739,2022-11-30 02:23:44.214398,0 days 00:00:20.021659,"{0: 1, 1: 10}",6.0,,610,COMPLETE
1694,1694,0.7108155787691198,2022-11-30 02:23:44.444724,2022-11-30 02:24:06.140890,0 days 00:00:21.696166,"{0: 1, 1: 10}",,,660,COMPLETE
1695,1695,0.7298838461724826,2022-11-30 02:24:06.370856,2022-11-30 02:24:26.479688,0 days 00:00:20.108832,"{0: 1, 1: 10}",6.0,,610,COMPLETE
1696,1696,0.7310934683395448,2022-11-30 02:24:26.711068,2022-11-30 02:24:44.836262,0 days 00:00:18.125194,"{0: 1, 1: 10}",5.0,,560,COMPLETE
1697,1697,0.7133896371944076,2022-11-30 02:24:45.061692,2022-11-30 02:25:05.607616,0 days 00:00:20.545924,"{0: 1, 1: 10}",23.0,,610,COMPLETE
1698,1698,0.7305224141075031,2022-11-30 02:25:05.834389,2022-11-30 02:25:27.206763,0 days 00:00:21.372374,"{0: 1, 1: 10}",6.0,,660,COMPLETE
1699,1699,0.7311814213756451,2022-11-30 02:25:27.447663,2022-11-30 02:25:46.213904,0 days 00:00:18.766241,"{0: 1, 1: 10}",6.0,,560,COMPLETE
1700,1700,0.7120702968175494,2022-11-30 02:25:46.455006,2022-11-30 02:26:06.875382,0 days 00:00:20.420376,"{0: 1, 1: 10}",26.0,,610,COMPLETE
1701,1701,0.7161879970031491,2022-11-30 02:26:07.105480,2022-11-30 02:26:28.698187,0 days 00:00:21.592707,"{0: 1, 1: 10}",27.0,,660,COMPLETE
1702,1702,0.7147140515265852,2022-11-30 02:26:28.923821,2022-11-30 02:26:49.384148,0 days 00:00:20.460327,"{0: 1, 1: 10}",34.0,,610,COMPLETE
1703,1703,0.7325584243235503,2022-11-30 02:26:49.619999,2022-11-30 02:27:08.462850,0 days 00:00:18.842851,"{0: 1, 1: 10}",6.0,,560,COMPLETE
1704,1704,0.7180408283810161,2022-11-30 02:27:08.701328,2022-11-30 02:27:30.287474,0 days 00:00:21.586146,"{0: 1, 1: 10}",33.0,,660,COMPLETE
1705,1705,0.7335167791078644,2022-11-30 02:27:30.530494,2022-11-30 02:27:50.496284,0 days 00:00:19.965790,"{0: 1, 1: 10}",6.0,,610,COMPLETE
1706,1706,0.7137389690248457,2022-11-30 02:27:50.726881,2022-11-30 02:28:11.217956,0 days 00:00:20.491075,"{0: 1, 1: 10}",31.0,,610,COMPLETE
1707,1707,0.7189778736183787,2022-11-30 02:28:11.454564,2022-11-30 02:28:30.630162,0 days 00:00:19.175598,"{0: 1, 1: 10}",10.0,,560,COMPLETE
1708,1708,0.711453534143966,2022-11-30 02:28:30.864741,2022-11-30 02:28:51.281557,0 days 00:00:20.416816,"{0: 1, 1: 10}",25.0,,610,COMPLETE
1709,1709,0.7339373197826882,2022-11-30 02:28:51.511018,2022-11-30 02:29:12.726053,0 days 00:00:21.215035,"{0: 1, 1: 10}",6.0,,660,COMPLETE
1710,1710,0.713165478845239,2022-11-30 02:29:12.967983,2022-11-30 02:29:35.853374,0 days 00:00:22.885391,"{0: 1, 1: 10}",36.0,,710,COMPLETE
1711,1711,0.7291647922325415,2022-11-30 02:29:36.084945,2022-11-30 02:29:54.906182,0 days 00:00:18.821237,"{0: 1, 1: 10}",6.0,,560,COMPLETE
1712,1712,0.7109999426124942,2022-11-30 02:29:55.148419,2022-11-30 02:30:12.062393,0 days 00:00:16.913974,"{0: 1, 1: 10}",3.0,,660,COMPLETE
1713,1713,0.7187806016468531,2022-11-30 02:30:12.295652,2022-11-30 02:30:32.661765,0 days 00:00:20.366113,"{0: 1, 1: 10}",16.0,,610,COMPLETE
1714,1714,0.7304042094484642,2022-11-30 02:30:32.904675,2022-11-30 02:30:51.674373,0 days 00:00:18.769698,"{0: 1, 1: 10}",6.0,,560,COMPLETE
1715,1715,0.7127588520616126,2022-11-30 02:30:51.902679,2022-11-30 02:31:12.366146,0 days 00:00:20.463467,"{0: 1, 1: 10}",37.0,,610,COMPLETE
1716,1716,0.7185734711382945,2022-11-30 02:31:12.590622,2022-11-30 02:31:34.327194,0 days 00:00:21.736572,"{0: 1, 1: 10}",11.0,,660,COMPLETE
1717,1717,0.7342966605308576,2022-11-30 02:31:34.560273,2022-11-30 02:31:54.497269,0 days 00:00:19.936996,"{0: 1, 1: 10}",6.0,,610,COMPLETE
1718,1718,0.7296362458455494,2022-11-30 02:31:54.721355,2022-11-30 02:32:13.922782,0 days 00:00:19.201427,"{0: 1, 1: 10}",5.0,,610,COMPLETE
1719,1719,0.7288835898657843,2022-11-30 02:32:14.162173,2022-11-30 02:32:32.918996,0 days 00:00:18.756823,"{0: 1, 1: 10}",6.0,,560,COMPLETE
1720,1720,0.7154751061662713,2022-11-30 02:32:33.151183,2022-11-30 02:32:53.562806,0 days 00:00:20.411623,"{0: 1, 1: 10}",18.0,,610,COMPLETE
1721,1721,0.7321216394056409,2022-11-30 02:32:53.798354,2022-11-30 02:33:12.732148,0 days 00:00:18.933794,"{0: 1, 1: 10}",6.0,,560,COMPLETE
1722,1722,0.7139130557666864,2022-11-30 02:33:12.961355,2022-11-30 02:33:33.367058,0 days 00:00:20.405703,"{0: 1, 1: 10}",30.0,,610,COMPLETE
1723,1723,0.7172437845775448,2022-11-30 02:33:33.613490,2022-11-30 02:33:52.917842,0 days 00:00:19.304352,"{0: 1, 1: 10}",35.0,,560,COMPLETE
1724,1724,0.7143170674883413,2022-11-30 02:33:53.158386,2022-11-30 02:34:11.234071,0 days 00:00:18.075685,"{0: 1, 1: 10}",4.0,,610,COMPLETE
1725,1725,0.7146046585862644,2022-11-30 02:34:11.472829,2022-11-30 02:34:32.063848,0 days 00:00:20.591019,"{0: 1, 1: 10}",38.0,,610,COMPLETE
1726,1726,0.7326957025055714,2022-11-30 02:34:32.294482,2022-11-30 02:34:51.279880,0 days 00:00:18.985398,"{0: 1, 1: 10}",6.0,,560,COMPLETE
1727,1727,0.7122266070026736,2022-11-30 02:34:51.527965,2022-11-30 02:35:12.083521,0 days 00:00:20.555556,"{0: 1, 1: 10}",14.0,,610,COMPLETE
1728,1728,0.7333238402623699,2022-11-30 02:35:12.317398,2022-11-30 02:35:32.371422,0 days 00:00:20.054024,"{0: 1, 1: 10}",6.0,,610,COMPLETE
1729,1729,0.7097764825223194,2022-11-30 02:35:32.612131,2022-11-30 02:35:51.804224,0 days 00:00:19.192093,"{0: 1, 1: 10}",17.0,,560,COMPLETE
1730,1730,0.7200853667343359,2022-11-30 02:35:52.037504,2022-11-30 02:36:11.171056,0 days 00:00:19.133552,"{0: 1, 1: 10}",24.0,,560,COMPLETE
1731,1731,0.7323618978374631,2022-11-30 02:36:11.405240,2022-11-30 02:36:31.522644,0 days 00:00:20.117404,"{0: 1, 1: 10}",6.0,,610,COMPLETE
1732,1732,0.7140805283101536,2022-11-30 02:36:31.758748,2022-11-30 02:36:52.331734,0 days 00:00:20.572986,"{0: 1, 1: 10}",39.0,,610,COMPLETE
1733,1733,0.713105386676981,2022-11-30 02:36:52.563725,2022-11-30 02:37:11.834184,0 days 00:00:19.270459,"{0: 1, 1: 10}",21.0,,560,COMPLETE
1734,1734,0.7311892650503407,2022-11-30 02:37:12.066149,2022-11-30 02:37:32.080341,0 days 00:00:20.014192,"{0: 1, 1: 10}",6.0,,610,COMPLETE
1735,1735,0.7127894052829277,2022-11-30 02:37:32.319956,2022-11-30 02:37:52.874398,0 days 00:00:20.554442,"{0: 1, 1: 10}",19.0,,610,COMPLETE
1736,1736,0.7120846118155256,2022-11-30 02:37:53.103185,2022-11-30 02:38:12.222842,0 days 00:00:19.119657,"{0: 1, 1: 10}",32.0,,560,COMPLETE
1737,1737,0.7140827750590134,2022-11-30 02:38:12.456764,2022-11-30 02:38:32.788106,0 days 00:00:20.331342,"{0: 1, 1: 10}",28.0,,610,COMPLETE
1738,1738,0.7311072969389399,2022-11-30 02:38:33.022135,2022-11-30 02:38:53.084686,0 days 00:00:20.062551,"{0: 1, 1: 10}",6.0,,610,COMPLETE
1739,1739,0.7335543831543899,2022-11-30 02:38:53.322752,2022-11-30 02:39:12.129381,0 days 00:00:18.806629,"{0: 1, 1: 10}",6.0,,560,COMPLETE
