,number,value,datetime_start,datetime_complete,duration,params_class_weight,params_max_depth,params_max_features,params_n_estimators,state
1895,1895,0.7325769885594112,2022-11-30 03:36:47.943525,2022-11-30 03:37:11.130074,0 days 00:00:23.186549,"{0: 1, 1: 10}",6.0,0.9,810,COMPLETE
1896,1896,0.731313901102679,2022-11-30 03:37:11.371120,2022-11-30 03:37:34.956747,0 days 00:00:23.585627,"{0: 1, 1: 10}",6.0,,760,COMPLETE
1897,1897,0.7320258079363823,2022-11-30 03:37:35.194297,2022-11-30 03:37:58.651760,0 days 00:00:23.457463,"{0: 1, 1: 10}",6.0,,760,COMPLETE
1898,1898,0.7134706384350318,2022-11-30 03:37:58.885637,2022-11-30 03:38:22.988602,0 days 00:00:24.102965,"{0: 1, 1: 10}",,,760,COMPLETE
1899,1899,0.7176925788630812,2022-11-30 03:38:23.217937,2022-11-30 03:38:47.266603,0 days 00:00:24.048666,"{0: 1, 1: 10}",9.0,,760,COMPLETE
1900,1900,0.7158851128470112,2022-11-30 03:38:47.512900,2022-11-30 03:39:10.357738,0 days 00:00:22.844838,"{0: 1, 1: 10}",23.0,,710,COMPLETE
1901,1901,0.7330922427484021,2022-11-30 03:39:10.585246,2022-11-30 03:39:32.789036,0 days 00:00:22.203790,"{0: 1, 1: 10}",6.0,,710,COMPLETE
1902,1902,0.7328611833990383,2022-11-30 03:39:33.016636,2022-11-30 03:39:55.458411,0 days 00:00:22.441775,"{0: 1, 1: 10}",6.0,,710,COMPLETE
1903,1903,0.7321121183651246,2022-11-30 03:39:55.707409,2022-11-30 03:40:20.445659,0 days 00:00:24.738250,"{0: 1, 1: 10}",6.0,,810,COMPLETE
1904,1904,0.5934857128062847,2022-11-30 03:40:20.683776,2022-11-30 03:40:32.340527,0 days 00:00:11.656751,"{0: 1, 1: 10}",1.0,,760,COMPLETE
1905,1905,0.7042618272826864,2022-11-30 03:40:32.577502,2022-11-30 03:40:49.637818,0 days 00:00:17.060316,"{0: 1, 1: 10}",33.0,0.6,710,COMPLETE
1906,1906,0.7077123485215475,2022-11-30 03:40:49.868223,2022-11-30 03:41:08.591381,0 days 00:00:18.723158,"{0: 1, 1: 10}",3.0,,760,COMPLETE
1907,1907,0.7329079421475908,2022-11-30 03:41:08.834094,2022-11-30 03:41:32.266666,0 days 00:00:23.432572,"{0: 1, 1: 10}",6.0,,760,COMPLETE
1908,1908,0.7193968260173864,2022-11-30 03:41:32.512400,2022-11-30 03:41:55.450847,0 days 00:00:22.938447,"{0: 1, 1: 10}",27.0,,710,COMPLETE
1909,1909,0.7328159924320525,2022-11-30 03:41:55.689865,2022-11-30 03:42:20.511922,0 days 00:00:24.822057,"{0: 1, 1: 10}",6.0,,810,COMPLETE
1910,1910,0.7171073203236897,2022-11-30 03:42:20.753778,2022-11-30 03:42:44.803875,0 days 00:00:24.050097,"{0: 1, 1: 10}",26.0,,760,COMPLETE
1911,1911,0.7310077139961214,2022-11-30 03:42:45.043490,2022-11-30 03:43:07.424383,0 days 00:00:22.380893,"{0: 1, 1: 10}",6.0,,710,COMPLETE
1912,1912,0.7148573873067756,2022-11-30 03:43:07.673155,2022-11-30 03:43:30.602305,0 days 00:00:22.929150,"{0: 1, 1: 10}",25.0,,710,COMPLETE
1913,1913,0.715136233301241,2022-11-30 03:43:30.851860,2022-11-30 03:43:54.791182,0 days 00:00:23.939322,"{0: 1, 1: 10}",34.0,,760,COMPLETE
1914,1914,0.7325083324370373,2022-11-30 03:43:55.019883,2022-11-30 03:44:18.472996,0 days 00:00:23.453113,"{0: 1, 1: 10}",6.0,,760,COMPLETE
1915,1915,0.7167265510272365,2022-11-30 03:44:18.702763,2022-11-30 03:44:43.949958,0 days 00:00:25.247195,"{0: 1, 1: 10}",10.0,,810,COMPLETE
1916,1916,0.7288931621227877,2022-11-30 03:44:44.180220,2022-11-30 03:45:06.485957,0 days 00:00:22.305737,"{0: 1, 1: 10}",6.0,,710,COMPLETE
1917,1917,0.7330252254949943,2022-11-30 03:45:06.723555,2022-11-30 03:45:29.130173,0 days 00:00:22.406618,"{0: 1, 1: 10}",6.0,,710,COMPLETE
1918,1918,0.7164695317170876,2022-11-30 03:45:29.365459,2022-11-30 03:45:53.579787,0 days 00:00:24.214328,"{0: 1, 1: 10}",36.0,,760,COMPLETE
1919,1919,0.7338201117871807,2022-11-30 03:45:53.808729,2022-11-30 03:46:17.346660,0 days 00:00:23.537931,"{0: 1, 1: 10}",6.0,,760,COMPLETE
1920,1920,0.7166098342747286,2022-11-30 03:46:17.578628,2022-11-30 03:46:40.427584,0 days 00:00:22.848956,"{0: 1, 1: 10}",37.0,,710,COMPLETE
1921,1921,0.7106565552844303,2022-11-30 03:46:40.654590,2022-11-30 03:47:02.099449,0 days 00:00:21.444859,"{0: 1, 1: 10}",31.0,0.9,710,COMPLETE
1922,1922,0.7326554543736051,2022-11-30 03:47:02.337455,2022-11-30 03:47:27.087403,0 days 00:00:24.749948,"{0: 1, 1: 10}",6.0,,810,COMPLETE
1923,1923,0.7139319769084671,2022-11-30 03:47:27.314533,2022-11-30 03:47:51.449779,0 days 00:00:24.135246,"{0: 1, 1: 10}",18.0,,760,COMPLETE
1924,1924,0.711324027369508,2022-11-30 03:47:51.679788,2022-11-30 03:48:17.018569,0 days 00:00:25.338781,"{0: 1, 1: 10}",30.0,,810,COMPLETE
1925,1925,0.7181054654553474,2022-11-30 03:48:17.262665,2022-11-30 03:48:40.236544,0 days 00:00:22.973879,"{0: 1, 1: 10}",16.0,,710,COMPLETE
1926,1926,0.7163863481944862,2022-11-30 03:48:40.465858,2022-11-30 03:49:03.288042,0 days 00:00:22.822184,"{0: 1, 1: 10}",11.0,,710,COMPLETE
1927,1927,0.7318622978832944,2022-11-30 03:49:03.523567,2022-11-30 03:49:27.024288,0 days 00:00:23.500721,"{0: 1, 1: 10}",6.0,,760,COMPLETE
1928,1928,0.717419379954257,2022-11-30 03:49:27.256506,2022-11-30 03:49:51.183619,0 days 00:00:23.927113,"{0: 1, 1: 10}",35.0,,760,COMPLETE
1929,1929,0.730704057340795,2022-11-30 03:49:51.425632,2022-11-30 03:50:13.880483,0 days 00:00:22.454851,"{0: 1, 1: 10}",6.0,,710,COMPLETE
1930,1930,0.7153157169127672,2022-11-30 03:50:14.117531,2022-11-30 03:50:35.288926,0 days 00:00:21.171395,"{0: 1, 1: 10}",4.0,,760,COMPLETE
1931,1931,0.7168056510733576,2022-11-30 03:50:35.533108,2022-11-30 03:50:58.372625,0 days 00:00:22.839517,"{0: 1, 1: 10}",38.0,,710,COMPLETE
1932,1932,0.7171931064719181,2022-11-30 03:50:58.608852,2022-11-30 03:51:22.585043,0 days 00:00:23.976191,"{0: 1, 1: 10}",17.0,,760,COMPLETE
1933,1933,0.7215995347473209,2022-11-30 03:51:22.817511,2022-11-30 03:51:41.113796,0 days 00:00:18.296285,"{0: 1, 1: 10}",6.0,0.6,810,COMPLETE
1934,1934,0.7335553117599088,2022-11-30 03:51:41.352903,2022-11-30 03:52:03.625573,0 days 00:00:22.272670,"{0: 1, 1: 10}",6.0,,710,COMPLETE
1935,1935,0.7152033992646919,2022-11-30 03:52:03.865306,2022-11-30 03:52:26.690070,0 days 00:00:22.824764,"{0: 1, 1: 10}",24.0,,710,COMPLETE
1936,1936,0.7122533425051707,2022-11-30 03:52:26.925262,2022-11-30 03:52:51.156109,0 days 00:00:24.230847,"{0: 1, 1: 10}",14.0,,760,COMPLETE
1937,1937,0.7339396311291585,2022-11-30 03:52:51.396536,2022-11-30 03:53:14.954624,0 days 00:00:23.558088,"{0: 1, 1: 10}",6.0,,760,COMPLETE
1938,1938,0.7117030378083828,2022-11-30 03:53:15.188154,2022-11-30 03:53:38.122620,0 days 00:00:22.934466,"{0: 1, 1: 10}",39.0,1.0,710,COMPLETE
1939,1939,0.7156726750625605,2022-11-30 03:53:38.355340,2022-11-30 03:54:03.636665,0 days 00:00:25.281325,"{0: 1, 1: 10}",21.0,,810,COMPLETE
1940,1940,0.7323856578612596,2022-11-30 03:54:03.881560,2022-11-30 03:54:27.660179,0 days 00:00:23.778619,"{0: 1, 1: 10}",6.0,,760,COMPLETE
1941,1941,0.7358899644015986,2022-11-30 03:54:27.897411,2022-11-30 03:54:50.249960,0 days 00:00:22.352549,"{0: 1, 1: 10}",6.0,,710,COMPLETE
1942,1942,0.7125355146962501,2022-11-30 03:54:50.485429,2022-11-30 03:55:13.318757,0 days 00:00:22.833328,"{0: 1, 1: 10}",32.0,,710,COMPLETE
1943,1943,0.7152413113745831,2022-11-30 03:55:13.564436,2022-11-30 03:55:37.608943,0 days 00:00:24.044507,"{0: 1, 1: 10}",13.0,,760,COMPLETE
1944,1944,0.7318697746012205,2022-11-30 03:55:37.837633,2022-11-30 03:56:00.323605,0 days 00:00:22.485972,"{0: 1, 1: 10}",6.0,,710,COMPLETE
1945,1945,0.7117879287279807,2022-11-30 03:56:00.561184,2022-11-30 03:56:25.968675,0 days 00:00:25.407491,"{0: 1, 1: 10}",19.0,,810,COMPLETE
1946,1946,0.7290613564802885,2022-11-30 03:56:26.213235,2022-11-30 03:56:50.160338,0 days 00:00:23.947103,"{0: 1, 1: 10}",7.0,,760,COMPLETE
1947,1947,0.7146244833415814,2022-11-30 03:56:50.388218,2022-11-30 03:57:11.743211,0 days 00:00:21.354993,"{0: 1, 1: 10}",28.0,0.9,710,COMPLETE
1948,1948,0.7244880782447514,2022-11-30 03:57:11.991297,2022-11-30 03:57:32.760468,0 days 00:00:20.769171,"{0: 1, 1: 10}",8.0,0.8,760,COMPLETE
1949,1949,0.6771597309715573,2022-11-30 03:57:32.997812,2022-11-30 03:57:49.118476,0 days 00:00:16.120664,"{0: 1, 1: 10}",2.0,,810,COMPLETE
1950,1950,0.729709300321381,2022-11-30 03:57:49.360351,2022-11-30 03:58:11.743023,0 days 00:00:22.382672,"{0: 1, 1: 10}",6.0,,710,COMPLETE
1951,1951,0.7139899824949426,2022-11-30 03:58:11.979078,2022-11-30 03:58:36.129836,0 days 00:00:24.150758,"{0: 1, 1: 10}",29.0,,760,COMPLETE
1952,1952,0.717402389155746,2022-11-30 03:58:36.369095,2022-11-30 03:58:59.274446,0 days 00:00:22.905351,"{0: 1, 1: 10}",20.0,,710,COMPLETE
1953,1953,0.7145534323793938,2022-11-30 03:58:59.506352,2022-11-30 03:59:23.536747,0 days 00:00:24.030395,"{0: 1, 1: 10}",15.0,,760,COMPLETE
1954,1954,0.7303238134089429,2022-11-30 03:59:23.769230,2022-11-30 03:59:47.244444,0 days 00:00:23.475214,"{0: 1, 1: 10}",6.0,,760,COMPLETE
1955,1955,0.732160400748372,2022-11-30 03:59:47.485748,2022-11-30 04:00:11.154441,0 days 00:00:23.668693,"{0: 1, 1: 10}",6.0,,760,COMPLETE
1956,1956,0.7305142912912388,2022-11-30 04:00:11.384857,2022-11-30 04:00:33.878712,0 days 00:00:22.493855,"{0: 1, 1: 10}",6.0,,710,COMPLETE
1957,1957,0.7141594292725363,2022-11-30 04:00:34.115288,2022-11-30 04:00:57.178777,0 days 00:00:23.063489,"{0: 1, 1: 10}",22.0,,710,COMPLETE
1958,1958,0.7107581069000372,2022-11-30 04:00:57.408667,2022-11-30 04:01:14.505748,0 days 00:00:17.097081,"{0: 1, 1: 10}",12.0,0.6,710,COMPLETE
1959,1959,0.7336448531587745,2022-11-30 04:01:14.734428,2022-11-30 04:01:39.408679,0 days 00:00:24.674251,"{0: 1, 1: 10}",6.0,,810,COMPLETE
1960,1960,0.7117120424722356,2022-11-30 04:01:39.645765,2022-11-30 04:02:03.727395,0 days 00:00:24.081630,"{0: 1, 1: 10}",23.0,,760,COMPLETE
1961,1961,0.5914914554823117,2022-11-30 04:02:03.961534,2022-11-30 04:02:15.255859,0 days 00:00:11.294325,"{0: 1, 1: 10}",1.0,,710,COMPLETE
1962,1962,0.7227251403689448,2022-11-30 04:02:15.493674,2022-11-30 04:02:38.316687,0 days 00:00:22.823013,"{0: 1, 1: 10}",9.0,,710,COMPLETE
1963,1963,0.7324667932548768,2022-11-30 04:02:38.553640,2022-11-30 04:03:02.168188,0 days 00:00:23.614548,"{0: 1, 1: 10}",6.0,,760,COMPLETE
1964,1964,0.7168820749020117,2022-11-30 04:03:02.398697,2022-11-30 04:03:25.108600,0 days 00:00:22.709903,"{0: 1, 1: 10}",,1.0,710,COMPLETE
1965,1965,0.7301142854279628,2022-11-30 04:03:25.356144,2022-11-30 04:03:50.036379,0 days 00:00:24.680235,"{0: 1, 1: 10}",6.0,,810,COMPLETE
1966,1966,0.73044168521803,2022-11-30 04:03:50.276514,2022-11-30 04:04:12.535625,0 days 00:00:22.259111,"{0: 1, 1: 10}",6.0,,710,COMPLETE
1967,1967,0.732310580362876,2022-11-30 04:04:12.770254,2022-11-30 04:04:36.255624,0 days 00:00:23.485370,"{0: 1, 1: 10}",6.0,,760,COMPLETE
1968,1968,0.7114729584579838,2022-11-30 04:04:36.496066,2022-11-30 04:05:00.583579,0 days 00:00:24.087513,"{0: 1, 1: 10}",33.0,,760,COMPLETE
1969,1969,0.7334081263903063,2022-11-30 04:05:00.821748,2022-11-30 04:05:23.128712,0 days 00:00:22.306964,"{0: 1, 1: 10}",6.0,,710,COMPLETE
1970,1970,0.714635795682458,2022-11-30 04:05:23.376950,2022-11-30 04:05:47.484894,0 days 00:00:24.107944,"{0: 1, 1: 10}",34.0,,760,COMPLETE
1971,1971,0.7165568797706223,2022-11-30 04:05:47.723436,2022-11-30 04:06:12.910078,0 days 00:00:25.186642,"{0: 1, 1: 10}",26.0,,810,COMPLETE
1972,1972,0.7317215794662073,2022-11-30 04:06:13.140913,2022-11-30 04:06:36.786621,0 days 00:00:23.645708,"{0: 1, 1: 10}",6.0,,760,COMPLETE
1973,1973,0.7176043819395661,2022-11-30 04:06:37.029890,2022-11-30 04:06:59.892695,0 days 00:00:22.862805,"{0: 1, 1: 10}",36.0,,710,COMPLETE
1974,1974,0.735277769702218,2022-11-30 04:07:00.123960,2022-11-30 04:07:24.936222,0 days 00:00:24.812262,"{0: 1, 1: 10}",6.0,,810,COMPLETE
1975,1975,0.7018255722412001,2022-11-30 04:07:25.168810,2022-11-30 04:07:43.713764,0 days 00:00:18.544954,"{0: 1, 1: 10}",3.0,0.9,810,COMPLETE
1976,1976,0.726001774236823,2022-11-30 04:07:43.951222,2022-11-30 04:08:05.413479,0 days 00:00:21.462257,"{0: 1, 1: 10}",6.0,0.8,810,COMPLETE
1977,1977,0.7179552230029963,2022-11-30 04:08:05.650759,2022-11-30 04:08:31.017285,0 days 00:00:25.366526,"{0: 1, 1: 10}",27.0,,810,COMPLETE
1978,1978,0.7312453275626074,2022-11-30 04:08:31.255841,2022-11-30 04:08:55.870242,0 days 00:00:24.614401,"{0: 1, 1: 10}",6.0,,810,COMPLETE
1979,1979,0.7141736110264068,2022-11-30 04:08:56.103899,2022-11-30 04:09:21.376997,0 days 00:00:25.273098,"{0: 1, 1: 10}",31.0,,810,COMPLETE
1980,1980,0.731426463332111,2022-11-30 04:09:21.614639,2022-11-30 04:09:46.158689,0 days 00:00:24.544050,"{0: 1, 1: 10}",6.0,,810,COMPLETE
1981,1981,0.7182714026012744,2022-11-30 04:09:46.399693,2022-11-30 04:10:11.756217,0 days 00:00:25.356524,"{0: 1, 1: 10}",10.0,,810,COMPLETE
1982,1982,0.7139059859537388,2022-11-30 04:10:12.000688,2022-11-30 04:10:37.290277,0 days 00:00:25.289589,"{0: 1, 1: 10}",18.0,,810,COMPLETE
1983,1983,0.7162698036981106,2022-11-30 04:10:37.532930,2022-11-30 04:11:01.582693,0 days 00:00:24.049763,"{0: 1, 1: 10}",25.0,,760,COMPLETE
1984,1984,0.7169855524655163,2022-11-30 04:11:01.819803,2022-11-30 04:11:27.047615,0 days 00:00:25.227812,"{0: 1, 1: 10}",37.0,,810,COMPLETE
1985,1985,0.7203941065112388,2022-11-30 04:11:27.289726,2022-11-30 04:11:44.783378,0 days 00:00:17.493652,"{0: 1, 1: 10}",6.0,0.6,760,COMPLETE
1986,1986,0.7136991966821206,2022-11-30 04:11:45.022732,2022-11-30 04:12:07.934516,0 days 00:00:22.911784,"{0: 1, 1: 10}",11.0,,710,COMPLETE
1987,1987,0.7162207333196086,2022-11-30 04:12:08.175849,2022-11-30 04:12:32.278486,0 days 00:00:24.102637,"{0: 1, 1: 10}",16.0,,760,COMPLETE
1988,1988,0.7103522026494551,2022-11-30 04:12:32.508588,2022-11-30 04:12:57.845091,0 days 00:00:25.336503,"{0: 1, 1: 10}",30.0,,810,COMPLETE
1989,1989,0.732133616885483,2022-11-30 04:12:58.085849,2022-11-30 04:13:21.653797,0 days 00:00:23.567948,"{0: 1, 1: 10}",6.0,,760,COMPLETE
1990,1990,0.730114920947547,2022-11-30 04:13:21.883859,2022-11-30 04:13:44.293064,0 days 00:00:22.409205,"{0: 1, 1: 10}",6.0,,710,COMPLETE
1991,1991,0.7129691115748696,2022-11-30 04:13:44.527563,2022-11-30 04:14:07.352940,0 days 00:00:22.825377,"{0: 1, 1: 10}",38.0,1.0,710,COMPLETE
1992,1992,0.7114403777719379,2022-11-30 04:14:07.602127,2022-11-30 04:14:33.012671,0 days 00:00:25.410544,"{0: 1, 1: 10}",35.0,,810,COMPLETE
1993,1993,0.7192906373805776,2022-11-30 04:14:33.255840,2022-11-30 04:14:54.417090,0 days 00:00:21.161250,"{0: 1, 1: 10}",4.0,,760,COMPLETE
1994,1994,0.7125233975694518,2022-11-30 04:14:54.648447,2022-11-30 04:15:17.540044,0 days 00:00:22.891597,"{0: 1, 1: 10}",17.0,,710,COMPLETE
1995,1995,0.7133702628567125,2022-11-30 04:15:17.786737,2022-11-30 04:15:40.705309,0 days 00:00:22.918572,"{0: 1, 1: 10}",14.0,,710,COMPLETE
1996,1996,0.7339231401754891,2022-11-30 04:15:40.938281,2022-11-30 04:16:04.601659,0 days 00:00:23.663378,"{0: 1, 1: 10}",6.0,,760,COMPLETE
1997,1997,0.7307786106809,2022-11-30 04:16:04.839509,2022-11-30 04:16:28.485804,0 days 00:00:23.646295,"{0: 1, 1: 10}",6.0,,760,COMPLETE
1998,1998,0.7311443211034608,2022-11-30 04:16:28.732696,2022-11-30 04:16:53.373333,0 days 00:00:24.640637,"{0: 1, 1: 10}",6.0,,810,COMPLETE
1999,1999,0.7170445122591342,2022-11-30 04:16:53.599586,2022-11-30 04:17:18.927797,0 days 00:00:25.328211,"{0: 1, 1: 10}",24.0,,810,COMPLETE
2000,2000,0.7339423359652713,2022-11-30 04:17:19.166256,2022-11-30 04:17:41.413640,0 days 00:00:22.247384,"{0: 1, 1: 10}",6.0,,710,COMPLETE
2001,2001,0.7236431489089407,2022-11-30 04:17:41.651707,2022-11-30 04:18:02.674339,0 days 00:00:21.022632,"{0: 1, 1: 10}",8.0,0.8,760,COMPLETE
2002,2002,0.717091423973889,2022-11-30 04:18:02.910796,2022-11-30 04:18:25.800660,0 days 00:00:22.889864,"{0: 1, 1: 10}",19.0,,710,COMPLETE
2003,2003,0.7325362727386032,2022-11-30 04:18:26.041248,2022-11-30 04:18:48.589360,0 days 00:00:22.548112,"{0: 1, 1: 10}",6.0,,710,COMPLETE
2004,2004,0.7151633060277289,2022-11-30 04:18:48.832576,2022-11-30 04:19:10.248749,0 days 00:00:21.416173,"{0: 1, 1: 10}",21.0,0.9,710,COMPLETE
2005,2005,0.7139400282003968,2022-11-30 04:19:10.486870,2022-11-30 04:19:34.479885,0 days 00:00:23.993015,"{0: 1, 1: 10}",13.0,,760,COMPLETE
2006,2006,0.7122196802355254,2022-11-30 04:19:34.712104,2022-11-30 04:20:00.067614,0 days 00:00:25.355510,"{0: 1, 1: 10}",32.0,,810,COMPLETE
2007,2007,0.6731364320648204,2022-11-30 04:20:00.316882,2022-11-30 04:20:16.052351,0 days 00:00:15.735469,"{0: 1, 1: 10}",2.0,,760,COMPLETE
2008,2008,0.7306625034789161,2022-11-30 04:20:16.290238,2022-11-30 04:20:38.907220,0 days 00:00:22.616982,"{0: 1, 1: 10}",6.0,,710,COMPLETE
2009,2009,0.7332293051600758,2022-11-30 04:20:39.144829,2022-11-30 04:21:02.665465,0 days 00:00:23.520636,"{0: 1, 1: 10}",6.0,,760,COMPLETE
2010,2010,0.7317007297020867,2022-11-30 04:21:02.902691,2022-11-30 04:21:25.408427,0 days 00:00:22.505736,"{0: 1, 1: 10}",6.0,,710,COMPLETE
2011,2011,0.7291963960486927,2022-11-30 04:21:25.641844,2022-11-30 04:21:49.289671,0 days 00:00:23.647827,"{0: 1, 1: 10}",6.0,,760,COMPLETE
2012,2012,0.7135407124190867,2022-11-30 04:21:49.519958,2022-11-30 04:22:14.959594,0 days 00:00:25.439636,"{0: 1, 1: 10}",29.0,,810,COMPLETE
2013,2013,0.7034386830370428,2022-11-30 04:22:15.191912,2022-11-30 04:22:32.222315,0 days 00:00:17.030403,"{0: 1, 1: 10}",39.0,0.6,710,COMPLETE
2014,2014,0.7312430180778685,2022-11-30 04:22:32.454000,2022-11-30 04:22:55.091152,0 days 00:00:22.637152,"{0: 1, 1: 10}",7.0,,710,COMPLETE
2015,2015,0.7161697215245457,2022-11-30 04:22:55.341123,2022-11-30 04:23:19.554529,0 days 00:00:24.213406,"{0: 1, 1: 10}",12.0,,760,COMPLETE
2016,2016,0.7157750133568501,2022-11-30 04:23:19.801997,2022-11-30 04:23:45.220841,0 days 00:00:25.418844,"{0: 1, 1: 10}",15.0,,810,COMPLETE
2017,2017,0.7155005241097923,2022-11-30 04:23:45.460270,2022-11-30 04:24:09.670510,0 days 00:00:24.210240,"{0: 1, 1: 10}",28.0,,760,COMPLETE
2018,2018,0.731786306500553,2022-11-30 04:24:09.906133,2022-11-30 04:24:32.386247,0 days 00:00:22.480114,"{0: 1, 1: 10}",6.0,,710,COMPLETE
2019,2019,0.711322932887612,2022-11-30 04:24:32.617382,2022-11-30 04:24:54.274423,0 days 00:00:21.657041,"{0: 1, 1: 10}",,,660,COMPLETE
2020,2020,0.7321992817578404,2022-11-30 04:24:54.522733,2022-11-30 04:25:18.187975,0 days 00:00:23.665242,"{0: 1, 1: 10}",6.0,1.0,760,COMPLETE
2021,2021,0.7170707448866099,2022-11-30 04:25:18.421219,2022-11-30 04:25:42.606480,0 days 00:00:24.185261,"{0: 1, 1: 10}",23.0,,760,COMPLETE
2022,2022,0.7308478819367404,2022-11-30 04:25:42.851216,2022-11-30 04:26:04.009894,0 days 00:00:21.158678,"{0: 1, 1: 10}",6.0,,660,COMPLETE
2023,2023,0.7151817857324981,2022-11-30 04:26:04.248379,2022-11-30 04:26:27.166215,0 days 00:00:22.917836,"{0: 1, 1: 10}",20.0,,710,COMPLETE
2024,2024,0.7137242778784318,2022-11-30 04:26:27.404714,2022-11-30 04:26:48.943056,0 days 00:00:21.538342,"{0: 1, 1: 10}",22.0,,660,COMPLETE
2025,2025,0.7224836590518885,2022-11-30 04:26:49.178550,2022-11-30 04:27:11.912117,0 days 00:00:22.733567,"{0: 1, 1: 10}",9.0,,710,COMPLETE
2026,2026,0.6189988797093907,2022-11-30 04:27:12.159288,2022-11-30 04:27:22.400118,0 days 00:00:10.240830,"{0: 1, 1: 10}",6.0,log2,760,COMPLETE
2027,2027,0.7332982051991832,2022-11-30 04:27:22.631043,2022-11-30 04:27:47.457543,0 days 00:00:24.826500,"{0: 1, 1: 10}",6.0,,810,COMPLETE
2028,2028,0.7303840440210905,2022-11-30 04:27:47.689439,2022-11-30 04:28:10.151459,0 days 00:00:22.462020,"{0: 1, 1: 10}",6.0,,710,COMPLETE
2029,2029,0.7334347637510031,2022-11-30 04:28:10.389353,2022-11-30 04:28:31.637976,0 days 00:00:21.248623,"{0: 1, 1: 10}",6.0,,660,COMPLETE
2030,2030,0.695129570308663,2022-11-30 04:28:31.881060,2022-11-30 04:28:47.107573,0 days 00:00:15.226513,"{0: 1, 1: 10}",3.0,0.8,660,COMPLETE
2031,2031,0.7170266894537266,2022-11-30 04:28:47.348612,2022-11-30 04:29:11.462843,0 days 00:00:24.114231,"{0: 1, 1: 10}",33.0,,760,COMPLETE
2032,2032,0.5857863050783882,2022-11-30 04:29:11.702189,2022-11-30 04:29:22.615457,0 days 00:00:10.913268,"{0: 1, 1: 10}",1.0,0.9,710,COMPLETE
2033,2033,0.7320396856440006,2022-11-30 04:29:22.849067,2022-11-30 04:29:47.510940,0 days 00:00:24.661873,"{0: 1, 1: 10}",6.0,,810,COMPLETE
2034,2034,0.7156717318136475,2022-11-30 04:29:47.749331,2022-11-30 04:30:09.476707,0 days 00:00:21.727376,"{0: 1, 1: 10}",26.0,,660,COMPLETE
2035,2035,0.7076219357126962,2022-11-30 04:30:09.718721,2022-11-30 04:30:33.980039,0 days 00:00:24.261318,"{0: 1, 1: 10}",27.0,,760,COMPLETE
2036,2036,0.733657868854038,2022-11-30 04:30:34.216112,2022-11-30 04:30:56.729927,0 days 00:00:22.513815,"{0: 1, 1: 10}",6.0,,710,COMPLETE
2037,2037,0.7157671301416889,2022-11-30 04:30:56.960080,2022-11-30 04:31:18.691544,0 days 00:00:21.731464,"{0: 1, 1: 10}",25.0,,660,COMPLETE
2038,2038,0.7157236393423176,2022-11-30 04:31:18.927880,2022-11-30 04:31:42.930160,0 days 00:00:24.002280,"{0: 1, 1: 10}",10.0,,760,COMPLETE
2039,2039,0.7168400349428347,2022-11-30 04:31:43.170156,2022-11-30 04:32:06.134365,0 days 00:00:22.964209,"{0: 1, 1: 10}",36.0,,710,COMPLETE
2040,2040,0.7137336104890112,2022-11-30 04:32:06.381534,2022-11-30 04:32:31.923896,0 days 00:00:25.542362,"{0: 1, 1: 10}",34.0,,810,COMPLETE
2041,2041,0.7306611648237058,2022-11-30 04:32:32.155612,2022-11-30 04:32:53.284451,0 days 00:00:21.128839,"{0: 1, 1: 10}",6.0,,660,COMPLETE
2042,2042,0.7303238758769378,2022-11-30 04:32:53.525164,2022-11-30 04:33:17.158377,0 days 00:00:23.633213,"{0: 1, 1: 10}",6.0,,760,COMPLETE
2043,2043,0.7188050778329602,2022-11-30 04:33:17.396083,2022-11-30 04:33:33.366301,0 days 00:00:15.970218,"{0: 1, 1: 10}",6.0,0.6,660,COMPLETE
2044,2044,0.7165113417265292,2022-11-30 04:33:33.594856,2022-11-30 04:33:56.467939,0 days 00:00:22.873083,"{0: 1, 1: 10}",31.0,,710,COMPLETE
2045,2045,0.7165655003443034,2022-11-30 04:33:56.707582,2022-11-30 04:34:23.230972,0 days 00:00:26.523390,"{0: 1, 1: 10}",37.0,,860,COMPLETE
2046,2046,0.719638657630497,2022-11-30 04:34:23.471558,2022-11-30 04:34:46.334980,0 days 00:00:22.863422,"{0: 1, 1: 10}",11.0,,710,COMPLETE
2047,2047,0.712404191441333,2022-11-30 04:34:46.573230,2022-11-30 04:35:08.251448,0 days 00:00:21.678218,"{0: 1, 1: 10}",16.0,,660,COMPLETE
2048,2048,0.7333493449264169,2022-11-30 04:35:08.495924,2022-11-30 04:35:33.121551,0 days 00:00:24.625627,"{0: 1, 1: 10}",6.0,,810,COMPLETE
2049,2049,0.7156035404824166,2022-11-30 04:35:33.356353,2022-11-30 04:35:57.584075,0 days 00:00:24.227722,"{0: 1, 1: 10}",18.0,,760,COMPLETE
