,number,value,datetime_start,datetime_complete,duration,params_class_weight,params_max_depth,params_max_features,params_n_estimators,state
1118,1118,0.7320399731993159,2022-11-29 23:12:58.961620,2022-11-29 23:13:16.487934,0 days 00:00:17.526314,"{0: 1, 1: 10}",6.0,,510,COMPLETE
1119,1119,0.733649229024256,2022-11-29 23:13:16.707530,2022-11-29 23:13:34.455454,0 days 00:00:17.747924,"{0: 1, 1: 10}",6.0,,510,COMPLETE
1120,1120,0.7329065020435556,2022-11-29 23:13:34.674887,2022-11-29 23:13:52.352874,0 days 00:00:17.677987,"{0: 1, 1: 10}",6.0,,510,COMPLETE
1121,1121,0.7330574729483482,2022-11-29 23:13:52.582777,2022-11-29 23:14:10.397650,0 days 00:00:17.814873,"{0: 1, 1: 10}",6.0,,510,COMPLETE
1122,1122,0.732050306618079,2022-11-29 23:14:10.622036,2022-11-29 23:14:28.312262,0 days 00:00:17.690226,"{0: 1, 1: 10}",6.0,,510,COMPLETE
1123,1123,0.7292604248759726,2022-11-29 23:14:28.530148,2022-11-29 23:14:46.226110,0 days 00:00:17.695962,"{0: 1, 1: 10}",6.0,,510,COMPLETE
1124,1124,0.7322308622847156,2022-11-29 23:14:46.453276,2022-11-29 23:15:03.949079,0 days 00:00:17.495803,"{0: 1, 1: 10}",6.0,,510,COMPLETE
1125,1125,0.733198892993346,2022-11-29 23:15:04.169053,2022-11-29 23:15:21.859738,0 days 00:00:17.690685,"{0: 1, 1: 10}",6.0,,510,COMPLETE
1126,1126,0.7289160235172101,2022-11-29 23:15:22.112120,2022-11-29 23:15:39.705847,0 days 00:00:17.593727,"{0: 1, 1: 10}",6.0,,510,COMPLETE
1127,1127,0.7304509545055873,2022-11-29 23:15:39.935548,2022-11-29 23:15:57.429645,0 days 00:00:17.494097,"{0: 1, 1: 10}",6.0,,510,COMPLETE
1128,1128,0.7327790452525045,2022-11-29 23:15:57.650087,2022-11-29 23:16:15.250989,0 days 00:00:17.600902,"{0: 1, 1: 10}",6.0,,510,COMPLETE
1129,1129,0.7300237824891302,2022-11-29 23:16:15.473116,2022-11-29 23:16:33.078990,0 days 00:00:17.605874,"{0: 1, 1: 10}",6.0,,510,COMPLETE
1130,1130,0.7316252454755571,2022-11-29 23:16:33.300615,2022-11-29 23:16:51.089279,0 days 00:00:17.788664,"{0: 1, 1: 10}",6.0,,510,COMPLETE
1131,1131,0.7332597864487596,2022-11-29 23:16:51.305652,2022-11-29 23:17:10.001730,0 days 00:00:18.696078,"{0: 1, 1: 10}",6.0,,560,COMPLETE
1132,1132,0.7306947208312846,2022-11-29 23:17:10.220165,2022-11-29 23:17:29.054352,0 days 00:00:18.834187,"{0: 1, 1: 10}",6.0,,560,COMPLETE
1133,1133,0.7303720562906892,2022-11-29 23:17:29.273240,2022-11-29 23:17:47.970884,0 days 00:00:18.697644,"{0: 1, 1: 10}",6.0,,560,COMPLETE
1134,1134,0.7320940058065774,2022-11-29 23:17:48.194412,2022-11-29 23:18:06.910614,0 days 00:00:18.716202,"{0: 1, 1: 10}",6.0,,560,COMPLETE
1135,1135,0.72752699213814,2022-11-29 23:18:07.125776,2022-11-29 23:18:25.974544,0 days 00:00:18.848768,"{0: 1, 1: 10}",6.0,,560,COMPLETE
1136,1136,0.7310861460571141,2022-11-29 23:18:26.190777,2022-11-29 23:18:45.231968,0 days 00:00:19.041191,"{0: 1, 1: 10}",6.0,,560,COMPLETE
1137,1137,0.7307157092538883,2022-11-29 23:18:45.451741,2022-11-29 23:19:04.179655,0 days 00:00:18.727914,"{0: 1, 1: 10}",6.0,,560,COMPLETE
1138,1138,0.7292607217775342,2022-11-29 23:19:04.403061,2022-11-29 23:19:22.038501,0 days 00:00:17.635440,"{0: 1, 1: 10}",6.0,,510,COMPLETE
1139,1139,0.7318457506039158,2022-11-29 23:19:22.254676,2022-11-29 23:19:39.864073,0 days 00:00:17.609397,"{0: 1, 1: 10}",6.0,,510,COMPLETE
1140,1140,0.7317414019110805,2022-11-29 23:19:40.087964,2022-11-29 23:19:58.816693,0 days 00:00:18.728729,"{0: 1, 1: 10}",6.0,,560,COMPLETE
1141,1141,0.7290903924309868,2022-11-29 23:19:59.033632,2022-11-29 23:20:16.713269,0 days 00:00:17.679637,"{0: 1, 1: 10}",6.0,,510,COMPLETE
1142,1142,0.731428808779366,2022-11-29 23:20:16.935863,2022-11-29 23:20:34.607172,0 days 00:00:17.671309,"{0: 1, 1: 10}",6.0,,510,COMPLETE
1143,1143,0.7298878863965089,2022-11-29 23:20:34.829732,2022-11-29 23:20:53.670209,0 days 00:00:18.840477,"{0: 1, 1: 10}",6.0,,560,COMPLETE
1144,1144,0.7310184445769423,2022-11-29 23:20:53.891359,2022-11-29 23:21:11.507995,0 days 00:00:17.616636,"{0: 1, 1: 10}",6.0,,510,COMPLETE
1145,1145,0.7335309533412816,2022-11-29 23:21:11.729936,2022-11-29 23:21:29.376403,0 days 00:00:17.646467,"{0: 1, 1: 10}",6.0,,510,COMPLETE
1146,1146,0.7332212712221416,2022-11-29 23:21:29.598979,2022-11-29 23:21:48.425430,0 days 00:00:18.826451,"{0: 1, 1: 10}",6.0,,560,COMPLETE
1147,1147,0.7296622842678413,2022-11-29 23:21:48.643227,2022-11-29 23:22:07.634885,0 days 00:00:18.991658,"{0: 1, 1: 10}",6.0,,560,COMPLETE
1148,1148,0.7291715871076724,2022-11-29 23:22:07.854608,2022-11-29 23:22:26.891802,0 days 00:00:19.037194,"{0: 1, 1: 10}",6.0,,560,COMPLETE
1149,1149,0.732863493021553,2022-11-29 23:22:27.121070,2022-11-29 23:22:45.838647,0 days 00:00:18.717577,"{0: 1, 1: 10}",6.0,,560,COMPLETE
1150,1150,0.7344377597046169,2022-11-29 23:22:46.053471,2022-11-29 23:23:03.783320,0 days 00:00:17.729849,"{0: 1, 1: 10}",6.0,,510,COMPLETE
1151,1151,0.7320538205406723,2022-11-29 23:23:04.006494,2022-11-29 23:23:21.654304,0 days 00:00:17.647810,"{0: 1, 1: 10}",6.0,,510,COMPLETE
1152,1152,0.7297866318665017,2022-11-29 23:23:21.868947,2022-11-29 23:23:39.577139,0 days 00:00:17.708192,"{0: 1, 1: 10}",6.0,,510,COMPLETE
1153,1153,0.7290389287561528,2022-11-29 23:23:39.798862,2022-11-29 23:23:58.598609,0 days 00:00:18.799747,"{0: 1, 1: 10}",6.0,,560,COMPLETE
1154,1154,0.728322921370161,2022-11-29 23:23:58.813971,2022-11-29 23:24:16.445744,0 days 00:00:17.631773,"{0: 1, 1: 10}",6.0,,510,COMPLETE
1155,1155,0.7341152102834987,2022-11-29 23:24:16.663036,2022-11-29 23:24:35.312779,0 days 00:00:18.649743,"{0: 1, 1: 10}",6.0,,560,COMPLETE
1156,1156,0.7316663834658186,2022-11-29 23:24:35.530254,2022-11-29 23:24:54.343965,0 days 00:00:18.813711,"{0: 1, 1: 10}",6.0,,560,COMPLETE
1157,1157,0.7329918968815787,2022-11-29 23:24:54.565469,2022-11-29 23:25:13.337831,0 days 00:00:18.772362,"{0: 1, 1: 10}",6.0,,560,COMPLETE
1158,1158,0.7288534594443115,2022-11-29 23:25:13.559225,2022-11-29 23:25:32.541324,0 days 00:00:18.982099,"{0: 1, 1: 10}",6.0,,560,COMPLETE
1159,1159,0.7322444467958148,2022-11-29 23:25:32.761576,2022-11-29 23:25:51.498885,0 days 00:00:18.737309,"{0: 1, 1: 10}",6.0,,560,COMPLETE
1160,1160,0.7330302785702127,2022-11-29 23:25:51.713702,2022-11-29 23:26:10.555483,0 days 00:00:18.841781,"{0: 1, 1: 10}",6.0,,560,COMPLETE
1161,1161,0.7313307051945861,2022-11-29 23:26:10.771926,2022-11-29 23:26:29.548628,0 days 00:00:18.776702,"{0: 1, 1: 10}",6.0,,560,COMPLETE
1162,1162,0.7303602970950629,2022-11-29 23:26:29.769123,2022-11-29 23:26:48.538078,0 days 00:00:18.768955,"{0: 1, 1: 10}",6.0,,560,COMPLETE
1163,1163,0.7353096539447337,2022-11-29 23:26:48.759067,2022-11-29 23:27:07.654451,0 days 00:00:18.895384,"{0: 1, 1: 10}",6.0,,560,COMPLETE
1164,1164,0.7309947085672828,2022-11-29 23:27:07.877456,2022-11-29 23:27:26.649214,0 days 00:00:18.771758,"{0: 1, 1: 10}",6.0,,560,COMPLETE
1165,1165,0.7321277394528863,2022-11-29 23:27:26.870980,2022-11-29 23:27:45.695671,0 days 00:00:18.824691,"{0: 1, 1: 10}",6.0,,560,COMPLETE
1166,1166,0.7319816747308663,2022-11-29 23:27:45.917462,2022-11-29 23:28:04.801512,0 days 00:00:18.884050,"{0: 1, 1: 10}",6.0,,560,COMPLETE
1167,1167,0.7300162222408896,2022-11-29 23:28:05.038824,2022-11-29 23:28:23.850109,0 days 00:00:18.811285,"{0: 1, 1: 10}",6.0,,560,COMPLETE
1168,1168,0.7267835463693875,2022-11-29 23:28:24.070302,2022-11-29 23:28:42.825916,0 days 00:00:18.755614,"{0: 1, 1: 10}",6.0,,560,COMPLETE
1169,1169,0.7318780789608695,2022-11-29 23:28:43.051977,2022-11-29 23:29:01.907146,0 days 00:00:18.855169,"{0: 1, 1: 10}",6.0,,560,COMPLETE
1170,1170,0.7262334009571747,2022-11-29 23:29:02.127875,2022-11-29 23:29:20.869832,0 days 00:00:18.741957,"{0: 1, 1: 10}",6.0,,560,COMPLETE
1171,1171,0.7304891955489243,2022-11-29 23:29:21.089251,2022-11-29 23:29:38.712768,0 days 00:00:17.623517,"{0: 1, 1: 10}",6.0,,510,COMPLETE
1172,1172,0.7318793257806295,2022-11-29 23:29:38.935592,2022-11-29 23:29:57.660058,0 days 00:00:18.724466,"{0: 1, 1: 10}",6.0,,560,COMPLETE
1173,1173,0.7279107234297693,2022-11-29 23:29:57.883840,2022-11-29 23:30:15.603753,0 days 00:00:17.719913,"{0: 1, 1: 10}",6.0,,510,COMPLETE
1174,1174,0.7300844261242654,2022-11-29 23:30:15.827058,2022-11-29 23:30:34.653422,0 days 00:00:18.826364,"{0: 1, 1: 10}",6.0,,560,COMPLETE
1175,1175,0.7314680253963305,2022-11-29 23:30:34.877153,2022-11-29 23:30:52.588470,0 days 00:00:17.711317,"{0: 1, 1: 10}",6.0,,510,COMPLETE
1176,1176,0.7315994738131728,2022-11-29 23:30:52.809679,2022-11-29 23:31:10.367573,0 days 00:00:17.557894,"{0: 1, 1: 10}",6.0,,510,COMPLETE
1177,1177,0.7295804968754909,2022-11-29 23:31:10.590639,2022-11-29 23:31:28.283987,0 days 00:00:17.693348,"{0: 1, 1: 10}",6.0,,510,COMPLETE
1178,1178,0.7312881738735251,2022-11-29 23:31:28.507801,2022-11-29 23:31:47.365737,0 days 00:00:18.857936,"{0: 1, 1: 10}",6.0,,560,COMPLETE
1179,1179,0.7280612249679416,2022-11-29 23:31:47.593415,2022-11-29 23:32:05.169744,0 days 00:00:17.576329,"{0: 1, 1: 10}",6.0,,510,COMPLETE
1180,1180,0.7283583246623986,2022-11-29 23:32:05.393143,2022-11-29 23:32:24.249142,0 days 00:00:18.855999,"{0: 1, 1: 10}",6.0,,560,COMPLETE
1181,1181,0.7314933583735727,2022-11-29 23:32:24.464879,2022-11-29 23:32:43.115438,0 days 00:00:18.650559,"{0: 1, 1: 10}",6.0,,560,COMPLETE
1182,1182,0.7286240674430973,2022-11-29 23:32:43.337631,2022-11-29 23:33:00.993960,0 days 00:00:17.656329,"{0: 1, 1: 10}",6.0,,510,COMPLETE
1183,1183,0.7338660966616033,2022-11-29 23:33:01.219083,2022-11-29 23:33:18.958548,0 days 00:00:17.739465,"{0: 1, 1: 10}",6.0,,510,COMPLETE
1184,1184,0.7322952593960028,2022-11-29 23:33:19.175941,2022-11-29 23:33:36.886695,0 days 00:00:17.710754,"{0: 1, 1: 10}",6.0,,510,COMPLETE
1185,1185,0.7309422760136439,2022-11-29 23:33:37.103538,2022-11-29 23:33:55.931046,0 days 00:00:18.827508,"{0: 1, 1: 10}",6.0,,560,COMPLETE
1186,1186,0.7332494669608266,2022-11-29 23:33:56.153373,2022-11-29 23:34:13.767870,0 days 00:00:17.614497,"{0: 1, 1: 10}",6.0,,510,COMPLETE
1187,1187,0.7315177999042266,2022-11-29 23:34:14.026836,2022-11-29 23:34:31.714528,0 days 00:00:17.687692,"{0: 1, 1: 10}",6.0,,510,COMPLETE
1188,1188,0.7327680347357262,2022-11-29 23:34:31.946122,2022-11-29 23:34:49.698751,0 days 00:00:17.752629,"{0: 1, 1: 10}",6.0,,510,COMPLETE
1189,1189,0.7304883679564558,2022-11-29 23:34:49.922249,2022-11-29 23:35:07.569661,0 days 00:00:17.647412,"{0: 1, 1: 10}",6.0,,510,COMPLETE
1190,1190,0.7329244741767196,2022-11-29 23:35:07.793831,2022-11-29 23:35:25.450462,0 days 00:00:17.656631,"{0: 1, 1: 10}",6.0,,510,COMPLETE
1191,1191,0.7319532023871507,2022-11-29 23:35:25.673074,2022-11-29 23:35:43.383069,0 days 00:00:17.709995,"{0: 1, 1: 10}",6.0,,510,COMPLETE
1192,1192,0.7277293610277646,2022-11-29 23:35:43.596728,2022-11-29 23:36:01.193061,0 days 00:00:17.596333,"{0: 1, 1: 10}",6.0,,510,COMPLETE
1193,1193,0.73175811644922,2022-11-29 23:36:01.421814,2022-11-29 23:36:20.376019,0 days 00:00:18.954205,"{0: 1, 1: 10}",6.0,,560,COMPLETE
1194,1194,0.7277438977773951,2022-11-29 23:36:20.594913,2022-11-29 23:36:38.255592,0 days 00:00:17.660679,"{0: 1, 1: 10}",6.0,,510,COMPLETE
1195,1195,0.7310859988390743,2022-11-29 23:36:38.481239,2022-11-29 23:36:55.976035,0 days 00:00:17.494796,"{0: 1, 1: 10}",6.0,,510,COMPLETE
1196,1196,0.7298829643098561,2022-11-29 23:36:56.202965,2022-11-29 23:37:15.165520,0 days 00:00:18.962555,"{0: 1, 1: 10}",6.0,,560,COMPLETE
1197,1197,0.7315693873228273,2022-11-29 23:37:15.386467,2022-11-29 23:37:34.250333,0 days 00:00:18.863866,"{0: 1, 1: 10}",6.0,,560,COMPLETE
1198,1198,0.7306993912158729,2022-11-29 23:37:34.473213,2022-11-29 23:37:52.105965,0 days 00:00:17.632752,"{0: 1, 1: 10}",6.0,,510,COMPLETE
1199,1199,0.7339971048175203,2022-11-29 23:37:52.330194,2022-11-29 23:38:09.830443,0 days 00:00:17.500249,"{0: 1, 1: 10}",6.0,,510,COMPLETE
1200,1200,0.7336655529337861,2022-11-29 23:38:10.061795,2022-11-29 23:38:28.835500,0 days 00:00:18.773705,"{0: 1, 1: 10}",6.0,,560,COMPLETE
1201,1201,0.7326016056617888,2022-11-29 23:38:29.055959,2022-11-29 23:38:47.770728,0 days 00:00:18.714769,"{0: 1, 1: 10}",6.0,,560,COMPLETE
1202,1202,0.7299487963821899,2022-11-29 23:38:47.998407,2022-11-29 23:39:06.666185,0 days 00:00:18.667778,"{0: 1, 1: 10}",6.0,,560,COMPLETE
1203,1203,0.7319505722103538,2022-11-29 23:39:06.888695,2022-11-29 23:39:25.742882,0 days 00:00:18.854187,"{0: 1, 1: 10}",6.0,,560,COMPLETE
1204,1204,0.7337606153009568,2022-11-29 23:39:25.972725,2022-11-29 23:39:43.507555,0 days 00:00:17.534830,"{0: 1, 1: 10}",6.0,,510,COMPLETE
1205,1205,0.7340800421378578,2022-11-29 23:39:43.742918,2022-11-29 23:40:02.826906,0 days 00:00:19.083988,"{0: 1, 1: 10}",6.0,,560,COMPLETE
1206,1206,0.729587366058824,2022-11-29 23:40:03.045134,2022-11-29 23:40:21.863519,0 days 00:00:18.818385,"{0: 1, 1: 10}",6.0,,560,COMPLETE
1207,1207,0.7327302761795556,2022-11-29 23:40:22.086033,2022-11-29 23:40:40.944772,0 days 00:00:18.858739,"{0: 1, 1: 10}",6.0,,560,COMPLETE
1208,1208,0.7336688078910483,2022-11-29 23:40:41.160530,2022-11-29 23:41:00.040016,0 days 00:00:18.879486,"{0: 1, 1: 10}",6.0,,560,COMPLETE
1209,1209,0.7294285148069042,2022-11-29 23:41:00.264231,2022-11-29 23:41:19.186500,0 days 00:00:18.922269,"{0: 1, 1: 10}",6.0,,560,COMPLETE
1210,1210,0.7321145989286888,2022-11-29 23:41:19.408219,2022-11-29 23:41:38.319682,0 days 00:00:18.911463,"{0: 1, 1: 10}",6.0,,560,COMPLETE
1211,1211,0.7328555819123831,2022-11-29 23:41:38.551378,2022-11-29 23:41:56.080227,0 days 00:00:17.528849,"{0: 1, 1: 10}",6.0,,510,COMPLETE
1212,1212,0.7309360157557092,2022-11-29 23:41:56.305871,2022-11-29 23:42:15.016563,0 days 00:00:18.710692,"{0: 1, 1: 10}",6.0,,560,COMPLETE
1213,1213,0.7292267472021885,2022-11-29 23:42:15.233834,2022-11-29 23:42:32.800039,0 days 00:00:17.566205,"{0: 1, 1: 10}",6.0,,510,COMPLETE
1214,1214,0.7321917737624689,2022-11-29 23:42:33.025064,2022-11-29 23:42:51.930996,0 days 00:00:18.905932,"{0: 1, 1: 10}",6.0,,560,COMPLETE
1215,1215,0.7324601214037832,2022-11-29 23:42:52.150758,2022-11-29 23:43:09.779939,0 days 00:00:17.629181,"{0: 1, 1: 10}",6.0,,510,COMPLETE
1216,1216,0.7180701525032914,2022-11-29 23:43:10.000373,2022-11-29 23:43:27.043621,0 days 00:00:17.043248,"{0: 1, 1: 10}",4.0,,560,COMPLETE
1217,1217,0.7305763012894784,2022-11-29 23:43:27.268140,2022-11-29 23:43:44.909144,0 days 00:00:17.641004,"{0: 1, 1: 10}",6.0,,510,COMPLETE
1218,1218,0.729086157108817,2022-11-29 23:43:45.129899,2022-11-29 23:44:03.910667,0 days 00:00:18.780768,"{0: 1, 1: 10}",6.0,,560,COMPLETE
1219,1219,0.7276257062853875,2022-11-29 23:44:04.134163,2022-11-29 23:44:21.702386,0 days 00:00:17.568223,"{0: 1, 1: 10}",6.0,,510,COMPLETE
1220,1220,0.7312088364767823,2022-11-29 23:44:21.927883,2022-11-29 23:44:40.723572,0 days 00:00:18.795689,"{0: 1, 1: 10}",6.0,,560,COMPLETE
1221,1221,0.7280225804861259,2022-11-29 23:44:40.946223,2022-11-29 23:44:58.453541,0 days 00:00:17.507318,"{0: 1, 1: 10}",6.0,,510,COMPLETE
1222,1222,0.7302126012296933,2022-11-29 23:44:58.670549,2022-11-29 23:45:16.243916,0 days 00:00:17.573367,"{0: 1, 1: 10}",6.0,,510,COMPLETE
1223,1223,0.7326460581746925,2022-11-29 23:45:16.462781,2022-11-29 23:45:35.246269,0 days 00:00:18.783488,"{0: 1, 1: 10}",6.0,,560,COMPLETE
1224,1224,0.7313215614649067,2022-11-29 23:45:35.461683,2022-11-29 23:45:53.043980,0 days 00:00:17.582297,"{0: 1, 1: 10}",6.0,,510,COMPLETE
1225,1225,0.7298932991531479,2022-11-29 23:45:53.278323,2022-11-29 23:46:12.059874,0 days 00:00:18.781551,"{0: 1, 1: 10}",6.0,,560,COMPLETE
1226,1226,0.7153116489952988,2022-11-29 23:46:12.290659,2022-11-29 23:46:30.278461,0 days 00:00:17.987802,"{0: 1, 1: 10}",12.0,,510,COMPLETE
1227,1227,0.7280808479462626,2022-11-29 23:46:30.506149,2022-11-29 23:46:49.124423,0 days 00:00:18.618274,"{0: 1, 1: 10}",6.0,,560,COMPLETE
1228,1228,0.72959366050283,2022-11-29 23:46:49.350075,2022-11-29 23:47:06.963994,0 days 00:00:17.613919,"{0: 1, 1: 10}",6.0,,510,COMPLETE
1229,1229,0.7336854711375074,2022-11-29 23:47:07.185080,2022-11-29 23:47:25.997528,0 days 00:00:18.812448,"{0: 1, 1: 10}",6.0,,560,COMPLETE
1230,1230,0.7320354966002128,2022-11-29 23:47:26.216261,2022-11-29 23:47:44.933618,0 days 00:00:18.717357,"{0: 1, 1: 10}",6.0,,560,COMPLETE
1231,1231,0.730529110328533,2022-11-29 23:47:45.154352,2022-11-29 23:48:03.949184,0 days 00:00:18.794832,"{0: 1, 1: 10}",6.0,,560,COMPLETE
1232,1232,0.7292610187539224,2022-11-29 23:48:04.165555,2022-11-29 23:48:22.995805,0 days 00:00:18.830250,"{0: 1, 1: 10}",6.0,,560,COMPLETE
1233,1233,0.7327368817080235,2022-11-29 23:48:23.221389,2022-11-29 23:48:41.942312,0 days 00:00:18.720923,"{0: 1, 1: 10}",6.0,,560,COMPLETE
1234,1234,0.7324340062118047,2022-11-29 23:48:42.168260,2022-11-29 23:49:02.044317,0 days 00:00:19.876057,"{0: 1, 1: 10}",6.0,,610,COMPLETE
1235,1235,0.7320433340485297,2022-11-29 23:49:02.267337,2022-11-29 23:49:21.017718,0 days 00:00:18.750381,"{0: 1, 1: 10}",6.0,,560,COMPLETE
1236,1236,0.7324861218884348,2022-11-29 23:49:21.236331,2022-11-29 23:49:40.070242,0 days 00:00:18.833911,"{0: 1, 1: 10}",6.0,,560,COMPLETE
1237,1237,0.7277944856943795,2022-11-29 23:49:40.305346,2022-11-29 23:49:57.844124,0 days 00:00:17.538778,"{0: 1, 1: 10}",6.0,,510,COMPLETE
1238,1238,0.7291994837566792,2022-11-29 23:49:58.060161,2022-11-29 23:50:16.868907,0 days 00:00:18.808746,"{0: 1, 1: 10}",6.0,,560,COMPLETE
1239,1239,0.7325091448554342,2022-11-29 23:50:17.088745,2022-11-29 23:50:34.612282,0 days 00:00:17.523537,"{0: 1, 1: 10}",6.0,,510,COMPLETE
1240,1240,0.7300128390962333,2022-11-29 23:50:34.840242,2022-11-29 23:50:53.624518,0 days 00:00:18.784276,"{0: 1, 1: 10}",6.0,,560,COMPLETE
1241,1241,0.7337892887945495,2022-11-29 23:50:53.859385,2022-11-29 23:51:13.885723,0 days 00:00:20.026338,"{0: 1, 1: 10}",6.0,,610,COMPLETE
1242,1242,0.7333442056253189,2022-11-29 23:51:14.102533,2022-11-29 23:51:34.025869,0 days 00:00:19.923336,"{0: 1, 1: 10}",6.0,,610,COMPLETE
1243,1243,0.7312701429303734,2022-11-29 23:51:34.261843,2022-11-29 23:51:54.055138,0 days 00:00:19.793295,"{0: 1, 1: 10}",6.0,,610,COMPLETE
1244,1244,0.7327496401154716,2022-11-29 23:51:54.274077,2022-11-29 23:52:14.082019,0 days 00:00:19.807942,"{0: 1, 1: 10}",6.0,,610,COMPLETE
1245,1245,0.7145615996362967,2022-11-29 23:52:14.305276,2022-11-29 23:52:34.717338,0 days 00:00:20.412062,"{0: 1, 1: 10}",21.0,,610,COMPLETE
1246,1246,0.730526288323578,2022-11-29 23:52:34.936537,2022-11-29 23:52:54.951011,0 days 00:00:20.014474,"{0: 1, 1: 10}",6.0,,610,COMPLETE
1247,1247,0.7293928149731607,2022-11-29 23:52:55.184141,2022-11-29 23:53:15.266513,0 days 00:00:20.082372,"{0: 1, 1: 10}",6.0,,610,COMPLETE
1248,1248,0.7299483984706174,2022-11-29 23:53:15.497852,2022-11-29 23:53:35.502765,0 days 00:00:20.004913,"{0: 1, 1: 10}",6.0,,610,COMPLETE
1249,1249,0.7207207258350102,2022-11-29 23:53:35.721032,2022-11-29 23:53:53.798347,0 days 00:00:18.077315,"{0: 1, 1: 10}",4.0,,610,COMPLETE
1250,1250,0.7323016944041433,2022-11-29 23:53:54.020954,2022-11-29 23:54:14.130818,0 days 00:00:20.109864,"{0: 1, 1: 10}",6.0,,610,COMPLETE
1251,1251,0.7321628909948108,2022-11-29 23:54:14.363210,2022-11-29 23:54:34.366189,0 days 00:00:20.002979,"{0: 1, 1: 10}",6.0,,610,COMPLETE
1252,1252,0.7329087359384985,2022-11-29 23:54:34.585273,2022-11-29 23:54:53.268825,0 days 00:00:18.683552,"{0: 1, 1: 10}",6.0,,560,COMPLETE
1253,1253,0.7175945555757312,2022-11-29 23:54:53.495343,2022-11-29 23:55:11.526926,0 days 00:00:18.031583,"{0: 1, 1: 10}",12.0,,510,COMPLETE
1254,1254,0.7338053838329379,2022-11-29 23:55:11.755325,2022-11-29 23:55:30.552254,0 days 00:00:18.796929,"{0: 1, 1: 10}",6.0,,560,COMPLETE
1255,1255,0.7320614087572219,2022-11-29 23:55:30.777765,2022-11-29 23:55:49.548257,0 days 00:00:18.770492,"{0: 1, 1: 10}",6.0,,560,COMPLETE
1256,1256,0.7333656958766037,2022-11-29 23:55:49.772362,2022-11-29 23:56:09.703976,0 days 00:00:19.931614,"{0: 1, 1: 10}",6.0,,610,COMPLETE
1257,1257,0.7309745880676407,2022-11-29 23:56:09.932192,2022-11-29 23:56:29.979518,0 days 00:00:20.047326,"{0: 1, 1: 10}",6.0,,610,COMPLETE
1258,1258,0.7302959625858222,2022-11-29 23:56:30.203296,2022-11-29 23:56:50.240259,0 days 00:00:20.036963,"{0: 1, 1: 10}",6.0,,610,COMPLETE
1259,1259,0.7313157528239334,2022-11-29 23:56:50.472424,2022-11-29 23:57:10.382950,0 days 00:00:19.910526,"{0: 1, 1: 10}",6.0,,610,COMPLETE
1260,1260,0.7296795287764508,2022-11-29 23:57:10.614821,2022-11-29 23:57:30.511550,0 days 00:00:19.896729,"{0: 1, 1: 10}",6.0,,610,COMPLETE
1261,1261,0.728935988655073,2022-11-29 23:57:30.734652,2022-11-29 23:57:50.527950,0 days 00:00:19.793298,"{0: 1, 1: 10}",6.0,,610,COMPLETE
1262,1262,0.7350429984429955,2022-11-29 23:57:50.746379,2022-11-29 23:58:10.640001,0 days 00:00:19.893622,"{0: 1, 1: 10}",6.0,,610,COMPLETE
1263,1263,0.7308251632697342,2022-11-29 23:58:10.860572,2022-11-29 23:58:30.851762,0 days 00:00:19.991190,"{0: 1, 1: 10}",6.0,,610,COMPLETE
1264,1264,0.7158571714457724,2022-11-29 23:58:31.074336,2022-11-29 23:58:51.548589,0 days 00:00:20.474253,"{0: 1, 1: 10}",,,610,COMPLETE
1265,1265,0.7109233422240789,2022-11-29 23:58:51.773514,2022-11-29 23:59:07.934150,0 days 00:00:16.160636,"{0: 1, 1: 10}",3.0,,610,COMPLETE
1266,1266,0.7328460033321669,2022-11-29 23:59:08.166029,2022-11-29 23:59:28.120907,0 days 00:00:19.954878,"{0: 1, 1: 10}",6.0,,610,COMPLETE
1267,1267,0.7337045864026158,2022-11-29 23:59:28.342870,2022-11-29 23:59:48.375670,0 days 00:00:20.032800,"{0: 1, 1: 10}",6.0,,610,COMPLETE
1268,1268,0.7129251560262506,2022-11-29 23:59:48.595287,2022-11-30 00:00:09.123924,0 days 00:00:20.528637,"{0: 1, 1: 10}",31.0,,610,COMPLETE
1269,1269,0.7330864344254195,2022-11-30 00:00:09.343475,2022-11-30 00:00:29.199943,0 days 00:00:19.856468,"{0: 1, 1: 10}",6.0,,610,COMPLETE
1270,1270,0.73399112719019,2022-11-30 00:00:29.431482,2022-11-30 00:00:49.556991,0 days 00:00:20.125509,"{0: 1, 1: 10}",6.0,,610,COMPLETE
1271,1271,0.7342326047356784,2022-11-30 00:00:49.781563,2022-11-30 00:01:09.650260,0 days 00:00:19.868697,"{0: 1, 1: 10}",6.0,,610,COMPLETE
1272,1272,0.71561864808948,2022-11-30 00:01:09.868251,2022-11-30 00:01:30.267973,0 days 00:00:20.399722,"{0: 1, 1: 10}",25.0,,610,COMPLETE
1273,1273,0.733573777239241,2022-11-30 00:01:30.493888,2022-11-30 00:01:50.496709,0 days 00:00:20.002821,"{0: 1, 1: 10}",6.0,,610,COMPLETE
