,number,value,datetime_start,datetime_complete,duration,params_class_weight,params_max_depth,params_max_features,params_n_estimators,state
1430,1430,0.7188386459072559,2022-11-30 00:54:53.648988,2022-11-30 00:55:15.366740,0 days 00:00:21.717752,"{0: 1, 1: 10}",15.0,,660,COMPLETE
1431,1431,0.7168331138418762,2022-11-30 00:55:15.595836,2022-11-30 00:55:37.230460,0 days 00:00:21.634624,"{0: 1, 1: 10}",12.0,,660,COMPLETE
1432,1432,0.7346432922039895,2022-11-30 00:55:37.456392,2022-11-30 00:55:57.518234,0 days 00:00:20.061842,"{0: 1, 1: 10}",6.0,,610,COMPLETE
1433,1433,0.7183173220895467,2022-11-30 00:55:57.741230,2022-11-30 00:56:18.293839,0 days 00:00:20.552609,"{0: 1, 1: 10}",20.0,,610,COMPLETE
1434,1434,0.72990041733113,2022-11-30 00:56:18.517453,2022-11-30 00:56:39.724096,0 days 00:00:21.206643,"{0: 1, 1: 10}",6.0,,660,COMPLETE
1435,1435,0.731881558997008,2022-11-30 00:56:39.963230,2022-11-30 00:57:02.503851,0 days 00:00:22.540621,"{0: 1, 1: 10}",6.0,,710,COMPLETE
1436,1436,0.7195428814034431,2022-11-30 00:57:02.733182,2022-11-30 00:57:23.210183,0 days 00:00:20.477001,"{0: 1, 1: 10}",,,610,COMPLETE
1437,1437,0.7312149046471157,2022-11-30 00:57:23.437175,2022-11-30 00:57:43.365861,0 days 00:00:19.928686,"{0: 1, 1: 10}",6.0,,610,COMPLETE
1438,1438,0.7330932870236838,2022-11-30 00:57:43.591252,2022-11-30 00:58:03.596783,0 days 00:00:20.005531,"{0: 1, 1: 10}",6.0,,610,COMPLETE
1439,1439,0.7343256564851186,2022-11-30 00:58:03.829875,2022-11-30 00:58:23.858547,0 days 00:00:20.028672,"{0: 1, 1: 10}",6.0,,610,COMPLETE
1440,1440,0.7141114911176748,2022-11-30 00:58:24.093756,2022-11-30 00:58:45.696487,0 days 00:00:21.602731,"{0: 1, 1: 10}",22.0,,660,COMPLETE
1441,1441,0.7322366441844446,2022-11-30 00:58:45.925131,2022-11-30 00:59:07.086071,0 days 00:00:21.160940,"{0: 1, 1: 10}",6.0,,660,COMPLETE
1442,1442,0.7343442413656044,2022-11-30 00:59:07.313573,2022-11-30 00:59:27.066680,0 days 00:00:19.753107,"{0: 1, 1: 10}",6.0,,610,COMPLETE
1443,1443,0.5891287891848996,2022-11-30 00:59:27.288463,2022-11-30 00:59:37.834001,0 days 00:00:10.545538,"{0: 1, 1: 10}",1.0,,610,COMPLETE
1444,1444,0.7179229612590643,2022-11-30 00:59:38.062879,2022-11-30 00:59:58.464857,0 days 00:00:20.401978,"{0: 1, 1: 10}",23.0,,610,COMPLETE
1445,1445,0.7309836966909042,2022-11-30 00:59:58.703167,2022-11-30 01:00:18.661989,0 days 00:00:19.958822,"{0: 1, 1: 10}",6.0,,610,COMPLETE
1446,1446,0.7144764220445033,2022-11-30 01:00:18.891473,2022-11-30 01:00:39.376449,0 days 00:00:20.484976,"{0: 1, 1: 10}",27.0,,610,COMPLETE
1447,1447,0.7298799104139517,2022-11-30 01:00:39.611938,2022-11-30 01:00:59.495420,0 days 00:00:19.883482,"{0: 1, 1: 10}",6.0,,610,COMPLETE
1448,1448,0.7077267187354369,2022-11-30 01:00:59.726416,2022-11-30 01:01:16.042622,0 days 00:00:16.316206,"{0: 1, 1: 10}",3.0,,610,COMPLETE
1449,1449,0.731813706476452,2022-11-30 01:01:16.270320,2022-11-30 01:01:36.226765,0 days 00:00:19.956445,"{0: 1, 1: 10}",6.0,,610,COMPLETE
1450,1450,0.7154021525995582,2022-11-30 01:01:36.457516,2022-11-30 01:01:56.815012,0 days 00:00:20.357496,"{0: 1, 1: 10}",33.0,,610,COMPLETE
1451,1451,0.7200562641211394,2022-11-30 01:01:57.047834,2022-11-30 01:02:17.389106,0 days 00:00:20.341272,"{0: 1, 1: 10}",34.0,,610,COMPLETE
1452,1452,0.7154655694071137,2022-11-30 01:02:17.619692,2022-11-30 01:02:36.860536,0 days 00:00:19.240844,"{0: 1, 1: 10}",26.0,,560,COMPLETE
1453,1453,0.7348987964592565,2022-11-30 01:02:37.088697,2022-11-30 01:02:57.198158,0 days 00:00:20.109461,"{0: 1, 1: 10}",6.0,,610,COMPLETE
1454,1454,0.7182221281333689,2022-11-30 01:02:57.424710,2022-11-30 01:03:17.835858,0 days 00:00:20.411148,"{0: 1, 1: 10}",25.0,,610,COMPLETE
1455,1455,0.7148006578571005,2022-11-30 01:03:18.057439,2022-11-30 01:03:38.396887,0 days 00:00:20.339448,"{0: 1, 1: 10}",10.0,,610,COMPLETE
1456,1456,0.7329266748828115,2022-11-30 01:03:38.623669,2022-11-30 01:03:58.654563,0 days 00:00:20.030894,"{0: 1, 1: 10}",6.0,,610,COMPLETE
1457,1457,0.7318587541274517,2022-11-30 01:03:58.882237,2022-11-30 01:04:18.867370,0 days 00:00:19.985133,"{0: 1, 1: 10}",6.0,,610,COMPLETE
1458,1458,0.7329652739558767,2022-11-30 01:04:19.097386,2022-11-30 01:04:38.972346,0 days 00:00:19.874960,"{0: 1, 1: 10}",6.0,,610,COMPLETE
1459,1459,0.7165928524605212,2022-11-30 01:04:39.198321,2022-11-30 01:04:59.591055,0 days 00:00:20.392734,"{0: 1, 1: 10}",31.0,,610,COMPLETE
1460,1460,0.7313834962367307,2022-11-30 01:04:59.827306,2022-11-30 01:05:21.053362,0 days 00:00:21.226056,"{0: 1, 1: 10}",6.0,,660,COMPLETE
1461,1461,0.7151859154757468,2022-11-30 01:05:21.278114,2022-11-30 01:05:41.761262,0 days 00:00:20.483148,"{0: 1, 1: 10}",16.0,,610,COMPLETE
1462,1462,0.7323591893291785,2022-11-30 01:05:41.988627,2022-11-30 01:06:01.996845,0 days 00:00:20.008218,"{0: 1, 1: 10}",6.0,,610,COMPLETE
1463,1463,0.7166839638526009,2022-11-30 01:06:02.223828,2022-11-30 01:06:22.909786,0 days 00:00:20.685958,"{0: 1, 1: 10}",30.0,,610,COMPLETE
1464,1464,0.7318675363931753,2022-11-30 01:06:23.137839,2022-11-30 01:06:44.366870,0 days 00:00:21.229031,"{0: 1, 1: 10}",6.0,,660,COMPLETE
1465,1465,0.7184847466311002,2022-11-30 01:06:44.590462,2022-11-30 01:07:06.605716,0 days 00:00:22.015254,"{0: 1, 1: 10}",11.0,,660,COMPLETE
1466,1466,0.715637339546184,2022-11-30 01:07:06.834858,2022-11-30 01:07:25.932295,0 days 00:00:19.097437,"{0: 1, 1: 10}",35.0,,560,COMPLETE
1467,1467,0.7133340926615984,2022-11-30 01:07:26.163830,2022-11-30 01:07:46.652250,0 days 00:00:20.488420,"{0: 1, 1: 10}",37.0,,610,COMPLETE
1468,1468,0.7334659923151795,2022-11-30 01:07:46.881003,2022-11-30 01:08:08.115170,0 days 00:00:21.234167,"{0: 1, 1: 10}",6.0,,660,COMPLETE
1469,1469,0.7126209294979894,2022-11-30 01:08:08.341050,2022-11-30 01:08:27.425175,0 days 00:00:19.084125,"{0: 1, 1: 10}",17.0,,560,COMPLETE
1470,1470,0.7176857559957184,2022-11-30 01:08:27.659425,2022-11-30 01:08:48.112684,0 days 00:00:20.453259,"{0: 1, 1: 10}",18.0,,610,COMPLETE
1471,1471,0.7190879525866042,2022-11-30 01:08:48.339765,2022-11-30 01:09:07.362920,0 days 00:00:19.023155,"{0: 1, 1: 10}",4.0,,660,COMPLETE
1472,1472,0.7343138094263781,2022-11-30 01:09:07.593603,2022-11-30 01:09:25.942799,0 days 00:00:18.349196,"{0: 1, 1: 10}",5.0,,560,COMPLETE
1473,1473,0.6785674526449265,2022-11-30 01:09:26.169671,2022-11-30 01:09:39.184307,0 days 00:00:13.014636,"{0: 1, 1: 10}",2.0,,560,COMPLETE
1474,1474,0.7317690253180549,2022-11-30 01:09:39.410664,2022-11-30 01:09:57.601145,0 days 00:00:18.190481,"{0: 1, 1: 10}",5.0,,560,COMPLETE
1475,1475,0.730584731760517,2022-11-30 01:09:57.829086,2022-11-30 01:10:16.013388,0 days 00:00:18.184302,"{0: 1, 1: 10}",5.0,,560,COMPLETE
1476,1476,0.7315054928173624,2022-11-30 01:10:16.250639,2022-11-30 01:10:34.365717,0 days 00:00:18.115078,"{0: 1, 1: 10}",5.0,,560,COMPLETE
1477,1477,0.7301353761911408,2022-11-30 01:10:34.599004,2022-11-30 01:10:52.877248,0 days 00:00:18.278244,"{0: 1, 1: 10}",5.0,,560,COMPLETE
1478,1478,0.732326715683395,2022-11-30 01:10:53.104571,2022-11-30 01:11:11.350939,0 days 00:00:18.246368,"{0: 1, 1: 10}",5.0,,560,COMPLETE
1479,1479,0.7153456404010282,2022-11-30 01:11:11.570904,2022-11-30 01:11:30.870123,0 days 00:00:19.299219,"{0: 1, 1: 10}",24.0,,560,COMPLETE
1480,1480,0.7299241671226956,2022-11-30 01:11:31.107958,2022-11-30 01:11:49.201813,0 days 00:00:18.093855,"{0: 1, 1: 10}",5.0,,560,COMPLETE
1481,1481,0.7199969279779286,2022-11-30 01:11:49.438422,2022-11-30 01:12:09.886177,0 days 00:00:20.447755,"{0: 1, 1: 10}",19.0,,610,COMPLETE
1482,1482,0.7174725589780657,2022-11-30 01:12:10.122625,2022-11-30 01:12:29.521419,0 days 00:00:19.398794,"{0: 1, 1: 10}",21.0,,560,COMPLETE
1483,1483,0.7190669543213152,2022-11-30 01:12:29.751837,2022-11-30 01:12:50.366194,0 days 00:00:20.614357,"{0: 1, 1: 10}",13.0,,610,COMPLETE
1484,1484,0.7293011981351021,2022-11-30 01:12:50.590222,2022-11-30 01:13:08.703058,0 days 00:00:18.112836,"{0: 1, 1: 10}",5.0,,560,COMPLETE
1485,1485,0.7148395205453368,2022-11-30 01:13:08.929708,2022-11-30 01:13:29.538272,0 days 00:00:20.608564,"{0: 1, 1: 10}",32.0,,610,COMPLETE
1486,1486,0.7168842160770312,2022-11-30 01:13:29.768897,2022-11-30 01:13:51.321807,0 days 00:00:21.552910,"{0: 1, 1: 10}",39.0,,660,COMPLETE
1487,1487,0.7137040962399535,2022-11-30 01:13:51.550856,2022-11-30 01:14:12.002725,0 days 00:00:20.451869,"{0: 1, 1: 10}",28.0,,610,COMPLETE
1488,1488,0.7349863758997592,2022-11-30 01:14:12.233628,2022-11-30 01:14:30.617011,0 days 00:00:18.383383,"{0: 1, 1: 10}",5.0,,560,COMPLETE
1489,1489,0.7288020128375751,2022-11-30 01:14:30.845552,2022-11-30 01:14:49.077634,0 days 00:00:18.232082,"{0: 1, 1: 10}",5.0,,560,COMPLETE
1490,1490,0.715207736801526,2022-11-30 01:14:49.300338,2022-11-30 01:15:08.520913,0 days 00:00:19.220575,"{0: 1, 1: 10}",15.0,,560,COMPLETE
1491,1491,0.730130000709723,2022-11-30 01:15:08.756831,2022-11-30 01:15:26.911779,0 days 00:00:18.154948,"{0: 1, 1: 10}",5.0,,560,COMPLETE
1492,1492,0.7256549140802729,2022-11-30 01:15:27.143667,2022-11-30 01:15:45.200895,0 days 00:00:18.057228,"{0: 1, 1: 10}",5.0,,560,COMPLETE
1493,1493,0.730678763900452,2022-11-30 01:15:45.421265,2022-11-30 01:16:03.591296,0 days 00:00:18.170031,"{0: 1, 1: 10}",5.0,,560,COMPLETE
1494,1494,0.7292074131699323,2022-11-30 01:16:03.829277,2022-11-30 01:16:22.057943,0 days 00:00:18.228666,"{0: 1, 1: 10}",5.0,,560,COMPLETE
1495,1495,0.7287356740429476,2022-11-30 01:16:22.286013,2022-11-30 01:16:40.475469,0 days 00:00:18.189456,"{0: 1, 1: 10}",5.0,,560,COMPLETE
1496,1496,0.730429425541557,2022-11-30 01:16:40.697726,2022-11-30 01:16:59.851877,0 days 00:00:19.154151,"{0: 1, 1: 10}",7.0,,560,COMPLETE
1497,1497,0.7267923496468242,2022-11-30 01:17:00.091716,2022-11-30 01:17:19.412058,0 days 00:00:19.320342,"{0: 1, 1: 10}",5.0,,610,COMPLETE
1498,1498,0.7284547899100354,2022-11-30 01:17:19.635378,2022-11-30 01:17:37.799627,0 days 00:00:18.164249,"{0: 1, 1: 10}",5.0,,560,COMPLETE
1499,1499,0.7280653676905681,2022-11-30 01:17:38.029603,2022-11-30 01:17:59.539920,0 days 00:00:21.510317,"{0: 1, 1: 10}",5.0,,710,COMPLETE
1500,1500,0.7146651654425175,2022-11-30 01:17:59.780336,2022-11-30 01:18:21.426817,0 days 00:00:21.646481,"{0: 1, 1: 10}",,,660,COMPLETE
1501,1501,0.7227319451633246,2022-11-30 01:18:21.653824,2022-11-30 01:18:40.850856,0 days 00:00:19.197032,"{0: 1, 1: 10}",9.0,,560,COMPLETE
1502,1502,0.7192372647388872,2022-11-30 01:18:41.078928,2022-11-30 01:19:01.616642,0 days 00:00:20.537714,"{0: 1, 1: 10}",14.0,,610,COMPLETE
1503,1503,0.7313876051386761,2022-11-30 01:19:01.841144,2022-11-30 01:19:21.132660,0 days 00:00:19.291516,"{0: 1, 1: 10}",5.0,,610,COMPLETE
1504,1504,0.7338368578097119,2022-11-30 01:19:21.359866,2022-11-30 01:19:41.899033,0 days 00:00:20.539167,"{0: 1, 1: 10}",5.0,,660,COMPLETE
1505,1505,0.7311624105773273,2022-11-30 01:19:42.136818,2022-11-30 01:20:00.236408,0 days 00:00:18.099590,"{0: 1, 1: 10}",5.0,,560,COMPLETE
1506,1506,0.7268092757877012,2022-11-30 01:20:00.462480,2022-11-30 01:20:18.568744,0 days 00:00:18.106264,"{0: 1, 1: 10}",5.0,,560,COMPLETE
1507,1507,0.731620163875919,2022-11-30 01:20:18.796335,2022-11-30 01:20:37.972810,0 days 00:00:19.176475,"{0: 1, 1: 10}",5.0,,610,COMPLETE
1508,1508,0.7291534821685849,2022-11-30 01:20:38.197602,2022-11-30 01:20:58.695695,0 days 00:00:20.498093,"{0: 1, 1: 10}",5.0,,660,COMPLETE
1509,1509,0.7305387107991825,2022-11-30 01:20:58.927514,2022-11-30 01:21:17.163994,0 days 00:00:18.236480,"{0: 1, 1: 10}",5.0,,560,COMPLETE
1510,1510,0.7185394738824906,2022-11-30 01:21:17.406335,2022-11-30 01:21:37.693572,0 days 00:00:20.287237,"{0: 1, 1: 10}",20.0,,610,COMPLETE
1511,1511,0.7146497064130741,2022-11-30 01:21:37.926176,2022-11-30 01:22:00.819641,0 days 00:00:22.893465,"{0: 1, 1: 10}",22.0,,710,COMPLETE
1512,1512,0.5887972123603367,2022-11-30 01:22:01.049003,2022-11-30 01:22:11.560821,0 days 00:00:10.511818,"{0: 1, 1: 10}",1.0,,610,COMPLETE
1513,1513,0.7181838797619019,2022-11-30 01:22:11.791560,2022-11-30 01:22:32.203348,0 days 00:00:20.411788,"{0: 1, 1: 10}",12.0,,610,COMPLETE
1514,1514,0.7295560850227393,2022-11-30 01:22:32.436092,2022-11-30 01:22:50.676053,0 days 00:00:18.239961,"{0: 1, 1: 10}",5.0,,560,COMPLETE
1515,1515,0.7168363391054973,2022-11-30 01:22:50.913177,2022-11-30 01:23:12.619494,0 days 00:00:21.706317,"{0: 1, 1: 10}",23.0,,660,COMPLETE
1516,1516,0.7165898073984754,2022-11-30 01:23:12.849400,2022-11-30 01:23:34.633845,0 days 00:00:21.784445,"{0: 1, 1: 10}",10.0,,660,COMPLETE
1517,1517,0.7168855223579659,2022-11-30 01:23:34.863036,2022-11-30 01:23:55.315494,0 days 00:00:20.452458,"{0: 1, 1: 10}",27.0,,610,COMPLETE
1518,1518,0.7175656487175122,2022-11-30 01:23:55.541839,2022-11-30 01:24:16.133800,0 days 00:00:20.591961,"{0: 1, 1: 10}",33.0,,610,COMPLETE
1519,1519,0.710968736127118,2022-11-30 01:24:16.354760,2022-11-30 01:24:31.635762,0 days 00:00:15.281002,"{0: 1, 1: 10}",3.0,,560,COMPLETE
1520,1520,0.7162836236150663,2022-11-30 01:24:31.866640,2022-11-30 01:24:51.107966,0 days 00:00:19.241326,"{0: 1, 1: 10}",31.0,,560,COMPLETE
1521,1521,0.7151063676999613,2022-11-30 01:24:51.338180,2022-11-30 01:25:12.958812,0 days 00:00:21.620632,"{0: 1, 1: 10}",26.0,,660,COMPLETE
1522,1522,0.713819485935953,2022-11-30 01:25:13.181709,2022-11-30 01:25:33.504169,0 days 00:00:20.322460,"{0: 1, 1: 10}",34.0,,610,COMPLETE
1523,1523,0.7137051953918861,2022-11-30 01:25:33.730312,2022-11-30 01:25:52.921527,0 days 00:00:19.191215,"{0: 1, 1: 10}",25.0,,560,COMPLETE
1524,1524,0.7149110729556766,2022-11-30 01:25:53.144966,2022-11-30 01:26:13.449610,0 days 00:00:20.304644,"{0: 1, 1: 10}",37.0,,610,COMPLETE
1525,1525,0.7153848298360537,2022-11-30 01:26:13.682951,2022-11-30 01:26:36.273564,0 days 00:00:22.590613,"{0: 1, 1: 10}",36.0,,710,COMPLETE
1526,1526,0.7332340288195851,2022-11-30 01:26:36.502980,2022-11-30 01:26:56.870954,0 days 00:00:20.367974,"{0: 1, 1: 10}",5.0,,660,COMPLETE
1527,1527,0.7149948788912182,2022-11-30 01:26:57.110783,2022-11-30 01:27:17.573628,0 days 00:00:20.462845,"{0: 1, 1: 10}",35.0,,610,COMPLETE
1528,1528,0.7126283504938367,2022-11-30 01:27:17.812797,2022-11-30 01:27:37.035593,0 days 00:00:19.222796,"{0: 1, 1: 10}",17.0,,560,COMPLETE
1529,1529,0.7174047887586813,2022-11-30 01:27:37.276461,2022-11-30 01:27:58.862160,0 days 00:00:21.585699,"{0: 1, 1: 10}",16.0,,660,COMPLETE
1530,1530,0.7140262220423201,2022-11-30 01:27:59.088298,2022-11-30 01:28:19.510650,0 days 00:00:20.422352,"{0: 1, 1: 10}",11.0,,610,COMPLETE
1531,1531,0.71571274411034,2022-11-30 01:28:19.748248,2022-11-30 01:28:39.042529,0 days 00:00:19.294281,"{0: 1, 1: 10}",18.0,,560,COMPLETE
1532,1532,0.7087928501348943,2022-11-30 01:28:39.271534,2022-11-30 01:28:59.733295,0 days 00:00:20.461761,"{0: 1, 1: 10}",30.0,,610,COMPLETE
1533,1533,0.7315254186775795,2022-11-30 01:28:59.960695,2022-11-30 01:29:18.619499,0 days 00:00:18.658804,"{0: 1, 1: 10}",6.0,,560,COMPLETE
1534,1534,0.7324742992732434,2022-11-30 01:29:18.848654,2022-11-30 01:29:39.959644,0 days 00:00:21.110990,"{0: 1, 1: 10}",6.0,,660,COMPLETE
1535,1535,0.7212006609631973,2022-11-30 01:29:40.192726,2022-11-30 01:29:58.386125,0 days 00:00:18.193399,"{0: 1, 1: 10}",4.0,,610,COMPLETE
1536,1536,0.715780163911676,2022-11-30 01:29:58.625501,2022-11-30 01:30:19.058534,0 days 00:00:20.433033,"{0: 1, 1: 10}",24.0,,610,COMPLETE
1537,1537,0.7110527346507465,2022-11-30 01:30:19.280073,2022-11-30 01:30:39.913816,0 days 00:00:20.633743,"{0: 1, 1: 10}",38.0,,610,COMPLETE
1538,1538,0.7321375522530629,2022-11-30 01:30:40.137444,2022-11-30 01:31:01.300150,0 days 00:00:21.162706,"{0: 1, 1: 10}",6.0,,660,COMPLETE
1539,1539,0.7281981508545403,2022-11-30 01:31:01.533159,2022-11-30 01:31:20.224809,0 days 00:00:18.691650,"{0: 1, 1: 10}",6.0,,560,COMPLETE
1540,1540,0.7204493649242603,2022-11-30 01:31:20.457464,2022-11-30 01:31:42.214410,0 days 00:00:21.756946,"{0: 1, 1: 10}",14.0,,660,COMPLETE
1541,1541,0.7096117938196154,2022-11-30 01:31:42.444658,2022-11-30 01:32:02.886878,0 days 00:00:20.442220,"{0: 1, 1: 10}",21.0,,610,COMPLETE
1542,1542,0.7133351254268858,2022-11-30 01:32:03.118687,2022-11-30 01:32:22.472063,0 days 00:00:19.353376,"{0: 1, 1: 10}",39.0,,560,COMPLETE
1543,1543,0.7119299942409513,2022-11-30 01:32:22.695459,2022-11-30 01:32:45.560141,0 days 00:00:22.864682,"{0: 1, 1: 10}",19.0,,710,COMPLETE
1544,1544,0.7322172006142473,2022-11-30 01:32:45.791057,2022-11-30 01:33:05.746223,0 days 00:00:19.955166,"{0: 1, 1: 10}",6.0,,610,COMPLETE
1545,1545,0.7331762796559461,2022-11-30 01:33:05.974591,2022-11-30 01:33:24.741542,0 days 00:00:18.766951,"{0: 1, 1: 10}",6.0,,560,COMPLETE
1546,1546,0.7150757411964979,2022-11-30 01:33:24.969957,2022-11-30 01:33:45.337880,0 days 00:00:20.367923,"{0: 1, 1: 10}",32.0,,610,COMPLETE
1547,1547,0.7151144756965131,2022-11-30 01:33:45.568577,2022-11-30 01:34:04.639618,0 days 00:00:19.071041,"{0: 1, 1: 10}",28.0,,560,COMPLETE
1548,1548,0.7144156534508597,2022-11-30 01:34:04.871093,2022-11-30 01:34:25.236081,0 days 00:00:20.364988,"{0: 1, 1: 10}",13.0,,610,COMPLETE
1549,1549,0.7305345195129525,2022-11-30 01:34:25.468459,2022-11-30 01:34:46.545908,0 days 00:00:21.077449,"{0: 1, 1: 10}",6.0,,660,COMPLETE
1550,1550,0.6753014115543474,2022-11-30 01:34:46.773385,2022-11-30 01:35:01.067594,0 days 00:00:14.294209,"{0: 1, 1: 10}",2.0,,660,COMPLETE
1551,1551,0.7293157971846311,2022-11-30 01:35:01.306375,2022-11-30 01:35:20.520176,0 days 00:00:19.213801,"{0: 1, 1: 10}",5.0,,610,COMPLETE
1552,1552,0.713398342350077,2022-11-30 01:35:20.751600,2022-11-30 01:35:40.105406,0 days 00:00:19.353806,"{0: 1, 1: 10}",15.0,,560,COMPLETE
1553,1553,0.7126179720067024,2022-11-30 01:35:40.335430,2022-11-30 01:35:59.504962,0 days 00:00:19.169532,"{0: 1, 1: 10}",12.0,,560,COMPLETE
1554,1554,0.7314632856297218,2022-11-30 01:35:59.738966,2022-11-30 01:36:20.867897,0 days 00:00:21.128931,"{0: 1, 1: 10}",6.0,,660,COMPLETE
1555,1555,0.7174439763148028,2022-11-30 01:36:21.090454,2022-11-30 01:36:41.540970,0 days 00:00:20.450516,"{0: 1, 1: 10}",20.0,,610,COMPLETE
1556,1556,0.7165680388410556,2022-11-30 01:36:41.771405,2022-11-30 01:37:02.083577,0 days 00:00:20.312172,"{0: 1, 1: 10}",29.0,,610,COMPLETE
1557,1557,0.7180079017389909,2022-11-30 01:37:02.310604,2022-11-30 01:37:21.542236,0 days 00:00:19.231632,"{0: 1, 1: 10}",22.0,,560,COMPLETE
1558,1558,0.7308869525423377,2022-11-30 01:37:21.770609,2022-11-30 01:37:43.288785,0 days 00:00:21.518176,"{0: 1, 1: 10}",7.0,,660,COMPLETE
1559,1559,0.7334872275880341,2022-11-30 01:37:43.523420,2022-11-30 01:38:05.859313,0 days 00:00:22.335893,"{0: 1, 1: 10}",6.0,,710,COMPLETE
1560,1560,0.7319112024884414,2022-11-30 01:38:06.089315,2022-11-30 01:38:26.109635,0 days 00:00:20.020320,"{0: 1, 1: 10}",6.0,,610,COMPLETE
1561,1561,0.7137943443251997,2022-11-30 01:38:26.339482,2022-11-30 01:38:45.692326,0 days 00:00:19.352844,"{0: 1, 1: 10}",,,560,COMPLETE
1562,1562,0.7327935215626703,2022-11-30 01:38:45.915328,2022-11-30 01:39:05.735074,0 days 00:00:19.819746,"{0: 1, 1: 10}",6.0,,610,COMPLETE
1563,1563,0.7319100107932955,2022-11-30 01:39:05.973807,2022-11-30 01:39:27.136038,0 days 00:00:21.162231,"{0: 1, 1: 10}",6.0,,660,COMPLETE
1564,1564,0.7172560404257131,2022-11-30 01:39:27.362768,2022-11-30 01:39:46.640161,0 days 00:00:19.277393,"{0: 1, 1: 10}",23.0,,560,COMPLETE
1565,1565,0.7301078123771461,2022-11-30 01:39:46.870248,2022-11-30 01:40:06.895902,0 days 00:00:20.025654,"{0: 1, 1: 10}",6.0,,610,COMPLETE
1566,1566,0.7307443314136083,2022-11-30 01:40:07.122750,2022-11-30 01:40:27.521459,0 days 00:00:20.398709,"{0: 1, 1: 10}",5.0,,660,COMPLETE
1567,1567,0.7207151533493587,2022-11-30 01:40:27.746080,2022-11-30 01:40:48.190501,0 days 00:00:20.444421,"{0: 1, 1: 10}",9.0,,610,COMPLETE
1568,1568,0.7325965376425199,2022-11-30 01:40:48.420845,2022-11-30 01:41:07.434966,0 days 00:00:19.014121,"{0: 1, 1: 10}",6.0,,560,COMPLETE
1569,1569,0.7346195956156961,2022-11-30 01:41:07.668065,2022-11-30 01:41:27.522297,0 days 00:00:19.854232,"{0: 1, 1: 10}",6.0,,610,COMPLETE
1570,1570,0.7083825161350922,2022-11-30 01:41:27.750985,2022-11-30 01:41:43.937198,0 days 00:00:16.186213,"{0: 1, 1: 10}",3.0,,610,COMPLETE
1571,1571,0.7153577956747317,2022-11-30 01:41:44.176024,2022-11-30 01:42:04.632089,0 days 00:00:20.456065,"{0: 1, 1: 10}",33.0,,610,COMPLETE
1572,1572,0.5893790298867065,2022-11-30 01:42:04.858588,2022-11-30 01:42:15.315859,0 days 00:00:10.457271,"{0: 1, 1: 10}",1.0,,610,COMPLETE
1573,1573,0.7297743869492741,2022-11-30 01:42:15.544630,2022-11-30 01:42:36.606256,0 days 00:00:21.061626,"{0: 1, 1: 10}",6.0,,660,COMPLETE
1574,1574,0.7333286757755728,2022-11-30 01:42:36.830861,2022-11-30 01:42:56.627272,0 days 00:00:19.796411,"{0: 1, 1: 10}",6.0,,610,COMPLETE
1575,1575,0.7130435188695736,2022-11-30 01:42:56.865883,2022-11-30 01:43:17.429916,0 days 00:00:20.564033,"{0: 1, 1: 10}",27.0,,610,COMPLETE
1576,1576,0.7147645793108207,2022-11-30 01:43:17.653948,2022-11-30 01:43:38.031902,0 days 00:00:20.377954,"{0: 1, 1: 10}",26.0,,610,COMPLETE
1577,1577,0.7163686176322861,2022-11-30 01:43:38.270433,2022-11-30 01:44:00.034526,0 days 00:00:21.764093,"{0: 1, 1: 10}",34.0,,660,COMPLETE
1578,1578,0.7327128194912784,2022-11-30 01:44:00.265431,2022-11-30 01:44:21.548343,0 days 00:00:21.282912,"{0: 1, 1: 10}",6.0,,660,COMPLETE
1579,1579,0.7218318917461254,2022-11-30 01:44:21.778865,2022-11-30 01:44:42.174293,0 days 00:00:20.395428,"{0: 1, 1: 10}",10.0,,610,COMPLETE
1580,1580,0.7302702381828909,2022-11-30 01:44:42.405497,2022-11-30 01:45:02.345574,0 days 00:00:19.940077,"{0: 1, 1: 10}",6.0,,610,COMPLETE
1581,1581,0.7137306986634726,2022-11-30 01:45:02.567014,2022-11-30 01:45:24.209763,0 days 00:00:21.642749,"{0: 1, 1: 10}",25.0,,660,COMPLETE
1582,1582,0.7308759878852333,2022-11-30 01:45:24.438667,2022-11-30 01:45:44.709903,0 days 00:00:20.271236,"{0: 1, 1: 10}",6.0,,610,COMPLETE
1583,1583,0.7160659900011552,2022-11-30 01:45:44.948499,2022-11-30 01:46:07.847676,0 days 00:00:22.899177,"{0: 1, 1: 10}",36.0,,710,COMPLETE
1584,1584,0.7192061717771405,2022-11-30 01:46:08.077864,2022-11-30 01:46:28.505837,0 days 00:00:20.427973,"{0: 1, 1: 10}",31.0,,610,COMPLETE
