,number,value,datetime_start,datetime_complete,duration,params_class_weight,params_max_depth,params_max_features,params_n_estimators,state
0,0,0.7245900722924246,2022-11-29 18:46:16.368840,2022-11-29 18:46:34.526797,0 days 00:00:18.157957,,5.0,0.9,460,COMPLETE
1,1,0.7124275811969951,2022-11-29 18:46:34.707037,2022-11-29 18:46:52.233077,0 days 00:00:17.526040,"{0: 1, 1: 10}",18.0,0.8,560,COMPLETE
2,2,0.6508678894906738,2022-11-29 18:46:52.382871,2022-11-29 18:47:13.588161,0 days 00:00:21.205290,balanced,,1.0,710,COMPLETE
3,3,0.6421780860462902,2022-11-29 18:47:13.774571,2022-11-29 18:47:24.117372,0 days 00:00:10.342801,"{0: 1, 1: 100}",30.0,,260,COMPLETE
4,4,0.6454914325510333,2022-11-29 18:47:24.296845,2022-11-29 18:47:31.194945,0 days 00:00:06.898100,"{0: 1, 1: 10}",9.0,sqrt,110,COMPLETE
5,5,0.6666745588432648,2022-11-29 18:47:31.358193,2022-11-29 18:47:43.184156,0 days 00:00:11.825963,balanced,2.0,1.0,410,COMPLETE
6,6,0.6579657606423465,2022-11-29 18:47:43.355498,2022-11-29 18:48:00.214048,0 days 00:00:16.858550,balanced,24.0,0.9,560,COMPLETE
7,7,0.6548037611332664,2022-11-29 18:48:00.389553,2022-11-29 18:48:07.161791,0 days 00:00:06.772238,balanced,19.0,0.6,60,COMPLETE
8,8,0.65751281607572,2022-11-29 18:48:07.318665,2022-11-29 18:48:19.131854,0 days 00:00:11.813189,balanced,,0.9,310,COMPLETE
9,9,0.6743867435499065,2022-11-29 18:48:19.295259,2022-11-29 18:48:36.865309,0 days 00:00:17.570050,,33.0,0.8,360,COMPLETE
10,10,0.6744870520438724,2022-11-29 18:48:37.061878,2022-11-29 18:48:49.359176,0 days 00:00:12.297298,,10.0,0.6,260,COMPLETE
11,11,0.6994418345291531,2022-11-29 18:48:49.519585,2022-11-29 18:49:27.123531,0 days 00:00:37.603946,,8.0,1.0,810,COMPLETE
12,12,0.6592492539730805,2022-11-29 18:49:27.302956,2022-11-29 18:49:42.419871,0 days 00:00:15.116915,balanced,14.0,0.7,560,COMPLETE
13,13,0.6731046657709543,2022-11-29 18:49:42.592187,2022-11-29 18:50:03.215473,0 days 00:00:20.623286,,36.0,0.7,510,COMPLETE
14,14,0.6608123014139873,2022-11-29 18:50:03.374366,2022-11-29 18:50:13.576202,0 days 00:00:10.201836,balanced,29.0,sqrt,960,COMPLETE
15,15,0.6619298418040925,2022-11-29 18:50:13.753038,2022-11-29 18:50:35.191055,0 days 00:00:21.438017,balanced,21.0,0.7,910,COMPLETE
16,16,0.632292171555996,2022-11-29 18:50:35.359005,2022-11-29 18:50:42.166374,0 days 00:00:06.807369,,1.0,0.7,110,COMPLETE
17,17,0.6400421875250307,2022-11-29 18:50:42.332424,2022-11-29 18:50:49.210946,0 days 00:00:06.878522,,2.0,0.6,10,COMPLETE
18,18,0.6295548177836341,2022-11-29 18:50:49.388676,2022-11-29 18:51:06.152322,0 days 00:00:16.763646,"{0: 1, 1: 100}",15.0,0.9,660,COMPLETE
19,19,0.626364451529544,2022-11-29 18:51:06.320541,2022-11-29 18:51:28.984908,0 days 00:00:22.664367,"{0: 1, 1: 100}",12.0,,960,COMPLETE
20,20,0.6742901773147337,2022-11-29 18:51:29.165587,2022-11-29 18:51:47.151538,0 days 00:00:17.985951,,27.0,1.0,310,COMPLETE
21,21,0.6545668893164287,2022-11-29 18:51:47.321092,2022-11-29 18:52:08.618640,0 days 00:00:21.297548,balanced,38.0,,710,COMPLETE
22,22,0.7077865768377223,2022-11-29 18:52:08.798774,2022-11-29 18:52:19.790619,0 days 00:00:10.991845,"{0: 1, 1: 10}",33.0,,210,COMPLETE
23,23,0.7133196175646266,2022-11-29 18:52:19.968369,2022-11-29 18:52:43.415331,0 days 00:00:23.446962,"{0: 1, 1: 10}",31.0,0.9,760,COMPLETE
24,24,0.6506921097145643,2022-11-29 18:52:43.568228,2022-11-29 18:53:01.197338,0 days 00:00:17.629110,"{0: 1, 1: 100}",32.0,0.6,910,COMPLETE
25,25,0.667438037147327,2022-11-29 18:53:01.363673,2022-11-29 18:53:09.374470,0 days 00:00:08.010797,"{0: 1, 1: 100}",36.0,sqrt,510,COMPLETE
26,26,0.6653030524358605,2022-11-29 18:53:09.550488,2022-11-29 18:53:19.137371,0 days 00:00:09.586883,balanced,25.0,0.6,260,COMPLETE
27,27,0.7171974056900674,2022-11-29 18:53:19.296269,2022-11-29 18:53:39.406374,0 days 00:00:20.110105,"{0: 1, 1: 10}",10.0,0.9,610,COMPLETE
28,28,0.6203774338929989,2022-11-29 18:53:39.581011,2022-11-29 18:53:54.916297,0 days 00:00:15.335286,balanced,8.0,1.0,460,COMPLETE
29,29,0.6552829114976123,2022-11-29 18:53:55.087789,2022-11-29 18:54:18.542861,0 days 00:00:23.455072,balanced,24.0,1.0,810,COMPLETE
30,30,0.5930616710714764,2022-11-29 18:54:18.707626,2022-11-29 18:54:25.549629,0 days 00:00:06.842003,balanced,23.0,log2,160,COMPLETE
31,31,0.7276272314664165,2022-11-29 18:54:25.728218,2022-11-29 18:54:43.058366,0 days 00:00:17.330148,"{0: 1, 1: 10}",7.0,,460,COMPLETE
32,32,0.6509984646638888,2022-11-29 18:54:43.245559,2022-11-29 18:55:02.287161,0 days 00:00:19.041602,balanced,17.0,1.0,610,COMPLETE
33,33,0.7317423869370232,2022-11-29 18:55:02.454772,2022-11-29 18:55:24.971112,0 days 00:00:22.516340,"{0: 1, 1: 10}",5.0,1.0,710,COMPLETE
34,34,0.6351593931120005,2022-11-29 18:55:25.163661,2022-11-29 18:55:32.869753,0 days 00:00:07.706092,"{0: 1, 1: 100}",24.0,0.6,160,COMPLETE
35,35,0.560993349352848,2022-11-29 18:55:33.046051,2022-11-29 18:55:39.674451,0 days 00:00:06.628400,"{0: 1, 1: 100}",1.0,0.8,110,COMPLETE
36,36,0.7125227920006795,2022-11-29 18:55:39.837123,2022-11-29 18:56:02.908613,0 days 00:00:23.071490,"{0: 1, 1: 10}",21.0,0.8,810,COMPLETE
37,37,0.7161740082364342,2022-11-29 18:56:03.079836,2022-11-29 18:56:19.479873,0 days 00:00:16.400037,"{0: 1, 1: 10}",29.0,0.9,460,COMPLETE
38,38,0.7160348375787582,2022-11-29 18:56:19.636460,2022-11-29 18:56:42.361834,0 days 00:00:22.725374,"{0: 1, 1: 10}",31.0,1.0,660,COMPLETE
39,39,0.6956988748359627,2022-11-29 18:56:42.535903,2022-11-29 18:56:50.532683,0 days 00:00:07.996780,"{0: 1, 1: 10}",13.0,0.8,110,COMPLETE
40,40,0.6457151625148194,2022-11-29 18:56:50.716675,2022-11-29 18:57:07.459002,0 days 00:00:16.742327,"{0: 1, 1: 100}",20.0,0.6,860,COMPLETE
41,41,0.6354841186168818,2022-11-29 18:57:07.625182,2022-11-29 18:57:26.418857,0 days 00:00:18.793675,"{0: 1, 1: 100}",38.0,,710,COMPLETE
42,42,0.5303369811205967,2022-11-29 18:57:26.586031,2022-11-29 18:57:36.113367,0 days 00:00:09.527336,"{0: 1, 1: 10}",36.0,log2,860,COMPLETE
43,43,0.7140242663695873,2022-11-29 18:57:36.285032,2022-11-29 18:57:51.667464,0 days 00:00:15.382432,"{0: 1, 1: 10}",14.0,0.7,510,COMPLETE
44,44,0.6490847327394507,2022-11-29 18:57:51.836611,2022-11-29 18:58:14.146835,0 days 00:00:22.310224,balanced,21.0,,760,COMPLETE
45,45,0.6486937433308623,2022-11-29 18:58:14.313103,2022-11-29 18:58:21.382031,0 days 00:00:07.068928,"{0: 1, 1: 10}",11.0,sqrt,310,COMPLETE
46,46,0.6395120206005921,2022-11-29 18:58:21.558559,2022-11-29 18:58:32.661755,0 days 00:00:11.103196,"{0: 1, 1: 100}",25.0,0.7,360,COMPLETE
47,47,0.6721293245634686,2022-11-29 18:58:32.842946,2022-11-29 18:58:53.291603,0 days 00:00:20.448657,,35.0,,360,COMPLETE
48,48,0.5512513272180707,2022-11-29 18:58:53.459777,2022-11-29 18:59:00.407555,0 days 00:00:06.947778,"{0: 1, 1: 10}",25.0,log2,60,COMPLETE
49,49,0.6625663788431267,2022-11-29 18:59:00.583561,2022-11-29 18:59:14.002401,0 days 00:00:13.418840,balanced,19.0,0.6,510,COMPLETE
50,50,0.650884409890564,2022-11-29 18:59:14.148676,2022-11-29 18:59:34.267517,0 days 00:00:20.118841,balanced,16.0,,660,COMPLETE
51,51,0.7158540903219383,2022-11-29 18:59:34.441785,2022-11-29 18:59:42.869087,0 days 00:00:08.427302,"{0: 1, 1: 10}",36.0,,110,COMPLETE
52,52,0.7176954412305385,2022-11-29 18:59:43.057068,2022-11-29 18:59:57.495582,0 days 00:00:14.438514,"{0: 1, 1: 10}",28.0,0.8,410,COMPLETE
53,53,0.5863092178779252,2022-11-29 18:59:57.686890,2022-11-29 19:00:16.158335,0 days 00:00:18.471445,"{0: 1, 1: 100}",3.0,,910,COMPLETE
54,54,0.5915924088567659,2022-11-29 19:00:16.346846,2022-11-29 19:00:23.511402,0 days 00:00:07.164556,"{0: 1, 1: 100}",,log2,310,COMPLETE
55,55,0.6424470935874597,2022-11-29 19:00:23.680770,2022-11-29 19:00:37.833723,0 days 00:00:14.152953,"{0: 1, 1: 100}",19.0,0.6,660,COMPLETE
56,56,0.7245444188528964,2022-11-29 19:00:38.010086,2022-11-29 19:00:59.459261,0 days 00:00:21.449175,,6.0,,460,COMPLETE
57,57,0.5577167121812994,2022-11-29 19:00:59.644172,2022-11-29 19:01:08.164897,0 days 00:00:08.520725,"{0: 1, 1: 10}",23.0,log2,660,COMPLETE
58,58,0.6034029393919003,2022-11-29 19:01:08.339603,2022-11-29 19:01:15.182981,0 days 00:00:06.843378,balanced,,0.8,10,COMPLETE
59,59,0.7150442203225842,2022-11-29 19:01:15.368023,2022-11-29 19:01:27.792040,0 days 00:00:12.424017,"{0: 1, 1: 10}",24.0,1.0,260,COMPLETE
60,60,0.6572259844177883,2022-11-29 19:01:27.960040,2022-11-29 19:01:34.715349,0 days 00:00:06.755309,"{0: 1, 1: 10}",21.0,0.7,10,COMPLETE
61,61,0.6790544554023611,2022-11-29 19:01:34.880732,2022-11-29 19:01:42.063314,0 days 00:00:07.182582,balanced,4.0,0.6,110,COMPLETE
62,62,0.6637155509580746,2022-11-29 19:01:42.232333,2022-11-29 19:02:03.338622,0 days 00:00:21.106289,balanced,36.0,0.7,910,COMPLETE
63,63,0.6328337472450977,2022-11-29 19:02:03.519671,2022-11-29 19:02:19.356596,0 days 00:00:15.836925,balanced,9.0,0.8,560,COMPLETE
64,64,0.6522083879365171,2022-11-29 19:02:19.546072,2022-11-29 19:02:33.325776,0 days 00:00:13.779704,balanced,5.0,0.7,510,COMPLETE
65,65,0.6707509414014223,2022-11-29 19:02:33.509711,2022-11-29 19:02:43.282865,0 days 00:00:09.773154,"{0: 1, 1: 100}",31.0,sqrt,910,COMPLETE
66,66,0.7126374668886253,2022-11-29 19:02:43.471174,2022-11-29 19:02:58.939288,0 days 00:00:15.468114,"{0: 1, 1: 10}",21.0,0.8,460,COMPLETE
67,67,0.5860117095060746,2022-11-29 19:02:59.147436,2022-11-29 19:03:07.066102,0 days 00:00:07.918666,,19.0,sqrt,460,COMPLETE
68,68,0.6031685994533726,2022-11-29 19:03:07.236396,2022-11-29 19:03:14.574816,0 days 00:00:07.338420,balanced,14.0,log2,310,COMPLETE
69,69,0.6731922221383453,2022-11-29 19:03:14.730664,2022-11-29 19:03:44.013382,0 days 00:00:29.282718,,29.0,0.8,710,COMPLETE
70,70,0.6639538109626578,2022-11-29 19:03:44.193558,2022-11-29 19:03:53.663546,0 days 00:00:09.469988,balanced,19.0,sqrt,860,COMPLETE
71,71,0.602733597191795,2022-11-29 19:03:53.836219,2022-11-29 19:04:05.829735,0 days 00:00:11.993516,"{0: 1, 1: 100}",5.0,0.7,510,COMPLETE
72,72,0.6767611696795732,2022-11-29 19:04:06.007538,2022-11-29 19:04:32.070289,0 days 00:00:26.062751,,33.0,,510,COMPLETE
73,73,0.7264800182110418,2022-11-29 19:04:32.239752,2022-11-29 19:04:42.769754,0 days 00:00:10.530002,"{0: 1, 1: 10}",5.0,,210,COMPLETE
74,74,0.6428920589888271,2022-11-29 19:04:42.966410,2022-11-29 19:05:06.347507,0 days 00:00:23.381097,"{0: 1, 1: 100}",31.0,,960,COMPLETE
75,75,0.6274560338664273,2022-11-29 19:05:06.543067,2022-11-29 19:05:15.811634,0 days 00:00:09.268567,balanced,3.0,sqrt,910,COMPLETE
76,76,0.7176378611887779,2022-11-29 19:05:16.014991,2022-11-29 19:05:41.289278,0 days 00:00:25.274287,"{0: 1, 1: 10}",37.0,1.0,760,COMPLETE
77,77,0.6632129316316446,2022-11-29 19:05:41.441035,2022-11-29 19:05:53.467785,0 days 00:00:12.026750,balanced,31.0,0.6,410,COMPLETE
78,78,0.6751836130658602,2022-11-29 19:05:53.636773,2022-11-29 19:06:01.556940,0 days 00:00:07.920167,,27.0,,60,COMPLETE
79,79,0.6653340493684925,2022-11-29 19:06:01.746261,2022-11-29 19:06:10.818925,0 days 00:00:09.072664,balanced,38.0,0.7,210,COMPLETE
80,80,0.6477336495165249,2022-11-29 19:06:10.989495,2022-11-29 19:06:31.251066,0 days 00:00:20.261571,"{0: 1, 1: 100}",22.0,0.9,860,COMPLETE
81,81,0.6740577754978577,2022-11-29 19:06:31.426987,2022-11-29 19:06:53.980186,0 days 00:00:22.553199,,33.0,0.9,460,COMPLETE
82,82,0.7215934696627426,2022-11-29 19:06:54.168799,2022-11-29 19:07:03.911357,0 days 00:00:09.742558,,7.0,1.0,110,COMPLETE
83,83,0.6275386484865279,2022-11-29 19:07:04.092766,2022-11-29 19:07:14.095350,0 days 00:00:10.002584,"{0: 1, 1: 100}",19.0,0.9,260,COMPLETE
84,84,0.6259936661892842,2022-11-29 19:07:14.265295,2022-11-29 19:07:23.624042,0 days 00:00:09.358747,"{0: 1, 1: 10}",22.0,sqrt,810,COMPLETE
85,85,0.6548269134084694,2022-11-29 19:07:23.805446,2022-11-29 19:07:47.319051,0 days 00:00:23.513605,balanced,25.0,,810,COMPLETE
86,86,0.5994667666252236,2022-11-29 19:07:47.490624,2022-11-29 19:07:56.959278,0 days 00:00:09.468654,"{0: 1, 1: 10}",10.0,log2,960,COMPLETE
87,87,0.6181087974677173,2022-11-29 19:07:57.135226,2022-11-29 19:08:03.896448,0 days 00:00:06.761222,"{0: 1, 1: 10}",14.0,sqrt,160,COMPLETE
88,88,0.5876062759521572,2022-11-29 19:08:04.050071,2022-11-29 19:08:14.755549,0 days 00:00:10.705478,"{0: 1, 1: 100}",6.0,,310,COMPLETE
89,89,0.6734275843231892,2022-11-29 19:08:14.940032,2022-11-29 19:08:35.555987,0 days 00:00:20.615955,,11.0,0.6,560,COMPLETE
90,90,0.6508158274563374,2022-11-29 19:08:35.730093,2022-11-29 19:08:54.632678,0 days 00:00:18.902585,"{0: 1, 1: 100}",38.0,0.9,760,COMPLETE
91,91,0.5981179989868168,2022-11-29 19:08:54.799836,2022-11-29 19:09:03.528476,0 days 00:00:08.728640,,7.0,log2,660,COMPLETE
92,92,0.6248105724663409,2022-11-29 19:09:03.710147,2022-11-29 19:09:25.294677,0 days 00:00:21.584530,balanced,8.0,0.8,860,COMPLETE
93,93,0.6577780900471797,2022-11-29 19:09:25.472750,2022-11-29 19:09:47.474836,0 days 00:00:22.002086,balanced,30.0,0.9,760,COMPLETE
94,94,0.6513013356112909,2022-11-29 19:09:47.654208,2022-11-29 19:09:56.550478,0 days 00:00:08.896270,balanced,22.0,0.9,160,COMPLETE
95,95,0.6813873435791623,2022-11-29 19:09:56.718372,2022-11-29 19:10:08.366634,0 days 00:00:11.648262,,3.0,0.7,410,COMPLETE
96,96,0.5828914938531118,2022-11-29 19:10:08.544477,2022-11-29 19:10:16.528758,0 days 00:00:07.984281,,21.0,sqrt,460,COMPLETE
97,97,0.592916852727944,2022-11-29 19:10:16.705396,2022-11-29 19:10:23.523118,0 days 00:00:06.817722,balanced,24.0,sqrt,10,COMPLETE
98,98,0.6596018934096963,2022-11-29 19:10:23.699685,2022-11-29 19:10:30.818085,0 days 00:00:07.118400,balanced,23.0,sqrt,310,COMPLETE
99,99,0.6097041024270263,2022-11-29 19:10:30.989743,2022-11-29 19:10:44.975349,0 days 00:00:13.985606,"{0: 1, 1: 100}",9.0,0.7,610,COMPLETE
100,100,0.6413347136297235,2022-11-29 19:10:45.156426,2022-11-29 19:11:05.792159,0 days 00:00:20.635733,"{0: 1, 1: 100}",24.0,1.0,810,COMPLETE
101,101,0.6627568532314266,2022-11-29 19:11:05.994579,2022-11-29 19:11:14.540158,0 days 00:00:08.545579,balanced,20.0,sqrt,610,COMPLETE
102,102,0.634797205572019,2022-11-29 19:11:14.725541,2022-11-29 19:11:21.709611,0 days 00:00:06.984070,"{0: 1, 1: 100}",9.0,sqrt,160,COMPLETE
103,103,0.7132546251994036,2022-11-29 19:11:21.895792,2022-11-29 19:11:41.955572,0 days 00:00:20.059780,"{0: 1, 1: 10}",24.0,1.0,560,COMPLETE
104,104,0.6402940466349796,2022-11-29 19:11:42.132466,2022-11-29 19:11:51.679413,0 days 00:00:09.546947,"{0: 1, 1: 100}",11.0,sqrt,960,COMPLETE
105,105,0.6842148664178483,2022-11-29 19:11:51.849381,2022-11-29 19:11:58.764274,0 days 00:00:06.914893,"{0: 1, 1: 10}",,,10,COMPLETE
106,106,0.6609002903715593,2022-11-29 19:11:58.941875,2022-11-29 19:12:21.450778,0 days 00:00:22.508903,balanced,25.0,0.8,910,COMPLETE
107,107,0.6218000769931714,2022-11-29 19:12:21.617084,2022-11-29 19:12:42.036129,0 days 00:00:20.419045,"{0: 1, 1: 100}",11.0,,810,COMPLETE
108,108,0.6511644226997211,2022-11-29 19:12:42.212842,2022-11-29 19:13:08.778686,0 days 00:00:26.565844,balanced,12.0,,910,COMPLETE
109,109,0.6716310220845985,2022-11-29 19:13:08.961360,2022-11-29 19:13:24.464096,0 days 00:00:15.502736,,2.0,0.7,960,COMPLETE
110,110,0.652547604305283,2022-11-29 19:13:24.629109,2022-11-29 19:13:31.492652,0 days 00:00:06.863543,"{0: 1, 1: 10}",7.0,sqrt,210,COMPLETE
111,111,0.5905203953342033,2022-11-29 19:13:31.665424,2022-11-29 19:13:45.652163,0 days 00:00:13.986739,"{0: 1, 1: 100}",3.0,0.7,760,COMPLETE
112,112,0.6627971532988838,2022-11-29 19:13:45.853100,2022-11-29 19:13:52.724060,0 days 00:00:06.870960,"{0: 1, 1: 100}",32.0,sqrt,110,COMPLETE
113,113,0.7174363620956903,2022-11-29 19:13:52.900579,2022-11-29 19:14:12.780001,0 days 00:00:19.879422,"{0: 1, 1: 10}",5.0,0.6,910,COMPLETE
114,114,0.6309015334548667,2022-11-29 19:14:12.962804,2022-11-29 19:14:22.928381,0 days 00:00:09.965577,"{0: 1, 1: 100}",16.0,0.7,310,COMPLETE
115,115,0.6316486299267238,2022-11-29 19:14:23.111304,2022-11-29 19:14:32.677532,0 days 00:00:09.566228,"{0: 1, 1: 100}",30.0,log2,960,COMPLETE
116,116,0.6729241092414977,2022-11-29 19:14:32.847757,2022-11-29 19:14:56.471434,0 days 00:00:23.623677,,35.0,0.6,710,COMPLETE
117,117,0.6431279144442484,2022-11-29 19:14:56.641908,2022-11-29 19:15:06.699432,0 days 00:00:10.057524,"{0: 1, 1: 100}",29.0,0.7,310,COMPLETE
118,118,0.669105918717237,2022-11-29 19:15:06.871499,2022-11-29 19:15:21.659982,0 days 00:00:14.788483,,32.0,0.6,360,COMPLETE
119,119,0.6606577682724326,2022-11-29 19:15:21.840634,2022-11-29 19:15:41.873835,0 days 00:00:20.033201,balanced,25.0,0.7,860,COMPLETE
120,120,0.6751086659019452,2022-11-29 19:15:42.052184,2022-11-29 19:16:11.228500,0 days 00:00:29.176316,,38.0,0.7,810,COMPLETE
121,121,0.5886894939437324,2022-11-29 19:16:11.385683,2022-11-29 19:16:18.196401,0 days 00:00:06.810718,balanced,13.0,sqrt,10,COMPLETE
122,122,0.5304424643759784,2022-11-29 19:16:18.387431,2022-11-29 19:16:25.555221,0 days 00:00:07.167790,"{0: 1, 1: 10}",30.0,log2,310,COMPLETE
123,123,0.602023024992121,2022-11-29 19:16:25.742680,2022-11-29 19:16:33.180348,0 days 00:00:07.437668,,4.0,log2,260,COMPLETE
124,124,0.7139668566883166,2022-11-29 19:16:33.354682,2022-11-29 19:16:54.389257,0 days 00:00:21.034575,"{0: 1, 1: 10}",30.0,0.9,660,COMPLETE
125,125,0.6018298729266164,2022-11-29 19:16:54.569533,2022-11-29 19:17:04.864871,0 days 00:00:10.295338,"{0: 1, 1: 100}",6.0,0.6,410,COMPLETE
126,126,0.6236659011286225,2022-11-29 19:17:05.052370,2022-11-29 19:17:11.847059,0 days 00:00:06.794689,"{0: 1, 1: 100}",34.0,,60,COMPLETE
127,127,0.6784058427928342,2022-11-29 19:17:12.009111,2022-11-29 19:17:35.910436,0 days 00:00:23.901325,,10.0,0.6,710,COMPLETE
128,128,0.687622539091316,2022-11-29 19:17:36.081970,2022-11-29 19:17:46.196623,0 days 00:00:10.114653,,4.0,0.7,260,COMPLETE
129,129,0.6378401370998035,2022-11-29 19:17:46.365086,2022-11-29 19:17:53.342853,0 days 00:00:06.977767,balanced,7.0,sqrt,210,COMPLETE
130,130,0.5470560650009766,2022-11-29 19:17:53.512679,2022-11-29 19:18:01.600004,0 days 00:00:08.087325,"{0: 1, 1: 10}",26.0,log2,560,COMPLETE
131,131,0.6557520943382908,2022-11-29 19:18:01.754685,2022-11-29 19:18:12.670708,0 days 00:00:10.916023,balanced,33.0,0.7,310,COMPLETE
132,132,0.6727501269590309,2022-11-29 19:18:12.842055,2022-11-29 19:18:21.616130,0 days 00:00:08.774075,,15.0,0.7,110,COMPLETE
133,133,0.5854679107374163,2022-11-29 19:18:21.799571,2022-11-29 19:18:40.543102,0 days 00:00:18.743531,"{0: 1, 1: 100}",3.0,1.0,960,COMPLETE
134,134,0.6676370453809698,2022-11-29 19:18:40.714765,2022-11-29 19:18:57.679441,0 days 00:00:16.964676,balanced,33.0,0.6,760,COMPLETE
135,135,0.6285412265117426,2022-11-29 19:18:57.849478,2022-11-29 19:19:07.187065,0 days 00:00:09.337587,"{0: 1, 1: 10}",30.0,sqrt,810,COMPLETE
136,136,0.6525590864503763,2022-11-29 19:19:07.376735,2022-11-29 19:19:32.611252,0 days 00:00:25.234517,balanced,22.0,,910,COMPLETE
137,137,0.6382159730941183,2022-11-29 19:19:32.795968,2022-11-29 19:19:40.583712,0 days 00:00:07.787744,,7.0,sqrt,510,COMPLETE
138,138,0.7093411243641817,2022-11-29 19:19:40.744348,2022-11-29 19:19:50.243146,0 days 00:00:09.498798,"{0: 1, 1: 10}",17.0,,160,COMPLETE
139,139,0.7231895104356265,2022-11-29 19:19:50.413174,2022-11-29 19:20:11.365391,0 days 00:00:20.952217,"{0: 1, 1: 10}",8.0,0.9,660,COMPLETE
140,140,0.5882648445362672,2022-11-29 19:20:11.530182,2022-11-29 19:20:18.386660,0 days 00:00:06.856478,balanced,14.0,0.8,10,COMPLETE
141,141,0.71021451759714,2022-11-29 19:20:18.572603,2022-11-29 19:20:39.499220,0 days 00:00:20.926617,"{0: 1, 1: 10}",29.0,0.7,810,COMPLETE
142,142,0.5871510015648594,2022-11-29 19:20:39.667813,2022-11-29 19:20:46.524564,0 days 00:00:06.856751,balanced,24.0,log2,110,COMPLETE
143,143,0.6538026658976006,2022-11-29 19:20:46.683089,2022-11-29 19:21:01.539532,0 days 00:00:14.856443,balanced,38.0,0.9,460,COMPLETE
144,144,0.6746500395924047,2022-11-29 19:21:01.714406,2022-11-29 19:21:13.563962,0 days 00:00:11.849556,,18.0,1.0,160,COMPLETE
145,145,0.6611997302642283,2022-11-29 19:21:13.739549,2022-11-29 19:21:21.926849,0 days 00:00:08.187300,balanced,,0.7,160,COMPLETE
146,146,0.6767652873681056,2022-11-29 19:21:22.086839,2022-11-29 19:21:47.983848,0 days 00:00:25.897009,,13.0,,510,COMPLETE
147,147,0.6721262942949013,2022-11-29 19:21:48.165649,2022-11-29 19:22:00.016078,0 days 00:00:11.850429,,22.0,,160,COMPLETE
148,148,0.6565029109888121,2022-11-29 19:22:00.186102,2022-11-29 19:22:09.704100,0 days 00:00:09.517998,balanced,33.0,sqrt,810,COMPLETE
149,149,0.599906557770089,2022-11-29 19:22:09.865628,2022-11-29 19:22:19.519216,0 days 00:00:09.653588,"{0: 1, 1: 100}",,log2,910,COMPLETE
150,150,0.7145079483327545,2022-11-29 19:22:19.700715,2022-11-29 19:22:33.185003,0 days 00:00:13.484288,"{0: 1, 1: 10}",18.0,1.0,310,COMPLETE
151,151,0.6401184014621755,2022-11-29 19:22:33.347621,2022-11-29 19:22:40.479607,0 days 00:00:07.131986,"{0: 1, 1: 100}",29.0,0.6,110,COMPLETE
152,152,0.707449718653365,2022-11-29 19:22:40.652258,2022-11-29 19:23:00.658027,0 days 00:00:20.005769,"{0: 1, 1: 10}",30.0,0.7,760,COMPLETE
153,153,0.6438744890680741,2022-11-29 19:23:00.825815,2022-11-29 19:23:18.976452,0 days 00:00:18.150637,"{0: 1, 1: 100}",22.0,0.8,810,COMPLETE
154,154,0.6760536904396169,2022-11-29 19:23:19.151034,2022-11-29 19:23:54.622179,0 days 00:00:35.471145,,39.0,0.8,910,COMPLETE
155,155,0.5945239211413602,2022-11-29 19:23:54.785569,2022-11-29 19:24:04.008028,0 days 00:00:09.222459,,11.0,sqrt,810,COMPLETE
156,156,0.6292127270196741,2022-11-29 19:24:04.170277,2022-11-29 19:24:11.123872,0 days 00:00:06.953595,balanced,6.0,sqrt,160,COMPLETE
157,157,0.6870724779606125,2022-11-29 19:24:11.298259,2022-11-29 19:24:26.442704,0 days 00:00:15.144445,,2.0,1.0,710,COMPLETE
158,158,0.6260512550040943,2022-11-29 19:24:26.627488,2022-11-29 19:24:35.775127,0 days 00:00:09.147639,"{0: 1, 1: 10}",28.0,sqrt,760,COMPLETE
159,159,0.7169271455969277,2022-11-29 19:24:35.918914,2022-11-29 19:24:50.343525,0 days 00:00:14.424611,,6.0,0.6,410,COMPLETE
160,160,0.6768647862012026,2022-11-29 19:24:50.514371,2022-11-29 19:25:20.259887,0 days 00:00:29.745516,,28.0,1.0,610,COMPLETE
