,number,value,datetime_start,datetime_complete,duration,params_class_weight,params_max_depth,params_max_features,params_n_estimators,state
1274,1274,0.7321571101324765,2022-11-30 00:01:50.722139,2022-11-30 00:02:10.885490,0 days 00:00:20.163351,"{0: 1, 1: 10}",6.0,,610,COMPLETE
1275,1275,0.7307358704785797,2022-11-30 00:02:11.116210,2022-11-30 00:02:31.119930,0 days 00:00:20.003720,"{0: 1, 1: 10}",6.0,,610,COMPLETE
1276,1276,0.7163174757647057,2022-11-30 00:02:31.338796,2022-11-30 00:02:49.407458,0 days 00:00:18.068662,"{0: 1, 1: 10}",4.0,,610,COMPLETE
1277,1277,0.7315851866752047,2022-11-30 00:02:49.627343,2022-11-30 00:03:09.753418,0 days 00:00:20.126075,"{0: 1, 1: 10}",6.0,,610,COMPLETE
1278,1278,0.7315486218384213,2022-11-30 00:03:09.978364,2022-11-30 00:03:29.742284,0 days 00:00:19.763920,"{0: 1, 1: 10}",6.0,,610,COMPLETE
1279,1279,0.729816651719357,2022-11-30 00:03:29.964372,2022-11-30 00:03:50.138676,0 days 00:00:20.174304,"{0: 1, 1: 10}",6.0,,610,COMPLETE
1280,1280,0.7314056668785934,2022-11-30 00:03:50.364065,2022-11-30 00:04:10.423497,0 days 00:00:20.059432,"{0: 1, 1: 10}",6.0,,610,COMPLETE
1281,1281,0.7137320096698829,2022-11-30 00:04:10.657820,2022-11-30 00:04:31.078422,0 days 00:00:20.420602,"{0: 1, 1: 10}",21.0,,610,COMPLETE
1282,1282,0.7338263928127026,2022-11-30 00:04:31.295685,2022-11-30 00:04:51.333678,0 days 00:00:20.037993,"{0: 1, 1: 10}",6.0,,610,COMPLETE
1283,1283,0.7343823846703498,2022-11-30 00:04:51.557270,2022-11-30 00:05:11.482712,0 days 00:00:19.925442,"{0: 1, 1: 10}",6.0,,610,COMPLETE
1284,1284,0.7326735272057754,2022-11-30 00:05:11.713247,2022-11-30 00:05:31.652472,0 days 00:00:19.939225,"{0: 1, 1: 10}",6.0,,610,COMPLETE
1285,1285,0.7365987465114275,2022-11-30 00:05:31.873383,2022-11-30 00:05:51.915969,0 days 00:00:20.042586,"{0: 1, 1: 10}",6.0,,610,COMPLETE
1286,1286,0.7279758397267184,2022-11-30 00:05:52.141157,2022-11-30 00:06:12.468416,0 days 00:00:20.327259,"{0: 1, 1: 10}",7.0,,610,COMPLETE
1287,1287,0.734854568132097,2022-11-30 00:06:12.691468,2022-11-30 00:06:32.793371,0 days 00:00:20.101903,"{0: 1, 1: 10}",6.0,,610,COMPLETE
1288,1288,0.7175653108718919,2022-11-30 00:06:33.017715,2022-11-30 00:06:53.527086,0 days 00:00:20.509371,"{0: 1, 1: 10}",12.0,,610,COMPLETE
1289,1289,0.7313190822717409,2022-11-30 00:06:53.743330,2022-11-30 00:07:13.702486,0 days 00:00:19.959156,"{0: 1, 1: 10}",6.0,,610,COMPLETE
1290,1290,0.7307886634879471,2022-11-30 00:07:13.934775,2022-11-30 00:07:33.924776,0 days 00:00:19.990001,"{0: 1, 1: 10}",6.0,,610,COMPLETE
1291,1291,0.7330023110599873,2022-11-30 00:07:34.142161,2022-11-30 00:07:54.358423,0 days 00:00:20.216262,"{0: 1, 1: 10}",6.0,,610,COMPLETE
1292,1292,0.7177238472190945,2022-11-30 00:07:54.576450,2022-11-30 00:08:15.146205,0 days 00:00:20.569755,"{0: 1, 1: 10}",15.0,,610,COMPLETE
1293,1293,0.7155544221397968,2022-11-30 00:08:15.366440,2022-11-30 00:08:35.797936,0 days 00:00:20.431496,"{0: 1, 1: 10}",,,610,COMPLETE
1294,1294,0.72943020033338,2022-11-30 00:08:36.024731,2022-11-30 00:08:55.982863,0 days 00:00:19.958132,"{0: 1, 1: 10}",6.0,,610,COMPLETE
1295,1295,0.7331232360691399,2022-11-30 00:08:56.205894,2022-11-30 00:09:16.139166,0 days 00:00:19.933272,"{0: 1, 1: 10}",6.0,,610,COMPLETE
1296,1296,0.7308571560183236,2022-11-30 00:09:16.359285,2022-11-30 00:09:36.177862,0 days 00:00:19.818577,"{0: 1, 1: 10}",6.0,,610,COMPLETE
1297,1297,0.7098528040339949,2022-11-30 00:09:36.400231,2022-11-30 00:09:52.595752,0 days 00:00:16.195521,"{0: 1, 1: 10}",3.0,,610,COMPLETE
1298,1298,0.733331566101002,2022-11-30 00:09:52.817356,2022-11-30 00:10:12.697112,0 days 00:00:19.879756,"{0: 1, 1: 10}",6.0,,610,COMPLETE
1299,1299,0.7303772688358838,2022-11-30 00:10:12.914872,2022-11-30 00:10:34.107601,0 days 00:00:21.192729,"{0: 1, 1: 10}",6.0,,660,COMPLETE
1300,1300,0.7348340463124456,2022-11-30 00:10:34.334731,2022-11-30 00:10:54.214580,0 days 00:00:19.879849,"{0: 1, 1: 10}",6.0,,610,COMPLETE
1301,1301,0.7334900942932594,2022-11-30 00:10:54.440991,2022-11-30 00:11:14.267997,0 days 00:00:19.827006,"{0: 1, 1: 10}",6.0,,610,COMPLETE
1302,1302,0.719958926948171,2022-11-30 00:11:14.514221,2022-11-30 00:11:34.789244,0 days 00:00:20.275023,"{0: 1, 1: 10}",25.0,,610,COMPLETE
1303,1303,0.7180291911793705,2022-11-30 00:11:35.010073,2022-11-30 00:11:56.616663,0 days 00:00:21.606590,"{0: 1, 1: 10}",31.0,,660,COMPLETE
1304,1304,0.7317971800833082,2022-11-30 00:11:56.845187,2022-11-30 00:12:18.114294,0 days 00:00:21.269107,"{0: 1, 1: 10}",6.0,,660,COMPLETE
1305,1305,0.7305913835147696,2022-11-30 00:12:18.345956,2022-11-30 00:12:38.389091,0 days 00:00:20.043135,"{0: 1, 1: 10}",6.0,,610,COMPLETE
1306,1306,0.7331245113886702,2022-11-30 00:12:38.620121,2022-11-30 00:12:58.507355,0 days 00:00:19.887234,"{0: 1, 1: 10}",6.0,,610,COMPLETE
1307,1307,0.7302907334541957,2022-11-30 00:12:58.741106,2022-11-30 00:13:17.529720,0 days 00:00:18.788614,"{0: 1, 1: 10}",6.0,,560,COMPLETE
1308,1308,0.730221571030713,2022-11-30 00:13:17.755865,2022-11-30 00:13:37.731714,0 days 00:00:19.975849,"{0: 1, 1: 10}",6.0,,610,COMPLETE
1309,1309,0.7160904822795868,2022-11-30 00:13:37.953443,2022-11-30 00:13:58.251939,0 days 00:00:20.298496,"{0: 1, 1: 10}",11.0,,610,COMPLETE
1310,1310,0.7338288108919188,2022-11-30 00:13:58.479418,2022-11-30 00:14:19.569176,0 days 00:00:21.089758,"{0: 1, 1: 10}",6.0,,660,COMPLETE
1311,1311,0.7178359450629272,2022-11-30 00:14:19.800741,2022-11-30 00:14:41.446399,0 days 00:00:21.645658,"{0: 1, 1: 10}",18.0,,660,COMPLETE
1312,1312,0.71978389037598,2022-11-30 00:14:41.752318,2022-11-30 00:15:00.714418,0 days 00:00:18.962100,"{0: 1, 1: 10}",4.0,,660,COMPLETE
1313,1313,0.714646507511132,2022-11-30 00:15:00.945876,2022-11-30 00:15:22.602717,0 days 00:00:21.656841,"{0: 1, 1: 10}",35.0,,660,COMPLETE
1314,1314,0.7309999848046114,2022-11-30 00:15:22.824729,2022-11-30 00:15:44.102801,0 days 00:00:21.278072,"{0: 1, 1: 10}",6.0,,660,COMPLETE
1315,1315,0.7329181930257955,2022-11-30 00:15:44.326281,2022-11-30 00:16:02.586634,0 days 00:00:18.260353,"{0: 1, 1: 10}",5.0,,560,COMPLETE
1316,1316,0.7329287461527582,2022-11-30 00:16:02.812361,2022-11-30 00:16:21.735543,0 days 00:00:18.923182,"{0: 1, 1: 10}",6.0,,560,COMPLETE
1317,1317,0.7170000127393251,2022-11-30 00:16:21.960265,2022-11-30 00:16:41.186204,0 days 00:00:19.225939,"{0: 1, 1: 10}",27.0,,560,COMPLETE
1318,1318,0.7335864283444844,2022-11-30 00:16:41.408626,2022-11-30 00:17:00.219849,0 days 00:00:18.811223,"{0: 1, 1: 10}",6.0,,560,COMPLETE
1319,1319,0.7164461627963943,2022-11-30 00:17:00.439076,2022-11-30 00:17:19.744787,0 days 00:00:19.305711,"{0: 1, 1: 10}",39.0,,560,COMPLETE
1320,1320,0.7324819998515457,2022-11-30 00:17:19.965287,2022-11-30 00:17:41.241174,0 days 00:00:21.275887,"{0: 1, 1: 10}",6.0,,660,COMPLETE
1321,1321,0.7314900423010373,2022-11-30 00:17:41.465644,2022-11-30 00:18:01.355354,0 days 00:00:19.889710,"{0: 1, 1: 10}",6.0,,610,COMPLETE
1322,1322,0.7131671298992639,2022-11-30 00:18:01.580384,2022-11-30 00:18:21.958954,0 days 00:00:20.378570,"{0: 1, 1: 10}",21.0,,610,COMPLETE
1323,1323,0.7303802815002013,2022-11-30 00:18:22.184895,2022-11-30 00:18:41.047319,0 days 00:00:18.862424,"{0: 1, 1: 10}",6.0,,560,COMPLETE
1324,1324,0.7186651501920565,2022-11-30 00:18:41.284843,2022-11-30 00:19:03.122061,0 days 00:00:21.837218,"{0: 1, 1: 10}",19.0,,660,COMPLETE
1325,1325,0.7302281557836436,2022-11-30 00:19:03.351795,2022-11-30 00:19:22.175113,0 days 00:00:18.823318,"{0: 1, 1: 10}",6.0,,560,COMPLETE
1326,1326,0.7131879216479249,2022-11-30 00:19:22.423026,2022-11-30 00:19:42.962161,0 days 00:00:20.539135,"{0: 1, 1: 10}",13.0,,610,COMPLETE
1327,1327,0.7289080228083666,2022-11-30 00:19:43.188036,2022-11-30 00:20:03.645163,0 days 00:00:20.457127,"{0: 1, 1: 10}",7.0,,610,COMPLETE
1328,1328,0.7317746793798596,2022-11-30 00:20:03.871575,2022-11-30 00:20:25.024918,0 days 00:00:21.153343,"{0: 1, 1: 10}",6.0,,660,COMPLETE
1329,1329,0.7326301057289961,2022-11-30 00:20:25.244636,2022-11-30 00:20:44.139564,0 days 00:00:18.894928,"{0: 1, 1: 10}",6.0,,560,COMPLETE
1330,1330,0.7137788217386332,2022-11-30 00:20:44.361748,2022-11-30 00:21:03.858190,0 days 00:00:19.496442,"{0: 1, 1: 10}",22.0,,560,COMPLETE
1331,1331,0.7302901162959333,2022-11-30 00:21:04.083804,2022-11-30 00:21:24.243614,0 days 00:00:20.159810,"{0: 1, 1: 10}",6.0,,610,COMPLETE
1332,1332,0.7117299923025651,2022-11-30 00:21:24.471391,2022-11-30 00:21:44.896749,0 days 00:00:20.425358,"{0: 1, 1: 10}",15.0,,610,COMPLETE
1333,1333,0.7314804547683762,2022-11-30 00:21:45.119799,2022-11-30 00:22:05.085003,0 days 00:00:19.965204,"{0: 1, 1: 10}",6.0,,610,COMPLETE
1334,1334,0.71513679705328,2022-11-30 00:22:05.316323,2022-11-30 00:22:24.675651,0 days 00:00:19.359328,"{0: 1, 1: 10}",12.0,,560,COMPLETE
1335,1335,0.7306412765216702,2022-11-30 00:22:24.903773,2022-11-30 00:22:43.835325,0 days 00:00:18.931552,"{0: 1, 1: 10}",6.0,,560,COMPLETE
1336,1336,0.7141278329535634,2022-11-30 00:22:44.064204,2022-11-30 00:23:05.774980,0 days 00:00:21.710776,"{0: 1, 1: 10}",,,660,COMPLETE
1337,1337,0.732245631755764,2022-11-30 00:23:06.002076,2022-11-30 00:23:24.788758,0 days 00:00:18.786682,"{0: 1, 1: 10}",6.0,,560,COMPLETE
1338,1338,0.7293332406742612,2022-11-30 00:23:25.016341,2022-11-30 00:23:44.999877,0 days 00:00:19.983536,"{0: 1, 1: 10}",6.0,,610,COMPLETE
1339,1339,0.7327235993459891,2022-11-30 00:23:45.235843,2022-11-30 00:24:05.286215,0 days 00:00:20.050372,"{0: 1, 1: 10}",6.0,,610,COMPLETE
1340,1340,0.7316237048526096,2022-11-30 00:24:05.516937,2022-11-30 00:24:24.323086,0 days 00:00:18.806149,"{0: 1, 1: 10}",6.0,,560,COMPLETE
1341,1341,0.7328945661282746,2022-11-30 00:24:24.556617,2022-11-30 00:24:43.396706,0 days 00:00:18.840089,"{0: 1, 1: 10}",6.0,,560,COMPLETE
1342,1342,0.7320974884602567,2022-11-30 00:24:43.634483,2022-11-30 00:25:03.644262,0 days 00:00:20.009779,"{0: 1, 1: 10}",6.0,,610,COMPLETE
1343,1343,0.7346963511358899,2022-11-30 00:25:03.870954,2022-11-30 00:25:25.102921,0 days 00:00:21.231967,"{0: 1, 1: 10}",6.0,,660,COMPLETE
1344,1344,0.7088537422147819,2022-11-30 00:25:25.327586,2022-11-30 00:25:42.367184,0 days 00:00:17.039598,"{0: 1, 1: 10}",3.0,,660,COMPLETE
1345,1345,0.7132402292843144,2022-11-30 00:25:42.591386,2022-11-30 00:26:04.309560,0 days 00:00:21.718174,"{0: 1, 1: 10}",27.0,,660,COMPLETE
1346,1346,0.732954651435002,2022-11-30 00:26:04.536242,2022-11-30 00:26:25.752236,0 days 00:00:21.215994,"{0: 1, 1: 10}",6.0,,660,COMPLETE
1347,1347,0.7153642733400581,2022-11-30 00:26:25.983002,2022-11-30 00:26:47.558978,0 days 00:00:21.575976,"{0: 1, 1: 10}",25.0,,660,COMPLETE
1348,1348,0.7306308342169394,2022-11-30 00:26:47.784207,2022-11-30 00:27:08.887861,0 days 00:00:21.103654,"{0: 1, 1: 10}",6.0,,660,COMPLETE
1349,1349,0.7320708879791918,2022-11-30 00:27:09.113375,2022-11-30 00:27:30.347027,0 days 00:00:21.233652,"{0: 1, 1: 10}",6.0,,660,COMPLETE
1350,1350,0.7341604512318947,2022-11-30 00:27:30.569636,2022-11-30 00:27:50.672800,0 days 00:00:20.103164,"{0: 1, 1: 10}",6.0,,610,COMPLETE
1351,1351,0.7165549688309758,2022-11-30 00:27:50.910499,2022-11-30 00:28:11.426223,0 days 00:00:20.515724,"{0: 1, 1: 10}",18.0,,610,COMPLETE
1352,1352,0.7142785263340569,2022-11-30 00:28:11.649487,2022-11-30 00:28:32.043261,0 days 00:00:20.393774,"{0: 1, 1: 10}",31.0,,610,COMPLETE
1353,1353,0.7299260597597396,2022-11-30 00:28:32.273130,2022-11-30 00:28:52.291726,0 days 00:00:20.018596,"{0: 1, 1: 10}",6.0,,610,COMPLETE
1354,1354,0.7150878948464826,2022-11-30 00:28:52.518510,2022-11-30 00:29:14.121405,0 days 00:00:21.602895,"{0: 1, 1: 10}",16.0,,660,COMPLETE
1355,1355,0.7321132446885551,2022-11-30 00:29:14.344575,2022-11-30 00:29:34.334472,0 days 00:00:19.989897,"{0: 1, 1: 10}",6.0,,610,COMPLETE
1356,1356,0.7192292978345747,2022-11-30 00:29:34.557756,2022-11-30 00:29:54.961747,0 days 00:00:20.403991,"{0: 1, 1: 10}",35.0,,610,COMPLETE
1357,1357,0.730588739652986,2022-11-30 00:29:55.192132,2022-11-30 00:30:16.175331,0 days 00:00:20.983199,"{0: 1, 1: 10}",6.0,,660,COMPLETE
1358,1358,0.7165398230431128,2022-11-30 00:30:16.398176,2022-11-30 00:30:38.079790,0 days 00:00:21.681614,"{0: 1, 1: 10}",11.0,,660,COMPLETE
1359,1359,0.7332131017720132,2022-11-30 00:30:38.305054,2022-11-30 00:30:57.657212,0 days 00:00:19.352158,"{0: 1, 1: 10}",5.0,,610,COMPLETE
1360,1360,0.7339522212598036,2022-11-30 00:30:57.893096,2022-11-30 00:31:17.750935,0 days 00:00:19.857839,"{0: 1, 1: 10}",6.0,,610,COMPLETE
1361,1361,0.7157690791596546,2022-11-30 00:31:17.972846,2022-11-30 00:31:39.553315,0 days 00:00:21.580469,"{0: 1, 1: 10}",14.0,,660,COMPLETE
1362,1362,0.7139390603411891,2022-11-30 00:31:39.777658,2022-11-30 00:31:57.864688,0 days 00:00:18.087030,"{0: 1, 1: 10}",4.0,,610,COMPLETE
1363,1363,0.7182560263689219,2022-11-30 00:31:58.097235,2022-11-30 00:32:18.411869,0 days 00:00:20.314634,"{0: 1, 1: 10}",17.0,,610,COMPLETE
1364,1364,0.7313209204957645,2022-11-30 00:32:18.641520,2022-11-30 00:32:39.784777,0 days 00:00:21.143257,"{0: 1, 1: 10}",6.0,,660,COMPLETE
1365,1365,0.731507013304133,2022-11-30 00:32:40.010630,2022-11-30 00:32:59.922562,0 days 00:00:19.911932,"{0: 1, 1: 10}",6.0,,610,COMPLETE
1366,1366,0.717717449272425,2022-11-30 00:33:00.148396,2022-11-30 00:33:20.556318,0 days 00:00:20.407922,"{0: 1, 1: 10}",21.0,,610,COMPLETE
1367,1367,0.7301112971589296,2022-11-30 00:33:20.784157,2022-11-30 00:33:40.718858,0 days 00:00:19.934701,"{0: 1, 1: 10}",6.0,,610,COMPLETE
1368,1368,0.732551357118519,2022-11-30 00:33:40.956451,2022-11-30 00:34:02.168628,0 days 00:00:21.212177,"{0: 1, 1: 10}",6.0,,660,COMPLETE
1369,1369,0.7167956380654729,2022-11-30 00:34:02.391377,2022-11-30 00:34:22.867807,0 days 00:00:20.476430,"{0: 1, 1: 10}",39.0,,610,COMPLETE
1370,1370,0.7302419984271789,2022-11-30 00:34:23.102813,2022-11-30 00:34:44.272690,0 days 00:00:21.169877,"{0: 1, 1: 10}",6.0,,660,COMPLETE
1371,1371,0.7136832721167147,2022-11-30 00:34:44.499821,2022-11-30 00:35:04.922221,0 days 00:00:20.422400,"{0: 1, 1: 10}",19.0,,610,COMPLETE
1372,1372,0.7309512883576164,2022-11-30 00:35:05.147986,2022-11-30 00:35:24.846635,0 days 00:00:19.698649,"{0: 1, 1: 10}",6.0,,610,COMPLETE
1373,1373,0.7162781503597206,2022-11-30 00:35:25.071735,2022-11-30 00:35:46.650919,0 days 00:00:21.579184,"{0: 1, 1: 10}",32.0,,660,COMPLETE
1374,1374,0.6770303953978613,2022-11-30 00:35:46.877769,2022-11-30 00:36:00.626866,0 days 00:00:13.749097,"{0: 1, 1: 10}",2.0,,610,COMPLETE
1375,1375,0.7144569215037347,2022-11-30 00:36:00.852296,2022-11-30 00:36:21.117475,0 days 00:00:20.265179,"{0: 1, 1: 10}",15.0,,610,COMPLETE
1376,1376,0.730316962611594,2022-11-30 00:36:21.352946,2022-11-30 00:36:40.315733,0 days 00:00:18.962787,"{0: 1, 1: 10}",7.0,,560,COMPLETE
1377,1377,0.7179322563141884,2022-11-30 00:36:40.534730,2022-11-30 00:37:01.067820,0 days 00:00:20.533090,"{0: 1, 1: 10}",13.0,,610,COMPLETE
1378,1378,0.7332546246217373,2022-11-30 00:37:01.293345,2022-11-30 00:37:22.414386,0 days 00:00:21.121041,"{0: 1, 1: 10}",6.0,,660,COMPLETE
1379,1379,0.7170837324503385,2022-11-30 00:37:22.643389,2022-11-30 00:37:43.198495,0 days 00:00:20.555106,"{0: 1, 1: 10}",12.0,,610,COMPLETE
1380,1380,0.7305710840100937,2022-11-30 00:37:43.423392,2022-11-30 00:38:02.196222,0 days 00:00:18.772830,"{0: 1, 1: 10}",6.0,,560,COMPLETE
1381,1381,0.7269504803137166,2022-11-30 00:38:02.426042,2022-11-30 00:38:22.481027,0 days 00:00:20.054985,"{0: 1, 1: 10}",6.0,,610,COMPLETE
1382,1382,0.7147513435804064,2022-11-30 00:38:22.715714,2022-11-30 00:38:42.028560,0 days 00:00:19.312846,"{0: 1, 1: 10}",,,560,COMPLETE
1383,1383,0.7151084736549027,2022-11-30 00:38:42.257537,2022-11-30 00:39:04.027702,0 days 00:00:21.770165,"{0: 1, 1: 10}",22.0,,660,COMPLETE
1384,1384,0.7296780446391328,2022-11-30 00:39:04.251220,2022-11-30 00:39:24.105597,0 days 00:00:19.854377,"{0: 1, 1: 10}",6.0,,610,COMPLETE
1385,1385,0.7314689670522241,2022-11-30 00:39:24.331756,2022-11-30 00:39:44.345258,0 days 00:00:20.013502,"{0: 1, 1: 10}",6.0,,610,COMPLETE
1386,1386,0.7346795035776014,2022-11-30 00:39:44.577122,2022-11-30 00:40:03.333990,0 days 00:00:18.756868,"{0: 1, 1: 10}",6.0,,560,COMPLETE
1387,1387,0.5916402605255534,2022-11-30 00:40:03.560811,2022-11-30 00:40:14.429767,0 days 00:00:10.868956,"{0: 1, 1: 10}",1.0,,660,COMPLETE
1388,1388,0.7317510534423567,2022-11-30 00:40:14.664025,2022-11-30 00:40:33.385771,0 days 00:00:18.721746,"{0: 1, 1: 10}",6.0,,560,COMPLETE
1389,1389,0.7345495246751172,2022-11-30 00:40:33.623717,2022-11-30 00:40:53.609715,0 days 00:00:19.985998,"{0: 1, 1: 10}",6.0,,610,COMPLETE
1390,1390,0.7089947032099218,2022-11-30 00:40:53.829924,2022-11-30 00:41:10.018601,0 days 00:00:16.188677,"{0: 1, 1: 10}",3.0,,610,COMPLETE
1391,1391,0.7328380260441246,2022-11-30 00:41:10.245065,2022-11-30 00:41:31.465964,0 days 00:00:21.220899,"{0: 1, 1: 10}",6.0,,660,COMPLETE
1392,1392,0.7174709756929387,2022-11-30 00:41:31.697138,2022-11-30 00:41:52.018946,0 days 00:00:20.321808,"{0: 1, 1: 10}",33.0,,610,COMPLETE
1393,1393,0.7321173762236496,2022-11-30 00:41:52.250645,2022-11-30 00:42:12.211562,0 days 00:00:19.960917,"{0: 1, 1: 10}",6.0,,610,COMPLETE
1394,1394,0.7313757636602902,2022-11-30 00:42:12.431187,2022-11-30 00:42:33.478646,0 days 00:00:21.047459,"{0: 1, 1: 10}",6.0,,660,COMPLETE
1395,1395,0.7326910611104996,2022-11-30 00:42:33.704150,2022-11-30 00:42:54.896051,0 days 00:00:21.191901,"{0: 1, 1: 10}",6.0,,660,COMPLETE
1396,1396,0.7103849048700716,2022-11-30 00:42:55.127093,2022-11-30 00:43:15.457103,0 days 00:00:20.330010,"{0: 1, 1: 10}",26.0,,610,COMPLETE
1397,1397,0.7309293654842293,2022-11-30 00:43:15.684428,2022-11-30 00:43:35.593815,0 days 00:00:19.909387,"{0: 1, 1: 10}",6.0,,610,COMPLETE
1398,1398,0.7183371099162261,2022-11-30 00:43:35.819324,2022-11-30 00:43:56.183547,0 days 00:00:20.364223,"{0: 1, 1: 10}",27.0,,610,COMPLETE
1399,1399,0.7338107490151227,2022-11-30 00:43:56.409857,2022-11-30 00:44:16.303276,0 days 00:00:19.893419,"{0: 1, 1: 10}",6.0,,610,COMPLETE
1400,1400,0.7297629103141975,2022-11-30 00:44:16.532968,2022-11-30 00:44:36.555041,0 days 00:00:20.022073,"{0: 1, 1: 10}",6.0,,610,COMPLETE
1401,1401,0.7182660347590171,2022-11-30 00:44:36.780261,2022-11-30 00:44:58.447317,0 days 00:00:21.667056,"{0: 1, 1: 10}",31.0,,660,COMPLETE
1402,1402,0.7360575024848826,2022-11-30 00:44:58.673040,2022-11-30 00:45:19.743815,0 days 00:00:21.070775,"{0: 1, 1: 10}",6.0,,660,COMPLETE
1403,1403,0.7180463798958707,2022-11-30 00:45:19.979798,2022-11-30 00:45:41.585101,0 days 00:00:21.605303,"{0: 1, 1: 10}",37.0,,660,COMPLETE
1404,1404,0.7356411074262722,2022-11-30 00:45:41.818034,2022-11-30 00:46:03.009159,0 days 00:00:21.191125,"{0: 1, 1: 10}",6.0,,660,COMPLETE
1405,1405,0.7305988914913688,2022-11-30 00:46:03.235441,2022-11-30 00:46:24.433376,0 days 00:00:21.197935,"{0: 1, 1: 10}",6.0,,660,COMPLETE
1406,1406,0.7187222970266509,2022-11-30 00:46:24.660448,2022-11-30 00:46:46.346388,0 days 00:00:21.685940,"{0: 1, 1: 10}",16.0,,660,COMPLETE
1407,1407,0.7136514193051398,2022-11-30 00:46:46.574525,2022-11-30 00:47:08.140035,0 days 00:00:21.565510,"{0: 1, 1: 10}",25.0,,660,COMPLETE
1408,1408,0.7118499641655307,2022-11-30 00:47:08.381406,2022-11-30 00:47:30.066855,0 days 00:00:21.685449,"{0: 1, 1: 10}",35.0,,660,COMPLETE
1409,1409,0.7319729745048734,2022-11-30 00:47:30.288870,2022-11-30 00:47:51.411527,0 days 00:00:21.122657,"{0: 1, 1: 10}",6.0,,660,COMPLETE
1410,1410,0.7167114835425462,2022-11-30 00:47:51.644245,2022-11-30 00:48:13.210833,0 days 00:00:21.566588,"{0: 1, 1: 10}",11.0,,660,COMPLETE
1411,1411,0.7305733231049054,2022-11-30 00:48:13.434242,2022-11-30 00:48:33.722776,0 days 00:00:20.288534,"{0: 1, 1: 10}",5.0,,660,COMPLETE
1412,1412,0.7120938919336213,2022-11-30 00:48:33.946337,2022-11-30 00:48:55.690966,0 days 00:00:21.744629,"{0: 1, 1: 10}",14.0,,660,COMPLETE
1413,1413,0.7347980471091137,2022-11-30 00:48:55.922500,2022-11-30 00:49:17.138102,0 days 00:00:21.215602,"{0: 1, 1: 10}",6.0,,660,COMPLETE
1414,1414,0.7140381813984135,2022-11-30 00:49:17.368933,2022-11-30 00:49:38.869070,0 days 00:00:21.500137,"{0: 1, 1: 10}",18.0,,660,COMPLETE
1415,1415,0.7189758851968621,2022-11-30 00:49:39.090796,2022-11-30 00:49:58.173984,0 days 00:00:19.083188,"{0: 1, 1: 10}",4.0,,660,COMPLETE
1416,1416,0.7117721775537655,2022-11-30 00:49:58.409050,2022-11-30 00:50:21.071002,0 days 00:00:22.661952,"{0: 1, 1: 10}",17.0,,710,COMPLETE
1417,1417,0.732327753525302,2022-11-30 00:50:21.297397,2022-11-30 00:50:42.429637,0 days 00:00:21.132240,"{0: 1, 1: 10}",6.0,,660,COMPLETE
1418,1418,0.7279345751790915,2022-11-30 00:50:42.656748,2022-11-30 00:51:03.791749,0 days 00:00:21.135001,"{0: 1, 1: 10}",6.0,,660,COMPLETE
1419,1419,0.7305727335605207,2022-11-30 00:51:04.028048,2022-11-30 00:51:25.208389,0 days 00:00:21.180341,"{0: 1, 1: 10}",6.0,,660,COMPLETE
1420,1420,0.7140708846744702,2022-11-30 00:51:25.436351,2022-11-30 00:51:47.126292,0 days 00:00:21.689941,"{0: 1, 1: 10}",39.0,,660,COMPLETE
1421,1421,0.7304605582341013,2022-11-30 00:51:47.349020,2022-11-30 00:52:08.542511,0 days 00:00:21.193491,"{0: 1, 1: 10}",6.0,,660,COMPLETE
1422,1422,0.6735838980651031,2022-11-30 00:52:08.766721,2022-11-30 00:52:23.548774,0 days 00:00:14.782053,"{0: 1, 1: 10}",2.0,,710,COMPLETE
1423,1423,0.7162004966637651,2022-11-30 00:52:23.772367,2022-11-30 00:52:45.326791,0 days 00:00:21.554424,"{0: 1, 1: 10}",32.0,,660,COMPLETE
1424,1424,0.7163398199328365,2022-11-30 00:52:45.553864,2022-11-30 00:53:08.439207,0 days 00:00:22.885343,"{0: 1, 1: 10}",19.0,,710,COMPLETE
1425,1425,0.7302640460665557,2022-11-30 00:53:08.665866,2022-11-30 00:53:29.826479,0 days 00:00:21.160613,"{0: 1, 1: 10}",6.0,,660,COMPLETE
1426,1426,0.7127181636390232,2022-11-30 00:53:30.048876,2022-11-30 00:53:50.497370,0 days 00:00:20.448494,"{0: 1, 1: 10}",21.0,,610,COMPLETE
1427,1427,0.7324709080049084,2022-11-30 00:53:50.732478,2022-11-30 00:54:11.941662,0 days 00:00:21.209184,"{0: 1, 1: 10}",6.0,,660,COMPLETE
1428,1428,0.7271432091629046,2022-11-30 00:54:12.172256,2022-11-30 00:54:32.484577,0 days 00:00:20.312321,"{0: 1, 1: 10}",7.0,,610,COMPLETE
1429,1429,0.7200103427512927,2022-11-30 00:54:32.702198,2022-11-30 00:54:53.397058,0 days 00:00:20.694860,"{0: 1, 1: 10}",13.0,,610,COMPLETE
