,number,value,datetime_start,datetime_complete,duration,params_class_weight,params_max_depth,params_max_features,params_n_estimators,state
480,480,0.6767682124588938,2022-11-29 20:42:07.684609,2022-11-29 20:42:41.483681,0 days 00:00:33.799072,,23.0,1.0,710,COMPLETE
481,481,0.7135505202584166,2022-11-29 20:42:41.658793,2022-11-29 20:43:00.408286,0 days 00:00:18.749493,"{0: 1, 1: 10}",31.0,1.0,510,COMPLETE
482,482,0.607081728034354,2022-11-29 20:43:00.570149,2022-11-29 20:43:07.460049,0 days 00:00:06.889900,"{0: 1, 1: 100}",2.0,1.0,10,COMPLETE
483,483,0.6324816386676159,2022-11-29 20:43:07.639890,2022-11-29 20:43:33.631732,0 days 00:00:25.991842,balanced,9.0,1.0,960,COMPLETE
484,484,0.6550154017111909,2022-11-29 20:43:33.809708,2022-11-29 20:43:43.725487,0 days 00:00:09.915779,balanced,15.0,0.7,260,COMPLETE
485,485,0.6728730542940473,2022-11-29 20:43:43.920075,2022-11-29 20:44:06.551687,0 days 00:00:22.631612,,28.0,0.6,660,COMPLETE
486,486,0.6309077864231907,2022-11-29 20:44:06.730452,2022-11-29 20:44:16.696907,0 days 00:00:09.966455,"{0: 1, 1: 10}",32.0,sqrt,910,COMPLETE
487,487,0.6551801860037643,2022-11-29 20:44:16.884291,2022-11-29 20:44:38.679506,0 days 00:00:21.795215,balanced,25.0,0.9,810,COMPLETE
488,488,0.6735770000391056,2022-11-29 20:44:38.856634,2022-11-29 20:44:55.667622,0 days 00:00:16.810988,,13.0,0.9,310,COMPLETE
489,489,0.5548837193537579,2022-11-29 20:44:55.860310,2022-11-29 20:45:03.896192,0 days 00:00:08.035882,,36.0,log2,510,COMPLETE
490,490,0.6344251934373829,2022-11-29 20:45:04.101487,2022-11-29 20:45:11.016427,0 days 00:00:06.914940,"{0: 1, 1: 100}",39.0,0.7,60,COMPLETE
491,491,0.676363923839711,2022-11-29 20:45:11.197713,2022-11-29 20:45:45.300099,0 days 00:00:34.102386,,34.0,,710,COMPLETE
492,492,0.7089602324278769,2022-11-29 20:45:45.481729,2022-11-29 20:45:57.805927,0 days 00:00:12.324198,"{0: 1, 1: 10}",26.0,0.8,310,COMPLETE
493,493,0.675525387822272,2022-11-29 20:45:57.984438,2022-11-29 20:46:12.194360,0 days 00:00:14.209922,,28.0,0.8,260,COMPLETE
494,494,0.6383068836744248,2022-11-29 20:46:12.389620,2022-11-29 20:46:31.783400,0 days 00:00:19.393780,balanced,9.0,0.8,760,COMPLETE
495,495,0.6677624721366614,2022-11-29 20:46:31.957983,2022-11-29 20:46:38.764612,0 days 00:00:06.806629,"{0: 1, 1: 10}",11.0,0.8,10,COMPLETE
496,496,0.6444548035712026,2022-11-29 20:46:38.949025,2022-11-29 20:46:48.424566,0 days 00:00:09.475541,"{0: 1, 1: 100}",13.0,sqrt,910,COMPLETE
497,497,0.6381462560264718,2022-11-29 20:46:48.609686,2022-11-29 20:46:55.782041,0 days 00:00:07.172355,balanced,20.0,,60,COMPLETE
498,498,0.6454553943203754,2022-11-29 20:46:55.971163,2022-11-29 20:47:16.480128,0 days 00:00:20.508965,"{0: 1, 1: 100}",33.0,1.0,810,COMPLETE
499,499,0.6220907260514955,2022-11-29 20:47:16.664116,2022-11-29 20:47:32.114666,0 days 00:00:15.450550,balanced,7.0,0.9,510,COMPLETE
500,500,0.6629882200116983,2022-11-29 20:47:32.307619,2022-11-29 20:47:42.003422,0 days 00:00:09.695803,,,0.6,160,COMPLETE
501,501,0.7127385353335075,2022-11-29 20:47:42.193447,2022-11-29 20:47:51.581997,0 days 00:00:09.388550,"{0: 1, 1: 10}",17.0,0.9,160,COMPLETE
502,502,0.7156454692996448,2022-11-29 20:47:51.767394,2022-11-29 20:48:19.901401,0 days 00:00:28.134007,"{0: 1, 1: 10}",37.0,0.9,960,COMPLETE
503,503,0.607675954136484,2022-11-29 20:48:20.075152,2022-11-29 20:48:26.980501,0 days 00:00:06.905349,balanced,38.0,0.8,10,COMPLETE
504,504,0.6157550275243198,2022-11-29 20:48:27.170047,2022-11-29 20:48:34.935656,0 days 00:00:07.765609,"{0: 1, 1: 100}",9.0,0.7,160,COMPLETE
505,505,0.6296866293863977,2022-11-29 20:48:35.096930,2022-11-29 20:48:57.007506,0 days 00:00:21.910576,balanced,8.0,0.8,910,COMPLETE
506,506,0.5745526096444062,2022-11-29 20:48:57.194277,2022-11-29 20:49:05.043499,0 days 00:00:07.849222,balanced,31.0,log2,510,COMPLETE
507,507,0.627489361178238,2022-11-29 20:49:05.241258,2022-11-29 20:49:14.749436,0 days 00:00:09.508178,"{0: 1, 1: 10}",31.0,sqrt,810,COMPLETE
508,508,0.6243315075930155,2022-11-29 20:49:14.915790,2022-11-29 20:49:22.180271,0 days 00:00:07.264481,"{0: 1, 1: 100}",20.0,0.8,110,COMPLETE
509,509,0.6894889781452992,2022-11-29 20:49:22.373890,2022-11-29 20:49:48.783286,0 days 00:00:26.409396,,4.0,,860,COMPLETE
510,510,0.6518454240230813,2022-11-29 20:49:48.961142,2022-11-29 20:49:57.000848,0 days 00:00:08.039706,balanced,30.0,,110,COMPLETE
511,511,0.7168575212522339,2022-11-29 20:49:57.195077,2022-11-29 20:50:18.779939,0 days 00:00:21.584862,"{0: 1, 1: 10}",13.0,0.8,760,COMPLETE
512,512,0.6761954337122587,2022-11-29 20:50:18.970659,2022-11-29 20:50:28.831586,0 days 00:00:09.860927,,27.0,,110,COMPLETE
513,513,0.6725360967978234,2022-11-29 20:50:28.994163,2022-11-29 20:50:35.922028,0 days 00:00:06.927865,,15.0,,10,COMPLETE
514,514,0.6538596503894077,2022-11-29 20:50:36.101009,2022-11-29 20:50:50.243761,0 days 00:00:14.142752,balanced,13.0,0.8,460,COMPLETE
515,515,0.674095353621458,2022-11-29 20:50:50.421139,2022-11-29 20:51:20.593917,0 days 00:00:30.172778,,35.0,0.6,960,COMPLETE
516,516,0.6047209846652943,2022-11-29 20:51:20.770458,2022-11-29 20:51:38.128928,0 days 00:00:17.358470,"{0: 1, 1: 100}",6.0,0.7,910,COMPLETE
517,517,0.6762391184789829,2022-11-29 20:51:38.299257,2022-11-29 20:51:54.199531,0 days 00:00:15.900274,,36.0,1.0,260,COMPLETE
518,518,0.572774305841364,2022-11-29 20:51:54.377864,2022-11-29 20:52:01.301489,0 days 00:00:06.923625,,25.0,sqrt,60,COMPLETE
519,519,0.6856395572696443,2022-11-29 20:52:01.483484,2022-11-29 20:52:10.637940,0 days 00:00:09.154456,"{0: 1, 1: 10}",2.0,1.0,260,COMPLETE
520,520,0.6652952122434513,2022-11-29 20:52:10.823202,2022-11-29 20:52:21.595910,0 days 00:00:10.772708,balanced,37.0,0.7,310,COMPLETE
521,521,0.6744422934486545,2022-11-29 20:52:21.777075,2022-11-29 20:52:36.674894,0 days 00:00:14.897819,,32.0,0.6,360,COMPLETE
522,522,0.6878832573143165,2022-11-29 20:52:36.852670,2022-11-29 20:52:47.291229,0 days 00:00:10.438559,,2.0,,360,COMPLETE
523,523,0.6507535888981456,2022-11-29 20:52:47.492297,2022-11-29 20:53:10.310020,0 days 00:00:22.817723,balanced,14.0,0.9,860,COMPLETE
524,524,0.630405143166761,2022-11-29 20:53:10.495853,2022-11-29 20:53:18.351306,0 days 00:00:07.855453,balanced,5.0,,110,COMPLETE
525,525,0.6573495940229365,2022-11-29 20:53:18.534934,2022-11-29 20:53:43.444512,0 days 00:00:24.909578,balanced,33.0,0.9,960,COMPLETE
526,526,0.6406241765930367,2022-11-29 20:53:43.623576,2022-11-29 20:54:01.063927,0 days 00:00:17.440351,"{0: 1, 1: 100}",20.0,1.0,660,COMPLETE
527,527,0.6350722312099687,2022-11-29 20:54:01.229410,2022-11-29 20:54:08.524054,0 days 00:00:07.294644,"{0: 1, 1: 100}",30.0,0.8,110,COMPLETE
528,528,0.6118426001828843,2022-11-29 20:54:08.706210,2022-11-29 20:54:18.119945,0 days 00:00:09.413735,balanced,3.0,log2,810,COMPLETE
529,529,0.6231771939246065,2022-11-29 20:54:18.305945,2022-11-29 20:54:30.357335,0 days 00:00:12.051390,balanced,6.0,,310,COMPLETE
530,530,0.6335850769345395,2022-11-29 20:54:30.520912,2022-11-29 20:54:37.650173,0 days 00:00:07.129261,,1.0,1.0,160,COMPLETE
531,531,0.7199449544221949,2022-11-29 20:54:37.838792,2022-11-29 20:55:08.076569,0 days 00:00:30.237777,"{0: 1, 1: 10}",23.0,1.0,960,COMPLETE
532,532,0.554801860593721,2022-11-29 20:55:08.265981,2022-11-29 20:55:17.369893,0 days 00:00:09.103912,"{0: 1, 1: 100}",1.0,1.0,410,COMPLETE
533,533,0.6751851748587545,2022-11-29 20:55:17.546577,2022-11-29 20:55:36.540466,0 days 00:00:18.993889,,29.0,0.7,460,COMPLETE
534,534,0.6219655860752279,2022-11-29 20:55:36.738068,2022-11-29 20:55:45.315639,0 days 00:00:08.577571,"{0: 1, 1: 100}",34.0,,160,COMPLETE
535,535,0.6429134187215297,2022-11-29 20:55:45.493223,2022-11-29 20:56:04.062609,0 days 00:00:18.569386,"{0: 1, 1: 100}",30.0,0.9,760,COMPLETE
536,536,0.5946718110949588,2022-11-29 20:56:04.256243,2022-11-29 20:56:21.131731,0 days 00:00:16.875488,"{0: 1, 1: 100}",4.0,0.9,810,COMPLETE
537,537,0.6378660080725875,2022-11-29 20:56:21.335122,2022-11-29 20:56:28.483425,0 days 00:00:07.148303,"{0: 1, 1: 100}",9.0,sqrt,260,COMPLETE
538,538,0.5843099801817383,2022-11-29 20:56:28.660171,2022-11-29 20:56:35.572986,0 days 00:00:06.912815,,19.0,sqrt,60,COMPLETE
539,539,0.6758605907914764,2022-11-29 20:56:35.738178,2022-11-29 20:56:49.651393,0 days 00:00:13.913215,,17.0,,210,COMPLETE
540,540,0.6246098925791757,2022-11-29 20:56:49.833892,2022-11-29 20:56:59.191554,0 days 00:00:09.357662,"{0: 1, 1: 100}",32.0,log2,860,COMPLETE
541,541,0.7120223362792085,2022-11-29 20:56:59.373656,2022-11-29 20:57:13.987816,0 days 00:00:14.614160,"{0: 1, 1: 10}",11.0,,360,COMPLETE
542,542,0.5584055335609598,2022-11-29 20:57:14.166892,2022-11-29 20:57:22.045592,0 days 00:00:07.878700,,29.0,log2,460,COMPLETE
543,543,0.7186925385419646,2022-11-29 20:57:22.253025,2022-11-29 20:57:51.007854,0 days 00:00:28.754829,"{0: 1, 1: 10}",23.0,,910,COMPLETE
544,544,0.6543967421854217,2022-11-29 20:57:51.183261,2022-11-29 20:58:14.160468,0 days 00:00:22.977207,balanced,25.0,0.9,860,COMPLETE
545,545,0.6701479885769388,2022-11-29 20:58:14.357642,2022-11-29 20:58:23.835220,0 days 00:00:09.477578,"{0: 1, 1: 100}",28.0,sqrt,810,COMPLETE
546,546,0.602856999885858,2022-11-29 20:58:24.039327,2022-11-29 20:58:31.341536,0 days 00:00:07.302209,,9.0,sqrt,360,COMPLETE
547,547,0.7112317855451131,2022-11-29 20:58:31.520726,2022-11-29 20:58:39.034177,0 days 00:00:07.513451,"{0: 1, 1: 10}",10.0,0.6,110,COMPLETE
548,548,0.5351228995530024,2022-11-29 20:58:39.221948,2022-11-29 20:58:47.645624,0 days 00:00:08.423676,"{0: 1, 1: 10}",30.0,log2,610,COMPLETE
549,549,0.712496842836077,2022-11-29 20:58:47.820831,2022-11-29 20:59:17.841077,0 days 00:00:30.020246,"{0: 1, 1: 10}",24.0,1.0,960,COMPLETE
550,550,0.6304284767765165,2022-11-29 20:59:18.016828,2022-11-29 20:59:27.523066,0 days 00:00:09.506238,"{0: 1, 1: 10}",,sqrt,810,COMPLETE
551,551,0.5210308754659692,2022-11-29 20:59:27.729439,2022-11-29 20:59:34.756305,0 days 00:00:07.026866,"{0: 1, 1: 100}",7.0,log2,10,COMPLETE
552,552,0.6677679407681659,2022-11-29 20:59:34.929551,2022-11-29 20:59:44.888468,0 days 00:00:09.958917,balanced,12.0,0.7,260,COMPLETE
553,553,0.6528068774135437,2022-11-29 20:59:45.072415,2022-11-29 20:59:51.951975,0 days 00:00:06.879560,balanced,38.0,0.6,60,COMPLETE
554,554,0.5863918839670219,2022-11-29 20:59:52.151672,2022-11-29 20:59:59.051886,0 days 00:00:06.900214,"{0: 1, 1: 100}",17.0,0.7,10,COMPLETE
555,555,0.5810246101608829,2022-11-29 20:59:59.248981,2022-11-29 21:00:08.360191,0 days 00:00:09.111210,balanced,34.0,log2,760,COMPLETE
556,556,0.6549805260421275,2022-11-29 21:00:08.539961,2022-11-29 21:00:15.468723,0 days 00:00:06.928762,balanced,34.0,sqrt,110,COMPLETE
557,557,0.6726623469703691,2022-11-29 21:00:15.653470,2022-11-29 21:00:30.512059,0 days 00:00:14.858589,,24.0,0.7,310,COMPLETE
558,558,0.6741699979240603,2022-11-29 21:00:30.698206,2022-11-29 21:00:56.315410,0 days 00:00:25.617204,,18.0,0.8,610,COMPLETE
559,559,0.6113220437704602,2022-11-29 21:00:56.507593,2022-11-29 21:01:17.876519,0 days 00:00:21.368926,"{0: 1, 1: 100}",10.0,1.0,910,COMPLETE
560,560,0.6269132937054326,2022-11-29 21:01:18.073101,2022-11-29 21:01:26.996018,0 days 00:00:08.922917,"{0: 1, 1: 10}",32.0,sqrt,660,COMPLETE
561,561,0.6187601342743365,2022-11-29 21:01:27.195301,2022-11-29 21:01:34.060371,0 days 00:00:06.865070,"{0: 1, 1: 10}",1.0,1.0,10,COMPLETE
562,562,0.7124698744149064,2022-11-29 21:01:34.254537,2022-11-29 21:02:00.574509,0 days 00:00:26.319972,"{0: 1, 1: 10}",22.0,1.0,810,COMPLETE
563,563,0.611846093590215,2022-11-29 21:02:00.768628,2022-11-29 21:02:08.505628,0 days 00:00:07.737000,"{0: 1, 1: 100}",29.0,log2,460,COMPLETE
564,564,0.5824965793629142,2022-11-29 21:02:08.684928,2022-11-29 21:02:16.907424,0 days 00:00:08.222496,,19.0,sqrt,510,COMPLETE
565,565,0.6697414920088977,2022-11-29 21:02:17.088495,2022-11-29 21:02:27.011631,0 days 00:00:09.923136,"{0: 1, 1: 100}",30.0,sqrt,910,COMPLETE
566,566,0.6064945856167198,2022-11-29 21:02:27.215568,2022-11-29 21:02:35.968076,0 days 00:00:08.752508,balanced,20.0,log2,710,COMPLETE
567,567,0.5882830312341722,2022-11-29 21:02:36.155762,2022-11-29 21:02:45.841165,0 days 00:00:09.685403,"{0: 1, 1: 100}",9.0,log2,910,COMPLETE
568,568,0.685251335621499,2022-11-29 21:02:46.023548,2022-11-29 21:03:29.523563,0 days 00:00:43.500015,,9.0,1.0,960,COMPLETE
569,569,0.5891891254522366,2022-11-29 21:03:29.701120,2022-11-29 21:03:36.619872,0 days 00:00:06.918752,"{0: 1, 1: 100}",35.0,0.7,10,COMPLETE
570,570,0.6574885549582097,2022-11-29 21:03:36.799364,2022-11-29 21:03:43.700011,0 days 00:00:06.900647,"{0: 1, 1: 10}",16.0,0.6,10,COMPLETE
571,571,0.7176350272816416,2022-11-29 21:03:43.882094,2022-11-29 21:04:08.843904,0 days 00:00:24.961810,,7.0,0.7,710,COMPLETE
572,572,0.7263997432898324,2022-11-29 21:04:09.045441,2022-11-29 21:04:29.881525,0 days 00:00:20.836084,"{0: 1, 1: 10}",8.0,0.9,660,COMPLETE
573,573,0.6153074680709658,2022-11-29 21:04:30.062120,2022-11-29 21:04:38.344185,0 days 00:00:08.282065,"{0: 1, 1: 100}",28.0,log2,560,COMPLETE
574,574,0.7163971568841911,2022-11-29 21:04:38.519283,2022-11-29 21:04:51.756316,0 days 00:00:13.237033,"{0: 1, 1: 10}",13.0,0.8,360,COMPLETE
575,575,0.6552972082769745,2022-11-29 21:04:51.939030,2022-11-29 21:04:58.900389,0 days 00:00:06.961359,,24.0,0.8,10,COMPLETE
576,576,0.6380172142637507,2022-11-29 21:04:59.087761,2022-11-29 21:05:08.419874,0 days 00:00:09.332113,"{0: 1, 1: 100}",26.0,0.7,260,COMPLETE
577,577,0.7129056491598298,2022-11-29 21:05:08.626406,2022-11-29 21:05:36.127508,0 days 00:00:27.501102,"{0: 1, 1: 10}",19.0,1.0,860,COMPLETE
578,578,0.6586558758889772,2022-11-29 21:05:36.299059,2022-11-29 21:05:48.855818,0 days 00:00:12.556759,balanced,34.0,0.7,410,COMPLETE
579,579,0.7182180339025198,2022-11-29 21:05:49.038345,2022-11-29 21:06:03.792039,0 days 00:00:14.753694,"{0: 1, 1: 10}",14.0,,360,COMPLETE
580,580,0.7136578536049362,2022-11-29 21:06:03.961307,2022-11-29 21:06:18.303614,0 days 00:00:14.342307,"{0: 1, 1: 10}",27.0,0.8,410,COMPLETE
581,581,0.632256957830343,2022-11-29 21:06:18.491239,2022-11-29 21:06:37.318070,0 days 00:00:18.826831,balanced,8.0,0.7,810,COMPLETE
582,582,0.712872589091467,2022-11-29 21:06:37.507033,2022-11-29 21:06:45.821654,0 days 00:00:08.314621,"{0: 1, 1: 10}",23.0,0.9,110,COMPLETE
583,583,0.5990894791510215,2022-11-29 21:06:46.005295,2022-11-29 21:06:52.947690,0 days 00:00:06.942395,balanced,5.0,,10,COMPLETE
584,584,0.5987097730943829,2022-11-29 21:06:53.130005,2022-11-29 21:07:01.891577,0 days 00:00:08.761572,"{0: 1, 1: 100}",18.0,log2,710,COMPLETE
585,585,0.6313484827946281,2022-11-29 21:07:02.059455,2022-11-29 21:07:20.783671,0 days 00:00:18.724216,"{0: 1, 1: 100}",13.0,0.9,810,COMPLETE
586,586,0.6453029864166664,2022-11-29 21:07:20.980999,2022-11-29 21:07:32.579424,0 days 00:00:11.598425,"{0: 1, 1: 100}",37.0,0.6,460,COMPLETE
587,587,0.6486385926616427,2022-11-29 21:07:32.766600,2022-11-29 21:07:54.019917,0 days 00:00:21.253317,"{0: 1, 1: 100}",39.0,,860,COMPLETE
588,588,0.6713268751382437,2022-11-29 21:07:54.206753,2022-11-29 21:08:11.657876,0 days 00:00:17.451123,,29.0,0.8,360,COMPLETE
589,589,0.6394232181247439,2022-11-29 21:08:11.848652,2022-11-29 21:08:25.542998,0 days 00:00:13.694346,"{0: 1, 1: 100}",,0.7,560,COMPLETE
590,590,0.5782812604876904,2022-11-29 21:08:25.733196,2022-11-29 21:08:35.871546,0 days 00:00:10.138350,"{0: 1, 1: 100}",2.0,0.9,410,COMPLETE
591,591,0.6556324394859981,2022-11-29 21:08:36.048329,2022-11-29 21:08:47.943672,0 days 00:00:11.895343,balanced,17.0,0.9,310,COMPLETE
592,592,0.6080142408946507,2022-11-29 21:08:48.129658,2022-11-29 21:08:57.179938,0 days 00:00:09.050280,balanced,2.0,sqrt,760,COMPLETE
593,593,0.715034915264052,2022-11-29 21:08:57.367368,2022-11-29 21:09:19.870749,0 days 00:00:22.503381,"{0: 1, 1: 10}",30.0,1.0,660,COMPLETE
594,594,0.6732589176302476,2022-11-29 21:09:20.039055,2022-11-29 21:09:34.090538,0 days 00:00:14.051483,,23.0,1.0,210,COMPLETE
595,595,0.7045463300429333,2022-11-29 21:09:34.292210,2022-11-29 21:09:48.498437,0 days 00:00:14.206227,"{0: 1, 1: 10}",34.0,0.6,510,COMPLETE
596,596,0.6227820695790329,2022-11-29 21:09:48.678562,2022-11-29 21:10:04.974336,0 days 00:00:16.295774,balanced,7.0,,510,COMPLETE
597,597,0.718800023314931,2022-11-29 21:10:05.143112,2022-11-29 21:10:23.716933,0 days 00:00:18.573821,"{0: 1, 1: 10}",22.0,1.0,510,COMPLETE
598,598,0.6405958360729321,2022-11-29 21:10:23.888813,2022-11-29 21:10:33.358917,0 days 00:00:09.470104,"{0: 1, 1: 100}",28.0,1.0,210,COMPLETE
599,599,0.6299998973219942,2022-11-29 21:10:33.538813,2022-11-29 21:10:52.764630,0 days 00:00:19.225817,"{0: 1, 1: 100}",16.0,1.0,760,COMPLETE
600,600,0.6414961668524622,2022-11-29 21:10:52.946159,2022-11-29 21:11:12.891938,0 days 00:00:19.945779,"{0: 1, 1: 100}",32.0,,810,COMPLETE
601,601,0.6252874749666807,2022-11-29 21:11:13.099517,2022-11-29 21:11:21.317602,0 days 00:00:08.218085,"{0: 1, 1: 10}",36.0,sqrt,560,COMPLETE
602,602,0.650227352772802,2022-11-29 21:11:21.532222,2022-11-29 21:11:34.472203,0 days 00:00:12.939981,balanced,31.0,,360,COMPLETE
603,603,0.6489633474678678,2022-11-29 21:11:34.685094,2022-11-29 21:11:41.809967,0 days 00:00:07.124873,balanced,7.0,sqrt,160,COMPLETE
604,604,0.5906752613324368,2022-11-29 21:11:42.025139,2022-11-29 21:11:49.071472,0 days 00:00:07.046333,balanced,23.0,log2,210,COMPLETE
605,605,0.5765560481108112,2022-11-29 21:11:49.280229,2022-11-29 21:11:56.659650,0 days 00:00:07.379421,balanced,32.0,log2,360,COMPLETE
606,606,0.6431998393991837,2022-11-29 21:11:56.871825,2022-11-29 21:12:14.775212,0 days 00:00:17.903387,"{0: 1, 1: 100}",31.0,,710,COMPLETE
607,607,0.6500903038904526,2022-11-29 21:12:14.979938,2022-11-29 21:12:36.011460,0 days 00:00:21.031522,balanced,14.0,1.0,760,COMPLETE
608,608,0.6759959871436878,2022-11-29 21:12:36.220336,2022-11-29 21:13:01.282897,0 days 00:00:25.062561,,10.0,0.7,710,COMPLETE
609,609,0.625021006905494,2022-11-29 21:13:01.490430,2022-11-29 21:13:14.728854,0 days 00:00:13.238424,"{0: 1, 1: 100}",13.0,,460,COMPLETE
610,610,0.7127453617164308,2022-11-29 21:13:14.938101,2022-11-29 21:13:23.221941,0 days 00:00:08.283840,"{0: 1, 1: 10}",24.0,1.0,110,COMPLETE
611,611,0.6227502524312534,2022-11-29 21:13:23.427669,2022-11-29 21:13:34.690939,0 days 00:00:11.263270,,1.0,0.7,910,COMPLETE
612,612,0.646932045706185,2022-11-29 21:13:34.905339,2022-11-29 21:13:41.842156,0 days 00:00:06.936817,balanced,27.0,0.7,60,COMPLETE
613,613,0.6515814860372645,2022-11-29 21:13:42.051340,2022-11-29 21:13:57.363464,0 days 00:00:15.312124,balanced,38.0,0.9,510,COMPLETE
614,614,0.6688740408266446,2022-11-29 21:13:57.574726,2022-11-29 21:14:06.512018,0 days 00:00:08.937292,"{0: 1, 1: 100}",31.0,sqrt,710,COMPLETE
615,615,0.608162256983914,2022-11-29 21:14:06.724077,2022-11-29 21:14:13.705923,0 days 00:00:06.981846,balanced,29.0,sqrt,10,COMPLETE
616,616,0.6170506175562693,2022-11-29 21:14:13.920641,2022-11-29 21:14:20.916370,0 days 00:00:06.995729,balanced,8.0,0.9,60,COMPLETE
617,617,0.6494582552508754,2022-11-29 21:14:21.125368,2022-11-29 21:14:41.274939,0 days 00:00:20.149571,"{0: 1, 1: 100}",29.0,0.9,910,COMPLETE
618,618,0.7176416051998592,2022-11-29 21:14:41.485741,2022-11-29 21:14:53.277478,0 days 00:00:11.791737,"{0: 1, 1: 10}",22.0,,260,COMPLETE
619,619,0.52738021,2022-11-29 21:14:53.484671,2022-11-29 21:15:00.455314,0 days 00:00:06.970643,,39.0,log2,10,COMPLETE
620,620,0.5575913320258691,2022-11-29 21:15:00.667415,2022-11-29 21:15:09.142504,0 days 00:00:08.475089,"{0: 1, 1: 100}",1.0,0.7,460,COMPLETE
621,621,0.6129354251168886,2022-11-29 21:15:09.362137,2022-11-29 21:15:17.057177,0 days 00:00:07.695040,"{0: 1, 1: 100}",38.0,log2,460,COMPLETE
622,622,0.6762689773014727,2022-11-29 21:15:17.261672,2022-11-29 21:15:24.270741,0 days 00:00:07.009069,balanced,3.0,0.6,110,COMPLETE
623,623,0.6477174864197912,2022-11-29 21:15:24.486903,2022-11-29 21:15:32.698771,0 days 00:00:08.211868,"{0: 1, 1: 10}",12.0,sqrt,610,COMPLETE
624,624,0.6718744441383985,2022-11-29 21:15:32.906640,2022-11-29 21:15:46.009819,0 days 00:00:13.103179,,11.0,0.6,310,COMPLETE
625,625,0.6416143434813748,2022-11-29 21:15:46.222255,2022-11-29 21:16:01.280065,0 days 00:00:15.057810,"{0: 1, 1: 100}",22.0,0.6,760,COMPLETE
626,626,0.5986273149724445,2022-11-29 21:16:01.495932,2022-11-29 21:16:10.741816,0 days 00:00:09.245884,,10.0,sqrt,860,COMPLETE
627,627,0.636352805917046,2022-11-29 21:16:10.953780,2022-11-29 21:16:21.620156,0 days 00:00:10.666376,"{0: 1, 1: 100}",17.0,0.6,410,COMPLETE
628,628,0.7068919349340186,2022-11-29 21:16:21.845347,2022-11-29 21:16:34.882461,0 days 00:00:13.037114,"{0: 1, 1: 10}",23.0,0.6,460,COMPLETE
629,629,0.6749586855279371,2022-11-29 21:16:35.093948,2022-11-29 21:17:16.407558,0 days 00:00:41.313610,,23.0,,960,COMPLETE
630,630,0.6771676866804199,2022-11-29 21:17:16.619566,2022-11-29 21:17:32.021181,0 days 00:00:15.401615,,15.0,,260,COMPLETE
631,631,0.6603449543710194,2022-11-29 21:17:32.240760,2022-11-29 21:17:51.964847,0 days 00:00:19.724087,balanced,26.0,0.8,810,COMPLETE
632,632,0.6633830010158628,2022-11-29 21:17:52.177470,2022-11-29 21:18:03.379778,0 days 00:00:11.202308,"{0: 1, 1: 10}",2.0,0.7,560,COMPLETE
633,633,0.7142539158175565,2022-11-29 21:18:03.745720,2022-11-29 21:18:20.618805,0 days 00:00:16.873085,"{0: 1, 1: 10}",15.0,0.9,510,COMPLETE
634,634,0.6728135440088266,2022-11-29 21:18:20.825594,2022-11-29 21:18:42.237753,0 days 00:00:21.412159,,35.0,0.6,660,COMPLETE
635,635,0.662747434072323,2022-11-29 21:18:42.448369,2022-11-29 21:18:52.011802,0 days 00:00:09.563433,"{0: 1, 1: 10}",6.0,sqrt,960,COMPLETE
636,636,0.6652154024011061,2022-11-29 21:18:52.222129,2022-11-29 21:18:59.404117,0 days 00:00:07.181988,,25.0,0.6,60,COMPLETE
637,637,0.6362174477913627,2022-11-29 21:18:59.613281,2022-11-29 21:19:06.637953,0 days 00:00:07.024672,"{0: 1, 1: 100}",,0.7,60,COMPLETE
638,638,0.6463907773162847,2022-11-29 21:19:06.844650,2022-11-29 21:19:16.326383,0 days 00:00:09.481733,balanced,11.0,0.9,210,COMPLETE
639,639,0.6511916877795307,2022-11-29 21:19:16.530755,2022-11-29 21:19:33.443125,0 days 00:00:16.912370,balanced,12.0,1.0,560,COMPLETE
