,number,value,datetime_start,datetime_complete,duration,params_class_weight,params_max_depth,params_max_features,params_n_estimators,state
961,961,0.7011623487908523,2022-11-29 22:32:54.892091,2022-11-29 22:33:05.273739,0 days 00:00:10.381648,"{0: 1, 1: 10}",22.0,0.7,260,COMPLETE
962,962,0.7072299085711127,2022-11-29 22:33:05.492753,2022-11-29 22:33:26.471923,0 days 00:00:20.979170,"{0: 1, 1: 10}",33.0,0.6,960,COMPLETE
963,963,0.6843365626083102,2022-11-29 22:33:26.691690,2022-11-29 22:34:00.345557,0 days 00:00:33.653867,,9.0,0.8,910,COMPLETE
964,964,0.6418973940570706,2022-11-29 22:34:00.561311,2022-11-29 22:34:10.807915,0 days 00:00:10.246604,"{0: 1, 1: 100}",37.0,0.8,310,COMPLETE
965,965,0.6705637310156198,2022-11-29 22:34:11.027074,2022-11-29 22:34:21.830547,0 days 00:00:10.803473,"{0: 1, 1: 10}",2.0,0.8,460,COMPLETE
966,966,0.6685094042249181,2022-11-29 22:34:22.048558,2022-11-29 22:34:41.389418,0 days 00:00:19.340860,balanced,26.0,0.6,960,COMPLETE
967,967,0.629013275747768,2022-11-29 22:34:41.612014,2022-11-29 22:34:49.740361,0 days 00:00:08.128347,"{0: 1, 1: 100}",26.0,0.8,160,COMPLETE
968,968,0.6761075256785652,2022-11-29 22:34:49.956857,2022-11-29 22:35:09.095539,0 days 00:00:19.138682,,27.0,1.0,360,COMPLETE
969,969,0.5853491380560253,2022-11-29 22:35:09.324078,2022-11-29 22:35:18.394049,0 days 00:00:09.069971,,32.0,sqrt,710,COMPLETE
970,970,0.6604178832866145,2022-11-29 22:35:18.608266,2022-11-29 22:35:27.241604,0 days 00:00:08.633338,"{0: 1, 1: 10}",5.0,sqrt,660,COMPLETE
971,971,0.5903090548053938,2022-11-29 22:35:27.460891,2022-11-29 22:35:48.370790,0 days 00:00:20.909899,"{0: 1, 1: 100}",8.0,1.0,960,COMPLETE
972,972,0.5592845169920094,2022-11-29 22:35:48.582457,2022-11-29 22:35:55.745213,0 days 00:00:07.162756,balanced,38.0,log2,110,COMPLETE
973,973,0.5994026814219021,2022-11-29 22:35:55.966151,2022-11-29 22:36:12.544587,0 days 00:00:16.578436,"{0: 1, 1: 100}",8.0,0.8,810,COMPLETE
974,974,0.6548604555459103,2022-11-29 22:36:12.769162,2022-11-29 22:36:28.979113,0 days 00:00:16.209951,balanced,23.0,1.0,510,COMPLETE
975,975,0.5739537807277006,2022-11-29 22:36:29.202913,2022-11-29 22:36:36.220831,0 days 00:00:07.017918,"{0: 1, 1: 100}",26.0,0.9,10,COMPLETE
976,976,0.6585021213978035,2022-11-29 22:36:36.433191,2022-11-29 22:36:47.923603,0 days 00:00:11.490412,balanced,24.0,0.7,360,COMPLETE
977,977,0.636068601139003,2022-11-29 22:36:48.143198,2022-11-29 22:37:06.728419,0 days 00:00:18.585221,"{0: 1, 1: 100}",19.0,1.0,760,COMPLETE
978,978,0.6496690779448621,2022-11-29 22:37:06.945188,2022-11-29 22:37:15.908113,0 days 00:00:08.962925,balanced,37.0,,160,COMPLETE
979,979,0.6716653459812052,2022-11-29 22:37:16.124671,2022-11-29 22:37:23.687343,0 days 00:00:07.562672,,10.0,0.8,60,COMPLETE
980,980,0.6159905258360949,2022-11-29 22:37:23.913713,2022-11-29 22:37:31.524791,0 days 00:00:07.611078,"{0: 1, 1: 100}",11.0,,110,COMPLETE
981,981,0.6750444666972707,2022-11-29 22:37:31.745164,2022-11-29 22:37:56.908061,0 days 00:00:25.162897,,36.0,0.7,710,COMPLETE
982,982,0.5667557902277929,2022-11-29 22:37:57.130670,2022-11-29 22:38:06.607053,0 days 00:00:09.476383,balanced,33.0,log2,910,COMPLETE
983,983,0.5712729815542668,2022-11-29 22:38:06.822877,2022-11-29 22:38:16.598564,0 days 00:00:09.775687,"{0: 1, 1: 10}",21.0,log2,960,COMPLETE
984,984,0.6741746918310263,2022-11-29 22:38:16.817613,2022-11-29 22:38:44.894283,0 days 00:00:28.076670,,38.0,0.7,810,COMPLETE
985,985,0.5958427115495168,2022-11-29 22:38:45.109189,2022-11-29 22:38:54.240767,0 days 00:00:09.131578,,13.0,sqrt,760,COMPLETE
986,986,0.5485217823853122,2022-11-29 22:38:54.450955,2022-11-29 22:39:01.509632,0 days 00:00:07.058677,"{0: 1, 1: 10}",16.0,log2,10,COMPLETE
987,987,0.6619831765158195,2022-11-29 22:39:01.724253,2022-11-29 22:39:10.421291,0 days 00:00:08.697038,balanced,29.0,0.6,210,COMPLETE
988,988,0.6718683036638671,2022-11-29 22:39:10.639389,2022-11-29 22:39:27.357876,0 days 00:00:16.718487,,36.0,0.6,460,COMPLETE
989,989,0.6697477865777793,2022-11-29 22:39:27.569793,2022-11-29 22:39:37.675572,0 days 00:00:10.105779,,29.0,0.7,160,COMPLETE
990,990,0.643207715380471,2022-11-29 22:39:38.156387,2022-11-29 22:39:51.861490,0 days 00:00:13.705103,"{0: 1, 1: 100}",34.0,0.9,510,COMPLETE
991,991,0.6553667833994735,2022-11-29 22:39:52.079018,2022-11-29 22:40:01.198471,0 days 00:00:09.119453,balanced,14.0,0.7,210,COMPLETE
992,992,0.657262374125487,2022-11-29 22:40:01.421237,2022-11-29 22:40:08.538548,0 days 00:00:07.117311,,16.0,1.0,10,COMPLETE
993,993,0.599045426841519,2022-11-29 22:40:08.762383,2022-11-29 22:40:17.956997,0 days 00:00:09.194614,balanced,12.0,log2,760,COMPLETE
994,994,0.6541003090121177,2022-11-29 22:40:18.296751,2022-11-29 22:40:38.559054,0 days 00:00:20.262303,balanced,35.0,1.0,710,COMPLETE
995,995,0.5805926688086787,2022-11-29 22:40:38.796949,2022-11-29 22:40:45.743360,0 days 00:00:06.946411,"{0: 1, 1: 100}",33.0,0.9,10,COMPLETE
996,996,0.6670629158099588,2022-11-29 22:40:45.955706,2022-11-29 22:40:52.934780,0 days 00:00:06.979074,"{0: 1, 1: 100}",35.0,sqrt,160,COMPLETE
997,997,0.6283122879438399,2022-11-29 22:40:53.154217,2022-11-29 22:41:02.080532,0 days 00:00:08.926315,"{0: 1, 1: 10}",22.0,sqrt,710,COMPLETE
998,998,0.5965106835914242,2022-11-29 22:41:02.307282,2022-11-29 22:41:09.535643,0 days 00:00:07.228361,"{0: 1, 1: 100}",38.0,log2,260,COMPLETE
999,999,0.6734684881358549,2022-11-29 22:41:09.753035,2022-11-29 22:41:26.592043,0 days 00:00:16.839008,,36.0,0.6,460,COMPLETE
1000,1000,0.7223411452075974,2022-11-29 22:41:26.852900,2022-11-29 22:41:42.397648,0 days 00:00:15.544748,"{0: 1, 1: 10}",8.0,,410,COMPLETE
1001,1001,0.7248437632304409,2022-11-29 22:41:42.619976,2022-11-29 22:41:58.014959,0 days 00:00:15.394983,"{0: 1, 1: 10}",8.0,,410,COMPLETE
1002,1002,0.7201815772909748,2022-11-29 22:41:58.226538,2022-11-29 22:42:13.731190,0 days 00:00:15.504652,"{0: 1, 1: 10}",8.0,,410,COMPLETE
1003,1003,0.7246373393231431,2022-11-29 22:42:13.951925,2022-11-29 22:42:29.365606,0 days 00:00:15.413681,"{0: 1, 1: 10}",8.0,,410,COMPLETE
1004,1004,0.7202358301077969,2022-11-29 22:42:29.584224,2022-11-29 22:42:44.986620,0 days 00:00:15.402396,"{0: 1, 1: 10}",8.0,,410,COMPLETE
1005,1005,0.7272528629868907,2022-11-29 22:42:45.213668,2022-11-29 22:43:00.914922,0 days 00:00:15.701254,"{0: 1, 1: 10}",8.0,,410,COMPLETE
1006,1006,0.7219299463851775,2022-11-29 22:43:01.134092,2022-11-29 22:43:16.601401,0 days 00:00:15.467309,"{0: 1, 1: 10}",8.0,,410,COMPLETE
1007,1007,0.7190895453637347,2022-11-29 22:43:16.817341,2022-11-29 22:43:32.367887,0 days 00:00:15.550546,"{0: 1, 1: 10}",8.0,,410,COMPLETE
1008,1008,0.7323018253808528,2022-11-29 22:43:32.586998,2022-11-29 22:43:47.718525,0 days 00:00:15.131527,"{0: 1, 1: 10}",6.0,,410,COMPLETE
1009,1009,0.722317868597345,2022-11-29 22:43:47.938149,2022-11-29 22:44:03.270538,0 days 00:00:15.332389,"{0: 1, 1: 10}",8.0,,410,COMPLETE
1010,1010,0.7199180997566123,2022-11-29 22:44:03.488446,2022-11-29 22:44:18.883706,0 days 00:00:15.395260,"{0: 1, 1: 10}",8.0,,410,COMPLETE
1011,1011,0.7214045720266218,2022-11-29 22:44:19.116182,2022-11-29 22:44:34.907806,0 days 00:00:15.791624,"{0: 1, 1: 10}",8.0,,410,COMPLETE
1012,1012,0.7260212525842136,2022-11-29 22:44:35.123797,2022-11-29 22:44:50.662691,0 days 00:00:15.538894,"{0: 1, 1: 10}",8.0,,410,COMPLETE
1013,1013,0.7296875618469655,2022-11-29 22:44:50.878672,2022-11-29 22:45:06.153017,0 days 00:00:15.274345,"{0: 1, 1: 10}",6.0,,410,COMPLETE
1014,1014,0.7289716910522097,2022-11-29 22:45:06.378912,2022-11-29 22:45:21.611182,0 days 00:00:15.232270,"{0: 1, 1: 10}",6.0,,410,COMPLETE
1015,1015,0.733347377036396,2022-11-29 22:45:21.832332,2022-11-29 22:45:37.160958,0 days 00:00:15.328626,"{0: 1, 1: 10}",6.0,,410,COMPLETE
1016,1016,0.7299912897703991,2022-11-29 22:45:37.387150,2022-11-29 22:45:52.727143,0 days 00:00:15.339993,"{0: 1, 1: 10}",6.0,,410,COMPLETE
1017,1017,0.7321222202258489,2022-11-29 22:45:52.942962,2022-11-29 22:46:08.234581,0 days 00:00:15.291619,"{0: 1, 1: 10}",6.0,,410,COMPLETE
1018,1018,0.7258028645496196,2022-11-29 22:46:08.454243,2022-11-29 22:46:23.702824,0 days 00:00:15.248581,"{0: 1, 1: 10}",6.0,,410,COMPLETE
1019,1019,0.7297928924432682,2022-11-29 22:46:23.918637,2022-11-29 22:46:39.149010,0 days 00:00:15.230373,"{0: 1, 1: 10}",6.0,,410,COMPLETE
1020,1020,0.7294749625660112,2022-11-29 22:46:39.367812,2022-11-29 22:46:54.537835,0 days 00:00:15.170023,"{0: 1, 1: 10}",6.0,,410,COMPLETE
1021,1021,0.7282323005476563,2022-11-29 22:46:54.750284,2022-11-29 22:47:10.015520,0 days 00:00:15.265236,"{0: 1, 1: 10}",6.0,,410,COMPLETE
1022,1022,0.7296206243485984,2022-11-29 22:47:10.231686,2022-11-29 22:47:25.383450,0 days 00:00:15.151764,"{0: 1, 1: 10}",6.0,,410,COMPLETE
1023,1023,0.7303583031509545,2022-11-29 22:47:25.614654,2022-11-29 22:47:40.925394,0 days 00:00:15.310740,"{0: 1, 1: 10}",6.0,,410,COMPLETE
1024,1024,0.7292111001130268,2022-11-29 22:47:41.140142,2022-11-29 22:47:56.470696,0 days 00:00:15.330554,"{0: 1, 1: 10}",6.0,,410,COMPLETE
1025,1025,0.7297644278018229,2022-11-29 22:47:56.694554,2022-11-29 22:48:12.104548,0 days 00:00:15.409994,"{0: 1, 1: 10}",6.0,,410,COMPLETE
1026,1026,0.7309747603010586,2022-11-29 22:48:12.317286,2022-11-29 22:48:27.558466,0 days 00:00:15.241180,"{0: 1, 1: 10}",6.0,,410,COMPLETE
1027,1027,0.7293530964353379,2022-11-29 22:48:27.777369,2022-11-29 22:48:43.094644,0 days 00:00:15.317275,"{0: 1, 1: 10}",6.0,,410,COMPLETE
1028,1028,0.7324633538328184,2022-11-29 22:48:43.310042,2022-11-29 22:48:58.618128,0 days 00:00:15.308086,"{0: 1, 1: 10}",6.0,,410,COMPLETE
1029,1029,0.7324235381285309,2022-11-29 22:48:58.839114,2022-11-29 22:49:14.158420,0 days 00:00:15.319306,"{0: 1, 1: 10}",6.0,,410,COMPLETE
1030,1030,0.728373650564924,2022-11-29 22:49:14.370213,2022-11-29 22:49:29.650459,0 days 00:00:15.280246,"{0: 1, 1: 10}",6.0,,410,COMPLETE
1031,1031,0.7317760693499294,2022-11-29 22:49:29.878186,2022-11-29 22:49:45.142268,0 days 00:00:15.264082,"{0: 1, 1: 10}",6.0,,410,COMPLETE
1032,1032,0.7295320228766459,2022-11-29 22:49:45.368776,2022-11-29 22:50:00.556210,0 days 00:00:15.187434,"{0: 1, 1: 10}",6.0,,410,COMPLETE
1033,1033,0.7296818604692825,2022-11-29 22:50:00.775983,2022-11-29 22:50:16.026820,0 days 00:00:15.250837,"{0: 1, 1: 10}",6.0,,410,COMPLETE
1034,1034,0.7274179915639893,2022-11-29 22:50:16.247532,2022-11-29 22:50:31.376851,0 days 00:00:15.129319,"{0: 1, 1: 10}",6.0,,410,COMPLETE
1035,1035,0.7247536654666044,2022-11-29 22:50:31.602550,2022-11-29 22:50:46.836568,0 days 00:00:15.234018,"{0: 1, 1: 10}",6.0,,410,COMPLETE
1036,1036,0.7311619770129478,2022-11-29 22:50:47.058801,2022-11-29 22:51:02.231193,0 days 00:00:15.172392,"{0: 1, 1: 10}",6.0,,410,COMPLETE
1037,1037,0.7279607822589843,2022-11-29 22:51:02.451530,2022-11-29 22:51:17.790287,0 days 00:00:15.338757,"{0: 1, 1: 10}",6.0,,410,COMPLETE
1038,1038,0.7309881232891573,2022-11-29 22:51:18.008538,2022-11-29 22:51:33.286740,0 days 00:00:15.278202,"{0: 1, 1: 10}",6.0,,410,COMPLETE
1039,1039,0.7283937707514171,2022-11-29 22:51:33.507067,2022-11-29 22:51:48.799506,0 days 00:00:15.292439,"{0: 1, 1: 10}",6.0,,410,COMPLETE
1040,1040,0.7275908753156332,2022-11-29 22:51:49.027527,2022-11-29 22:52:04.241557,0 days 00:00:15.214030,"{0: 1, 1: 10}",6.0,,410,COMPLETE
1041,1041,0.7288519737821797,2022-11-29 22:52:04.458785,2022-11-29 22:52:19.614822,0 days 00:00:15.156037,"{0: 1, 1: 10}",6.0,,410,COMPLETE
1042,1042,0.7325420294308187,2022-11-29 22:52:19.831475,2022-11-29 22:52:35.201383,0 days 00:00:15.369908,"{0: 1, 1: 10}",6.0,,410,COMPLETE
1043,1043,0.7299213072998163,2022-11-29 22:52:35.431628,2022-11-29 22:52:50.762491,0 days 00:00:15.330863,"{0: 1, 1: 10}",6.0,,410,COMPLETE
1044,1044,0.7333647771964907,2022-11-29 22:52:50.980114,2022-11-29 22:53:06.199972,0 days 00:00:15.219858,"{0: 1, 1: 10}",6.0,,410,COMPLETE
1045,1045,0.7285288402503202,2022-11-29 22:53:06.423812,2022-11-29 22:53:21.670598,0 days 00:00:15.246786,"{0: 1, 1: 10}",6.0,,410,COMPLETE
1046,1046,0.73085967469688,2022-11-29 22:53:21.894632,2022-11-29 22:53:37.155055,0 days 00:00:15.260423,"{0: 1, 1: 10}",6.0,,410,COMPLETE
1047,1047,0.728967893234032,2022-11-29 22:53:37.376092,2022-11-29 22:53:52.681900,0 days 00:00:15.305808,"{0: 1, 1: 10}",6.0,,410,COMPLETE
1048,1048,0.7254849921323474,2022-11-29 22:53:52.903187,2022-11-29 22:54:08.263158,0 days 00:00:15.359971,"{0: 1, 1: 10}",6.0,,410,COMPLETE
1049,1049,0.7316209760275556,2022-11-29 22:54:08.482577,2022-11-29 22:54:22.506958,0 days 00:00:14.024381,"{0: 1, 1: 10}",6.0,,360,COMPLETE
1050,1050,0.7295257540635587,2022-11-29 22:54:22.733611,2022-11-29 22:54:36.783963,0 days 00:00:14.050352,"{0: 1, 1: 10}",6.0,,360,COMPLETE
1051,1051,0.7279800525073726,2022-11-29 22:54:37.019119,2022-11-29 22:54:51.059148,0 days 00:00:14.040029,"{0: 1, 1: 10}",6.0,,360,COMPLETE
1052,1052,0.728083045374093,2022-11-29 22:54:51.281045,2022-11-29 22:55:06.503580,0 days 00:00:15.222535,"{0: 1, 1: 10}",6.0,,410,COMPLETE
1053,1053,0.7256215541867346,2022-11-29 22:55:06.719531,2022-11-29 22:55:20.821589,0 days 00:00:14.102058,"{0: 1, 1: 10}",6.0,,360,COMPLETE
1054,1054,0.7260083768850967,2022-11-29 22:55:21.042107,2022-11-29 22:55:36.224393,0 days 00:00:15.182286,"{0: 1, 1: 10}",6.0,,410,COMPLETE
1055,1055,0.7294700790935262,2022-11-29 22:55:36.443965,2022-11-29 22:55:50.552454,0 days 00:00:14.108489,"{0: 1, 1: 10}",6.0,,360,COMPLETE
1056,1056,0.727823127203465,2022-11-29 22:55:50.771974,2022-11-29 22:56:05.844390,0 days 00:00:15.072416,"{0: 1, 1: 10}",6.0,,410,COMPLETE
1057,1057,0.7283747620642276,2022-11-29 22:56:06.065407,2022-11-29 22:56:21.502367,0 days 00:00:15.436960,"{0: 1, 1: 10}",6.0,,410,COMPLETE
1058,1058,0.7303563915473897,2022-11-29 22:56:21.732300,2022-11-29 22:56:37.148883,0 days 00:00:15.416583,"{0: 1, 1: 10}",6.0,,410,COMPLETE
1059,1059,0.7274675364166929,2022-11-29 22:56:37.367784,2022-11-29 22:56:51.361366,0 days 00:00:13.993582,"{0: 1, 1: 10}",6.0,,360,COMPLETE
1060,1060,0.72837100845927,2022-11-29 22:56:51.583166,2022-11-29 22:57:06.886495,0 days 00:00:15.303329,"{0: 1, 1: 10}",6.0,,410,COMPLETE
1061,1061,0.7327302682320329,2022-11-29 22:57:07.117106,2022-11-29 22:57:23.656481,0 days 00:00:16.539375,"{0: 1, 1: 10}",6.0,,460,COMPLETE
1062,1062,0.7299858521109124,2022-11-29 22:57:23.872288,2022-11-29 22:57:40.270698,0 days 00:00:16.398410,"{0: 1, 1: 10}",6.0,,460,COMPLETE
1063,1063,0.7325763551438765,2022-11-29 22:57:40.494317,2022-11-29 22:57:57.002122,0 days 00:00:16.507805,"{0: 1, 1: 10}",6.0,,460,COMPLETE
1064,1064,0.7307666636338792,2022-11-29 22:57:57.218052,2022-11-29 22:58:13.825811,0 days 00:00:16.607759,"{0: 1, 1: 10}",6.0,,460,COMPLETE
1065,1065,0.7295244859288441,2022-11-29 22:58:14.051667,2022-11-29 22:58:30.653730,0 days 00:00:16.602063,"{0: 1, 1: 10}",6.0,,460,COMPLETE
1066,1066,0.7291638650382034,2022-11-29 22:58:30.875818,2022-11-29 22:58:47.419777,0 days 00:00:16.543959,"{0: 1, 1: 10}",6.0,,460,COMPLETE
1067,1067,0.7284280954237802,2022-11-29 22:58:47.640392,2022-11-29 22:59:04.154079,0 days 00:00:16.513687,"{0: 1, 1: 10}",6.0,,460,COMPLETE
1068,1068,0.7303916924442704,2022-11-29 22:59:04.369184,2022-11-29 22:59:20.862297,0 days 00:00:16.493113,"{0: 1, 1: 10}",6.0,,460,COMPLETE
1069,1069,0.7274218264102431,2022-11-29 22:59:21.092754,2022-11-29 22:59:37.527518,0 days 00:00:16.434764,"{0: 1, 1: 10}",6.0,,460,COMPLETE
1070,1070,0.728377119453017,2022-11-29 22:59:37.749038,2022-11-29 22:59:54.239635,0 days 00:00:16.490597,"{0: 1, 1: 10}",6.0,,460,COMPLETE
1071,1071,0.7302611063575397,2022-11-29 22:59:54.453981,2022-11-29 23:00:11.038786,0 days 00:00:16.584805,"{0: 1, 1: 10}",6.0,,460,COMPLETE
1072,1072,0.7293410526833867,2022-11-29 23:00:11.263044,2022-11-29 23:00:27.806629,0 days 00:00:16.543585,"{0: 1, 1: 10}",6.0,,460,COMPLETE
1073,1073,0.7299677676839151,2022-11-29 23:00:28.032276,2022-11-29 23:00:44.423770,0 days 00:00:16.391494,"{0: 1, 1: 10}",6.0,,460,COMPLETE
1074,1074,0.7292948139697252,2022-11-29 23:00:44.648537,2022-11-29 23:01:01.068510,0 days 00:00:16.419973,"{0: 1, 1: 10}",6.0,,460,COMPLETE
1075,1075,0.7312779965806431,2022-11-29 23:01:01.288303,2022-11-29 23:01:17.806434,0 days 00:00:16.518131,"{0: 1, 1: 10}",6.0,,460,COMPLETE
1076,1076,0.7314456108315356,2022-11-29 23:01:18.037444,2022-11-29 23:01:34.448208,0 days 00:00:16.410764,"{0: 1, 1: 10}",6.0,,460,COMPLETE
1077,1077,0.7327521254734408,2022-11-29 23:01:34.669021,2022-11-29 23:01:51.106164,0 days 00:00:16.437143,"{0: 1, 1: 10}",6.0,,460,COMPLETE
1078,1078,0.73363663539261,2022-11-29 23:01:51.326638,2022-11-29 23:02:07.833601,0 days 00:00:16.506963,"{0: 1, 1: 10}",6.0,,460,COMPLETE
1079,1079,0.7278405361881095,2022-11-29 23:02:08.049463,2022-11-29 23:02:24.559998,0 days 00:00:16.510535,"{0: 1, 1: 10}",6.0,,460,COMPLETE
1080,1080,0.7275120807300781,2022-11-29 23:02:24.777792,2022-11-29 23:02:41.183396,0 days 00:00:16.405604,"{0: 1, 1: 10}",6.0,,460,COMPLETE
1081,1081,0.7310779055537778,2022-11-29 23:02:41.400236,2022-11-29 23:02:57.748275,0 days 00:00:16.348039,"{0: 1, 1: 10}",6.0,,460,COMPLETE
1082,1082,0.7312467366534817,2022-11-29 23:02:57.968056,2022-11-29 23:03:14.411307,0 days 00:00:16.443251,"{0: 1, 1: 10}",6.0,,460,COMPLETE
1083,1083,0.7273070532299352,2022-11-29 23:03:14.626267,2022-11-29 23:03:30.926863,0 days 00:00:16.300596,"{0: 1, 1: 10}",6.0,,460,COMPLETE
1084,1084,0.7246686074543647,2022-11-29 23:03:31.150398,2022-11-29 23:03:47.550652,0 days 00:00:16.400254,"{0: 1, 1: 10}",6.0,,460,COMPLETE
1085,1085,0.7291783434267949,2022-11-29 23:03:47.769399,2022-11-29 23:04:04.350422,0 days 00:00:16.581023,"{0: 1, 1: 10}",6.0,,460,COMPLETE
1086,1086,0.7272833995597512,2022-11-29 23:04:04.564981,2022-11-29 23:04:20.999141,0 days 00:00:16.434160,"{0: 1, 1: 10}",6.0,,460,COMPLETE
1087,1087,0.7324348081265497,2022-11-29 23:04:21.222925,2022-11-29 23:04:37.659958,0 days 00:00:16.437033,"{0: 1, 1: 10}",6.0,,460,COMPLETE
1088,1088,0.7333873236746854,2022-11-29 23:04:37.880265,2022-11-29 23:04:54.347668,0 days 00:00:16.467403,"{0: 1, 1: 10}",6.0,,460,COMPLETE
1089,1089,0.7277264384218926,2022-11-29 23:04:54.559529,2022-11-29 23:05:11.062320,0 days 00:00:16.502791,"{0: 1, 1: 10}",6.0,,460,COMPLETE
1090,1090,0.7311481171204784,2022-11-29 23:05:11.280075,2022-11-29 23:05:27.777332,0 days 00:00:16.497257,"{0: 1, 1: 10}",6.0,,460,COMPLETE
1091,1091,0.7270547664285572,2022-11-29 23:05:27.990405,2022-11-29 23:05:44.483040,0 days 00:00:16.492635,"{0: 1, 1: 10}",6.0,,460,COMPLETE
1092,1092,0.7271993294663285,2022-11-29 23:05:44.703658,2022-11-29 23:06:01.109420,0 days 00:00:16.405762,"{0: 1, 1: 10}",6.0,,460,COMPLETE
1093,1093,0.7271543346688085,2022-11-29 23:06:01.321685,2022-11-29 23:06:17.794921,0 days 00:00:16.473236,"{0: 1, 1: 10}",6.0,,460,COMPLETE
1094,1094,0.7300949470270126,2022-11-29 23:06:18.016906,2022-11-29 23:06:34.404028,0 days 00:00:16.387122,"{0: 1, 1: 10}",6.0,,460,COMPLETE
1095,1095,0.7305454368408852,2022-11-29 23:06:34.618113,2022-11-29 23:06:50.904745,0 days 00:00:16.286632,"{0: 1, 1: 10}",6.0,,460,COMPLETE
1096,1096,0.7295670849785459,2022-11-29 23:06:51.130061,2022-11-29 23:07:07.769173,0 days 00:00:16.639112,"{0: 1, 1: 10}",6.0,,460,COMPLETE
1097,1097,0.7320450829876018,2022-11-29 23:07:07.988084,2022-11-29 23:07:24.448674,0 days 00:00:16.460590,"{0: 1, 1: 10}",6.0,,460,COMPLETE
1098,1098,0.7314491378154582,2022-11-29 23:07:24.671918,2022-11-29 23:07:41.148795,0 days 00:00:16.476877,"{0: 1, 1: 10}",6.0,,460,COMPLETE
1099,1099,0.7287023434859259,2022-11-29 23:07:41.365370,2022-11-29 23:07:57.852283,0 days 00:00:16.486913,"{0: 1, 1: 10}",6.0,,460,COMPLETE
1100,1100,0.731788738699323,2022-11-29 23:07:58.073936,2022-11-29 23:08:14.513785,0 days 00:00:16.439849,"{0: 1, 1: 10}",6.0,,460,COMPLETE
1101,1101,0.7289931574501033,2022-11-29 23:08:14.734237,2022-11-29 23:08:31.123323,0 days 00:00:16.389086,"{0: 1, 1: 10}",6.0,,460,COMPLETE
1102,1102,0.7277333569291475,2022-11-29 23:08:31.343050,2022-11-29 23:08:47.697714,0 days 00:00:16.354664,"{0: 1, 1: 10}",6.0,,460,COMPLETE
1103,1103,0.7319770771425492,2022-11-29 23:08:47.917755,2022-11-29 23:09:04.322571,0 days 00:00:16.404816,"{0: 1, 1: 10}",6.0,,460,COMPLETE
1104,1104,0.7303484104527376,2022-11-29 23:09:04.541361,2022-11-29 23:09:21.133197,0 days 00:00:16.591836,"{0: 1, 1: 10}",6.0,,460,COMPLETE
1105,1105,0.7283626878896967,2022-11-29 23:09:21.354028,2022-11-29 23:09:37.658400,0 days 00:00:16.304372,"{0: 1, 1: 10}",6.0,,460,COMPLETE
1106,1106,0.7282726080587902,2022-11-29 23:09:37.880212,2022-11-29 23:09:54.362915,0 days 00:00:16.482703,"{0: 1, 1: 10}",6.0,,460,COMPLETE
1107,1107,0.7284651450242784,2022-11-29 23:09:54.584818,2022-11-29 23:10:11.018619,0 days 00:00:16.433801,"{0: 1, 1: 10}",6.0,,460,COMPLETE
1108,1108,0.7313743391615506,2022-11-29 23:10:11.237104,2022-11-29 23:10:27.638495,0 days 00:00:16.401391,"{0: 1, 1: 10}",6.0,,460,COMPLETE
1109,1109,0.7340139945147275,2022-11-29 23:10:27.856991,2022-11-29 23:10:44.313897,0 days 00:00:16.456906,"{0: 1, 1: 10}",6.0,,460,COMPLETE
1110,1110,0.7306598461924406,2022-11-29 23:10:44.535183,2022-11-29 23:11:00.924997,0 days 00:00:16.389814,"{0: 1, 1: 10}",6.0,,460,COMPLETE
1111,1111,0.7315371344421797,2022-11-29 23:11:01.148199,2022-11-29 23:11:17.708396,0 days 00:00:16.560197,"{0: 1, 1: 10}",6.0,,460,COMPLETE
1112,1112,0.7274431411618896,2022-11-29 23:11:17.928954,2022-11-29 23:11:34.290260,0 days 00:00:16.361306,"{0: 1, 1: 10}",6.0,,460,COMPLETE
1113,1113,0.7302376991679249,2022-11-29 23:11:34.517255,2022-11-29 23:11:50.964903,0 days 00:00:16.447648,"{0: 1, 1: 10}",6.0,,460,COMPLETE
1114,1114,0.7300682472037731,2022-11-29 23:11:51.186251,2022-11-29 23:12:08.732809,0 days 00:00:17.546558,"{0: 1, 1: 10}",6.0,,510,COMPLETE
1115,1115,0.7283768637719134,2022-11-29 23:12:08.953949,2022-11-29 23:12:25.339998,0 days 00:00:16.386049,"{0: 1, 1: 10}",6.0,,460,COMPLETE
1116,1116,0.7280923187647875,2022-11-29 23:12:25.557862,2022-11-29 23:12:42.018383,0 days 00:00:16.460521,"{0: 1, 1: 10}",6.0,,460,COMPLETE
1117,1117,0.7311919526681772,2022-11-29 23:12:42.237254,2022-11-29 23:12:58.745610,0 days 00:00:16.508356,"{0: 1, 1: 10}",6.0,,460,COMPLETE
