,number,value,datetime_start,datetime_complete,duration,params_class_weight,params_max_depth,params_max_features,params_n_estimators,state
1740,1740,0.7114140197525585,2022-11-30 02:39:12.357945,2022-11-30 02:39:32.902463,0 days 00:00:20.544518,"{0: 1, 1: 10}",13.0,,610,COMPLETE
1741,1741,0.6774608975545875,2022-11-30 02:39:33.144009,2022-11-30 02:39:46.816148,0 days 00:00:13.672139,"{0: 1, 1: 10}",2.0,,610,COMPLETE
1742,1742,0.7287074972881478,2022-11-30 02:39:47.050285,2022-11-30 02:40:06.147380,0 days 00:00:19.097095,"{0: 1, 1: 10}",7.0,,560,COMPLETE
1743,1743,0.7277397620431166,2022-11-30 02:40:06.381760,2022-11-30 02:40:24.498395,0 days 00:00:18.116635,"{0: 1, 1: 10}",5.0,,560,COMPLETE
1744,1744,0.7180890230907186,2022-11-30 02:40:24.735110,2022-11-30 02:40:45.151176,0 days 00:00:20.416066,"{0: 1, 1: 10}",15.0,,610,COMPLETE
1745,1745,0.7310107706154877,2022-11-30 02:40:45.383902,2022-11-30 02:41:05.309219,0 days 00:00:19.925317,"{0: 1, 1: 10}",6.0,,610,COMPLETE
1746,1746,0.7148221428439134,2022-11-30 02:41:05.543936,2022-11-30 02:41:24.766475,0 days 00:00:19.222539,"{0: 1, 1: 10}",12.0,,560,COMPLETE
1747,1747,0.7126396981507566,2022-11-30 02:41:24.998843,2022-11-30 02:41:45.393889,0 days 00:00:20.395046,"{0: 1, 1: 10}",22.0,,610,COMPLETE
1748,1748,0.7165904135671595,2022-11-30 02:41:45.622943,2022-11-30 02:42:06.102261,0 days 00:00:20.479318,"{0: 1, 1: 10}",29.0,,610,COMPLETE
1749,1749,0.7141650029219326,2022-11-30 02:42:06.337910,2022-11-30 02:42:25.591773,0 days 00:00:19.253863,"{0: 1, 1: 10}",20.0,,560,COMPLETE
1750,1750,0.7282880505732046,2022-11-30 02:42:25.831645,2022-11-30 02:42:45.858573,0 days 00:00:20.026928,"{0: 1, 1: 10}",6.0,,610,COMPLETE
1751,1751,0.7298721647735829,2022-11-30 02:42:46.084494,2022-11-30 02:43:07.314323,0 days 00:00:21.229829,"{0: 1, 1: 10}",6.0,,660,COMPLETE
1752,1752,0.717525856158227,2022-11-30 02:43:07.551700,2022-11-30 02:43:26.806555,0 days 00:00:19.254855,"{0: 1, 1: 10}",,,560,COMPLETE
1753,1753,0.7298417298777842,2022-11-30 02:43:27.042614,2022-11-30 02:43:47.173179,0 days 00:00:20.130565,"{0: 1, 1: 10}",6.0,,610,COMPLETE
1754,1754,0.7317706866856406,2022-11-30 02:43:47.403870,2022-11-30 02:44:07.292358,0 days 00:00:19.888488,"{0: 1, 1: 10}",6.0,,610,COMPLETE
1755,1755,0.7320591948232622,2022-11-30 02:44:07.529332,2022-11-30 02:44:26.483118,0 days 00:00:18.953786,"{0: 1, 1: 10}",6.0,,560,COMPLETE
1756,1756,0.7185448672164207,2022-11-30 02:44:26.707665,2022-11-30 02:44:48.274503,0 days 00:00:21.566838,"{0: 1, 1: 10}",9.0,,660,COMPLETE
1757,1757,0.7323258021653994,2022-11-30 02:44:48.509115,2022-11-30 02:45:09.590369,0 days 00:00:21.081254,"{0: 1, 1: 10}",6.0,,660,COMPLETE
1758,1758,0.7303138994207959,2022-11-30 02:45:09.823582,2022-11-30 02:45:29.748288,0 days 00:00:19.924706,"{0: 1, 1: 10}",6.0,,610,COMPLETE
1759,1759,0.713402658837413,2022-11-30 02:45:29.976823,2022-11-30 02:45:50.366028,0 days 00:00:20.389205,"{0: 1, 1: 10}",23.0,,610,COMPLETE
1760,1760,0.5908389112242183,2022-11-30 02:45:50.601160,2022-11-30 02:46:00.684486,0 days 00:00:10.083326,"{0: 1, 1: 10}",1.0,,560,COMPLETE
1761,1761,0.7073965527960955,2022-11-30 02:46:00.918284,2022-11-30 02:46:16.261508,0 days 00:00:15.343224,"{0: 1, 1: 10}",3.0,,560,COMPLETE
1762,1762,0.7298982272777318,2022-11-30 02:46:16.497323,2022-11-30 02:46:35.731154,0 days 00:00:19.233831,"{0: 1, 1: 10}",5.0,,610,COMPLETE
1763,1763,0.7348520573180602,2022-11-30 02:46:35.969592,2022-11-30 02:46:57.139732,0 days 00:00:21.170140,"{0: 1, 1: 10}",6.0,,660,COMPLETE
1764,1764,0.7134102427334461,2022-11-30 02:46:57.373336,2022-11-30 02:47:18.971669,0 days 00:00:21.598333,"{0: 1, 1: 10}",27.0,,660,COMPLETE
1765,1765,0.731379977201177,2022-11-30 02:47:19.209622,2022-11-30 02:47:40.362053,0 days 00:00:21.152431,"{0: 1, 1: 10}",6.0,,660,COMPLETE
1766,1766,0.730986572813528,2022-11-30 02:47:40.595657,2022-11-30 02:48:02.727266,0 days 00:00:22.131609,"{0: 1, 1: 10}",6.0,,710,COMPLETE
1767,1767,0.7148067983145794,2022-11-30 02:48:02.936258,2022-11-30 02:48:24.691459,0 days 00:00:21.755201,"{0: 1, 1: 10}",34.0,,660,COMPLETE
1768,1768,0.7168305150966138,2022-11-30 02:48:24.925508,2022-11-30 02:48:47.982295,0 days 00:00:23.056787,"{0: 1, 1: 10}",25.0,,710,COMPLETE
1769,1769,0.7207451146872602,2022-11-30 02:48:48.214975,2022-11-30 02:49:09.888441,0 days 00:00:21.673466,"{0: 1, 1: 10}",26.0,,660,COMPLETE
1770,1770,0.7147345499015909,2022-11-30 02:49:10.125033,2022-11-30 02:49:31.704538,0 days 00:00:21.579505,"{0: 1, 1: 10}",33.0,,660,COMPLETE
1771,1771,0.7329863344121587,2022-11-30 02:49:31.941248,2022-11-30 02:49:53.059300,0 days 00:00:21.118052,"{0: 1, 1: 10}",6.0,,660,COMPLETE
1772,1772,0.7301061224588035,2022-11-30 02:49:53.297443,2022-11-30 02:50:14.503974,0 days 00:00:21.206531,"{0: 1, 1: 10}",6.0,,660,COMPLETE
1773,1773,0.7313856240560036,2022-11-30 02:50:14.742754,2022-11-30 02:50:37.043754,0 days 00:00:22.301000,"{0: 1, 1: 10}",6.0,,710,COMPLETE
1774,1774,0.7134046291436983,2022-11-30 02:50:37.282222,2022-11-30 02:50:58.974108,0 days 00:00:21.691886,"{0: 1, 1: 10}",16.0,,660,COMPLETE
1775,1775,0.7182051729057162,2022-11-30 02:50:59.210058,2022-11-30 02:51:21.021551,0 days 00:00:21.811493,"{0: 1, 1: 10}",36.0,,660,COMPLETE
1776,1776,0.716086218918924,2022-11-30 02:51:21.255193,2022-11-30 02:51:42.913364,0 days 00:00:21.658171,"{0: 1, 1: 10}",31.0,,660,COMPLETE
1777,1777,0.7332777052610664,2022-11-30 02:51:43.139515,2022-11-30 02:52:05.407780,0 days 00:00:22.268265,"{0: 1, 1: 10}",6.0,,710,COMPLETE
1778,1778,0.7160287962996139,2022-11-30 02:52:05.656179,2022-11-30 02:52:27.234151,0 days 00:00:21.577972,"{0: 1, 1: 10}",10.0,,660,COMPLETE
1779,1779,0.7158128332488333,2022-11-30 02:52:27.471227,2022-11-30 02:52:49.329678,0 days 00:00:21.858451,"{0: 1, 1: 10}",18.0,,660,COMPLETE
1780,1780,0.7164192812242707,2022-11-30 02:52:49.566695,2022-11-30 02:53:11.038672,0 days 00:00:21.471977,"{0: 1, 1: 10}",11.0,,660,COMPLETE
1781,1781,0.7168096876033675,2022-11-30 02:53:11.271725,2022-11-30 02:53:31.642534,0 days 00:00:20.370809,"{0: 1, 1: 10}",37.0,,610,COMPLETE
1782,1782,0.7290988609906346,2022-11-30 02:53:31.881687,2022-11-30 02:53:51.939870,0 days 00:00:20.058183,"{0: 1, 1: 10}",6.0,,610,COMPLETE
1783,1783,0.7337112500191272,2022-11-30 02:53:52.177285,2022-11-30 02:54:11.519318,0 days 00:00:19.342033,"{0: 1, 1: 10}",5.0,,610,COMPLETE
1784,1784,0.7150626972730708,2022-11-30 02:54:11.752362,2022-11-30 02:54:33.410514,0 days 00:00:21.658152,"{0: 1, 1: 10}",35.0,,660,COMPLETE
1785,1785,0.7124827483606784,2022-11-30 02:54:33.651945,2022-11-30 02:54:54.027926,0 days 00:00:20.375981,"{0: 1, 1: 10}",30.0,,610,COMPLETE
1786,1786,0.7310957022677042,2022-11-30 02:54:54.259777,2022-11-30 02:55:15.505265,0 days 00:00:21.245488,"{0: 1, 1: 10}",6.0,,660,COMPLETE
1787,1787,0.7162794928518628,2022-11-30 02:55:15.737062,2022-11-30 02:55:36.273557,0 days 00:00:20.536495,"{0: 1, 1: 10}",17.0,,610,COMPLETE
1788,1788,0.7345201848592887,2022-11-30 02:55:36.505834,2022-11-30 02:55:58.818620,0 days 00:00:22.312786,"{0: 1, 1: 10}",6.0,,710,COMPLETE
1789,1789,0.7180481865598283,2022-11-30 02:55:59.055209,2022-11-30 02:56:18.058864,0 days 00:00:19.003655,"{0: 1, 1: 10}",4.0,,660,COMPLETE
1790,1790,0.7307476803469399,2022-11-30 02:56:18.293846,2022-11-30 02:56:40.572099,0 days 00:00:22.278253,"{0: 1, 1: 10}",6.0,,710,COMPLETE
1791,1791,0.7103765911283108,2022-11-30 02:56:40.814912,2022-11-30 02:57:03.546160,0 days 00:00:22.731248,"{0: 1, 1: 10}",14.0,,710,COMPLETE
1792,1792,0.7330275615249431,2022-11-30 02:57:03.777055,2022-11-30 02:57:26.204891,0 days 00:00:22.427836,"{0: 1, 1: 10}",6.0,,710,COMPLETE
1793,1793,0.7152116632264907,2022-11-30 02:57:26.432988,2022-11-30 02:57:49.354899,0 days 00:00:22.921911,"{0: 1, 1: 10}",38.0,,710,COMPLETE
1794,1794,0.7351505642327079,2022-11-30 02:57:49.582286,2022-11-30 02:58:11.847957,0 days 00:00:22.265671,"{0: 1, 1: 10}",6.0,,710,COMPLETE
1795,1795,0.7132590676558708,2022-11-30 02:58:12.092789,2022-11-30 02:58:34.812854,0 days 00:00:22.720065,"{0: 1, 1: 10}",24.0,,710,COMPLETE
1796,1796,0.7174642259062416,2022-11-30 02:58:35.045554,2022-11-30 02:58:57.928540,0 days 00:00:22.882986,"{0: 1, 1: 10}",21.0,,710,COMPLETE
1797,1797,0.7305926784378645,2022-11-30 02:58:58.169885,2022-11-30 02:59:20.605529,0 days 00:00:22.435644,"{0: 1, 1: 10}",6.0,,710,COMPLETE
1798,1798,0.715978677689719,2022-11-30 02:59:20.836913,2022-11-30 02:59:43.585512,0 days 00:00:22.748599,"{0: 1, 1: 10}",19.0,,710,COMPLETE
1799,1799,0.7297506366329849,2022-11-30 02:59:43.820721,2022-11-30 03:00:06.038667,0 days 00:00:22.217946,"{0: 1, 1: 10}",6.0,,710,COMPLETE
1800,1800,0.7115809673303983,2022-11-30 03:00:06.274804,2022-11-30 03:00:29.277618,0 days 00:00:23.002814,"{0: 1, 1: 10}",39.0,,710,COMPLETE
1801,1801,0.6744502841486997,2022-11-30 03:00:29.513803,2022-11-30 03:00:44.478868,0 days 00:00:14.965065,"{0: 1, 1: 10}",2.0,,710,COMPLETE
1802,1802,0.7201665561977885,2022-11-30 03:00:44.724291,2022-11-30 03:01:07.581851,0 days 00:00:22.857560,"{0: 1, 1: 10}",32.0,,710,COMPLETE
1803,1803,0.7289197796167003,2022-11-30 03:01:07.816944,2022-11-30 03:01:30.310721,0 days 00:00:22.493777,"{0: 1, 1: 10}",6.0,,710,COMPLETE
1804,1804,0.7326596022853595,2022-11-30 03:01:30.543607,2022-11-30 03:01:51.751679,0 days 00:00:21.208072,"{0: 1, 1: 10}",6.0,,660,COMPLETE
1805,1805,0.7160299706571422,2022-11-30 03:01:51.979555,2022-11-30 03:02:14.915965,0 days 00:00:22.936410,"{0: 1, 1: 10}",28.0,,710,COMPLETE
1806,1806,0.7161226245012375,2022-11-30 03:02:15.154970,2022-11-30 03:02:39.173334,0 days 00:00:24.018364,"{0: 1, 1: 10}",13.0,,760,COMPLETE
1807,1807,0.7135672381684576,2022-11-30 03:02:39.405671,2022-11-30 03:03:00.979618,0 days 00:00:21.573947,"{0: 1, 1: 10}",20.0,,660,COMPLETE
1808,1808,0.7185902752646313,2022-11-30 03:03:01.212274,2022-11-30 03:03:24.167975,0 days 00:00:22.955701,"{0: 1, 1: 10}",29.0,,710,COMPLETE
1809,1809,0.7289450630105164,2022-11-30 03:03:24.403530,2022-11-30 03:03:46.004033,0 days 00:00:21.600503,"{0: 1, 1: 10}",5.0,,710,COMPLETE
1810,1810,0.7180280542151138,2022-11-30 03:03:46.232325,2022-11-30 03:04:09.191403,0 days 00:00:22.959078,"{0: 1, 1: 10}",15.0,,710,COMPLETE
1811,1811,0.730093467597796,2022-11-30 03:04:09.431851,2022-11-30 03:04:32.188016,0 days 00:00:22.756165,"{0: 1, 1: 10}",7.0,,710,COMPLETE
1812,1812,0.7145548602308425,2022-11-30 03:04:32.429770,2022-11-30 03:04:56.638117,0 days 00:00:24.208347,"{0: 1, 1: 10}",12.0,,760,COMPLETE
1813,1813,0.7308920799332965,2022-11-30 03:04:56.866729,2022-11-30 03:05:17.984407,0 days 00:00:21.117678,"{0: 1, 1: 10}",6.0,,660,COMPLETE
1814,1814,0.7320917056574883,2022-11-30 03:05:18.222034,2022-11-30 03:05:40.496036,0 days 00:00:22.274002,"{0: 1, 1: 10}",6.0,,710,COMPLETE
1815,1815,0.7309594564026102,2022-11-30 03:05:40.732976,2022-11-30 03:06:03.086031,0 days 00:00:22.353055,"{0: 1, 1: 10}",6.0,,710,COMPLETE
1816,1816,0.7347182737985114,2022-11-30 03:06:03.316695,2022-11-30 03:06:26.695272,0 days 00:00:23.378577,"{0: 1, 1: 10}",6.0,,760,COMPLETE
1817,1817,0.7143465993914743,2022-11-30 03:06:26.942113,2022-11-30 03:06:51.239190,0 days 00:00:24.297077,"{0: 1, 1: 10}",,,760,COMPLETE
1818,1818,0.7316032678031126,2022-11-30 03:06:51.479103,2022-11-30 03:07:15.340481,0 days 00:00:23.861378,"{0: 1, 1: 10}",6.0,,760,COMPLETE
1819,1819,0.7134627258791654,2022-11-30 03:07:15.576404,2022-11-30 03:07:39.734307,0 days 00:00:24.157903,"{0: 1, 1: 10}",22.0,,760,COMPLETE
1820,1820,0.7178080561923691,2022-11-30 03:07:39.962280,2022-11-30 03:08:02.814562,0 days 00:00:22.852282,"{0: 1, 1: 10}",23.0,,710,COMPLETE
1821,1821,0.7327240178034053,2022-11-30 03:08:03.031415,2022-11-30 03:08:26.528205,0 days 00:00:23.496790,"{0: 1, 1: 10}",6.0,,760,COMPLETE
1822,1822,0.7207405377187548,2022-11-30 03:08:26.763693,2022-11-30 03:08:49.590135,0 days 00:00:22.826442,"{0: 1, 1: 10}",9.0,,710,COMPLETE
1823,1823,0.5660632562939528,2022-11-30 03:08:49.837414,2022-11-30 03:09:01.157797,0 days 00:00:11.320383,"{0: 1, 1: 10}",1.0,,710,COMPLETE
1824,1824,0.7316709208688951,2022-11-30 03:09:01.385062,2022-11-30 03:09:24.968272,0 days 00:00:23.583210,"{0: 1, 1: 10}",6.0,,760,COMPLETE
1825,1825,0.7091792352776933,2022-11-30 03:09:25.195352,2022-11-30 03:09:44.043044,0 days 00:00:18.847692,"{0: 1, 1: 10}",3.0,,760,COMPLETE
1826,1826,0.731323089630949,2022-11-30 03:09:44.270296,2022-11-30 03:10:05.514701,0 days 00:00:21.244405,"{0: 1, 1: 10}",6.0,,660,COMPLETE
1827,1827,0.7274790898770317,2022-11-30 03:10:05.756929,2022-11-30 03:10:28.438836,0 days 00:00:22.681907,"{0: 1, 1: 10}",5.0,,760,COMPLETE
1828,1828,0.73455567789461,2022-11-30 03:10:28.676631,2022-11-30 03:10:50.947036,0 days 00:00:22.270405,"{0: 1, 1: 10}",6.0,,710,COMPLETE
1829,1829,0.7319663062795089,2022-11-30 03:10:51.192502,2022-11-30 03:11:14.938563,0 days 00:00:23.746061,"{0: 1, 1: 10}",6.0,,760,COMPLETE
1830,1830,0.7323801988450414,2022-11-30 03:11:15.177940,2022-11-30 03:11:37.590075,0 days 00:00:22.412135,"{0: 1, 1: 10}",6.0,,710,COMPLETE
1831,1831,0.7208901037875418,2022-11-30 03:11:37.826852,2022-11-30 03:11:54.377132,0 days 00:00:16.550280,"{0: 1, 1: 10}",6.0,0.6,710,COMPLETE
1832,1832,0.7318932704327337,2022-11-30 03:11:54.607275,2022-11-30 03:12:18.154487,0 days 00:00:23.547212,"{0: 1, 1: 10}",6.0,,760,COMPLETE
1833,1833,0.7311358950371776,2022-11-30 03:12:18.386906,2022-11-30 03:12:42.016446,0 days 00:00:23.629540,"{0: 1, 1: 10}",6.0,,760,COMPLETE
1834,1834,0.7326062720764906,2022-11-30 03:12:42.247085,2022-11-30 03:13:05.902760,0 days 00:00:23.655675,"{0: 1, 1: 10}",6.0,,760,COMPLETE
1835,1835,0.7325331081361547,2022-11-30 03:13:06.132412,2022-11-30 03:13:28.514429,0 days 00:00:22.382017,"{0: 1, 1: 10}",6.0,,710,COMPLETE
1836,1836,0.7337101424594027,2022-11-30 03:13:28.750645,2022-11-30 03:13:51.197440,0 days 00:00:22.446795,"{0: 1, 1: 10}",6.0,,710,COMPLETE
1837,1837,0.7314357679849761,2022-11-30 03:13:51.433414,2022-11-30 03:14:13.815477,0 days 00:00:22.382063,"{0: 1, 1: 10}",6.0,,710,COMPLETE
1838,1838,0.7315791822688229,2022-11-30 03:14:14.052361,2022-11-30 03:14:37.548182,0 days 00:00:23.495821,"{0: 1, 1: 10}",6.0,,760,COMPLETE
1839,1839,0.7360339975120713,2022-11-30 03:14:37.781856,2022-11-30 03:14:59.998842,0 days 00:00:22.216986,"{0: 1, 1: 10}",6.0,,710,COMPLETE
1840,1840,0.7303958221231535,2022-11-30 03:15:00.230597,2022-11-30 03:15:22.517360,0 days 00:00:22.286763,"{0: 1, 1: 10}",6.0,,710,COMPLETE
1841,1841,0.7360059625125794,2022-11-30 03:15:22.759459,2022-11-30 03:15:46.373808,0 days 00:00:23.614349,"{0: 1, 1: 10}",6.0,,760,COMPLETE
1842,1842,0.7325814980326616,2022-11-30 03:15:46.609671,2022-11-30 03:16:09.069593,0 days 00:00:22.459922,"{0: 1, 1: 10}",6.0,,710,COMPLETE
1843,1843,0.7158365723515602,2022-11-30 03:16:09.297981,2022-11-30 03:16:33.613660,0 days 00:00:24.315679,"{0: 1, 1: 10}",27.0,,760,COMPLETE
1844,1844,0.7329458719808628,2022-11-30 03:16:33.850934,2022-11-30 03:16:57.314226,0 days 00:00:23.463292,"{0: 1, 1: 10}",6.0,,760,COMPLETE
1845,1845,0.7144252662011985,2022-11-30 03:16:57.550061,2022-11-30 03:17:20.477749,0 days 00:00:22.927688,"{0: 1, 1: 10}",33.0,,710,COMPLETE
1846,1846,0.7360160168887178,2022-11-30 03:17:20.705475,2022-11-30 03:17:44.297360,0 days 00:00:23.591885,"{0: 1, 1: 10}",6.0,,760,COMPLETE
1847,1847,0.7194952832834041,2022-11-30 03:17:44.533573,2022-11-30 03:18:08.702752,0 days 00:00:24.169179,"{0: 1, 1: 10}",34.0,,760,COMPLETE
1848,1848,0.7303386802537971,2022-11-30 03:18:08.932955,2022-11-30 03:18:32.586180,0 days 00:00:23.653225,"{0: 1, 1: 10}",6.0,,760,COMPLETE
1849,1849,0.7162056300363496,2022-11-30 03:18:32.821003,2022-11-30 03:18:56.973505,0 days 00:00:24.152502,"{0: 1, 1: 10}",26.0,,760,COMPLETE
1850,1850,0.7134057766415841,2022-11-30 03:18:57.199092,2022-11-30 03:19:21.256510,0 days 00:00:24.057418,"{0: 1, 1: 10}",36.0,,760,COMPLETE
1851,1851,0.7141235734989834,2022-11-30 03:19:21.492840,2022-11-30 03:19:45.531032,0 days 00:00:24.038192,"{0: 1, 1: 10}",31.0,,760,COMPLETE
1852,1852,0.7141563648831735,2022-11-30 03:19:45.767226,2022-11-30 03:20:09.996921,0 days 00:00:24.229695,"{0: 1, 1: 10}",25.0,,760,COMPLETE
1853,1853,0.7196711839050545,2022-11-30 03:20:10.239677,2022-11-30 03:20:34.187915,0 days 00:00:23.948238,"{0: 1, 1: 10}",10.0,,760,COMPLETE
1854,1854,0.7333526463775735,2022-11-30 03:20:34.432943,2022-11-30 03:20:58.078888,0 days 00:00:23.645945,"{0: 1, 1: 10}",6.0,,760,COMPLETE
1855,1855,0.7216154786949965,2022-11-30 03:20:58.314216,2022-11-30 03:21:15.791678,0 days 00:00:17.477462,"{0: 1, 1: 10}",6.0,0.6,760,COMPLETE
1856,1856,0.7329576286839912,2022-11-30 03:21:16.026249,2022-11-30 03:21:39.586712,0 days 00:00:23.560463,"{0: 1, 1: 10}",6.0,,760,COMPLETE
1857,1857,0.7347949631367937,2022-11-30 03:21:39.825432,2022-11-30 03:22:03.335050,0 days 00:00:23.509618,"{0: 1, 1: 10}",6.0,,760,COMPLETE
1858,1858,0.7175682538725068,2022-11-30 03:22:03.565870,2022-11-30 03:22:27.435285,0 days 00:00:23.869415,"{0: 1, 1: 10}",37.0,,760,COMPLETE
1859,1859,0.7180479370948053,2022-11-30 03:22:27.663501,2022-11-30 03:22:51.873138,0 days 00:00:24.209637,"{0: 1, 1: 10}",11.0,,760,COMPLETE
1860,1860,0.7335844284255314,2022-11-30 03:22:52.116938,2022-11-30 03:23:15.603598,0 days 00:00:23.486660,"{0: 1, 1: 10}",6.0,,760,COMPLETE
1861,1861,0.718341930339799,2022-11-30 03:23:15.830930,2022-11-30 03:23:40.001321,0 days 00:00:24.170391,"{0: 1, 1: 10}",35.0,,760,COMPLETE
1862,1862,0.714774029375961,2022-11-30 03:23:40.226196,2022-11-30 03:24:05.527282,0 days 00:00:25.301086,"{0: 1, 1: 10}",18.0,,810,COMPLETE
1863,1863,0.7324096896538149,2022-11-30 03:24:05.754828,2022-11-30 03:24:29.236644,0 days 00:00:23.481816,"{0: 1, 1: 10}",6.0,,760,COMPLETE
1864,1864,0.7171272133814608,2022-11-30 03:24:29.476587,2022-11-30 03:24:53.692502,0 days 00:00:24.215915,"{0: 1, 1: 10}",16.0,,760,COMPLETE
1865,1865,0.7358357926321922,2022-11-30 03:24:53.931960,2022-11-30 03:25:17.438774,0 days 00:00:23.506814,"{0: 1, 1: 10}",6.0,,760,COMPLETE
1866,1866,0.7184507363996177,2022-11-30 03:25:17.672334,2022-11-30 03:25:38.760172,0 days 00:00:21.087838,"{0: 1, 1: 10}",4.0,,760,COMPLETE
1867,1867,0.7163971780036603,2022-11-30 03:25:38.988425,2022-11-30 03:26:04.317524,0 days 00:00:25.329099,"{0: 1, 1: 10}",30.0,,810,COMPLETE
1868,1868,0.7107699723268022,2022-11-30 03:26:04.545511,2022-11-30 03:26:30.043065,0 days 00:00:25.497554,"{0: 1, 1: 10}",38.0,,810,COMPLETE
1869,1869,0.7113563892108895,2022-11-30 03:26:30.276048,2022-11-30 03:26:54.474846,0 days 00:00:24.198798,"{0: 1, 1: 10}",17.0,,760,COMPLETE
1870,1870,0.7320684599851124,2022-11-30 03:26:54.712407,2022-11-30 03:27:16.820758,0 days 00:00:22.108351,"{0: 1, 1: 10}",6.0,0.9,760,COMPLETE
1871,1871,0.7321946646349575,2022-11-30 03:27:17.053357,2022-11-30 03:27:40.535787,0 days 00:00:23.482430,"{0: 1, 1: 10}",6.0,,760,COMPLETE
1872,1872,0.7151041578668963,2022-11-30 03:27:40.788748,2022-11-30 03:28:06.090750,0 days 00:00:25.302002,"{0: 1, 1: 10}",21.0,,810,COMPLETE
1873,1873,0.7138564914510309,2022-11-30 03:28:06.327861,2022-11-30 03:28:31.603142,0 days 00:00:25.275281,"{0: 1, 1: 10}",14.0,,810,COMPLETE
1874,1874,0.734455307003525,2022-11-30 03:28:31.838672,2022-11-30 03:28:55.411426,0 days 00:00:23.572754,"{0: 1, 1: 10}",6.0,,760,COMPLETE
1875,1875,0.7141752175751117,2022-11-30 03:28:55.649141,2022-11-30 03:29:19.631533,0 days 00:00:23.982392,"{0: 1, 1: 10}",24.0,,760,COMPLETE
1876,1876,0.7159128621279582,2022-11-30 03:29:19.868709,2022-11-30 03:29:43.936187,0 days 00:00:24.067478,"{0: 1, 1: 10}",19.0,,760,COMPLETE
1877,1877,0.7145152775478599,2022-11-30 03:29:44.166370,2022-11-30 03:30:08.172617,0 days 00:00:24.006247,"{0: 1, 1: 10}",32.0,,760,COMPLETE
1878,1878,0.7328969527835256,2022-11-30 03:30:08.408918,2022-11-30 03:30:33.182262,0 days 00:00:24.773344,"{0: 1, 1: 10}",6.0,,810,COMPLETE
1879,1879,0.7132797196395222,2022-11-30 03:30:33.418911,2022-11-30 03:30:57.402394,0 days 00:00:23.983483,"{0: 1, 1: 10}",28.0,,760,COMPLETE
1880,1880,0.7079097355488837,2022-11-30 03:30:57.636753,2022-11-30 03:31:16.369120,0 days 00:00:18.732367,"{0: 1, 1: 10}",39.0,0.6,810,COMPLETE
1881,1881,0.7332239693964484,2022-11-30 03:31:16.602190,2022-11-30 03:31:40.070369,0 days 00:00:23.468179,"{0: 1, 1: 10}",6.0,,760,COMPLETE
1882,1882,0.7241915467131624,2022-11-30 03:31:40.307407,2022-11-30 03:32:04.327593,0 days 00:00:24.020186,"{0: 1, 1: 10}",8.0,,760,COMPLETE
1883,1883,0.733525245549427,2022-11-30 03:32:04.554926,2022-11-30 03:32:28.062728,0 days 00:00:23.507802,"{0: 1, 1: 10}",6.0,,760,COMPLETE
1884,1884,0.7321893721234174,2022-11-30 03:32:28.293964,2022-11-30 03:32:52.058929,0 days 00:00:23.764965,"{0: 1, 1: 10}",6.0,,760,COMPLETE
1885,1885,0.7295140139592916,2022-11-30 03:32:52.296971,2022-11-30 03:33:15.038138,0 days 00:00:22.741167,"{0: 1, 1: 10}",7.0,,710,COMPLETE
1886,1886,0.6819183151278976,2022-11-30 03:33:15.272438,2022-11-30 03:33:30.430028,0 days 00:00:15.157590,"{0: 1, 1: 10}",2.0,,710,COMPLETE
1887,1887,0.7179885652015513,2022-11-30 03:33:30.673755,2022-11-30 03:33:55.808848,0 days 00:00:25.135093,"{0: 1, 1: 10}",13.0,,810,COMPLETE
1888,1888,0.7348000682808659,2022-11-30 03:33:56.043656,2022-11-30 03:34:19.674321,0 days 00:00:23.630665,"{0: 1, 1: 10}",6.0,,760,COMPLETE
1889,1889,0.719403120791911,2022-11-30 03:34:19.905407,2022-11-30 03:34:43.966977,0 days 00:00:24.061570,"{0: 1, 1: 10}",15.0,,760,COMPLETE
1890,1890,0.7133820042562474,2022-11-30 03:34:44.207465,2022-11-30 03:35:09.610498,0 days 00:00:25.403033,"{0: 1, 1: 10}",29.0,,810,COMPLETE
1891,1891,0.7142048146721758,2022-11-30 03:35:09.841691,2022-11-30 03:35:33.980492,0 days 00:00:24.138801,"{0: 1, 1: 10}",20.0,,760,COMPLETE
1892,1892,0.7155375587811875,2022-11-30 03:35:34.218256,2022-11-30 03:35:58.345585,0 days 00:00:24.127329,"{0: 1, 1: 10}",22.0,,760,COMPLETE
1893,1893,0.7151752401036354,2022-11-30 03:35:58.571621,2022-11-30 03:36:22.673193,0 days 00:00:24.101572,"{0: 1, 1: 10}",12.0,,760,COMPLETE
1894,1894,0.7308161061136548,2022-11-30 03:36:22.909233,2022-11-30 03:36:47.704597,0 days 00:00:24.795364,"{0: 1, 1: 10}",6.0,,810,COMPLETE
