,number,value,datetime_start,datetime_complete,duration,params_class_weight,params_max_depth,params_max_features,params_n_estimators,state
2358,2358,0.7310624483922132,2022-11-30 06:30:13.603375,2022-11-30 06:30:37.159461,0 days 00:00:23.556086,"{0: 1, 1: 10}",6.0,,760,COMPLETE
2359,2359,0.7147283350179638,2022-11-30 06:30:37.399182,2022-11-30 06:31:01.252432,0 days 00:00:23.853250,"{0: 1, 1: 10}",31.0,0.9,810,COMPLETE
2360,2360,0.7332644904967889,2022-11-30 06:31:01.500024,2022-11-30 06:31:22.640667,0 days 00:00:21.140643,"{0: 1, 1: 10}",6.0,,660,COMPLETE
2361,2361,0.7225930556948481,2022-11-30 06:31:22.878285,2022-11-30 06:31:41.970616,0 days 00:00:19.092331,"{0: 1, 1: 10}",6.0,0.7,760,COMPLETE
2362,2362,0.7136172450572721,2022-11-30 06:31:42.207545,2022-11-30 06:32:05.302199,0 days 00:00:23.094654,"{0: 1, 1: 10}",37.0,,710,COMPLETE
2363,2363,0.7189408763043951,2022-11-30 06:32:05.548069,2022-11-30 06:32:32.164956,0 days 00:00:26.616887,"{0: 1, 1: 10}",16.0,,860,COMPLETE
2364,2364,0.7139461691045097,2022-11-30 06:32:32.402682,2022-11-30 06:32:54.117177,0 days 00:00:21.714495,"{0: 1, 1: 10}",18.0,,660,COMPLETE
2365,2365,0.6593273113992163,2022-11-30 06:32:54.352650,2022-11-30 06:33:03.485949,0 days 00:00:09.133299,"{0: 1, 1: 10}",6.0,sqrt,810,COMPLETE
2366,2366,0.7151438152669487,2022-11-30 06:33:03.731299,2022-11-30 06:33:27.778042,0 days 00:00:24.046743,"{0: 1, 1: 10}",30.0,,760,COMPLETE
2367,2367,0.7311233114121948,2022-11-30 06:33:28.014825,2022-11-30 06:33:49.290953,0 days 00:00:21.276128,"{0: 1, 1: 10}",6.0,,660,COMPLETE
2368,2368,0.7293658415828254,2022-11-30 06:33:49.537341,2022-11-30 06:34:11.933706,0 days 00:00:22.396365,"{0: 1, 1: 10}",6.0,,710,COMPLETE
2369,2369,0.7149740359727875,2022-11-30 06:34:12.181701,2022-11-30 06:34:36.329658,0 days 00:00:24.147957,"{0: 1, 1: 10}",17.0,,760,COMPLETE
2370,2370,0.7136919256669796,2022-11-30 06:34:36.571755,2022-11-30 06:34:58.296000,0 days 00:00:21.724245,"{0: 1, 1: 10}",38.0,,660,COMPLETE
2371,2371,0.7300628911964419,2022-11-30 06:34:58.534581,2022-11-30 06:35:22.087855,0 days 00:00:23.553274,"{0: 1, 1: 10}",6.0,,760,COMPLETE
2372,2372,0.7309479081030126,2022-11-30 06:35:22.342170,2022-11-30 06:35:44.920570,0 days 00:00:22.578400,"{0: 1, 1: 10}",6.0,,710,COMPLETE
2373,2373,0.7169352358591444,2022-11-30 06:35:45.168602,2022-11-30 06:36:10.335290,0 days 00:00:25.166688,"{0: 1, 1: 10}",14.0,,810,COMPLETE
2374,2374,0.7031328731908459,2022-11-30 06:36:10.579782,2022-11-30 06:36:27.741646,0 days 00:00:17.161864,"{0: 1, 1: 10}",11.0,0.6,710,COMPLETE
2375,2375,0.714264417690925,2022-11-30 06:36:27.982204,2022-11-30 06:36:49.625430,0 days 00:00:21.643226,"{0: 1, 1: 10}",35.0,,660,COMPLETE
2376,2376,0.7185960308338328,2022-11-30 06:36:49.860816,2022-11-30 06:37:10.896261,0 days 00:00:21.035445,"{0: 1, 1: 10}",4.0,,760,COMPLETE
2377,2377,0.7281170906050731,2022-11-30 06:37:11.145871,2022-11-30 06:37:35.940022,0 days 00:00:24.794151,"{0: 1, 1: 10}",6.0,,810,COMPLETE
2378,2378,0.7153440333293162,2022-11-30 06:37:36.184746,2022-11-30 06:37:59.302590,0 days 00:00:23.117844,"{0: 1, 1: 10}",24.0,1.0,710,COMPLETE
2379,2379,0.7310893377290604,2022-11-30 06:37:59.547803,2022-11-30 06:38:23.174419,0 days 00:00:23.626616,"{0: 1, 1: 10}",6.0,,760,COMPLETE
2380,2380,0.7126154689704827,2022-11-30 06:38:23.426810,2022-11-30 06:38:48.845714,0 days 00:00:25.418904,"{0: 1, 1: 10}",21.0,,810,COMPLETE
2381,2381,0.7247893834864404,2022-11-30 06:38:49.083622,2022-11-30 06:39:10.642781,0 days 00:00:21.559159,"{0: 1, 1: 10}",8.0,,660,COMPLETE
2382,2382,0.7162263019921439,2022-11-30 06:39:10.882392,2022-11-30 06:39:33.902350,0 days 00:00:23.019958,"{0: 1, 1: 10}",19.0,,710,COMPLETE
2383,2383,0.7312307059327657,2022-11-30 06:39:34.151303,2022-11-30 06:39:57.576923,0 days 00:00:23.425620,"{0: 1, 1: 10}",6.0,,760,COMPLETE
2384,2384,0.5374068537649966,2022-11-30 06:39:57.827582,2022-11-30 06:40:06.629592,0 days 00:00:08.802010,"{0: 1, 1: 10}",39.0,log2,660,COMPLETE
2385,2385,0.733926772008302,2022-11-30 06:40:06.875448,2022-11-30 06:40:30.812299,0 days 00:00:23.936851,"{0: 1, 1: 10}",5.0,,810,COMPLETE
2386,2386,0.6762710634457093,2022-11-30 06:40:31.119746,2022-11-30 06:40:45.507999,0 days 00:00:14.388253,"{0: 1, 1: 10}",2.0,,660,COMPLETE
2387,2387,0.7187589349077457,2022-11-30 06:40:45.754679,2022-11-30 06:41:06.725910,0 days 00:00:20.971231,"{0: 1, 1: 10}",13.0,0.8,760,COMPLETE
2388,2388,0.7154219134677903,2022-11-30 06:41:07.022720,2022-11-30 06:41:29.908577,0 days 00:00:22.885857,"{0: 1, 1: 10}",32.0,,710,COMPLETE
2389,2389,0.7153929629452666,2022-11-30 06:41:30.150338,2022-11-30 06:41:54.102077,0 days 00:00:23.951739,"{0: 1, 1: 10}",28.0,,760,COMPLETE
2390,2390,0.7244327828921564,2022-11-30 06:41:54.353698,2022-11-30 06:42:12.643091,0 days 00:00:18.289393,"{0: 1, 1: 10}",6.0,0.7,710,COMPLETE
2391,2391,0.7311964319222108,2022-11-30 06:42:12.888859,2022-11-30 06:42:37.264319,0 days 00:00:24.375460,"{0: 1, 1: 10}",6.0,0.9,860,COMPLETE
2392,2392,0.7327412838777686,2022-11-30 06:42:37.524187,2022-11-30 06:42:58.968752,0 days 00:00:21.444565,"{0: 1, 1: 10}",7.0,,660,COMPLETE
2393,2393,0.7331871833619154,2022-11-30 06:42:59.223411,2022-11-30 06:43:23.887396,0 days 00:00:24.663985,"{0: 1, 1: 10}",6.0,,810,COMPLETE
2394,2394,0.6392920754191734,2022-11-30 06:43:24.123227,2022-11-30 06:43:33.358915,0 days 00:00:09.235688,"{0: 1, 1: 10}",15.0,sqrt,760,COMPLETE
2395,2395,0.7325501135137659,2022-11-30 06:43:33.603861,2022-11-30 06:43:54.790439,0 days 00:00:21.186578,"{0: 1, 1: 10}",6.0,,660,COMPLETE
2396,2396,0.715359414283715,2022-11-30 06:43:55.027714,2022-11-30 06:44:19.215711,0 days 00:00:24.187997,"{0: 1, 1: 10}",20.0,,760,COMPLETE
2397,2397,0.7350474843396131,2022-11-30 06:44:19.464033,2022-11-30 06:44:41.935594,0 days 00:00:22.471561,"{0: 1, 1: 10}",6.0,,710,COMPLETE
2398,2398,0.7152434895195459,2022-11-30 06:44:42.184401,2022-11-30 06:45:05.050894,0 days 00:00:22.866493,"{0: 1, 1: 10}",12.0,,710,COMPLETE
2399,2399,0.713677505721518,2022-11-30 06:45:05.300494,2022-11-30 06:45:28.303440,0 days 00:00:23.002946,"{0: 1, 1: 10}",22.0,,710,COMPLETE
2400,2400,0.7218636350680534,2022-11-30 06:45:28.541305,2022-11-30 06:45:51.485446,0 days 00:00:22.944141,"{0: 1, 1: 10}",29.0,,710,COMPLETE
2401,2401,0.7224276795102135,2022-11-30 06:45:51.724493,2022-11-30 06:46:08.386834,0 days 00:00:16.662341,"{0: 1, 1: 10}",6.0,0.6,710,COMPLETE
2402,2402,0.7334214156407411,2022-11-30 06:46:08.623226,2022-11-30 06:46:29.770271,0 days 00:00:21.147045,"{0: 1, 1: 10}",6.0,,660,COMPLETE
2403,2403,0.586228826842668,2022-11-30 06:46:30.015061,2022-11-30 06:46:41.342668,0 days 00:00:11.327607,"{0: 1, 1: 10}",1.0,,710,COMPLETE
2404,2404,0.7115235317127793,2022-11-30 06:46:41.591758,2022-11-30 06:47:03.306304,0 days 00:00:21.714546,"{0: 1, 1: 10}",23.0,,660,COMPLETE
2405,2405,0.7333285745320948,2022-11-30 06:47:03.555218,2022-11-30 06:47:25.941550,0 days 00:00:22.386332,"{0: 1, 1: 10}",6.0,,710,COMPLETE
2406,2406,0.7216405977713266,2022-11-30 06:47:26.190158,2022-11-30 06:47:47.799491,0 days 00:00:21.609333,"{0: 1, 1: 10}",9.0,,660,COMPLETE
2407,2407,0.715722456182661,2022-11-30 06:47:48.052159,2022-11-30 06:48:11.020004,0 days 00:00:22.967845,"{0: 1, 1: 10}",,1.0,710,COMPLETE
2408,2408,0.7313524691284499,2022-11-30 06:48:11.258451,2022-11-30 06:48:32.557139,0 days 00:00:21.298688,"{0: 1, 1: 10}",6.0,,660,COMPLETE
2409,2409,0.7302908005362307,2022-11-30 06:48:32.792688,2022-11-30 06:48:55.162209,0 days 00:00:22.369521,"{0: 1, 1: 10}",6.0,,710,COMPLETE
2410,2410,0.7290417967456687,2022-11-30 06:48:55.413794,2022-11-30 06:49:17.784909,0 days 00:00:22.371115,"{0: 1, 1: 10}",6.0,,710,COMPLETE
2411,2411,0.7334035234242637,2022-11-30 06:49:18.038500,2022-11-30 06:49:39.216786,0 days 00:00:21.178286,"{0: 1, 1: 10}",6.0,,660,COMPLETE
2412,2412,0.7187512117965726,2022-11-30 06:49:39.464918,2022-11-30 06:50:01.204426,0 days 00:00:21.739508,"{0: 1, 1: 10}",33.0,,660,COMPLETE
2413,2413,0.7105328521204765,2022-11-30 06:50:01.455474,2022-11-30 06:50:19.446751,0 days 00:00:17.991277,"{0: 1, 1: 10}",3.0,,710,COMPLETE
2414,2414,0.7294396825696909,2022-11-30 06:50:19.686628,2022-11-30 06:50:40.204075,0 days 00:00:20.517447,"{0: 1, 1: 10}",5.0,,660,COMPLETE
2415,2415,0.5387053072361192,2022-11-30 06:50:40.440394,2022-11-30 06:50:49.092016,0 days 00:00:08.651622,"{0: 1, 1: 10}",27.0,log2,660,COMPLETE
2416,2416,0.7320189184112726,2022-11-30 06:50:49.338054,2022-11-30 06:51:11.698449,0 days 00:00:22.360395,"{0: 1, 1: 10}",6.0,,710,COMPLETE
2417,2417,0.7161776945479976,2022-11-30 06:51:11.950801,2022-11-30 06:51:33.644451,0 days 00:00:21.693650,"{0: 1, 1: 10}",10.0,,660,COMPLETE
2418,2418,0.7176248188332616,2022-11-30 06:51:33.878679,2022-11-30 06:51:53.890135,0 days 00:00:20.011456,"{0: 1, 1: 10}",34.0,0.8,710,COMPLETE
2419,2419,0.7304819655921715,2022-11-30 06:51:54.141355,2022-11-30 06:52:12.925124,0 days 00:00:18.783769,"{0: 1, 1: 10}",6.0,0.9,610,COMPLETE
2420,2420,0.7176099190795837,2022-11-30 06:52:13.175807,2022-11-30 06:52:36.114304,0 days 00:00:22.938497,"{0: 1, 1: 10}",26.0,,710,COMPLETE
2421,2421,0.7227577926659252,2022-11-30 06:52:36.369008,2022-11-30 06:52:53.609802,0 days 00:00:17.240794,"{0: 1, 1: 10}",6.0,0.7,660,COMPLETE
2422,2422,0.7129081644668154,2022-11-30 06:52:53.847772,2022-11-30 06:53:14.264255,0 days 00:00:20.416483,"{0: 1, 1: 10}",25.0,,610,COMPLETE
2423,2423,0.7163481686538997,2022-11-30 06:53:14.510317,2022-11-30 06:53:37.620446,0 days 00:00:23.110129,"{0: 1, 1: 10}",36.0,,710,COMPLETE
2424,2424,0.729667520044022,2022-11-30 06:53:37.873238,2022-11-30 06:53:57.778904,0 days 00:00:19.905666,"{0: 1, 1: 10}",6.0,,610,COMPLETE
2425,2425,0.6285812511585753,2022-11-30 06:53:58.031011,2022-11-30 06:54:07.090519,0 days 00:00:09.059508,"{0: 1, 1: 10}",31.0,sqrt,710,COMPLETE
2426,2426,0.718888610369456,2022-11-30 06:54:07.331070,2022-11-30 06:54:29.106844,0 days 00:00:21.775774,"{0: 1, 1: 10}",37.0,,660,COMPLETE
2427,2427,0.7295592845157405,2022-11-30 06:54:29.352484,2022-11-30 06:54:49.395731,0 days 00:00:20.043247,"{0: 1, 1: 10}",6.0,,610,COMPLETE
2428,2428,0.7145275749239368,2022-11-30 06:54:49.649476,2022-11-30 06:55:11.272308,0 days 00:00:21.622832,"{0: 1, 1: 10}",11.0,,660,COMPLETE
2429,2429,0.7160895461344029,2022-11-30 06:55:11.527800,2022-11-30 06:55:34.677075,0 days 00:00:23.149275,"{0: 1, 1: 10}",18.0,,710,COMPLETE
2430,2430,0.731614432494914,2022-11-30 06:55:34.925557,2022-11-30 06:56:00.800872,0 days 00:00:25.875315,"{0: 1, 1: 10}",6.0,,860,COMPLETE
2431,2431,0.7123953590903512,2022-11-30 06:56:01.054094,2022-11-30 06:56:16.664384,0 days 00:00:15.610290,"{0: 1, 1: 10}",30.0,0.6,610,COMPLETE
2432,2432,0.7320584821407282,2022-11-30 06:56:16.911391,2022-11-30 06:56:39.403996,0 days 00:00:22.492605,"{0: 1, 1: 10}",6.0,,710,COMPLETE
2433,2433,0.7134248913528615,2022-11-30 06:56:39.654428,2022-11-30 06:57:01.420363,0 days 00:00:21.765935,"{0: 1, 1: 10}",16.0,,660,COMPLETE
2434,2434,0.7146655874899939,2022-11-30 06:57:01.672061,2022-11-30 06:57:22.119198,0 days 00:00:20.447137,"{0: 1, 1: 10}",35.0,,610,COMPLETE
2435,2435,0.7153219515748813,2022-11-30 06:57:22.370323,2022-11-30 06:57:45.313518,0 days 00:00:22.943195,"{0: 1, 1: 10}",17.0,,710,COMPLETE
2436,2436,0.7319966857102693,2022-11-30 06:57:45.557644,2022-11-30 06:58:06.902993,0 days 00:00:21.345349,"{0: 1, 1: 10}",6.0,,660,COMPLETE
2437,2437,0.7303878129009149,2022-11-30 06:58:07.157310,2022-11-30 06:58:27.160230,0 days 00:00:20.002920,"{0: 1, 1: 10}",6.0,1.0,610,COMPLETE
2438,2438,0.7136419032725196,2022-11-30 06:58:27.412977,2022-11-30 06:58:46.698877,0 days 00:00:19.285900,"{0: 1, 1: 10}",4.0,,660,COMPLETE
2439,2439,0.73294185277359,2022-11-30 06:58:46.945489,2022-11-30 06:59:09.318435,0 days 00:00:22.372946,"{0: 1, 1: 10}",6.0,,710,COMPLETE
2440,2440,0.7174601221065946,2022-11-30 06:59:09.558344,2022-11-30 06:59:30.114786,0 days 00:00:20.556442,"{0: 1, 1: 10}",14.0,,610,COMPLETE
2441,2441,0.7341337490910282,2022-11-30 06:59:30.361919,2022-11-30 06:59:51.540193,0 days 00:00:21.178274,"{0: 1, 1: 10}",6.0,,660,COMPLETE
2442,2442,0.7182271986062023,2022-11-30 06:59:51.790135,2022-11-30 07:00:14.635992,0 days 00:00:22.845857,"{0: 1, 1: 10}",24.0,,710,COMPLETE
2443,2443,0.7141474914628018,2022-11-30 07:00:14.884224,2022-11-30 07:00:35.426669,0 days 00:00:20.542445,"{0: 1, 1: 10}",19.0,,610,COMPLETE
2444,2444,0.6238743410858052,2022-11-30 07:00:35.675198,2022-11-30 07:00:45.448507,0 days 00:00:09.773309,"{0: 1, 1: 10}",6.0,log2,660,COMPLETE
2445,2445,0.7163526995504849,2022-11-30 07:00:45.699035,2022-11-30 07:01:08.426847,0 days 00:00:22.727812,"{0: 1, 1: 10}",39.0,,710,COMPLETE
2446,2446,0.71396249380771,2022-11-30 07:01:08.673328,2022-11-30 07:01:29.218418,0 days 00:00:20.545090,"{0: 1, 1: 10}",21.0,,610,COMPLETE
2447,2447,0.7145314661608632,2022-11-30 07:01:29.458971,2022-11-30 07:01:51.224437,0 days 00:00:21.765466,"{0: 1, 1: 10}",32.0,,660,COMPLETE
2448,2448,0.7194014905617325,2022-11-30 07:01:51.471955,2022-11-30 07:02:11.541019,0 days 00:00:20.069064,"{0: 1, 1: 10}",8.0,0.8,710,COMPLETE
2449,2449,0.7176398291756813,2022-11-30 07:02:11.796458,2022-11-30 07:02:32.466864,0 days 00:00:20.670406,"{0: 1, 1: 10}",28.0,,610,COMPLETE
2450,2450,0.7318578748907261,2022-11-30 07:02:32.710606,2022-11-30 07:02:52.594787,0 days 00:00:19.884181,"{0: 1, 1: 10}",6.0,0.9,660,COMPLETE
2451,2451,0.7163028649791721,2022-11-30 07:02:52.836487,2022-11-30 07:03:19.443227,0 days 00:00:26.606740,"{0: 1, 1: 10}",13.0,,860,COMPLETE
2452,2452,0.710743372430095,2022-11-30 07:03:19.689568,2022-11-30 07:03:38.374864,0 days 00:00:18.685296,"{0: 1, 1: 10}",38.0,0.7,710,COMPLETE
2453,2453,0.7304296374522294,2022-11-30 07:03:38.611980,2022-11-30 07:03:58.728123,0 days 00:00:20.116143,"{0: 1, 1: 10}",6.0,,610,COMPLETE
2454,2454,0.7305124202275765,2022-11-30 07:03:58.972128,2022-11-30 07:04:20.076969,0 days 00:00:21.104841,"{0: 1, 1: 10}",6.0,,660,COMPLETE
2455,2455,0.6357600963302248,2022-11-30 07:04:20.326114,2022-11-30 07:04:29.258431,0 days 00:00:08.932317,balanced,5.0,sqrt,710,COMPLETE
2456,2456,0.7180761694555231,2022-11-30 07:04:29.501869,2022-11-30 07:04:53.527168,0 days 00:00:24.025299,"{0: 1, 1: 10}",12.0,,760,COMPLETE
2457,2457,0.7312923538642986,2022-11-30 07:04:53.769929,2022-11-30 07:05:14.073392,0 days 00:00:20.303463,"{0: 1, 1: 10}",7.0,,610,COMPLETE
2458,2458,0.7157653774245477,2022-11-30 07:05:14.319763,2022-11-30 07:05:39.877914,0 days 00:00:25.558151,"{0: 1, 1: 10}",20.0,,810,COMPLETE
2459,2459,0.7133967580784787,2022-11-30 07:05:40.129082,2022-11-30 07:06:01.780255,0 days 00:00:21.651173,"{0: 1, 1: 10}",15.0,,660,COMPLETE
2460,2460,0.7159493574921322,2022-11-30 07:06:02.029897,2022-11-30 07:06:28.658402,0 days 00:00:26.628505,"{0: 1, 1: 10}",29.0,,860,COMPLETE
2461,2461,0.6753692557977553,2022-11-30 07:06:28.897867,2022-11-30 07:06:43.847636,0 days 00:00:14.949769,"{0: 1, 1: 10}",2.0,,710,COMPLETE
2462,2462,0.7194942339234712,2022-11-30 07:06:44.096316,2022-11-30 07:07:02.421158,0 days 00:00:18.324842,"{0: 1, 1: 10}",6.0,0.6,810,COMPLETE
2463,2463,0.7160314561616467,2022-11-30 07:07:02.676847,2022-11-30 07:07:26.882613,0 days 00:00:24.205766,"{0: 1, 1: 10}",22.0,,760,COMPLETE
2464,2464,0.733450580226245,2022-11-30 07:07:27.128982,2022-11-30 07:07:47.166337,0 days 00:00:20.037355,"{0: 1, 1: 10}",6.0,,610,COMPLETE
2465,2465,0.7329976152362898,2022-11-30 07:07:47.421975,2022-11-30 07:08:08.865071,0 days 00:00:21.443096,"{0: 1, 1: 10}",6.0,,660,COMPLETE
2466,2466,0.7172257635575978,2022-11-30 07:08:09.115042,2022-11-30 07:08:32.073941,0 days 00:00:22.958899,"{0: 1, 1: 10}",,,710,COMPLETE
2467,2467,0.733618419373721,2022-11-30 07:08:32.312732,2022-11-30 07:08:55.841796,0 days 00:00:23.529064,"{0: 1, 1: 10}",6.0,1.0,760,COMPLETE
2468,2468,0.7304158391130355,2022-11-30 07:08:56.092889,2022-11-30 07:09:17.217938,0 days 00:00:21.125049,"{0: 1, 1: 10}",6.0,,660,COMPLETE
2469,2469,0.7249930314547519,2022-11-30 07:09:17.455279,2022-11-30 07:09:40.290022,0 days 00:00:22.834743,"{0: 1, 1: 10}",9.0,,710,COMPLETE
2470,2470,0.7310108891832167,2022-11-30 07:09:40.530442,2022-11-30 07:10:00.621806,0 days 00:00:20.091364,"{0: 1, 1: 10}",6.0,,610,COMPLETE
2471,2471,0.7334245265444178,2022-11-30 07:10:00.869515,2022-11-30 07:10:25.514978,0 days 00:00:24.645463,"{0: 1, 1: 10}",6.0,,810,COMPLETE
2472,2472,0.7321406624907859,2022-11-30 07:10:25.770949,2022-11-30 07:10:49.279652,0 days 00:00:23.508703,"{0: 1, 1: 10}",6.0,,760,COMPLETE
2473,2473,0.7132039254295937,2022-11-30 07:10:49.529258,2022-11-30 07:11:10.149521,0 days 00:00:20.620263,"{0: 1, 1: 10}",27.0,,610,COMPLETE
2474,2474,0.7151721579542117,2022-11-30 07:11:10.398595,2022-11-30 07:11:32.050646,0 days 00:00:21.652051,"{0: 1, 1: 10}",33.0,,660,COMPLETE
2475,2475,0.7326859417042246,2022-11-30 07:11:32.292462,2022-11-30 07:11:55.842615,0 days 00:00:23.550153,"{0: 1, 1: 10}",6.0,,760,COMPLETE
2476,2476,0.5817794206791447,2022-11-30 07:11:56.088305,2022-11-30 07:12:07.406275,0 days 00:00:11.317970,"{0: 1, 1: 10}",1.0,,710,COMPLETE
2477,2477,0.6067599624113929,2022-11-30 07:12:07.659434,2022-11-30 07:12:18.390639,0 days 00:00:10.731205,balanced,3.0,log2,810,COMPLETE
2478,2478,0.716291597796405,2022-11-30 07:12:18.639633,2022-11-30 07:12:39.152468,0 days 00:00:20.512835,"{0: 1, 1: 10}",23.0,,610,COMPLETE
2479,2479,0.7150041633265279,2022-11-30 07:12:39.396772,2022-11-30 07:12:59.318746,0 days 00:00:19.921974,"{0: 1, 1: 10}",26.0,0.8,710,COMPLETE
2480,2480,0.7341457186096713,2022-11-30 07:12:59.572389,2022-11-30 07:13:20.879770,0 days 00:00:21.307381,"{0: 1, 1: 10}",6.0,,660,COMPLETE
2481,2481,0.7131639887462031,2022-11-30 07:13:21.129796,2022-11-30 07:13:40.696309,0 days 00:00:19.566513,"{0: 1, 1: 10}",34.0,0.7,760,COMPLETE
2482,2482,0.7308751667509154,2022-11-30 07:13:40.937496,2022-11-30 07:14:00.367601,0 days 00:00:19.430105,"{0: 1, 1: 10}",5.0,,610,COMPLETE
2483,2483,0.7351462234526467,2022-11-30 07:14:00.622208,2022-11-30 07:14:21.800269,0 days 00:00:21.178061,"{0: 1, 1: 10}",6.0,,660,COMPLETE
2484,2484,0.661603007433414,2022-11-30 07:14:22.046412,2022-11-30 07:14:30.798507,0 days 00:00:08.752095,"{0: 1, 1: 10}",6.0,sqrt,710,COMPLETE
2485,2485,0.7160047062175344,2022-11-30 07:14:31.045636,2022-11-30 07:14:53.445624,0 days 00:00:22.399988,"{0: 1, 1: 10}",36.0,0.9,760,COMPLETE
2486,2486,0.732708482522147,2022-11-30 07:14:53.702068,2022-11-30 07:15:19.457038,0 days 00:00:25.754970,"{0: 1, 1: 10}",6.0,,860,COMPLETE
2487,2487,0.7204651007690962,2022-11-30 07:15:19.712729,2022-11-30 07:15:41.518676,0 days 00:00:21.805947,"{0: 1, 1: 10}",37.0,,660,COMPLETE
2488,2488,0.7315501345516543,2022-11-30 07:15:41.766630,2022-11-30 07:16:06.461472,0 days 00:00:24.694842,"{0: 1, 1: 10}",6.0,,810,COMPLETE
2489,2489,0.7154536260478215,2022-11-30 07:16:06.700972,2022-11-30 07:16:27.197069,0 days 00:00:20.496097,"{0: 1, 1: 10}",16.0,,610,COMPLETE
2490,2490,0.7307661891054731,2022-11-30 07:16:27.439471,2022-11-30 07:16:51.040986,0 days 00:00:23.601515,"{0: 1, 1: 10}",6.0,,760,COMPLETE
2491,2491,0.731972299499655,2022-11-30 07:16:51.288938,2022-11-30 07:17:13.515858,0 days 00:00:22.226920,"{0: 1, 1: 10}",6.0,,710,COMPLETE
2492,2492,0.7149256677014452,2022-11-30 07:17:13.763214,2022-11-30 07:17:30.267748,0 days 00:00:16.504534,"{0: 1, 1: 10}",10.0,0.6,660,COMPLETE
2493,2493,0.7173352247118937,2022-11-30 07:17:30.520964,2022-11-30 07:17:56.011058,0 days 00:00:25.490094,"{0: 1, 1: 10}",25.0,,810,COMPLETE
2494,2494,0.7153952133869619,2022-11-30 07:17:56.258931,2022-11-30 07:18:18.224007,0 days 00:00:21.965076,"{0: 1, 1: 10}",31.0,,660,COMPLETE
2495,2495,0.7155861220661702,2022-11-30 07:18:18.471559,2022-11-30 07:18:41.327016,0 days 00:00:22.855457,"{0: 1, 1: 10}",18.0,,710,COMPLETE
2496,2496,0.7307994732392161,2022-11-30 07:18:41.574530,2022-11-30 07:19:01.580522,0 days 00:00:20.005992,"{0: 1, 1: 10}",6.0,,610,COMPLETE
2497,2497,0.7202904763415764,2022-11-30 07:19:01.829521,2022-11-30 07:19:27.029916,0 days 00:00:25.200395,"{0: 1, 1: 10}",17.0,,810,COMPLETE
2498,2498,0.6492808232472316,2022-11-30 07:19:27.279612,2022-11-30 07:19:48.439475,0 days 00:00:21.159863,balanced,11.0,,760,COMPLETE
2499,2499,0.7124783364516056,2022-11-30 07:19:48.679957,2022-11-30 07:20:12.970833,0 days 00:00:24.290876,"{0: 1, 1: 10}",35.0,1.0,760,COMPLETE
