,number,value,datetime_start,datetime_complete,duration,params_class_weight,params_max_depth,params_max_features,params_n_estimators,state
2204,2204,0.7158361522529122,2022-11-30 05:32:53.013740,2022-11-30 05:33:19.466029,0 days 00:00:26.452289,"{0: 1, 1: 10}",20.0,,860,COMPLETE
2205,2205,0.7345863344419974,2022-11-30 05:33:19.711833,2022-11-30 05:33:44.416286,0 days 00:00:24.704453,"{0: 1, 1: 10}",6.0,,810,COMPLETE
2206,2206,0.7183511507713145,2022-11-30 05:33:44.657015,2022-11-30 05:34:10.133343,0 days 00:00:25.476328,"{0: 1, 1: 10}",12.0,,810,COMPLETE
2207,2207,0.7338583829777722,2022-11-30 05:34:10.365206,2022-11-30 05:34:33.562555,0 days 00:00:23.197349,"{0: 1, 1: 10}",6.0,0.9,810,COMPLETE
2208,2208,0.7075613676035587,2022-11-30 05:34:33.795814,2022-11-30 05:34:55.130558,0 days 00:00:21.334744,"{0: 1, 1: 10}",22.0,0.7,860,COMPLETE
2209,2209,0.7335774668816366,2022-11-30 05:34:55.380109,2022-11-30 05:35:20.164307,0 days 00:00:24.784198,"{0: 1, 1: 10}",6.0,,810,COMPLETE
2210,2210,0.7319712317880407,2022-11-30 05:35:20.405026,2022-11-30 05:35:45.218195,0 days 00:00:24.813169,"{0: 1, 1: 10}",6.0,,810,COMPLETE
2211,2211,0.5778719340625471,2022-11-30 05:35:45.470453,2022-11-30 05:35:56.653259,0 days 00:00:11.182806,"{0: 1, 1: 10}",1.0,0.8,810,COMPLETE
2212,2212,0.7321887552112802,2022-11-30 05:35:56.894046,2022-11-30 05:36:21.729384,0 days 00:00:24.835338,"{0: 1, 1: 10}",6.0,,810,COMPLETE
2213,2213,0.6597016432083199,2022-11-30 05:36:21.974836,2022-11-30 05:36:31.214577,0 days 00:00:09.239741,"{0: 1, 1: 10}",9.0,sqrt,810,COMPLETE
2214,2214,0.7127216509222947,2022-11-30 05:36:31.458255,2022-11-30 05:36:56.861712,0 days 00:00:25.403457,"{0: 1, 1: 10}",23.0,,810,COMPLETE
2215,2215,0.7321806072239776,2022-11-30 05:36:57.105339,2022-11-30 05:37:22.950760,0 days 00:00:25.845421,"{0: 1, 1: 10}",6.0,,860,COMPLETE
2216,2216,0.7146522952314853,2022-11-30 05:37:23.195113,2022-11-30 05:37:48.535710,0 days 00:00:25.340597,"{0: 1, 1: 10}",,,810,COMPLETE
2217,2217,0.7330486825634334,2022-11-30 05:37:48.772588,2022-11-30 05:38:13.569247,0 days 00:00:24.796659,"{0: 1, 1: 10}",6.0,,810,COMPLETE
2218,2218,0.710833959900855,2022-11-30 05:38:13.819931,2022-11-30 05:38:33.526913,0 days 00:00:19.706982,"{0: 1, 1: 10}",3.0,,810,COMPLETE
2219,2219,0.7229620514943117,2022-11-30 05:38:33.773423,2022-11-30 05:38:52.846590,0 days 00:00:19.073167,"{0: 1, 1: 10}",6.0,0.6,860,COMPLETE
2220,2220,0.711785255848991,2022-11-30 05:38:53.095790,2022-11-30 05:39:18.643618,0 days 00:00:25.547828,"{0: 1, 1: 10}",27.0,,810,COMPLETE
2221,2221,0.7133841913573556,2022-11-30 05:39:18.883964,2022-11-30 05:39:44.252134,0 days 00:00:25.368170,"{0: 1, 1: 10}",33.0,,810,COMPLETE
2222,2222,0.7339601262448858,2022-11-30 05:39:44.488674,2022-11-30 05:40:09.156348,0 days 00:00:24.667674,"{0: 1, 1: 10}",6.0,,810,COMPLETE
2223,2223,0.7174107340886355,2022-11-30 05:40:09.396968,2022-11-30 05:40:35.962208,0 days 00:00:26.565240,"{0: 1, 1: 10}",34.0,,860,COMPLETE
2224,2224,0.7350464913709513,2022-11-30 05:40:36.206307,2022-11-30 05:40:59.657136,0 days 00:00:23.450829,"{0: 1, 1: 10}",6.0,,760,COMPLETE
2225,2225,0.7146405283296483,2022-11-30 05:40:59.895362,2022-11-30 05:41:25.359303,0 days 00:00:25.463941,"{0: 1, 1: 10}",26.0,,810,COMPLETE
2226,2226,0.7137505244688155,2022-11-30 05:41:25.592826,2022-11-30 05:41:49.793262,0 days 00:00:24.200436,"{0: 1, 1: 10}",36.0,1.0,760,COMPLETE
2227,2227,0.7341586102465661,2022-11-30 05:41:50.033021,2022-11-30 05:42:13.672561,0 days 00:00:23.639540,"{0: 1, 1: 10}",6.0,,760,COMPLETE
2228,2228,0.7152665422124092,2022-11-30 05:42:13.911181,2022-11-30 05:42:39.341569,0 days 00:00:25.430388,"{0: 1, 1: 10}",25.0,,810,COMPLETE
2229,2229,0.7304045013682118,2022-11-30 05:42:39.586305,2022-11-30 05:43:03.085372,0 days 00:00:23.499067,"{0: 1, 1: 10}",6.0,,760,COMPLETE
2230,2230,0.7151415261391817,2022-11-30 05:43:03.319376,2022-11-30 05:43:28.689313,0 days 00:00:25.369937,"{0: 1, 1: 10}",31.0,,810,COMPLETE
2231,2231,0.7314088160775787,2022-11-30 05:43:28.926372,2022-11-30 05:43:52.469256,0 days 00:00:23.542884,"{0: 1, 1: 10}",6.0,,760,COMPLETE
2232,2232,0.6019123772020706,2022-11-30 05:43:52.709591,2022-11-30 05:44:02.523649,0 days 00:00:09.814058,"{0: 1, 1: 10}",10.0,log2,810,COMPLETE
2233,2233,0.7287401805416107,2022-11-30 05:44:02.764520,2022-11-30 05:44:26.273425,0 days 00:00:23.508905,"{0: 1, 1: 10}",6.0,,760,COMPLETE
2234,2234,0.7176591618325608,2022-11-30 05:44:26.516138,2022-11-30 05:44:51.984334,0 days 00:00:25.468196,"{0: 1, 1: 10}",37.0,,810,COMPLETE
2235,2235,0.7177865354980772,2022-11-30 05:44:52.218158,2022-11-30 05:45:16.378060,0 days 00:00:24.159902,"{0: 1, 1: 10}",16.0,,760,COMPLETE
2236,2236,0.7300813907558081,2022-11-30 05:45:16.631626,2022-11-30 05:45:39.259170,0 days 00:00:22.627544,"{0: 1, 1: 10}",6.0,0.8,860,COMPLETE
2237,2237,0.7333847402469675,2022-11-30 05:45:39.499493,2022-11-30 05:46:03.006266,0 days 00:00:23.506773,"{0: 1, 1: 10}",6.0,,760,COMPLETE
2238,2238,0.7116483355126632,2022-11-30 05:46:03.257234,2022-11-30 05:46:27.392446,0 days 00:00:24.135212,"{0: 1, 1: 10}",30.0,,760,COMPLETE
2239,2239,0.7123553738818981,2022-11-30 05:46:27.632079,2022-11-30 05:46:51.267082,0 days 00:00:23.635003,"{0: 1, 1: 10}",18.0,0.9,810,COMPLETE
2240,2240,0.7176948135657847,2022-11-30 05:46:51.501879,2022-11-30 05:47:15.803437,0 days 00:00:24.301558,"{0: 1, 1: 10}",11.0,,760,COMPLETE
2241,2241,0.7245067215135108,2022-11-30 05:47:16.046416,2022-11-30 05:47:36.003656,0 days 00:00:19.957240,"{0: 1, 1: 10}",6.0,0.7,810,COMPLETE
2242,2242,0.7152957113540025,2022-11-30 05:47:36.247595,2022-11-30 05:48:00.431314,0 days 00:00:24.183719,"{0: 1, 1: 10}",17.0,,760,COMPLETE
2243,2243,0.7323624294655038,2022-11-30 05:48:00.670026,2022-11-30 05:48:25.540852,0 days 00:00:24.870826,"{0: 1, 1: 10}",6.0,,810,COMPLETE
2244,2244,0.7163465580141363,2022-11-30 05:48:25.775642,2022-11-30 05:48:50.136033,0 days 00:00:24.360391,"{0: 1, 1: 10}",38.0,,760,COMPLETE
2245,2245,0.7129430879387534,2022-11-30 05:48:50.370526,2022-11-30 05:49:14.349075,0 days 00:00:23.978549,"{0: 1, 1: 10}",35.0,,760,COMPLETE
2246,2246,0.7312493792477693,2022-11-30 05:49:14.585195,2022-11-30 05:49:39.318695,0 days 00:00:24.733500,"{0: 1, 1: 10}",6.0,,810,COMPLETE
2247,2247,0.6542023192831918,2022-11-30 05:49:39.554374,2022-11-30 05:49:48.631716,0 days 00:00:09.077342,"{0: 1, 1: 10}",4.0,sqrt,760,COMPLETE
2248,2248,0.7339798845731784,2022-11-30 05:49:48.865663,2022-11-30 05:50:13.606505,0 days 00:00:24.740842,"{0: 1, 1: 10}",6.0,,810,COMPLETE
2249,2249,0.7222888128087134,2022-11-30 05:50:13.859832,2022-11-30 05:50:33.039479,0 days 00:00:19.179647,"{0: 1, 1: 10}",6.0,0.6,860,COMPLETE
2250,2250,0.7164517685012819,2022-11-30 05:50:33.286208,2022-11-30 05:50:57.406180,0 days 00:00:24.119972,"{0: 1, 1: 10}",14.0,,760,COMPLETE
2251,2251,0.7136112751808255,2022-11-30 05:50:57.642654,2022-11-30 05:51:21.908196,0 days 00:00:24.265542,"{0: 1, 1: 10}",24.0,,760,COMPLETE
2252,2252,0.7156998723532292,2022-11-30 05:51:22.150855,2022-11-30 05:51:47.309504,0 days 00:00:25.158649,"{0: 1, 1: 10}",21.0,,810,COMPLETE
2253,2253,0.7145395266542552,2022-11-30 05:51:47.560753,2022-11-30 05:52:11.642434,0 days 00:00:24.081681,"{0: 1, 1: 10}",19.0,,760,COMPLETE
2254,2254,0.7152626041891477,2022-11-30 05:52:11.896008,2022-11-30 05:52:37.346077,0 days 00:00:25.450069,"{0: 1, 1: 10}",39.0,,810,COMPLETE
2255,2255,0.7131846205420798,2022-11-30 05:52:37.594394,2022-11-30 05:53:01.746234,0 days 00:00:24.151840,"{0: 1, 1: 10}",32.0,1.0,760,COMPLETE
2256,2256,0.7258345021185817,2022-11-30 05:53:01.997278,2022-11-30 05:53:25.977878,0 days 00:00:23.980600,"{0: 1, 1: 10}",8.0,,760,COMPLETE
2257,2257,0.7320708836041767,2022-11-30 05:53:26.215825,2022-11-30 05:53:49.839997,0 days 00:00:23.624172,"{0: 1, 1: 10}",6.0,,760,COMPLETE
2258,2258,0.7350056755789051,2022-11-30 05:53:50.082679,2022-11-30 05:54:14.688889,0 days 00:00:24.606210,"{0: 1, 1: 10}",6.0,,810,COMPLETE
2259,2259,0.7189978734486795,2022-11-30 05:54:14.940310,2022-11-30 05:54:39.112235,0 days 00:00:24.171925,"{0: 1, 1: 10}",13.0,,760,COMPLETE
2260,2260,0.7318958478338591,2022-11-30 05:54:39.364185,2022-11-30 05:55:04.121891,0 days 00:00:24.757706,"{0: 1, 1: 10}",6.0,,810,COMPLETE
2261,2261,0.6734147985074357,2022-11-30 05:55:04.360233,2022-11-30 05:55:21.389175,0 days 00:00:17.028942,"{0: 1, 1: 10}",2.0,,860,COMPLETE
2262,2262,0.7173170936167714,2022-11-30 05:55:21.630788,2022-11-30 05:55:45.665114,0 days 00:00:24.034326,"{0: 1, 1: 10}",29.0,,760,COMPLETE
2263,2263,0.5411582670527741,2022-11-30 05:55:45.909384,2022-11-30 05:55:55.065625,0 days 00:00:09.156241,"{0: 1, 1: 10}",28.0,log2,760,COMPLETE
2264,2264,0.7305281238878953,2022-11-30 05:55:55.298805,2022-11-30 05:56:20.106933,0 days 00:00:24.808128,"{0: 1, 1: 10}",6.0,,810,COMPLETE
2265,2265,0.7155716499063035,2022-11-30 05:56:20.359262,2022-11-30 05:56:44.499486,0 days 00:00:24.140224,"{0: 1, 1: 10}",15.0,,760,COMPLETE
2266,2266,0.7287458782321474,2022-11-30 05:56:44.734998,2022-11-30 05:57:07.449634,0 days 00:00:22.714636,"{0: 1, 1: 10}",7.0,0.8,860,COMPLETE
2267,2267,0.7306834707659589,2022-11-30 05:57:07.691510,2022-11-30 05:57:31.015559,0 days 00:00:23.324049,"{0: 1, 1: 10}",6.0,0.9,810,COMPLETE
2268,2268,0.7147559150475539,2022-11-30 05:57:31.268341,2022-11-30 05:57:55.569833,0 days 00:00:24.301492,"{0: 1, 1: 10}",12.0,,760,COMPLETE
2269,2269,0.713023899071835,2022-11-30 05:57:55.812217,2022-11-30 05:58:21.266328,0 days 00:00:25.454111,"{0: 1, 1: 10}",20.0,,810,COMPLETE
2270,2270,0.7174929663243985,2022-11-30 05:58:21.499185,2022-11-30 05:58:45.696632,0 days 00:00:24.197447,"{0: 1, 1: 10}",22.0,,760,COMPLETE
2271,2271,0.7321853287954081,2022-11-30 05:58:45.946034,2022-11-30 05:59:10.573620,0 days 00:00:24.627586,"{0: 1, 1: 10}",6.0,,810,COMPLETE
2272,2272,0.6642968048148867,2022-11-30 05:59:10.823595,2022-11-30 05:59:19.774072,0 days 00:00:08.950477,"{0: 1, 1: 10}",6.0,sqrt,760,COMPLETE
2273,2273,0.7271504818719366,2022-11-30 05:59:20.009842,2022-11-30 05:59:39.021960,0 days 00:00:19.012118,"{0: 1, 1: 10}",6.0,0.7,760,COMPLETE
2274,2274,0.7122572896368248,2022-11-30 05:59:39.267044,2022-11-30 06:00:04.628563,0 days 00:00:25.361519,"{0: 1, 1: 10}",,,810,COMPLETE
2275,2275,0.7176670789495738,2022-11-30 06:00:04.866739,2022-11-30 06:00:28.924048,0 days 00:00:24.057309,"{0: 1, 1: 10}",23.0,,760,COMPLETE
2276,2276,0.7342920026570227,2022-11-30 06:00:29.176850,2022-11-30 06:00:54.032147,0 days 00:00:24.855297,"{0: 1, 1: 10}",6.0,,810,COMPLETE
2277,2277,0.7306799324073815,2022-11-30 06:00:54.277951,2022-11-30 06:01:20.246915,0 days 00:00:25.968964,"{0: 1, 1: 10}",6.0,,860,COMPLETE
2278,2278,0.5915964247888638,2022-11-30 06:01:20.491747,2022-11-30 06:01:32.295160,0 days 00:00:11.803413,"{0: 1, 1: 10}",1.0,,760,COMPLETE
2279,2279,0.7301405418902406,2022-11-30 06:01:32.553996,2022-11-30 06:01:53.903908,0 days 00:00:21.349912,"{0: 1, 1: 10}",6.0,,660,COMPLETE
2280,2280,0.717341978262063,2022-11-30 06:01:54.147046,2022-11-30 06:02:11.555564,0 days 00:00:17.408518,"{0: 1, 1: 10}",6.0,0.6,760,COMPLETE
2281,2281,0.722914659264298,2022-11-30 06:02:11.796098,2022-11-30 06:02:34.717930,0 days 00:00:22.921832,"{0: 1, 1: 10}",9.0,,710,COMPLETE
2282,2282,0.7139207120678632,2022-11-30 06:02:34.961023,2022-11-30 06:03:00.294786,0 days 00:00:25.333763,"{0: 1, 1: 10}",33.0,,810,COMPLETE
2283,2283,0.7108477169657991,2022-11-30 06:03:00.537678,2022-11-30 06:03:19.518478,0 days 00:00:18.980800,"{0: 1, 1: 10}",3.0,,760,COMPLETE
2284,2284,0.7139964892751596,2022-11-30 06:03:19.771693,2022-11-30 06:03:41.529724,0 days 00:00:21.758031,"{0: 1, 1: 10}",27.0,,660,COMPLETE
2285,2285,0.7320442774607878,2022-11-30 06:03:41.773521,2022-11-30 06:04:02.281348,0 days 00:00:20.507827,"{0: 1, 1: 10}",5.0,,660,COMPLETE
2286,2286,0.7315518012450073,2022-11-30 06:04:02.515528,2022-11-30 06:04:26.024905,0 days 00:00:23.509377,"{0: 1, 1: 10}",6.0,,760,COMPLETE
2287,2287,0.7316197065670569,2022-11-30 06:04:26.262160,2022-11-30 06:04:51.073326,0 days 00:00:24.811166,"{0: 1, 1: 10}",6.0,,810,COMPLETE
2288,2288,0.719318952780669,2022-11-30 06:04:51.314303,2022-11-30 06:05:18.110948,0 days 00:00:26.796645,"{0: 1, 1: 10}",34.0,1.0,860,COMPLETE
2289,2289,0.7146202444193335,2022-11-30 06:05:18.357335,2022-11-30 06:05:41.508043,0 days 00:00:23.150708,"{0: 1, 1: 10}",36.0,,710,COMPLETE
2290,2290,0.7194764412128603,2022-11-30 06:05:41.747504,2022-11-30 06:06:03.592737,0 days 00:00:21.845233,"{0: 1, 1: 10}",10.0,,660,COMPLETE
2291,2291,0.7160977325049224,2022-11-30 06:06:03.834021,2022-11-30 06:06:28.084373,0 days 00:00:24.250352,"{0: 1, 1: 10}",25.0,,760,COMPLETE
2292,2292,0.7299903685203241,2022-11-30 06:06:28.318024,2022-11-30 06:06:50.708754,0 days 00:00:22.390730,"{0: 1, 1: 10}",6.0,,710,COMPLETE
2293,2293,0.6271834148415951,2022-11-30 06:06:50.945859,2022-11-30 06:07:01.276406,0 days 00:00:10.330547,"{0: 1, 1: 10}",6.0,log2,760,COMPLETE
2294,2294,0.7130854172155553,2022-11-30 06:07:01.509512,2022-11-30 06:07:26.895832,0 days 00:00:25.386320,"{0: 1, 1: 10}",31.0,,810,COMPLETE
2295,2295,0.7308438443507026,2022-11-30 06:07:27.141785,2022-11-30 06:07:49.464434,0 days 00:00:22.322649,"{0: 1, 1: 10}",6.0,,710,COMPLETE
2296,2296,0.7314853992239827,2022-11-30 06:07:49.701517,2022-11-30 06:08:11.070313,0 days 00:00:21.368796,"{0: 1, 1: 10}",6.0,,660,COMPLETE
2297,2297,0.7136704160316684,2022-11-30 06:08:11.307143,2022-11-30 06:08:32.472377,0 days 00:00:21.165234,"{0: 1, 1: 10}",37.0,0.8,760,COMPLETE
2298,2298,0.7158578302096811,2022-11-30 06:08:32.730937,2022-11-30 06:08:58.280916,0 days 00:00:25.549979,"{0: 1, 1: 10}",26.0,,810,COMPLETE
2299,2299,0.7139769284558208,2022-11-30 06:08:58.520665,2022-11-30 06:09:20.041000,0 days 00:00:21.520335,"{0: 1, 1: 10}",16.0,0.9,710,COMPLETE
2300,2300,0.7056634925655614,2022-11-30 06:09:20.257206,2022-11-30 06:09:38.366520,0 days 00:00:18.109314,"{0: 1, 1: 10}",11.0,0.7,660,COMPLETE
2301,2301,0.7109341950619286,2022-11-30 06:09:38.616195,2022-11-30 06:10:02.926162,0 days 00:00:24.309967,"{0: 1, 1: 10}",18.0,,760,COMPLETE
2302,2302,0.7313855055455427,2022-11-30 06:10:03.169217,2022-11-30 06:10:25.562873,0 days 00:00:22.393656,"{0: 1, 1: 10}",6.0,,710,COMPLETE
2303,2303,0.7314876341214374,2022-11-30 06:10:25.812999,2022-11-30 06:10:49.428784,0 days 00:00:23.615785,"{0: 1, 1: 10}",6.0,,760,COMPLETE
2304,2304,0.7159295582166127,2022-11-30 06:10:49.652322,2022-11-30 06:11:11.522823,0 days 00:00:21.870501,"{0: 1, 1: 10}",30.0,,660,COMPLETE
2305,2305,0.6338052426936613,2022-11-30 06:11:11.772212,2022-11-30 06:11:21.221120,0 days 00:00:09.448908,"{0: 1, 1: 10}",17.0,sqrt,810,COMPLETE
2306,2306,0.7325140343867756,2022-11-30 06:11:21.474657,2022-11-30 06:11:42.622937,0 days 00:00:21.148280,"{0: 1, 1: 10}",6.0,,660,COMPLETE
2307,2307,0.7206154412605358,2022-11-30 06:11:42.857582,2022-11-30 06:12:04.077419,0 days 00:00:21.219837,"{0: 1, 1: 10}",4.0,,760,COMPLETE
2308,2308,0.7134644514084173,2022-11-30 06:12:04.298574,2022-11-30 06:12:27.348182,0 days 00:00:23.049608,"{0: 1, 1: 10}",14.0,,710,COMPLETE
2309,2309,0.7320707763755874,2022-11-30 06:12:27.582637,2022-11-30 06:12:52.361601,0 days 00:00:24.778964,"{0: 1, 1: 10}",6.0,,810,COMPLETE
2310,2310,0.7110799530373507,2022-11-30 06:12:52.605285,2022-11-30 06:13:14.404747,0 days 00:00:21.799462,"{0: 1, 1: 10}",38.0,,660,COMPLETE
2311,2311,0.7079844891751981,2022-11-30 06:13:14.647951,2022-11-30 06:13:32.649054,0 days 00:00:18.001103,"{0: 1, 1: 10}",35.0,0.6,760,COMPLETE
2312,2312,0.7155864817282006,2022-11-30 06:13:32.884233,2022-11-30 06:13:59.497883,0 days 00:00:26.613650,"{0: 1, 1: 10}",24.0,,860,COMPLETE
2313,2313,0.7318424498041944,2022-11-30 06:13:59.746430,2022-11-30 06:14:22.187922,0 days 00:00:22.441492,"{0: 1, 1: 10}",6.0,,710,COMPLETE
2314,2314,0.7124558770193185,2022-11-30 06:14:22.438055,2022-11-30 06:14:46.678489,0 days 00:00:24.240434,"{0: 1, 1: 10}",21.0,,760,COMPLETE
2315,2315,0.732489357025129,2022-11-30 06:14:46.931450,2022-11-30 06:15:08.116875,0 days 00:00:21.185425,"{0: 1, 1: 10}",6.0,,660,COMPLETE
2316,2316,0.713184262246991,2022-11-30 06:15:08.359368,2022-11-30 06:15:31.364578,0 days 00:00:23.005210,"{0: 1, 1: 10}",19.0,,710,COMPLETE
2317,2317,0.7323694680096777,2022-11-30 06:15:31.605615,2022-11-30 06:15:55.333533,0 days 00:00:23.727918,"{0: 1, 1: 10}",6.0,,760,COMPLETE
2318,2318,0.7318574839348138,2022-11-30 06:15:55.567763,2022-11-30 06:16:19.487761,0 days 00:00:23.919998,"{0: 1, 1: 10}",5.0,1.0,810,COMPLETE
2319,2319,0.7151709050960221,2022-11-30 06:16:19.734487,2022-11-30 06:16:42.610313,0 days 00:00:22.875826,"{0: 1, 1: 10}",39.0,,710,COMPLETE
2320,2320,0.7158977877708538,2022-11-30 06:16:42.863883,2022-11-30 06:17:04.576021,0 days 00:00:21.712138,"{0: 1, 1: 10}",32.0,,660,COMPLETE
2321,2321,0.7309135720837419,2022-11-30 06:17:04.822143,2022-11-30 06:17:28.776131,0 days 00:00:23.953988,"{0: 1, 1: 10}",6.0,,760,COMPLETE
2322,2322,0.7251782088592403,2022-11-30 06:17:29.017589,2022-11-30 06:17:54.346155,0 days 00:00:25.328566,"{0: 1, 1: 10}",8.0,,810,COMPLETE
2323,2323,0.732660806554215,2022-11-30 06:17:54.589919,2022-11-30 06:18:15.853077,0 days 00:00:21.263158,"{0: 1, 1: 10}",6.0,,660,COMPLETE
2324,2324,0.7117148996091107,2022-11-30 06:18:16.091018,2022-11-30 06:18:39.012285,0 days 00:00:22.921267,"{0: 1, 1: 10}",28.0,,710,COMPLETE
2325,2325,0.5901796787879137,2022-11-30 06:18:39.264307,2022-11-30 06:18:48.714531,0 days 00:00:09.450224,"{0: 1, 1: 10}",13.0,log2,760,COMPLETE
2326,2326,0.7331816042889514,2022-11-30 06:18:48.952236,2022-11-30 06:19:10.294922,0 days 00:00:21.342686,"{0: 1, 1: 10}",6.0,,660,COMPLETE
2327,2327,0.7290301005039194,2022-11-30 06:19:10.531502,2022-11-30 06:19:32.234947,0 days 00:00:21.703445,"{0: 1, 1: 10}",7.0,0.8,810,COMPLETE
2328,2328,0.7163867868495674,2022-11-30 06:19:32.471845,2022-11-30 06:19:53.953641,0 days 00:00:21.481796,"{0: 1, 1: 10}",29.0,0.9,710,COMPLETE
2329,2329,0.7323648139852051,2022-11-30 06:19:54.197247,2022-11-30 06:20:17.918645,0 days 00:00:23.721398,"{0: 1, 1: 10}",6.0,,760,COMPLETE
2330,2330,0.716071899738472,2022-11-30 06:20:18.155929,2022-11-30 06:20:39.923264,0 days 00:00:21.767335,"{0: 1, 1: 10}",20.0,,660,COMPLETE
2331,2331,0.6643464079300692,2022-11-30 06:20:40.178019,2022-11-30 06:20:52.991322,0 days 00:00:12.813303,"{0: 1, 1: 10}",2.0,0.7,710,COMPLETE
2332,2332,0.731337827748796,2022-11-30 06:20:53.241200,2022-11-30 06:21:16.715000,0 days 00:00:23.473800,"{0: 1, 1: 10}",6.0,,760,COMPLETE
2333,2333,0.7337414887140512,2022-11-30 06:21:16.961957,2022-11-30 06:21:42.824393,0 days 00:00:25.862436,"{0: 1, 1: 10}",6.0,,860,COMPLETE
2334,2334,0.6228564214953047,2022-11-30 06:21:43.074558,2022-11-30 06:21:52.631771,0 days 00:00:09.557213,"{0: 1, 1: 10}",,sqrt,810,COMPLETE
2335,2335,0.7332048995558467,2022-11-30 06:21:52.884849,2022-11-30 06:22:14.157144,0 days 00:00:21.272295,"{0: 1, 1: 10}",6.0,,660,COMPLETE
2336,2336,0.71785867037288,2022-11-30 06:22:14.395557,2022-11-30 06:22:38.675028,0 days 00:00:24.279471,"{0: 1, 1: 10}",23.0,,760,COMPLETE
2337,2337,0.5856880022507028,2022-11-30 06:22:38.925341,2022-11-30 06:22:51.117160,0 days 00:00:12.191819,"{0: 1, 1: 10}",1.0,,810,COMPLETE
2338,2338,0.7159004031149802,2022-11-30 06:22:51.368106,2022-11-30 06:23:14.399066,0 days 00:00:23.030960,"{0: 1, 1: 10}",22.0,,710,COMPLETE
2339,2339,0.7292660942784362,2022-11-30 06:23:14.643249,2022-11-30 06:23:35.818783,0 days 00:00:21.175534,"{0: 1, 1: 10}",6.0,,660,COMPLETE
2340,2340,0.7121451570592434,2022-11-30 06:23:36.065779,2022-11-30 06:23:53.023015,0 days 00:00:16.957236,"{0: 1, 1: 10}",9.0,0.6,710,COMPLETE
2341,2341,0.7160031815971324,2022-11-30 06:23:53.268395,2022-11-30 06:24:17.434074,0 days 00:00:24.165679,"{0: 1, 1: 10}",15.0,,760,COMPLETE
2342,2342,0.731146910266028,2022-11-30 06:24:17.672407,2022-11-30 06:24:42.447384,0 days 00:00:24.774977,"{0: 1, 1: 10}",6.0,,810,COMPLETE
2343,2343,0.7141035807131298,2022-11-30 06:24:42.689624,2022-11-30 06:25:04.441107,0 days 00:00:21.751483,"{0: 1, 1: 10}",12.0,,660,COMPLETE
2344,2344,0.7326115244636864,2022-11-30 06:25:04.675705,2022-11-30 06:25:28.310909,0 days 00:00:23.635204,"{0: 1, 1: 10}",6.0,,760,COMPLETE
2345,2345,0.7114710722600438,2022-11-30 06:25:28.553656,2022-11-30 06:25:46.358773,0 days 00:00:17.805117,"{0: 1, 1: 10}",3.0,,710,COMPLETE
2346,2346,0.7317500375144085,2022-11-30 06:25:46.596408,2022-11-30 06:26:10.177166,0 days 00:00:23.580758,"{0: 1, 1: 10}",6.0,,760,COMPLETE
2347,2347,0.7147631419814966,2022-11-30 06:26:10.422786,2022-11-30 06:26:32.291997,0 days 00:00:21.869211,"{0: 1, 1: 10}",33.0,1.0,660,COMPLETE
2348,2348,0.7339467414731037,2022-11-30 06:26:32.540326,2022-11-30 06:26:58.473544,0 days 00:00:25.933218,"{0: 1, 1: 10}",6.0,,860,COMPLETE
2349,2349,0.7272496672704805,2022-11-30 06:26:58.708316,2022-11-30 06:27:20.226297,0 days 00:00:21.517981,"{0: 1, 1: 10}",5.0,,710,COMPLETE
2350,2350,0.7181852600417759,2022-11-30 06:27:20.476985,2022-11-30 06:27:44.529725,0 days 00:00:24.052740,"{0: 1, 1: 10}",34.0,,760,COMPLETE
2351,2351,0.7140133097927875,2022-11-30 06:27:44.779306,2022-11-30 06:28:10.302763,0 days 00:00:25.523457,"{0: 1, 1: 10}",26.0,,810,COMPLETE
2352,2352,0.7127327705986182,2022-11-30 06:28:10.544720,2022-11-30 06:28:32.475701,0 days 00:00:21.930981,"{0: 1, 1: 10}",27.0,,660,COMPLETE
2353,2353,0.7338536148517573,2022-11-30 06:28:32.754940,2022-11-30 06:28:55.157116,0 days 00:00:22.402176,"{0: 1, 1: 10}",6.0,,710,COMPLETE
2354,2354,0.6192862657476919,2022-11-30 06:28:55.402124,2022-11-30 06:29:05.509050,0 days 00:00:10.106926,"{0: 1, 1: 10}",6.0,log2,760,COMPLETE
2355,2355,0.7174794627409937,2022-11-30 06:29:05.752358,2022-11-30 06:29:31.017383,0 days 00:00:25.265025,"{0: 1, 1: 10}",10.0,,810,COMPLETE
2356,2356,0.7169874071802314,2022-11-30 06:29:31.264913,2022-11-30 06:29:53.078982,0 days 00:00:21.814069,"{0: 1, 1: 10}",36.0,,660,COMPLETE
2357,2357,0.7159920154145138,2022-11-30 06:29:53.324083,2022-11-30 06:30:13.358652,0 days 00:00:20.034569,"{0: 1, 1: 10}",25.0,0.8,710,COMPLETE
