,number,value,datetime_start,datetime_complete,duration,params_class_weight,params_max_depth,params_max_features,params_n_estimators,state
1269,1269,0.2936309523809523,2022-12-02 00:08:18.553341,2022-12-02 00:08:28.616824,0 days 00:00:10.063483,balanced,10.0,log2,710,COMPLETE
1270,1270,0.2798379629629629,2022-12-02 00:08:28.850911,2022-12-02 00:08:39.016217,0 days 00:00:10.165306,balanced,10.0,log2,760,COMPLETE
1271,1271,0.29038359788359785,2022-12-02 00:08:39.245607,2022-12-02 00:08:49.678337,0 days 00:00:10.432730,balanced,10.0,log2,810,COMPLETE
1272,1272,0.18927266677036753,2022-12-02 00:08:49.904156,2022-12-02 00:08:59.649722,0 days 00:00:09.745566,balanced,25.0,log2,710,COMPLETE
1273,1273,0.2760515873015873,2022-12-02 00:08:59.881314,2022-12-02 00:09:09.899977,0 days 00:00:10.018663,balanced,10.0,log2,760,COMPLETE
1274,1274,0.2893734968734968,2022-12-02 00:09:10.127344,2022-12-02 00:09:20.087922,0 days 00:00:09.960578,balanced,10.0,log2,710,COMPLETE
1275,1275,0.296058201058201,2022-12-02 00:09:20.323601,2022-12-02 00:09:30.592131,0 days 00:00:10.268530,balanced,10.0,log2,760,COMPLETE
1276,1276,0.27256944444444436,2022-12-02 00:09:30.824324,2022-12-02 00:09:40.918035,0 days 00:00:10.093711,balanced,4.0,log2,710,COMPLETE
1277,1277,0.28691558441558446,2022-12-02 00:09:41.147827,2022-12-02 00:09:51.054409,0 days 00:00:09.906582,balanced,10.0,log2,710,COMPLETE
1278,1278,0.2973385642135642,2022-12-02 00:09:51.278418,2022-12-02 00:10:01.304035,0 days 00:00:10.025617,balanced,10.0,log2,760,COMPLETE
1279,1279,0.26948412698412705,2022-12-02 00:10:01.541582,2022-12-02 00:10:11.744403,0 days 00:00:10.202821,balanced,3.0,log2,710,COMPLETE
1280,1280,0.29655092592592586,2022-12-02 00:10:11.965617,2022-12-02 00:10:22.431434,0 days 00:00:10.465817,balanced,10.0,log2,810,COMPLETE
1281,1281,0.2328795135045135,2022-12-02 00:10:22.655824,2022-12-02 00:10:32.513547,0 days 00:00:09.857723,balanced,21.0,log2,760,COMPLETE
1282,1282,0.2984292328042328,2022-12-02 00:10:32.742416,2022-12-02 00:10:42.970459,0 days 00:00:10.228043,balanced,10.0,log2,760,COMPLETE
1283,1283,0.28529100529100526,2022-12-02 00:10:43.199390,2022-12-02 00:10:53.229377,0 days 00:00:10.029987,balanced,10.0,log2,710,COMPLETE
1284,1284,0.2893253968253968,2022-12-02 00:10:53.461341,2022-12-02 00:11:03.318112,0 days 00:00:09.856771,balanced,10.0,log2,710,COMPLETE
1285,1285,0.2957175925925925,2022-12-02 00:11:03.548931,2022-12-02 00:11:13.603747,0 days 00:00:10.054816,balanced,10.0,log2,760,COMPLETE
1286,1286,0.28565476190476186,2022-12-02 00:11:13.835287,2022-12-02 00:11:23.731917,0 days 00:00:09.896630,balanced,10.0,log2,710,COMPLETE
1287,1287,0.14355436924039572,2022-12-02 00:11:23.973474,2022-12-02 00:11:33.853664,0 days 00:00:09.880190,balanced,,log2,760,COMPLETE
1288,1288,0.27488095238095234,2022-12-02 00:11:34.074913,2022-12-02 00:11:43.957828,0 days 00:00:09.882915,balanced,12.0,log2,710,COMPLETE
1289,1289,0.28806938431938434,2022-12-02 00:11:44.191431,2022-12-02 00:11:54.724037,0 days 00:00:10.532606,balanced,10.0,log2,810,COMPLETE
1290,1290,0.2871924603174603,2022-12-02 00:11:54.956428,2022-12-02 00:12:05.168783,0 days 00:00:10.212355,balanced,10.0,log2,760,COMPLETE
1291,1291,0.2750661375661375,2022-12-02 00:12:05.410519,2022-12-02 00:12:15.360397,0 days 00:00:09.949878,balanced,10.0,log2,710,COMPLETE
1292,1292,0.2936474867724867,2022-12-02 00:12:15.588999,2022-12-02 00:12:25.641162,0 days 00:00:10.052163,balanced,10.0,log2,760,COMPLETE
1293,1293,0.2785194203944204,2022-12-02 00:12:25.867098,2022-12-02 00:12:35.897484,0 days 00:00:10.030386,balanced,10.0,log2,710,COMPLETE
1294,1294,0.28725619288119286,2022-12-02 00:12:36.125834,2022-12-02 00:12:45.939298,0 days 00:00:09.813464,balanced,10.0,log2,710,COMPLETE
1295,1295,0.26246031746031745,2022-12-02 00:12:46.172733,2022-12-02 00:12:56.678426,0 days 00:00:10.505693,balanced,3.0,log2,760,COMPLETE
1296,1296,0.17444521080213843,2022-12-02 00:12:56.906715,2022-12-02 00:13:07.012916,0 days 00:00:10.106201,balanced,27.0,log2,810,COMPLETE
1297,1297,0.2972991822991823,2022-12-02 00:13:07.244510,2022-12-02 00:13:17.363988,0 days 00:00:10.119478,balanced,10.0,log2,760,COMPLETE
1298,1298,0.2835152116402116,2022-12-02 00:13:17.606373,2022-12-02 00:13:27.387680,0 days 00:00:09.781307,balanced,10.0,log2,710,COMPLETE
1299,1299,0.29538690476190477,2022-12-02 00:13:27.617087,2022-12-02 00:13:37.589593,0 days 00:00:09.972506,balanced,10.0,log2,710,COMPLETE
1300,1300,0.29621031746031745,2022-12-02 00:13:37.829105,2022-12-02 00:13:48.006378,0 days 00:00:10.177273,balanced,10.0,log2,760,COMPLETE
1301,1301,0.18706486120752805,2022-12-02 00:13:48.225293,2022-12-02 00:13:58.099100,0 days 00:00:09.873807,balanced,25.0,log2,710,COMPLETE
1302,1302,0.27591931216931215,2022-12-02 00:13:58.337552,2022-12-02 00:14:07.976484,0 days 00:00:09.638932,balanced,10.0,log2,660,COMPLETE
1303,1303,0.1400897482386311,2022-12-02 00:14:08.212182,2022-12-02 00:14:18.355376,0 days 00:00:10.143194,balanced,31.0,log2,810,COMPLETE
1304,1304,0.2871867484367484,2022-12-02 00:14:18.586297,2022-12-02 00:14:28.789768,0 days 00:00:10.203471,balanced,10.0,log2,760,COMPLETE
1305,1305,0.29218344155844156,2022-12-02 00:14:29.021757,2022-12-02 00:14:38.805780,0 days 00:00:09.784023,balanced,11.0,log2,710,COMPLETE
1306,1306,0.2895171957671957,2022-12-02 00:14:39.037594,2022-12-02 00:14:48.714552,0 days 00:00:09.676958,balanced,10.0,log2,660,COMPLETE
1307,1307,0.26757330632330634,2022-12-02 00:14:48.946898,2022-12-02 00:14:59.029307,0 days 00:00:10.082409,balanced,18.0,log2,760,COMPLETE
1308,1308,0.29476759351759346,2022-12-02 00:14:59.268675,2022-12-02 00:15:08.610864,0 days 00:00:09.342189,balanced,10.0,log2,610,COMPLETE
1309,1309,0.2798478835978836,2022-12-02 00:15:08.845269,2022-12-02 00:15:18.783169,0 days 00:00:09.937900,balanced,10.0,log2,710,COMPLETE
1310,1310,0.2793816137566137,2022-12-02 00:15:19.017820,2022-12-02 00:15:29.155754,0 days 00:00:10.137934,balanced,5.0,log2,710,COMPLETE
1311,1311,0.26863095238095236,2022-12-02 00:15:29.387136,2022-12-02 00:15:39.870177,0 days 00:00:10.483041,balanced,4.0,log2,760,COMPLETE
1312,1312,0.2818792087542087,2022-12-02 00:15:40.104525,2022-12-02 00:15:50.081718,0 days 00:00:09.977193,balanced,10.0,log2,710,COMPLETE
1313,1313,0.14720592533175408,2022-12-02 00:15:50.304181,2022-12-02 00:16:00.379963,0 days 00:00:10.075782,balanced,35.0,log2,810,COMPLETE
1314,1314,0.28783158970658973,2022-12-02 00:16:00.619365,2022-12-02 00:16:10.287146,0 days 00:00:09.667781,balanced,10.0,log2,660,COMPLETE
1315,1315,0.24490488188282308,2022-12-02 00:16:10.514909,2022-12-02 00:16:20.338883,0 days 00:00:09.823974,balanced,21.0,log2,760,COMPLETE
1316,1316,0.29042478354978346,2022-12-02 00:16:20.566792,2022-12-02 00:16:30.405155,0 days 00:00:09.838363,balanced,10.0,log2,660,COMPLETE
1317,1317,0.28518608706108706,2022-12-02 00:16:30.633735,2022-12-02 00:16:40.592697,0 days 00:00:09.958962,balanced,10.0,log2,710,COMPLETE
1318,1318,0.24786856661856663,2022-12-02 00:16:40.814118,2022-12-02 00:16:50.851414,0 days 00:00:10.037296,balanced,19.0,log2,760,COMPLETE
1319,1319,0.14935513855253568,2022-12-02 00:16:51.080294,2022-12-02 00:17:00.441793,0 days 00:00:09.361499,balanced,39.0,log2,610,COMPLETE
1320,1320,0.28248015873015875,2022-12-02 00:17:00.672049,2022-12-02 00:17:10.912822,0 days 00:00:10.240773,balanced,10.0,log2,760,COMPLETE
1321,1321,0.2598677248677248,2022-12-02 00:17:11.146466,2022-12-02 00:17:21.248285,0 days 00:00:10.101819,balanced,3.0,log2,710,COMPLETE
1322,1322,0.2931821188071188,2022-12-02 00:17:21.472641,2022-12-02 00:17:31.149680,0 days 00:00:09.677039,balanced,13.0,log2,660,COMPLETE
1323,1323,0.2727744708994709,2022-12-02 00:17:31.384359,2022-12-02 00:17:41.730933,0 days 00:00:10.346574,balanced,10.0,log2,810,COMPLETE
1324,1324,0.2891104497354497,2022-12-02 00:17:41.958245,2022-12-02 00:17:51.862424,0 days 00:00:09.904179,balanced,10.0,log2,710,COMPLETE
1325,1325,0.2831580687830687,2022-12-02 00:17:52.093590,2022-12-02 00:18:02.358783,0 days 00:00:10.265193,balanced,10.0,log2,760,COMPLETE
1326,1326,0.29127735690235684,2022-12-02 00:18:02.624465,2022-12-02 00:18:12.471126,0 days 00:00:09.846661,balanced,10.0,log2,710,COMPLETE
1327,1327,0.29306637806637803,2022-12-02 00:18:12.710867,2022-12-02 00:18:22.352360,0 days 00:00:09.641493,balanced,10.0,log2,660,COMPLETE
1328,1328,0.23739463912401892,2022-12-02 00:18:22.585195,2022-12-02 00:18:32.315770,0 days 00:00:09.730575,balanced,22.0,log2,710,COMPLETE
1329,1329,0.2927555315055314,2022-12-02 00:18:32.547415,2022-12-02 00:18:42.769632,0 days 00:00:10.222217,balanced,10.0,log2,760,COMPLETE
1330,1330,0.29377314814814814,2022-12-02 00:18:43.014687,2022-12-02 00:18:53.052253,0 days 00:00:10.037566,balanced,10.0,log2,710,COMPLETE
1331,1331,0.30827380952380945,2022-12-02 00:18:53.283551,2022-12-02 00:19:03.509634,0 days 00:00:10.226083,balanced,10.0,log2,760,COMPLETE
1332,1332,0.2824801587301587,2022-12-02 00:19:03.738790,2022-12-02 00:19:14.027939,0 days 00:00:10.289149,balanced,10.0,log2,810,COMPLETE
1333,1333,0.12677056933449463,2022-12-02 00:19:14.267453,2022-12-02 00:19:24.104129,0 days 00:00:09.836676,balanced,,log2,760,COMPLETE
1334,1334,0.28997955747955745,2022-12-02 00:19:24.338669,2022-12-02 00:19:34.772914,0 days 00:00:10.434245,balanced,12.0,log2,810,COMPLETE
1335,1335,0.27511333573833574,2022-12-02 00:19:35.006664,2022-12-02 00:19:45.211155,0 days 00:00:10.204491,balanced,10.0,log2,760,COMPLETE
1336,1336,0.29034391534391524,2022-12-02 00:19:45.444920,2022-12-02 00:19:55.704058,0 days 00:00:10.259138,balanced,10.0,log2,760,COMPLETE
1337,1337,0.30418410293410286,2022-12-02 00:19:55.919653,2022-12-02 00:20:06.158263,0 days 00:00:10.238610,balanced,10.0,log2,760,COMPLETE
1338,1338,0.29392526455026446,2022-12-02 00:20:06.385493,2022-12-02 00:20:16.927317,0 days 00:00:10.541824,balanced,10.0,log2,810,COMPLETE
1339,1339,0.16470195210275534,2022-12-02 00:20:17.159868,2022-12-02 00:20:27.160599,0 days 00:00:10.000731,balanced,27.0,log2,810,COMPLETE
1340,1340,0.18649334733465078,2022-12-02 00:20:27.386240,2022-12-02 00:20:37.239171,0 days 00:00:09.852931,balanced,25.0,log2,760,COMPLETE
1341,1341,0.2768569624819624,2022-12-02 00:20:37.464851,2022-12-02 00:20:47.505741,0 days 00:00:10.040890,balanced,10.0,log2,760,COMPLETE
1342,1342,0.15836246132989584,2022-12-02 00:20:47.739859,2022-12-02 00:20:57.983547,0 days 00:00:10.243688,balanced,31.0,log2,810,COMPLETE
1343,1343,0.26812500000000006,2022-12-02 00:20:58.215113,2022-12-02 00:21:08.666299,0 days 00:00:10.451186,balanced,3.0,log2,760,COMPLETE
1344,1344,0.29430284992784983,2022-12-02 00:21:08.894897,2022-12-02 00:21:18.964833,0 days 00:00:10.069936,balanced,10.0,log2,760,COMPLETE
1345,1345,0.28660473785473783,2022-12-02 00:21:19.199138,2022-12-02 00:21:29.394959,0 days 00:00:10.195821,balanced,10.0,log2,760,COMPLETE
1346,1346,0.2813425925925926,2022-12-02 00:21:29.625035,2022-12-02 00:21:39.799658,0 days 00:00:10.174623,balanced,10.0,log2,760,COMPLETE
1347,1347,0.28854587542087545,2022-12-02 00:21:40.033469,2022-12-02 00:21:50.531687,0 days 00:00:10.498218,balanced,10.0,log2,810,COMPLETE
1348,1348,0.28941618566618554,2022-12-02 00:21:50.755171,2022-12-02 00:22:01.159827,0 days 00:00:10.404656,balanced,11.0,log2,760,COMPLETE
1349,1349,0.2919294131794131,2022-12-02 00:22:01.393865,2022-12-02 00:22:11.565672,0 days 00:00:10.171807,balanced,10.0,log2,760,COMPLETE
1350,1350,0.2582374107374107,2022-12-02 00:22:11.800420,2022-12-02 00:22:22.071532,0 days 00:00:10.271112,balanced,18.0,log2,810,COMPLETE
1351,1351,0.3028935185185185,2022-12-02 00:22:22.301687,2022-12-02 00:22:32.613769,0 days 00:00:10.312082,balanced,10.0,log2,760,COMPLETE
1352,1352,0.30300264550264544,2022-12-02 00:22:32.843511,2022-12-02 00:22:43.201845,0 days 00:00:10.358334,balanced,16.0,log2,810,COMPLETE
1353,1353,0.263045634920635,2022-12-02 00:22:43.430113,2022-12-02 00:22:54.141762,0 days 00:00:10.711649,balanced,4.0,log2,810,COMPLETE
1354,1354,0.24963128306878302,2022-12-02 00:22:54.367197,2022-12-02 00:23:04.597802,0 days 00:00:10.230605,balanced,16.0,log2,810,COMPLETE
1355,1355,0.2920369126403609,2022-12-02 00:23:04.830575,2022-12-02 00:23:15.152090,0 days 00:00:10.321515,balanced,16.0,log2,810,COMPLETE
1356,1356,0.2641764716764717,2022-12-02 00:23:15.377343,2022-12-02 00:23:25.629881,0 days 00:00:10.252538,balanced,16.0,log2,810,COMPLETE
1357,1357,0.2664748677248677,2022-12-02 00:23:25.872432,2022-12-02 00:23:36.669655,0 days 00:00:10.797223,balanced,5.0,log2,810,COMPLETE
1358,1358,0.28305495430495436,2022-12-02 00:23:36.902891,2022-12-02 00:23:46.985852,0 days 00:00:10.082961,balanced,14.0,log2,760,COMPLETE
1359,1359,0.2777101370851371,2022-12-02 00:23:47.210317,2022-12-02 00:23:57.410561,0 days 00:00:10.200244,balanced,17.0,log2,810,COMPLETE
1360,1360,0.28411153661153665,2022-12-02 00:23:57.653431,2022-12-02 00:24:08.021439,0 days 00:00:10.368008,balanced,16.0,log2,810,COMPLETE
1361,1361,0.2664165464165464,2022-12-02 00:24:08.250390,2022-12-02 00:24:18.272751,0 days 00:00:10.022361,balanced,16.0,log2,760,COMPLETE
1362,1362,0.2638966576795524,2022-12-02 00:24:18.500873,2022-12-02 00:24:28.631302,0 days 00:00:10.130429,balanced,16.0,log2,760,COMPLETE
1363,1363,0.27922348484848486,2022-12-02 00:24:28.864811,2022-12-02 00:24:39.193926,0 days 00:00:10.329115,balanced,16.0,log2,810,COMPLETE
1364,1364,0.2691236772486772,2022-12-02 00:24:39.435298,2022-12-02 00:24:49.840121,0 days 00:00:10.404823,balanced,6.0,log2,760,COMPLETE
1365,1365,0.26610282079032077,2022-12-02 00:24:50.070879,2022-12-02 00:25:00.070611,0 days 00:00:09.999732,balanced,16.0,log2,760,COMPLETE
1366,1366,0.14437032328861865,2022-12-02 00:25:00.300761,2022-12-02 00:25:10.179509,0 days 00:00:09.878748,balanced,35.0,log2,760,COMPLETE
1367,1367,0.2654229566729566,2022-12-02 00:25:10.415352,2022-12-02 00:25:20.593657,0 days 00:00:10.178305,balanced,16.0,log2,810,COMPLETE
1368,1368,0.2707738095238095,2022-12-02 00:25:20.826634,2022-12-02 00:25:31.340578,0 days 00:00:10.513944,balanced,3.0,log2,760,COMPLETE
1369,1369,0.27561743811743805,2022-12-02 00:25:31.575376,2022-12-02 00:25:41.587572,0 days 00:00:10.012196,balanced,15.0,log2,760,COMPLETE
1370,1370,0.26065295815295814,2022-12-02 00:25:41.819468,2022-12-02 00:25:52.172144,0 days 00:00:10.352676,balanced,16.0,log2,810,COMPLETE
1371,1371,0.2674588143338143,2022-12-02 00:25:52.413877,2022-12-02 00:26:02.455729,0 days 00:00:10.041852,balanced,16.0,log2,760,COMPLETE
1372,1372,0.23376125214941004,2022-12-02 00:26:02.684475,2022-12-02 00:26:12.857113,0 days 00:00:10.172638,balanced,21.0,log2,760,COMPLETE
1373,1373,0.14804269487600114,2022-12-02 00:26:13.083783,2022-12-02 00:26:23.042662,0 days 00:00:09.958879,balanced,32.0,log2,760,COMPLETE
1374,1374,0.24751984126984125,2022-12-02 00:26:23.276405,2022-12-02 00:26:33.381652,0 days 00:00:10.105247,balanced,2.0,log2,710,COMPLETE
1375,1375,0.13245902375446178,2022-12-02 00:26:33.617265,2022-12-02 00:26:43.577093,0 days 00:00:09.959828,balanced,39.0,log2,810,COMPLETE
1376,1376,0.2770304232804232,2022-12-02 00:26:43.823423,2022-12-02 00:26:54.130643,0 days 00:00:10.307220,balanced,10.0,log2,760,COMPLETE
1377,1377,0.2609823727470786,2022-12-02 00:26:54.367053,2022-12-02 00:27:04.642251,0 days 00:00:10.275198,balanced,19.0,log2,810,COMPLETE
1378,1378,0.286872594997595,2022-12-02 00:27:04.879281,2022-12-02 00:27:15.016207,0 days 00:00:10.136926,balanced,10.0,log2,760,COMPLETE
1379,1379,0.2926902958152958,2022-12-02 00:27:15.249818,2022-12-02 00:27:25.165000,0 days 00:00:09.915182,balanced,12.0,log2,710,COMPLETE
1380,1380,0.29074389730639727,2022-12-02 00:27:25.400911,2022-12-02 00:27:35.535129,0 days 00:00:10.134218,balanced,13.0,log2,810,COMPLETE
1381,1381,0.13577159211402487,2022-12-02 00:27:35.765206,2022-12-02 00:27:45.479925,0 days 00:00:09.714719,balanced,,log2,710,COMPLETE
1382,1382,0.29328042328042325,2022-12-02 00:27:45.713397,2022-12-02 00:27:55.900653,0 days 00:00:10.187256,balanced,8.0,log2,760,COMPLETE
1383,1383,0.2276804300030845,2022-12-02 00:27:56.142258,2022-12-02 00:28:06.152600,0 days 00:00:10.010342,balanced,22.0,log2,760,COMPLETE
1384,1384,0.29727182539682534,2022-12-02 00:28:06.379013,2022-12-02 00:28:16.298413,0 days 00:00:09.919400,balanced,10.0,log2,710,COMPLETE
1385,1385,0.27321901782428093,2022-12-02 00:28:16.526370,2022-12-02 00:28:26.525337,0 days 00:00:09.998967,balanced,16.0,log2,760,COMPLETE
1386,1386,0.3003637566137566,2022-12-02 00:28:26.759245,2022-12-02 00:28:36.777684,0 days 00:00:10.018439,balanced,10.0,log2,710,COMPLETE
1387,1387,0.2710822510822511,2022-12-02 00:28:37.005141,2022-12-02 00:28:47.531811,0 days 00:00:10.526670,balanced,1.0,log2,760,COMPLETE
1388,1388,0.28617394179894184,2022-12-02 00:28:47.774262,2022-12-02 00:28:57.808361,0 days 00:00:10.034099,balanced,10.0,log2,710,COMPLETE
1389,1389,0.28681878306878306,2022-12-02 00:28:58.040171,2022-12-02 00:29:08.557619,0 days 00:00:10.517448,balanced,10.0,log2,810,COMPLETE
1390,1390,0.27121031746031743,2022-12-02 00:29:08.793230,2022-12-02 00:29:19.255519,0 days 00:00:10.462289,balanced,3.0,log2,760,COMPLETE
1391,1391,0.18726009898344426,2022-12-02 00:29:19.489368,2022-12-02 00:29:29.204530,0 days 00:00:09.715162,balanced,25.0,log2,710,COMPLETE
1392,1392,0.15322727706039718,2022-12-02 00:29:29.442351,2022-12-02 00:29:39.259142,0 days 00:00:09.816791,balanced,33.0,log2,760,COMPLETE
1393,1393,0.27462632275132276,2022-12-02 00:29:39.484042,2022-12-02 00:29:49.465664,0 days 00:00:09.981622,balanced,10.0,log2,710,COMPLETE
1394,1394,0.2863095238095238,2022-12-02 00:29:49.696352,2022-12-02 00:30:00.240080,0 days 00:00:10.543728,balanced,10.0,log2,810,COMPLETE
1395,1395,0.2813359788359788,2022-12-02 00:30:00.476507,2022-12-02 00:30:10.457631,0 days 00:00:09.981124,balanced,10.0,log2,710,COMPLETE
1396,1396,0.1716468184761663,2022-12-02 00:30:10.691121,2022-12-02 00:30:20.562868,0 days 00:00:09.871747,balanced,26.0,log2,760,COMPLETE
1397,1397,0.14918871862288124,2022-12-02 00:30:20.792404,2022-12-02 00:30:30.523003,0 days 00:00:09.730599,balanced,37.0,log2,710,COMPLETE
1398,1398,0.17153793499725303,2022-12-02 00:30:30.754676,2022-12-02 00:30:40.677182,0 days 00:00:09.922506,balanced,27.0,log2,760,COMPLETE
1399,1399,0.27521164021164024,2022-12-02 00:30:40.903229,2022-12-02 00:30:51.372935,0 days 00:00:10.469706,balanced,10.0,log2,810,COMPLETE
1400,1400,0.2635007585007585,2022-12-02 00:30:51.610414,2022-12-02 00:31:01.371482,0 days 00:00:09.761068,balanced,18.0,log2,710,COMPLETE
1401,1401,0.15352334387466424,2022-12-02 00:31:01.612538,2022-12-02 00:31:11.574644,0 days 00:00:09.962106,balanced,31.0,log2,760,COMPLETE
1402,1402,0.28632605820105816,2022-12-02 00:31:11.812398,2022-12-02 00:31:21.941956,0 days 00:00:10.129558,balanced,10.0,log2,760,COMPLETE
1403,1403,0.2937518037518037,2022-12-02 00:31:22.183035,2022-12-02 00:31:32.181393,0 days 00:00:09.998358,balanced,11.0,log2,710,COMPLETE
1404,1404,0.2988591269841269,2022-12-02 00:31:32.418383,2022-12-02 00:31:42.366719,0 days 00:00:09.948336,balanced,10.0,log2,710,COMPLETE
1405,1405,0.14422178869426233,2022-12-02 00:31:42.598262,2022-12-02 00:31:52.731606,0 days 00:00:10.133344,balanced,35.0,log2,760,COMPLETE
1406,1406,0.2707010582010582,2022-12-02 00:31:52.974437,2022-12-02 00:32:03.378597,0 days 00:00:10.404160,balanced,5.0,log2,760,COMPLETE
1407,1407,0.2815806878306878,2022-12-02 00:32:03.611448,2022-12-02 00:32:13.581868,0 days 00:00:09.970420,balanced,10.0,log2,710,COMPLETE
1408,1408,0.28019510582010576,2022-12-02 00:32:13.814839,2022-12-02 00:32:24.367163,0 days 00:00:10.552324,balanced,10.0,log2,810,COMPLETE
1409,1409,0.2628348258495318,2022-12-02 00:32:24.592171,2022-12-02 00:32:34.456235,0 days 00:00:09.864064,balanced,17.0,log2,710,COMPLETE
1410,1410,0.2735648148148148,2022-12-02 00:32:34.686636,2022-12-02 00:32:45.032711,0 days 00:00:10.346075,balanced,4.0,log2,760,COMPLETE
1411,1411,0.27803902116402107,2022-12-02 00:32:45.263203,2022-12-02 00:32:54.869577,0 days 00:00:09.606374,balanced,10.0,log2,660,COMPLETE
1412,1412,0.281746632996633,2022-12-02 00:32:55.109448,2022-12-02 00:33:05.248612,0 days 00:00:10.139164,balanced,14.0,log2,760,COMPLETE
1413,1413,0.23728283166582398,2022-12-02 00:33:05.478356,2022-12-02 00:33:15.835462,0 days 00:00:10.357106,balanced,21.0,log2,810,COMPLETE
1414,1414,0.2722025659525659,2022-12-02 00:33:16.060662,2022-12-02 00:33:25.906936,0 days 00:00:09.846274,balanced,15.0,log2,710,COMPLETE
1415,1415,0.26752916065416066,2022-12-02 00:33:26.149234,2022-12-02 00:33:35.491663,0 days 00:00:09.342429,balanced,16.0,log2,610,COMPLETE
1416,1416,0.290186087061087,2022-12-02 00:33:35.724627,2022-12-02 00:33:45.753524,0 days 00:00:10.028897,balanced,10.0,log2,710,COMPLETE
1417,1417,0.2707705026455026,2022-12-02 00:33:45.996720,2022-12-02 00:33:55.707846,0 days 00:00:09.711126,balanced,6.0,log2,660,COMPLETE
1418,1418,0.26142602495543665,2022-12-02 00:33:55.945668,2022-12-02 00:34:06.033344,0 days 00:00:10.087676,balanced,19.0,log2,760,COMPLETE
1419,1419,0.28071428571428575,2022-12-02 00:34:06.266106,2022-12-02 00:34:16.515458,0 days 00:00:10.249352,balanced,10.0,log2,760,COMPLETE
1420,1420,0.1426303781367267,2022-12-02 00:34:16.750913,2022-12-02 00:34:26.393351,0 days 00:00:09.642438,balanced,39.0,log2,710,COMPLETE
1421,1421,0.29542388167388167,2022-12-02 00:34:26.625510,2022-12-02 00:34:37.041369,0 days 00:00:10.415859,balanced,10.0,log2,810,COMPLETE
1422,1422,0.2927561096311096,2022-12-02 00:34:37.281341,2022-12-02 00:34:46.816872,0 days 00:00:09.535531,balanced,13.0,log2,660,COMPLETE
1423,1423,0.15277683123271857,2022-12-02 00:34:47.050863,2022-12-02 00:34:56.944709,0 days 00:00:09.893846,balanced,32.0,log2,760,COMPLETE
1424,1424,0.26202380952380955,2022-12-02 00:34:57.179176,2022-12-02 00:35:07.339272,0 days 00:00:10.160096,balanced,3.0,log2,710,COMPLETE
1425,1425,0.2970667989417989,2022-12-02 00:35:07.574045,2022-12-02 00:35:17.514848,0 days 00:00:09.940803,balanced,10.0,log2,760,COMPLETE
1426,1426,0.28050925925925924,2022-12-02 00:35:17.743366,2022-12-02 00:35:27.696236,0 days 00:00:09.952870,balanced,10.0,log2,710,COMPLETE
