,number,value,datetime_start,datetime_complete,duration,params_class_weight,params_max_depth,params_max_features,params_n_estimators,state
2375,2375,0.23517844300611288,2022-12-02 03:22:07.389445,2022-12-02 03:22:19.677690,0 days 00:00:12.288245,balanced,4.0,1.0,760,COMPLETE
2376,2376,0.29692550505050497,2022-12-02 03:22:19.930327,2022-12-02 03:22:29.786955,0 days 00:00:09.856628,balanced,11.0,log2,660,COMPLETE
2377,2377,0.2715674603174603,2022-12-02 03:22:30.042118,2022-12-02 03:22:40.761835,0 days 00:00:10.719717,balanced,5.0,log2,810,COMPLETE
2378,2378,0.28349867724867717,2022-12-02 03:22:41.014552,2022-12-02 03:22:51.095494,0 days 00:00:10.080942,balanced,10.0,log2,710,COMPLETE
2379,2379,0.14284782519219452,2022-12-02 03:22:51.349301,2022-12-02 03:23:01.322852,0 days 00:00:09.973551,balanced,38.0,log2,760,COMPLETE
2380,2380,0.2534111014258073,2022-12-02 03:23:01.585448,2022-12-02 03:23:11.776552,0 days 00:00:10.191104,balanced,17.0,log2,760,COMPLETE
2381,2381,0.28525222462722455,2022-12-02 03:23:12.024505,2022-12-02 03:23:22.906906,0 days 00:00:10.882401,balanced,10.0,log2,860,COMPLETE
2382,2382,0.27027777777777773,2022-12-02 03:23:23.170221,2022-12-02 03:23:33.278506,0 days 00:00:10.108285,balanced,6.0,log2,710,COMPLETE
2383,2383,0.18867626069033777,2022-12-02 03:23:33.529413,2022-12-02 03:23:43.611555,0 days 00:00:10.082142,balanced,24.0,log2,810,COMPLETE
2384,2384,0.24520060821531411,2022-12-02 03:23:43.867150,2022-12-02 03:23:53.908727,0 days 00:00:10.041577,balanced,21.0,log2,760,COMPLETE
2385,2385,0.1866374184517388,2022-12-02 03:23:54.153538,2022-12-02 03:24:06.169951,0 days 00:00:12.016413,balanced,14.0,0.9,760,COMPLETE
2386,2386,0.1683946550572764,2022-12-02 03:24:06.427326,2022-12-02 03:24:18.457817,0 days 00:00:12.030491,balanced,10.0,0.8,810,COMPLETE
2387,2387,0.20919138070105564,2022-12-02 03:24:18.709157,2022-12-02 03:24:27.988885,0 days 00:00:09.279728,balanced,15.0,sqrt,710,COMPLETE
2388,2388,0.2759093915343915,2022-12-02 03:24:28.233178,2022-12-02 03:24:38.398857,0 days 00:00:10.165679,balanced,9.0,log2,760,COMPLETE
2389,2389,0.17654216109313198,2022-12-02 03:24:38.645613,2022-12-02 03:24:51.921734,0 days 00:00:13.276121,balanced,19.0,,860,COMPLETE
2390,2390,0.17077158548032334,2022-12-02 03:24:52.168154,2022-12-02 03:25:03.328761,0 days 00:00:11.160607,balanced,12.0,0.7,760,COMPLETE
2391,2391,0.15017382948943964,2022-12-02 03:25:03.584754,2022-12-02 03:25:13.771908,0 days 00:00:10.187154,balanced,39.0,log2,810,COMPLETE
2392,2392,0.27321428571428574,2022-12-02 03:25:14.025707,2022-12-02 03:25:24.104845,0 days 00:00:10.079138,balanced,8.0,log2,710,COMPLETE
2393,2393,0.284781746031746,2022-12-02 03:25:24.357100,2022-12-02 03:25:34.645468,0 days 00:00:10.288368,balanced,10.0,log2,760,COMPLETE
2394,2394,0.1425493508500993,2022-12-02 03:25:34.885675,2022-12-02 03:25:44.746849,0 days 00:00:09.861174,balanced,32.0,log2,710,COMPLETE
2395,2395,0.2768882275132275,2022-12-02 03:25:45.005226,2022-12-02 03:25:55.490748,0 days 00:00:10.485522,balanced,10.0,log2,810,COMPLETE
2396,2396,0.283883177008177,2022-12-02 03:25:55.737495,2022-12-02 03:26:06.730411,0 days 00:00:10.992916,balanced,10.0,log2,910,COMPLETE
2397,2397,0.30202380952380947,2022-12-02 03:26:06.974985,2022-12-02 03:26:17.283795,0 days 00:00:10.308810,balanced,10.0,log2,760,COMPLETE
2398,2398,0.15613626738957992,2022-12-02 03:26:17.534959,2022-12-02 03:26:27.360726,0 days 00:00:09.825767,balanced,28.0,log2,710,COMPLETE
2399,2399,0.17142033487907274,2022-12-02 03:26:27.597490,2022-12-02 03:26:37.742465,0 days 00:00:10.144975,balanced,22.0,0.6,660,COMPLETE
2400,2400,0.14277381217438184,2022-12-02 03:26:38.012448,2022-12-02 03:26:47.068891,0 days 00:00:09.056443,balanced,29.0,log2,560,COMPLETE
2401,2401,0.29197014790764786,2022-12-02 03:26:47.323224,2022-12-02 03:26:57.598502,0 days 00:00:10.275278,balanced,13.0,log2,760,COMPLETE
2402,2402,0.27705593018093017,2022-12-02 03:26:57.851124,2022-12-02 03:27:08.081969,0 days 00:00:10.230845,balanced,20.0,log2,810,COMPLETE
2403,2403,0.3266402116402116,2022-12-02 03:27:08.336101,2022-12-02 03:27:18.191564,0 days 00:00:09.855463,balanced,3.0,sqrt,760,COMPLETE
2404,2404,0.30914682539682536,2022-12-02 03:27:18.449041,2022-12-02 03:27:28.351021,0 days 00:00:09.901980,balanced,3.0,sqrt,760,COMPLETE
2405,2405,0.24572137229904217,2022-12-02 03:27:28.605967,2022-12-02 03:27:40.405856,0 days 00:00:11.799889,balanced,3.0,0.9,760,COMPLETE
2406,2406,0.297010582010582,2022-12-02 03:27:40.657969,2022-12-02 03:27:50.610087,0 days 00:00:09.952118,balanced,3.0,sqrt,760,COMPLETE
2407,2407,0.3006084656084656,2022-12-02 03:27:50.860028,2022-12-02 03:28:00.684915,0 days 00:00:09.824887,balanced,3.0,sqrt,760,COMPLETE
2408,2408,0.2995568783068782,2022-12-02 03:28:00.946488,2022-12-02 03:28:11.100528,0 days 00:00:10.154040,balanced,3.0,sqrt,760,COMPLETE
2409,2409,0.21849340474340476,2022-12-02 03:28:11.343655,2022-12-02 03:28:20.834714,0 days 00:00:09.491059,balanced,12.0,sqrt,760,COMPLETE
2410,2410,0.3041501322751322,2022-12-02 03:28:21.089957,2022-12-02 03:28:30.977873,0 days 00:00:09.887916,balanced,3.0,sqrt,710,COMPLETE
2411,2411,0.29005621693121697,2022-12-02 03:28:31.232383,2022-12-02 03:28:41.252448,0 days 00:00:10.020065,balanced,3.0,sqrt,760,COMPLETE
2412,2412,0.27947089947089954,2022-12-02 03:28:41.501623,2022-12-02 03:28:51.679906,0 days 00:00:10.178283,balanced,1.0,sqrt,710,COMPLETE
2413,2413,0.2883994708994708,2022-12-02 03:28:51.940900,2022-12-02 03:29:02.081982,0 days 00:00:10.141082,balanced,3.0,sqrt,760,COMPLETE
2414,2414,0.30313822751322744,2022-12-02 03:29:02.327243,2022-12-02 03:29:12.516320,0 days 00:00:10.189077,balanced,3.0,sqrt,760,COMPLETE
2415,2415,0.27360119047619047,2022-12-02 03:29:12.769210,2022-12-02 03:29:22.908632,0 days 00:00:10.139422,balanced,2.0,sqrt,710,COMPLETE
2416,2416,0.2762400793650793,2022-12-02 03:29:23.160191,2022-12-02 03:29:33.032455,0 days 00:00:09.872264,balanced,3.0,sqrt,760,COMPLETE
2417,2417,0.28941798941798935,2022-12-02 03:29:33.279876,2022-12-02 03:29:43.283431,0 days 00:00:10.003555,balanced,3.0,sqrt,760,COMPLETE
2418,2418,0.28576719576719567,2022-12-02 03:29:43.532082,2022-12-02 03:29:53.317567,0 days 00:00:09.785485,balanced,3.0,sqrt,710,COMPLETE
2419,2419,0.27905092592592595,2022-12-02 03:29:53.581960,2022-12-02 03:30:03.684133,0 days 00:00:10.102173,balanced,3.0,sqrt,760,COMPLETE
2420,2420,0.31207341269841266,2022-12-02 03:30:03.937727,2022-12-02 03:30:13.628553,0 days 00:00:09.690826,balanced,3.0,sqrt,710,COMPLETE
2421,2421,0.30793650793650784,2022-12-02 03:30:13.874901,2022-12-02 03:30:23.315149,0 days 00:00:09.440248,balanced,3.0,sqrt,660,COMPLETE
2422,2422,0.284619708994709,2022-12-02 03:30:23.565584,2022-12-02 03:30:33.337561,0 days 00:00:09.771977,balanced,3.0,sqrt,660,COMPLETE
2423,2423,0.30891534391534387,2022-12-02 03:30:33.592677,2022-12-02 03:30:42.912658,0 days 00:00:09.319981,balanced,3.0,sqrt,610,COMPLETE
2424,2424,0.28171626984126974,2022-12-02 03:30:43.161400,2022-12-02 03:30:52.610867,0 days 00:00:09.449467,balanced,3.0,sqrt,610,COMPLETE
2425,2425,0.30163690476190474,2022-12-02 03:30:52.874371,2022-12-02 03:31:02.218474,0 days 00:00:09.344103,balanced,3.0,sqrt,610,COMPLETE
2426,2426,0.2830919312169312,2022-12-02 03:31:02.469385,2022-12-02 03:31:11.741516,0 days 00:00:09.272131,balanced,3.0,sqrt,610,COMPLETE
2427,2427,0.2897982804232804,2022-12-02 03:31:11.988984,2022-12-02 03:31:21.299994,0 days 00:00:09.311010,balanced,3.0,sqrt,610,COMPLETE
2428,2428,0.30098214285714275,2022-12-02 03:31:21.559977,2022-12-02 03:31:31.066734,0 days 00:00:09.506757,balanced,3.0,sqrt,610,COMPLETE
2429,2429,0.2933498677248677,2022-12-02 03:31:31.317779,2022-12-02 03:31:40.530555,0 days 00:00:09.212776,balanced,3.0,sqrt,610,COMPLETE
2430,2430,0.30806547619047614,2022-12-02 03:31:40.775776,2022-12-02 03:31:49.903196,0 days 00:00:09.127420,balanced,3.0,sqrt,610,COMPLETE
2431,2431,0.3164054232804233,2022-12-02 03:31:50.161984,2022-12-02 03:31:59.145706,0 days 00:00:08.983722,balanced,3.0,sqrt,560,COMPLETE
2432,2432,0.27721891534391535,2022-12-02 03:31:59.397393,2022-12-02 03:32:08.677100,0 days 00:00:09.279707,balanced,3.0,sqrt,560,COMPLETE
2433,2433,0.2883068783068783,2022-12-02 03:32:08.925830,2022-12-02 03:32:18.070177,0 days 00:00:09.144347,balanced,3.0,sqrt,610,COMPLETE
2434,2434,0.29894510582010575,2022-12-02 03:32:18.324138,2022-12-02 03:32:27.654146,0 days 00:00:09.330008,balanced,3.0,sqrt,610,COMPLETE
2435,2435,0.2923379629629629,2022-12-02 03:32:27.921222,2022-12-02 03:32:36.949701,0 days 00:00:09.028479,balanced,3.0,sqrt,560,COMPLETE
2436,2436,0.2895469576719576,2022-12-02 03:32:37.215056,2022-12-02 03:32:46.878533,0 days 00:00:09.663477,balanced,3.0,sqrt,710,COMPLETE
2437,2437,0.28992063492063486,2022-12-02 03:32:47.134257,2022-12-02 03:32:56.308128,0 days 00:00:09.173871,balanced,3.0,sqrt,560,COMPLETE
2438,2438,0.30117063492063484,2022-12-02 03:32:56.563010,2022-12-02 03:33:05.743859,0 days 00:00:09.180849,balanced,3.0,sqrt,560,COMPLETE
2439,2439,0.2875661375661376,2022-12-02 03:33:05.995830,2022-12-02 03:33:15.375764,0 days 00:00:09.379934,balanced,3.0,sqrt,610,COMPLETE
2440,2440,0.1350543569931341,2022-12-02 03:33:15.632873,2022-12-02 03:33:24.508260,0 days 00:00:08.875387,balanced,23.0,sqrt,560,COMPLETE
2441,2441,0.30299603174603174,2022-12-02 03:33:24.771361,2022-12-02 03:33:34.061885,0 days 00:00:09.290524,balanced,3.0,sqrt,610,COMPLETE
2442,2442,0.2970436507936507,2022-12-02 03:33:34.318173,2022-12-02 03:33:43.444756,0 days 00:00:09.126583,balanced,3.0,sqrt,560,COMPLETE
2443,2443,0.2980390211640211,2022-12-02 03:33:43.707860,2022-12-02 03:33:53.074390,0 days 00:00:09.366530,balanced,3.0,sqrt,610,COMPLETE
2444,2444,0.30033730158730154,2022-12-02 03:33:53.350543,2022-12-02 03:34:02.832275,0 days 00:00:09.481732,balanced,3.0,sqrt,610,COMPLETE
2445,2445,0.29324735449735445,2022-12-02 03:34:03.076338,2022-12-02 03:34:12.435965,0 days 00:00:09.359627,balanced,3.0,sqrt,610,COMPLETE
2446,2446,0.2993353174603174,2022-12-02 03:34:12.697747,2022-12-02 03:34:22.150917,0 days 00:00:09.453170,balanced,3.0,sqrt,610,COMPLETE
2447,2447,0.29094907407407405,2022-12-02 03:34:22.406544,2022-12-02 03:34:31.847737,0 days 00:00:09.441193,balanced,3.0,sqrt,610,COMPLETE
2448,2448,0.2887037037037037,2022-12-02 03:34:32.104676,2022-12-02 03:34:41.281047,0 days 00:00:09.176371,balanced,3.0,sqrt,560,COMPLETE
2449,2449,0.28904431216931215,2022-12-02 03:34:41.546738,2022-12-02 03:34:50.994386,0 days 00:00:09.447648,balanced,3.0,sqrt,610,COMPLETE
2450,2450,0.30792989417989414,2022-12-02 03:34:51.265135,2022-12-02 03:35:00.434941,0 days 00:00:09.169806,balanced,3.0,sqrt,560,COMPLETE
2451,2451,0.2856150793650793,2022-12-02 03:35:00.681389,2022-12-02 03:35:09.726283,0 days 00:00:09.044894,balanced,3.0,sqrt,560,COMPLETE
2452,2452,0.2906622775372775,2022-12-02 03:35:09.981317,2022-12-02 03:35:19.124891,0 days 00:00:09.143574,balanced,3.0,sqrt,560,COMPLETE
2453,2453,0.29564153439153434,2022-12-02 03:35:19.382724,2022-12-02 03:35:28.568288,0 days 00:00:09.185564,balanced,3.0,sqrt,610,COMPLETE
2454,2454,0.14832804210408965,2022-12-02 03:35:28.822392,2022-12-02 03:35:37.887394,0 days 00:00:09.065002,balanced,,sqrt,610,COMPLETE
2455,2455,0.29131283068783065,2022-12-02 03:35:38.146432,2022-12-02 03:35:47.157451,0 days 00:00:09.011019,balanced,3.0,sqrt,560,COMPLETE
2456,2456,0.3026289682539681,2022-12-02 03:35:47.413094,2022-12-02 03:35:56.462524,0 days 00:00:09.049430,balanced,3.0,sqrt,560,COMPLETE
2457,2457,0.29013648388648383,2022-12-02 03:35:56.726403,2022-12-02 03:36:06.055720,0 days 00:00:09.329317,balanced,3.0,sqrt,610,COMPLETE
2458,2458,0.3026289682539682,2022-12-02 03:36:06.299586,2022-12-02 03:36:15.364952,0 days 00:00:09.065366,balanced,3.0,sqrt,560,COMPLETE
2459,2459,0.29850529100529094,2022-12-02 03:36:15.609574,2022-12-02 03:36:24.860061,0 days 00:00:09.250487,balanced,3.0,sqrt,560,COMPLETE
2460,2460,0.30184193121693115,2022-12-02 03:36:25.114216,2022-12-02 03:36:34.152490,0 days 00:00:09.038274,balanced,3.0,sqrt,560,COMPLETE
2461,2461,0.30758928571428573,2022-12-02 03:36:34.392479,2022-12-02 03:36:43.373123,0 days 00:00:08.980644,balanced,3.0,sqrt,560,COMPLETE
2462,2462,0.29945436507936496,2022-12-02 03:36:43.626584,2022-12-02 03:36:52.761826,0 days 00:00:09.135242,balanced,3.0,sqrt,560,COMPLETE
2463,2463,0.3061474867724867,2022-12-02 03:36:53.003886,2022-12-02 03:37:01.783853,0 days 00:00:08.779967,balanced,3.0,sqrt,510,COMPLETE
2464,2464,0.3061375661375661,2022-12-02 03:37:02.036777,2022-12-02 03:37:10.897587,0 days 00:00:08.860810,balanced,3.0,sqrt,510,COMPLETE
2465,2465,0.29904100529100525,2022-12-02 03:37:11.151776,2022-12-02 03:37:19.891924,0 days 00:00:08.740148,balanced,3.0,sqrt,510,COMPLETE
2466,2466,0.3066402116402116,2022-12-02 03:37:20.149315,2022-12-02 03:37:29.114987,0 days 00:00:08.965672,balanced,3.0,sqrt,510,COMPLETE
2467,2467,0.3021296296296296,2022-12-02 03:37:29.360131,2022-12-02 03:37:38.227876,0 days 00:00:08.867745,balanced,3.0,sqrt,510,COMPLETE
2468,2468,0.316683201058201,2022-12-02 03:37:38.495466,2022-12-02 03:37:47.263588,0 days 00:00:08.768122,balanced,3.0,sqrt,510,COMPLETE
2469,2469,0.28627645502645505,2022-12-02 03:37:47.522006,2022-12-02 03:37:56.292032,0 days 00:00:08.770026,balanced,3.0,sqrt,510,COMPLETE
2470,2470,0.30412698412698413,2022-12-02 03:37:56.537263,2022-12-02 03:38:05.260363,0 days 00:00:08.723100,balanced,3.0,sqrt,510,COMPLETE
2471,2471,0.29045634920634916,2022-12-02 03:38:05.493859,2022-12-02 03:38:14.524534,0 days 00:00:09.030675,balanced,3.0,sqrt,510,COMPLETE
2472,2472,0.2999140211640211,2022-12-02 03:38:14.762770,2022-12-02 03:38:23.577837,0 days 00:00:08.815067,balanced,3.0,sqrt,510,COMPLETE
2473,2473,0.2892923280423281,2022-12-02 03:38:23.823284,2022-12-02 03:38:32.599743,0 days 00:00:08.776459,balanced,3.0,sqrt,510,COMPLETE
2474,2474,0.3083035714285714,2022-12-02 03:38:32.851694,2022-12-02 03:38:41.846694,0 days 00:00:08.995000,balanced,3.0,sqrt,560,COMPLETE
2475,2475,0.30391203703703706,2022-12-02 03:38:42.103446,2022-12-02 03:38:51.370200,0 days 00:00:09.266754,balanced,3.0,sqrt,560,COMPLETE
2476,2476,0.29397246272246264,2022-12-02 03:38:51.618001,2022-12-02 03:39:00.146943,0 days 00:00:08.528942,balanced,3.0,sqrt,460,COMPLETE
2477,2477,0.2928406084656084,2022-12-02 03:39:00.398023,2022-12-02 03:39:09.473489,0 days 00:00:09.075466,balanced,3.0,sqrt,560,COMPLETE
2478,2478,0.29915013227513226,2022-12-02 03:39:09.728990,2022-12-02 03:39:18.724790,0 days 00:00:08.995800,balanced,3.0,sqrt,560,COMPLETE
2479,2479,0.30326719576719574,2022-12-02 03:39:18.992620,2022-12-02 03:39:27.696239,0 days 00:00:08.703619,balanced,3.0,sqrt,510,COMPLETE
2480,2480,0.3095932539682539,2022-12-02 03:39:27.949845,2022-12-02 03:39:37.125632,0 days 00:00:09.175787,balanced,3.0,sqrt,560,COMPLETE
2481,2481,0.3048412698412698,2022-12-02 03:39:37.389364,2022-12-02 03:39:46.375099,0 days 00:00:08.985735,balanced,3.0,sqrt,560,COMPLETE
2482,2482,0.28395833333333326,2022-12-02 03:39:46.622208,2022-12-02 03:39:55.631217,0 days 00:00:09.009009,balanced,3.0,sqrt,560,COMPLETE
2483,2483,0.3005522486772486,2022-12-02 03:39:55.884822,2022-12-02 03:40:04.780703,0 days 00:00:08.895881,balanced,3.0,sqrt,510,COMPLETE
2484,2484,0.3024702380952381,2022-12-02 03:40:05.025228,2022-12-02 03:40:13.920252,0 days 00:00:08.895024,balanced,3.0,sqrt,510,COMPLETE
2485,2485,0.2925628306878306,2022-12-02 03:40:14.180834,2022-12-02 03:40:23.243760,0 days 00:00:09.062926,balanced,3.0,sqrt,560,COMPLETE
2486,2486,0.28524140211640214,2022-12-02 03:40:23.502306,2022-12-02 03:40:32.568464,0 days 00:00:09.066158,balanced,3.0,sqrt,560,COMPLETE
2487,2487,0.2858002645502645,2022-12-02 03:40:32.823295,2022-12-02 03:40:42.006942,0 days 00:00:09.183647,balanced,3.0,sqrt,560,COMPLETE
2488,2488,0.31703373015873015,2022-12-02 03:40:42.262254,2022-12-02 03:40:51.182515,0 days 00:00:08.920261,balanced,3.0,sqrt,510,COMPLETE
2489,2489,0.2935085978835978,2022-12-02 03:40:51.427611,2022-12-02 03:41:00.460157,0 days 00:00:09.032546,balanced,3.0,sqrt,560,COMPLETE
2490,2490,0.30196097883597883,2022-12-02 03:41:00.712265,2022-12-02 03:41:09.909363,0 days 00:00:09.197098,balanced,3.0,sqrt,560,COMPLETE
2491,2491,0.3047949735449735,2022-12-02 03:41:10.175505,2022-12-02 03:41:19.314972,0 days 00:00:09.139467,balanced,3.0,sqrt,560,COMPLETE
2492,2492,0.3039814814814814,2022-12-02 03:41:19.562159,2022-12-02 03:41:28.737232,0 days 00:00:09.175073,balanced,3.0,sqrt,560,COMPLETE
2493,2493,0.3009722222222221,2022-12-02 03:41:29.001254,2022-12-02 03:41:38.016179,0 days 00:00:09.014925,balanced,3.0,sqrt,510,COMPLETE
2494,2494,0.316547619047619,2022-12-02 03:41:38.272168,2022-12-02 03:41:47.088722,0 days 00:00:08.816554,balanced,3.0,sqrt,510,COMPLETE
2495,2495,0.31793320105820094,2022-12-02 03:41:47.353389,2022-12-02 03:41:56.220818,0 days 00:00:08.867429,balanced,3.0,sqrt,510,COMPLETE
2496,2496,0.2862929894179894,2022-12-02 03:41:56.465848,2022-12-02 03:42:05.377337,0 days 00:00:08.911489,balanced,3.0,sqrt,510,COMPLETE
2497,2497,0.2877810846560846,2022-12-02 03:42:05.625398,2022-12-02 03:42:14.626976,0 days 00:00:09.001578,balanced,3.0,sqrt,510,COMPLETE
2498,2498,0.2540376984126984,2022-12-02 03:42:14.888316,2022-12-02 03:42:23.700778,0 days 00:00:08.812462,"{0: 1, 1: 10}",3.0,sqrt,510,COMPLETE
2499,2499,0.30959986772486764,2022-12-02 03:42:23.956703,2022-12-02 03:42:32.842507,0 days 00:00:08.885804,balanced,3.0,sqrt,510,COMPLETE
