,number,value,datetime_start,datetime_complete,duration,params_class_weight,params_max_depth,params_max_features,params_n_estimators,state
953,953,0.16932058098320232,2022-12-01 23:14:54.087274,2022-12-01 23:15:07.320291,0 days 00:00:13.233017,balanced,29.0,,860,COMPLETE
954,954,0.035016181229773465,2022-12-01 23:15:07.543480,2022-12-01 23:15:20.827883,0 days 00:00:13.284403,,27.0,,610,COMPLETE
955,955,0.1849574279550008,2022-12-01 23:15:21.062082,2022-12-01 23:15:28.276006,0 days 00:00:07.213924,"{0: 1, 1: 100}",39.0,0.7,60,COMPLETE
956,956,0.26158730158730165,2022-12-01 23:15:28.496196,2022-12-01 23:15:38.464936,0 days 00:00:09.968740,balanced,2.0,log2,660,COMPLETE
957,957,0.1381930814515167,2022-12-01 23:15:38.686407,2022-12-01 23:15:47.577505,0 days 00:00:08.891098,balanced,36.0,sqrt,610,COMPLETE
958,958,0.16570200402011612,2022-12-01 23:15:47.802545,2022-12-01 23:15:55.997558,0 days 00:00:08.195013,balanced,19.0,sqrt,460,COMPLETE
959,959,0.11314326809472441,2022-12-01 23:15:56.209457,2022-12-01 23:16:10.293384,0 days 00:00:14.083927,"{0: 1, 1: 10}",19.0,,710,COMPLETE
960,960,0.0402588996763754,2022-12-01 23:16:10.528124,2022-12-01 23:16:18.746436,0 days 00:00:08.218312,,33.0,0.9,210,COMPLETE
961,961,0.07595469255663431,2022-12-01 23:16:18.981241,2022-12-01 23:16:27.200180,0 days 00:00:08.218939,"{0: 1, 1: 10}",22.0,0.7,260,COMPLETE
962,962,0.08510248404059081,2022-12-01 23:16:27.417053,2022-12-01 23:16:40.962189,0 days 00:00:13.545136,"{0: 1, 1: 10}",33.0,0.6,960,COMPLETE
963,963,0.01932038834951456,2022-12-01 23:16:41.195068,2022-12-01 23:16:56.297944,0 days 00:00:15.102876,,9.0,0.8,910,COMPLETE
964,964,0.187760408640263,2022-12-01 23:16:56.517393,2022-12-01 23:17:04.687714,0 days 00:00:08.170321,"{0: 1, 1: 100}",37.0,0.8,310,COMPLETE
965,965,0.15066759519538983,2022-12-01 23:17:04.904516,2022-12-01 23:17:15.042303,0 days 00:00:10.137787,"{0: 1, 1: 10}",2.0,0.8,460,COMPLETE
966,966,0.1673208944507488,2022-12-01 23:17:15.261638,2022-12-01 23:17:27.173476,0 days 00:00:11.911838,balanced,26.0,0.6,960,COMPLETE
967,967,0.17175640185955718,2022-12-01 23:17:27.394270,2022-12-01 23:17:34.655936,0 days 00:00:07.261666,"{0: 1, 1: 100}",26.0,0.8,160,COMPLETE
968,968,0.014563106796116504,2022-12-01 23:17:34.878174,2022-12-01 23:17:45.052031,0 days 00:00:10.173857,,27.0,1.0,360,COMPLETE
969,969,0.10536054244760278,2022-12-01 23:17:45.254433,2022-12-01 23:17:54.437886,0 days 00:00:09.183453,,32.0,sqrt,710,COMPLETE
970,970,0.26418169793169793,2022-12-01 23:17:54.670800,2022-12-01 23:18:03.890768,0 days 00:00:09.219968,"{0: 1, 1: 10}",5.0,sqrt,660,COMPLETE
971,971,0.18502234550778238,2022-12-01 23:18:04.101987,2022-12-01 23:18:17.954674,0 days 00:00:13.852687,"{0: 1, 1: 100}",8.0,1.0,960,COMPLETE
972,972,0.10966105390791284,2022-12-01 23:18:18.182267,2022-12-01 23:18:25.458586,0 days 00:00:07.276319,balanced,38.0,log2,110,COMPLETE
973,973,0.1839839857194226,2022-12-01 23:18:25.688932,2022-12-01 23:18:37.391816,0 days 00:00:11.702884,"{0: 1, 1: 100}",8.0,0.8,810,COMPLETE
974,974,0.17364597780859917,2022-12-01 23:18:37.614796,2022-12-01 23:18:47.783131,0 days 00:00:10.168335,balanced,23.0,1.0,510,COMPLETE
975,975,0.08786407766990292,2022-12-01 23:18:48.007748,2022-12-01 23:18:55.027829,0 days 00:00:07.020081,"{0: 1, 1: 100}",26.0,0.9,10,COMPLETE
976,976,0.17085429829968662,2022-12-01 23:18:55.254704,2022-12-01 23:19:03.621171,0 days 00:00:08.366467,balanced,24.0,0.7,360,COMPLETE
977,977,0.18564336441156826,2022-12-01 23:19:03.842202,2022-12-01 23:19:16.016746,0 days 00:00:12.174544,"{0: 1, 1: 100}",19.0,1.0,760,COMPLETE
978,978,0.1584005624903683,2022-12-01 23:19:16.237476,2022-12-01 23:19:23.492554,0 days 00:00:07.255078,balanced,37.0,,160,COMPLETE
979,979,0.014563106796116504,2022-12-01 23:19:23.718400,2022-12-01 23:19:30.794931,0 days 00:00:07.076531,,10.0,0.8,60,COMPLETE
980,980,0.17011615811373093,2022-12-01 23:19:31.018997,2022-12-01 23:19:38.147940,0 days 00:00:07.128943,"{0: 1, 1: 100}",11.0,,110,COMPLETE
981,981,0.0371544151641239,2022-12-01 23:19:38.365569,2022-12-01 23:19:50.922214,0 days 00:00:12.556645,,36.0,0.7,710,COMPLETE
982,982,0.14425861511674706,2022-12-01 23:19:51.155371,2022-12-01 23:20:01.547896,0 days 00:00:10.392525,balanced,33.0,log2,910,COMPLETE
983,983,0.19203960813299956,2022-12-01 23:20:01.775499,2022-12-01 23:20:12.895751,0 days 00:00:11.120252,"{0: 1, 1: 10}",21.0,log2,960,COMPLETE
984,984,0.02657766990291262,2022-12-01 23:20:13.117142,2022-12-01 23:20:26.374667,0 days 00:00:13.257525,,38.0,0.7,810,COMPLETE
985,985,0.09420560749119913,2022-12-01 23:20:26.594637,2022-12-01 23:20:35.936877,0 days 00:00:09.342240,,13.0,sqrt,760,COMPLETE
986,986,0.14150304602622782,2022-12-01 23:20:36.164418,2022-12-01 23:20:43.217455,0 days 00:00:07.053037,"{0: 1, 1: 10}",16.0,log2,10,COMPLETE
987,987,0.16826167360147942,2022-12-01 23:20:43.436229,2022-12-01 23:20:50.780189,0 days 00:00:07.343960,balanced,29.0,0.6,210,COMPLETE
988,988,0.02122052704576976,2022-12-01 23:20:51.007747,2022-12-01 23:21:00.787319,0 days 00:00:09.779572,,36.0,0.6,460,COMPLETE
989,989,0.014563106796116504,2022-12-01 23:21:01.014377,2022-12-01 23:21:08.501022,0 days 00:00:07.486645,,29.0,0.7,160,COMPLETE
990,990,0.17101171212821695,2022-12-01 23:21:08.750523,2022-12-01 23:21:18.535048,0 days 00:00:09.784525,"{0: 1, 1: 100}",34.0,0.9,510,COMPLETE
991,991,0.1607173678532902,2022-12-01 23:21:18.768798,2022-12-01 23:21:26.152124,0 days 00:00:07.383326,balanced,14.0,0.7,210,COMPLETE
992,992,0.03074433656957929,2022-12-01 23:21:26.374646,2022-12-01 23:21:33.402949,0 days 00:00:07.028303,,16.0,1.0,10,COMPLETE
993,993,0.2798950817700817,2022-12-01 23:21:33.643341,2022-12-01 23:21:43.722721,0 days 00:00:10.079380,balanced,12.0,log2,760,COMPLETE
994,994,0.17566715467200902,2022-12-01 23:21:43.953384,2022-12-01 23:21:55.749766,0 days 00:00:11.796382,balanced,35.0,1.0,710,COMPLETE
995,995,0.09664913700107874,2022-12-01 23:21:56.007755,2022-12-01 23:22:02.995905,0 days 00:00:06.988150,"{0: 1, 1: 100}",33.0,0.9,10,COMPLETE
996,996,0.09252426825242359,2022-12-01 23:22:03.208172,2022-12-01 23:22:10.430968,0 days 00:00:07.222796,"{0: 1, 1: 100}",35.0,sqrt,160,COMPLETE
997,997,0.09404534593239408,2022-12-01 23:22:10.654822,2022-12-01 23:22:19.862449,0 days 00:00:09.207627,"{0: 1, 1: 10}",22.0,sqrt,710,COMPLETE
998,998,0.1254445953904779,2022-12-01 23:22:20.100799,2022-12-01 23:22:27.833643,0 days 00:00:07.732844,"{0: 1, 1: 100}",38.0,log2,260,COMPLETE
999,999,0.03073509015256588,2022-12-01 23:22:28.060745,2022-12-01 23:22:37.673561,0 days 00:00:09.612816,,36.0,0.6,460,COMPLETE
1000,1000,0.2692757936507936,2022-12-01 23:22:37.900508,2022-12-01 23:22:48.210594,0 days 00:00:10.310086,balanced,3.0,log2,760,COMPLETE
1001,1001,0.27193452380952376,2022-12-01 23:22:48.441301,2022-12-01 23:22:57.526506,0 days 00:00:09.085205,balanced,3.0,log2,560,COMPLETE
1002,1002,0.26274470899470903,2022-12-01 23:22:57.754168,2022-12-01 23:23:06.910164,0 days 00:00:09.155996,balanced,3.0,log2,560,COMPLETE
1003,1003,0.2803835978835979,2022-12-01 23:23:07.136032,2022-12-01 23:23:17.442604,0 days 00:00:10.306572,balanced,7.0,log2,760,COMPLETE
1004,1004,0.28419642857142857,2022-12-01 23:23:17.674418,2022-12-01 23:23:26.963839,0 days 00:00:09.289421,balanced,7.0,log2,560,COMPLETE
1005,1005,0.28367724867724864,2022-12-01 23:23:27.196471,2022-12-01 23:23:37.478155,0 days 00:00:10.281684,balanced,7.0,log2,760,COMPLETE
1006,1006,0.27607804232804234,2022-12-01 23:23:37.735850,2022-12-01 23:23:48.076266,0 days 00:00:10.340416,balanced,7.0,log2,760,COMPLETE
1007,1007,0.2755522486772487,2022-12-01 23:23:48.300083,2022-12-01 23:23:57.452088,0 days 00:00:09.152005,balanced,7.0,log2,560,COMPLETE
1008,1008,0.263313492063492,2022-12-01 23:23:57.672476,2022-12-01 23:24:06.843175,0 days 00:00:09.170699,balanced,3.0,log2,560,COMPLETE
1009,1009,0.2810001803751804,2022-12-01 23:24:07.075342,2022-12-01 23:24:16.292637,0 days 00:00:09.217295,balanced,7.0,log2,560,COMPLETE
1010,1010,0.2707705026455026,2022-12-01 23:24:16.516104,2022-12-01 23:24:26.738814,0 days 00:00:10.222710,balanced,7.0,log2,760,COMPLETE
1011,1011,0.2745039682539683,2022-12-01 23:24:26.965706,2022-12-01 23:24:37.204285,0 days 00:00:10.238579,balanced,7.0,log2,760,COMPLETE
1012,1012,0.26992063492063495,2022-12-01 23:24:37.430162,2022-12-01 23:24:46.672923,0 days 00:00:09.242761,balanced,3.0,log2,560,COMPLETE
1013,1013,0.27758928571428576,2022-12-01 23:24:46.893984,2022-12-01 23:24:57.230538,0 days 00:00:10.336554,balanced,7.0,log2,760,COMPLETE
1014,1014,0.26812500000000006,2022-12-01 23:24:57.453716,2022-12-01 23:25:07.986419,0 days 00:00:10.532703,balanced,3.0,log2,760,COMPLETE
1015,1015,0.27443121693121697,2022-12-01 23:25:08.208170,2022-12-01 23:25:17.296363,0 days 00:00:09.088193,balanced,7.0,log2,560,COMPLETE
1016,1016,0.26640542328042327,2022-12-01 23:25:17.514280,2022-12-01 23:25:27.804567,0 days 00:00:10.290287,balanced,3.0,log2,760,COMPLETE
1017,1017,0.27593584656084663,2022-12-01 23:25:28.032879,2022-12-01 23:25:38.343276,0 days 00:00:10.310397,balanced,7.0,log2,760,COMPLETE
1018,1018,0.2742261904761905,2022-12-01 23:25:38.566865,2022-12-01 23:25:49.013713,0 days 00:00:10.446848,balanced,3.0,log2,760,COMPLETE
1019,1019,0.2717724867724868,2022-12-01 23:25:49.236376,2022-12-01 23:25:58.451401,0 days 00:00:09.215025,balanced,7.0,log2,560,COMPLETE
1020,1020,0.2911937830687831,2022-12-01 23:25:58.679134,2022-12-01 23:26:08.841849,0 days 00:00:10.162715,balanced,10.0,log2,760,COMPLETE
1021,1021,0.2815013227513227,2022-12-01 23:26:09.042104,2022-12-01 23:26:19.233970,0 days 00:00:10.191866,balanced,10.0,log2,760,COMPLETE
1022,1022,0.2635416666666667,2022-12-01 23:26:19.460018,2022-12-01 23:26:29.950714,0 days 00:00:10.490696,balanced,3.0,log2,760,COMPLETE
1023,1023,0.27831409331409324,2022-12-01 23:26:30.189350,2022-12-01 23:26:40.322285,0 days 00:00:10.132935,balanced,10.0,log2,760,COMPLETE
1024,1024,0.2943395262145262,2022-12-01 23:26:40.548306,2022-12-01 23:26:50.664068,0 days 00:00:10.115762,balanced,10.0,log2,760,COMPLETE
1025,1025,0.2968160774410774,2022-12-01 23:26:50.865245,2022-12-01 23:27:01.050199,0 days 00:00:10.184954,balanced,10.0,log2,760,COMPLETE
1026,1026,0.2789417989417989,2022-12-01 23:27:01.271542,2022-12-01 23:27:11.288333,0 days 00:00:10.016791,balanced,10.0,log2,760,COMPLETE
1027,1027,0.2874636243386244,2022-12-01 23:27:11.515084,2022-12-01 23:27:21.564837,0 days 00:00:10.049753,balanced,10.0,log2,760,COMPLETE
1028,1028,0.28357894420394414,2022-12-01 23:27:21.788795,2022-12-01 23:27:32.150468,0 days 00:00:10.361673,balanced,10.0,log2,760,COMPLETE
1029,1029,0.278305352055352,2022-12-01 23:27:32.368828,2022-12-01 23:27:43.389870,0 days 00:00:11.021042,balanced,10.0,log2,760,COMPLETE
1030,1030,0.2810019841269841,2022-12-01 23:27:43.618171,2022-12-01 23:27:53.797432,0 days 00:00:10.179261,balanced,10.0,log2,760,COMPLETE
1031,1031,0.28102693602693596,2022-12-01 23:27:54.022242,2022-12-01 23:28:04.158777,0 days 00:00:10.136535,balanced,10.0,log2,760,COMPLETE
1032,1032,0.2853935185185185,2022-12-01 23:28:04.379577,2022-12-01 23:28:14.542858,0 days 00:00:10.163281,balanced,10.0,log2,760,COMPLETE
1033,1033,0.29658399470899466,2022-12-01 23:28:14.763334,2022-12-01 23:28:24.728942,0 days 00:00:09.965608,balanced,10.0,log2,710,COMPLETE
1034,1034,0.28412037037037036,2022-12-01 23:28:24.953498,2022-12-01 23:28:34.714184,0 days 00:00:09.760686,balanced,10.0,log2,710,COMPLETE
1035,1035,0.292358706108706,2022-12-01 23:28:34.937017,2022-12-01 23:28:44.852766,0 days 00:00:09.915749,balanced,10.0,log2,710,COMPLETE
1036,1036,0.28494047619047613,2022-12-01 23:28:45.076840,2022-12-01 23:28:55.009366,0 days 00:00:09.932526,balanced,10.0,log2,710,COMPLETE
1037,1037,0.30537698412698405,2022-12-01 23:28:55.237497,2022-12-01 23:29:05.208361,0 days 00:00:09.970864,balanced,10.0,log2,710,COMPLETE
1038,1038,0.28795634920634916,2022-12-01 23:29:05.440318,2022-12-01 23:29:15.491965,0 days 00:00:10.051647,balanced,10.0,log2,710,COMPLETE
1039,1039,0.29844666907166906,2022-12-01 23:29:15.712148,2022-12-01 23:29:25.643525,0 days 00:00:09.931377,balanced,10.0,log2,710,COMPLETE
1040,1040,0.30038029100529096,2022-12-01 23:29:25.864826,2022-12-01 23:29:35.742584,0 days 00:00:09.877758,balanced,10.0,log2,710,COMPLETE
1041,1041,0.2766898148148148,2022-12-01 23:29:35.967094,2022-12-01 23:29:45.889327,0 days 00:00:09.922233,balanced,10.0,log2,710,COMPLETE
1042,1042,0.29865169552669546,2022-12-01 23:29:46.114816,2022-12-01 23:29:56.138766,0 days 00:00:10.023950,balanced,10.0,log2,710,COMPLETE
1043,1043,0.2922619047619047,2022-12-01 23:29:56.373246,2022-12-01 23:30:06.383486,0 days 00:00:10.010240,balanced,10.0,log2,710,COMPLETE
1044,1044,0.28412518037518036,2022-12-01 23:30:06.609289,2022-12-01 23:30:16.576620,0 days 00:00:09.967331,balanced,10.0,log2,710,COMPLETE
1045,1045,0.2906117724867724,2022-12-01 23:30:16.799382,2022-12-01 23:30:26.740692,0 days 00:00:09.941310,balanced,10.0,log2,710,COMPLETE
1046,1046,0.28214616402116394,2022-12-01 23:30:26.954283,2022-12-01 23:30:36.854230,0 days 00:00:09.899947,balanced,10.0,log2,710,COMPLETE
1047,1047,0.2862301587301587,2022-12-01 23:30:37.092586,2022-12-01 23:30:46.938191,0 days 00:00:09.845605,balanced,10.0,log2,710,COMPLETE
1048,1048,0.2728935185185185,2022-12-01 23:30:47.165740,2022-12-01 23:30:56.960522,0 days 00:00:09.794782,balanced,10.0,log2,710,COMPLETE
1049,1049,0.3059589947089947,2022-12-01 23:30:57.183998,2022-12-01 23:31:07.027583,0 days 00:00:09.843585,balanced,10.0,log2,710,COMPLETE
1050,1050,0.31405753968253963,2022-12-01 23:31:07.258770,2022-12-01 23:31:17.274325,0 days 00:00:10.015555,balanced,10.0,log2,710,COMPLETE
1051,1051,0.29684523809523805,2022-12-01 23:31:17.503040,2022-12-01 23:31:27.276063,0 days 00:00:09.773023,balanced,10.0,log2,710,COMPLETE
1052,1052,0.2883862433862433,2022-12-01 23:31:27.502440,2022-12-01 23:31:37.374230,0 days 00:00:09.871790,balanced,10.0,log2,710,COMPLETE
1053,1053,0.29032828282828277,2022-12-01 23:31:37.595156,2022-12-01 23:31:47.500713,0 days 00:00:09.905557,balanced,10.0,log2,710,COMPLETE
1054,1054,0.2951322751322751,2022-12-01 23:31:47.744062,2022-12-01 23:31:57.705752,0 days 00:00:09.961690,balanced,10.0,log2,710,COMPLETE
1055,1055,0.3020171957671957,2022-12-01 23:31:57.935574,2022-12-01 23:32:07.904818,0 days 00:00:09.969244,balanced,10.0,log2,710,COMPLETE
1056,1056,0.2978571428571429,2022-12-01 23:32:08.126618,2022-12-01 23:32:18.149855,0 days 00:00:10.023237,balanced,10.0,log2,710,COMPLETE
1057,1057,0.28790103415103413,2022-12-01 23:32:18.379370,2022-12-01 23:32:28.325532,0 days 00:00:09.946162,balanced,10.0,log2,710,COMPLETE
1058,1058,0.2914021164021164,2022-12-01 23:32:28.544672,2022-12-01 23:32:38.420871,0 days 00:00:09.876199,balanced,10.0,log2,710,COMPLETE
1059,1059,0.2902744708994709,2022-12-01 23:32:38.640849,2022-12-01 23:32:48.650504,0 days 00:00:10.009655,balanced,10.0,log2,710,COMPLETE
1060,1060,0.30292057479557477,2022-12-01 23:32:48.879847,2022-12-01 23:32:58.817751,0 days 00:00:09.937904,balanced,10.0,log2,710,COMPLETE
1061,1061,0.278938492063492,2022-12-01 23:32:59.049813,2022-12-01 23:33:08.903163,0 days 00:00:09.853350,balanced,10.0,log2,710,COMPLETE
1062,1062,0.2773412698412698,2022-12-01 23:33:09.127292,2022-12-01 23:33:19.066747,0 days 00:00:09.939455,balanced,10.0,log2,710,COMPLETE
1063,1063,0.29170304232804234,2022-12-01 23:33:19.288226,2022-12-01 23:33:29.397606,0 days 00:00:10.109380,balanced,10.0,log2,710,COMPLETE
1064,1064,0.28188492063492065,2022-12-01 23:33:29.617710,2022-12-01 23:33:39.511613,0 days 00:00:09.893903,balanced,10.0,log2,710,COMPLETE
1065,1065,0.2923875661375661,2022-12-01 23:33:39.733575,2022-12-01 23:33:49.573645,0 days 00:00:09.840070,balanced,10.0,log2,710,COMPLETE
1066,1066,0.29301316738816735,2022-12-01 23:33:49.801093,2022-12-01 23:33:59.757412,0 days 00:00:09.956319,balanced,10.0,log2,710,COMPLETE
1067,1067,0.29126653439153427,2022-12-01 23:33:59.995374,2022-12-01 23:34:09.855557,0 days 00:00:09.860183,balanced,10.0,log2,710,COMPLETE
1068,1068,0.28244137806637803,2022-12-01 23:34:10.080263,2022-12-01 23:34:19.936024,0 days 00:00:09.855761,balanced,10.0,log2,710,COMPLETE
1069,1069,0.29604828042328035,2022-12-01 23:34:20.154065,2022-12-01 23:34:30.148515,0 days 00:00:09.994450,balanced,10.0,log2,710,COMPLETE
1070,1070,0.30001322751322756,2022-12-01 23:34:30.371682,2022-12-01 23:34:40.280950,0 days 00:00:09.909268,balanced,10.0,log2,710,COMPLETE
1071,1071,0.299941378066378,2022-12-01 23:34:40.507339,2022-12-01 23:34:50.366351,0 days 00:00:09.859012,balanced,10.0,log2,710,COMPLETE
1072,1072,0.300549543049543,2022-12-01 23:34:50.592016,2022-12-01 23:35:00.488966,0 days 00:00:09.896950,balanced,10.0,log2,710,COMPLETE
1073,1073,0.28545725108225095,2022-12-01 23:35:00.711529,2022-12-01 23:35:10.612928,0 days 00:00:09.901399,balanced,10.0,log2,710,COMPLETE
1074,1074,0.2853703703703704,2022-12-01 23:35:10.838774,2022-12-01 23:35:20.751629,0 days 00:00:09.912855,balanced,10.0,log2,710,COMPLETE
1075,1075,0.29269179894179886,2022-12-01 23:35:20.974443,2022-12-01 23:35:30.906998,0 days 00:00:09.932555,balanced,10.0,log2,710,COMPLETE
1076,1076,0.28218482905982906,2022-12-01 23:35:31.136378,2022-12-01 23:35:41.131259,0 days 00:00:09.994881,balanced,10.0,log2,710,COMPLETE
1077,1077,0.2866666666666667,2022-12-01 23:35:41.361177,2022-12-01 23:35:51.246871,0 days 00:00:09.885694,balanced,10.0,log2,710,COMPLETE
1078,1078,0.28266534391534387,2022-12-01 23:35:51.468521,2022-12-01 23:36:01.398167,0 days 00:00:09.929646,balanced,10.0,log2,710,COMPLETE
1079,1079,0.2768028499278499,2022-12-01 23:36:01.620857,2022-12-01 23:36:11.587795,0 days 00:00:09.966938,balanced,10.0,log2,710,COMPLETE
1080,1080,0.3019651875901876,2022-12-01 23:36:11.814324,2022-12-01 23:36:21.772796,0 days 00:00:09.958472,balanced,10.0,log2,710,COMPLETE
1081,1081,0.2873048941798942,2022-12-01 23:36:21.998177,2022-12-01 23:36:31.982443,0 days 00:00:09.984266,balanced,10.0,log2,710,COMPLETE
1082,1082,0.2723280423280423,2022-12-01 23:36:32.209712,2022-12-01 23:36:42.199952,0 days 00:00:09.990240,balanced,10.0,log2,710,COMPLETE
1083,1083,0.28018849206349206,2022-12-01 23:36:42.428258,2022-12-01 23:36:52.276851,0 days 00:00:09.848593,balanced,10.0,log2,710,COMPLETE
1084,1084,0.2903382034632034,2022-12-01 23:36:52.499414,2022-12-01 23:37:02.406489,0 days 00:00:09.907075,balanced,10.0,log2,710,COMPLETE
1085,1085,0.2987136243386243,2022-12-01 23:37:02.629316,2022-12-01 23:37:12.572370,0 days 00:00:09.943054,balanced,10.0,log2,710,COMPLETE
1086,1086,0.2983664021164021,2022-12-01 23:37:12.793353,2022-12-01 23:37:22.683969,0 days 00:00:09.890616,balanced,10.0,log2,710,COMPLETE
1087,1087,0.27676587301587297,2022-12-01 23:37:22.904360,2022-12-01 23:37:32.800298,0 days 00:00:09.895938,balanced,10.0,log2,710,COMPLETE
1088,1088,0.2792030423280423,2022-12-01 23:37:33.020148,2022-12-01 23:37:43.035225,0 days 00:00:10.015077,balanced,10.0,log2,710,COMPLETE
1089,1089,0.29523869648869644,2022-12-01 23:37:43.267593,2022-12-01 23:37:53.177330,0 days 00:00:09.909737,balanced,10.0,log2,710,COMPLETE
1090,1090,0.2828712722462722,2022-12-01 23:37:53.397688,2022-12-01 23:38:03.357847,0 days 00:00:09.960159,balanced,10.0,log2,710,COMPLETE
1091,1091,0.28491131553631555,2022-12-01 23:38:03.581057,2022-12-01 23:38:13.065499,0 days 00:00:09.484442,balanced,10.0,log2,660,COMPLETE
1092,1092,0.292771164021164,2022-12-01 23:38:13.290370,2022-12-01 23:38:23.245851,0 days 00:00:09.955481,balanced,10.0,log2,710,COMPLETE
1093,1093,0.2927777777777777,2022-12-01 23:38:23.470256,2022-12-01 23:38:33.328886,0 days 00:00:09.858630,balanced,10.0,log2,710,COMPLETE
1094,1094,0.29548370610870606,2022-12-01 23:38:33.557997,2022-12-01 23:38:43.502640,0 days 00:00:09.944643,balanced,10.0,log2,710,COMPLETE
1095,1095,0.2829341029341029,2022-12-01 23:38:43.724257,2022-12-01 23:38:53.454899,0 days 00:00:09.730642,balanced,10.0,log2,660,COMPLETE
1096,1096,0.29091991341991336,2022-12-01 23:38:53.680749,2022-12-01 23:39:03.566627,0 days 00:00:09.885878,balanced,10.0,log2,710,COMPLETE
1097,1097,0.29479497354497364,2022-12-01 23:39:03.794448,2022-12-01 23:39:13.804169,0 days 00:00:10.009721,balanced,10.0,log2,710,COMPLETE
1098,1098,0.2888227513227513,2022-12-01 23:39:14.024923,2022-12-01 23:39:23.990283,0 days 00:00:09.965360,balanced,10.0,log2,710,COMPLETE
1099,1099,0.30136574074074074,2022-12-01 23:39:24.224295,2022-12-01 23:39:33.951046,0 days 00:00:09.726751,balanced,10.0,log2,660,COMPLETE
1100,1100,0.2914204545454545,2022-12-01 23:39:34.183641,2022-12-01 23:39:43.958884,0 days 00:00:09.775243,balanced,10.0,log2,660,COMPLETE
1101,1101,0.30069173881673883,2022-12-01 23:39:44.188188,2022-12-01 23:39:53.916195,0 days 00:00:09.728007,balanced,10.0,log2,660,COMPLETE
1102,1102,0.30028108465608455,2022-12-01 23:39:54.136688,2022-12-01 23:40:03.772297,0 days 00:00:09.635609,balanced,10.0,log2,660,COMPLETE
1103,1103,0.2923256373256372,2022-12-01 23:40:04.003110,2022-12-01 23:40:13.648197,0 days 00:00:09.645087,balanced,10.0,log2,660,COMPLETE
1104,1104,0.29278769841269836,2022-12-01 23:40:13.866201,2022-12-01 23:40:23.458959,0 days 00:00:09.592758,balanced,10.0,log2,660,COMPLETE
1105,1105,0.2909400553150553,2022-12-01 23:40:23.687482,2022-12-01 23:40:33.399157,0 days 00:00:09.711675,balanced,10.0,log2,660,COMPLETE
1106,1106,0.2847156084656085,2022-12-01 23:40:33.630823,2022-12-01 23:40:43.192778,0 days 00:00:09.561955,balanced,10.0,log2,660,COMPLETE
1107,1107,0.28340668590668594,2022-12-01 23:40:43.422461,2022-12-01 23:40:52.952075,0 days 00:00:09.529614,balanced,10.0,log2,660,COMPLETE
1108,1108,0.28876322751322747,2022-12-01 23:40:53.194394,2022-12-01 23:41:02.820193,0 days 00:00:09.625799,balanced,10.0,log2,660,COMPLETE
1109,1109,0.2835152116402116,2022-12-01 23:41:03.046293,2022-12-01 23:41:12.859578,0 days 00:00:09.813285,balanced,10.0,log2,660,COMPLETE
1110,1110,0.28129148629148626,2022-12-01 23:41:13.083609,2022-12-01 23:41:22.946287,0 days 00:00:09.862678,balanced,10.0,log2,710,COMPLETE
