,number,value,datetime_start,datetime_complete,duration,params_class_weight,params_max_depth,params_max_features,params_n_estimators,state
794,794,0.15816242639058176,2022-12-01 22:48:02.108494,2022-12-01 22:48:11.240200,0 days 00:00:09.131706,balanced,19.0,0.7,460,COMPLETE
795,795,0.16317171366928648,2022-12-01 22:48:11.462978,2022-12-01 22:48:18.599868,0 days 00:00:07.136890,balanced,18.0,0.9,110,COMPLETE
796,796,0.2157035624389993,2022-12-01 22:48:18.823076,2022-12-01 22:48:25.914579,0 days 00:00:07.091503,balanced,5.0,,110,COMPLETE
797,797,0.018487055016181232,2022-12-01 22:48:26.137183,2022-12-01 22:48:37.803595,0 days 00:00:11.666412,,33.0,0.7,610,COMPLETE
798,798,0.16572796270611803,2022-12-01 22:48:38.034434,2022-12-01 22:48:46.534128,0 days 00:00:08.499694,balanced,13.0,,310,COMPLETE
799,799,0.014563106796116504,2022-12-01 22:48:46.755558,2022-12-01 22:48:55.482069,0 days 00:00:08.726511,,37.0,0.7,310,COMPLETE
800,800,0.21279379062146053,2022-12-01 22:48:55.691095,2022-12-01 22:49:05.493244,0 days 00:00:09.802149,"{0: 1, 1: 10}",3.0,0.8,410,COMPLETE
801,801,0.15717715959506362,2022-12-01 22:49:05.715491,2022-12-01 22:49:14.132108,0 days 00:00:08.416617,,2.0,0.7,310,COMPLETE
802,802,0.15415453074433655,2022-12-01 22:49:14.350272,2022-12-01 22:49:21.992009,0 days 00:00:07.641737,balanced,17.0,,210,COMPLETE
803,803,0.1715414868752247,2022-12-01 22:49:22.213565,2022-12-01 22:49:33.565796,0 days 00:00:11.352231,"{0: 1, 1: 100}",18.0,0.9,710,COMPLETE
804,804,0.29051917989417986,2022-12-01 22:49:33.786247,2022-12-01 22:49:42.840182,0 days 00:00:09.053935,"{0: 1, 1: 10}",9.0,log2,560,COMPLETE
805,805,0.14265776699029126,2022-12-01 22:49:43.024927,2022-12-01 22:49:49.930490,0 days 00:00:06.905563,"{0: 1, 1: 100}",10.0,,10,COMPLETE
806,806,0.14811283857124707,2022-12-01 22:49:50.149547,2022-12-01 22:50:02.964566,0 days 00:00:12.815019,"{0: 1, 1: 10}",2.0,0.9,710,COMPLETE
807,807,0.13384941260025224,2022-12-01 22:50:03.185800,2022-12-01 22:50:14.277894,0 days 00:00:11.092094,"{0: 1, 1: 10}",38.0,log2,960,COMPLETE
808,808,0.17913013047721787,2022-12-01 22:50:14.495701,2022-12-01 22:50:24.442612,0 days 00:00:09.946911,balanced,9.0,0.7,610,COMPLETE
809,809,0.21563719721486713,2022-12-01 22:50:24.675980,2022-12-01 22:50:36.528223,0 days 00:00:11.852243,"{0: 1, 1: 100}",5.0,0.7,910,COMPLETE
810,810,0.1675988998865212,2022-12-01 22:50:36.752644,2022-12-01 22:50:47.030244,0 days 00:00:10.277600,balanced,21.0,0.8,610,COMPLETE
811,811,0.014563106796116504,2022-12-01 22:50:47.253516,2022-12-01 22:50:54.122413,0 days 00:00:06.868897,,16.0,,10,COMPLETE
812,812,0.09372592078902758,2022-12-01 22:50:54.339628,2022-12-01 22:51:08.486615,0 days 00:00:14.146987,"{0: 1, 1: 10}",19.0,0.7,910,COMPLETE
813,813,0.03074433656957929,2022-12-01 22:51:08.706160,2022-12-01 22:51:18.799274,0 days 00:00:10.093114,,13.0,0.6,510,COMPLETE
814,814,0.1760500374760083,2022-12-01 22:51:19.005186,2022-12-01 22:51:28.279005,0 days 00:00:09.273819,"{0: 1, 1: 100}",22.0,0.6,560,COMPLETE
815,815,0.16869227410489546,2022-12-01 22:51:28.495385,2022-12-01 22:51:39.549229,0 days 00:00:11.053844,"{0: 1, 1: 100}",20.0,0.8,710,COMPLETE
816,816,0.15121933913802843,2022-12-01 22:51:39.773123,2022-12-01 22:51:47.430380,0 days 00:00:07.657257,"{0: 1, 1: 100}",38.0,0.7,260,COMPLETE
817,817,0.014563106796116504,2022-12-01 22:51:47.647169,2022-12-01 22:51:54.959865,0 days 00:00:07.312696,,24.0,,110,COMPLETE
818,818,0.03323509015256588,2022-12-01 22:51:55.176496,2022-12-01 22:52:08.524001,0 days 00:00:13.347505,,31.0,0.7,810,COMPLETE
819,819,0.2557118807118807,2022-12-01 22:52:08.749266,2022-12-01 22:52:18.578472,0 days 00:00:09.829206,"{0: 1, 1: 10}",5.0,sqrt,860,COMPLETE
820,820,0.15367954276934861,2022-12-01 22:52:18.802151,2022-12-01 22:52:26.671310,0 days 00:00:07.869159,balanced,26.0,0.6,310,COMPLETE
821,821,0.07984783128593809,2022-12-01 22:52:26.889964,2022-12-01 22:52:34.022076,0 days 00:00:07.132112,"{0: 1, 1: 100}",35.0,log2,60,COMPLETE
822,822,0.16802453210220203,2022-12-01 22:52:34.240445,2022-12-01 22:52:41.529699,0 days 00:00:07.289254,balanced,1.0,,160,COMPLETE
823,823,0.15749113885036214,2022-12-01 22:52:41.757643,2022-12-01 22:52:48.900255,0 days 00:00:07.142612,"{0: 1, 1: 100}",27.0,0.8,60,COMPLETE
824,824,0.28662217412217406,2022-12-01 22:52:49.116660,2022-12-01 22:52:59.964917,0 days 00:00:10.848257,balanced,10.0,log2,860,COMPLETE
825,825,0.07133629989212513,2022-12-01 22:53:00.192464,2022-12-01 22:53:08.360208,0 days 00:00:08.167744,"{0: 1, 1: 10}",32.0,0.9,210,COMPLETE
826,826,0.17513474726460163,2022-12-01 22:53:08.576209,2022-12-01 22:53:19.084819,0 days 00:00:10.508610,"{0: 1, 1: 100}",23.0,0.8,660,COMPLETE
827,827,0.14759090558847843,2022-12-01 22:53:19.305784,2022-12-01 22:53:30.162734,0 days 00:00:10.856950,"{0: 1, 1: 10}",24.0,0.7,560,COMPLETE
828,828,0.10210086299892127,2022-12-01 22:53:30.386918,2022-12-01 22:53:37.852371,0 days 00:00:07.465453,"{0: 1, 1: 10}",9.0,0.8,160,COMPLETE
829,829,0.18268690137622173,2022-12-01 22:53:38.071989,2022-12-01 22:53:50.835105,0 days 00:00:12.763116,balanced,23.0,,810,COMPLETE
830,830,0.13914194534340166,2022-12-01 22:53:51.054898,2022-12-01 22:53:59.237009,0 days 00:00:08.182111,balanced,39.0,0.6,360,COMPLETE
831,831,0.08211269245856626,2022-12-01 22:53:59.458452,2022-12-01 22:54:12.735684,0 days 00:00:13.277232,"{0: 1, 1: 10}",,0.6,910,COMPLETE
832,832,0.0640453074433657,2022-12-01 22:54:12.957977,2022-12-01 22:54:28.483467,0 days 00:00:15.525490,,16.0,0.9,860,COMPLETE
833,833,0.12289164574207874,2022-12-01 22:54:28.704750,2022-12-01 22:54:37.979962,0 days 00:00:09.275212,,37.0,log2,610,COMPLETE
834,834,0.11766070680441858,2022-12-01 22:54:38.206064,2022-12-01 22:54:45.843063,0 days 00:00:07.636999,"{0: 1, 1: 100}",38.0,sqrt,310,COMPLETE
835,835,0.14806589356346636,2022-12-01 22:54:46.060027,2022-12-01 22:54:53.324982,0 days 00:00:07.264955,"{0: 1, 1: 100}",22.0,0.6,210,COMPLETE
836,836,0.16096474161401345,2022-12-01 22:54:53.560888,2022-12-01 22:55:04.586362,0 days 00:00:11.025474,balanced,14.0,0.8,710,COMPLETE
837,837,0.1048947375492921,2022-12-01 22:55:04.809096,2022-12-01 22:55:12.298514,0 days 00:00:07.489418,"{0: 1, 1: 100}",34.0,sqrt,260,COMPLETE
838,838,0.17058114373041555,2022-12-01 22:55:12.516135,2022-12-01 22:55:20.239962,0 days 00:00:07.723827,balanced,28.0,0.8,260,COMPLETE
839,839,0.21384004884004887,2022-12-01 22:55:20.463532,2022-12-01 22:55:31.073242,0 days 00:00:10.609710,balanced,1.0,0.6,910,COMPLETE
840,840,0.09153143781784559,2022-12-01 22:55:31.302003,2022-12-01 22:55:40.934587,0 days 00:00:09.632584,"{0: 1, 1: 10}",20.0,0.7,410,COMPLETE
841,841,0.04299699491447064,2022-12-01 22:55:41.156526,2022-12-01 22:55:48.750047,0 days 00:00:07.593521,"{0: 1, 1: 10}",17.0,1.0,160,COMPLETE
842,842,0.0940154434966328,2022-12-01 22:55:48.969589,2022-12-01 22:55:56.200058,0 days 00:00:07.230469,,24.0,log2,60,COMPLETE
843,843,0.16960163353367236,2022-12-01 22:55:56.422047,2022-12-01 22:56:04.477880,0 days 00:00:08.055833,balanced,21.0,,260,COMPLETE
844,844,0.1737456307177181,2022-12-01 22:56:04.699345,2022-12-01 22:56:17.072037,0 days 00:00:12.372692,balanced,32.0,0.7,960,COMPLETE
845,845,0.04970334412081985,2022-12-01 22:56:17.296809,2022-12-01 22:56:24.319957,0 days 00:00:07.023148,balanced,,log2,10,COMPLETE
846,846,0.08775235013099089,2022-12-01 22:56:24.540744,2022-12-01 22:56:33.995575,0 days 00:00:09.454831,"{0: 1, 1: 10}",28.0,0.6,460,COMPLETE
847,847,0.1522550662659886,2022-12-01 22:56:34.220027,2022-12-01 22:56:44.334172,0 days 00:00:10.114145,balanced,35.0,1.0,510,COMPLETE
848,848,0.05918284789644013,2022-12-01 22:56:44.564525,2022-12-01 22:56:51.830179,0 days 00:00:07.265654,"{0: 1, 1: 10}",29.0,1.0,110,COMPLETE
849,849,0.16345790019940504,2022-12-01 22:56:52.046431,2022-12-01 22:57:03.018755,0 days 00:00:10.972324,balanced,20.0,0.7,760,COMPLETE
850,850,0.12377774719488069,2022-12-01 22:57:03.246115,2022-12-01 22:57:14.336476,0 days 00:00:11.090361,,,log2,910,COMPLETE
851,851,0.023244336569579287,2022-12-01 22:57:14.554687,2022-12-01 22:57:24.315743,0 days 00:00:09.761056,,32.0,0.6,460,COMPLETE
852,852,0.08656187394051472,2022-12-01 22:57:24.533706,2022-12-01 22:57:36.443700,0 days 00:00:11.909994,"{0: 1, 1: 10}",38.0,,510,COMPLETE
853,853,0.07504226414277812,2022-12-01 22:57:36.665599,2022-12-01 22:57:44.180189,0 days 00:00:07.514590,,36.0,sqrt,210,COMPLETE
854,854,0.031334951456310677,2022-12-01 22:57:44.393968,2022-12-01 22:57:58.574022,0 days 00:00:14.180054,,38.0,0.8,810,COMPLETE
855,855,0.11050238865772848,2022-12-01 22:57:58.799252,2022-12-01 22:58:15.913811,0 days 00:00:17.114559,"{0: 1, 1: 10}",38.0,1.0,960,COMPLETE
856,856,0.022653721682847898,2022-12-01 22:58:16.135327,2022-12-01 22:58:26.346333,0 days 00:00:10.211006,,6.0,1.0,360,COMPLETE
857,857,0.15759631684388964,2022-12-01 22:58:26.574995,2022-12-01 22:58:34.077552,0 days 00:00:07.502557,"{0: 1, 1: 100}",31.0,0.6,260,COMPLETE
858,858,0.19939900155747012,2022-12-01 22:58:34.305927,2022-12-01 22:58:43.894379,0 days 00:00:09.588452,"{0: 1, 1: 100}",23.0,log2,660,COMPLETE
859,859,0.17263407304669437,2022-12-01 22:58:44.113629,2022-12-01 22:58:54.744491,0 days 00:00:10.630862,"{0: 1, 1: 100}",28.0,0.8,660,COMPLETE
860,860,0.08628409616273693,2022-12-01 22:58:54.964779,2022-12-01 22:59:07.935600,0 days 00:00:12.970821,"{0: 1, 1: 10}",15.0,,610,COMPLETE
861,861,0.12786310456637995,2022-12-01 22:59:08.161226,2022-12-01 22:59:15.211180,0 days 00:00:07.049954,"{0: 1, 1: 10}",14.0,log2,10,COMPLETE
862,862,0.17656726768377254,2022-12-01 22:59:15.433462,2022-12-01 22:59:24.400409,0 days 00:00:08.966947,balanced,13.0,,360,COMPLETE
863,863,0.2534038184038184,2022-12-01 22:59:24.628142,2022-12-01 22:59:34.933850,0 days 00:00:10.305708,"{0: 1, 1: 10}",15.0,log2,810,COMPLETE
864,864,0.2334124111755691,2022-12-01 22:59:35.158775,2022-12-01 22:59:44.854807,0 days 00:00:09.696032,"{0: 1, 1: 100}",20.0,log2,660,COMPLETE
865,865,0.1027859194805506,2022-12-01 22:59:45.078080,2022-12-01 22:59:54.654534,0 days 00:00:09.576454,,24.0,sqrt,860,COMPLETE
866,866,0.1658027045769764,2022-12-01 22:59:54.880680,2022-12-01 23:00:03.314830,0 days 00:00:08.434150,balanced,9.0,0.8,360,COMPLETE
867,867,0.09237998921251349,2022-12-01 23:00:03.537356,2022-12-01 23:00:13.434963,0 days 00:00:09.897607,"{0: 1, 1: 10}",18.0,0.8,410,COMPLETE
868,868,0.2881095293595293,2022-12-01 23:00:13.660984,2022-12-01 23:00:23.064728,0 days 00:00:09.403744,"{0: 1, 1: 100}",7.0,sqrt,710,COMPLETE
869,869,0.11794306242121774,2022-12-01 23:00:23.286402,2022-12-01 23:00:30.452696,0 days 00:00:07.166294,"{0: 1, 1: 100}",17.0,sqrt,110,COMPLETE
870,870,0.08215402226324556,2022-12-01 23:00:30.679183,2022-12-01 23:00:37.938159,0 days 00:00:07.258976,"{0: 1, 1: 10}",13.0,sqrt,110,COMPLETE
871,871,0.15520942492423076,2022-12-01 23:00:38.163375,2022-12-01 23:00:45.292995,0 days 00:00:07.129620,"{0: 1, 1: 100}",7.0,0.9,110,COMPLETE
872,872,0.022411003236245952,2022-12-01 23:00:45.514682,2022-12-01 23:00:59.962127,0 days 00:00:14.447445,,11.0,1.0,710,COMPLETE
873,873,0.10435582017434859,2022-12-01 23:01:00.186930,2022-12-01 23:01:09.987829,0 days 00:00:09.800899,,39.0,sqrt,910,COMPLETE
874,874,0.023899098474341192,2022-12-01 23:01:10.204553,2022-12-01 23:01:18.552148,0 days 00:00:08.347595,,32.0,0.7,260,COMPLETE
875,875,0.25463677526177525,2022-12-01 23:01:18.767668,2022-12-01 23:01:27.314796,0 days 00:00:08.547128,balanced,8.0,sqrt,510,COMPLETE
876,876,0.022653721682847898,2022-12-01 23:01:27.539329,2022-12-01 23:01:36.999981,0 days 00:00:09.460652,,33.0,,310,COMPLETE
877,877,0.16787878204140338,2022-12-01 23:01:37.223333,2022-12-01 23:01:47.309504,0 days 00:00:10.086171,balanced,38.0,0.7,610,COMPLETE
878,878,0.2825132275132275,2022-12-01 23:01:47.546097,2022-12-01 23:01:57.789819,0 days 00:00:10.243722,balanced,9.0,log2,760,COMPLETE
879,879,0.13026064645982657,2022-12-01 23:01:58.011255,2022-12-01 23:02:08.962344,0 days 00:00:10.951089,,28.0,log2,910,COMPLETE
880,880,0.10323554755695977,2022-12-01 23:02:09.189798,2022-12-01 23:02:17.354940,0 days 00:00:08.165142,,14.0,sqrt,410,COMPLETE
881,881,0.16312969033842822,2022-12-01 23:02:17.578742,2022-12-01 23:02:28.440057,0 days 00:00:10.861315,"{0: 1, 1: 100}",29.0,0.6,810,COMPLETE
882,882,0.02057038834951456,2022-12-01 23:02:28.668519,2022-12-01 23:02:36.056628,0 days 00:00:07.388109,,36.0,0.7,160,COMPLETE
883,883,0.1585904029896748,2022-12-01 23:02:36.306423,2022-12-01 23:02:46.435001,0 days 00:00:10.128578,"{0: 1, 1: 100}",28.0,,510,COMPLETE
884,884,0.14711522338526145,2022-12-01 23:02:46.658325,2022-12-01 23:02:54.384064,0 days 00:00:07.725739,"{0: 1, 1: 10}",2.0,0.8,210,COMPLETE
885,885,0.032827669902912616,2022-12-01 23:02:54.604634,2022-12-01 23:03:01.865761,0 days 00:00:07.261127,,28.0,sqrt,10,COMPLETE
886,886,0.1455282015718909,2022-12-01 23:03:02.083944,2022-12-01 23:03:09.762433,0 days 00:00:07.678489,"{0: 1, 1: 100}",33.0,1.0,210,COMPLETE
887,887,0.02057038834951456,2022-12-01 23:03:09.977377,2022-12-01 23:03:20.774508,0 days 00:00:10.797131,,10.0,1.0,410,COMPLETE
888,888,0.03442556634304207,2022-12-01 23:03:21.002776,2022-12-01 23:03:34.016819,0 days 00:00:13.014043,,10.0,0.7,760,COMPLETE
889,889,0.18447205527302613,2022-12-01 23:03:34.230948,2022-12-01 23:03:42.276269,0 days 00:00:08.045321,balanced,7.0,0.7,310,COMPLETE
890,890,0.02518878101402373,2022-12-01 23:03:42.501693,2022-12-01 23:03:52.652570,0 days 00:00:10.150877,,16.0,1.0,360,COMPLETE
891,891,0.014563106796116504,2022-12-01 23:03:52.870334,2022-12-01 23:04:08.234389,0 days 00:00:15.364055,,24.0,0.9,860,COMPLETE
892,892,0.10417103303025635,2022-12-01 23:04:08.454271,2022-12-01 23:04:24.677717,0 days 00:00:16.223446,"{0: 1, 1: 10}",14.0,0.9,960,COMPLETE
893,893,0.24431240056240053,2022-12-01 23:04:24.908663,2022-12-01 23:04:34.253600,0 days 00:00:09.344937,balanced,8.0,sqrt,760,COMPLETE
894,894,0.2707010582010582,2022-12-01 23:04:34.481120,2022-12-01 23:04:45.472752,0 days 00:00:10.991632,"{0: 1, 1: 100}",8.0,log2,860,COMPLETE
895,895,0.032688781014023734,2022-12-01 23:04:45.693804,2022-12-01 23:04:52.739580,0 days 00:00:07.045776,"{0: 1, 1: 10}",17.0,sqrt,10,COMPLETE
896,896,0.02057038834951456,2022-12-01 23:04:52.954521,2022-12-01 23:05:07.522939,0 days 00:00:14.568418,,21.0,0.8,860,COMPLETE
897,897,0.17082254584681766,2022-12-01 23:05:07.748643,2022-12-01 23:05:15.718343,0 days 00:00:07.969700,balanced,7.0,,260,COMPLETE
898,898,0.14013112036276706,2022-12-01 23:05:15.944993,2022-12-01 23:05:25.510717,0 days 00:00:09.565724,"{0: 1, 1: 10}",32.0,log2,660,COMPLETE
899,899,0.1535394513792572,2022-12-01 23:05:25.727691,2022-12-01 23:05:33.583931,0 days 00:00:07.856240,"{0: 1, 1: 100}",18.0,0.9,260,COMPLETE
900,900,0.05084951456310679,2022-12-01 23:05:33.808075,2022-12-01 23:05:44.540244,0 days 00:00:10.732169,,36.0,1.0,410,COMPLETE
901,901,0.03377542764678687,2022-12-01 23:05:44.765082,2022-12-01 23:05:51.810126,0 days 00:00:07.045044,"{0: 1, 1: 100}",32.0,log2,10,COMPLETE
902,902,0.04334489135460009,2022-12-01 23:05:52.034725,2022-12-01 23:06:01.599753,0 days 00:00:09.565028,,15.0,0.6,460,COMPLETE
903,903,0.09785868477580299,2022-12-01 23:06:01.824056,2022-12-01 23:06:11.098105,0 days 00:00:09.274049,,38.0,sqrt,660,COMPLETE
904,904,0.17927755070352158,2022-12-01 23:06:11.322589,2022-12-01 23:06:23.019988,0 days 00:00:11.697399,"{0: 1, 1: 100}",14.0,0.9,760,COMPLETE
905,905,0.17206329942980428,2022-12-01 23:06:23.237725,2022-12-01 23:06:31.643674,0 days 00:00:08.405949,"{0: 1, 1: 100}",38.0,,310,COMPLETE
906,906,0.10395939281861613,2022-12-01 23:06:31.846157,2022-12-01 23:06:47.167487,0 days 00:00:15.321330,"{0: 1, 1: 10}",,1.0,810,COMPLETE
907,907,0.18460625674217906,2022-12-01 23:06:47.394773,2022-12-01 23:06:54.421922,0 days 00:00:07.027149,"{0: 1, 1: 100}",6.0,1.0,60,COMPLETE
908,908,0.12307051677197309,2022-12-01 23:06:54.651122,2022-12-01 23:07:09.047594,0 days 00:00:14.396472,"{0: 1, 1: 10}",8.0,0.8,860,COMPLETE
909,909,0.2091007719132719,2022-12-01 23:07:09.271004,2022-12-01 23:07:19.207133,0 days 00:00:09.936129,,9.0,log2,710,COMPLETE
910,910,0.2236846486846487,2022-12-01 23:07:19.432460,2022-12-01 23:07:29.189443,0 days 00:00:09.756983,,1.0,sqrt,660,COMPLETE
911,911,0.16353753709848173,2022-12-01 23:07:29.411949,2022-12-01 23:07:40.502321,0 days 00:00:11.090372,,18.0,log2,960,COMPLETE
912,912,0.11095873786407769,2022-12-01 23:07:40.721775,2022-12-01 23:07:56.669781,0 days 00:00:15.948006,"{0: 1, 1: 10}",28.0,,860,COMPLETE
913,913,0.1649010376395778,2022-12-01 23:07:56.887679,2022-12-01 23:08:05.147966,0 days 00:00:08.260287,"{0: 1, 1: 10}",21.0,log2,410,COMPLETE
914,914,0.024077669902912623,2022-12-01 23:08:05.367838,2022-12-01 23:08:14.347291,0 days 00:00:08.979453,,15.0,0.8,310,COMPLETE
915,915,0.17221548004314996,2022-12-01 23:08:14.570621,2022-12-01 23:08:24.686307,0 days 00:00:10.115686,,3.0,1.0,360,COMPLETE
916,916,0.23000565462944106,2022-12-01 23:08:24.921280,2022-12-01 23:08:34.460476,0 days 00:00:09.539196,balanced,4.0,0.6,610,COMPLETE
917,917,0.08672240785104862,2022-12-01 23:08:34.693195,2022-12-01 23:08:45.145612,0 days 00:00:10.452417,"{0: 1, 1: 10}",20.0,0.8,460,COMPLETE
918,918,0.21997161279928273,2022-12-01 23:08:45.365027,2022-12-01 23:08:55.592178,0 days 00:00:10.227151,"{0: 1, 1: 100}",5.0,0.6,710,COMPLETE
919,919,0.018487055016181232,2022-12-01 23:08:55.813234,2022-12-01 23:09:04.058861,0 days 00:00:08.245627,,36.0,0.7,260,COMPLETE
920,920,0.05428340268146094,2022-12-01 23:09:04.284227,2022-12-01 23:09:20.440242,0 days 00:00:16.156015,,29.0,0.9,910,COMPLETE
921,921,0.12243623824934505,2022-12-01 23:09:20.658981,2022-12-01 23:09:33.788439,0 days 00:00:13.129458,"{0: 1, 1: 10}",22.0,,610,COMPLETE
922,922,0.03317556634304207,2022-12-01 23:09:34.014134,2022-12-01 23:09:47.757828,0 days 00:00:13.743694,,30.0,0.9,710,COMPLETE
923,923,0.1320955164853545,2022-12-01 23:09:47.981834,2022-12-01 23:09:56.551842,0 days 00:00:08.570008,balanced,27.0,sqrt,560,COMPLETE
924,924,0.12688011106013505,2022-12-01 23:09:56.771205,2022-12-01 23:10:06.550898,0 days 00:00:09.779693,"{0: 1, 1: 100}",37.0,sqrt,810,COMPLETE
925,925,0.1734673655183364,2022-12-01 23:10:06.778475,2022-12-01 23:10:17.462989,0 days 00:00:10.684514,"{0: 1, 1: 100}",27.0,0.8,660,COMPLETE
926,926,0.16970910675282896,2022-12-01 23:10:17.679524,2022-12-01 23:10:27.128046,0 days 00:00:09.448522,"{0: 1, 1: 10}",10.0,sqrt,760,COMPLETE
927,927,0.14828203603617657,2022-12-01 23:10:27.358941,2022-12-01 23:10:36.544553,0 days 00:00:09.185612,"{0: 1, 1: 10}",1.0,,460,COMPLETE
928,928,0.26827324976222033,2022-12-01 23:10:36.780147,2022-12-01 23:10:44.826501,0 days 00:00:08.046354,"{0: 1, 1: 100}",7.0,sqrt,360,COMPLETE
929,929,0.12212937278471263,2022-12-01 23:10:45.044455,2022-12-01 23:10:56.964588,0 days 00:00:11.920133,"{0: 1, 1: 10}",23.0,,510,COMPLETE
930,930,0.24488425925925927,2022-12-01 23:10:57.187501,2022-12-01 23:11:05.575532,0 days 00:00:08.388031,"{0: 1, 1: 100}",1.0,log2,410,COMPLETE
931,931,0.018487055016181232,2022-12-01 23:11:05.796153,2022-12-01 23:11:20.530154,0 days 00:00:14.734001,,19.0,0.7,960,COMPLETE
932,932,0.014563106796116504,2022-12-01 23:11:20.752078,2022-12-01 23:11:27.983020,0 days 00:00:07.230942,,36.0,0.9,110,COMPLETE
933,933,0.031334951456310677,2022-12-01 23:11:28.207114,2022-12-01 23:11:44.822444,0 days 00:00:16.615330,,28.0,0.9,960,COMPLETE
934,934,0.16860167206040994,2022-12-01 23:11:45.043024,2022-12-01 23:11:58.480270,0 days 00:00:13.437246,"{0: 1, 1: 100}",34.0,,910,COMPLETE
935,935,0.1511751078704818,2022-12-01 23:11:58.697557,2022-12-01 23:12:06.869600,0 days 00:00:08.172043,balanced,37.0,sqrt,460,COMPLETE
936,936,0.148571734010695,2022-12-01 23:12:07.086372,2022-12-01 23:12:17.889515,0 days 00:00:10.803143,"{0: 1, 1: 100}",28.0,log2,910,COMPLETE
937,937,0.1631968844711563,2022-12-01 23:12:18.112593,2022-12-01 23:12:27.538510,0 days 00:00:09.425917,"{0: 1, 1: 100}",22.0,0.9,460,COMPLETE
938,938,0.07955583341505672,2022-12-01 23:12:27.769574,2022-12-01 23:12:34.941416,0 days 00:00:07.171842,,36.0,sqrt,110,COMPLETE
939,939,0.16937217470591256,2022-12-01 23:12:35.161225,2022-12-01 23:12:48.151886,0 days 00:00:12.990661,"{0: 1, 1: 100}",11.0,,860,COMPLETE
940,940,0.032827669902912616,2022-12-01 23:12:48.379328,2022-12-01 23:12:58.862648,0 days 00:00:10.483320,,39.0,0.9,410,COMPLETE
941,941,0.014563106796116504,2022-12-01 23:12:59.086680,2022-12-01 23:13:07.321823,0 days 00:00:08.235143,,39.0,0.9,210,COMPLETE
942,942,0.1643067304339379,2022-12-01 23:13:07.542060,2022-12-01 23:13:16.924802,0 days 00:00:09.382742,"{0: 1, 1: 10}",22.0,log2,610,COMPLETE
943,943,0.12543541002752592,2022-12-01 23:13:17.146270,2022-12-01 23:13:24.449912,0 days 00:00:07.303642,balanced,26.0,log2,160,COMPLETE
944,944,0.11005258899676378,2022-12-01 23:13:24.668608,2022-12-01 23:13:31.570363,0 days 00:00:06.901755,"{0: 1, 1: 100}",24.0,1.0,10,COMPLETE
945,945,0.07144012944983819,2022-12-01 23:13:31.789434,2022-12-01 23:13:38.810317,0 days 00:00:07.020883,"{0: 1, 1: 100}",14.0,0.8,10,COMPLETE
946,946,0.17186292828889915,2022-12-01 23:13:39.032661,2022-12-01 23:13:50.398545,0 days 00:00:11.365884,balanced,33.0,0.7,810,COMPLETE
947,947,0.2838062169312169,2022-12-01 23:13:50.619893,2022-12-01 23:14:00.414829,0 days 00:00:09.794936,balanced,14.0,log2,760,COMPLETE
948,948,0.16420078617894152,2022-12-01 23:14:00.629653,2022-12-01 23:14:10.229588,0 days 00:00:09.599935,balanced,33.0,0.7,560,COMPLETE
949,949,0.028001618122977346,2022-12-01 23:14:10.455444,2022-12-01 23:14:18.998153,0 days 00:00:08.542709,,15.0,0.6,310,COMPLETE
950,950,0.08831116921450013,2022-12-01 23:14:19.220882,2022-12-01 23:14:27.184905,0 days 00:00:07.964023,"{0: 1, 1: 10}",18.0,sqrt,360,COMPLETE
951,951,0.10424115169260802,2022-12-01 23:14:27.410414,2022-12-01 23:14:43.006532,0 days 00:00:15.596118,"{0: 1, 1: 10}",25.0,0.8,960,COMPLETE
952,952,0.18062615580212665,2022-12-01 23:14:43.226827,2022-12-01 23:14:53.860278,0 days 00:00:10.633451,balanced,18.0,0.9,610,COMPLETE
