,number,value,datetime_start,datetime_complete,duration,params_class_weight,params_max_depth,params_max_features,params_n_estimators,state
1901,1901,0.28101851851851845,2022-12-02 01:57:04.426967,2022-12-02 01:57:15.139627,0 days 00:00:10.712660,balanced,9.0,log2,810,COMPLETE
1902,1902,0.296574074074074,2022-12-02 01:57:15.374484,2022-12-02 01:57:25.788270,0 days 00:00:10.413786,balanced,9.0,log2,810,COMPLETE
1903,1903,0.2841765873015873,2022-12-02 01:57:26.031764,2022-12-02 01:57:36.645777,0 days 00:00:10.614013,balanced,9.0,log2,810,COMPLETE
1904,1904,0.2675737803862804,2022-12-02 01:57:36.890158,2022-12-02 01:57:47.263072,0 days 00:00:10.372914,balanced,16.0,log2,810,COMPLETE
1905,1905,0.23648270589060058,2022-12-02 01:57:47.508254,2022-12-02 01:57:57.166515,0 days 00:00:09.658261,balanced,9.0,sqrt,860,COMPLETE
1906,1906,0.26475198412698414,2022-12-02 01:57:57.415057,2022-12-02 01:58:07.746242,0 days 00:00:10.331185,balanced,3.0,log2,760,COMPLETE
1907,1907,0.28883267195767187,2022-12-02 01:58:07.987261,2022-12-02 01:58:18.385488,0 days 00:00:10.398227,balanced,9.0,log2,760,COMPLETE
1908,1908,0.28912698412698407,2022-12-02 01:58:18.621684,2022-12-02 01:58:28.947795,0 days 00:00:10.326111,balanced,9.0,log2,760,COMPLETE
1909,1909,0.15775064564606125,2022-12-02 01:58:29.190059,2022-12-02 01:58:39.346844,0 days 00:00:10.156785,balanced,31.0,log2,810,COMPLETE
1910,1910,0.13805554727549912,2022-12-02 01:58:39.587729,2022-12-02 01:58:49.620470,0 days 00:00:10.032741,balanced,36.0,log2,760,COMPLETE
1911,1911,0.19274676227364337,2022-12-02 01:58:49.860543,2022-12-02 01:58:59.957245,0 days 00:00:10.096702,balanced,25.0,log2,810,COMPLETE
1912,1912,0.14340616062295813,2022-12-02 01:59:00.200811,2022-12-02 01:59:10.281939,0 days 00:00:10.081128,balanced,37.0,log2,760,COMPLETE
1913,1913,0.2873388648388649,2022-12-02 01:59:10.516173,2022-12-02 01:59:20.882952,0 days 00:00:10.366779,balanced,11.0,log2,760,COMPLETE
1914,1914,0.2679166666666667,2022-12-02 01:59:21.133991,2022-12-02 01:59:31.803878,0 days 00:00:10.669887,balanced,4.0,log2,810,COMPLETE
1915,1915,0.16721872271022756,2022-12-02 01:59:32.036357,2022-12-02 01:59:43.908736,0 days 00:00:11.872379,balanced,18.0,0.9,760,COMPLETE
1916,1916,0.1523473974388301,2022-12-02 01:59:44.140945,2022-12-02 01:59:54.602523,0 days 00:00:10.461578,balanced,30.0,log2,860,COMPLETE
1917,1917,0.2672718253968254,2022-12-02 01:59:54.850865,2022-12-02 02:00:05.240912,0 days 00:00:10.390047,balanced,5.0,log2,760,COMPLETE
1918,1918,0.14657944281080848,2022-12-02 02:00:05.473020,2022-12-02 02:00:15.570140,0 days 00:00:10.097120,balanced,35.0,log2,810,COMPLETE
1919,1919,0.28280092592592593,2022-12-02 02:00:15.817249,2022-12-02 02:00:25.988750,0 days 00:00:10.171501,balanced,9.0,log2,760,COMPLETE
1920,1920,0.2639787758537758,2022-12-02 02:00:26.223151,2022-12-02 02:00:36.016347,0 days 00:00:09.793196,balanced,6.0,sqrt,760,COMPLETE
1921,1921,0.2678823953823954,2022-12-02 02:00:36.247458,2022-12-02 02:00:46.400859,0 days 00:00:10.153401,balanced,17.0,log2,810,COMPLETE
1922,1922,0.15365526050110623,2022-12-02 02:00:46.642830,2022-12-02 02:00:56.680611,0 days 00:00:10.037781,balanced,38.0,log2,760,COMPLETE
1923,1923,0.2841865079365079,2022-12-02 02:00:56.935252,2022-12-02 02:01:07.309615,0 days 00:00:10.374363,balanced,8.0,log2,760,COMPLETE
1924,1924,0.2891197691197691,2022-12-02 02:01:07.539998,2022-12-02 02:01:17.508000,0 days 00:00:09.968002,balanced,14.0,log2,760,COMPLETE
1925,1925,0.2934523809523809,2022-12-02 02:01:17.750063,2022-12-02 02:01:27.989912,0 days 00:00:10.239849,balanced,12.0,log2,810,COMPLETE
1926,1926,0.17042767013640803,2022-12-02 02:01:28.234284,2022-12-02 02:01:38.970698,0 days 00:00:10.736414,balanced,15.0,0.6,760,COMPLETE
1927,1927,0.2510416666666667,2022-12-02 02:01:39.207014,2022-12-02 02:01:49.788562,0 days 00:00:10.581548,balanced,2.0,log2,760,COMPLETE
1928,1928,0.1497222472839952,2022-12-02 02:01:50.023056,2022-12-02 02:02:00.159778,0 days 00:00:10.136722,balanced,39.0,log2,810,COMPLETE
1929,1929,0.25704501517001516,2022-12-02 02:02:00.400761,2022-12-02 02:02:10.556190,0 days 00:00:10.155429,balanced,19.0,log2,760,COMPLETE
1930,1930,0.22331552752373188,2022-12-02 02:02:10.791753,2022-12-02 02:02:20.635753,0 days 00:00:09.844000,balanced,21.0,log2,760,COMPLETE
1931,1931,0.15760350160778758,2022-12-02 02:02:20.875482,2022-12-02 02:02:31.158576,0 days 00:00:10.283094,balanced,32.0,log2,810,COMPLETE
1932,1932,0.18248980500800888,2022-12-02 02:02:31.395604,2022-12-02 02:02:43.592528,0 days 00:00:12.196924,balanced,16.0,1.0,760,COMPLETE
1933,1933,0.19412558037825395,2022-12-02 02:02:43.838297,2022-12-02 02:02:53.946876,0 days 00:00:10.108579,balanced,24.0,log2,810,COMPLETE
1934,1934,0.12920226950032604,2022-12-02 02:02:54.188162,2022-12-02 02:03:03.698770,0 days 00:00:09.510608,balanced,28.0,sqrt,760,COMPLETE
1935,1935,0.2307912233463704,2022-12-02 02:03:03.939225,2022-12-02 02:03:13.796172,0 days 00:00:09.856947,balanced,22.0,log2,760,COMPLETE
1936,1936,0.2780955387205387,2022-12-02 02:03:14.035229,2022-12-02 02:03:24.158940,0 days 00:00:10.123711,balanced,13.0,log2,760,COMPLETE
1937,1937,0.15906998177943327,2022-12-02 02:03:24.405329,2022-12-02 02:03:34.552924,0 days 00:00:10.147595,balanced,29.0,log2,810,COMPLETE
1938,1938,0.2553006512165995,2022-12-02 02:03:34.787548,2022-12-02 02:03:44.868062,0 days 00:00:10.080514,balanced,20.0,log2,760,COMPLETE
1939,1939,0.26246031746031745,2022-12-02 02:03:45.120896,2022-12-02 02:03:55.627394,0 days 00:00:10.506498,balanced,3.0,log2,760,COMPLETE
1940,1940,0.27956018518518516,2022-12-02 02:03:55.868246,2022-12-02 02:04:06.374237,0 days 00:00:10.505991,balanced,10.0,log2,810,COMPLETE
1941,1941,0.29485780423280417,2022-12-02 02:04:06.614110,2022-12-02 02:04:17.430516,0 days 00:00:10.816406,balanced,10.0,log2,860,COMPLETE
1942,1942,0.17062217470591257,2022-12-02 02:04:17.667063,2022-12-02 02:04:29.473640,0 days 00:00:11.806577,balanced,12.0,0.9,760,COMPLETE
1943,1943,0.29584986772486765,2022-12-02 02:04:29.713266,2022-12-02 02:04:39.747039,0 days 00:00:10.033773,balanced,10.0,log2,710,COMPLETE
1944,1944,0.1767055144603688,2022-12-02 02:04:39.993370,2022-12-02 02:04:51.084536,0 days 00:00:11.091166,balanced,,0.8,710,COMPLETE
1945,1945,0.2956746031746031,2022-12-02 02:04:51.341322,2022-12-02 02:05:01.707391,0 days 00:00:10.366069,balanced,10.0,log2,760,COMPLETE
1946,1946,0.3027017195767196,2022-12-02 02:05:01.950378,2022-12-02 02:05:12.546743,0 days 00:00:10.596365,balanced,1.0,log2,760,COMPLETE
1947,1947,0.29161706349206346,2022-12-02 02:05:12.793023,2022-12-02 02:05:22.845202,0 days 00:00:10.052179,balanced,10.0,log2,710,COMPLETE
1948,1948,0.22765563140563141,2022-12-02 02:05:23.084877,2022-12-02 02:05:32.837425,0 days 00:00:09.752548,balanced,10.0,sqrt,810,COMPLETE
1949,1949,0.28052579365079366,2022-12-02 02:05:33.081471,2022-12-02 02:05:43.412758,0 days 00:00:10.331287,balanced,8.0,log2,760,COMPLETE
1950,1950,0.28454365079365074,2022-12-02 02:05:43.649523,2022-12-02 02:05:54.311601,0 days 00:00:10.662078,balanced,9.0,log2,810,COMPLETE
1951,1951,0.22510035468306686,2022-12-02 02:05:54.556057,2022-12-02 02:06:04.569849,0 days 00:00:10.013792,balanced,23.0,log2,760,COMPLETE
1952,1952,0.15094929025785278,2022-12-02 02:06:04.809857,2022-12-02 02:06:14.662779,0 days 00:00:09.852922,balanced,33.0,log2,710,COMPLETE
1953,1953,0.1663981045212,2022-12-02 02:06:14.908223,2022-12-02 02:06:24.753278,0 days 00:00:09.845055,balanced,27.0,log2,760,COMPLETE
1954,1954,0.1688925635224179,2022-12-02 02:06:24.987134,2022-12-02 02:06:35.907749,0 days 00:00:10.920615,balanced,10.0,0.6,810,COMPLETE
1955,1955,0.27809193121693115,2022-12-02 02:06:36.144813,2022-12-02 02:06:46.195687,0 days 00:00:10.050874,balanced,7.0,log2,710,COMPLETE
1956,1956,0.28421194546194545,2022-12-02 02:06:46.431661,2022-12-02 02:06:56.503386,0 days 00:00:10.071725,balanced,10.0,log2,760,COMPLETE
1957,1957,0.14269389755875433,2022-12-02 02:06:56.736571,2022-12-02 02:07:06.387728,0 days 00:00:09.651157,balanced,34.0,log2,660,COMPLETE
1958,1958,0.28205294705294703,2022-12-02 02:07:06.630148,2022-12-02 02:07:16.471060,0 days 00:00:09.840912,balanced,12.0,log2,710,COMPLETE
1959,1959,0.17926067027781517,2022-12-02 02:07:16.716173,2022-12-02 02:07:27.206006,0 days 00:00:10.489833,balanced,26.0,log2,860,COMPLETE
1960,1960,0.164948213643602,2022-12-02 02:07:27.439709,2022-12-02 02:07:40.255989,0 days 00:00:12.816280,balanced,16.0,1.0,810,COMPLETE
1961,1961,0.2761309523809523,2022-12-02 02:07:40.493022,2022-12-02 02:07:50.610537,0 days 00:00:10.117515,balanced,10.0,log2,760,COMPLETE
1962,1962,0.15366150703059742,2022-12-02 02:07:50.845154,2022-12-02 02:08:00.867726,0 days 00:00:10.022572,balanced,31.0,log2,760,COMPLETE
1963,1963,0.30045063732563726,2022-12-02 02:08:01.103176,2022-12-02 02:08:11.413702,0 days 00:00:10.310526,balanced,10.0,log2,760,COMPLETE
1964,1964,0.2951587301587302,2022-12-02 02:08:11.670016,2022-12-02 02:08:21.818662,0 days 00:00:10.148646,balanced,3.0,sqrt,810,COMPLETE
1965,1965,0.1441398831777419,2022-12-02 02:08:22.060665,2022-12-02 02:08:31.822960,0 days 00:00:09.762295,balanced,36.0,log2,710,COMPLETE
1966,1966,0.2879398148148148,2022-12-02 02:08:32.077051,2022-12-02 02:08:42.321590,0 days 00:00:10.244539,balanced,10.0,log2,760,COMPLETE
1967,1967,0.295922619047619,2022-12-02 02:08:42.563503,2022-12-02 02:08:52.564756,0 days 00:00:10.001253,balanced,10.0,log2,710,COMPLETE
1968,1968,0.25582311207311215,2022-12-02 02:08:52.808973,2022-12-02 02:09:02.954329,0 days 00:00:10.145356,balanced,18.0,log2,810,COMPLETE
1969,1969,0.1427998414749017,2022-12-02 02:09:03.191391,2022-12-02 02:09:12.798633,0 days 00:00:09.607242,balanced,37.0,log2,660,COMPLETE
1970,1970,0.27663359788359787,2022-12-02 02:09:13.056225,2022-12-02 02:09:23.296460,0 days 00:00:10.240235,balanced,10.0,log2,760,COMPLETE
1971,1971,0.21811615344382335,2022-12-02 02:09:23.542344,2022-12-02 02:09:34.984829,0 days 00:00:11.442485,balanced,5.0,0.8,760,COMPLETE
1972,1972,0.17425444341706475,2022-12-02 02:09:35.233786,2022-12-02 02:09:46.759955,0 days 00:00:11.526169,balanced,25.0,0.9,710,COMPLETE
1973,1973,0.28335738335738336,2022-12-02 02:09:47.007498,2022-12-02 02:09:57.101887,0 days 00:00:10.094389,balanced,11.0,log2,710,COMPLETE
1974,1974,0.1580015794509832,2022-12-02 02:09:57.351293,2022-12-02 02:10:07.492853,0 days 00:00:10.141560,balanced,30.0,log2,810,COMPLETE
1975,1975,0.29620039682539673,2022-12-02 02:10:07.741588,2022-12-02 02:10:18.014286,0 days 00:00:10.272698,balanced,10.0,log2,760,COMPLETE
1976,1976,0.26583002645502646,2022-12-02 02:10:18.264029,2022-12-02 02:10:28.644648,0 days 00:00:10.380619,balanced,4.0,log2,760,COMPLETE
1977,1977,0.2923060735560735,2022-12-02 02:10:28.888798,2022-12-02 02:10:38.465788,0 days 00:00:09.576990,balanced,12.0,log2,660,COMPLETE
1978,1978,0.18844084488942603,2022-12-02 02:10:38.717997,2022-12-02 02:10:48.552368,0 days 00:00:09.834371,balanced,17.0,sqrt,810,COMPLETE
1979,1979,0.29780032467532463,2022-12-02 02:10:48.792022,2022-12-02 02:10:58.684070,0 days 00:00:09.892048,balanced,14.0,log2,710,COMPLETE
1980,1980,0.13485564342278003,2022-12-02 02:10:58.932488,2022-12-02 02:11:08.921971,0 days 00:00:09.989483,balanced,35.0,log2,760,COMPLETE
1981,1981,0.2799999999999999,2022-12-02 02:11:09.164330,2022-12-02 02:11:19.298603,0 days 00:00:10.134273,balanced,10.0,log2,710,COMPLETE
1982,1982,0.19676153583920575,2022-12-02 02:11:19.534190,2022-12-02 02:11:30.006420,0 days 00:00:10.472230,balanced,6.0,0.6,760,COMPLETE
1983,1983,0.2777943121693121,2022-12-02 02:11:30.253440,2022-12-02 02:11:40.780698,0 days 00:00:10.527258,balanced,8.0,log2,860,COMPLETE
1984,1984,0.283015873015873,2022-12-02 02:11:41.023141,2022-12-02 02:11:51.388474,0 days 00:00:10.365333,balanced,9.0,log2,760,COMPLETE
1985,1985,0.143698616967987,2022-12-02 02:11:51.623291,2022-12-02 02:12:01.945288,0 days 00:00:10.321997,balanced,38.0,log2,810,COMPLETE
1986,1986,0.2912046055796056,2022-12-02 02:12:02.183032,2022-12-02 02:12:12.234295,0 days 00:00:10.051263,balanced,10.0,log2,760,COMPLETE
1987,1987,0.24933349966244706,2022-12-02 02:12:12.484219,2022-12-02 02:12:22.366718,0 days 00:00:09.882499,balanced,21.0,log2,710,COMPLETE
1988,1988,0.28429563492063487,2022-12-02 02:12:22.613884,2022-12-02 02:12:33.026656,0 days 00:00:10.412772,balanced,10.0,log2,810,COMPLETE
1989,1989,0.1800593632814506,2022-12-02 02:12:33.267679,2022-12-02 02:12:45.603461,0 days 00:00:12.335782,balanced,39.0,1.0,760,COMPLETE
1990,1990,0.2720818302068302,2022-12-02 02:12:45.848026,2022-12-02 02:12:55.672770,0 days 00:00:09.824744,balanced,15.0,log2,710,COMPLETE
1991,1991,0.14662203230592988,2022-12-02 02:12:55.910744,2022-12-02 02:13:05.471073,0 days 00:00:09.560329,balanced,32.0,log2,660,COMPLETE
1992,1992,0.29771164021164015,2022-12-02 02:13:05.717388,2022-12-02 02:13:16.074396,0 days 00:00:10.357008,balanced,10.0,log2,760,COMPLETE
1993,1993,0.23541722166722168,2022-12-02 02:13:16.327898,2022-12-02 02:13:25.527425,0 days 00:00:09.199527,balanced,10.0,sqrt,710,COMPLETE
1994,1994,0.2700664381914382,2022-12-02 02:13:25.771267,2022-12-02 02:13:35.831628,0 days 00:00:10.060361,balanced,16.0,log2,760,COMPLETE
1995,1995,0.1643148385907889,2022-12-02 02:13:36.074581,2022-12-02 02:13:46.424071,0 days 00:00:10.349490,balanced,28.0,log2,810,COMPLETE
1996,1996,0.257706968956969,2022-12-02 02:13:46.668729,2022-12-02 02:13:56.567703,0 days 00:00:09.898974,balanced,19.0,log2,710,COMPLETE
1997,1997,0.2655456349206349,2022-12-02 02:13:56.810294,2022-12-02 02:14:07.400030,0 days 00:00:10.589736,balanced,3.0,log2,760,COMPLETE
1998,1998,0.26201058201058197,2022-12-02 02:14:07.644925,2022-12-02 02:14:18.559606,0 days 00:00:10.914681,balanced,2.0,log2,810,COMPLETE
1999,1999,0.17790320565806,2022-12-02 02:14:18.797101,2022-12-02 02:14:30.251070,0 days 00:00:11.453969,balanced,24.0,0.8,760,COMPLETE
2000,2000,0.2922628066378066,2022-12-02 02:14:30.496594,2022-12-02 02:14:40.476947,0 days 00:00:09.980353,balanced,10.0,log2,710,COMPLETE
2001,2001,0.14401009293974615,2022-12-02 02:14:40.720212,2022-12-02 02:14:50.560222,0 days 00:00:09.840010,balanced,29.0,log2,760,COMPLETE
2002,2002,0.2237719494653069,2022-12-02 02:14:50.806335,2022-12-02 02:15:00.092913,0 days 00:00:09.286578,balanced,22.0,log2,610,COMPLETE
2003,2003,0.2430098605098605,2022-12-02 02:15:00.342754,2022-12-02 02:15:10.376817,0 days 00:00:10.034063,balanced,20.0,log2,760,COMPLETE
2004,2004,0.17664929752915187,2022-12-02 02:15:10.616841,2022-12-02 02:15:22.195920,0 days 00:00:11.579079,balanced,10.0,0.9,710,COMPLETE
2005,2005,0.28761393698893695,2022-12-02 02:15:22.434831,2022-12-02 02:15:32.055387,0 days 00:00:09.620556,balanced,13.0,log2,660,COMPLETE
2006,2006,0.28376954064454063,2022-12-02 02:15:32.300579,2022-12-02 02:15:42.616361,0 days 00:00:10.315782,balanced,12.0,log2,810,COMPLETE
2007,2007,0.29922709235209227,2022-12-02 02:15:42.856885,2022-12-02 02:15:53.116180,0 days 00:00:10.259295,balanced,10.0,log2,760,COMPLETE
2008,2008,0.27707010582010577,2022-12-02 02:15:53.345893,2022-12-02 02:16:03.760447,0 days 00:00:10.414554,balanced,10.0,log2,810,COMPLETE
2009,2009,0.2543187830687831,2022-12-02 02:16:04.007811,2022-12-02 02:16:14.105903,0 days 00:00:10.098092,balanced,1.0,sqrt,710,COMPLETE
2010,2010,0.2873917748917748,2022-12-02 02:16:14.354921,2022-12-02 02:16:24.750761,0 days 00:00:10.395840,balanced,10.0,log2,760,COMPLETE
2011,2011,0.17705991082811473,2022-12-02 02:16:25.007762,2022-12-02 02:16:35.773722,0 days 00:00:10.765960,balanced,9.0,0.6,760,COMPLETE
2012,2012,0.2952612433862434,2022-12-02 02:16:36.020445,2022-12-02 02:16:45.996085,0 days 00:00:09.975640,balanced,10.0,log2,710,COMPLETE
2013,2013,0.27476190476190476,2022-12-02 02:16:46.241906,2022-12-02 02:16:56.929738,0 days 00:00:10.687832,balanced,10.0,log2,860,COMPLETE
2014,2014,0.14571924617433388,2022-12-02 02:16:57.177170,2022-12-02 02:17:07.341430,0 days 00:00:10.164260,balanced,,log2,760,COMPLETE
2015,2015,0.2808763227513228,2022-12-02 02:17:07.582257,2022-12-02 02:17:17.267897,0 days 00:00:09.685640,balanced,7.0,log2,660,COMPLETE
2016,2016,0.27835978835978836,2022-12-02 02:17:17.506211,2022-12-02 02:17:27.567218,0 days 00:00:10.061007,balanced,8.0,log2,710,COMPLETE
2017,2017,0.1774217907227616,2022-12-02 02:17:27.811308,2022-12-02 02:17:40.647470,0 days 00:00:12.836162,balanced,23.0,1.0,810,COMPLETE
2018,2018,0.17115992034708238,2022-12-02 02:17:40.899804,2022-12-02 02:17:51.040088,0 days 00:00:10.140284,balanced,27.0,log2,760,COMPLETE
2019,2019,0.3051785714285714,2022-12-02 02:17:51.284548,2022-12-02 02:18:01.527204,0 days 00:00:10.242656,balanced,10.0,log2,760,COMPLETE
2020,2020,0.284510582010582,2022-12-02 02:18:01.775352,2022-12-02 02:18:11.657400,0 days 00:00:09.882048,balanced,10.0,log2,710,COMPLETE
2021,2021,0.2814559283309283,2022-12-02 02:18:11.900731,2022-12-02 02:18:22.243590,0 days 00:00:10.342859,balanced,10.0,log2,760,COMPLETE
2022,2022,0.28717021404521403,2022-12-02 02:18:22.489272,2022-12-02 02:18:32.602186,0 days 00:00:10.112914,balanced,10.0,log2,710,COMPLETE
2023,2023,0.23065591815591815,2022-12-02 02:18:32.849265,2022-12-02 02:18:42.258915,0 days 00:00:09.409650,balanced,10.0,sqrt,760,COMPLETE
2024,2024,0.3041666666666666,2022-12-02 02:18:42.503206,2022-12-02 02:18:52.666593,0 days 00:00:10.163387,balanced,10.0,log2,760,COMPLETE
2025,2025,0.2825132275132275,2022-12-02 02:18:52.916284,2022-12-02 02:19:02.889496,0 days 00:00:09.973212,balanced,10.0,log2,760,COMPLETE
2026,2026,0.30432208994708987,2022-12-02 02:19:03.138261,2022-12-02 02:19:13.286921,0 days 00:00:10.148660,balanced,10.0,log2,760,COMPLETE
2027,2027,0.29544702982202986,2022-12-02 02:19:13.526011,2022-12-02 02:19:23.925409,0 days 00:00:10.399398,balanced,10.0,log2,760,COMPLETE
2028,2028,0.278287037037037,2022-12-02 02:19:24.172262,2022-12-02 02:19:34.356158,0 days 00:00:10.183896,balanced,10.0,log2,760,COMPLETE
2029,2029,0.18165989238197974,2022-12-02 02:19:34.596763,2022-12-02 02:19:46.412883,0 days 00:00:11.816120,balanced,10.0,0.9,760,COMPLETE
2030,2030,0.17285168490265573,2022-12-02 02:19:46.656317,2022-12-02 02:19:58.122143,0 days 00:00:11.465826,balanced,10.0,0.8,760,COMPLETE
2031,2031,0.29528439153439157,2022-12-02 02:19:58.482092,2022-12-02 02:20:08.616349,0 days 00:00:10.134257,balanced,10.0,log2,760,COMPLETE
2032,2032,0.2850369769119768,2022-12-02 02:20:08.850645,2022-12-02 02:20:19.107883,0 days 00:00:10.257238,balanced,10.0,log2,760,COMPLETE
2033,2033,0.27986441798941797,2022-12-02 02:20:19.357874,2022-12-02 02:20:29.654199,0 days 00:00:10.296325,balanced,10.0,log2,760,COMPLETE
2034,2034,0.27964947089947084,2022-12-02 02:20:29.901661,2022-12-02 02:20:40.287279,0 days 00:00:10.385618,balanced,10.0,log2,760,COMPLETE
2035,2035,0.27655753968253965,2022-12-02 02:20:40.535449,2022-12-02 02:20:50.620126,0 days 00:00:10.084677,balanced,10.0,log2,760,COMPLETE
2036,2036,0.2778869047619047,2022-12-02 02:20:50.870865,2022-12-02 02:21:01.162251,0 days 00:00:10.291386,balanced,10.0,log2,760,COMPLETE
2037,2037,0.14050099678518435,2022-12-02 02:21:01.411580,2022-12-02 02:21:11.409075,0 days 00:00:09.997495,balanced,33.0,log2,760,COMPLETE
2038,2038,0.14802310458032375,2022-12-02 02:21:11.652934,2022-12-02 02:21:21.158324,0 days 00:00:09.505390,balanced,26.0,sqrt,760,COMPLETE
2039,2039,0.2860780423280423,2022-12-02 02:21:21.411134,2022-12-02 02:21:31.542850,0 days 00:00:10.131716,balanced,10.0,log2,760,COMPLETE
2040,2040,0.1465138887038676,2022-12-02 02:21:31.798672,2022-12-02 02:21:41.841910,0 days 00:00:10.043238,balanced,34.0,log2,760,COMPLETE
2041,2041,0.29143759018759013,2022-12-02 02:21:42.086159,2022-12-02 02:21:52.265340,0 days 00:00:10.179181,balanced,12.0,log2,760,COMPLETE
2042,2042,0.18566725060669007,2022-12-02 02:21:52.504726,2022-12-02 02:22:02.320764,0 days 00:00:09.816038,balanced,25.0,log2,760,COMPLETE
2043,2043,0.1682978128487837,2022-12-02 02:22:02.567423,2022-12-02 02:22:13.380234,0 days 00:00:10.812811,balanced,10.0,0.6,760,COMPLETE
2044,2044,0.14119390526008468,2022-12-02 02:22:13.616499,2022-12-02 02:22:23.626738,0 days 00:00:10.010239,balanced,31.0,log2,760,COMPLETE
2045,2045,0.138492549357549,2022-12-02 02:22:23.865543,2022-12-02 02:22:33.824892,0 days 00:00:09.959349,balanced,36.0,log2,760,COMPLETE
2046,2046,0.17840724045821132,2022-12-02 02:22:34.064273,2022-12-02 02:22:46.452783,0 days 00:00:12.388510,balanced,10.0,1.0,760,COMPLETE
2047,2047,0.13872862913812176,2022-12-02 02:22:46.699768,2022-12-02 02:22:57.064119,0 days 00:00:10.364351,balanced,37.0,log2,810,COMPLETE
2048,2048,0.2651157407407408,2022-12-02 02:22:57.303169,2022-12-02 02:23:07.904203,0 days 00:00:10.601034,balanced,3.0,log2,760,COMPLETE
2049,2049,0.29581679894179885,2022-12-02 02:23:08.159260,2022-12-02 02:23:18.139355,0 days 00:00:09.980095,balanced,11.0,log2,710,COMPLETE
2050,2050,0.28838624338624336,2022-12-02 02:23:18.388725,2022-12-02 02:23:28.839675,0 days 00:00:10.450950,balanced,10.0,log2,810,COMPLETE
2051,2051,0.2605919080919081,2022-12-02 02:23:29.080970,2022-12-02 02:23:39.232495,0 days 00:00:10.151525,balanced,18.0,log2,760,COMPLETE
2052,2052,0.2887608225108225,2022-12-02 02:23:39.479845,2022-12-02 02:23:49.725885,0 days 00:00:10.246040,balanced,10.0,log2,760,COMPLETE
2053,2053,0.23591331000870475,2022-12-02 02:23:49.972275,2022-12-02 02:23:59.456289,0 days 00:00:09.484014,balanced,10.0,sqrt,710,COMPLETE
2054,2054,0.15428387509545857,2022-12-02 02:23:59.695662,2022-12-02 02:24:10.010408,0 days 00:00:10.314746,balanced,30.0,log2,810,COMPLETE
2055,2055,0.2653373015873016,2022-12-02 02:24:10.256011,2022-12-02 02:24:20.763267,0 days 00:00:10.507256,balanced,4.0,log2,760,COMPLETE
2056,2056,0.16274252581291415,2022-12-02 02:24:21.005036,2022-12-02 02:24:32.984859,0 days 00:00:11.979823,balanced,35.0,0.9,760,COMPLETE
2057,2057,0.16598657343196174,2022-12-02 02:24:33.237099,2022-12-02 02:24:44.309660,0 days 00:00:11.072561,balanced,14.0,0.8,710,COMPLETE
2058,2058,0.26862764550264556,2022-12-02 02:24:44.565613,2022-12-02 02:24:55.118888,0 days 00:00:10.553275,balanced,5.0,log2,760,COMPLETE
