,number,value,datetime_start,datetime_complete,duration,params_class_weight,params_max_depth,params_max_features,params_n_estimators,state
1585,1585,0.27714466089466094,2022-12-02 01:02:32.153956,2022-12-02 01:02:42.327510,0 days 00:00:10.173554,balanced,18.0,log2,860,COMPLETE
1586,1586,0.2856646825396826,2022-12-02 01:02:42.557760,2022-12-02 01:02:52.756391,0 days 00:00:10.198631,balanced,10.0,log2,810,COMPLETE
1587,1587,0.13104546896946098,2022-12-02 01:02:52.994564,2022-12-02 01:03:03.025934,0 days 00:00:10.031370,balanced,30.0,log2,760,COMPLETE
1588,1588,0.2689186507936508,2022-12-02 01:03:03.251861,2022-12-02 01:03:13.660108,0 days 00:00:10.408247,balanced,5.0,log2,760,COMPLETE
1589,1589,0.28507605820105814,2022-12-02 01:03:13.896995,2022-12-02 01:03:24.388846,0 days 00:00:10.491851,balanced,10.0,log2,810,COMPLETE
1590,1590,0.2685615079365079,2022-12-02 01:03:24.626178,2022-12-02 01:03:34.993901,0 days 00:00:10.367723,balanced,4.0,log2,760,COMPLETE
1591,1591,0.27128968253968255,2022-12-02 01:03:35.226847,2022-12-02 01:03:45.608246,0 days 00:00:10.381399,balanced,6.0,log2,760,COMPLETE
1592,1592,0.25761183261183257,2022-12-02 01:03:45.850998,2022-12-02 01:03:55.729470,0 days 00:00:09.878472,balanced,17.0,log2,760,COMPLETE
1593,1593,0.28575156325156315,2022-12-02 01:03:55.962237,2022-12-02 01:04:06.370727,0 days 00:00:10.408490,balanced,10.0,log2,810,COMPLETE
1594,1594,0.2777248677248677,2022-12-02 01:04:06.605489,2022-12-02 01:04:16.845480,0 days 00:00:10.239991,balanced,8.0,log2,760,COMPLETE
1595,1595,0.2728382034632034,2022-12-02 01:04:17.081994,2022-12-02 01:04:27.649729,0 days 00:00:10.567735,balanced,10.0,log2,810,COMPLETE
1596,1596,0.14989877847895236,2022-12-02 01:04:27.892692,2022-12-02 01:04:37.775228,0 days 00:00:09.882536,balanced,35.0,log2,760,COMPLETE
1597,1597,0.14570025447610915,2022-12-02 01:04:38.011032,2022-12-02 01:04:48.098877,0 days 00:00:10.087845,balanced,38.0,log2,810,COMPLETE
1598,1598,0.2690767797017796,2022-12-02 01:04:48.337080,2022-12-02 01:04:59.056228,0 days 00:00:10.719148,balanced,10.0,log2,860,COMPLETE
1599,1599,0.2742227679727679,2022-12-02 01:04:59.294923,2022-12-02 01:05:09.224272,0 days 00:00:09.929349,balanced,14.0,log2,760,COMPLETE
1600,1600,0.23268976856476856,2022-12-02 01:05:09.455149,2022-12-02 01:05:19.549484,0 days 00:00:10.094335,balanced,21.0,log2,760,COMPLETE
1601,1601,0.29869708994708993,2022-12-02 01:05:19.779791,2022-12-02 01:05:29.802217,0 days 00:00:10.022426,balanced,15.0,log2,760,COMPLETE
1602,1602,0.19788709152617406,2022-12-02 01:05:30.038837,2022-12-02 01:05:39.863612,0 days 00:00:09.824775,balanced,24.0,log2,760,COMPLETE
1603,1603,0.13101649031497928,2022-12-02 01:05:40.101935,2022-12-02 01:05:50.348708,0 days 00:00:10.246773,balanced,39.0,log2,810,COMPLETE
1604,1604,0.2602275502275502,2022-12-02 01:05:50.583350,2022-12-02 01:06:00.678104,0 days 00:00:10.094754,balanced,19.0,log2,760,COMPLETE
1605,1605,0.29349627224627217,2022-12-02 01:06:00.913505,2022-12-02 01:06:11.026974,0 days 00:00:10.113469,balanced,10.0,log2,760,COMPLETE
1606,1606,0.25842291967291964,2022-12-02 01:06:11.258264,2022-12-02 01:06:21.605121,0 days 00:00:10.346857,balanced,16.0,log2,810,COMPLETE
1607,1607,0.288890392015392,2022-12-02 01:06:21.846934,2022-12-02 01:06:31.975328,0 days 00:00:10.128394,balanced,12.0,log2,760,COMPLETE
1608,1608,0.12735617346701505,2022-12-02 01:06:32.206625,2022-12-02 01:06:42.192639,0 days 00:00:09.986014,balanced,32.0,log2,760,COMPLETE
1609,1609,0.15571257270005603,2022-12-02 01:06:42.421075,2022-12-02 01:06:52.537219,0 days 00:00:10.116144,balanced,28.0,log2,810,COMPLETE
1610,1610,0.2901223544973545,2022-12-02 01:06:52.765044,2022-12-02 01:07:02.962539,0 days 00:00:10.197495,balanced,10.0,log2,760,COMPLETE
1611,1611,0.2600198412698413,2022-12-02 01:07:03.205578,2022-12-02 01:07:14.311774,0 days 00:00:11.106196,balanced,3.0,log2,860,COMPLETE
1612,1612,0.2895111832611833,2022-12-02 01:07:14.547628,2022-12-02 01:07:25.050231,0 days 00:00:10.502603,balanced,10.0,log2,810,COMPLETE
1613,1613,0.28525462962962955,2022-12-02 01:07:25.282536,2022-12-02 01:07:35.535089,0 days 00:00:10.252553,balanced,10.0,log2,760,COMPLETE
1614,1614,0.2903835978835979,2022-12-02 01:07:35.773745,2022-12-02 01:07:45.911288,0 days 00:00:10.137543,balanced,10.0,log2,760,COMPLETE
1615,1615,0.16726620145935986,2022-12-02 01:07:46.148949,2022-12-02 01:07:56.264256,0 days 00:00:10.115307,balanced,29.0,log2,760,COMPLETE
1616,1616,0.2410191892515809,2022-12-02 01:07:56.505305,2022-12-02 01:08:06.651307,0 days 00:00:10.146002,balanced,22.0,log2,810,COMPLETE
1617,1617,0.27,2022-12-02 01:08:06.888514,2022-12-02 01:08:17.384771,0 days 00:00:10.496257,balanced,2.0,log2,760,COMPLETE
1618,1618,0.2884656084656084,2022-12-02 01:08:17.614918,2022-12-02 01:08:27.890357,0 days 00:00:10.275439,balanced,10.0,log2,760,COMPLETE
1619,1619,0.24172101727248782,2022-12-02 01:08:28.136221,2022-12-02 01:08:38.356038,0 days 00:00:10.219817,balanced,20.0,log2,810,COMPLETE
1620,1620,0.2778042328042328,2022-12-02 01:08:38.607253,2022-12-02 01:08:48.840048,0 days 00:00:10.232795,balanced,10.0,log2,760,COMPLETE
1621,1621,0.2684169071669072,2022-12-02 01:08:49.080896,2022-12-02 01:08:59.535681,0 days 00:00:10.454785,balanced,1.0,log2,760,COMPLETE
1622,1622,0.2898024891774892,2022-12-02 01:08:59.770733,2022-12-02 01:09:10.098523,0 days 00:00:10.327790,balanced,10.0,log2,760,COMPLETE
1623,1623,0.282438048063048,2022-12-02 01:09:10.335956,2022-12-02 01:09:20.633846,0 days 00:00:10.297890,balanced,13.0,log2,810,COMPLETE
1624,1624,0.27807539682539684,2022-12-02 01:09:20.864265,2022-12-02 01:09:31.127292,0 days 00:00:10.263027,balanced,8.0,log2,760,COMPLETE
1625,1625,0.13624650525347531,2022-12-02 01:09:31.372921,2022-12-02 01:09:41.506359,0 days 00:00:10.133438,balanced,,log2,810,COMPLETE
1626,1626,0.28195857383357376,2022-12-02 01:09:41.744395,2022-12-02 01:09:52.070660,0 days 00:00:10.326265,balanced,9.0,log2,760,COMPLETE
1627,1627,0.20497512628396536,2022-12-02 01:09:52.311449,2022-12-02 01:10:02.578508,0 days 00:00:10.267059,balanced,23.0,log2,810,COMPLETE
1628,1628,0.27932870370370366,2022-12-02 01:10:02.832969,2022-12-02 01:10:13.126609,0 days 00:00:10.293640,balanced,10.0,log2,760,COMPLETE
1629,1629,0.23581404706404702,2022-12-02 01:10:13.357907,2022-12-02 01:10:22.849773,0 days 00:00:09.491866,balanced,10.0,sqrt,760,COMPLETE
1630,1630,0.1501840750959837,2022-12-02 01:10:23.082456,2022-12-02 01:10:32.936618,0 days 00:00:09.854162,balanced,33.0,log2,710,COMPLETE
1631,1631,0.16546496936806707,2022-12-02 01:10:33.186485,2022-12-02 01:10:43.620424,0 days 00:00:10.433939,balanced,27.0,log2,860,COMPLETE
1632,1632,0.2873115079365079,2022-12-02 01:10:43.861221,2022-12-02 01:10:54.199038,0 days 00:00:10.337817,balanced,10.0,log2,810,COMPLETE
1633,1633,0.2868825156325156,2022-12-02 01:10:54.430007,2022-12-02 01:11:04.724121,0 days 00:00:10.294114,balanced,10.0,log2,760,COMPLETE
1634,1634,0.17032062247467397,2022-12-02 01:11:04.965271,2022-12-02 01:11:15.041178,0 days 00:00:10.075907,balanced,26.0,log2,760,COMPLETE
1635,1635,0.3019561688311688,2022-12-02 01:11:15.282438,2022-12-02 01:11:25.122211,0 days 00:00:09.839773,balanced,12.0,log2,710,COMPLETE
1636,1636,0.260042815980316,2022-12-02 01:11:25.351999,2022-12-02 01:11:35.343781,0 days 00:00:09.991782,balanced,16.0,log2,760,COMPLETE
1637,1637,0.14187288604186132,2022-12-02 01:11:35.575856,2022-12-02 01:11:45.225117,0 days 00:00:09.649261,balanced,34.0,log2,710,COMPLETE
1638,1638,0.2617427248677248,2022-12-02 01:11:45.455387,2022-12-02 01:11:56.285835,0 days 00:00:10.830448,balanced,3.0,log2,810,COMPLETE
1639,1639,0.28006283068783067,2022-12-02 01:11:56.517269,2022-12-02 01:12:06.751046,0 days 00:00:10.233777,balanced,10.0,log2,760,COMPLETE
1640,1640,0.298859126984127,2022-12-02 01:12:06.985817,2022-12-02 01:12:16.840720,0 days 00:00:09.854903,balanced,10.0,log2,710,COMPLETE
1641,1641,0.19225887829141738,2022-12-02 01:12:17.068421,2022-12-02 01:12:26.920951,0 days 00:00:09.852530,balanced,25.0,log2,760,COMPLETE
1642,1642,0.23543599918599917,2022-12-02 01:12:27.161039,2022-12-02 01:12:36.855030,0 days 00:00:09.693991,balanced,10.0,sqrt,860,COMPLETE
1643,1643,0.15193923088386282,2022-12-02 01:12:37.087576,2022-12-02 01:12:47.211892,0 days 00:00:10.124316,balanced,37.0,log2,810,COMPLETE
1644,1644,0.13585845836294586,2022-12-02 01:12:47.445691,2022-12-02 01:12:57.233174,0 days 00:00:09.787483,balanced,36.0,log2,760,COMPLETE
1645,1645,0.28067460317460313,2022-12-02 01:12:57.472906,2022-12-02 01:13:07.281916,0 days 00:00:09.809010,balanced,10.0,log2,710,COMPLETE
1646,1646,0.14644742818131432,2022-12-02 01:13:07.528251,2022-12-02 01:13:17.159802,0 days 00:00:09.631551,balanced,31.0,log2,710,COMPLETE
1647,1647,0.28602272727272726,2022-12-02 01:13:17.392100,2022-12-02 01:13:27.643990,0 days 00:00:10.251890,balanced,10.0,log2,760,COMPLETE
1648,1648,0.29169733044733037,2022-12-02 01:13:27.871805,2022-12-02 01:13:37.897744,0 days 00:00:10.025939,balanced,11.0,log2,760,COMPLETE
1649,1649,0.14632283283661052,2022-12-02 01:13:38.145093,2022-12-02 01:13:47.934921,0 days 00:00:09.789828,balanced,30.0,log2,710,COMPLETE
1650,1650,0.26383627946127947,2022-12-02 01:13:48.167041,2022-12-02 01:13:58.449700,0 days 00:00:10.282659,balanced,18.0,log2,810,COMPLETE
1651,1651,0.28099537037037037,2022-12-02 01:13:58.688195,2022-12-02 01:14:09.125676,0 days 00:00:10.437481,balanced,10.0,log2,810,COMPLETE
1652,1652,0.31316287878787874,2022-12-02 01:14:09.366078,2022-12-02 01:14:19.625834,0 days 00:00:10.259756,balanced,10.0,log2,760,COMPLETE
1653,1653,0.28330071548821545,2022-12-02 01:14:19.869213,2022-12-02 01:14:29.784229,0 days 00:00:09.915016,balanced,17.0,log2,760,COMPLETE
1654,1654,0.15264864848168325,2022-12-02 01:14:30.015156,2022-12-02 01:14:40.155529,0 days 00:00:10.140373,balanced,35.0,log2,760,COMPLETE
1655,1655,0.2936874699374699,2022-12-02 01:14:40.405352,2022-12-02 01:14:49.794819,0 days 00:00:09.389467,balanced,5.0,sqrt,760,COMPLETE
1656,1656,0.2712797619047619,2022-12-02 01:14:50.039495,2022-12-02 01:15:00.726723,0 days 00:00:10.687228,balanced,6.0,log2,810,COMPLETE
1657,1657,0.2813600288600288,2022-12-02 01:15:00.965214,2022-12-02 01:15:11.299514,0 days 00:00:10.334300,balanced,10.0,log2,760,COMPLETE
1658,1658,0.2932705026455026,2022-12-02 01:15:11.553893,2022-12-02 01:15:21.796436,0 days 00:00:10.242543,balanced,10.0,log2,760,COMPLETE
1659,1659,0.14706709812928578,2022-12-02 01:15:22.036878,2022-12-02 01:15:32.336283,0 days 00:00:10.299405,balanced,38.0,log2,810,COMPLETE
1660,1660,0.27020833333333333,2022-12-02 01:15:32.576913,2022-12-02 01:15:43.149798,0 days 00:00:10.572885,balanced,4.0,log2,760,COMPLETE
1661,1661,0.2814254264254264,2022-12-02 01:15:43.380293,2022-12-02 01:15:53.553827,0 days 00:00:10.173534,balanced,14.0,log2,760,COMPLETE
1662,1662,0.2025326979559238,2022-12-02 01:15:53.787522,2022-12-02 01:16:04.024671,0 days 00:00:10.237149,balanced,24.0,log2,810,COMPLETE
1663,1663,0.2721296296296296,2022-12-02 01:16:04.260905,2022-12-02 01:16:14.600441,0 days 00:00:10.339536,balanced,8.0,log2,760,COMPLETE
1664,1664,0.2844642857142856,2022-12-02 01:16:14.829164,2022-12-02 01:16:25.037702,0 days 00:00:10.208538,balanced,10.0,log2,760,COMPLETE
1665,1665,0.14773293899106157,2022-12-02 01:16:25.271962,2022-12-02 01:16:35.411704,0 days 00:00:10.139742,balanced,39.0,log2,810,COMPLETE
1666,1666,0.2769727725977726,2022-12-02 01:16:35.648100,2022-12-02 01:16:45.768112,0 days 00:00:10.120012,balanced,16.0,log2,760,COMPLETE
1667,1667,0.24527504766475355,2022-12-02 01:16:46.000268,2022-12-02 01:16:56.192696,0 days 00:00:10.192428,balanced,21.0,log2,810,COMPLETE
1668,1668,0.19671340670566675,2022-12-02 01:16:56.433812,2022-12-02 01:17:05.626690,0 days 00:00:09.192878,balanced,15.0,sqrt,760,COMPLETE
1669,1669,0.27474537037037033,2022-12-02 01:17:05.867380,2022-12-02 01:17:15.934674,0 days 00:00:10.067294,balanced,10.0,log2,710,COMPLETE
1670,1670,0.23681332556332557,2022-12-02 01:17:16.172026,2022-12-02 01:17:26.177232,0 days 00:00:10.005206,balanced,19.0,log2,760,COMPLETE
1671,1671,0.14495038248670047,2022-12-02 01:17:26.418968,2022-12-02 01:17:36.478944,0 days 00:00:10.059976,balanced,32.0,log2,810,COMPLETE
1672,1672,0.2805092592592592,2022-12-02 01:17:36.719058,2022-12-02 01:17:46.873840,0 days 00:00:10.154782,balanced,10.0,log2,760,COMPLETE
1673,1673,0.2938219997594997,2022-12-02 01:17:47.114014,2022-12-02 01:17:56.933733,0 days 00:00:09.819719,balanced,12.0,log2,710,COMPLETE
1674,1674,0.17458450079391696,2022-12-02 01:17:57.174402,2022-12-02 01:18:07.196590,0 days 00:00:10.022188,balanced,28.0,log2,760,COMPLETE
1675,1675,0.2658333333333333,2022-12-02 01:18:07.436766,2022-12-02 01:18:17.893580,0 days 00:00:10.456814,balanced,3.0,log2,760,COMPLETE
1676,1676,0.2893816137566137,2022-12-02 01:18:18.127026,2022-12-02 01:18:28.052355,0 days 00:00:09.925329,balanced,10.0,log2,710,COMPLETE
1677,1677,0.2838657407407407,2022-12-02 01:18:28.273807,2022-12-02 01:18:38.744936,0 days 00:00:10.471129,balanced,10.0,log2,810,COMPLETE
1678,1678,0.24270996364746358,2022-12-02 01:18:38.985277,2022-12-02 01:18:48.836245,0 days 00:00:09.850968,balanced,20.0,log2,760,COMPLETE
1679,1679,0.2383479247202073,2022-12-02 01:18:49.070922,2022-12-02 01:18:58.891535,0 days 00:00:09.820613,balanced,22.0,log2,710,COMPLETE
1680,1680,0.21579240204240202,2022-12-02 01:18:59.131842,2022-12-02 01:19:09.010890,0 days 00:00:09.879048,balanced,13.0,sqrt,860,COMPLETE
1681,1681,0.15713597203397303,2022-12-02 01:19:09.243314,2022-12-02 01:19:19.108278,0 days 00:00:09.864964,balanced,29.0,log2,810,COMPLETE
1682,1682,0.27362433862433855,2022-12-02 01:19:19.346867,2022-12-02 01:19:29.563353,0 days 00:00:10.216486,balanced,10.0,log2,760,COMPLETE
1683,1683,0.28514550264550265,2022-12-02 01:19:29.800855,2022-12-02 01:19:39.708301,0 days 00:00:09.907446,balanced,10.0,log2,710,COMPLETE
1684,1684,0.298125,2022-12-02 01:19:39.947531,2022-12-02 01:19:49.899148,0 days 00:00:09.951617,balanced,10.0,log2,760,COMPLETE
1685,1685,0.2554166666666666,2022-12-02 01:19:50.122446,2022-12-02 01:20:00.656221,0 days 00:00:10.533775,balanced,2.0,log2,760,COMPLETE
1686,1686,0.2815749759499759,2022-12-02 01:20:00.890593,2022-12-02 01:20:11.181470,0 days 00:00:10.290877,balanced,10.0,log2,810,COMPLETE
1687,1687,0.2804701779701779,2022-12-02 01:20:11.427273,2022-12-02 01:20:21.664150,0 days 00:00:10.236877,balanced,1.0,log2,710,COMPLETE
1688,1688,0.27701058201058204,2022-12-02 01:20:21.899964,2022-12-02 01:20:32.201942,0 days 00:00:10.301978,balanced,8.0,log2,760,COMPLETE
1689,1689,0.2966378066378066,2022-12-02 01:20:32.442471,2022-12-02 01:20:42.401428,0 days 00:00:09.958957,balanced,10.0,log2,710,COMPLETE
1690,1690,0.27786044973544977,2022-12-02 01:20:42.633007,2022-12-02 01:20:53.009368,0 days 00:00:10.376361,balanced,9.0,log2,760,COMPLETE
1691,1691,0.2857275132275131,2022-12-02 01:20:53.248600,2022-12-02 01:21:03.700265,0 days 00:00:10.451665,balanced,10.0,log2,810,COMPLETE
1692,1692,0.27462632275132276,2022-12-02 01:21:03.938802,2022-12-02 01:21:13.958550,0 days 00:00:10.019748,balanced,10.0,log2,710,COMPLETE
1693,1693,0.23040491915491912,2022-12-02 01:21:14.191435,2022-12-02 01:21:23.659303,0 days 00:00:09.467868,balanced,10.0,sqrt,760,COMPLETE
1694,1694,0.1382117274001592,2022-12-02 01:21:23.892631,2022-12-02 01:21:33.705476,0 days 00:00:09.812845,balanced,,log2,710,COMPLETE
1695,1695,0.18005626231938276,2022-12-02 01:21:33.940130,2022-12-02 01:21:44.242530,0 days 00:00:10.302400,balanced,27.0,log2,810,COMPLETE
1696,1696,0.2487976948574774,2022-12-02 01:21:44.480281,2022-12-02 01:21:54.422800,0 days 00:00:09.942519,balanced,16.0,log2,760,COMPLETE
1697,1697,0.221507133804934,2022-12-02 01:21:54.671069,2022-12-02 01:22:04.766157,0 days 00:00:10.095088,balanced,23.0,log2,760,COMPLETE
1698,1698,0.29031355218855215,2022-12-02 01:22:05.005756,2022-12-02 01:22:14.836497,0 days 00:00:09.830741,balanced,12.0,log2,710,COMPLETE
1699,1699,0.136901098298034,2022-12-02 01:22:15.074096,2022-12-02 01:22:25.346477,0 days 00:00:10.272381,balanced,34.0,log2,860,COMPLETE
1700,1700,0.18611010959117827,2022-12-02 01:22:25.582197,2022-12-02 01:22:35.587605,0 days 00:00:10.005408,balanced,26.0,log2,760,COMPLETE
1701,1701,0.18160682693709268,2022-12-02 01:22:35.819915,2022-12-02 01:22:46.044930,0 days 00:00:10.225015,balanced,25.0,log2,810,COMPLETE
1702,1702,0.3003703703703703,2022-12-02 01:22:46.293184,2022-12-02 01:22:56.160084,0 days 00:00:09.866900,balanced,10.0,log2,710,COMPLETE
1703,1703,0.2631051587301587,2022-12-02 01:22:56.402772,2022-12-02 01:23:06.934328,0 days 00:00:10.531556,balanced,3.0,log2,760,COMPLETE
1704,1704,0.1314003540571776,2022-12-02 01:23:07.166403,2022-12-02 01:23:17.225537,0 days 00:00:10.059134,balanced,33.0,log2,760,COMPLETE
1705,1705,0.2928968253968253,2022-12-02 01:23:17.465142,2022-12-02 01:23:27.394486,0 days 00:00:09.929344,balanced,10.0,log2,710,COMPLETE
1706,1706,0.1422037485892396,2022-12-02 01:23:27.627931,2022-12-02 01:23:37.099727,0 days 00:00:09.471796,balanced,31.0,sqrt,810,COMPLETE
1707,1707,0.13212150966314956,2022-12-02 01:23:37.340558,2022-12-02 01:23:47.334289,0 days 00:00:09.993731,balanced,37.0,log2,760,COMPLETE
1708,1708,0.2903382034632035,2022-12-02 01:23:47.565219,2022-12-02 01:23:57.710700,0 days 00:00:10.145481,balanced,10.0,log2,760,COMPLETE
1709,1709,0.28482142857142856,2022-12-02 01:23:57.951373,2022-12-02 01:24:07.877281,0 days 00:00:09.925908,balanced,10.0,log2,710,COMPLETE
1710,1710,0.13462735059272216,2022-12-02 01:24:08.121735,2022-12-02 01:24:18.155654,0 days 00:00:10.033919,balanced,36.0,log2,810,COMPLETE
1711,1711,0.2794516594516594,2022-12-02 01:24:18.393682,2022-12-02 01:24:28.720735,0 days 00:00:10.327053,balanced,10.0,log2,760,COMPLETE
1712,1712,0.2960831529581529,2022-12-02 01:24:28.952630,2022-12-02 01:24:38.613248,0 days 00:00:09.660618,balanced,10.0,log2,710,COMPLETE
1713,1713,0.15929573466958197,2022-12-02 01:24:38.850100,2022-12-02 01:24:49.218239,0 days 00:00:10.368139,balanced,30.0,log2,860,COMPLETE
1714,1714,0.26547288359788357,2022-12-02 01:24:49.458018,2022-12-02 01:24:59.673543,0 days 00:00:10.215525,balanced,4.0,log2,760,COMPLETE
1715,1715,0.27604497354497354,2022-12-02 01:24:59.914147,2022-12-02 01:25:10.473140,0 days 00:00:10.558993,balanced,10.0,log2,810,COMPLETE
1716,1716,0.2812117498514557,2022-12-02 01:25:10.715752,2022-12-02 01:25:20.576857,0 days 00:00:09.861105,balanced,11.0,log2,710,COMPLETE
1717,1717,0.2684788359788359,2022-12-02 01:25:20.812013,2022-12-02 01:25:31.220859,0 days 00:00:10.408846,balanced,5.0,log2,760,COMPLETE
1718,1718,0.27341931216931215,2022-12-02 01:25:31.450461,2022-12-02 01:25:42.003121,0 days 00:00:10.552660,balanced,8.0,log2,810,COMPLETE
1719,1719,0.19300783586812234,2022-12-02 01:25:42.229044,2022-12-02 01:25:51.335974,0 days 00:00:09.106930,balanced,17.0,sqrt,710,COMPLETE
1720,1720,0.2591047378547378,2022-12-02 01:25:51.575936,2022-12-02 01:26:01.704221,0 days 00:00:10.128285,balanced,18.0,log2,760,COMPLETE
1721,1721,0.30001410626410624,2022-12-02 01:26:01.943953,2022-12-02 01:26:11.983779,0 days 00:00:10.039826,balanced,14.0,log2,760,COMPLETE
1722,1722,0.14144256722617846,2022-12-02 01:26:12.230829,2022-12-02 01:26:21.824564,0 days 00:00:09.593735,balanced,35.0,log2,710,COMPLETE
1723,1723,0.2818948412698412,2022-12-02 01:26:22.062696,2022-12-02 01:26:32.389965,0 days 00:00:10.327269,balanced,6.0,log2,760,COMPLETE
1724,1724,0.140483373121966,2022-12-02 01:26:32.631013,2022-12-02 01:26:42.792687,0 days 00:00:10.161674,balanced,38.0,log2,810,COMPLETE
1725,1725,0.2856265031265031,2022-12-02 01:26:43.039729,2022-12-02 01:26:53.122714,0 days 00:00:10.082985,balanced,10.0,log2,760,COMPLETE
1726,1726,0.19868274833899519,2022-12-02 01:26:53.357368,2022-12-02 01:27:03.236715,0 days 00:00:09.879347,balanced,24.0,log2,710,COMPLETE
1727,1727,0.2870800264550264,2022-12-02 01:27:03.477371,2022-12-02 01:27:13.941121,0 days 00:00:10.463750,balanced,10.0,log2,810,COMPLETE
1728,1728,0.24284534284295528,2022-12-02 01:27:14.180528,2022-12-02 01:27:24.230459,0 days 00:00:10.049931,balanced,21.0,log2,760,COMPLETE
1729,1729,0.29549362674362667,2022-12-02 01:27:24.475144,2022-12-02 01:27:34.412804,0 days 00:00:09.937660,balanced,10.0,log2,710,COMPLETE
1730,1730,0.26156348961496023,2022-12-02 01:27:34.647735,2022-12-02 01:27:44.693635,0 days 00:00:10.045900,balanced,19.0,log2,760,COMPLETE
1731,1731,0.15715026721263342,2022-12-02 01:27:44.946100,2022-12-02 01:27:54.635460,0 days 00:00:09.689360,balanced,32.0,log2,710,COMPLETE
1732,1732,0.14346551332089957,2022-12-02 01:27:54.870274,2022-12-02 01:28:04.369293,0 days 00:00:09.499019,balanced,39.0,sqrt,760,COMPLETE
1733,1733,0.2672814454064454,2022-12-02 01:28:04.607170,2022-12-02 01:28:14.914763,0 days 00:00:10.307593,balanced,16.0,log2,810,COMPLETE
1734,1734,0.2800965007215007,2022-12-02 01:28:15.156877,2022-12-02 01:28:25.427973,0 days 00:00:10.271096,balanced,10.0,log2,760,COMPLETE
1735,1735,0.27162457912457916,2022-12-02 01:28:25.667413,2022-12-02 01:28:35.422127,0 days 00:00:09.754714,balanced,15.0,log2,710,COMPLETE
1736,1736,0.1561430344481841,2022-12-02 01:28:35.662791,2022-12-02 01:28:45.864950,0 days 00:00:10.202159,balanced,28.0,log2,810,COMPLETE
1737,1737,0.28287307599807604,2022-12-02 01:28:46.105057,2022-12-02 01:28:56.025674,0 days 00:00:09.920617,balanced,13.0,log2,710,COMPLETE
1738,1738,0.28806878306878303,2022-12-02 01:28:56.266785,2022-12-02 01:29:06.287288,0 days 00:00:10.020503,balanced,12.0,log2,760,COMPLETE
1739,1739,0.27041666666666664,2022-12-02 01:29:06.520942,2022-12-02 01:29:17.024017,0 days 00:00:10.503075,balanced,3.0,log2,760,COMPLETE
1740,1740,0.285675505050505,2022-12-02 01:29:17.266642,2022-12-02 01:29:27.658487,0 days 00:00:10.391845,balanced,10.0,log2,810,COMPLETE
1741,1741,0.27344246031746033,2022-12-02 01:29:27.910483,2022-12-02 01:29:38.022194,0 days 00:00:10.111711,balanced,2.0,log2,710,COMPLETE
1742,1742,0.28340668590668583,2022-12-02 01:29:38.264269,2022-12-02 01:29:48.593113,0 days 00:00:10.328844,balanced,10.0,log2,760,COMPLETE
