,number,value,datetime_start,datetime_complete,duration,params_class_weight,params_max_depth,params_max_features,params_n_estimators,state
2059,2059,0.2902645502645503,2022-12-02 02:24:55.370882,2022-12-02 02:25:05.964320,0 days 00:00:10.593438,balanced,10.0,log2,810,COMPLETE
2060,2060,0.2630969955969956,2022-12-02 02:25:06.216102,2022-12-02 02:25:16.014131,0 days 00:00:09.798029,balanced,17.0,log2,710,COMPLETE
2061,2061,0.296377442002442,2022-12-02 02:25:16.265225,2022-12-02 02:25:26.506369,0 days 00:00:10.241144,balanced,10.0,log2,760,COMPLETE
2062,2062,0.28295063732563736,2022-12-02 02:25:26.764118,2022-12-02 02:25:37.081892,0 days 00:00:10.317774,balanced,10.0,log2,760,COMPLETE
2063,2063,0.2833002645502646,2022-12-02 02:25:37.319136,2022-12-02 02:25:47.927597,0 days 00:00:10.608461,balanced,9.0,log2,810,COMPLETE
2064,2064,0.28329113016613017,2022-12-02 02:25:48.171952,2022-12-02 02:25:57.918234,0 days 00:00:09.746282,balanced,12.0,log2,710,COMPLETE
2065,2065,0.27128968253968255,2022-12-02 02:25:58.166924,2022-12-02 02:26:08.547642,0 days 00:00:10.380718,balanced,6.0,log2,760,COMPLETE
2066,2066,0.2737070105820105,2022-12-02 02:26:08.808613,2022-12-02 02:26:19.326107,0 days 00:00:10.517494,balanced,8.0,log2,810,COMPLETE
2067,2067,0.23930124456440244,2022-12-02 02:26:19.585907,2022-12-02 02:26:29.832878,0 days 00:00:10.246971,balanced,21.0,log2,760,COMPLETE
2068,2068,0.17185744406618192,2022-12-02 02:26:30.071594,2022-12-02 02:26:40.465939,0 days 00:00:10.394345,balanced,24.0,0.6,710,COMPLETE
2069,2069,0.20243429743578156,2022-12-02 02:26:40.705251,2022-12-02 02:26:50.324464,0 days 00:00:09.619213,balanced,15.0,sqrt,760,COMPLETE
2070,2070,0.28026875901875903,2022-12-02 02:26:50.565807,2022-12-02 02:27:00.566746,0 days 00:00:10.000939,balanced,10.0,log2,710,COMPLETE
2071,2071,0.26896402208902204,2022-12-02 02:27:00.813379,2022-12-02 02:27:11.251495,0 days 00:00:10.438116,balanced,19.0,log2,810,COMPLETE
2072,2072,0.2937830687830687,2022-12-02 02:27:11.492811,2022-12-02 02:27:21.686846,0 days 00:00:10.194035,balanced,10.0,log2,760,COMPLETE
2073,2073,0.15013156590260623,2022-12-02 02:27:21.929987,2022-12-02 02:27:31.787695,0 days 00:00:09.857708,balanced,38.0,log2,710,COMPLETE
2074,2074,0.17204413237787025,2022-12-02 02:27:32.046655,2022-12-02 02:27:44.333553,0 days 00:00:12.286898,balanced,28.0,1.0,760,COMPLETE
2075,2075,0.29294402356902355,2022-12-02 02:27:44.573824,2022-12-02 02:27:54.714607,0 days 00:00:10.140783,balanced,13.0,log2,760,COMPLETE
2076,2076,0.14375747210250212,2022-12-02 02:27:54.961893,2022-12-02 02:28:05.178061,0 days 00:00:10.216168,balanced,32.0,log2,810,COMPLETE
2077,2077,0.2613789682539682,2022-12-02 02:28:05.432127,2022-12-02 02:28:15.748279,0 days 00:00:10.316152,balanced,2.0,log2,710,COMPLETE
2078,2078,0.14129499068721296,2022-12-02 02:28:16.005160,2022-12-02 02:28:26.044016,0 days 00:00:10.038856,balanced,39.0,log2,760,COMPLETE
2079,2079,0.28875330687830686,2022-12-02 02:28:26.283081,2022-12-02 02:28:36.599309,0 days 00:00:10.316228,balanced,10.0,log2,760,COMPLETE
2080,2080,0.27656084656084656,2022-12-02 02:28:36.839439,2022-12-02 02:28:46.964332,0 days 00:00:10.124893,balanced,10.0,log2,710,COMPLETE
2081,2081,0.2923587061087061,2022-12-02 02:28:47.202746,2022-12-02 02:28:57.645278,0 days 00:00:10.442532,balanced,10.0,log2,810,COMPLETE
2082,2082,0.26316137566137565,2022-12-02 02:28:57.887074,2022-12-02 02:29:08.330318,0 days 00:00:10.443244,balanced,3.0,log2,760,COMPLETE
2083,2083,0.12765060525471558,2022-12-02 02:29:08.566574,2022-12-02 02:29:17.789948,0 days 00:00:09.223374,balanced,29.0,sqrt,710,COMPLETE
2084,2084,0.22936489068370278,2022-12-02 02:29:18.035768,2022-12-02 02:29:28.175010,0 days 00:00:10.139242,balanced,22.0,log2,760,COMPLETE
2085,2085,0.17446345096830532,2022-12-02 02:29:28.425751,2022-12-02 02:29:40.438554,0 days 00:00:12.012803,balanced,10.0,0.9,760,COMPLETE
2086,2086,0.1754422869471413,2022-12-02 02:29:40.686712,2022-12-02 02:29:51.825049,0 days 00:00:11.138337,balanced,20.0,0.8,710,COMPLETE
2087,2087,0.30702471139971144,2022-12-02 02:29:52.074426,2022-12-02 02:30:02.390927,0 days 00:00:10.316501,balanced,12.0,log2,810,COMPLETE
2088,2088,0.2970926295926296,2022-12-02 02:30:02.637473,2022-12-02 02:30:12.996551,0 days 00:00:10.359078,balanced,12.0,log2,810,COMPLETE
2089,2089,0.29747444684944685,2022-12-02 02:30:13.237535,2022-12-02 02:30:23.915034,0 days 00:00:10.677499,balanced,12.0,log2,860,COMPLETE
2090,2090,0.2893193843193843,2022-12-02 02:30:24.167942,2022-12-02 02:30:34.495880,0 days 00:00:10.327938,balanced,12.0,log2,810,COMPLETE
2091,2091,0.2864535233285233,2022-12-02 02:30:34.746647,2022-12-02 02:30:45.176935,0 days 00:00:10.430288,balanced,12.0,log2,810,COMPLETE
2092,2092,0.28446428571428567,2022-12-02 02:30:45.421464,2022-12-02 02:30:55.979837,0 days 00:00:10.558373,balanced,8.0,log2,810,COMPLETE
2093,2093,0.29569382006882,2022-12-02 02:30:56.223997,2022-12-02 02:31:06.766406,0 days 00:00:10.542409,balanced,12.0,log2,810,COMPLETE
2094,2094,0.2860639129389129,2022-12-02 02:31:07.021422,2022-12-02 02:31:17.831814,0 days 00:00:10.810392,balanced,12.0,log2,860,COMPLETE
2095,2095,0.16504606280091721,2022-12-02 02:31:18.076853,2022-12-02 02:31:29.385931,0 days 00:00:11.309078,balanced,12.0,0.6,860,COMPLETE
2096,2096,0.2692757936507937,2022-12-02 02:31:29.639243,2022-12-02 02:31:40.299707,0 days 00:00:10.660464,balanced,7.0,log2,810,COMPLETE
2097,2097,0.28906084656084646,2022-12-02 02:31:40.543280,2022-12-02 02:31:50.958486,0 days 00:00:10.415206,balanced,12.0,log2,810,COMPLETE
2098,2098,0.2903920153920153,2022-12-02 02:31:51.197953,2022-12-02 02:32:01.642778,0 days 00:00:10.444825,balanced,12.0,log2,810,COMPLETE
2099,2099,0.2244417156917157,2022-12-02 02:32:01.880280,2022-12-02 02:32:11.708627,0 days 00:00:09.828347,balanced,12.0,sqrt,860,COMPLETE
2100,2100,0.2802432058682058,2022-12-02 02:32:11.955662,2022-12-02 02:32:22.260220,0 days 00:00:10.304558,balanced,12.0,log2,810,COMPLETE
2101,2101,0.2948556998556998,2022-12-02 02:32:22.501793,2022-12-02 02:32:33.076759,0 days 00:00:10.574966,balanced,12.0,log2,810,COMPLETE
2102,2102,0.1482691139222605,2022-12-02 02:32:33.318411,2022-12-02 02:32:43.572632,0 days 00:00:10.254221,balanced,,log2,810,COMPLETE
2103,2103,0.2866940235690235,2022-12-02 02:32:43.822443,2022-12-02 02:32:54.232545,0 days 00:00:10.410102,balanced,12.0,log2,810,COMPLETE
2104,2104,0.28912788600288597,2022-12-02 02:32:54.478061,2022-12-02 02:33:04.820649,0 days 00:00:10.342588,balanced,12.0,log2,810,COMPLETE
2105,2105,0.17247271022756458,2022-12-02 02:33:05.064393,2022-12-02 02:33:17.849066,0 days 00:00:12.784673,balanced,23.0,1.0,810,COMPLETE
2106,2106,0.2898950817700817,2022-12-02 02:33:18.089631,2022-12-02 02:33:28.847968,0 days 00:00:10.758337,balanced,12.0,log2,860,COMPLETE
2107,2107,0.2932308201058201,2022-12-02 02:33:29.100413,2022-12-02 02:33:39.602458,0 days 00:00:10.502045,balanced,12.0,log2,810,COMPLETE
2108,2108,0.2818458393458393,2022-12-02 02:33:39.849964,2022-12-02 02:33:50.266589,0 days 00:00:10.416625,balanced,12.0,log2,810,COMPLETE
2109,2109,0.27255291005291,2022-12-02 02:33:50.514897,2022-12-02 02:34:01.057659,0 days 00:00:10.542762,balanced,9.0,log2,810,COMPLETE
2110,2110,0.19567939336417822,2022-12-02 02:34:01.304106,2022-12-02 02:34:11.950824,0 days 00:00:10.646718,balanced,25.0,log2,860,COMPLETE
2111,2111,0.2592294973544974,2022-12-02 02:34:12.194124,2022-12-02 02:34:23.074971,0 days 00:00:10.880847,balanced,1.0,log2,810,COMPLETE
2112,2112,0.18460632095340831,2022-12-02 02:34:23.321378,2022-12-02 02:34:35.309063,0 days 00:00:11.987685,balanced,34.0,0.9,760,COMPLETE
2113,2113,0.18013741203061592,2022-12-02 02:34:35.549722,2022-12-02 02:34:47.008259,0 days 00:00:11.458537,balanced,36.0,0.8,760,COMPLETE
2114,2114,0.30147486772486765,2022-12-02 02:34:47.255558,2022-12-02 02:34:57.152628,0 days 00:00:09.897070,balanced,3.0,sqrt,810,COMPLETE
2115,2115,0.15587799430199006,2022-12-02 02:34:57.397782,2022-12-02 02:35:07.384446,0 days 00:00:09.986664,balanced,27.0,log2,760,COMPLETE
2116,2116,0.28891865079365076,2022-12-02 02:35:07.633262,2022-12-02 02:35:18.142368,0 days 00:00:10.509106,balanced,12.0,log2,810,COMPLETE
2117,2117,0.18615593054913443,2022-12-02 02:35:18.395368,2022-12-02 02:35:30.753359,0 days 00:00:12.357991,balanced,31.0,,760,COMPLETE
2118,2118,0.18045618867827604,2022-12-02 02:35:31.002969,2022-12-02 02:35:42.127684,0 days 00:00:11.124715,balanced,30.0,0.7,760,COMPLETE
2119,2119,0.274074074074074,2022-12-02 02:35:42.384408,2022-12-02 02:35:52.800828,0 days 00:00:10.416420,balanced,5.0,log2,760,COMPLETE
2120,2120,0.17849988755378376,2022-12-02 02:35:53.046807,2022-12-02 02:36:03.337562,0 days 00:00:10.290755,balanced,26.0,log2,810,COMPLETE
2121,2121,0.260546663984164,2022-12-02 02:36:03.585777,2022-12-02 02:36:13.430455,0 days 00:00:09.844678,balanced,18.0,log2,760,COMPLETE
2122,2122,0.2740366809116809,2022-12-02 02:36:13.676173,2022-12-02 02:36:23.545142,0 days 00:00:09.868969,balanced,15.0,log2,760,COMPLETE
2123,2123,0.148372281785644,2022-12-02 02:36:23.788462,2022-12-02 02:36:33.901360,0 days 00:00:10.112898,balanced,33.0,log2,810,COMPLETE
2124,2124,0.26699915824915826,2022-12-02 02:36:34.164996,2022-12-02 02:36:44.211859,0 days 00:00:10.046863,balanced,17.0,log2,760,COMPLETE
2125,2125,0.14676673636136578,2022-12-02 02:36:44.460381,2022-12-02 02:36:54.459862,0 days 00:00:09.999481,balanced,37.0,log2,760,COMPLETE
2126,2126,0.28663359788359777,2022-12-02 02:36:54.705417,2022-12-02 02:37:05.083335,0 days 00:00:10.377918,balanced,11.0,log2,810,COMPLETE
2127,2127,0.27623015873015866,2022-12-02 02:37:05.334195,2022-12-02 02:37:15.613935,0 days 00:00:10.279740,balanced,6.0,log2,760,COMPLETE
2128,2128,0.2325211003487703,2022-12-02 02:37:15.853607,2022-12-02 02:37:27.077424,0 days 00:00:11.223817,balanced,4.0,0.6,860,COMPLETE
2129,2129,0.14832169399033207,2022-12-02 02:37:27.324450,2022-12-02 02:37:37.601114,0 days 00:00:10.276664,balanced,35.0,log2,810,COMPLETE
2130,2130,0.13702524429012125,2022-12-02 02:37:37.839324,2022-12-02 02:37:47.982497,0 days 00:00:10.143173,balanced,38.0,log2,760,COMPLETE
2131,2131,0.14685404845240302,2022-12-02 02:37:48.230276,2022-12-02 02:37:57.443075,0 days 00:00:09.212799,balanced,21.0,sqrt,760,COMPLETE
2132,2132,0.28163958726458727,2022-12-02 02:37:57.682889,2022-12-02 02:38:08.045573,0 days 00:00:10.362684,balanced,12.0,log2,810,COMPLETE
2133,2133,0.19765388537105813,2022-12-02 02:38:08.293559,2022-12-02 02:38:18.247535,0 days 00:00:09.953976,balanced,24.0,log2,760,COMPLETE
2134,2134,0.16966134625606383,2022-12-02 02:38:18.500139,2022-12-02 02:38:28.511667,0 days 00:00:10.011528,balanced,28.0,log2,760,COMPLETE
2135,2135,0.2825506553631553,2022-12-02 02:38:28.763106,2022-12-02 02:38:39.307943,0 days 00:00:10.544837,balanced,14.0,log2,810,COMPLETE
2136,2136,0.17656530924128008,2022-12-02 02:38:39.556367,2022-12-02 02:38:51.753251,0 days 00:00:12.196884,balanced,8.0,1.0,760,COMPLETE
2137,2137,0.2917138648388648,2022-12-02 02:38:52.001813,2022-12-02 02:39:02.332199,0 days 00:00:10.330386,balanced,10.0,log2,760,COMPLETE
2138,2138,0.15147450745599755,2022-12-02 02:39:02.582689,2022-12-02 02:39:12.611974,0 days 00:00:10.029285,balanced,39.0,log2,810,COMPLETE
2139,2139,0.31557870370370367,2022-12-02 02:39:12.858074,2022-12-02 02:39:23.641199,0 days 00:00:10.783125,balanced,9.0,log2,860,COMPLETE
2140,2140,0.2796040764790764,2022-12-02 02:39:23.883289,2022-12-02 02:39:34.865701,0 days 00:00:10.982412,balanced,9.0,log2,860,COMPLETE
2141,2141,0.26733134920634927,2022-12-02 02:39:35.112852,2022-12-02 02:39:46.446256,0 days 00:00:11.333404,balanced,2.0,log2,910,COMPLETE
2142,2142,0.28388227513227515,2022-12-02 02:39:46.689117,2022-12-02 02:39:57.577956,0 days 00:00:10.888839,balanced,9.0,log2,860,COMPLETE
2143,2143,0.17209572610058047,2022-12-02 02:39:57.827331,2022-12-02 02:40:10.058116,0 days 00:00:12.230785,balanced,9.0,0.8,860,COMPLETE
2144,2144,0.14478746588184072,2022-12-02 02:40:10.308892,2022-12-02 02:40:20.513671,0 days 00:00:10.204779,balanced,32.0,log2,860,COMPLETE
2145,2145,0.1811380798274002,2022-12-02 02:40:20.760277,2022-12-02 02:40:33.973731,0 days 00:00:13.213454,balanced,9.0,0.9,910,COMPLETE
2146,2146,0.24172059422059416,2022-12-02 02:40:34.222441,2022-12-02 02:40:44.208256,0 days 00:00:09.985815,balanced,9.0,sqrt,910,COMPLETE
2147,2147,0.17102099065084503,2022-12-02 02:40:44.455789,2022-12-02 02:40:57.184625,0 days 00:00:12.728836,balanced,9.0,,810,COMPLETE
2148,2148,0.17935488437308825,2022-12-02 02:40:57.420720,2022-12-02 02:41:09.189702,0 days 00:00:11.768982,balanced,9.0,0.7,860,COMPLETE
2149,2149,0.2749140211640212,2022-12-02 02:41:09.456707,2022-12-02 02:41:20.318957,0 days 00:00:10.862250,balanced,9.0,log2,860,COMPLETE
2150,2150,0.2724173280423281,2022-12-02 02:41:20.568047,2022-12-02 02:41:31.394178,0 days 00:00:10.826131,balanced,9.0,log2,860,COMPLETE
2151,2151,0.2953439153439153,2022-12-02 02:41:31.636098,2022-12-02 02:41:42.200981,0 days 00:00:10.564883,balanced,9.0,log2,810,COMPLETE
2152,2152,0.27814897928868515,2022-12-02 02:41:42.445516,2022-12-02 02:41:52.767628,0 days 00:00:10.322112,balanced,13.0,log2,810,COMPLETE
2153,2153,0.30388888888888876,2022-12-02 02:41:53.007496,2022-12-02 02:42:03.844870,0 days 00:00:10.837374,balanced,9.0,log2,860,COMPLETE
2154,2154,0.2907572751322751,2022-12-02 02:42:04.100452,2022-12-02 02:42:15.015081,0 days 00:00:10.914629,balanced,9.0,log2,860,COMPLETE
2155,2155,0.2908366402116402,2022-12-02 02:42:15.275916,2022-12-02 02:42:25.808480,0 days 00:00:10.532564,balanced,9.0,log2,860,COMPLETE
2156,2156,0.28630952380952374,2022-12-02 02:42:26.055358,2022-12-02 02:42:36.987802,0 days 00:00:10.932444,balanced,9.0,log2,860,COMPLETE
2157,2157,0.2798544973544973,2022-12-02 02:42:37.237041,2022-12-02 02:42:47.954687,0 days 00:00:10.717646,balanced,9.0,log2,860,COMPLETE
2158,2158,0.1674611726371435,2022-12-02 02:42:48.200681,2022-12-02 02:42:59.540767,0 days 00:00:11.340086,balanced,9.0,0.6,860,COMPLETE
2159,2159,0.28067971380471374,2022-12-02 02:42:59.790507,2022-12-02 02:43:11.079097,0 days 00:00:11.288590,balanced,9.0,log2,910,COMPLETE
2160,2160,0.2969246031746031,2022-12-02 02:43:11.324573,2022-12-02 02:43:22.332926,0 days 00:00:11.008353,balanced,9.0,log2,910,COMPLETE
2161,2161,0.16149320962029962,2022-12-02 02:43:22.581526,2022-12-02 02:43:33.000567,0 days 00:00:10.419041,balanced,29.0,log2,860,COMPLETE
2162,2162,0.296167328042328,2022-12-02 02:43:33.252386,2022-12-02 02:43:43.326632,0 days 00:00:10.074246,balanced,3.0,sqrt,810,COMPLETE
2163,2163,0.28561928811928805,2022-12-02 02:43:43.575343,2022-12-02 02:43:54.607027,0 days 00:00:11.031684,balanced,9.0,log2,860,COMPLETE
2164,2164,0.27622023809523805,2022-12-02 02:43:54.848356,2022-12-02 02:44:05.644315,0 days 00:00:10.795959,balanced,9.0,log2,860,COMPLETE
2165,2165,0.2810085978835978,2022-12-02 02:44:05.895596,2022-12-02 02:44:16.680292,0 days 00:00:10.784696,balanced,9.0,log2,860,COMPLETE
2166,2166,0.1818007718189757,2022-12-02 02:44:16.929575,2022-12-02 02:44:30.558943,0 days 00:00:13.629368,balanced,9.0,1.0,910,COMPLETE
2167,2167,0.26862854737854736,2022-12-02 02:44:30.814593,2022-12-02 02:44:41.997828,0 days 00:00:11.183235,balanced,9.0,log2,910,COMPLETE
2168,2168,0.28188492063492054,2022-12-02 02:44:42.258772,2022-12-02 02:44:53.401909,0 days 00:00:11.143137,balanced,9.0,log2,910,COMPLETE
2169,2169,0.2753538359788359,2022-12-02 02:44:53.652725,2022-12-02 02:45:04.460128,0 days 00:00:10.807403,balanced,9.0,log2,860,COMPLETE
2170,2170,0.26106615484904955,2022-12-02 02:45:04.709735,2022-12-02 02:45:15.189076,0 days 00:00:10.479341,balanced,19.0,log2,860,COMPLETE
2171,2171,0.29486592111592114,2022-12-02 02:45:15.439850,2022-12-02 02:45:26.000706,0 days 00:00:10.560856,balanced,12.0,log2,860,COMPLETE
2172,2172,0.28252976190476187,2022-12-02 02:45:26.243112,2022-12-02 02:45:37.127676,0 days 00:00:10.884564,balanced,9.0,log2,860,COMPLETE
2173,2173,0.17406782807268242,2022-12-02 02:45:37.376852,2022-12-02 02:45:50.047031,0 days 00:00:12.670179,balanced,9.0,0.9,860,COMPLETE
2174,2174,0.18120685005393738,2022-12-02 02:45:50.291167,2022-12-02 02:46:02.896068,0 days 00:00:12.604901,balanced,9.0,0.8,910,COMPLETE
2175,2175,0.28315806878306876,2022-12-02 02:46:03.153883,2022-12-02 02:46:14.077154,0 days 00:00:10.923271,balanced,9.0,log2,860,COMPLETE
2176,2176,0.28782076719576716,2022-12-02 02:46:14.326271,2022-12-02 02:46:25.282882,0 days 00:00:10.956611,balanced,9.0,log2,910,COMPLETE
2177,2177,0.2830125661375661,2022-12-02 02:46:25.527802,2022-12-02 02:46:34.790451,0 days 00:00:09.262649,balanced,9.0,log2,560,COMPLETE
2178,2178,0.1876347064029103,2022-12-02 02:46:35.025852,2022-12-02 02:46:46.379604,0 days 00:00:11.353752,balanced,9.0,0.7,810,COMPLETE
2179,2179,0.18506665125597163,2022-12-02 02:46:46.619048,2022-12-02 02:46:59.707118,0 days 00:00:13.088070,balanced,9.0,,860,COMPLETE
2180,2180,0.23875129500129502,2022-12-02 02:46:59.954430,2022-12-02 02:47:09.673123,0 days 00:00:09.718693,balanced,9.0,sqrt,860,COMPLETE
2181,2181,0.22502629843650848,2022-12-02 02:47:09.912087,2022-12-02 02:47:20.345622,0 days 00:00:10.433535,balanced,22.0,log2,860,COMPLETE
2182,2182,0.26044719169719166,2022-12-02 02:47:20.589689,2022-12-02 02:47:31.053582,0 days 00:00:10.463893,balanced,20.0,log2,860,COMPLETE
2183,2183,0.28554921929921917,2022-12-02 02:47:31.303791,2022-12-02 02:47:42.313161,0 days 00:00:11.009370,balanced,12.0,log2,910,COMPLETE
2184,2184,0.27872685185185186,2022-12-02 02:47:42.554690,2022-12-02 02:47:53.239178,0 days 00:00:10.684488,balanced,9.0,log2,860,COMPLETE
2185,2185,0.14131772041057225,2022-12-02 02:47:53.498067,2022-12-02 02:48:03.916542,0 days 00:00:10.418475,balanced,,log2,860,COMPLETE
2186,2186,0.29724537037037035,2022-12-02 02:48:04.162404,2022-12-02 02:48:15.676428,0 days 00:00:11.514024,balanced,1.0,log2,910,COMPLETE
2187,2187,0.16577278798152584,2022-12-02 02:48:15.932215,2022-12-02 02:48:27.328933,0 days 00:00:11.396718,balanced,23.0,0.6,860,COMPLETE
2188,2188,0.2719080687830688,2022-12-02 02:48:27.577213,2022-12-02 02:48:38.306118,0 days 00:00:10.728905,balanced,8.0,log2,860,COMPLETE
2189,2189,0.28304232804232804,2022-12-02 02:48:38.546249,2022-12-02 02:48:49.471937,0 days 00:00:10.925688,balanced,7.0,log2,860,COMPLETE
2190,2190,0.18048598855026646,2022-12-02 02:48:49.723491,2022-12-02 02:49:00.248229,0 days 00:00:10.524738,balanced,25.0,log2,860,COMPLETE
2191,2191,0.1837849948807787,2022-12-02 02:49:00.503334,2022-12-02 02:49:11.114324,0 days 00:00:10.610990,balanced,26.0,log2,860,COMPLETE
2192,2192,0.2866666666666666,2022-12-02 02:49:11.365343,2022-12-02 02:49:22.575933,0 days 00:00:11.210590,balanced,9.0,log2,910,COMPLETE
2193,2193,0.17579281604767039,2022-12-02 02:49:22.812667,2022-12-02 02:49:36.174635,0 days 00:00:13.361968,balanced,27.0,1.0,860,COMPLETE
2194,2194,0.14335500977262644,2022-12-02 02:49:36.426199,2022-12-02 02:49:47.002922,0 days 00:00:10.576723,balanced,36.0,log2,860,COMPLETE
2195,2195,0.13417045157144306,2022-12-02 02:49:47.249265,2022-12-02 02:49:56.888851,0 days 00:00:09.639586,balanced,33.0,sqrt,810,COMPLETE
2196,2196,0.2658333333333333,2022-12-02 02:49:57.142307,2022-12-02 02:50:08.531675,0 days 00:00:11.389368,balanced,3.0,log2,910,COMPLETE
2197,2197,0.26570526695526697,2022-12-02 02:50:08.770206,2022-12-02 02:50:19.550056,0 days 00:00:10.779850,balanced,5.0,log2,810,COMPLETE
2198,2198,0.14773987255364382,2022-12-02 02:50:19.801321,2022-12-02 02:50:30.085877,0 days 00:00:10.284556,balanced,34.0,log2,810,COMPLETE
2199,2199,0.1453063431534356,2022-12-02 02:50:30.331930,2022-12-02 02:50:40.697741,0 days 00:00:10.365811,balanced,37.0,log2,810,COMPLETE
2200,2200,0.2885515873015872,2022-12-02 02:50:40.947673,2022-12-02 02:50:51.428294,0 days 00:00:10.480621,balanced,12.0,log2,810,COMPLETE
2201,2201,0.29315566378066377,2022-12-02 02:50:51.672357,2022-12-02 02:51:02.325582,0 days 00:00:10.653225,balanced,14.0,log2,860,COMPLETE
2202,2202,0.2987872775372776,2022-12-02 02:51:02.578282,2022-12-02 02:51:13.614992,0 days 00:00:11.036710,balanced,11.0,log2,910,COMPLETE
2203,2203,0.2347617763394462,2022-12-02 02:51:13.857014,2022-12-02 02:51:26.081976,0 days 00:00:12.224962,balanced,4.0,0.9,810,COMPLETE
2204,2204,0.1539728554658873,2022-12-02 02:51:26.327600,2022-12-02 02:51:36.616550,0 days 00:00:10.288950,balanced,31.0,log2,810,COMPLETE
2205,2205,0.1833252427184466,2022-12-02 02:51:36.865467,2022-12-02 02:51:48.733379,0 days 00:00:11.867912,balanced,35.0,0.8,810,COMPLETE
2206,2206,0.17605405943391378,2022-12-02 02:51:48.973201,2022-12-02 02:52:02.158402,0 days 00:00:13.185201,balanced,18.0,,860,COMPLETE
2207,2207,0.266984126984127,2022-12-02 02:52:02.404984,2022-12-02 02:52:13.069543,0 days 00:00:10.664559,balanced,6.0,log2,810,COMPLETE
2208,2208,0.17564269019366105,2022-12-02 02:52:13.316719,2022-12-02 02:52:24.443949,0 days 00:00:11.127230,balanced,30.0,0.7,760,COMPLETE
2209,2209,0.27657076719576723,2022-12-02 02:52:24.688796,2022-12-02 02:52:34.878013,0 days 00:00:10.189217,balanced,9.0,log2,760,COMPLETE
2210,2210,0.1497320608816085,2022-12-02 02:52:35.129624,2022-12-02 02:52:45.337851,0 days 00:00:10.208227,balanced,38.0,log2,810,COMPLETE
2211,2211,0.23846445901592958,2022-12-02 02:52:45.583190,2022-12-02 02:52:55.570560,0 days 00:00:09.987370,balanced,21.0,log2,760,COMPLETE
2212,2212,0.13614145127235816,2022-12-02 02:52:55.822398,2022-12-02 02:53:05.566710,0 days 00:00:09.744312,balanced,24.0,sqrt,810,COMPLETE
2213,2213,0.28506518822308297,2022-12-02 02:53:05.816571,2022-12-02 02:53:15.833685,0 days 00:00:10.017114,balanced,12.0,log2,710,COMPLETE
2214,2214,0.25036796536796546,2022-12-02 02:53:16.078158,2022-12-02 02:53:26.306142,0 days 00:00:10.227984,balanced,17.0,log2,760,COMPLETE
2215,2215,0.13164210897876874,2022-12-02 02:53:26.554573,2022-12-02 02:53:36.839350,0 days 00:00:10.284777,balanced,39.0,log2,860,COMPLETE
2216,2216,0.2744597763347763,2022-12-02 02:53:37.091718,2022-12-02 02:53:47.278687,0 days 00:00:10.186969,balanced,15.0,log2,760,COMPLETE
