,number,value,datetime_start,datetime_complete,duration,params_class_weight,params_max_depth,params_max_features,params_n_estimators,state
636,636,0.014563106796116504,2022-12-01 22:22:01.446059,2022-12-01 22:22:08.455610,0 days 00:00:07.009551,,25.0,0.6,60,COMPLETE
637,637,0.15964459084604715,2022-12-01 22:22:08.669832,2022-12-01 22:22:15.730181,0 days 00:00:07.060349,"{0: 1, 1: 100}",,0.7,60,COMPLETE
638,638,0.1898258591462475,2022-12-01 22:22:15.951123,2022-12-01 22:22:23.472572,0 days 00:00:07.521449,balanced,11.0,0.9,210,COMPLETE
639,639,0.16796077978116813,2022-12-01 22:22:23.688499,2022-12-01 22:22:34.275218,0 days 00:00:10.586719,balanced,12.0,1.0,560,COMPLETE
640,640,0.09341770688858067,2022-12-01 22:22:34.497450,2022-12-01 22:22:49.655658,0 days 00:00:15.158208,"{0: 1, 1: 10}",37.0,0.9,860,COMPLETE
641,641,0.06925893820311296,2022-12-01 22:22:49.867542,2022-12-01 22:22:59.741633,0 days 00:00:09.874091,"{0: 1, 1: 10}",24.0,0.6,510,COMPLETE
642,642,0.17634307417681203,2022-12-01 22:22:59.969969,2022-12-01 22:23:09.326693,0 days 00:00:09.356724,"{0: 1, 1: 100}",11.0,0.9,460,COMPLETE
643,643,0.02057038834951456,2022-12-01 22:23:09.541700,2022-12-01 22:23:16.568737,0 days 00:00:07.027037,,29.0,0.7,60,COMPLETE
644,644,0.08320013073047053,2022-12-01 22:23:16.785745,2022-12-01 22:23:23.897621,0 days 00:00:07.111876,,11.0,sqrt,110,COMPLETE
645,645,0.16586406424391859,2022-12-01 22:23:24.116029,2022-12-01 22:23:36.286930,0 days 00:00:12.170901,"{0: 1, 1: 100}",16.0,0.7,960,COMPLETE
646,646,0.054764216366158115,2022-12-01 22:23:36.506365,2022-12-01 22:23:44.872731,0 days 00:00:08.366366,,29.0,0.6,310,COMPLETE
647,647,0.17474051366648452,2022-12-01 22:23:45.090577,2022-12-01 22:23:57.734061,0 days 00:00:12.643484,balanced,20.0,,810,COMPLETE
648,648,0.1705506258843637,2022-12-01 22:23:57.954102,2022-12-01 22:24:07.836172,0 days 00:00:09.882070,"{0: 1, 1: 100}",13.0,0.6,660,COMPLETE
649,649,0.13719063406298024,2022-12-01 22:24:08.050694,2022-12-01 22:24:15.730905,0 days 00:00:07.680211,"{0: 1, 1: 100}",25.0,log2,310,COMPLETE
650,650,0.143761138605192,2022-12-01 22:24:15.957858,2022-12-01 22:24:23.242106,0 days 00:00:07.284248,"{0: 1, 1: 10}",9.0,sqrt,110,COMPLETE
651,651,0.11828105209663656,2022-12-01 22:24:23.458678,2022-12-01 22:24:32.163605,0 days 00:00:08.704927,"{0: 1, 1: 100}",37.0,log2,510,COMPLETE
652,652,0.10390648276570605,2022-12-01 22:24:32.381440,2022-12-01 22:24:49.752713,0 days 00:00:17.371273,"{0: 1, 1: 10}",11.0,,960,COMPLETE
653,653,0.1661631222068115,2022-12-01 22:24:49.972696,2022-12-01 22:24:57.085010,0 days 00:00:07.112314,"{0: 1, 1: 100}",29.0,0.7,110,COMPLETE
654,654,0.030501618122977348,2022-12-01 22:24:57.308244,2022-12-01 22:25:04.638389,0 days 00:00:07.330145,"{0: 1, 1: 10}",31.0,0.6,160,COMPLETE
655,655,0.06118219294190168,2022-12-01 22:25:04.854646,2022-12-01 22:25:13.512762,0 days 00:00:08.658116,"{0: 1, 1: 10}",10.0,0.9,260,COMPLETE
656,656,0.06078074433656958,2022-12-01 22:25:13.727747,2022-12-01 22:25:21.082740,0 days 00:00:07.354993,"{0: 1, 1: 10}",19.0,0.7,160,COMPLETE
657,657,0.02057038834951456,2022-12-01 22:25:21.307440,2022-12-01 22:25:31.247010,0 days 00:00:09.939570,,20.0,0.8,410,COMPLETE
658,658,0.24346336533836527,2022-12-01 22:25:31.466475,2022-12-01 22:25:41.078023,0 days 00:00:09.611548,"{0: 1, 1: 10}",16.0,log2,660,COMPLETE
659,659,0.1843880027739251,2022-12-01 22:25:41.299062,2022-12-01 22:25:48.404163,0 days 00:00:07.105101,balanced,13.0,0.8,110,COMPLETE
660,660,0.1749607990445369,2022-12-01 22:25:48.620171,2022-12-01 22:25:59.885222,0 days 00:00:11.265051,balanced,12.0,,660,COMPLETE
661,661,0.1128481562828916,2022-12-01 22:26:00.105857,2022-12-01 22:26:07.427699,0 days 00:00:07.321842,"{0: 1, 1: 100}",25.0,log2,160,COMPLETE
662,662,0.06025562490368315,2022-12-01 22:26:07.644626,2022-12-01 22:26:18.456615,0 days 00:00:10.811989,"{0: 1, 1: 10}",36.0,0.9,460,COMPLETE
663,663,0.17064397441824627,2022-12-01 22:26:18.666336,2022-12-01 22:26:27.470681,0 days 00:00:08.804345,balanced,30.0,1.0,360,COMPLETE
664,664,0.10856143102854383,2022-12-01 22:26:27.688232,2022-12-01 22:26:35.248016,0 days 00:00:07.559784,,28.0,log2,210,COMPLETE
665,665,0.18194958134278522,2022-12-01 22:26:35.475767,2022-12-01 22:26:47.253744,0 days 00:00:11.777977,balanced,8.0,,710,COMPLETE
666,666,0.1144983818770227,2022-12-01 22:26:47.476505,2022-12-01 22:26:56.202777,0 days 00:00:08.726272,"{0: 1, 1: 10}",8.0,,260,COMPLETE
667,667,0.11029056590780204,2022-12-01 22:26:56.421944,2022-12-01 22:27:03.865008,0 days 00:00:07.443064,"{0: 1, 1: 10}",28.0,log2,210,COMPLETE
668,668,0.17116450274824063,2022-12-01 22:27:04.086047,2022-12-01 22:27:13.698530,0 days 00:00:09.612483,"{0: 1, 1: 100}",36.0,,460,COMPLETE
669,669,0.1512172347609241,2022-12-01 22:27:13.914031,2022-12-01 22:27:20.947918,0 days 00:00:07.033887,"{0: 1, 1: 100}",29.0,0.6,160,COMPLETE
670,670,0.03074433656957929,2022-12-01 22:27:21.165025,2022-12-01 22:27:28.187174,0 days 00:00:07.022149,,34.0,0.8,60,COMPLETE
671,671,0.15917501412647045,2022-12-01 22:27:28.405197,2022-12-01 22:27:35.641355,0 days 00:00:07.236158,balanced,36.0,0.9,160,COMPLETE
672,672,0.09736018004828684,2022-12-01 22:27:35.858594,2022-12-01 22:27:50.526552,0 days 00:00:14.667958,"{0: 1, 1: 10}",20.0,1.0,760,COMPLETE
673,673,0.17633299525896612,2022-12-01 22:27:50.746839,2022-12-01 22:28:02.662619,0 days 00:00:11.915780,balanced,34.0,0.7,910,COMPLETE
674,674,0.2192227400867107,2022-12-01 22:28:02.856994,2022-12-01 22:28:09.994571,0 days 00:00:07.137577,,1.0,sqrt,110,COMPLETE
675,675,0.10120550888044651,2022-12-01 22:28:10.209397,2022-12-01 22:28:17.955616,0 days 00:00:07.746219,"{0: 1, 1: 100}",34.0,sqrt,360,COMPLETE
676,676,0.17307250732008012,2022-12-01 22:28:18.176092,2022-12-01 22:28:25.248094,0 days 00:00:07.072002,"{0: 1, 1: 100}",25.0,0.7,110,COMPLETE
677,677,0.06519012944983818,2022-12-01 22:28:25.468234,2022-12-01 22:28:32.650476,0 days 00:00:07.182242,"{0: 1, 1: 10}",29.0,,110,COMPLETE
678,678,0.1751129154466533,2022-12-01 22:28:32.852295,2022-12-01 22:28:43.861372,0 days 00:00:11.009077,balanced,38.0,0.7,760,COMPLETE
679,679,0.14256229607219464,2022-12-01 22:28:44.082225,2022-12-01 22:28:53.955911,0 days 00:00:09.873686,"{0: 1, 1: 100}",17.0,sqrt,910,COMPLETE
680,680,0.11031939447417397,2022-12-01 22:28:54.181170,2022-12-01 22:29:03.330588,0 days 00:00:09.149418,"{0: 1, 1: 10}",15.0,sqrt,660,COMPLETE
681,681,0.18140121744490678,2022-12-01 22:29:03.555118,2022-12-01 22:29:10.628295,0 days 00:00:07.073177,"{0: 1, 1: 100}",7.0,0.8,60,COMPLETE
682,682,0.16924830832597826,2022-12-01 22:29:10.843026,2022-12-01 22:29:17.877341,0 days 00:00:07.034315,balanced,1.0,,60,COMPLETE
683,683,0.18523655416859303,2022-12-01 22:29:18.098826,2022-12-01 22:29:25.218857,0 days 00:00:07.120031,"{0: 1, 1: 100}",39.0,0.9,110,COMPLETE
684,684,0.09649310371397748,2022-12-01 22:29:25.436578,2022-12-01 22:29:37.170412,0 days 00:00:11.733834,"{0: 1, 1: 10}",15.0,,510,COMPLETE
685,685,0.12284898075506441,2022-12-01 22:29:37.390183,2022-12-01 22:29:47.606421,0 days 00:00:10.216238,,23.0,log2,810,COMPLETE
686,686,0.16802453210220203,2022-12-01 22:29:47.821959,2022-12-01 22:29:55.208171,0 days 00:00:07.386212,balanced,1.0,,210,COMPLETE
687,687,0.18606919577186568,2022-12-01 22:29:55.429378,2022-12-01 22:30:02.639637,0 days 00:00:07.210259,"{0: 1, 1: 10}",3.0,1.0,110,COMPLETE
688,688,0.2861903477680177,2022-12-01 22:30:02.860015,2022-12-01 22:30:09.874059,0 days 00:00:07.014044,balanced,3.0,0.7,10,COMPLETE
689,689,0.07675683182031998,2022-12-01 22:30:10.091346,2022-12-01 22:30:17.732134,0 days 00:00:07.640788,"{0: 1, 1: 10}",36.0,sqrt,310,COMPLETE
690,690,0.01932038834951456,2022-12-01 22:30:17.953523,2022-12-01 22:30:25.911042,0 days 00:00:07.957519,,39.0,0.8,210,COMPLETE
691,691,0.1617841323545207,2022-12-01 22:30:26.129076,2022-12-01 22:30:36.058133,0 days 00:00:09.929057,balanced,16.0,0.7,610,COMPLETE
692,692,0.19073181342962617,2022-12-01 22:30:36.271954,2022-12-01 22:30:45.303893,0 days 00:00:09.031939,"{0: 1, 1: 100}",13.0,sqrt,660,COMPLETE
693,693,0.16293695741511274,2022-12-01 22:30:45.516386,2022-12-01 22:30:53.525319,0 days 00:00:08.008933,balanced,26.0,1.0,260,COMPLETE
694,694,0.17522473930240917,2022-12-01 22:30:53.740890,2022-12-01 22:31:02.386778,0 days 00:00:08.645888,"{0: 1, 1: 100}",2.0,1.0,360,COMPLETE
695,695,0.16963991801977238,2022-12-01 22:31:02.611307,2022-12-01 22:31:13.906582,0 days 00:00:11.295275,"{0: 1, 1: 100}",10.0,0.7,810,COMPLETE
696,696,0.014563106796116504,2022-12-01 22:31:14.122904,2022-12-01 22:31:27.294525,0 days 00:00:13.171621,,15.0,1.0,610,COMPLETE
697,697,0.014563106796116504,2022-12-01 22:31:27.509070,2022-12-01 22:31:37.537698,0 days 00:00:10.028628,,35.0,0.8,410,COMPLETE
698,698,0.17275639543843427,2022-12-01 22:31:37.754934,2022-12-01 22:31:48.324329,0 days 00:00:10.569395,"{0: 1, 1: 10}",6.0,,410,COMPLETE
699,699,0.06889120049314224,2022-12-01 22:31:48.554291,2022-12-01 22:31:57.173563,0 days 00:00:08.619272,"{0: 1, 1: 10}",21.0,0.7,310,COMPLETE
700,700,0.1567186777623671,2022-12-01 22:31:57.395521,2022-12-01 22:32:04.633715,0 days 00:00:07.238194,"{0: 1, 1: 100}",21.0,1.0,160,COMPLETE
701,701,0.05987401756819233,2022-12-01 22:32:04.855696,2022-12-01 22:32:18.617861,0 days 00:00:13.762165,,38.0,0.8,760,COMPLETE
702,702,0.04484223300970874,2022-12-01 22:32:18.831442,2022-12-01 22:32:26.067445,0 days 00:00:07.236003,"{0: 1, 1: 10}",25.0,0.9,110,COMPLETE
703,703,0.1727398931525145,2022-12-01 22:32:26.289300,2022-12-01 22:32:36.285074,0 days 00:00:09.995774,balanced,34.0,0.8,560,COMPLETE
704,704,0.22523721648721645,2022-12-01 22:32:36.501263,2022-12-01 22:32:45.095040,0 days 00:00:08.593777,balanced,12.0,sqrt,510,COMPLETE
705,705,0.19511891919658905,2022-12-01 22:32:45.289943,2022-12-01 22:32:58.207048,0 days 00:00:12.917105,"{0: 1, 1: 100}",6.0,1.0,860,COMPLETE
706,706,0.18410104279036316,2022-12-01 22:32:58.429142,2022-12-01 22:33:09.798436,0 days 00:00:11.369294,balanced,8.0,0.8,760,COMPLETE
707,707,0.10339921405455385,2022-12-01 22:33:10.014524,2022-12-01 22:33:17.031996,0 days 00:00:07.017472,"{0: 1, 1: 10}",30.0,sqrt,60,COMPLETE
708,708,0.09385118130769439,2022-12-01 22:33:17.246635,2022-12-01 22:33:26.159944,0 days 00:00:08.913309,,23.0,sqrt,610,COMPLETE
709,709,0.014563106796116504,2022-12-01 22:33:26.380424,2022-12-01 22:33:38.282339,0 days 00:00:11.901915,,29.0,0.7,660,COMPLETE
710,710,0.09109695253505933,2022-12-01 22:33:38.502412,2022-12-01 22:33:51.434367,0 days 00:00:12.931955,"{0: 1, 1: 10}",26.0,,610,COMPLETE
711,711,0.1767054735986775,2022-12-01 22:33:51.654003,2022-12-01 22:34:01.547628,0 days 00:00:09.893625,"{0: 1, 1: 100}",9.0,0.6,660,COMPLETE
712,712,0.27565145502645505,2022-12-01 22:34:01.770158,2022-12-01 22:34:09.533081,0 days 00:00:07.762923,balanced,5.0,log2,260,COMPLETE
713,713,0.09341924232204851,2022-12-01 22:34:09.752510,2022-12-01 22:34:18.056404,0 days 00:00:08.303894,,30.0,sqrt,460,COMPLETE
714,714,0.07779598166127293,2022-12-01 22:34:18.280192,2022-12-01 22:34:27.672017,0 days 00:00:09.391825,"{0: 1, 1: 10}",12.0,0.8,360,COMPLETE
715,715,0.15921574639059982,2022-12-01 22:34:27.889345,2022-12-01 22:34:41.255467,0 days 00:00:13.366122,,2.0,0.9,760,COMPLETE
716,716,0.16231263163301998,2022-12-01 22:34:41.474744,2022-12-01 22:34:51.091155,0 days 00:00:09.616411,"{0: 1, 1: 100}",31.0,0.7,560,COMPLETE
717,717,0.19902103559870551,2022-12-01 22:34:51.318771,2022-12-01 22:35:01.939717,0 days 00:00:10.620946,"{0: 1, 1: 100}",6.0,0.8,660,COMPLETE
718,718,0.1217310902988682,2022-12-01 22:35:02.161493,2022-12-01 22:35:10.145981,0 days 00:00:07.984488,"{0: 1, 1: 10}",30.0,log2,360,COMPLETE
719,719,0.17597833396377086,2022-12-01 22:35:10.369540,2022-12-01 22:35:21.540039,0 days 00:00:11.170499,"{0: 1, 1: 100}",8.0,0.6,860,COMPLETE
720,720,0.1383295704654928,2022-12-01 22:35:21.759939,2022-12-01 22:35:34.139400,0 days 00:00:12.379461,"{0: 1, 1: 10}",6.0,0.6,810,COMPLETE
721,721,0.2932539682539682,2022-12-01 22:35:34.358072,2022-12-01 22:35:43.815959,0 days 00:00:09.457887,"{0: 1, 1: 100}",10.0,log2,610,COMPLETE
722,722,0.12394147788565264,2022-12-01 22:35:44.034965,2022-12-01 22:35:51.001812,0 days 00:00:06.966847,"{0: 1, 1: 100}",34.0,0.9,10,COMPLETE
723,723,0.028418284789644012,2022-12-01 22:35:51.220494,2022-12-01 22:36:04.663556,0 days 00:00:13.443062,,35.0,0.7,810,COMPLETE
724,724,0.17067505265320798,2022-12-01 22:36:04.880922,2022-12-01 22:36:13.173619,0 days 00:00:08.292697,"{0: 1, 1: 100}",39.0,0.7,360,COMPLETE
725,725,0.24480264253290568,2022-12-01 22:36:13.389509,2022-12-01 22:36:24.233760,0 days 00:00:10.844251,"{0: 1, 1: 10}",17.0,log2,860,COMPLETE
726,726,0.0942417938049006,2022-12-01 22:36:24.457760,2022-12-01 22:36:41.133280,0 days 00:00:16.675520,"{0: 1, 1: 10}",14.0,,910,COMPLETE
727,727,0.05571129989212513,2022-12-01 22:36:41.350231,2022-12-01 22:36:52.355320,0 days 00:00:11.005089,"{0: 1, 1: 10}",11.0,0.8,510,COMPLETE
728,728,0.09024928203012032,2022-12-01 22:36:52.573113,2022-12-01 22:37:01.096191,0 days 00:00:08.523078,,24.0,sqrt,510,COMPLETE
729,729,0.035258899676375396,2022-12-01 22:37:01.323882,2022-12-01 22:37:14.664832,0 days 00:00:13.340950,,31.0,0.7,810,COMPLETE
730,730,0.13974622321758012,2022-12-01 22:37:14.885655,2022-12-01 22:37:23.989533,0 days 00:00:09.103878,balanced,38.0,sqrt,660,COMPLETE
731,731,0.1319897240222137,2022-12-01 22:37:24.208558,2022-12-01 22:37:34.410871,0 days 00:00:10.202313,,24.0,log2,760,COMPLETE
732,732,0.10612686814282346,2022-12-01 22:37:34.713109,2022-12-01 22:37:44.582352,0 days 00:00:09.869243,,23.0,sqrt,960,COMPLETE
733,733,0.20268967997123336,2022-12-01 22:37:44.842057,2022-12-01 22:37:54.130020,0 days 00:00:09.287963,balanced,6.0,1.0,410,COMPLETE
734,734,0.027168284789644014,2022-12-01 22:37:54.347765,2022-12-01 22:38:07.386429,0 days 00:00:13.038664,,22.0,0.6,860,COMPLETE
735,735,0.16422606205373197,2022-12-01 22:38:07.606433,2022-12-01 22:38:18.043985,0 days 00:00:10.437552,,2.0,1.0,410,COMPLETE
736,736,0.2203636281912981,2022-12-01 22:38:18.290144,2022-12-01 22:38:31.474904,0 days 00:00:13.184760,balanced,5.0,0.9,960,COMPLETE
737,737,0.09459893666204347,2022-12-01 22:38:31.694176,2022-12-01 22:38:43.012081,0 days 00:00:11.317905,"{0: 1, 1: 10}",10.0,0.6,660,COMPLETE
738,738,0.13497970456584202,2022-12-01 22:38:43.225429,2022-12-01 22:38:52.989188,0 days 00:00:09.763759,"{0: 1, 1: 100}",28.0,log2,610,COMPLETE
739,739,0.07171992988133764,2022-12-01 22:38:53.206473,2022-12-01 22:39:03.217632,0 days 00:00:10.011159,"{0: 1, 1: 10}",16.0,,360,COMPLETE
740,740,0.2574050024050024,2022-12-01 22:39:03.430254,2022-12-01 22:39:10.630564,0 days 00:00:07.200310,"{0: 1, 1: 10}",6.0,log2,110,COMPLETE
741,741,0.05416897827092002,2022-12-01 22:39:10.850331,2022-12-01 22:39:19.763503,0 days 00:00:08.913172,"{0: 1, 1: 10}",35.0,0.8,310,COMPLETE
742,742,0.042758899676375396,2022-12-01 22:39:19.983203,2022-12-01 22:39:27.303319,0 days 00:00:07.320116,,21.0,,110,COMPLETE
743,743,0.14934284342051332,2022-12-01 22:39:27.694391,2022-12-01 22:39:37.285776,0 days 00:00:09.591385,"{0: 1, 1: 10}",1.0,1.0,510,COMPLETE
744,744,0.23430093055093054,2022-12-01 22:39:37.705157,2022-12-01 22:39:47.228975,0 days 00:00:09.523818,balanced,10.0,sqrt,760,COMPLETE
745,745,0.043592233009708735,2022-12-01 22:39:47.449645,2022-12-01 22:40:00.024346,0 days 00:00:12.574701,,19.0,,510,COMPLETE
746,746,0.16275967021112653,2022-12-01 22:40:00.241173,2022-12-01 22:40:07.419815,0 days 00:00:07.178642,"{0: 1, 1: 100}",23.0,0.8,110,COMPLETE
747,747,0.18803423742744127,2022-12-01 22:40:07.634690,2022-12-01 22:40:20.214776,0 days 00:00:12.580086,"{0: 1, 1: 100}",25.0,1.0,810,COMPLETE
748,748,0.17625976010684746,2022-12-01 22:40:20.435321,2022-12-01 22:40:33.511248,0 days 00:00:13.075927,"{0: 1, 1: 100}",23.0,1.0,860,COMPLETE
749,749,0.10335355987055014,2022-12-01 22:40:33.733871,2022-12-01 22:40:46.725406,0 days 00:00:12.991535,"{0: 1, 1: 10}",34.0,,610,COMPLETE
750,750,0.0850146581919094,2022-12-01 22:40:46.945736,2022-12-01 22:40:54.920104,0 days 00:00:07.974368,,21.0,sqrt,360,COMPLETE
751,751,0.039077669902912615,2022-12-01 22:40:55.161588,2022-12-01 22:41:02.348228,0 days 00:00:07.186640,"{0: 1, 1: 10}",16.0,0.9,60,COMPLETE
752,752,0.17278882210921045,2022-12-01 22:41:02.568810,2022-12-01 22:41:10.958773,0 days 00:00:08.389963,balanced,24.0,1.0,310,COMPLETE
753,753,0.15408576051779937,2022-12-01 22:41:11.179341,2022-12-01 22:41:20.983441,0 days 00:00:09.804100,"{0: 1, 1: 100}",10.0,,460,COMPLETE
754,754,0.1377739395388836,2022-12-01 22:41:21.204386,2022-12-01 22:41:28.542516,0 days 00:00:07.338130,,20.0,log2,160,COMPLETE
755,755,0.13041672160173018,2022-12-01 22:41:28.763335,2022-12-01 22:41:36.278680,0 days 00:00:07.515345,"{0: 1, 1: 100}",34.0,log2,210,COMPLETE
756,756,0.16940787614938096,2022-12-01 22:41:36.505614,2022-12-01 22:41:45.683050,0 days 00:00:09.177436,balanced,37.0,0.6,510,COMPLETE
757,757,0.026820388349514564,2022-12-01 22:41:45.899734,2022-12-01 22:41:53.041538,0 days 00:00:07.141804,"{0: 1, 1: 10}",32.0,0.7,110,COMPLETE
758,758,0.08476026737555863,2022-12-01 22:41:53.261668,2022-12-01 22:42:01.508216,0 days 00:00:08.246548,"{0: 1, 1: 10}",18.0,0.7,260,COMPLETE
759,759,0.09163729002928031,2022-12-01 22:42:01.725512,2022-12-01 22:42:16.227613,0 days 00:00:14.502101,"{0: 1, 1: 10}",17.0,0.7,960,COMPLETE
760,760,0.16508043915810905,2022-12-01 22:42:16.447863,2022-12-01 22:42:23.920233,0 days 00:00:07.472370,,3.0,0.7,160,COMPLETE
761,761,0.1719177559226103,2022-12-01 22:42:24.146427,2022-12-01 22:42:34.102732,0 days 00:00:09.956305,balanced,34.0,0.6,660,COMPLETE
762,762,0.14197266527970412,2022-12-01 22:42:34.322994,2022-12-01 22:42:49.128221,0 days 00:00:14.805227,"{0: 1, 1: 10}",6.0,0.8,910,COMPLETE
763,763,0.18068436328145063,2022-12-01 22:42:49.348979,2022-12-01 22:43:00.263275,0 days 00:00:10.914296,"{0: 1, 1: 100}",29.0,0.8,710,COMPLETE
764,764,0.159129424153696,2022-12-01 22:43:00.483641,2022-12-01 22:43:09.194240,0 days 00:00:08.710599,balanced,35.0,0.6,460,COMPLETE
765,765,0.17569154618305102,2022-12-01 22:43:09.411480,2022-12-01 22:43:18.361216,0 days 00:00:08.949736,balanced,26.0,,360,COMPLETE
766,766,0.2719377022653721,2022-12-01 22:43:18.582683,2022-12-01 22:43:26.483989,0 days 00:00:07.901306,"{0: 1, 1: 100}",3.0,,260,COMPLETE
767,767,0.23726177633944623,2022-12-01 22:43:26.705719,2022-12-01 22:43:34.899801,0 days 00:00:08.194082,balanced,4.0,0.9,310,COMPLETE
768,768,0.1885215510397549,2022-12-01 22:43:35.120455,2022-12-01 22:43:46.110746,0 days 00:00:10.990291,"{0: 1, 1: 100}",12.0,0.7,760,COMPLETE
769,769,0.16970274870760305,2022-12-01 22:43:46.331999,2022-12-01 22:43:58.068926,0 days 00:00:11.736927,balanced,29.0,0.6,960,COMPLETE
770,770,0.2100678128954828,2022-12-01 22:43:58.286146,2022-12-01 22:44:08.953958,0 days 00:00:10.667812,"{0: 1, 1: 10}",4.0,0.6,610,COMPLETE
771,771,0.29099053724053725,2022-12-01 22:44:09.175953,2022-12-01 22:44:16.866376,0 days 00:00:07.690423,balanced,1.0,log2,210,COMPLETE
772,772,0.17204533487907275,2022-12-01 22:44:17.082320,2022-12-01 22:44:29.255609,0 days 00:00:12.173289,balanced,20.0,0.8,860,COMPLETE
773,773,0.014563106796116504,2022-12-01 22:44:29.477847,2022-12-01 22:44:36.386593,0 days 00:00:06.908746,,30.0,0.7,10,COMPLETE
774,774,0.014563106796116504,2022-12-01 22:44:36.606913,2022-12-01 22:44:43.666454,0 days 00:00:07.059541,,33.0,0.6,110,COMPLETE
775,775,0.014563106796116504,2022-12-01 22:44:43.895896,2022-12-01 22:44:50.886704,0 days 00:00:06.990808,"{0: 1, 1: 10}",16.0,0.7,10,COMPLETE
776,776,0.014563106796116504,2022-12-01 22:44:51.108178,2022-12-01 22:45:01.835329,0 days 00:00:10.727151,,28.0,1.0,410,COMPLETE
777,777,0.1876600532089739,2022-12-01 22:45:02.061034,2022-12-01 22:45:11.499797,0 days 00:00:09.438763,balanced,24.0,log2,660,COMPLETE
778,778,0.1755037370935429,2022-12-01 22:45:11.723791,2022-12-01 22:45:18.816263,0 days 00:00:07.092472,balanced,9.0,0.9,110,COMPLETE
779,779,0.17522463422948859,2022-12-01 22:45:19.033156,2022-12-01 22:45:31.208244,0 days 00:00:12.175088,balanced,37.0,0.9,810,COMPLETE
780,780,0.1736564588324297,2022-12-01 22:45:31.427740,2022-12-01 22:45:44.820999,0 days 00:00:13.393259,"{0: 1, 1: 100}",30.0,,910,COMPLETE
781,781,0.12849110032362462,2022-12-01 22:45:45.040283,2022-12-01 22:45:52.060632,0 days 00:00:07.020349,"{0: 1, 1: 100}",24.0,,10,COMPLETE
782,782,0.1584700390404274,2022-12-01 22:45:52.280369,2022-12-01 22:46:03.609694,0 days 00:00:11.329325,"{0: 1, 1: 100}",30.0,0.8,760,COMPLETE
783,783,0.09906874746073775,2022-12-01 22:46:03.826233,2022-12-01 22:46:16.671732,0 days 00:00:12.845499,"{0: 1, 1: 10}",34.0,0.8,710,COMPLETE
784,784,0.10953668234424244,2022-12-01 22:46:16.890300,2022-12-01 22:46:25.056840,0 days 00:00:08.166540,balanced,37.0,log2,410,COMPLETE
785,785,0.23887038887038886,2022-12-01 22:46:25.282167,2022-12-01 22:46:34.520388,0 days 00:00:09.238221,balanced,9.0,sqrt,710,COMPLETE
786,786,0.2166823984178353,2022-12-01 22:46:34.743996,2022-12-01 22:46:41.935928,0 days 00:00:07.191932,"{0: 1, 1: 100}",5.0,0.8,160,COMPLETE
787,787,0.1801340730466944,2022-12-01 22:46:42.154691,2022-12-01 22:46:51.117390,0 days 00:00:08.962699,balanced,30.0,0.8,410,COMPLETE
788,788,0.10543426054348384,2022-12-01 22:46:51.338196,2022-12-01 22:47:07.186670,0 days 00:00:15.848474,"{0: 1, 1: 10}",20.0,1.0,860,COMPLETE
789,789,0.11662274618585297,2022-12-01 22:47:07.401654,2022-12-01 22:47:20.994263,0 days 00:00:13.592609,"{0: 1, 1: 10}",9.0,0.9,710,COMPLETE
790,790,0.10845604099244877,2022-12-01 22:47:21.209489,2022-12-01 22:47:29.521153,0 days 00:00:08.311664,"{0: 1, 1: 10}",26.0,1.0,210,COMPLETE
791,791,0.029842233009708737,2022-12-01 22:47:29.745798,2022-12-01 22:47:42.161082,0 days 00:00:12.415284,,27.0,0.7,710,COMPLETE
792,792,0.08388371860387851,2022-12-01 22:47:42.390058,2022-12-01 22:47:49.679412,0 days 00:00:07.289354,,35.0,sqrt,160,COMPLETE
793,793,0.02032766990291262,2022-12-01 22:47:49.900128,2022-12-01 22:48:01.885465,0 days 00:00:11.985337,,27.0,0.7,660,COMPLETE
