,number,value,datetime_start,datetime_complete,duration,params_class_weight,params_max_depth,params_max_features,params_n_estimators,state
319,319,0.1722946262205971,2022-12-01 21:29:19.523792,2022-12-01 21:29:31.221968,0 days 00:00:11.698176,"{0: 1, 1: 100}",10.0,0.8,810,COMPLETE
320,320,0.11155010655314306,2022-12-01 21:29:31.431688,2022-12-01 21:29:40.374202,0 days 00:00:08.942514,"{0: 1, 1: 10}",34.0,sqrt,610,COMPLETE
321,321,0.1263460581293316,2022-12-01 21:29:40.585941,2022-12-01 21:29:50.714560,0 days 00:00:10.128619,"{0: 1, 1: 10}",33.0,log2,760,COMPLETE
322,322,0.15431261879077413,2022-12-01 21:29:50.931373,2022-12-01 21:29:59.871471,0 days 00:00:08.940098,balanced,37.0,0.6,510,COMPLETE
323,323,0.014563106796116504,2022-12-01 21:30:00.079030,2022-12-01 21:30:07.220141,0 days 00:00:07.141111,"{0: 1, 1: 10}",10.0,0.9,60,COMPLETE
324,324,0.10207367538071421,2022-12-01 21:30:07.430800,2022-12-01 21:30:14.532168,0 days 00:00:07.101368,balanced,39.0,sqrt,110,COMPLETE
325,325,0.1700613217239431,2022-12-01 21:30:14.741259,2022-12-01 21:30:24.882480,0 days 00:00:10.141221,balanced,35.0,1.0,510,COMPLETE
326,326,0.07234282550423328,2022-12-01 21:30:25.113033,2022-12-01 21:30:37.889925,0 days 00:00:12.776892,"{0: 1, 1: 10}",38.0,0.8,710,COMPLETE
327,327,0.02122052704576976,2022-12-01 21:30:38.099729,2022-12-01 21:30:46.874382,0 days 00:00:08.774653,,,0.6,360,COMPLETE
328,328,0.1122952770889664,2022-12-01 21:30:47.083222,2022-12-01 21:30:59.919931,0 days 00:00:12.836709,"{0: 1, 1: 10}",29.0,0.6,860,COMPLETE
329,329,0.046856796116504854,2022-12-01 21:31:00.132788,2022-12-01 21:31:11.427093,0 days 00:00:11.294305,,4.0,1.0,460,COMPLETE
330,330,0.026820388349514564,2022-12-01 21:31:11.640251,2022-12-01 21:31:18.554324,0 days 00:00:06.914073,"{0: 1, 1: 10}",19.0,0.8,10,COMPLETE
331,331,0.1707471618636667,2022-12-01 21:31:18.765772,2022-12-01 21:31:28.214971,0 days 00:00:09.449199,balanced,12.0,0.9,460,COMPLETE
332,332,0.014563106796116504,2022-12-01 21:31:28.420956,2022-12-01 21:31:35.938832,0 days 00:00:07.517876,,17.0,0.6,210,COMPLETE
333,333,0.036092233009708735,2022-12-01 21:31:36.148605,2022-12-01 21:31:50.522858,0 days 00:00:14.374253,,14.0,0.9,760,COMPLETE
334,334,0.1632391996712385,2022-12-01 21:31:50.746307,2022-12-01 21:31:59.931733,0 days 00:00:09.185426,balanced,11.0,0.8,460,COMPLETE
335,335,0.17521870344685878,2022-12-01 21:32:00.150944,2022-12-01 21:32:07.546320,0 days 00:00:07.395376,"{0: 1, 1: 100}",11.0,0.6,260,COMPLETE
336,336,0.1271770156840465,2022-12-01 21:32:07.763923,2022-12-01 21:32:16.151441,0 days 00:00:08.387518,"{0: 1, 1: 100}",25.0,sqrt,510,COMPLETE
337,337,0.2000639543843427,2022-12-01 21:32:16.366980,2022-12-01 21:32:23.372180,0 days 00:00:07.005200,"{0: 1, 1: 100}",6.0,,60,COMPLETE
338,338,0.08084691400832178,2022-12-01 21:32:23.596087,2022-12-01 21:32:33.648250,0 days 00:00:10.052163,"{0: 1, 1: 10}",10.0,1.0,360,COMPLETE
339,339,0.2684821428571428,2022-12-01 21:32:33.864226,2022-12-01 21:32:45.180026,0 days 00:00:11.315800,balanced,3.0,log2,910,COMPLETE
340,340,0.1385801273414246,2022-12-01 21:32:45.391022,2022-12-01 21:32:54.749492,0 days 00:00:09.358470,"{0: 1, 1: 10}",39.0,log2,610,COMPLETE
341,341,0.2017036204536204,2022-12-01 21:32:54.966201,2022-12-01 21:33:04.919666,0 days 00:00:09.953465,,7.0,log2,710,COMPLETE
342,342,0.14057443365695796,2022-12-01 21:33:05.130559,2022-12-01 21:33:12.108834,0 days 00:00:06.978275,"{0: 1, 1: 100}",10.0,,10,COMPLETE
343,343,0.1739355529404073,2022-12-01 21:33:12.320177,2022-12-01 21:33:23.552901,0 days 00:00:11.232724,"{0: 1, 1: 100}",22.0,0.8,760,COMPLETE
344,344,0.24429881337648332,2022-12-01 21:33:23.765783,2022-12-01 21:33:30.789084,0 days 00:00:07.023301,balanced,3.0,,10,COMPLETE
345,345,0.13045412007958235,2022-12-01 21:33:31.004634,2022-12-01 21:33:39.775754,0 days 00:00:08.771120,"{0: 1, 1: 100}",36.0,log2,510,COMPLETE
346,346,0.24823399856166847,2022-12-01 21:33:39.983671,2022-12-01 21:33:47.491136,0 days 00:00:07.507465,"{0: 1, 1: 100}",4.0,,210,COMPLETE
347,347,0.1833089826839827,2022-12-01 21:33:47.704202,2022-12-01 21:33:56.054325,0 days 00:00:08.350123,,4.0,sqrt,510,COMPLETE
348,348,0.16553616376431907,2022-12-01 21:33:56.266074,2022-12-01 21:34:04.876408,0 days 00:00:08.610334,balanced,27.0,0.7,410,COMPLETE
349,349,0.2143583371860071,2022-12-01 21:34:05.091421,2022-12-01 21:34:12.628731,0 days 00:00:07.537310,"{0: 1, 1: 100}",5.0,0.7,260,COMPLETE
350,350,0.032168284789644015,2022-12-01 21:34:12.837272,2022-12-01 21:34:29.574165,0 days 00:00:16.736893,,28.0,,910,COMPLETE
351,351,0.10861780184188996,2022-12-01 21:34:29.782288,2022-12-01 21:34:37.354909,0 days 00:00:07.572621,"{0: 1, 1: 10}",24.0,sqrt,260,COMPLETE
352,352,0.014563106796116504,2022-12-01 21:34:37.575194,2022-12-01 21:34:44.467752,0 days 00:00:06.892558,"{0: 1, 1: 10}",12.0,0.9,10,COMPLETE
353,353,0.17091517054502492,2022-12-01 21:34:44.678049,2022-12-01 21:34:54.918098,0 days 00:00:10.240049,"{0: 1, 1: 100}",17.0,0.7,660,COMPLETE
354,354,0.10460086299892128,2022-12-01 21:34:55.126834,2022-12-01 21:35:02.114202,0 days 00:00:06.987368,"{0: 1, 1: 100}",8.0,0.9,10,COMPLETE
355,355,0.16720004307989744,2022-12-01 21:35:02.323914,2022-12-01 21:35:13.285918,0 days 00:00:10.962004,"{0: 1, 1: 100}",27.0,0.7,760,COMPLETE
356,356,0.1645315469769353,2022-12-01 21:35:13.495153,2022-12-01 21:35:24.362185,0 days 00:00:10.867032,balanced,15.0,1.0,610,COMPLETE
357,357,0.14994850918291286,2022-12-01 21:35:24.576611,2022-12-01 21:35:33.544544,0 days 00:00:08.967933,,1.0,0.7,560,COMPLETE
358,358,0.10173123105768737,2022-12-01 21:35:33.756601,2022-12-01 21:35:48.503908,0 days 00:00:14.747307,"{0: 1, 1: 10}",39.0,1.0,760,COMPLETE
359,359,0.25981992544492544,2022-12-01 21:35:48.716666,2022-12-01 21:35:57.266380,0 days 00:00:08.549714,"{0: 1, 1: 10}",4.0,sqrt,510,COMPLETE
360,360,0.24058248341015326,2022-12-01 21:35:57.479402,2022-12-01 21:36:05.763505,0 days 00:00:08.284103,"{0: 1, 1: 100}",4.0,0.8,360,COMPLETE
361,361,0.27558531746031745,2022-12-01 21:36:05.972338,2022-12-01 21:36:14.544564,0 days 00:00:08.572226,balanced,4.0,log2,460,COMPLETE
362,362,0.18973678923272574,2022-12-01 21:36:14.753281,2022-12-01 21:36:25.153426,0 days 00:00:10.400145,,14.0,log2,810,COMPLETE
363,363,0.2602901137427836,2022-12-01 21:36:25.366269,2022-12-01 21:36:40.151498,0 days 00:00:14.785229,"{0: 1, 1: 10}",3.0,0.8,910,COMPLETE
364,364,0.10478884875306844,2022-12-01 21:36:40.362621,2022-12-01 21:36:47.809424,0 days 00:00:07.446803,"{0: 1, 1: 100}",26.0,sqrt,260,COMPLETE
365,365,0.038140507011866234,2022-12-01 21:36:48.018571,2022-12-01 21:36:55.838930,0 days 00:00:07.820359,"{0: 1, 1: 10}",30.0,1.0,160,COMPLETE
366,366,0.02657766990291262,2022-12-01 21:36:56.049574,2022-12-01 21:37:08.616189,0 days 00:00:12.566615,,26.0,0.8,660,COMPLETE
367,367,0.14245280474649408,2022-12-01 21:37:08.837933,2022-12-01 21:37:20.553330,0 days 00:00:11.715397,"{0: 1, 1: 10}",6.0,1.0,510,COMPLETE
368,368,0.17601437689423127,2022-12-01 21:37:20.765835,2022-12-01 21:37:31.756508,0 days 00:00:10.990673,balanced,39.0,,610,COMPLETE
369,369,0.22802843196099865,2022-12-01 21:37:31.967725,2022-12-01 21:37:40.742743,0 days 00:00:08.775018,"{0: 1, 1: 10}",18.0,log2,510,COMPLETE
370,370,0.17872849507558247,2022-12-01 21:37:40.961698,2022-12-01 21:37:52.421735,0 days 00:00:11.460037,"{0: 1, 1: 100}",20.0,0.7,860,COMPLETE
371,371,0.014563106796116504,2022-12-01 21:37:52.633808,2022-12-01 21:38:06.491294,0 days 00:00:13.857486,,29.0,,660,COMPLETE
372,372,0.18465919014462703,2022-12-01 21:38:06.698741,2022-12-01 21:38:19.023591,0 days 00:00:12.324850,"{0: 1, 1: 100}",37.0,0.8,910,COMPLETE
373,373,0.18121063110608557,2022-12-01 21:38:19.238859,2022-12-01 21:38:26.338080,0 days 00:00:07.099221,"{0: 1, 1: 10}",7.0,sqrt,60,COMPLETE
374,374,0.17482258437355522,2022-12-01 21:38:26.549994,2022-12-01 21:38:39.514089,0 days 00:00:12.964095,"{0: 1, 1: 100}",30.0,1.0,860,COMPLETE
375,375,0.014563106796116504,2022-12-01 21:38:39.722108,2022-12-01 21:38:53.901236,0 days 00:00:14.179128,,18.0,0.7,910,COMPLETE
376,376,0.1194955584243554,2022-12-01 21:38:54.110693,2022-12-01 21:39:02.461855,0 days 00:00:08.351162,"{0: 1, 1: 100}",19.0,sqrt,460,COMPLETE
377,377,0.09727221066420097,2022-12-01 21:39:02.677482,2022-12-01 21:39:15.676268,0 days 00:00:12.998786,"{0: 1, 1: 10}",15.0,1.0,610,COMPLETE
378,378,0.18606853906611187,2022-12-01 21:39:15.888899,2022-12-01 21:39:22.882743,0 days 00:00:06.993844,balanced,33.0,0.7,60,COMPLETE
379,379,0.26105246605246607,2022-12-01 21:39:23.099257,2022-12-01 21:39:32.864923,0 days 00:00:09.765666,"{0: 1, 1: 100}",8.0,sqrt,910,COMPLETE
380,380,0.09601877385544362,2022-12-01 21:39:33.072105,2022-12-01 21:39:42.315425,0 days 00:00:09.243320,,31.0,sqrt,660,COMPLETE
381,381,0.18246876123696512,2022-12-01 21:39:42.525342,2022-12-01 21:39:54.587773,0 days 00:00:12.062431,"{0: 1, 1: 100}",24.0,0.9,810,COMPLETE
382,382,0.03907766990291262,2022-12-01 21:39:54.802814,2022-12-01 21:40:01.815618,0 days 00:00:07.012804,"{0: 1, 1: 10}",17.0,0.8,10,COMPLETE
383,383,0.17701636102121537,2022-12-01 21:40:02.028880,2022-12-01 21:40:13.321300,0 days 00:00:11.292420,balanced,,1.0,660,COMPLETE
384,384,0.1301291496626245,2022-12-01 21:40:13.545066,2022-12-01 21:40:24.359448,0 days 00:00:10.814382,"{0: 1, 1: 100}",39.0,log2,910,COMPLETE
385,385,0.23812457095224088,2022-12-01 21:40:24.571340,2022-12-01 21:40:32.840287,0 days 00:00:08.268947,"{0: 1, 1: 100}",4.0,0.6,410,COMPLETE
386,386,0.1498834065632105,2022-12-01 21:40:33.048055,2022-12-01 21:40:41.486748,0 days 00:00:08.438693,"{0: 1, 1: 10}",2.0,,260,COMPLETE
387,387,0.08996756384677572,2022-12-01 21:40:41.695886,2022-12-01 21:40:49.162745,0 days 00:00:07.466859,"{0: 1, 1: 100}",30.0,sqrt,260,COMPLETE
388,388,0.11976861343594047,2022-12-01 21:40:49.372476,2022-12-01 21:40:59.109080,0 days 00:00:09.736604,"{0: 1, 1: 10}",17.0,sqrt,810,COMPLETE
389,389,0.1533628688965734,2022-12-01 21:40:59.322905,2022-12-01 21:41:07.879910,0 days 00:00:08.557005,,18.0,log2,460,COMPLETE
390,390,0.014563106796116504,2022-12-01 21:41:08.090992,2022-12-01 21:41:15.081597,0 days 00:00:06.990605,"{0: 1, 1: 10}",12.0,0.7,60,COMPLETE
391,391,0.18086688370062157,2022-12-01 21:41:15.299550,2022-12-01 21:41:24.943135,0 days 00:00:09.643585,balanced,9.0,,460,COMPLETE
392,392,0.16455601145528329,2022-12-01 21:41:25.157551,2022-12-01 21:41:34.516007,0 days 00:00:09.358456,balanced,16.0,,410,COMPLETE
393,393,0.2844645863395864,2022-12-01 21:41:34.730574,2022-12-01 21:41:42.794668,0 days 00:00:08.064094,"{0: 1, 1: 10}",5.0,sqrt,410,COMPLETE
394,394,0.09619741100323624,2022-12-01 21:41:43.009094,2022-12-01 21:41:49.989526,0 days 00:00:06.980432,balanced,22.0,0.8,10,COMPLETE
395,395,0.23025397112775758,2022-12-01 21:41:50.202968,2022-12-01 21:42:01.173584,0 days 00:00:10.970616,balanced,4.0,0.6,860,COMPLETE
396,396,0.19600516258283246,2022-12-01 21:42:01.386002,2022-12-01 21:42:14.243003,0 days 00:00:12.857001,"{0: 1, 1: 100}",,,860,COMPLETE
397,397,0.12788300500311897,2022-12-01 21:42:14.458767,2022-12-01 21:42:24.078205,0 days 00:00:09.619438,"{0: 1, 1: 100}",32.0,sqrt,860,COMPLETE
398,398,0.17979544637311626,2022-12-01 21:42:24.293945,2022-12-01 21:42:36.619413,0 days 00:00:12.325468,"{0: 1, 1: 100}",2.0,,810,COMPLETE
399,399,0.25423989081756065,2022-12-01 21:42:36.840128,2022-12-01 21:42:49.567904,0 days 00:00:12.727776,"{0: 1, 1: 100}",3.0,0.9,910,COMPLETE
400,400,0.15277987390156128,2022-12-01 21:42:49.781275,2022-12-01 21:42:56.832040,0 days 00:00:07.050765,,5.0,sqrt,10,COMPLETE
401,401,0.1037556826937895,2022-12-01 21:42:57.052484,2022-12-01 21:43:11.710855,0 days 00:00:14.658371,"{0: 1, 1: 10}",31.0,0.9,810,COMPLETE
402,402,0.16947799481173265,2022-12-01 21:43:11.924830,2022-12-01 21:43:24.038712,0 days 00:00:12.113882,"{0: 1, 1: 100}",24.0,1.0,760,COMPLETE
403,403,0.18350182359891096,2022-12-01 21:43:24.246285,2022-12-01 21:43:37.767166,0 days 00:00:13.520881,balanced,37.0,,910,COMPLETE
404,404,0.1538310987825551,2022-12-01 21:43:37.980256,2022-12-01 21:43:45.096850,0 days 00:00:07.116594,"{0: 1, 1: 100}",29.0,0.8,110,COMPLETE
405,405,0.17591332356348963,2022-12-01 21:43:45.308762,2022-12-01 21:43:52.598103,0 days 00:00:07.289341,balanced,16.0,sqrt,160,COMPLETE
406,406,0.02883495145631068,2022-12-01 21:43:52.816678,2022-12-01 21:44:05.964283,0 days 00:00:13.147605,,20.0,0.9,660,COMPLETE
407,407,0.09648716417527095,2022-12-01 21:44:06.177664,2022-12-01 21:44:20.782064,0 days 00:00:14.604400,"{0: 1, 1: 10}",29.0,0.9,810,COMPLETE
408,408,0.13059320461339663,2022-12-01 21:44:21.007847,2022-12-01 21:44:30.465571,0 days 00:00:09.457724,"{0: 1, 1: 100}",30.0,log2,660,COMPLETE
409,409,0.14591443211588842,2022-12-01 21:44:30.680549,2022-12-01 21:44:37.881021,0 days 00:00:07.200472,balanced,16.0,,160,COMPLETE
410,410,0.14012828544754058,2022-12-01 21:44:38.090581,2022-12-01 21:44:47.533054,0 days 00:00:09.442473,"{0: 1, 1: 100}",34.0,log2,660,COMPLETE
411,411,0.1750044305748189,2022-12-01 21:44:47.749965,2022-12-01 21:44:55.578987,0 days 00:00:07.829022,"{0: 1, 1: 10}",4.0,0.7,210,COMPLETE
412,412,0.12274612609882303,2022-12-01 21:44:55.793262,2022-12-01 21:45:03.551067,0 days 00:00:07.757805,"{0: 1, 1: 100}",17.0,sqrt,310,COMPLETE
413,413,0.11109993222803885,2022-12-01 21:45:03.760531,2022-12-01 21:45:11.760567,0 days 00:00:08.000036,"{0: 1, 1: 100}",,sqrt,410,COMPLETE
414,414,0.17319030282015718,2022-12-01 21:45:11.969727,2022-12-01 21:45:23.285740,0 days 00:00:11.316013,balanced,9.0,0.8,760,COMPLETE
415,415,0.17989732624441362,2022-12-01 21:45:23.498066,2022-12-01 21:45:35.195407,0 days 00:00:11.697341,"{0: 1, 1: 100}",14.0,,710,COMPLETE
416,416,0.18635581256470032,2022-12-01 21:45:35.408580,2022-12-01 21:45:44.005021,0 days 00:00:08.596441,balanced,25.0,log2,510,COMPLETE
417,417,0.2806712962962963,2022-12-01 21:45:44.216437,2022-12-01 21:45:53.320268,0 days 00:00:09.103831,balanced,6.0,log2,560,COMPLETE
418,418,0.15362682577884307,2022-12-01 21:45:53.534333,2022-12-01 21:46:04.146296,0 days 00:00:10.611963,"{0: 1, 1: 10}",25.0,log2,860,COMPLETE
419,419,0.19374700407467396,2022-12-01 21:46:04.360181,2022-12-01 21:46:12.172010,0 days 00:00:07.811829,"{0: 1, 1: 10}",3.0,0.8,210,COMPLETE
420,420,0.10637135922330102,2022-12-01 21:46:12.382709,2022-12-01 21:46:19.302792,0 days 00:00:06.920083,"{0: 1, 1: 100}",30.0,,10,COMPLETE
421,421,0.014563106796116504,2022-12-01 21:46:19.514902,2022-12-01 21:46:26.458489,0 days 00:00:06.943587,"{0: 1, 1: 10}",25.0,1.0,10,COMPLETE
422,422,0.0942206040992449,2022-12-01 21:46:26.667531,2022-12-01 21:46:39.551179,0 days 00:00:12.883648,"{0: 1, 1: 10}",33.0,0.9,660,COMPLETE
423,423,0.2971625827875828,2022-12-01 21:46:39.762620,2022-12-01 21:46:48.305764,0 days 00:00:08.543144,"{0: 1, 1: 100}",15.0,log2,460,COMPLETE
424,424,0.07382230873705672,2022-12-01 21:46:48.531836,2022-12-01 21:46:55.790129,0 days 00:00:07.258293,,18.0,sqrt,160,COMPLETE
425,425,0.0334136615811373,2022-12-01 21:46:56.007959,2022-12-01 21:47:08.125754,0 days 00:00:12.117795,,26.0,0.9,560,COMPLETE
426,426,0.16082322006472488,2022-12-01 21:47:08.338951,2022-12-01 21:47:18.398246,0 days 00:00:10.059295,"{0: 1, 1: 100}",30.0,,510,COMPLETE
427,427,0.13173398545897155,2022-12-01 21:47:18.610510,2022-12-01 21:47:26.480586,0 days 00:00:07.870076,balanced,24.0,sqrt,360,COMPLETE
428,428,0.17078150611524395,2022-12-01 21:47:26.691356,2022-12-01 21:47:36.866694,0 days 00:00:10.175338,"{0: 1, 1: 100}",23.0,0.7,660,COMPLETE
429,429,0.07467560486977962,2022-12-01 21:47:37.082184,2022-12-01 21:47:47.363782,0 days 00:00:10.281598,"{0: 1, 1: 10}",18.0,0.9,410,COMPLETE
430,430,0.18025909231006318,2022-12-01 21:47:47.578154,2022-12-01 21:47:58.924169,0 days 00:00:11.346015,"{0: 1, 1: 100}",36.0,1.0,660,COMPLETE
431,431,0.014563106796116504,2022-12-01 21:47:59.136843,2022-12-01 21:48:06.501204,0 days 00:00:07.364361,,36.0,0.6,160,COMPLETE
432,432,0.12595674731597062,2022-12-01 21:48:06.711285,2022-12-01 21:48:18.045964,0 days 00:00:11.334679,"{0: 1, 1: 10}",8.0,0.7,610,COMPLETE
433,433,0.09021266759130836,2022-12-01 21:48:18.256970,2022-12-01 21:48:27.791039,0 days 00:00:09.534069,"{0: 1, 1: 10}",32.0,0.7,410,COMPLETE
434,434,0.19340858889402576,2022-12-01 21:48:28.000362,2022-12-01 21:48:36.886208,0 days 00:00:08.885846,"{0: 1, 1: 100}",6.0,0.9,410,COMPLETE
435,435,0.20100011588753577,2022-12-01 21:48:37.095438,2022-12-01 21:48:46.569768,0 days 00:00:09.474330,"{0: 1, 1: 10}",20.0,log2,660,COMPLETE
436,436,0.027168284789644014,2022-12-01 21:48:46.785985,2022-12-01 21:48:57.250440,0 days 00:00:10.464455,,17.0,0.7,510,COMPLETE
437,437,0.16826568680330817,2022-12-01 21:48:57.461211,2022-12-01 21:49:08.435824,0 days 00:00:10.974613,balanced,21.0,,610,COMPLETE
438,438,0.08205723146863923,2022-12-01 21:49:08.652234,2022-12-01 21:49:18.039415,0 days 00:00:09.387181,"{0: 1, 1: 10}",26.0,1.0,310,COMPLETE
439,439,0.014563106796116504,2022-12-01 21:49:18.252252,2022-12-01 21:49:27.826554,0 days 00:00:09.574302,,27.0,,310,COMPLETE
440,440,0.21873003030770016,2022-12-01 21:49:28.040779,2022-12-01 21:49:39.978577,0 days 00:00:11.937798,balanced,5.0,0.8,860,COMPLETE
441,441,0.13049994771153473,2022-12-01 21:49:40.192176,2022-12-01 21:49:48.234912,0 days 00:00:08.042736,"{0: 1, 1: 10}",29.0,log2,360,COMPLETE
442,442,0.09969284558483588,2022-12-01 21:49:48.446914,2022-12-01 21:50:05.748304,0 days 00:00:17.301390,"{0: 1, 1: 10}",30.0,,960,COMPLETE
443,443,0.16763009195048026,2022-12-01 21:50:05.946667,2022-12-01 21:50:14.868097,0 days 00:00:08.921430,balanced,35.0,0.7,460,COMPLETE
444,444,0.17821081830790567,2022-12-01 21:50:15.082283,2022-12-01 21:50:26.349136,0 days 00:00:11.266853,"{0: 1, 1: 100}",27.0,1.0,660,COMPLETE
445,445,0.1382468645899548,2022-12-01 21:50:26.570349,2022-12-01 21:50:35.840188,0 days 00:00:09.269839,balanced,25.0,sqrt,860,COMPLETE
446,446,0.014563106796116504,2022-12-01 21:50:36.057100,2022-12-01 21:50:43.353627,0 days 00:00:07.296527,,33.0,1.0,110,COMPLETE
447,447,0.03675161812297734,2022-12-01 21:50:43.570336,2022-12-01 21:50:52.400258,0 days 00:00:08.829922,,24.0,,260,COMPLETE
448,448,0.0885116158113731,2022-12-01 21:50:52.614704,2022-12-01 21:51:04.416716,0 days 00:00:11.802012,"{0: 1, 1: 10}",14.0,,510,COMPLETE
449,449,0.10817299789387169,2022-12-01 21:51:04.630109,2022-12-01 21:51:15.359876,0 days 00:00:10.729767,"{0: 1, 1: 10}",10.0,0.6,610,COMPLETE
450,450,0.08087494512858592,2022-12-01 21:51:15.582515,2022-12-01 21:51:26.240160,0 days 00:00:10.657645,"{0: 1, 1: 10}",11.0,0.6,610,COMPLETE
451,451,0.17020812813872266,2022-12-01 21:51:26.460716,2022-12-01 21:51:35.166524,0 days 00:00:08.705808,balanced,17.0,sqrt,560,COMPLETE
452,452,0.014563106796116504,2022-12-01 21:51:35.375206,2022-12-01 21:51:46.193490,0 days 00:00:10.818284,,16.0,,410,COMPLETE
453,453,0.03442556634304207,2022-12-01 21:51:46.403067,2022-12-01 21:52:00.983303,0 days 00:00:14.580236,,37.0,0.8,860,COMPLETE
454,454,0.024077669902912623,2022-12-01 21:52:01.201912,2022-12-01 21:52:08.599838,0 days 00:00:07.397926,,36.0,0.7,160,COMPLETE
455,455,0.0758178263214671,2022-12-01 21:52:08.812412,2022-12-01 21:52:18.391742,0 days 00:00:09.579330,"{0: 1, 1: 10}",9.0,0.6,460,COMPLETE
456,456,0.10361885582656043,2022-12-01 21:52:18.603391,2022-12-01 21:52:26.112135,0 days 00:00:07.508744,"{0: 1, 1: 10}",35.0,sqrt,310,COMPLETE
457,457,0.10656903573772505,2022-12-01 21:52:26.329940,2022-12-01 21:52:33.336051,0 days 00:00:07.006111,"{0: 1, 1: 10}",26.0,log2,60,COMPLETE
458,458,0.024350824472183695,2022-12-01 21:52:33.548737,2022-12-01 21:52:45.049598,0 days 00:00:11.500861,,26.0,0.7,610,COMPLETE
459,459,0.05171790722761597,2022-12-01 21:52:45.272227,2022-12-01 21:52:54.094970,0 days 00:00:08.822743,"{0: 1, 1: 10}",27.0,,260,COMPLETE
460,460,0.1735130284584168,2022-12-01 21:52:54.309690,2022-12-01 21:53:03.482683,0 days 00:00:09.172993,balanced,19.0,0.7,510,COMPLETE
461,461,0.07516293644327626,2022-12-01 21:53:03.695866,2022-12-01 21:53:10.817192,0 days 00:00:07.121326,,27.0,sqrt,110,COMPLETE
462,462,0.11223451867262549,2022-12-01 21:53:11.029126,2022-12-01 21:53:22.901514,0 days 00:00:11.872388,"{0: 1, 1: 10}",11.0,0.9,560,COMPLETE
463,463,0.11490937900382503,2022-12-01 21:53:23.113370,2022-12-01 21:53:30.426509,0 days 00:00:07.313139,balanced,31.0,log2,110,COMPLETE
464,464,0.16419222273591205,2022-12-01 21:53:30.641464,2022-12-01 21:53:37.966746,0 days 00:00:07.325282,balanced,17.0,0.6,210,COMPLETE
465,465,0.21131600914367904,2022-12-01 21:53:38.186408,2022-12-01 21:53:46.511530,0 days 00:00:08.325122,"{0: 1, 1: 100}",5.0,1.0,310,COMPLETE
466,466,0.08508629989212513,2022-12-01 21:53:46.729416,2022-12-01 21:53:53.739664,0 days 00:00:07.010248,"{0: 1, 1: 10}",8.0,0.6,60,COMPLETE
467,467,0.03074433656957929,2022-12-01 21:53:53.948900,2022-12-01 21:54:03.540165,0 days 00:00:09.591265,,23.0,,310,COMPLETE
468,468,0.16698525068063902,2022-12-01 21:54:03.760085,2022-12-01 21:54:13.655990,0 days 00:00:09.895905,balanced,28.0,0.9,510,COMPLETE
469,469,0.014563106796116504,2022-12-01 21:54:13.879908,2022-12-01 21:54:20.821290,0 days 00:00:06.941382,,,0.7,10,COMPLETE
470,470,0.15873088593355586,2022-12-01 21:54:21.038026,2022-12-01 21:54:33.889334,0 days 00:00:12.851308,"{0: 1, 1: 10}",1.0,,960,COMPLETE
471,471,0.16847107629874622,2022-12-01 21:54:34.103125,2022-12-01 21:54:43.127990,0 days 00:00:09.024865,,2.0,1.0,310,COMPLETE
472,472,0.17516714182976317,2022-12-01 21:54:43.339221,2022-12-01 21:54:52.489648,0 days 00:00:09.150427,balanced,30.0,1.0,410,COMPLETE
473,473,0.16494429137026226,2022-12-01 21:54:52.694729,2022-12-01 21:55:04.192168,0 days 00:00:11.497439,"{0: 1, 1: 100}",14.0,0.6,960,COMPLETE
474,474,0.2867171717171717,2022-12-01 21:55:04.416060,2022-12-01 21:55:12.651423,0 days 00:00:08.235363,balanced,10.0,log2,410,COMPLETE
475,475,0.06279395900755122,2022-12-01 21:55:12.835551,2022-12-01 21:55:19.795141,0 days 00:00:06.959590,"{0: 1, 1: 10}",22.0,0.8,60,COMPLETE
476,476,0.20870158473313816,2022-12-01 21:55:20.006183,2022-12-01 21:55:27.218991,0 days 00:00:07.212808,balanced,6.0,0.6,210,COMPLETE
