,number,value,datetime_start,datetime_complete,duration,params_class_weight,params_max_depth,params_max_features,params_n_estimators,state
1111,1111,0.28416005291005286,2022-12-01 23:41:23.169597,2022-12-01 23:41:33.150250,0 days 00:00:09.980653,balanced,10.0,log2,710,COMPLETE
1112,1112,0.2841534391534391,2022-12-01 23:41:33.385757,2022-12-01 23:41:43.003432,0 days 00:00:09.617675,balanced,10.0,log2,660,COMPLETE
1113,1113,0.2815683621933622,2022-12-01 23:41:43.232280,2022-12-01 23:41:53.119694,0 days 00:00:09.887414,balanced,10.0,log2,710,COMPLETE
1114,1114,0.2963888888888888,2022-12-01 23:41:53.348885,2022-12-01 23:42:03.350999,0 days 00:00:10.002114,balanced,10.0,log2,710,COMPLETE
1115,1115,0.28778769841269836,2022-12-01 23:42:03.578568,2022-12-01 23:42:13.293673,0 days 00:00:09.715105,balanced,10.0,log2,660,COMPLETE
1116,1116,0.27387896825396824,2022-12-01 23:42:13.514219,2022-12-01 23:42:23.476317,0 days 00:00:09.962098,balanced,10.0,log2,710,COMPLETE
1117,1117,0.28437499999999993,2022-12-01 23:42:23.692121,2022-12-01 23:42:33.564002,0 days 00:00:09.871881,balanced,10.0,log2,710,COMPLETE
1118,1118,0.27832671957671956,2022-12-01 23:42:33.796741,2022-12-01 23:42:43.508057,0 days 00:00:09.711316,balanced,10.0,log2,660,COMPLETE
1119,1119,0.2867015160765161,2022-12-01 23:42:43.737248,2022-12-01 23:42:53.730207,0 days 00:00:09.992959,balanced,10.0,log2,710,COMPLETE
1120,1120,0.29541335978835975,2022-12-01 23:42:53.955624,2022-12-01 23:43:03.694462,0 days 00:00:09.738838,balanced,10.0,log2,660,COMPLETE
1121,1121,0.2922032828282828,2022-12-01 23:43:03.925233,2022-12-01 23:43:13.746324,0 days 00:00:09.821091,balanced,10.0,log2,710,COMPLETE
1122,1122,0.28430224867724857,2022-12-01 23:43:13.975124,2022-12-01 23:43:23.904100,0 days 00:00:09.928976,balanced,10.0,log2,710,COMPLETE
1123,1123,0.29161766474266465,2022-12-01 23:43:24.128094,2022-12-01 23:43:33.817946,0 days 00:00:09.689852,balanced,10.0,log2,660,COMPLETE
1124,1124,0.2983207070707071,2022-12-01 23:43:34.042164,2022-12-01 23:43:43.952956,0 days 00:00:09.910792,balanced,10.0,log2,710,COMPLETE
1125,1125,0.27613185425685416,2022-12-01 23:43:44.181859,2022-12-01 23:43:53.815816,0 days 00:00:09.633957,balanced,10.0,log2,660,COMPLETE
1126,1126,0.2814781746031746,2022-12-01 23:43:54.037585,2022-12-01 23:44:03.977365,0 days 00:00:09.939780,balanced,10.0,log2,710,COMPLETE
1127,1127,0.2881712962962963,2022-12-01 23:44:04.203402,2022-12-01 23:44:14.069021,0 days 00:00:09.865619,balanced,10.0,log2,710,COMPLETE
1128,1128,0.2837301587301587,2022-12-01 23:44:14.306249,2022-12-01 23:44:24.336885,0 days 00:00:10.030636,balanced,10.0,log2,710,COMPLETE
1129,1129,0.2828009259259259,2022-12-01 23:44:24.563494,2022-12-01 23:44:34.114731,0 days 00:00:09.551237,balanced,10.0,log2,660,COMPLETE
1130,1130,0.28439153439153436,2022-12-01 23:44:34.340567,2022-12-01 23:44:44.215276,0 days 00:00:09.874709,balanced,10.0,log2,710,COMPLETE
1131,1131,0.2739757696007695,2022-12-01 23:44:44.445330,2022-12-01 23:44:54.033893,0 days 00:00:09.588563,balanced,10.0,log2,660,COMPLETE
1132,1132,0.28486201298701297,2022-12-01 23:44:54.265074,2022-12-01 23:45:04.214569,0 days 00:00:09.949495,balanced,10.0,log2,710,COMPLETE
1133,1133,0.2938080206830206,2022-12-01 23:45:04.431407,2022-12-01 23:45:14.340749,0 days 00:00:09.909342,balanced,10.0,log2,710,COMPLETE
1134,1134,0.2926199494949494,2022-12-01 23:45:14.567693,2022-12-01 23:45:24.179737,0 days 00:00:09.612044,balanced,10.0,log2,660,COMPLETE
1135,1135,0.3031731000481,2022-12-01 23:45:24.408733,2022-12-01 23:45:34.461853,0 days 00:00:10.053120,balanced,10.0,log2,710,COMPLETE
1136,1136,0.2882969576719576,2022-12-01 23:45:34.694975,2022-12-01 23:45:44.700702,0 days 00:00:10.005727,balanced,10.0,log2,710,COMPLETE
1137,1137,0.30038029100529096,2022-12-01 23:45:44.922791,2022-12-01 23:45:55.040195,0 days 00:00:10.117404,balanced,10.0,log2,710,COMPLETE
1138,1138,0.2865145502645502,2022-12-01 23:45:55.268967,2022-12-01 23:46:05.323552,0 days 00:00:10.054585,balanced,10.0,log2,760,COMPLETE
1139,1139,0.2901058201058201,2022-12-01 23:46:05.548356,2022-12-01 23:46:15.376454,0 days 00:00:09.828098,balanced,10.0,log2,710,COMPLETE
1140,1140,0.2946891534391534,2022-12-01 23:46:15.606524,2022-12-01 23:46:25.332250,0 days 00:00:09.725726,balanced,10.0,log2,710,COMPLETE
1141,1141,0.27700907888407883,2022-12-01 23:46:25.558268,2022-12-01 23:46:35.652755,0 days 00:00:10.094487,balanced,10.0,log2,760,COMPLETE
1142,1142,0.285675505050505,2022-12-01 23:46:35.877400,2022-12-01 23:46:45.774444,0 days 00:00:09.897044,balanced,10.0,log2,710,COMPLETE
1143,1143,0.2766344997594997,2022-12-01 23:46:45.996359,2022-12-01 23:46:56.066124,0 days 00:00:10.069765,balanced,10.0,log2,710,COMPLETE
1144,1144,0.28665013227513225,2022-12-01 23:46:56.295759,2022-12-01 23:47:06.065034,0 days 00:00:09.769275,balanced,10.0,log2,660,COMPLETE
1145,1145,0.2732049663299663,2022-12-01 23:47:06.292516,2022-12-01 23:47:16.469882,0 days 00:00:10.177366,balanced,10.0,log2,760,COMPLETE
1146,1146,0.2904001322751323,2022-12-01 23:47:16.698820,2022-12-01 23:47:26.597831,0 days 00:00:09.899011,balanced,10.0,log2,710,COMPLETE
1147,1147,0.28964676527176525,2022-12-01 23:47:26.822614,2022-12-01 23:47:36.858972,0 days 00:00:10.036358,balanced,15.0,log2,760,COMPLETE
1148,1148,0.29621873496873496,2022-12-01 23:47:37.086743,2022-12-01 23:47:46.844633,0 days 00:00:09.757890,balanced,10.0,log2,660,COMPLETE
1149,1149,0.28708994708994706,2022-12-01 23:47:47.072177,2022-12-01 23:47:56.914333,0 days 00:00:09.842156,balanced,10.0,log2,710,COMPLETE
1150,1150,0.27814574314574314,2022-12-01 23:47:57.141468,2022-12-01 23:48:07.062298,0 days 00:00:09.920830,balanced,10.0,log2,710,COMPLETE
1151,1151,0.29840277777777774,2022-12-01 23:48:07.291256,2022-12-01 23:48:16.916395,0 days 00:00:09.625139,balanced,10.0,log2,660,COMPLETE
1152,1152,0.2842791005291005,2022-12-01 23:48:17.143263,2022-12-01 23:48:26.938203,0 days 00:00:09.794940,balanced,10.0,log2,660,COMPLETE
1153,1153,0.28120701058201053,2022-12-01 23:48:27.174859,2022-12-01 23:48:36.858801,0 days 00:00:09.683942,balanced,10.0,log2,660,COMPLETE
1154,1154,0.2821007696007696,2022-12-01 23:48:37.084682,2022-12-01 23:48:46.717400,0 days 00:00:09.632718,balanced,10.0,log2,660,COMPLETE
1155,1155,0.2863095238095238,2022-12-01 23:48:46.949593,2022-12-01 23:48:56.772534,0 days 00:00:09.822941,balanced,10.0,log2,660,COMPLETE
1156,1156,0.2940443121693121,2022-12-01 23:48:57.003349,2022-12-01 23:49:06.828413,0 days 00:00:09.825064,balanced,10.0,log2,660,COMPLETE
1157,1157,0.3046858465608465,2022-12-01 23:49:07.049172,2022-12-01 23:49:17.125546,0 days 00:00:10.076374,balanced,10.0,log2,710,COMPLETE
1158,1158,0.2831580687830687,2022-12-01 23:49:17.353944,2022-12-01 23:49:27.046238,0 days 00:00:09.692294,balanced,10.0,log2,660,COMPLETE
1159,1159,0.2828027296777297,2022-12-01 23:49:27.271814,2022-12-01 23:49:37.130216,0 days 00:00:09.858402,balanced,10.0,log2,710,COMPLETE
1160,1160,0.28278619528619525,2022-12-01 23:49:37.337697,2022-12-01 23:49:47.325110,0 days 00:00:09.987413,balanced,10.0,log2,710,COMPLETE
1161,1161,0.27636391386391385,2022-12-01 23:49:47.552205,2022-12-01 23:49:57.208895,0 days 00:00:09.656690,balanced,15.0,log2,660,COMPLETE
1162,1162,0.2849116161616161,2022-12-01 23:49:57.432680,2022-12-01 23:50:07.395983,0 days 00:00:09.963303,balanced,10.0,log2,710,COMPLETE
1163,1163,0.298311087061087,2022-12-01 23:50:07.620613,2022-12-01 23:50:17.490952,0 days 00:00:09.870339,balanced,10.0,log2,710,COMPLETE
1164,1164,0.2943683862433862,2022-12-01 23:50:17.717857,2022-12-01 23:50:27.537970,0 days 00:00:09.820113,balanced,10.0,log2,710,COMPLETE
1165,1165,0.294551467051467,2022-12-01 23:50:27.767379,2022-12-01 23:50:37.782650,0 days 00:00:10.015271,balanced,10.0,log2,710,COMPLETE
1166,1166,0.2990013227513227,2022-12-01 23:50:37.988911,2022-12-01 23:50:47.611098,0 days 00:00:09.622187,balanced,10.0,log2,660,COMPLETE
1167,1167,0.2835987854737855,2022-12-01 23:50:47.832597,2022-12-01 23:50:57.457497,0 days 00:00:09.624900,balanced,10.0,log2,660,COMPLETE
1168,1168,0.28759259259259257,2022-12-01 23:50:57.680493,2022-12-01 23:51:07.336988,0 days 00:00:09.656495,balanced,10.0,log2,660,COMPLETE
1169,1169,0.28215788840788836,2022-12-01 23:51:07.557761,2022-12-01 23:51:17.318814,0 days 00:00:09.761053,balanced,10.0,log2,660,COMPLETE
1170,1170,0.2920568783068783,2022-12-01 23:51:17.549407,2022-12-01 23:51:27.241670,0 days 00:00:09.692263,balanced,10.0,log2,660,COMPLETE
1171,1171,0.2904695767195767,2022-12-01 23:51:27.465835,2022-12-01 23:51:37.231488,0 days 00:00:09.765653,balanced,10.0,log2,660,COMPLETE
1172,1172,0.28517195767195763,2022-12-01 23:51:37.460422,2022-12-01 23:51:47.486883,0 days 00:00:10.026461,balanced,10.0,log2,710,COMPLETE
1173,1173,0.28578373015873015,2022-12-01 23:51:47.713352,2022-12-01 23:51:57.496568,0 days 00:00:09.783216,balanced,10.0,log2,660,COMPLETE
1174,1174,0.29476851851851854,2022-12-01 23:51:57.719250,2022-12-01 23:52:07.623740,0 days 00:00:09.904490,balanced,10.0,log2,710,COMPLETE
1175,1175,0.27771494708994704,2022-12-01 23:52:07.859559,2022-12-01 23:52:17.859757,0 days 00:00:10.000198,balanced,10.0,log2,710,COMPLETE
1176,1176,0.2901124338624338,2022-12-01 23:52:18.086741,2022-12-01 23:52:27.766814,0 days 00:00:09.680073,balanced,10.0,log2,660,COMPLETE
1177,1177,0.2889583333333333,2022-12-01 23:52:27.997434,2022-12-01 23:52:37.525845,0 days 00:00:09.528411,balanced,10.0,log2,660,COMPLETE
1178,1178,0.29074074074074063,2022-12-01 23:52:37.747835,2022-12-01 23:52:47.746022,0 days 00:00:09.998187,balanced,10.0,log2,710,COMPLETE
1179,1179,0.29743055555555553,2022-12-01 23:52:47.973541,2022-12-01 23:52:57.946777,0 days 00:00:09.973236,balanced,10.0,log2,710,COMPLETE
1180,1180,0.289613997113997,2022-12-01 23:52:58.174595,2022-12-01 23:53:08.109471,0 days 00:00:09.934876,balanced,10.0,log2,710,COMPLETE
1181,1181,0.3030125661375661,2022-12-01 23:53:08.332592,2022-12-01 23:53:17.979587,0 days 00:00:09.646995,balanced,10.0,log2,660,COMPLETE
1182,1182,0.3023842592592592,2022-12-01 23:53:18.221656,2022-12-01 23:53:28.051970,0 days 00:00:09.830314,balanced,10.0,log2,660,COMPLETE
1183,1183,0.2896999759499759,2022-12-01 23:53:28.280286,2022-12-01 23:53:37.991993,0 days 00:00:09.711707,balanced,10.0,log2,660,COMPLETE
1184,1184,0.2805342111592112,2022-12-01 23:53:38.223493,2022-12-01 23:53:47.875661,0 days 00:00:09.652168,balanced,10.0,log2,660,COMPLETE
1185,1185,0.28354226791726783,2022-12-01 23:53:48.106846,2022-12-01 23:53:57.705690,0 days 00:00:09.598844,balanced,10.0,log2,660,COMPLETE
1186,1186,0.29591269841269835,2022-12-01 23:53:57.933533,2022-12-01 23:54:07.489682,0 days 00:00:09.556149,balanced,10.0,log2,660,COMPLETE
1187,1187,0.27793079605579607,2022-12-01 23:54:07.715480,2022-12-01 23:54:17.394757,0 days 00:00:09.679277,balanced,10.0,log2,660,COMPLETE
1188,1188,0.27282166907166905,2022-12-01 23:54:17.620058,2022-12-01 23:54:27.266564,0 days 00:00:09.646506,balanced,10.0,log2,660,COMPLETE
1189,1189,0.2864234607984607,2022-12-01 23:54:27.494314,2022-12-01 23:54:37.182922,0 days 00:00:09.688608,balanced,10.0,log2,660,COMPLETE
1190,1190,0.2792030423280423,2022-12-01 23:54:37.400661,2022-12-01 23:54:47.006609,0 days 00:00:09.605948,balanced,10.0,log2,660,COMPLETE
1191,1191,0.2872784391534391,2022-12-01 23:54:47.240429,2022-12-01 23:54:56.924314,0 days 00:00:09.683885,balanced,10.0,log2,660,COMPLETE
1192,1192,0.29676677489177483,2022-12-01 23:54:57.162620,2022-12-01 23:55:06.886672,0 days 00:00:09.724052,balanced,10.0,log2,660,COMPLETE
1193,1193,0.27911946849446856,2022-12-01 23:55:07.116107,2022-12-01 23:55:16.708650,0 days 00:00:09.592543,balanced,10.0,log2,660,COMPLETE
1194,1194,0.28539742664742673,2022-12-01 23:55:16.936295,2022-12-01 23:55:26.930632,0 days 00:00:09.994337,balanced,10.0,log2,710,COMPLETE
1195,1195,0.27840608465608463,2022-12-01 23:55:27.172489,2022-12-01 23:55:37.548499,0 days 00:00:10.376010,balanced,10.0,log2,760,COMPLETE
1196,1196,0.27957671957671953,2022-12-01 23:55:37.775337,2022-12-01 23:55:47.762427,0 days 00:00:09.987090,balanced,10.0,log2,710,COMPLETE
1197,1197,0.27687830687830683,2022-12-01 23:55:47.990123,2022-12-01 23:55:57.799994,0 days 00:00:09.809871,balanced,10.0,log2,660,COMPLETE
1198,1198,0.29953884078884074,2022-12-01 23:55:58.024095,2022-12-01 23:56:08.334244,0 days 00:00:10.310149,balanced,10.0,log2,760,COMPLETE
1199,1199,0.3041666666666666,2022-12-01 23:56:08.553456,2022-12-01 23:56:18.783509,0 days 00:00:10.230053,balanced,10.0,log2,760,COMPLETE
1200,1200,0.2846693121693122,2022-12-01 23:56:19.006291,2022-12-01 23:56:29.261354,0 days 00:00:10.255063,balanced,10.0,log2,760,COMPLETE
1201,1201,0.28589706589706587,2022-12-01 23:56:29.487963,2022-12-01 23:56:39.605853,0 days 00:00:10.117890,balanced,10.0,log2,760,COMPLETE
1202,1202,0.2904803992303992,2022-12-01 23:56:39.826995,2022-12-01 23:56:50.111834,0 days 00:00:10.284839,balanced,10.0,log2,760,COMPLETE
1203,1203,0.2889583333333333,2022-12-01 23:56:50.336897,2022-12-01 23:57:00.645934,0 days 00:00:10.309037,balanced,10.0,log2,760,COMPLETE
1204,1204,0.31012566137566133,2022-12-01 23:57:00.868627,2022-12-01 23:57:11.009121,0 days 00:00:10.140494,balanced,10.0,log2,760,COMPLETE
1205,1205,0.2982251082251082,2022-12-01 23:57:11.238294,2022-12-01 23:57:21.450399,0 days 00:00:10.212105,balanced,10.0,log2,760,COMPLETE
1206,1206,0.30123106060606053,2022-12-01 23:57:21.680309,2022-12-01 23:57:31.790758,0 days 00:00:10.110449,balanced,10.0,log2,760,COMPLETE
1207,1207,0.2910978835978836,2022-12-01 23:57:32.017092,2022-12-01 23:57:42.236729,0 days 00:00:10.219637,balanced,10.0,log2,760,COMPLETE
1208,1208,0.2708895502645502,2022-12-01 23:57:42.470340,2022-12-01 23:57:52.710911,0 days 00:00:10.240571,balanced,10.0,log2,760,COMPLETE
1209,1209,0.2911153198653198,2022-12-01 23:57:52.941825,2022-12-01 23:58:03.023937,0 days 00:00:10.082112,balanced,10.0,log2,760,COMPLETE
1210,1210,0.28272907647907647,2022-12-01 23:58:03.258139,2022-12-01 23:58:13.386019,0 days 00:00:10.127880,balanced,10.0,log2,760,COMPLETE
1211,1211,0.2941137566137566,2022-12-01 23:58:13.622480,2022-12-01 23:58:23.853699,0 days 00:00:10.231219,balanced,10.0,log2,760,COMPLETE
1212,1212,0.3091071428571428,2022-12-01 23:58:24.083110,2022-12-01 23:58:34.325746,0 days 00:00:10.242636,balanced,10.0,log2,760,COMPLETE
1213,1213,0.296058201058201,2022-12-01 23:58:34.563405,2022-12-01 23:58:44.706807,0 days 00:00:10.143402,balanced,10.0,log2,760,COMPLETE
1214,1214,0.29178571428571426,2022-12-01 23:58:44.942284,2022-12-01 23:58:55.142498,0 days 00:00:10.200214,balanced,10.0,log2,760,COMPLETE
1215,1215,0.2818518518518518,2022-12-01 23:58:55.366068,2022-12-01 23:59:05.519967,0 days 00:00:10.153899,balanced,10.0,log2,760,COMPLETE
1216,1216,0.27285714285714285,2022-12-01 23:59:05.750251,2022-12-01 23:59:16.148448,0 days 00:00:10.398197,balanced,4.0,log2,760,COMPLETE
1217,1217,0.29227843915343915,2022-12-01 23:59:16.382132,2022-12-01 23:59:26.430308,0 days 00:00:10.048176,balanced,10.0,log2,760,COMPLETE
1218,1218,0.2964054232804232,2022-12-01 23:59:26.653988,2022-12-01 23:59:36.763219,0 days 00:00:10.109231,balanced,10.0,log2,760,COMPLETE
1219,1219,0.2902380952380952,2022-12-01 23:59:36.992205,2022-12-01 23:59:47.104186,0 days 00:00:10.111981,balanced,10.0,log2,760,COMPLETE
1220,1220,0.3103183621933622,2022-12-01 23:59:47.336339,2022-12-01 23:59:57.533096,0 days 00:00:10.196757,balanced,10.0,log2,760,COMPLETE
1221,1221,0.2879563492063492,2022-12-01 23:59:57.764507,2022-12-02 00:00:07.612550,0 days 00:00:09.848043,balanced,10.0,log2,760,COMPLETE
1222,1222,0.27769179894179896,2022-12-02 00:00:07.838684,2022-12-02 00:00:18.014436,0 days 00:00:10.175752,balanced,10.0,log2,760,COMPLETE
1223,1223,0.2817162698412698,2022-12-02 00:00:18.240812,2022-12-02 00:00:28.483853,0 days 00:00:10.243041,balanced,10.0,log2,760,COMPLETE
1224,1224,0.2838666426166426,2022-12-02 00:00:28.723490,2022-12-02 00:00:38.853484,0 days 00:00:10.129994,balanced,10.0,log2,760,COMPLETE
1225,1225,0.2847604016354016,2022-12-02 00:00:39.083514,2022-12-02 00:00:49.352904,0 days 00:00:10.269390,balanced,10.0,log2,760,COMPLETE
1226,1226,0.280404341029341,2022-12-02 00:00:49.590854,2022-12-02 00:00:59.760861,0 days 00:00:10.170007,balanced,12.0,log2,760,COMPLETE
1227,1227,0.2794973544973545,2022-12-02 00:01:00.090689,2022-12-02 00:01:10.295745,0 days 00:00:10.205056,balanced,10.0,log2,760,COMPLETE
1228,1228,0.28995370370370377,2022-12-02 00:01:10.534185,2022-12-02 00:01:20.724281,0 days 00:00:10.190096,balanced,10.0,log2,760,COMPLETE
1229,1229,0.30874999999999997,2022-12-02 00:01:20.950258,2022-12-02 00:01:31.124799,0 days 00:00:10.174541,balanced,10.0,log2,760,COMPLETE
1230,1230,0.3056887325637325,2022-12-02 00:01:31.350141,2022-12-02 00:01:41.450629,0 days 00:00:10.100488,balanced,10.0,log2,760,COMPLETE
1231,1231,0.30050595238095235,2022-12-02 00:01:41.681029,2022-12-02 00:01:51.836843,0 days 00:00:10.155814,balanced,10.0,log2,760,COMPLETE
1232,1232,0.28006944444444437,2022-12-02 00:01:52.067511,2022-12-02 00:02:02.536057,0 days 00:00:10.468546,balanced,10.0,log2,810,COMPLETE
1233,1233,0.2846693121693121,2022-12-02 00:02:02.769854,2022-12-02 00:02:12.999809,0 days 00:00:10.229955,balanced,10.0,log2,760,COMPLETE
1234,1234,0.2757804232804233,2022-12-02 00:02:13.223443,2022-12-02 00:02:23.312399,0 days 00:00:10.088956,balanced,10.0,log2,760,COMPLETE
1235,1235,0.2825237493987493,2022-12-02 00:02:23.552560,2022-12-02 00:02:33.790307,0 days 00:00:10.237747,balanced,10.0,log2,760,COMPLETE
1236,1236,0.2959391534391534,2022-12-02 00:02:34.135929,2022-12-02 00:02:44.543457,0 days 00:00:10.407528,balanced,10.0,log2,810,COMPLETE
1237,1237,0.29555555555555546,2022-12-02 00:02:44.770201,2022-12-02 00:02:55.059273,0 days 00:00:10.289072,balanced,10.0,log2,760,COMPLETE
1238,1238,0.2982215007215006,2022-12-02 00:02:55.288806,2022-12-02 00:03:05.523759,0 days 00:00:10.234953,balanced,10.0,log2,760,COMPLETE
1239,1239,0.29024801587301585,2022-12-02 00:03:05.755089,2022-12-02 00:03:15.935957,0 days 00:00:10.180868,balanced,10.0,log2,760,COMPLETE
1240,1240,0.28683531746031743,2022-12-02 00:03:16.166585,2022-12-02 00:03:26.760485,0 days 00:00:10.593900,balanced,10.0,log2,810,COMPLETE
1241,1241,0.2666104497354497,2022-12-02 00:03:26.996421,2022-12-02 00:03:37.499020,0 days 00:00:10.502599,balanced,4.0,log2,760,COMPLETE
1242,1242,0.2888970057720057,2022-12-02 00:03:37.724602,2022-12-02 00:03:47.998711,0 days 00:00:10.274109,balanced,10.0,log2,760,COMPLETE
1243,1243,0.28595899470899466,2022-12-02 00:03:48.231495,2022-12-02 00:03:58.715401,0 days 00:00:10.483906,balanced,10.0,log2,810,COMPLETE
1244,1244,0.28732894420394417,2022-12-02 00:03:58.939818,2022-12-02 00:04:09.124500,0 days 00:00:10.184682,balanced,10.0,log2,760,COMPLETE
1245,1245,0.23249925523822582,2022-12-02 00:04:09.349675,2022-12-02 00:04:19.254277,0 days 00:00:09.904602,balanced,21.0,log2,760,COMPLETE
1246,1246,0.289236111111111,2022-12-02 00:04:19.489263,2022-12-02 00:04:29.716018,0 days 00:00:10.226755,balanced,10.0,log2,760,COMPLETE
1247,1247,0.2621031746031746,2022-12-02 00:04:29.946902,2022-12-02 00:04:40.650837,0 days 00:00:10.703935,balanced,3.0,log2,810,COMPLETE
1248,1248,0.28983555796055793,2022-12-02 00:04:40.880963,2022-12-02 00:04:51.042507,0 days 00:00:10.161544,balanced,10.0,log2,760,COMPLETE
1249,1249,0.2823163179413179,2022-12-02 00:04:51.282226,2022-12-02 00:05:01.447949,0 days 00:00:10.165723,balanced,10.0,log2,760,COMPLETE
1250,1250,0.2861291486291486,2022-12-02 00:05:01.687900,2022-12-02 00:05:12.104260,0 days 00:00:10.416360,balanced,10.0,log2,810,COMPLETE
1251,1251,0.28135912698412696,2022-12-02 00:05:12.331216,2022-12-02 00:05:22.373488,0 days 00:00:10.042272,balanced,10.0,log2,760,COMPLETE
1252,1252,0.3001563251563251,2022-12-02 00:05:22.600430,2022-12-02 00:05:32.800763,0 days 00:00:10.200333,balanced,10.0,log2,760,COMPLETE
1253,1253,0.2850769600769601,2022-12-02 00:05:33.030155,2022-12-02 00:05:43.026174,0 days 00:00:09.996019,balanced,12.0,log2,760,COMPLETE
1254,1254,0.29577050264550264,2022-12-02 00:05:43.263405,2022-12-02 00:05:53.477989,0 days 00:00:10.214584,balanced,10.0,log2,760,COMPLETE
1255,1255,0.29355158730158726,2022-12-02 00:05:53.718148,2022-12-02 00:06:04.038362,0 days 00:00:10.320214,balanced,10.0,log2,810,COMPLETE
1256,1256,0.29442791005291,2022-12-02 00:06:04.273130,2022-12-02 00:06:14.506199,0 days 00:00:10.233069,balanced,10.0,log2,760,COMPLETE
1257,1257,0.2791524665421724,2022-12-02 00:06:14.731585,2022-12-02 00:06:24.918138,0 days 00:00:10.186553,balanced,10.0,log2,760,COMPLETE
1258,1258,0.28938822751322746,2022-12-02 00:06:25.150531,2022-12-02 00:06:35.374669,0 days 00:00:10.224138,balanced,10.0,log2,760,COMPLETE
1259,1259,0.29327380952380955,2022-12-02 00:06:35.601561,2022-12-02 00:06:45.551967,0 days 00:00:09.950406,balanced,10.0,log2,710,COMPLETE
1260,1260,0.2869477513227513,2022-12-02 00:06:45.784772,2022-12-02 00:06:56.194599,0 days 00:00:10.409827,balanced,10.0,log2,810,COMPLETE
1261,1261,0.28530753968253963,2022-12-02 00:06:56.425570,2022-12-02 00:07:06.324756,0 days 00:00:09.899186,balanced,10.0,log2,710,COMPLETE
1262,1262,0.2912599206349206,2022-12-02 00:07:06.544466,2022-12-02 00:07:16.405986,0 days 00:00:09.861520,balanced,10.0,log2,710,COMPLETE
1263,1263,0.26804563492063493,2022-12-02 00:07:16.643650,2022-12-02 00:07:27.176083,0 days 00:00:10.532433,balanced,3.0,log2,760,COMPLETE
1264,1264,0.14042364419416548,2022-12-02 00:07:27.402075,2022-12-02 00:07:37.424254,0 days 00:00:10.022179,balanced,,log2,760,COMPLETE
1265,1265,0.28451058201058194,2022-12-02 00:07:37.655365,2022-12-02 00:07:48.120913,0 days 00:00:10.465548,balanced,10.0,log2,810,COMPLETE
1266,1266,0.2932705026455026,2022-12-02 00:07:48.348243,2022-12-02 00:07:58.210796,0 days 00:00:09.862553,balanced,10.0,log2,710,COMPLETE
1267,1267,0.27554232804232803,2022-12-02 00:07:58.438168,2022-12-02 00:08:08.314777,0 days 00:00:09.876609,balanced,10.0,log2,760,COMPLETE
1268,1268,0.1576896340885349,2022-12-02 00:08:08.547072,2022-12-02 00:08:18.327317,0 days 00:00:09.780245,balanced,31.0,log2,710,COMPLETE
