,number,value,datetime_start,datetime_complete,duration,params_class_weight,params_max_depth,params_max_features,params_n_estimators,state
2217,2217,0.27672288359788355,2022-12-02 02:53:47.529225,2022-12-02 02:53:57.696965,0 days 00:00:10.167740,balanced,8.0,log2,710,COMPLETE
2218,2218,0.2605125661375661,2022-12-02 02:53:57.945723,2022-12-02 02:54:08.855165,0 days 00:00:10.909442,balanced,2.0,log2,810,COMPLETE
2219,2219,0.16359817838579976,2022-12-02 02:54:09.099414,2022-12-02 02:54:19.896423,0 days 00:00:10.797009,balanced,19.0,0.6,760,COMPLETE
2220,2220,0.155287916835393,2022-12-02 02:54:20.139105,2022-12-02 02:54:30.290828,0 days 00:00:10.151723,balanced,32.0,log2,810,COMPLETE
2221,2221,0.26583333333333337,2022-12-02 02:54:30.543196,2022-12-02 02:54:40.875608,0 days 00:00:10.332412,balanced,3.0,log2,710,COMPLETE
2222,2222,0.14376445876079663,2022-12-02 02:54:41.120056,2022-12-02 02:54:51.266504,0 days 00:00:10.146448,balanced,29.0,log2,760,COMPLETE
2223,2223,0.17853091128576565,2022-12-02 02:54:51.526946,2022-12-02 02:55:03.903554,0 days 00:00:12.376608,balanced,28.0,1.0,760,COMPLETE
2224,2224,0.2969405363155363,2022-12-02 02:55:04.145864,2022-12-02 02:55:14.516218,0 days 00:00:10.370354,balanced,13.0,log2,760,COMPLETE
2225,2225,0.2845998677248677,2022-12-02 02:55:14.773004,2022-12-02 02:55:25.401492,0 days 00:00:10.628488,balanced,9.0,log2,810,COMPLETE
2226,2226,0.30314153439153435,2022-12-02 02:55:25.643563,2022-12-02 02:55:36.355845,0 days 00:00:10.712282,balanced,12.0,log2,860,COMPLETE
2227,2227,0.14743158094804693,2022-12-02 02:55:36.614084,2022-12-02 02:55:45.738345,0 days 00:00:09.124261,balanced,20.0,sqrt,710,COMPLETE
2228,2228,0.2328464222510318,2022-12-02 02:55:45.989038,2022-12-02 02:55:56.504702,0 days 00:00:10.515664,balanced,22.0,log2,910,COMPLETE
2229,2229,0.2825396825396825,2022-12-02 02:55:56.747563,2022-12-02 02:56:05.958681,0 days 00:00:09.211118,balanced,7.0,log2,560,COMPLETE
2230,2230,0.15348034577765352,2022-12-02 02:56:06.197459,2022-12-02 02:56:16.171838,0 days 00:00:09.974379,balanced,,log2,760,COMPLETE
2231,2231,0.2916236772486772,2022-12-02 02:56:16.421472,2022-12-02 02:56:27.103638,0 days 00:00:10.682166,balanced,9.0,log2,810,COMPLETE
2232,2232,0.2072033079116112,2022-12-02 02:56:27.346422,2022-12-02 02:56:37.235954,0 days 00:00:09.889532,balanced,23.0,log2,710,COMPLETE
2233,2233,0.26704695767195763,2022-12-02 02:56:37.493629,2022-12-02 02:56:48.100405,0 days 00:00:10.606776,balanced,1.0,log2,760,COMPLETE
2234,2234,0.17421675142548926,2022-12-02 02:56:48.350997,2022-12-02 02:57:00.334922,0 days 00:00:11.983925,balanced,27.0,0.9,760,COMPLETE
2235,2235,0.1703159513535727,2022-12-02 02:57:00.595031,2022-12-02 02:57:12.445041,0 days 00:00:11.850010,balanced,12.0,0.8,810,COMPLETE
2236,2236,0.132985786933231,2022-12-02 02:57:12.695685,2022-12-02 02:57:22.450782,0 days 00:00:09.755097,balanced,33.0,log2,710,COMPLETE
2237,2237,0.18139391195823235,2022-12-02 02:57:22.697009,2022-12-02 02:57:34.468470,0 days 00:00:11.771461,balanced,8.0,0.7,860,COMPLETE
2238,2238,0.16138812738707173,2022-12-02 02:57:34.721341,2022-12-02 02:57:44.790128,0 days 00:00:10.068787,balanced,31.0,log2,760,COMPLETE
2239,2239,0.18188344377664764,2022-12-02 02:57:45.037125,2022-12-02 02:57:57.416637,0 days 00:00:12.379512,balanced,37.0,,760,COMPLETE
2240,2240,0.2679166666666667,2022-12-02 02:57:57.674433,2022-12-02 02:58:07.903532,0 days 00:00:10.229099,balanced,3.0,log2,710,COMPLETE
2241,2241,0.1470776038815139,2022-12-02 02:58:08.152555,2022-12-02 02:58:18.269440,0 days 00:00:10.116885,balanced,36.0,log2,810,COMPLETE
2242,2242,0.17691581829199357,2022-12-02 02:58:18.520849,2022-12-02 02:58:28.654605,0 days 00:00:10.133756,balanced,26.0,log2,760,COMPLETE
2243,2243,0.14149543868057174,2022-12-02 02:58:28.907742,2022-12-02 02:58:39.187252,0 days 00:00:10.279510,balanced,34.0,log2,810,COMPLETE
2244,2244,0.13938160162467556,2022-12-02 02:58:39.429540,2022-12-02 02:58:48.675360,0 days 00:00:09.245820,balanced,25.0,sqrt,710,COMPLETE
2245,2245,0.2950009018759019,2022-12-02 02:58:48.929702,2022-12-02 02:58:59.182720,0 days 00:00:10.253018,balanced,9.0,log2,760,COMPLETE
2246,2246,0.28481240981240974,2022-12-02 02:58:59.434020,2022-12-02 02:59:09.701759,0 days 00:00:10.267739,balanced,12.0,log2,760,COMPLETE
2247,2247,0.2659027777777778,2022-12-02 02:59:09.952714,2022-12-02 02:59:20.499225,0 days 00:00:10.546511,balanced,4.0,log2,760,COMPLETE
2248,2248,0.17005718593704028,2022-12-02 02:59:20.743527,2022-12-02 02:59:31.818592,0 days 00:00:11.075065,balanced,18.0,0.6,810,COMPLETE
2249,2249,0.28377735690235684,2022-12-02 02:59:32.063477,2022-12-02 02:59:42.198359,0 days 00:00:10.134882,balanced,11.0,log2,710,COMPLETE
2250,2250,0.14274845484277857,2022-12-02 02:59:42.455425,2022-12-02 02:59:52.853582,0 days 00:00:10.398157,balanced,35.0,log2,860,COMPLETE
2251,2251,0.17272828528738288,2022-12-02 02:59:53.109403,2022-12-02 03:00:03.369902,0 days 00:00:10.260499,balanced,30.0,log2,760,COMPLETE
2252,2252,0.26067488067488065,2022-12-02 03:00:03.621620,2022-12-02 03:00:13.581845,0 days 00:00:09.960225,balanced,17.0,log2,710,COMPLETE
2253,2253,0.19345829447726454,2022-12-02 03:00:13.830072,2022-12-02 03:00:23.879082,0 days 00:00:10.049010,balanced,24.0,log2,760,COMPLETE
2254,2254,0.27469937469937467,2022-12-02 03:00:24.122295,2022-12-02 03:00:34.511148,0 days 00:00:10.388853,balanced,14.0,log2,810,COMPLETE
2255,2255,0.21399458057225046,2022-12-02 03:00:34.748640,2022-12-02 03:00:46.948228,0 days 00:00:12.199588,balanced,5.0,1.0,760,COMPLETE
2256,2256,0.2766272847522847,2022-12-02 03:00:47.192126,2022-12-02 03:00:58.136113,0 days 00:00:10.943987,balanced,15.0,log2,910,COMPLETE
2257,2257,0.26898809523809525,2022-12-02 03:00:58.401061,2022-12-02 03:01:09.331744,0 days 00:00:10.930683,balanced,6.0,log2,860,COMPLETE
2258,2258,0.23567168942168942,2022-12-02 03:01:09.575332,2022-12-02 03:01:19.008482,0 days 00:00:09.433150,balanced,9.0,sqrt,710,COMPLETE
2259,2259,0.24064298990769578,2022-12-02 03:01:19.259587,2022-12-02 03:01:29.499940,0 days 00:00:10.240353,balanced,21.0,log2,810,COMPLETE
2260,2260,0.14792918571272512,2022-12-02 03:01:29.745240,2022-12-02 03:01:39.706243,0 days 00:00:09.961003,balanced,38.0,log2,760,COMPLETE
2261,2261,0.14591285651687635,2022-12-02 03:01:39.959123,2022-12-02 03:01:49.838012,0 days 00:00:09.878889,balanced,39.0,log2,710,COMPLETE
2262,2262,0.2899470899470899,2022-12-02 03:01:50.095928,2022-12-02 03:02:00.253642,0 days 00:00:10.157714,balanced,12.0,log2,760,COMPLETE
2263,2263,0.28757275132275123,2022-12-02 03:02:00.505138,2022-12-02 03:02:10.988596,0 days 00:00:10.483458,balanced,10.0,log2,810,COMPLETE
2264,2264,0.17971808059793495,2022-12-02 03:02:11.232762,2022-12-02 03:02:23.207383,0 days 00:00:11.974621,balanced,19.0,0.9,760,COMPLETE
2265,2265,0.19307790106333794,2022-12-02 03:02:23.457736,2022-12-02 03:02:34.678437,0 days 00:00:11.220701,balanced,8.0,0.8,710,COMPLETE
2266,2266,0.1358945079468674,2022-12-02 03:02:34.930636,2022-12-02 03:02:45.073375,0 days 00:00:10.142739,balanced,32.0,log2,760,COMPLETE
2267,2267,0.1827729940411979,2022-12-02 03:02:45.329262,2022-12-02 03:02:58.140840,0 days 00:00:12.811578,balanced,10.0,,810,COMPLETE
2268,2268,0.2803406084656084,2022-12-02 03:02:58.385068,2022-12-02 03:03:08.916133,0 days 00:00:10.531065,balanced,10.0,log2,760,COMPLETE
2269,2269,0.16148653051827816,2022-12-02 03:03:09.155803,2022-12-02 03:03:19.006931,0 days 00:00:09.851128,balanced,28.0,log2,710,COMPLETE
2270,2270,0.27999909812409807,2022-12-02 03:03:19.260976,2022-12-02 03:03:29.762739,0 days 00:00:10.501763,balanced,13.0,log2,810,COMPLETE
2271,2271,0.2575,2022-12-02 03:03:30.017955,2022-12-02 03:03:41.208455,0 days 00:00:11.190500,balanced,2.0,log2,860,COMPLETE
2272,2272,0.2787632275132275,2022-12-02 03:03:41.463026,2022-12-02 03:03:51.706479,0 days 00:00:10.243453,balanced,10.0,log2,760,COMPLETE
2273,2273,0.18367378127086864,2022-12-02 03:03:51.959081,2022-12-02 03:04:02.864782,0 days 00:00:10.905701,balanced,9.0,0.7,710,COMPLETE
2274,2274,0.25452465526962426,2022-12-02 03:04:03.121208,2022-12-02 03:04:13.147223,0 days 00:00:10.026015,balanced,20.0,log2,760,COMPLETE
2275,2275,0.13909189245214412,2022-12-02 03:04:13.407018,2022-12-02 03:04:23.127152,0 days 00:00:09.720134,balanced,29.0,sqrt,810,COMPLETE
2276,2276,0.26654761904761903,2022-12-02 03:04:23.390034,2022-12-02 03:04:34.040272,0 days 00:00:10.650238,balanced,3.0,log2,760,COMPLETE
2277,2277,0.2870800264550264,2022-12-02 03:04:34.286274,2022-12-02 03:04:44.304629,0 days 00:00:10.018355,balanced,10.0,log2,710,COMPLETE
2278,2278,0.1638713329550708,2022-12-02 03:04:44.562831,2022-12-02 03:04:55.382707,0 days 00:00:10.819876,balanced,12.0,0.6,760,COMPLETE
2279,2279,0.29269931457431453,2022-12-02 03:04:55.633092,2022-12-02 03:05:06.193165,0 days 00:00:10.560073,balanced,10.0,log2,810,COMPLETE
2280,2280,0.29053902116402114,2022-12-02 03:05:06.446660,2022-12-02 03:05:17.310096,0 days 00:00:10.863436,balanced,10.0,log2,860,COMPLETE
2281,2281,0.29246121933621927,2022-12-02 03:05:17.557121,2022-12-02 03:05:27.920967,0 days 00:00:10.363846,balanced,10.0,log2,760,COMPLETE
2282,2282,0.27499669312169306,2022-12-02 03:05:28.169179,2022-12-02 03:05:38.399164,0 days 00:00:10.229985,balanced,7.0,log2,710,COMPLETE
2283,2283,0.14174735118716314,2022-12-02 03:05:38.644940,2022-12-02 03:05:48.902607,0 days 00:00:10.257667,balanced,,log2,810,COMPLETE
2284,2284,0.1723437419735963,2022-12-02 03:05:49.167763,2022-12-02 03:06:01.614560,0 days 00:00:12.446797,balanced,22.0,1.0,760,COMPLETE
2285,2285,0.2950628306878307,2022-12-02 03:06:01.867631,2022-12-02 03:06:12.181821,0 days 00:00:10.314190,balanced,10.0,log2,760,COMPLETE
2286,2286,0.2665112433862434,2022-12-02 03:06:12.434073,2022-12-02 03:06:22.565113,0 days 00:00:10.131040,balanced,1.0,log2,710,COMPLETE
2287,2287,0.22065556905958542,2022-12-02 03:06:22.816394,2022-12-02 03:06:32.975634,0 days 00:00:10.159240,balanced,23.0,log2,810,COMPLETE
2288,2288,0.28124428811928814,2022-12-02 03:06:33.222950,2022-12-02 03:06:43.519826,0 days 00:00:10.296876,balanced,9.0,log2,760,COMPLETE
2289,2289,0.16559848390557036,2022-12-02 03:06:43.773965,2022-12-02 03:06:53.787786,0 days 00:00:10.013821,balanced,27.0,log2,710,COMPLETE
2290,2290,0.2163996188996189,2022-12-02 03:06:54.041879,2022-12-02 03:07:03.580958,0 days 00:00:09.539079,balanced,12.0,sqrt,760,COMPLETE
2291,2291,0.28281746031746036,2022-12-02 03:07:03.833088,2022-12-02 03:07:14.233673,0 days 00:00:10.400585,balanced,8.0,log2,760,COMPLETE
2292,2292,0.14832383527833712,2022-12-02 03:07:14.486518,2022-12-02 03:07:24.647163,0 days 00:00:10.160645,balanced,33.0,log2,810,COMPLETE
2293,2293,0.2809965728715728,2022-12-02 03:07:24.898359,2022-12-02 03:07:34.974721,0 days 00:00:10.076362,balanced,10.0,log2,710,COMPLETE
2294,2294,0.17896809344018078,2022-12-02 03:07:35.225559,2022-12-02 03:07:47.119974,0 days 00:00:11.894415,balanced,10.0,0.9,760,COMPLETE
2295,2295,0.28746362433862427,2022-12-02 03:07:47.375119,2022-12-02 03:07:58.360146,0 days 00:00:10.985027,balanced,10.0,log2,860,COMPLETE
2296,2296,0.29057629870129864,2022-12-02 03:07:58.613594,2022-12-02 03:08:08.940919,0 days 00:00:10.327325,balanced,10.0,log2,810,COMPLETE
2297,2297,0.18202143078963465,2022-12-02 03:08:09.209583,2022-12-02 03:08:20.668988,0 days 00:00:11.459405,balanced,34.0,0.8,760,COMPLETE
2298,2298,0.17314532285406073,2022-12-02 03:08:20.913601,2022-12-02 03:08:32.970122,0 days 00:00:12.056521,balanced,26.0,,710,COMPLETE
2299,2299,0.2796214572913602,2022-12-02 03:08:33.220865,2022-12-02 03:08:44.328675,0 days 00:00:11.107810,balanced,3.0,0.7,810,COMPLETE
2300,2300,0.18866826728989494,2022-12-02 03:08:44.588383,2022-12-02 03:08:54.607451,0 days 00:00:10.019068,balanced,25.0,log2,760,COMPLETE
2301,2301,0.14928877934344847,2022-12-02 03:08:54.852487,2022-12-02 03:09:04.649552,0 days 00:00:09.797065,balanced,36.0,log2,710,COMPLETE
2302,2302,0.27886904761904757,2022-12-02 03:09:04.894343,2022-12-02 03:09:15.256274,0 days 00:00:10.361931,balanced,9.0,log2,760,COMPLETE
2303,2303,0.14057056792155856,2022-12-02 03:09:15.506654,2022-12-02 03:09:25.548510,0 days 00:00:10.041856,balanced,37.0,log2,810,COMPLETE
2304,2304,0.1574173644208481,2022-12-02 03:09:25.790378,2022-12-02 03:09:36.191721,0 days 00:00:10.401343,balanced,31.0,log2,860,COMPLETE
2305,2305,0.28930886243386245,2022-12-02 03:09:36.432829,2022-12-02 03:09:46.479152,0 days 00:00:10.046323,balanced,11.0,log2,710,COMPLETE
2306,2306,0.2726058201058201,2022-12-02 03:09:46.741372,2022-12-02 03:09:57.115451,0 days 00:00:10.374079,balanced,10.0,log2,760,COMPLETE
2307,2307,0.2186103017353017,2022-12-02 03:09:57.357848,2022-12-02 03:10:06.740098,0 days 00:00:09.382250,balanced,12.0,sqrt,760,COMPLETE
2308,2308,0.18039516174224907,2022-12-02 03:10:06.986401,2022-12-02 03:10:16.575371,0 days 00:00:09.588970,balanced,30.0,0.6,560,COMPLETE
2309,2309,0.26724053724053726,2022-12-02 03:10:16.821012,2022-12-02 03:10:27.000329,0 days 00:00:10.179317,balanced,18.0,log2,810,COMPLETE
2310,2310,0.28465277777777775,2022-12-02 03:10:27.251578,2022-12-02 03:10:38.416736,0 days 00:00:11.165158,balanced,10.0,log2,910,COMPLETE
2311,2311,0.2653373015873017,2022-12-02 03:10:38.669057,2022-12-02 03:10:49.004097,0 days 00:00:10.335040,balanced,4.0,log2,760,COMPLETE
2312,2312,0.288720238095238,2022-12-02 03:10:49.251950,2022-12-02 03:10:59.405708,0 days 00:00:10.153758,balanced,10.0,log2,710,COMPLETE
2313,2313,0.14377086790579746,2022-12-02 03:10:59.648263,2022-12-02 03:11:09.759644,0 days 00:00:10.111381,balanced,35.0,log2,760,COMPLETE
2314,2314,0.28347222222222224,2022-12-02 03:11:10.012965,2022-12-02 03:11:20.135287,0 days 00:00:10.122322,balanced,6.0,log2,710,COMPLETE
2315,2315,0.28200396825396823,2022-12-02 03:11:20.392104,2022-12-02 03:11:30.706609,0 days 00:00:10.314505,balanced,10.0,log2,760,COMPLETE
2316,2316,0.27358134920634924,2022-12-02 03:11:30.958114,2022-12-02 03:11:41.745065,0 days 00:00:10.786951,balanced,5.0,log2,810,COMPLETE
2317,2317,0.27574735449735444,2022-12-02 03:11:41.988435,2022-12-02 03:11:52.859705,0 days 00:00:10.871270,balanced,14.0,log2,910,COMPLETE
2318,2318,0.18311228617660655,2022-12-02 03:11:53.119516,2022-12-02 03:12:06.408038,0 days 00:00:13.288522,balanced,38.0,1.0,860,COMPLETE
2319,2319,0.2850880832130832,2022-12-02 03:12:06.667194,2022-12-02 03:12:16.506292,0 days 00:00:09.839098,balanced,15.0,log2,760,COMPLETE
2320,2320,0.272843314093314,2022-12-02 03:12:16.755997,2022-12-02 03:12:26.457146,0 days 00:00:09.701149,balanced,17.0,log2,710,COMPLETE
2321,2321,0.29649801587301583,2022-12-02 03:12:26.704040,2022-12-02 03:12:37.229894,0 days 00:00:10.525854,balanced,10.0,log2,810,COMPLETE
2322,2322,0.2443136493136493,2022-12-02 03:12:37.474339,2022-12-02 03:12:46.796400,0 days 00:00:09.322061,balanced,9.0,sqrt,760,COMPLETE
2323,2323,0.13475523495821481,2022-12-02 03:12:47.052656,2022-12-02 03:12:57.213849,0 days 00:00:10.161193,balanced,39.0,log2,760,COMPLETE
2324,2324,0.2805531505531505,2022-12-02 03:12:57.472599,2022-12-02 03:13:07.402163,0 days 00:00:09.929564,balanced,12.0,log2,710,COMPLETE
2325,2325,0.17765856963065702,2022-12-02 03:13:07.653254,2022-12-02 03:13:20.030983,0 days 00:00:12.377729,balanced,19.0,0.9,810,COMPLETE
2326,2326,0.1734998330508039,2022-12-02 03:13:20.281410,2022-12-02 03:13:31.882573,0 days 00:00:11.601163,balanced,21.0,0.8,760,COMPLETE
2327,2327,0.2760681216931216,2022-12-02 03:13:32.130039,2022-12-02 03:13:42.316660,0 days 00:00:10.186621,balanced,8.0,log2,710,COMPLETE
2328,2328,0.19723913758876194,2022-12-02 03:13:42.569751,2022-12-02 03:13:52.882711,0 days 00:00:10.312960,balanced,24.0,log2,810,COMPLETE
2329,2329,0.17165711378696816,2022-12-02 03:13:53.134503,2022-12-02 03:14:04.229338,0 days 00:00:11.094835,balanced,10.0,0.7,760,COMPLETE
2330,2330,0.29340608465608453,2022-12-02 03:14:04.480981,2022-12-02 03:14:15.021993,0 days 00:00:10.541012,balanced,10.0,log2,810,COMPLETE
2331,2331,0.18619429675861715,2022-12-02 03:14:15.275953,2022-12-02 03:14:28.424558,0 days 00:00:13.148605,balanced,32.0,,860,COMPLETE
2332,2332,0.2886348605098605,2022-12-02 03:14:28.687790,2022-12-02 03:14:38.821930,0 days 00:00:10.134140,balanced,10.0,log2,760,COMPLETE
2333,2333,0.15737268567276286,2022-12-02 03:14:39.069704,2022-12-02 03:14:49.072689,0 days 00:00:10.002985,balanced,28.0,log2,760,COMPLETE
2334,2334,0.15541720144716092,2022-12-02 03:14:49.320773,2022-12-02 03:14:59.258035,0 days 00:00:09.937262,balanced,29.0,log2,710,COMPLETE
2335,2335,0.25758421193043957,2022-12-02 03:14:59.503784,2022-12-02 03:15:09.355468,0 days 00:00:09.851684,balanced,20.0,log2,710,COMPLETE
2336,2336,0.2737623256373256,2022-12-02 03:15:09.610543,2022-12-02 03:15:20.005376,0 days 00:00:10.394833,balanced,13.0,log2,760,COMPLETE
2337,2337,0.25958333333333333,2022-12-02 03:15:20.256027,2022-12-02 03:15:31.100529,0 days 00:00:10.844502,balanced,2.0,log2,810,COMPLETE
2338,2338,0.16509867043240828,2022-12-02 03:15:31.360517,2022-12-02 03:15:41.998374,0 days 00:00:10.637857,balanced,10.0,0.6,760,COMPLETE
2339,2339,0.21065669345274607,2022-12-02 03:15:42.243218,2022-12-02 03:15:52.292824,0 days 00:00:10.049606,balanced,22.0,log2,760,COMPLETE
2340,2340,0.23488148425648428,2022-12-02 03:15:52.550253,2022-12-02 03:16:02.024118,0 days 00:00:09.473865,balanced,10.0,sqrt,710,COMPLETE
2341,2341,0.2885681216931216,2022-12-02 03:16:02.271211,2022-12-02 03:16:12.864449,0 days 00:00:10.593238,balanced,12.0,log2,810,COMPLETE
2342,2342,0.28288029100529094,2022-12-02 03:16:13.078161,2022-12-02 03:16:23.418234,0 days 00:00:10.340073,balanced,9.0,log2,760,COMPLETE
2343,2343,0.26475198412698414,2022-12-02 03:16:23.674994,2022-12-02 03:16:33.841781,0 days 00:00:10.166787,balanced,3.0,log2,710,COMPLETE
2344,2344,0.27398148148148144,2022-12-02 03:16:34.108490,2022-12-02 03:16:44.887645,0 days 00:00:10.779155,balanced,10.0,log2,860,COMPLETE
2345,2345,0.182852359120563,2022-12-02 03:16:45.139796,2022-12-02 03:16:57.565693,0 days 00:00:12.425897,balanced,10.0,1.0,760,COMPLETE
2346,2346,0.28638979076479076,2022-12-02 03:16:57.811646,2022-12-02 03:17:08.268351,0 days 00:00:10.456705,balanced,10.0,log2,810,COMPLETE
2347,2347,0.28722402597402596,2022-12-02 03:17:08.522606,2022-12-02 03:17:19.030491,0 days 00:00:10.507885,balanced,1.0,log2,760,COMPLETE
2348,2348,0.28919071669071666,2022-12-02 03:17:19.284387,2022-12-02 03:17:29.357034,0 days 00:00:10.072647,balanced,10.0,log2,710,COMPLETE
2349,2349,0.27772486772486776,2022-12-02 03:17:29.604258,2022-12-02 03:17:40.003581,0 days 00:00:10.399323,balanced,7.0,log2,760,COMPLETE
2350,2350,0.14678340065283985,2022-12-02 03:17:40.246771,2022-12-02 03:17:50.472445,0 days 00:00:10.225674,balanced,,log2,810,COMPLETE
2351,2351,0.29112433862433856,2022-12-02 03:17:50.717471,2022-12-02 03:18:00.780482,0 days 00:00:10.063011,balanced,9.0,log2,710,COMPLETE
2352,2352,0.1640805550794237,2022-12-02 03:18:01.031590,2022-12-02 03:18:11.157426,0 days 00:00:10.125836,balanced,27.0,log2,760,COMPLETE
2353,2353,0.22347922910422913,2022-12-02 03:18:11.409081,2022-12-02 03:18:21.084789,0 days 00:00:09.675708,balanced,12.0,sqrt,810,COMPLETE
2354,2354,0.2835416666666667,2022-12-02 03:18:21.336023,2022-12-02 03:18:32.222690,0 days 00:00:10.886667,balanced,8.0,log2,860,COMPLETE
2355,2355,0.17474122874608308,2022-12-02 03:18:32.472192,2022-12-02 03:18:44.529740,0 days 00:00:12.057548,balanced,33.0,0.9,760,COMPLETE
2356,2356,0.18408845738942822,2022-12-02 03:18:44.795738,2022-12-02 03:18:56.033868,0 days 00:00:11.238130,balanced,23.0,0.8,710,COMPLETE
2357,2357,0.30122023809523807,2022-12-02 03:18:56.288623,2022-12-02 03:19:06.582522,0 days 00:00:10.293899,balanced,10.0,log2,760,COMPLETE
2358,2358,0.17029479375353163,2022-12-02 03:19:06.836250,2022-12-02 03:19:19.634651,0 days 00:00:12.798401,balanced,34.0,,810,COMPLETE
2359,2359,0.28032407407407406,2022-12-02 03:19:19.874305,2022-12-02 03:19:29.948426,0 days 00:00:10.074121,balanced,10.0,log2,760,COMPLETE
2360,2360,0.2971858465608465,2022-12-02 03:19:30.194576,2022-12-02 03:19:40.270332,0 days 00:00:10.075756,balanced,10.0,log2,710,COMPLETE
2361,2361,0.17344624877998666,2022-12-02 03:19:40.511177,2022-12-02 03:19:50.629044,0 days 00:00:10.117867,balanced,26.0,0.7,610,COMPLETE
2362,2362,0.13237007318656985,2022-12-02 03:19:50.874679,2022-12-02 03:20:00.914592,0 days 00:00:10.039913,balanced,36.0,log2,760,COMPLETE
2363,2363,0.1497690845685047,2022-12-02 03:20:01.164842,2022-12-02 03:20:11.199245,0 days 00:00:10.034403,balanced,31.0,log2,760,COMPLETE
2364,2364,0.18996523098533802,2022-12-02 03:20:11.448328,2022-12-02 03:20:21.549754,0 days 00:00:10.101426,balanced,25.0,log2,810,COMPLETE
2365,2365,0.1556870097360415,2022-12-02 03:20:21.800130,2022-12-02 03:20:31.488226,0 days 00:00:09.688096,balanced,37.0,log2,710,COMPLETE
2366,2366,0.28622622747622745,2022-12-02 03:20:31.732496,2022-12-02 03:20:42.067117,0 days 00:00:10.334621,balanced,10.0,log2,760,COMPLETE
2367,2367,0.26791666666666664,2022-12-02 03:20:42.330353,2022-12-02 03:20:53.694926,0 days 00:00:11.364573,balanced,3.0,log2,910,COMPLETE
2368,2368,0.27742063492063485,2022-12-02 03:20:53.950774,2022-12-02 03:21:04.784814,0 days 00:00:10.834040,balanced,9.0,log2,860,COMPLETE
2369,2369,0.2818954425204424,2022-12-02 03:21:05.043954,2022-12-02 03:21:15.578574,0 days 00:00:10.534620,balanced,10.0,log2,810,COMPLETE
2370,2370,0.18118941378650114,2022-12-02 03:21:15.817486,2022-12-02 03:21:26.170297,0 days 00:00:10.352811,balanced,12.0,0.6,710,COMPLETE
2371,2371,0.2344945101195101,2022-12-02 03:21:26.538423,2022-12-02 03:21:36.226825,0 days 00:00:09.688402,balanced,10.0,sqrt,760,COMPLETE
2372,2372,0.1510245892220859,2022-12-02 03:21:36.500521,2022-12-02 03:21:46.216251,0 days 00:00:09.715730,balanced,30.0,log2,710,COMPLETE
2373,2373,0.2549530793280793,2022-12-02 03:21:46.474979,2022-12-02 03:21:56.738440,0 days 00:00:10.263461,balanced,18.0,log2,810,COMPLETE
2374,2374,0.13830150856411,2022-12-02 03:21:56.993241,2022-12-02 03:22:07.129732,0 days 00:00:10.136491,balanced,35.0,log2,760,COMPLETE
