,number,value,datetime_start,datetime_complete,duration,params_class_weight,params_max_depth,params_max_features,params_n_estimators,state
1743,1743,0.1577880719652065,2022-12-02 01:29:48.832807,2022-12-02 01:29:59.237249,0 days 00:00:10.404442,balanced,29.0,log2,860,COMPLETE
1744,1744,0.28920725108225104,2022-12-02 01:29:59.474652,2022-12-02 01:30:09.525404,0 days 00:00:10.050752,balanced,10.0,log2,710,COMPLETE
1745,1745,0.23275129962629962,2022-12-02 01:30:09.765942,2022-12-02 01:30:19.176918,0 days 00:00:09.410976,balanced,10.0,sqrt,760,COMPLETE
1746,1746,0.20310422223376173,2022-12-02 01:30:19.418722,2022-12-02 01:30:29.448199,0 days 00:00:10.029477,balanced,22.0,log2,760,COMPLETE
1747,1747,0.2958041726791727,2022-12-02 01:30:29.682621,2022-12-02 01:30:39.721104,0 days 00:00:10.038483,balanced,10.0,log2,710,COMPLETE
1748,1748,0.28173280423280417,2022-12-02 01:30:39.957687,2022-12-02 01:30:50.458604,0 days 00:00:10.500917,balanced,10.0,log2,810,COMPLETE
1749,1749,0.23415675759425764,2022-12-02 01:30:50.691457,2022-12-02 01:31:00.653385,0 days 00:00:09.961928,balanced,20.0,log2,760,COMPLETE
1750,1750,0.145636960431078,2022-12-02 01:31:00.886252,2022-12-02 01:31:10.715404,0 days 00:00:09.829152,balanced,,log2,710,COMPLETE
1751,1751,0.2807085738335738,2022-12-02 01:31:10.956908,2022-12-02 01:31:21.207794,0 days 00:00:10.250886,balanced,10.0,log2,760,COMPLETE
1752,1752,0.27522817460317456,2022-12-02 01:31:21.448054,2022-12-02 01:31:32.012221,0 days 00:00:10.564167,balanced,8.0,log2,810,COMPLETE
1753,1753,0.29248767436267437,2022-12-02 01:31:32.251016,2022-12-02 01:31:42.169500,0 days 00:00:09.918484,balanced,10.0,log2,710,COMPLETE
1754,1754,0.2929085497835498,2022-12-02 01:31:42.409814,2022-12-02 01:31:52.806762,0 days 00:00:10.396948,balanced,1.0,log2,760,COMPLETE
1755,1755,0.17082371133346577,2022-12-02 01:31:53.036422,2022-12-02 01:32:03.031075,0 days 00:00:09.994653,balanced,27.0,log2,760,COMPLETE
1756,1756,0.2880919312169312,2022-12-02 01:32:03.263113,2022-12-02 01:32:13.286717,0 days 00:00:10.023604,balanced,10.0,log2,710,COMPLETE
1757,1757,0.23839618714618713,2022-12-02 01:32:13.527315,2022-12-02 01:32:22.929016,0 days 00:00:09.401701,balanced,9.0,sqrt,760,COMPLETE
1758,1758,0.28772486772486766,2022-12-02 01:32:23.162163,2022-12-02 01:32:33.541798,0 days 00:00:10.379635,balanced,10.0,log2,810,COMPLETE
1759,1759,0.20461027206673016,2022-12-02 01:32:33.783607,2022-12-02 01:32:43.596909,0 days 00:00:09.813302,balanced,23.0,log2,760,COMPLETE
1760,1760,0.2621136964886965,2022-12-02 01:32:43.835878,2022-12-02 01:32:54.318731,0 days 00:00:10.482853,balanced,16.0,log2,860,COMPLETE
1761,1761,0.2838194444444444,2022-12-02 01:32:54.570848,2022-12-02 01:33:04.998289,0 days 00:00:10.427441,balanced,7.0,log2,810,COMPLETE
1762,1762,0.1466743421629106,2022-12-02 01:33:05.232092,2022-12-02 01:33:14.991844,0 days 00:00:09.759752,balanced,33.0,log2,710,COMPLETE
1763,1763,0.30347643097643096,2022-12-02 01:33:15.238464,2022-12-02 01:33:25.473667,0 days 00:00:10.235203,balanced,10.0,log2,760,COMPLETE
1764,1764,0.262880291005291,2022-12-02 01:33:25.709468,2022-12-02 01:33:35.843512,0 days 00:00:10.134044,balanced,3.0,log2,710,COMPLETE
1765,1765,0.30937828375328363,2022-12-02 01:33:36.086990,2022-12-02 01:33:46.212119,0 days 00:00:10.125129,balanced,12.0,log2,760,COMPLETE
1766,1766,0.13995239636396345,2022-12-02 01:33:46.445136,2022-12-02 01:33:56.466759,0 days 00:00:10.021623,balanced,36.0,log2,760,COMPLETE
1767,1767,0.30028198653198646,2022-12-02 01:33:56.707886,2022-12-02 01:34:06.802684,0 days 00:00:10.094798,balanced,12.0,log2,760,COMPLETE
1768,1768,0.2760987854737854,2022-12-02 01:34:07.050970,2022-12-02 01:34:17.061576,0 days 00:00:10.010606,balanced,12.0,log2,710,COMPLETE
1769,1769,0.29230910293410284,2022-12-02 01:34:17.297397,2022-12-02 01:34:27.355518,0 days 00:00:10.058121,balanced,12.0,log2,760,COMPLETE
1770,1770,0.14760299631685583,2022-12-02 01:34:27.603497,2022-12-02 01:34:36.875415,0 days 00:00:09.271918,balanced,34.0,sqrt,710,COMPLETE
1771,1771,0.2887187349687349,2022-12-02 01:34:37.115900,2022-12-02 01:34:47.003822,0 days 00:00:09.887922,balanced,12.0,log2,710,COMPLETE
1772,1772,0.29412127224627216,2022-12-02 01:34:47.240031,2022-12-02 01:34:57.468475,0 days 00:00:10.228444,balanced,12.0,log2,760,COMPLETE
1773,1773,0.26992063492063484,2022-12-02 01:34:57.710399,2022-12-02 01:35:08.230965,0 days 00:00:10.520566,balanced,5.0,log2,760,COMPLETE
1774,1774,0.28983134920634923,2022-12-02 01:35:08.473161,2022-12-02 01:35:18.259205,0 days 00:00:09.786044,balanced,12.0,log2,710,COMPLETE
1775,1775,0.2866501322751322,2022-12-02 01:35:18.500067,2022-12-02 01:35:28.582261,0 days 00:00:10.082194,balanced,12.0,log2,760,COMPLETE
1776,1776,0.2921124939874939,2022-12-02 01:35:28.816320,2022-12-02 01:35:38.680248,0 days 00:00:09.863928,balanced,12.0,log2,710,COMPLETE
1777,1777,0.28619406056906055,2022-12-02 01:35:38.916180,2022-12-02 01:35:49.023679,0 days 00:00:10.107499,balanced,12.0,log2,760,COMPLETE
1778,1778,0.28710828523328524,2022-12-02 01:35:49.260978,2022-12-02 01:35:59.470737,0 days 00:00:10.209759,balanced,12.0,log2,760,COMPLETE
1779,1779,0.18824744894259793,2022-12-02 01:35:59.714326,2022-12-02 01:36:09.590433,0 days 00:00:09.876107,balanced,26.0,log2,710,COMPLETE
1780,1780,0.14423486435629268,2022-12-02 01:36:09.826413,2022-12-02 01:36:19.705311,0 days 00:00:09.878898,balanced,31.0,log2,760,COMPLETE
1781,1781,0.14395806200261557,2022-12-02 01:36:19.952731,2022-12-02 01:36:29.933133,0 days 00:00:09.980402,balanced,37.0,log2,760,COMPLETE
1782,1782,0.2899446849446849,2022-12-02 01:36:30.169421,2022-12-02 01:36:40.082206,0 days 00:00:09.912785,balanced,12.0,log2,710,COMPLETE
1783,1783,0.1454606198547914,2022-12-02 01:36:40.317790,2022-12-02 01:36:49.729284,0 days 00:00:09.411494,balanced,25.0,sqrt,760,COMPLETE
1784,1784,0.2869627825877825,2022-12-02 01:36:49.962953,2022-12-02 01:36:59.856179,0 days 00:00:09.893226,balanced,11.0,log2,710,COMPLETE
1785,1785,0.15166636524685953,2022-12-02 01:37:00.110210,2022-12-02 01:37:10.018181,0 days 00:00:09.907971,balanced,30.0,log2,760,COMPLETE
1786,1786,0.29013663419913416,2022-12-02 01:37:10.252678,2022-12-02 01:37:20.463172,0 days 00:00:10.210494,balanced,12.0,log2,760,COMPLETE
1787,1787,0.29827801827801825,2022-12-02 01:37:20.705607,2022-12-02 01:37:30.653906,0 days 00:00:09.948299,balanced,12.0,log2,710,COMPLETE
1788,1788,0.28646314333814327,2022-12-02 01:37:30.896458,2022-12-02 01:37:41.198820,0 days 00:00:10.302362,balanced,12.0,log2,760,COMPLETE
1789,1789,0.28998996373996366,2022-12-02 01:37:41.444191,2022-12-02 01:37:51.385949,0 days 00:00:09.941758,balanced,12.0,log2,710,COMPLETE
1790,1790,0.2683432539682539,2022-12-02 01:37:51.629655,2022-12-02 01:38:01.773656,0 days 00:00:10.144001,balanced,4.0,log2,710,COMPLETE
1791,1791,0.27981421356421354,2022-12-02 01:38:02.019113,2022-12-02 01:38:12.112826,0 days 00:00:10.093713,balanced,14.0,log2,760,COMPLETE
1792,1792,0.2738224275724276,2022-12-02 01:38:12.355737,2022-12-02 01:38:22.286569,0 days 00:00:09.930832,balanced,17.0,log2,760,COMPLETE
1793,1793,0.1460853524622881,2022-12-02 01:38:22.521792,2022-12-02 01:38:32.284657,0 days 00:00:09.762865,balanced,35.0,log2,760,COMPLETE
1794,1794,0.276413770053476,2022-12-02 01:38:32.534127,2022-12-02 01:38:42.201850,0 days 00:00:09.667723,balanced,18.0,log2,710,COMPLETE
1795,1795,0.26898809523809525,2022-12-02 01:38:42.442798,2022-12-02 01:38:52.661675,0 days 00:00:10.218877,balanced,6.0,log2,760,COMPLETE
1796,1796,0.2456380769185679,2022-12-02 01:38:52.901832,2022-12-02 01:39:02.568407,0 days 00:00:09.666575,balanced,21.0,log2,710,COMPLETE
1797,1797,0.24708418895918896,2022-12-02 01:39:02.810625,2022-12-02 01:39:12.218253,0 days 00:00:09.407628,balanced,8.0,sqrt,760,COMPLETE
1798,1798,0.2445725108225108,2022-12-02 01:39:12.464519,2022-12-02 01:39:22.196512,0 days 00:00:09.731993,balanced,19.0,log2,710,COMPLETE
1799,1799,0.19550619742735423,2022-12-02 01:39:22.434661,2022-12-02 01:39:32.174903,0 days 00:00:09.740242,balanced,24.0,log2,760,COMPLETE
1800,1800,0.1541082140964819,2022-12-02 01:39:32.418667,2022-12-02 01:39:42.333685,0 days 00:00:09.915018,balanced,39.0,log2,760,COMPLETE
1801,1801,0.14045654155314075,2022-12-02 01:39:42.573230,2022-12-02 01:39:52.198102,0 days 00:00:09.624872,balanced,38.0,log2,710,COMPLETE
1802,1802,0.14277003015207407,2022-12-02 01:39:52.431483,2022-12-02 01:40:02.102787,0 days 00:00:09.671304,balanced,32.0,log2,710,COMPLETE
1803,1803,0.2631577219077219,2022-12-02 01:40:02.346170,2022-12-02 01:40:12.322968,0 days 00:00:09.976798,balanced,16.0,log2,760,COMPLETE
1804,1804,0.26632605820105826,2022-12-02 01:40:12.569597,2022-12-02 01:40:22.925746,0 days 00:00:10.356149,balanced,3.0,log2,760,COMPLETE
1805,1805,0.1665378619445809,2022-12-02 01:40:23.167145,2022-12-02 01:40:33.228947,0 days 00:00:10.061802,balanced,28.0,log2,760,COMPLETE
1806,1806,0.29445945258445255,2022-12-02 01:40:33.457153,2022-12-02 01:40:43.161985,0 days 00:00:09.704832,balanced,13.0,log2,710,COMPLETE
1807,1807,0.26791666666666664,2022-12-02 01:40:43.398264,2022-12-02 01:40:53.478134,0 days 00:00:10.079870,balanced,2.0,log2,710,COMPLETE
1808,1808,0.1472837570888596,2022-12-02 01:40:53.721060,2022-12-02 01:41:03.722513,0 days 00:00:10.001453,balanced,29.0,log2,760,COMPLETE
1809,1809,0.1533487795698098,2022-12-02 01:41:03.962648,2022-12-02 01:41:13.203001,0 days 00:00:09.240353,balanced,20.0,sqrt,710,COMPLETE
1810,1810,0.2804316979316979,2022-12-02 01:41:13.445159,2022-12-02 01:41:23.568693,0 days 00:00:10.123534,balanced,15.0,log2,760,COMPLETE
1811,1811,0.2834003727753727,2022-12-02 01:41:23.812195,2022-12-02 01:41:34.374539,0 days 00:00:10.562344,balanced,10.0,log2,810,COMPLETE
1812,1812,0.22286230135907079,2022-12-02 01:41:34.613147,2022-12-02 01:41:44.466271,0 days 00:00:09.853124,balanced,22.0,log2,760,COMPLETE
1813,1813,0.2921578884078883,2022-12-02 01:41:44.712559,2022-12-02 01:41:54.600736,0 days 00:00:09.888177,balanced,12.0,log2,710,COMPLETE
1814,1814,0.1442685958417405,2022-12-02 01:41:54.841325,2022-12-02 01:42:04.715746,0 days 00:00:09.874421,balanced,,log2,760,COMPLETE
1815,1815,0.29248346560846555,2022-12-02 01:42:04.955611,2022-12-02 01:42:15.538619,0 days 00:00:10.583008,balanced,10.0,log2,810,COMPLETE
1816,1816,0.2788543169793169,2022-12-02 01:42:15.777152,2022-12-02 01:42:26.059303,0 days 00:00:10.282151,balanced,10.0,log2,760,COMPLETE
1817,1817,0.27756283068783066,2022-12-02 01:42:26.298263,2022-12-02 01:42:36.237128,0 days 00:00:09.938865,balanced,10.0,log2,710,COMPLETE
1818,1818,0.28187830687830684,2022-12-02 01:42:36.477188,2022-12-02 01:42:46.538989,0 days 00:00:10.061801,balanced,8.0,log2,710,COMPLETE
1819,1819,0.20353186991886685,2022-12-02 01:42:46.791081,2022-12-02 01:42:56.727128,0 days 00:00:09.936047,balanced,23.0,log2,760,COMPLETE
1820,1820,0.27610509860509863,2022-12-02 01:42:56.970575,2022-12-02 01:43:07.237677,0 days 00:00:10.267102,balanced,9.0,log2,760,COMPLETE
1821,1821,0.1730863594334468,2022-12-02 01:43:07.481918,2022-12-02 01:43:18.507988,0 days 00:00:11.026070,balanced,27.0,0.6,810,COMPLETE
1822,1822,0.2901124338624338,2022-12-02 01:43:18.745075,2022-12-02 01:43:28.892101,0 days 00:00:10.147026,balanced,10.0,log2,760,COMPLETE
1823,1823,0.2696825396825397,2022-12-02 01:43:29.140140,2022-12-02 01:43:39.290117,0 days 00:00:10.149977,balanced,1.0,sqrt,710,COMPLETE
1824,1824,0.2730059523809524,2022-12-02 01:43:39.524275,2022-12-02 01:43:49.796699,0 days 00:00:10.272424,balanced,7.0,log2,760,COMPLETE
1825,1825,0.1438447296080758,2022-12-02 01:43:50.030254,2022-12-02 01:43:59.684236,0 days 00:00:09.653982,balanced,33.0,log2,710,COMPLETE
1826,1826,0.2877777777777777,2022-12-02 01:43:59.936046,2022-12-02 01:44:10.470088,0 days 00:00:10.534042,balanced,10.0,log2,810,COMPLETE
1827,1827,0.2768662818662818,2022-12-02 01:44:10.706170,2022-12-02 01:44:20.901307,0 days 00:00:10.195137,balanced,12.0,log2,760,COMPLETE
1828,1828,0.26089526214526215,2022-12-02 01:44:21.140843,2022-12-02 01:44:31.225857,0 days 00:00:10.085014,balanced,16.0,log2,760,COMPLETE
1829,1829,0.17303121774826016,2022-12-02 01:44:31.462330,2022-12-02 01:44:41.153157,0 days 00:00:09.690827,balanced,26.0,log2,710,COMPLETE
1830,1830,0.2747453703703704,2022-12-02 01:44:41.400096,2022-12-02 01:44:51.977143,0 days 00:00:10.577047,balanced,10.0,log2,810,COMPLETE
1831,1831,0.14099351295663048,2022-12-02 01:44:52.208452,2022-12-02 01:45:02.123294,0 days 00:00:09.914842,balanced,34.0,log2,760,COMPLETE
1832,1832,0.19396784428102967,2022-12-02 01:45:02.357838,2022-12-02 01:45:12.109733,0 days 00:00:09.751895,balanced,25.0,log2,710,COMPLETE
1833,1833,0.1288467462366462,2022-12-02 01:45:12.345641,2022-12-02 01:45:22.101854,0 days 00:00:09.756213,balanced,36.0,log2,710,COMPLETE
1834,1834,0.267119708994709,2022-12-02 01:45:22.341171,2022-12-02 01:45:32.787941,0 days 00:00:10.446770,balanced,3.0,log2,760,COMPLETE
1835,1835,0.29958333333333326,2022-12-02 01:45:33.024946,2022-12-02 01:45:43.147038,0 days 00:00:10.122092,balanced,10.0,log2,760,COMPLETE
1836,1836,0.2810019841269841,2022-12-02 01:45:43.382063,2022-12-02 01:45:53.848001,0 days 00:00:10.465938,balanced,10.0,log2,810,COMPLETE
1837,1837,0.15032559982966945,2022-12-02 01:45:54.089111,2022-12-02 01:46:03.301703,0 days 00:00:09.212592,balanced,37.0,sqrt,710,COMPLETE
1838,1838,0.27800264550264553,2022-12-02 01:46:03.543132,2022-12-02 01:46:13.857796,0 days 00:00:10.314664,balanced,10.0,log2,760,COMPLETE
1839,1839,0.2825703463203463,2022-12-02 01:46:14.107646,2022-12-02 01:46:24.342685,0 days 00:00:10.235039,balanced,11.0,log2,760,COMPLETE
1840,1840,0.2757738095238095,2022-12-02 01:46:24.578449,2022-12-02 01:46:34.926009,0 days 00:00:10.347560,balanced,10.0,log2,810,COMPLETE
1841,1841,0.2954365079365079,2022-12-02 01:46:35.174133,2022-12-02 01:46:45.233705,0 days 00:00:10.059572,balanced,10.0,log2,710,COMPLETE
1842,1842,0.268614417989418,2022-12-02 01:46:45.477399,2022-12-02 01:46:55.809618,0 days 00:00:10.332219,balanced,5.0,log2,760,COMPLETE
1843,1843,0.14505064086522051,2022-12-02 01:46:56.059827,2022-12-02 01:47:06.248212,0 days 00:00:10.188385,balanced,31.0,log2,810,COMPLETE
1844,1844,0.14793536466051876,2022-12-02 01:47:06.484343,2022-12-02 01:47:16.102474,0 days 00:00:09.618131,balanced,35.0,log2,710,COMPLETE
1845,1845,0.15382159729022676,2022-12-02 01:47:16.350913,2022-12-02 01:47:26.154864,0 days 00:00:09.803951,balanced,30.0,log2,710,COMPLETE
1846,1846,0.25233155597126183,2022-12-02 01:47:26.396574,2022-12-02 01:47:35.988192,0 days 00:00:09.591618,balanced,18.0,log2,660,COMPLETE
1847,1847,0.2841645622895623,2022-12-02 01:47:36.237018,2022-12-02 01:47:46.030183,0 days 00:00:09.793165,balanced,17.0,log2,760,COMPLETE
1848,1848,0.22933492297462887,2022-12-02 01:47:46.273351,2022-12-02 01:47:55.564068,0 days 00:00:09.290717,balanced,10.0,sqrt,760,COMPLETE
1849,1849,0.3028439153439153,2022-12-02 01:47:55.805702,2022-12-02 01:48:05.957490,0 days 00:00:10.151788,balanced,12.0,log2,760,COMPLETE
1850,1850,0.23158416691183686,2022-12-02 01:48:06.203177,2022-12-02 01:48:16.702908,0 days 00:00:10.499731,balanced,4.0,0.6,760,COMPLETE
1851,1851,0.27899801587301587,2022-12-02 01:48:16.943616,2022-12-02 01:48:26.991000,0 days 00:00:10.047384,balanced,6.0,log2,710,COMPLETE
1852,1852,0.286540404040404,2022-12-02 01:48:27.236667,2022-12-02 01:48:37.418461,0 days 00:00:10.181794,balanced,14.0,log2,810,COMPLETE
1853,1853,0.13918260065999716,2022-12-02 01:48:37.652620,2022-12-02 01:48:47.320045,0 days 00:00:09.667425,balanced,38.0,log2,710,COMPLETE
1854,1854,0.28149470899470896,2022-12-02 01:48:47.564963,2022-12-02 01:48:57.821432,0 days 00:00:10.256469,balanced,10.0,log2,760,COMPLETE
1855,1855,0.1889799054097816,2022-12-02 01:48:58.062435,2022-12-02 01:49:08.348790,0 days 00:00:10.286355,balanced,24.0,log2,810,COMPLETE
1856,1856,0.28347222222222224,2022-12-02 01:49:08.591953,2022-12-02 01:49:18.710740,0 days 00:00:10.118787,balanced,8.0,log2,710,COMPLETE
1857,1857,0.27277747715247713,2022-12-02 01:49:18.944676,2022-12-02 01:49:28.986702,0 days 00:00:10.042026,balanced,15.0,log2,760,COMPLETE
1858,1858,0.24858284256954163,2022-12-02 01:49:29.213390,2022-12-02 01:49:39.312416,0 days 00:00:10.099026,balanced,21.0,log2,760,COMPLETE
1859,1859,0.28260251322751323,2022-12-02 01:49:39.550171,2022-12-02 01:49:49.320939,0 days 00:00:09.770768,balanced,10.0,log2,660,COMPLETE
1860,1860,0.2622123015873016,2022-12-02 01:49:49.569638,2022-12-02 01:49:59.455845,0 days 00:00:09.886207,balanced,19.0,log2,710,COMPLETE
1861,1861,0.13118462780905454,2022-12-02 01:49:59.690787,2022-12-02 01:50:09.927792,0 days 00:00:10.237005,balanced,39.0,log2,810,COMPLETE
1862,1862,0.17883912518621253,2022-12-02 01:50:10.173692,2022-12-02 01:50:22.002337,0 days 00:00:11.828645,balanced,10.0,0.9,760,COMPLETE
1863,1863,0.28937981000481,2022-12-02 01:50:22.247172,2022-12-02 01:50:32.381178,0 days 00:00:10.134006,balanced,16.0,log2,760,COMPLETE
1864,1864,0.2380998630998631,2022-12-02 01:50:32.624572,2022-12-02 01:50:42.048855,0 days 00:00:09.424283,balanced,10.0,sqrt,710,COMPLETE
1865,1865,0.1335863925471568,2022-12-02 01:50:42.298153,2022-12-02 01:50:52.461473,0 days 00:00:10.163320,balanced,32.0,log2,760,COMPLETE
1866,1866,0.28143939393939393,2022-12-02 01:50:52.693779,2022-12-02 01:51:03.282832,0 days 00:00:10.589053,balanced,10.0,log2,810,COMPLETE
1867,1867,0.1411430811535416,2022-12-02 01:51:03.493930,2022-12-02 01:51:13.227279,0 days 00:00:09.733349,balanced,28.0,log2,660,COMPLETE
1868,1868,0.2834559653309653,2022-12-02 01:51:13.473112,2022-12-02 01:51:23.389334,0 days 00:00:09.916222,balanced,13.0,log2,710,COMPLETE
1869,1869,0.2815584415584415,2022-12-02 01:51:23.627490,2022-12-02 01:51:33.894647,0 days 00:00:10.267157,balanced,10.0,log2,760,COMPLETE
1870,1870,0.2609490740740741,2022-12-02 01:51:34.140119,2022-12-02 01:51:44.991909,0 days 00:00:10.851790,balanced,2.0,log2,810,COMPLETE
1871,1871,0.2660624098124098,2022-12-02 01:51:45.224336,2022-12-02 01:51:55.324800,0 days 00:00:10.100464,balanced,3.0,log2,710,COMPLETE
1872,1872,0.16711917208060795,2022-12-02 01:51:55.558068,2022-12-02 01:52:05.513829,0 days 00:00:09.955761,balanced,29.0,log2,760,COMPLETE
1873,1873,0.16692737593223034,2022-12-02 01:52:05.756479,2022-12-02 01:52:16.411712,0 days 00:00:10.655233,balanced,20.0,0.6,760,COMPLETE
1874,1874,0.22755362054493236,2022-12-02 01:52:16.646212,2022-12-02 01:52:26.451581,0 days 00:00:09.805369,balanced,22.0,log2,710,COMPLETE
1875,1875,0.27574555074555074,2022-12-02 01:52:26.698137,2022-12-02 01:52:36.395974,0 days 00:00:09.697837,balanced,10.0,log2,660,COMPLETE
1876,1876,0.2946313871313871,2022-12-02 01:52:36.630709,2022-12-02 01:52:47.133792,0 days 00:00:10.503083,balanced,12.0,log2,810,COMPLETE
1877,1877,0.23927669552669548,2022-12-02 01:52:47.377339,2022-12-02 01:52:56.731652,0 days 00:00:09.354313,balanced,10.0,sqrt,760,COMPLETE
1878,1878,0.29743386243386244,2022-12-02 01:52:56.968308,2022-12-02 01:53:06.973597,0 days 00:00:10.005289,balanced,10.0,log2,710,COMPLETE
1879,1879,0.15004895775707672,2022-12-02 01:53:07.216007,2022-12-02 01:53:17.143349,0 days 00:00:09.927342,balanced,,log2,760,COMPLETE
1880,1880,0.28286375661375657,2022-12-02 01:53:17.378991,2022-12-02 01:53:27.383785,0 days 00:00:10.004794,balanced,10.0,log2,710,COMPLETE
1881,1881,0.29007936507936505,2022-12-02 01:53:27.622697,2022-12-02 01:53:37.785993,0 days 00:00:10.163296,balanced,10.0,log2,760,COMPLETE
1882,1882,0.25948082010582013,2022-12-02 01:53:38.033643,2022-12-02 01:53:48.580256,0 days 00:00:10.546613,balanced,1.0,log2,760,COMPLETE
1883,1883,0.22952002577002578,2022-12-02 01:53:48.826897,2022-12-02 01:53:58.654352,0 days 00:00:09.827455,balanced,23.0,log2,710,COMPLETE
1884,1884,0.3054728835978836,2022-12-02 01:53:58.890714,2022-12-02 01:54:09.408806,0 days 00:00:10.518092,balanced,9.0,log2,810,COMPLETE
1885,1885,0.281223544973545,2022-12-02 01:54:09.663810,2022-12-02 01:54:20.497979,0 days 00:00:10.834169,balanced,8.0,log2,860,COMPLETE
1886,1886,0.28317460317460313,2022-12-02 01:54:20.740269,2022-12-02 01:54:31.280927,0 days 00:00:10.540658,balanced,9.0,log2,810,COMPLETE
1887,1887,0.270922619047619,2022-12-02 01:54:31.524913,2022-12-02 01:54:42.459476,0 days 00:00:10.934563,balanced,7.0,log2,860,COMPLETE
1888,1888,0.2937037037037037,2022-12-02 01:54:42.691401,2022-12-02 01:54:53.431826,0 days 00:00:10.740425,balanced,9.0,log2,860,COMPLETE
1889,1889,0.28062830687830687,2022-12-02 01:54:53.665188,2022-12-02 01:55:04.206329,0 days 00:00:10.541141,balanced,9.0,log2,810,COMPLETE
1890,1890,0.17567839163712948,2022-12-02 01:55:04.447455,2022-12-02 01:55:16.806852,0 days 00:00:12.359397,balanced,27.0,0.9,810,COMPLETE
1891,1891,0.2846792328042328,2022-12-02 01:55:17.041189,2022-12-02 01:55:27.591184,0 days 00:00:10.549995,balanced,9.0,log2,810,COMPLETE
1892,1892,0.14748432469927703,2022-12-02 01:55:27.842584,2022-12-02 01:55:37.521699,0 days 00:00:09.679115,balanced,34.0,sqrt,810,COMPLETE
1893,1893,0.2869471269471269,2022-12-02 01:55:37.762505,2022-12-02 01:55:47.987848,0 days 00:00:10.225343,balanced,12.0,log2,810,COMPLETE
1894,1894,0.28410714285714284,2022-12-02 01:55:48.201806,2022-12-02 01:55:58.791604,0 days 00:00:10.589798,balanced,9.0,log2,810,COMPLETE
1895,1895,0.29364748677248675,2022-12-02 01:55:59.026484,2022-12-02 01:56:09.707145,0 days 00:00:10.680661,balanced,9.0,log2,810,COMPLETE
1896,1896,0.28323833573833573,2022-12-02 01:56:09.950125,2022-12-02 01:56:20.551931,0 days 00:00:10.601806,balanced,9.0,log2,810,COMPLETE
1897,1897,0.2783597883597883,2022-12-02 01:56:20.795352,2022-12-02 01:56:31.660051,0 days 00:00:10.864699,balanced,9.0,log2,860,COMPLETE
1898,1898,0.2815310846560847,2022-12-02 01:56:31.893631,2022-12-02 01:56:42.486167,0 days 00:00:10.592536,balanced,9.0,log2,810,COMPLETE
1899,1899,0.14470335761176767,2022-12-02 01:56:42.730923,2022-12-02 01:56:52.960833,0 days 00:00:10.229910,balanced,33.0,log2,810,COMPLETE
1900,1900,0.16951395601881036,2022-12-02 01:56:53.213371,2022-12-02 01:57:04.177437,0 days 00:00:10.964066,balanced,26.0,0.6,810,COMPLETE
