,number,value,datetime_start,datetime_complete,duration,params_class_weight,params_max_depth,params_max_features,params_n_estimators,state
2486,2486,0.768942494565127,2022-12-01 11:43:24.615900,2022-12-01 11:43:43.093316,0 days 00:00:18.477416,"{0: 1, 1: 10}",11.0,1.0,810,COMPLETE
2487,2487,0.749517031933423,2022-12-01 11:43:43.344028,2022-12-01 11:43:58.444940,0 days 00:00:15.100912,"{0: 1, 1: 10}",16.0,0.7,760,COMPLETE
2488,2488,0.7689949436308756,2022-12-01 11:43:58.692734,2022-12-01 11:44:17.154719,0 days 00:00:18.461985,"{0: 1, 1: 10}",38.0,,810,COMPLETE
2489,2489,0.7667159514647406,2022-12-01 11:44:17.400934,2022-12-01 11:44:36.521792,0 days 00:00:19.120858,"{0: 1, 1: 10}",11.0,1.0,860,COMPLETE
2490,2490,0.771310313207705,2022-12-01 11:44:36.781347,2022-12-01 11:44:56.028692,0 days 00:00:19.247345,"{0: 1, 1: 10}",11.0,1.0,860,COMPLETE
2491,2491,0.6793517924985766,2022-12-01 11:44:56.283168,2022-12-01 11:45:05.726110,0 days 00:00:09.442942,"{0: 1, 1: 10}",34.0,sqrt,810,COMPLETE
2492,2492,0.7739501337812735,2022-12-01 11:45:05.987128,2022-12-01 11:45:24.972306,0 days 00:00:18.985178,"{0: 1, 1: 10}",9.0,1.0,860,COMPLETE
2493,2493,0.7667070391678175,2022-12-01 11:45:25.218725,2022-12-01 11:45:39.651062,0 days 00:00:14.432337,"{0: 1, 1: 10}",9.0,1.0,560,COMPLETE
2494,2494,0.7677507222080233,2022-12-01 11:45:39.894609,2022-12-01 11:45:58.177617,0 days 00:00:18.283008,"{0: 1, 1: 10}",9.0,1.0,810,COMPLETE
2495,2495,0.7716692805732437,2022-12-01 11:45:58.430983,2022-12-01 11:46:16.710784,0 days 00:00:18.279801,"{0: 1, 1: 10}",9.0,1.0,810,COMPLETE
2496,2496,0.7650667433055569,2022-12-01 11:46:16.966636,2022-12-01 11:46:36.061519,0 days 00:00:19.094883,"{0: 1, 1: 10}",9.0,1.0,860,COMPLETE
2497,2497,0.7686536859207092,2022-12-01 11:46:36.317816,2022-12-01 11:46:54.330731,0 days 00:00:18.012915,"{0: 1, 1: 10}",18.0,1.0,760,COMPLETE
2498,2498,0.605442176061267,2022-12-01 11:46:54.597754,2022-12-01 11:47:10.959894,0 days 00:00:16.362140,balanced,9.0,1.0,860,COMPLETE
2499,2499,0.7691093714002639,2022-12-01 11:47:11.232981,2022-12-01 11:47:31.165975,0 days 00:00:19.932994,"{0: 1, 1: 10}",9.0,1.0,860,COMPLETE
