,number,value,datetime_start,datetime_complete,duration,params_class_weight,params_max_depth,params_max_features,params_n_estimators,state
800,800,0.7444227018990193,2022-12-01 03:11:33.247179,2022-12-01 03:11:43.654110,0 days 00:00:10.406931,"{0: 1, 1: 10}",3.0,0.8,410,COMPLETE
801,801,0.7151867688157801,2022-12-01 03:11:43.874747,2022-12-01 03:11:52.612650,0 days 00:00:08.737903,,2.0,0.7,310,COMPLETE
802,802,0.640749154575364,2022-12-01 03:11:52.832408,2022-12-01 03:12:01.019052,0 days 00:00:08.186644,balanced,17.0,,210,COMPLETE
803,803,0.6546230066251038,2022-12-01 03:12:01.240222,2022-12-01 03:12:14.694891,0 days 00:00:13.454669,"{0: 1, 1: 100}",18.0,0.9,710,COMPLETE
804,804,0.6410475881460929,2022-12-01 03:12:14.912807,2022-12-01 03:12:23.910446,0 days 00:00:08.997639,"{0: 1, 1: 10}",9.0,log2,560,COMPLETE
805,805,0.587318092208233,2022-12-01 03:12:24.141941,2022-12-01 03:12:30.990696,0 days 00:00:06.848755,"{0: 1, 1: 100}",10.0,,10,COMPLETE
806,806,0.7223117274459625,2022-12-01 03:12:31.207554,2022-12-01 03:12:44.248636,0 days 00:00:13.041082,"{0: 1, 1: 10}",2.0,0.9,710,COMPLETE
807,807,0.577542793730421,2022-12-01 03:12:44.471161,2022-12-01 03:12:54.222616,0 days 00:00:09.751455,"{0: 1, 1: 10}",38.0,log2,960,COMPLETE
808,808,0.6176718312572392,2022-12-01 03:12:54.441141,2022-12-01 03:13:05.889134,0 days 00:00:11.447993,balanced,9.0,0.7,610,COMPLETE
809,809,0.5963918605697466,2022-12-01 03:13:06.105456,2022-12-01 03:13:19.791359,0 days 00:00:13.685903,"{0: 1, 1: 100}",5.0,0.7,910,COMPLETE
810,810,0.6498851579071577,2022-12-01 03:13:20.007980,2022-12-01 03:13:32.033876,0 days 00:00:12.025896,balanced,21.0,0.8,610,COMPLETE
811,811,0.711684869655163,2022-12-01 03:13:32.257791,2022-12-01 03:13:39.288131,0 days 00:00:07.030340,,16.0,,10,COMPLETE
812,812,0.7517057094694275,2022-12-01 03:13:39.510239,2022-12-01 03:13:56.236776,0 days 00:00:16.726537,"{0: 1, 1: 10}",19.0,0.7,910,COMPLETE
813,813,0.7360065658559557,2022-12-01 03:13:56.453594,2022-12-01 03:14:11.523606,0 days 00:00:15.070012,,13.0,0.6,510,COMPLETE
814,814,0.6590766506927168,2022-12-01 03:14:11.744230,2022-12-01 03:14:22.300419,0 days 00:00:10.556189,"{0: 1, 1: 100}",22.0,0.6,560,COMPLETE
815,815,0.6570880498620545,2022-12-01 03:14:22.520200,2022-12-01 03:14:35.282848,0 days 00:00:12.762648,"{0: 1, 1: 100}",20.0,0.8,710,COMPLETE
816,816,0.6516526897678544,2022-12-01 03:14:35.497861,2022-12-01 03:14:43.738547,0 days 00:00:08.240686,"{0: 1, 1: 100}",38.0,0.7,260,COMPLETE
817,817,0.730463372844858,2022-12-01 03:14:43.958153,2022-12-01 03:14:52.744747,0 days 00:00:08.786594,,24.0,,110,COMPLETE
818,818,0.7360269002333154,2022-12-01 03:14:52.960262,2022-12-01 03:15:15.587392,0 days 00:00:22.627130,,31.0,0.7,810,COMPLETE
819,819,0.6988472550506825,2022-12-01 03:15:15.803218,2022-12-01 03:15:25.150946,0 days 00:00:09.347728,"{0: 1, 1: 10}",5.0,sqrt,860,COMPLETE
820,820,0.6621709967482808,2022-12-01 03:15:25.372810,2022-12-01 03:15:33.932847,0 days 00:00:08.560037,balanced,26.0,0.6,310,COMPLETE
821,821,0.6467052350598326,2022-12-01 03:15:34.154457,2022-12-01 03:15:41.180138,0 days 00:00:07.025681,"{0: 1, 1: 100}",35.0,log2,60,COMPLETE
822,822,0.6231545391136414,2022-12-01 03:15:41.399381,2022-12-01 03:15:48.569749,0 days 00:00:07.170368,balanced,1.0,,160,COMPLETE
823,823,0.640786818575545,2022-12-01 03:15:48.801412,2022-12-01 03:15:56.040302,0 days 00:00:07.238890,"{0: 1, 1: 100}",27.0,0.8,60,COMPLETE
824,824,0.6185224923059337,2022-12-01 03:15:56.262231,2022-12-01 03:16:06.465945,0 days 00:00:10.203714,balanced,10.0,log2,860,COMPLETE
825,825,0.7535115734354434,2022-12-01 03:16:06.684437,2022-12-01 03:16:15.462339,0 days 00:00:08.777902,"{0: 1, 1: 10}",32.0,0.9,210,COMPLETE
826,826,0.6569096938952682,2022-12-01 03:16:15.685507,2022-12-01 03:16:28.066685,0 days 00:00:12.381178,"{0: 1, 1: 100}",23.0,0.8,660,COMPLETE
827,827,0.746993890869584,2022-12-01 03:16:28.294184,2022-12-01 03:16:41.015837,0 days 00:00:12.721653,"{0: 1, 1: 10}",24.0,0.7,560,COMPLETE
828,828,0.7517794839539318,2022-12-01 03:16:41.239404,2022-12-01 03:16:49.216339,0 days 00:00:07.976935,"{0: 1, 1: 10}",9.0,0.8,160,COMPLETE
829,829,0.6330360913994156,2022-12-01 03:16:49.445596,2022-12-01 03:17:04.589916,0 days 00:00:15.144320,balanced,23.0,,810,COMPLETE
830,830,0.6594162542744845,2022-12-01 03:17:04.813394,2022-12-01 03:17:13.900959,0 days 00:00:09.087565,balanced,39.0,0.6,360,COMPLETE
831,831,0.74594954072869,2022-12-01 03:17:14.112115,2022-12-01 03:17:30.098117,0 days 00:00:15.986002,"{0: 1, 1: 10}",,0.6,910,COMPLETE
832,832,0.7354465608225794,2022-12-01 03:17:30.328246,2022-12-01 03:17:58.054422,0 days 00:00:27.726176,,16.0,0.9,860,COMPLETE
833,833,0.6097600610694032,2022-12-01 03:17:58.274663,2022-12-01 03:18:06.865647,0 days 00:00:08.590984,,37.0,log2,610,COMPLETE
834,834,0.7243103585862295,2022-12-01 03:18:07.094651,2022-12-01 03:18:14.411601,0 days 00:00:07.316950,"{0: 1, 1: 100}",38.0,sqrt,310,COMPLETE
835,835,0.6550416578131498,2022-12-01 03:18:14.639101,2022-12-01 03:18:22.231699,0 days 00:00:07.592598,"{0: 1, 1: 100}",22.0,0.6,210,COMPLETE
836,836,0.6482956376348747,2022-12-01 03:18:22.452108,2022-12-01 03:18:35.483874,0 days 00:00:13.031766,balanced,14.0,0.8,710,COMPLETE
837,837,0.7251324670080105,2022-12-01 03:18:35.708088,2022-12-01 03:18:42.835696,0 days 00:00:07.127608,"{0: 1, 1: 100}",34.0,sqrt,260,COMPLETE
838,838,0.651275634572291,2022-12-01 03:18:43.057874,2022-12-01 03:18:51.544494,0 days 00:00:08.486620,balanced,28.0,0.8,260,COMPLETE
839,839,0.604621475267529,2022-12-01 03:18:51.769085,2022-12-01 03:19:02.500054,0 days 00:00:10.730969,balanced,1.0,0.6,910,COMPLETE
840,840,0.7473299544804803,2022-12-01 03:19:02.724002,2022-12-01 03:19:13.413236,0 days 00:00:10.689234,"{0: 1, 1: 10}",20.0,0.7,410,COMPLETE
841,841,0.765094518906077,2022-12-01 03:19:13.635187,2022-12-01 03:19:21.837051,0 days 00:00:08.201864,"{0: 1, 1: 10}",17.0,1.0,160,COMPLETE
842,842,0.6026127244445207,2022-12-01 03:19:22.047278,2022-12-01 03:19:29.090823,0 days 00:00:07.043545,,24.0,log2,60,COMPLETE
843,843,0.6455034345825901,2022-12-01 03:19:29.310756,2022-12-01 03:19:38.047912,0 days 00:00:08.737156,balanced,21.0,,260,COMPLETE
844,844,0.6615046061641846,2022-12-01 03:19:38.264087,2022-12-01 03:19:53.144348,0 days 00:00:14.880261,balanced,32.0,0.7,960,COMPLETE
845,845,0.5896086569807392,2022-12-01 03:19:53.369331,2022-12-01 03:20:00.164822,0 days 00:00:06.795491,balanced,,log2,10,COMPLETE
846,846,0.7532959231660541,2022-12-01 03:20:00.382080,2022-12-01 03:20:11.121514,0 days 00:00:10.739434,"{0: 1, 1: 10}",28.0,0.6,460,COMPLETE
847,847,0.6344981580680153,2022-12-01 03:20:11.338292,2022-12-01 03:20:23.024024,0 days 00:00:11.685732,balanced,35.0,1.0,510,COMPLETE
848,848,0.7524729263685032,2022-12-01 03:20:23.241162,2022-12-01 03:20:30.825657,0 days 00:00:07.584495,"{0: 1, 1: 10}",29.0,1.0,110,COMPLETE
849,849,0.6562635024270448,2022-12-01 03:20:31.044656,2022-12-01 03:20:44.126704,0 days 00:00:13.082048,balanced,20.0,0.7,760,COMPLETE
850,850,0.6117194170798388,2022-12-01 03:20:44.346838,2022-12-01 03:20:53.942206,0 days 00:00:09.595368,,,log2,910,COMPLETE
851,851,0.7353900718662796,2022-12-01 03:20:54.166360,2022-12-01 03:21:08.476238,0 days 00:00:14.309878,,32.0,0.6,460,COMPLETE
852,852,0.7647156199073124,2022-12-01 03:21:08.707039,2022-12-01 03:21:22.344475,0 days 00:00:13.637436,"{0: 1, 1: 10}",38.0,,510,COMPLETE
853,853,0.6310907671497341,2022-12-01 03:21:22.568343,2022-12-01 03:21:29.700649,0 days 00:00:07.132306,,36.0,sqrt,210,COMPLETE
854,854,0.734955591490581,2022-12-01 03:21:29.914009,2022-12-01 03:21:54.523084,0 days 00:00:24.609075,,38.0,0.8,810,COMPLETE
855,855,0.7674977809709981,2022-12-01 03:21:54.753722,2022-12-01 03:22:15.261295,0 days 00:00:20.507573,"{0: 1, 1: 10}",38.0,1.0,960,COMPLETE
856,856,0.7487047341281545,2022-12-01 03:22:15.482345,2022-12-01 03:22:30.984739,0 days 00:00:15.502394,,6.0,1.0,360,COMPLETE
857,857,0.6564649794614966,2022-12-01 03:22:31.209874,2022-12-01 03:22:39.248437,0 days 00:00:08.038563,"{0: 1, 1: 100}",31.0,0.6,260,COMPLETE
858,858,0.6536050128113715,2022-12-01 03:22:39.470956,2022-12-01 03:22:48.139225,0 days 00:00:08.668269,"{0: 1, 1: 100}",23.0,log2,660,COMPLETE
859,859,0.6541623852015771,2022-12-01 03:22:48.358593,2022-12-01 03:23:00.671027,0 days 00:00:12.312434,"{0: 1, 1: 100}",28.0,0.8,660,COMPLETE
860,860,0.7648811795611494,2022-12-01 03:23:00.891273,2022-12-01 03:23:15.977043,0 days 00:00:15.085770,"{0: 1, 1: 10}",15.0,,610,COMPLETE
861,861,0.605371121025643,2022-12-01 03:23:16.193291,2022-12-01 03:23:23.266594,0 days 00:00:07.073303,"{0: 1, 1: 10}",14.0,log2,10,COMPLETE
862,862,0.6409783747920528,2022-12-01 03:23:23.492390,2022-12-01 03:23:33.465952,0 days 00:00:09.973562,balanced,13.0,,360,COMPLETE
863,863,0.6151740000495163,2022-12-01 03:23:33.694583,2022-12-01 03:23:43.114610,0 days 00:00:09.420027,"{0: 1, 1: 10}",15.0,log2,810,COMPLETE
864,864,0.6320777141412006,2022-12-01 03:23:43.333708,2022-12-01 03:23:52.247802,0 days 00:00:08.914094,"{0: 1, 1: 100}",20.0,log2,660,COMPLETE
865,865,0.6345923157739215,2022-12-01 03:23:52.463556,2022-12-01 03:24:02.055195,0 days 00:00:09.591639,,24.0,sqrt,860,COMPLETE
866,866,0.6107747742964186,2022-12-01 03:24:02.279039,2022-12-01 03:24:11.700029,0 days 00:00:09.420990,balanced,9.0,0.8,360,COMPLETE
867,867,0.7557554321745349,2022-12-01 03:24:11.931935,2022-12-01 03:24:23.115935,0 days 00:00:11.184000,"{0: 1, 1: 10}",18.0,0.8,410,COMPLETE
868,868,0.6731623603751339,2022-12-01 03:24:23.340224,2022-12-01 03:24:32.270941,0 days 00:00:08.930717,"{0: 1, 1: 100}",7.0,sqrt,710,COMPLETE
869,869,0.6973027136908024,2022-12-01 03:24:32.487328,2022-12-01 03:24:39.530427,0 days 00:00:07.043099,"{0: 1, 1: 100}",17.0,sqrt,110,COMPLETE
870,870,0.6528386419200943,2022-12-01 03:24:39.748515,2022-12-01 03:24:46.724586,0 days 00:00:06.976071,"{0: 1, 1: 10}",13.0,sqrt,110,COMPLETE
871,871,0.6130023615525984,2022-12-01 03:24:46.939134,2022-12-01 03:24:54.015392,0 days 00:00:07.076258,"{0: 1, 1: 100}",7.0,0.9,110,COMPLETE
872,872,0.7358763494192843,2022-12-01 03:24:54.230898,2022-12-01 03:25:19.556368,0 days 00:00:25.325470,,11.0,1.0,710,COMPLETE
873,873,0.6359626928608342,2022-12-01 03:25:19.775463,2022-12-01 03:25:29.617321,0 days 00:00:09.841858,,39.0,sqrt,910,COMPLETE
874,874,0.7291626511833686,2022-12-01 03:25:29.842210,2022-12-01 03:25:40.980442,0 days 00:00:11.138232,,32.0,0.7,260,COMPLETE
875,875,0.6805263768679738,2022-12-01 03:25:41.201349,2022-12-01 03:25:49.347442,0 days 00:00:08.146093,balanced,8.0,sqrt,510,COMPLETE
876,876,0.7354340387508372,2022-12-01 03:25:49.570421,2022-12-01 03:26:03.883489,0 days 00:00:14.313068,,33.0,,310,COMPLETE
877,877,0.6611149882890651,2022-12-01 03:26:04.103975,2022-12-01 03:26:15.608163,0 days 00:00:11.504188,balanced,38.0,0.7,610,COMPLETE
878,878,0.6181674162912898,2022-12-01 03:26:15.827230,2022-12-01 03:26:25.787336,0 days 00:00:09.960106,balanced,9.0,log2,760,COMPLETE
879,879,0.6101584478318343,2022-12-01 03:26:26.005371,2022-12-01 03:26:35.588037,0 days 00:00:09.582666,,28.0,log2,910,COMPLETE
880,880,0.6386452767357226,2022-12-01 03:26:35.813142,2022-12-01 03:26:43.627077,0 days 00:00:07.813935,,14.0,sqrt,410,COMPLETE
881,881,0.6618419195379865,2022-12-01 03:26:43.844495,2022-12-01 03:26:56.571983,0 days 00:00:12.727488,"{0: 1, 1: 100}",29.0,0.6,810,COMPLETE
882,882,0.7335803342725576,2022-12-01 03:26:56.793754,2022-12-01 03:27:05.812053,0 days 00:00:09.018299,,36.0,0.7,160,COMPLETE
883,883,0.6332162268348192,2022-12-01 03:27:06.036750,2022-12-01 03:27:17.457396,0 days 00:00:11.420646,"{0: 1, 1: 100}",28.0,,510,COMPLETE
884,884,0.7150695014176209,2022-12-01 03:27:17.682704,2022-12-01 03:27:25.513311,0 days 00:00:07.830607,"{0: 1, 1: 10}",2.0,0.8,210,COMPLETE
885,885,0.6267252231589492,2022-12-01 03:27:25.746321,2022-12-01 03:27:32.744925,0 days 00:00:06.998604,,28.0,sqrt,10,COMPLETE
886,886,0.6274065729029006,2022-12-01 03:27:32.970995,2022-12-01 03:27:41.204542,0 days 00:00:08.233547,"{0: 1, 1: 100}",33.0,1.0,210,COMPLETE
887,887,0.7367698231254636,2022-12-01 03:27:41.435180,2022-12-01 03:27:58.516593,0 days 00:00:17.081413,,10.0,1.0,410,COMPLETE
888,888,0.7333506277706822,2022-12-01 03:27:58.734531,2022-12-01 03:28:20.290658,0 days 00:00:21.556127,,10.0,0.7,760,COMPLETE
889,889,0.5985358673421324,2022-12-01 03:28:20.507662,2022-12-01 03:28:29.111381,0 days 00:00:08.603719,balanced,7.0,0.7,310,COMPLETE
890,890,0.733706210698689,2022-12-01 03:28:29.330831,2022-12-01 03:28:45.031186,0 days 00:00:15.700355,,16.0,1.0,360,COMPLETE
891,891,0.73558863497833,2022-12-01 03:28:45.256162,2022-12-01 03:29:13.006553,0 days 00:00:27.750391,,24.0,0.9,860,COMPLETE
892,892,0.7662469031444823,2022-12-01 03:29:13.231466,2022-12-01 03:29:32.739818,0 days 00:00:19.508352,"{0: 1, 1: 10}",14.0,0.9,960,COMPLETE
893,893,0.6787466628650431,2022-12-01 03:29:32.970436,2022-12-01 03:29:42.120587,0 days 00:00:09.150151,balanced,8.0,sqrt,760,COMPLETE
894,894,0.615567773390817,2022-12-01 03:29:42.347838,2022-12-01 03:29:52.910714,0 days 00:00:10.562876,"{0: 1, 1: 100}",8.0,log2,860,COMPLETE
895,895,0.6075916979721118,2022-12-01 03:29:53.135999,2022-12-01 03:30:00.187624,0 days 00:00:07.051625,"{0: 1, 1: 10}",17.0,sqrt,10,COMPLETE
896,896,0.735033517044965,2022-12-01 03:30:00.416207,2022-12-01 03:30:26.083532,0 days 00:00:25.667325,,21.0,0.8,860,COMPLETE
897,897,0.5876766797618301,2022-12-01 03:30:26.307791,2022-12-01 03:30:35.144529,0 days 00:00:08.836738,balanced,7.0,,260,COMPLETE
898,898,0.577516419066539,2022-12-01 03:30:35.374294,2022-12-01 03:30:44.043229,0 days 00:00:08.668935,"{0: 1, 1: 10}",32.0,log2,660,COMPLETE
899,899,0.6476409794195461,2022-12-01 03:30:44.266387,2022-12-01 03:30:52.913933,0 days 00:00:08.647546,"{0: 1, 1: 100}",18.0,0.9,260,COMPLETE
900,900,0.7341926832696067,2022-12-01 03:30:53.134942,2022-12-01 03:31:10.221568,0 days 00:00:17.086626,,36.0,1.0,410,COMPLETE
901,901,0.6116518980759938,2022-12-01 03:31:10.442624,2022-12-01 03:31:17.341166,0 days 00:00:06.898542,"{0: 1, 1: 100}",32.0,log2,10,COMPLETE
902,902,0.7348534882279881,2022-12-01 03:31:17.564022,2022-12-01 03:31:31.871490,0 days 00:00:14.307468,,15.0,0.6,460,COMPLETE
903,903,0.6374152644062534,2022-12-01 03:31:32.095042,2022-12-01 03:31:41.015102,0 days 00:00:08.920060,,38.0,sqrt,660,COMPLETE
904,904,0.6525671413055792,2022-12-01 03:31:41.242254,2022-12-01 03:31:55.057761,0 days 00:00:13.815507,"{0: 1, 1: 100}",14.0,0.9,760,COMPLETE
905,905,0.632414763607898,2022-12-01 03:31:55.277513,2022-12-01 03:32:04.635378,0 days 00:00:09.357865,"{0: 1, 1: 100}",38.0,,310,COMPLETE
906,906,0.7631250404269426,2022-12-01 03:32:04.855861,2022-12-01 03:32:23.074370,0 days 00:00:18.218509,"{0: 1, 1: 10}",,1.0,810,COMPLETE
907,907,0.5689161300472831,2022-12-01 03:32:23.285363,2022-12-01 03:32:30.308053,0 days 00:00:07.022690,"{0: 1, 1: 100}",6.0,1.0,60,COMPLETE
908,908,0.7607021091038858,2022-12-01 03:32:30.533297,2022-12-01 03:32:47.407083,0 days 00:00:16.873786,"{0: 1, 1: 10}",8.0,0.8,860,COMPLETE
909,909,0.6350274822732744,2022-12-01 03:32:47.632861,2022-12-01 03:32:57.360177,0 days 00:00:09.727316,,9.0,log2,710,COMPLETE
910,910,0.6083366040157755,2022-12-01 03:32:57.573373,2022-12-01 03:33:07.282255,0 days 00:00:09.708882,,1.0,sqrt,660,COMPLETE
911,911,0.6134039291156,2022-12-01 03:33:07.512605,2022-12-01 03:33:17.339209,0 days 00:00:09.826604,,18.0,log2,960,COMPLETE
912,912,0.7703939078969247,2022-12-01 03:33:17.566981,2022-12-01 03:33:36.766644,0 days 00:00:19.199663,"{0: 1, 1: 10}",28.0,,860,COMPLETE
913,913,0.6021872606053111,2022-12-01 03:33:36.987473,2022-12-01 03:33:44.680462,0 days 00:00:07.692989,"{0: 1, 1: 10}",21.0,log2,410,COMPLETE
914,914,0.7394744261677533,2022-12-01 03:33:44.890105,2022-12-01 03:33:57.981645,0 days 00:00:13.091540,,15.0,0.8,310,COMPLETE
915,915,0.7232668419303878,2022-12-01 03:33:58.200147,2022-12-01 03:34:10.227593,0 days 00:00:12.027446,,3.0,1.0,360,COMPLETE
916,916,0.644474396994219,2022-12-01 03:34:10.446762,2022-12-01 03:34:21.171803,0 days 00:00:10.725041,balanced,4.0,0.6,610,COMPLETE
917,917,0.7607119948784062,2022-12-01 03:34:21.395391,2022-12-01 03:34:33.130807,0 days 00:00:11.735416,"{0: 1, 1: 10}",20.0,0.8,460,COMPLETE
918,918,0.6041464534516559,2022-12-01 03:34:33.356773,2022-12-01 03:34:44.887550,0 days 00:00:11.530777,"{0: 1, 1: 100}",5.0,0.6,710,COMPLETE
919,919,0.7365273025197444,2022-12-01 03:34:45.110241,2022-12-01 03:34:56.276647,0 days 00:00:11.166406,,36.0,0.7,260,COMPLETE
920,920,0.7362192816985919,2022-12-01 03:34:56.498141,2022-12-01 03:35:25.462180,0 days 00:00:28.964039,,29.0,0.9,910,COMPLETE
921,921,0.7665878530686964,2022-12-01 03:35:25.692089,2022-12-01 03:35:40.885260,0 days 00:00:15.193171,"{0: 1, 1: 10}",22.0,,610,COMPLETE
922,922,0.7366977522013081,2022-12-01 03:35:41.109593,2022-12-01 03:36:05.002686,0 days 00:00:23.893093,,30.0,0.9,710,COMPLETE
923,923,0.7084459533414769,2022-12-01 03:36:05.221912,2022-12-01 03:36:13.507999,0 days 00:00:08.286087,balanced,27.0,sqrt,560,COMPLETE
924,924,0.7179148925435055,2022-12-01 03:36:13.729125,2022-12-01 03:36:23.167564,0 days 00:00:09.438439,"{0: 1, 1: 100}",37.0,sqrt,810,COMPLETE
925,925,0.6552280920348141,2022-12-01 03:36:23.384729,2022-12-01 03:36:35.611711,0 days 00:00:12.226982,"{0: 1, 1: 100}",27.0,0.8,660,COMPLETE
926,926,0.6951084912502516,2022-12-01 03:36:35.827497,2022-12-01 03:36:44.681209,0 days 00:00:08.853712,"{0: 1, 1: 10}",10.0,sqrt,760,COMPLETE
927,927,0.600062044342365,2022-12-01 03:36:44.900016,2022-12-01 03:36:54.182069,0 days 00:00:09.282053,"{0: 1, 1: 10}",1.0,,460,COMPLETE
928,928,0.6759312770946067,2022-12-01 03:36:54.408695,2022-12-01 03:37:02.116138,0 days 00:00:07.707443,"{0: 1, 1: 100}",7.0,sqrt,360,COMPLETE
929,929,0.7665032411908641,2022-12-01 03:37:02.340065,2022-12-01 03:37:15.797089,0 days 00:00:13.457024,"{0: 1, 1: 10}",23.0,,510,COMPLETE
930,930,0.5889771975515161,2022-12-01 03:37:16.024124,2022-12-01 03:37:24.312544,0 days 00:00:08.288420,"{0: 1, 1: 100}",1.0,log2,410,COMPLETE
931,931,0.7347504474999903,2022-12-01 03:37:24.531053,2022-12-01 03:37:50.316289,0 days 00:00:25.785236,,19.0,0.7,960,COMPLETE
932,932,0.7370966595326048,2022-12-01 03:37:50.540963,2022-12-01 03:37:59.029692,0 days 00:00:08.488729,,36.0,0.9,110,COMPLETE
933,933,0.7356267364308311,2022-12-01 03:37:59.261564,2022-12-01 03:38:29.483511,0 days 00:00:30.221947,,28.0,0.9,960,COMPLETE
934,934,0.6340910675046912,2022-12-01 03:38:29.699030,2022-12-01 03:38:45.804968,0 days 00:00:16.105938,"{0: 1, 1: 100}",34.0,,910,COMPLETE
935,935,0.7094957961656261,2022-12-01 03:38:46.030451,2022-12-01 03:38:54.034888,0 days 00:00:08.004437,balanced,37.0,sqrt,460,COMPLETE
936,936,0.654038612573598,2022-12-01 03:38:54.251676,2022-12-01 03:39:03.875716,0 days 00:00:09.624040,"{0: 1, 1: 100}",28.0,log2,910,COMPLETE
937,937,0.6539875504087345,2022-12-01 03:39:04.102144,2022-12-01 03:39:14.861863,0 days 00:00:10.759719,"{0: 1, 1: 100}",22.0,0.9,460,COMPLETE
938,938,0.6373352585419474,2022-12-01 03:39:15.079497,2022-12-01 03:39:21.952793,0 days 00:00:06.873296,,36.0,sqrt,110,COMPLETE
939,939,0.6320693882003231,2022-12-01 03:39:22.174549,2022-12-01 03:39:37.454472,0 days 00:00:15.279923,"{0: 1, 1: 100}",11.0,,860,COMPLETE
940,940,0.7341324955178041,2022-12-01 03:39:37.678991,2022-12-01 03:39:53.910484,0 days 00:00:16.231493,,39.0,0.9,410,COMPLETE
941,941,0.7341375509021922,2022-12-01 03:39:54.138403,2022-12-01 03:40:05.148248,0 days 00:00:11.009845,,39.0,0.9,210,COMPLETE
942,942,0.5991559023589368,2022-12-01 03:40:05.368049,2022-12-01 03:40:13.763116,0 days 00:00:08.395067,"{0: 1, 1: 10}",22.0,log2,610,COMPLETE
943,943,0.613596536242619,2022-12-01 03:40:13.986318,2022-12-01 03:40:20.928179,0 days 00:00:06.941861,balanced,26.0,log2,160,COMPLETE
944,944,0.5991721028025248,2022-12-01 03:40:21.153241,2022-12-01 03:40:28.049595,0 days 00:00:06.896354,"{0: 1, 1: 100}",24.0,1.0,10,COMPLETE
945,945,0.6105960847938423,2022-12-01 03:40:28.279046,2022-12-01 03:40:35.351990,0 days 00:00:07.072944,"{0: 1, 1: 100}",14.0,0.8,10,COMPLETE
946,946,0.6538295888714459,2022-12-01 03:40:35.582161,2022-12-01 03:40:49.224787,0 days 00:00:13.642626,balanced,33.0,0.7,810,COMPLETE
947,947,0.626644918591533,2022-12-01 03:40:49.448361,2022-12-01 03:40:58.918165,0 days 00:00:09.469804,balanced,14.0,log2,760,COMPLETE
948,948,0.6548259554291684,2022-12-01 03:40:59.144899,2022-12-01 03:41:10.311038,0 days 00:00:11.166139,balanced,33.0,0.7,560,COMPLETE
949,949,0.7330004071937122,2022-12-01 03:41:10.534199,2022-12-01 03:41:22.005629,0 days 00:00:11.471430,,15.0,0.6,310,COMPLETE
950,950,0.6772212692696442,2022-12-01 03:41:22.236936,2022-12-01 03:41:29.733229,0 days 00:00:07.496293,"{0: 1, 1: 10}",18.0,sqrt,360,COMPLETE
951,951,0.7575940621549992,2022-12-01 03:41:29.956355,2022-12-01 03:41:48.489633,0 days 00:00:18.533278,"{0: 1, 1: 10}",25.0,0.8,960,COMPLETE
952,952,0.6426977880964436,2022-12-01 03:41:48.712940,2022-12-01 03:42:01.183467,0 days 00:00:12.470527,balanced,18.0,0.9,610,COMPLETE
953,953,0.641296244150106,2022-12-01 03:42:01.403984,2022-12-01 03:42:17.278168,0 days 00:00:15.874184,balanced,29.0,,860,COMPLETE
954,954,0.736077149162405,2022-12-01 03:42:17.504160,2022-12-01 03:42:40.171652,0 days 00:00:22.667492,,27.0,,610,COMPLETE
955,955,0.6412885703468499,2022-12-01 03:42:40.391744,2022-12-01 03:42:47.335478,0 days 00:00:06.943734,"{0: 1, 1: 100}",39.0,0.7,60,COMPLETE
956,956,0.618226167091802,2022-12-01 03:42:47.560451,2022-12-01 03:42:57.255884,0 days 00:00:09.695433,balanced,2.0,log2,660,COMPLETE
957,957,0.7103026260506498,2022-12-01 03:42:57.480088,2022-12-01 03:43:05.903906,0 days 00:00:08.423818,balanced,36.0,sqrt,610,COMPLETE
958,958,0.6993362472753624,2022-12-01 03:43:06.133899,2022-12-01 03:43:13.884269,0 days 00:00:07.750370,balanced,19.0,sqrt,460,COMPLETE
959,959,0.7627303749910203,2022-12-01 03:43:14.105475,2022-12-01 03:43:30.699403,0 days 00:00:16.593928,"{0: 1, 1: 10}",19.0,,710,COMPLETE
960,960,0.7333533862997335,2022-12-01 03:43:30.914874,2022-12-01 03:43:41.941331,0 days 00:00:11.026457,,33.0,0.9,210,COMPLETE
