,number,value,datetime_start,datetime_complete,duration,params_class_weight,params_max_depth,params_max_features,params_n_estimators,state
2332,2332,0.7668982817707116,2022-12-01 10:58:51.192118,2022-12-01 10:59:09.439808,0 days 00:00:18.247690,"{0: 1, 1: 10}",17.0,,810,COMPLETE
2333,2333,0.763174808613611,2022-12-01 10:59:09.680777,2022-12-01 10:59:28.921871,0 days 00:00:19.241094,"{0: 1, 1: 10}",39.0,,860,COMPLETE
2334,2334,0.7528975166069196,2022-12-01 10:59:29.173802,2022-12-01 10:59:47.962893,0 days 00:00:18.789091,"{0: 1, 1: 10}",6.0,,860,COMPLETE
2335,2335,0.7576138639265193,2022-12-01 10:59:48.207070,2022-12-01 11:00:05.520935,0 days 00:00:17.313865,"{0: 1, 1: 10}",5.0,,760,COMPLETE
2336,2336,0.7723658052448675,2022-12-01 11:00:05.769458,2022-12-01 11:00:25.019045,0 days 00:00:19.249587,"{0: 1, 1: 10}",29.0,,860,COMPLETE
2337,2337,0.7712983703000194,2022-12-01 11:00:25.271573,2022-12-01 11:00:43.835044,0 days 00:00:18.563471,"{0: 1, 1: 10}",19.0,,810,COMPLETE
2338,2338,0.7674053291815299,2022-12-01 11:00:44.091071,2022-12-01 11:01:02.397577,0 days 00:00:18.306506,"{0: 1, 1: 10}",28.0,,810,COMPLETE
2339,2339,0.7262953278025767,2022-12-01 11:01:02.637450,2022-12-01 11:01:18.163489,0 days 00:00:15.526039,"{0: 1, 1: 10}",2.0,,860,COMPLETE
2340,2340,0.763196740155679,2022-12-01 11:01:18.416567,2022-12-01 11:01:36.794015,0 days 00:00:18.377448,"{0: 1, 1: 10}",26.0,,810,COMPLETE
2341,2341,0.7617822718136171,2022-12-01 11:01:37.042747,2022-12-01 11:01:56.135347,0 days 00:00:19.092600,"{0: 1, 1: 10}",15.0,,860,COMPLETE
2342,2342,0.7690719706659649,2022-12-01 11:01:56.387613,2022-12-01 11:02:14.769726,0 days 00:00:18.382113,"{0: 1, 1: 10}",20.0,,810,COMPLETE
2343,2343,0.7723626905774854,2022-12-01 11:02:15.022818,2022-12-01 11:02:32.629538,0 days 00:00:17.606720,"{0: 1, 1: 10}",21.0,,760,COMPLETE
2344,2344,0.7667764007265548,2022-12-01 11:02:32.875388,2022-12-01 11:02:51.931566,0 days 00:00:19.056178,"{0: 1, 1: 10}",10.0,,860,COMPLETE
2345,2345,0.771482955697276,2022-12-01 11:02:52.172828,2022-12-01 11:03:11.334731,0 days 00:00:19.161903,"{0: 1, 1: 10}",13.0,,860,COMPLETE
2346,2346,0.7665589735339675,2022-12-01 11:03:11.585952,2022-12-01 11:03:28.523998,0 days 00:00:16.938046,"{0: 1, 1: 10}",34.0,,710,COMPLETE
2347,2347,0.7651410109078989,2022-12-01 11:03:28.770083,2022-12-01 11:03:48.025619,0 days 00:00:19.255536,"{0: 1, 1: 10}",16.0,,860,COMPLETE
2348,2348,0.762968812279974,2022-12-01 11:03:48.274763,2022-12-01 11:04:06.499035,0 days 00:00:18.224272,"{0: 1, 1: 10}",11.0,,810,COMPLETE
2349,2349,0.7693182862480893,2022-12-01 11:04:06.749026,2022-12-01 11:04:25.094351,0 days 00:00:18.345325,"{0: 1, 1: 10}",12.0,,810,COMPLETE
2350,2350,0.7524263092789527,2022-12-01 11:04:25.358846,2022-12-01 11:04:44.389512,0 days 00:00:19.030666,"{0: 1, 1: 10}",7.0,,860,COMPLETE
2351,2351,0.6013869727653085,2022-12-01 11:04:44.630271,2022-12-01 11:04:56.738192,0 days 00:00:12.107921,"{0: 1, 1: 10}",1.0,,810,COMPLETE
2352,2352,0.7646240355154552,2022-12-01 11:04:56.987609,2022-12-01 11:05:16.110968,0 days 00:00:19.123359,"{0: 1, 1: 10}",11.0,,860,COMPLETE
2353,2353,0.7600203648869299,2022-12-01 11:05:16.364362,2022-12-01 11:05:34.673573,0 days 00:00:18.309211,"{0: 1, 1: 10}",8.0,,810,COMPLETE
2354,2354,0.7640054457342337,2022-12-01 11:05:34.929636,2022-12-01 11:05:51.862234,0 days 00:00:16.932598,"{0: 1, 1: 10}",34.0,,710,COMPLETE
2355,2355,0.767668965037555,2022-12-01 11:05:52.111353,2022-12-01 11:06:11.174542,0 days 00:00:19.063189,"{0: 1, 1: 10}",33.0,,860,COMPLETE
2356,2356,0.7703247323075245,2022-12-01 11:06:11.418685,2022-12-01 11:06:29.190296,0 days 00:00:17.771611,"{0: 1, 1: 10}",27.0,,760,COMPLETE
2357,2357,0.7654353453022071,2022-12-01 11:06:29.443175,2022-12-01 11:06:48.035995,0 days 00:00:18.592820,"{0: 1, 1: 10}",,,810,COMPLETE
2358,2358,0.7666816574571848,2022-12-01 11:06:48.294350,2022-12-01 11:07:07.536276,0 days 00:00:19.241926,"{0: 1, 1: 10}",11.0,,860,COMPLETE
2359,2359,0.7697097880299397,2022-12-01 11:07:07.779444,2022-12-01 11:07:26.227703,0 days 00:00:18.448259,"{0: 1, 1: 10}",11.0,,810,COMPLETE
2360,2360,0.7700553946811766,2022-12-01 11:07:26.469900,2022-12-01 11:07:44.306611,0 days 00:00:17.836711,"{0: 1, 1: 10}",37.0,,760,COMPLETE
2361,2361,0.7657640881732234,2022-12-01 11:07:44.552766,2022-12-01 11:08:03.739843,0 days 00:00:19.187077,"{0: 1, 1: 10}",28.0,,860,COMPLETE
2362,2362,0.7587166351608124,2022-12-01 11:08:03.993006,2022-12-01 11:08:20.598490,0 days 00:00:16.605484,"{0: 1, 1: 10}",3.0,,810,COMPLETE
2363,2363,0.7683211464688264,2022-12-01 11:08:20.857887,2022-12-01 11:08:40.038463,0 days 00:00:19.180576,"{0: 1, 1: 10}",11.0,,860,COMPLETE
2364,2364,0.763151509097739,2022-12-01 11:08:40.282457,2022-12-01 11:08:59.679560,0 days 00:00:19.397103,"{0: 1, 1: 10}",31.0,,860,COMPLETE
2365,2365,0.7649374439287323,2022-12-01 11:08:59.924299,2022-12-01 11:09:18.270022,0 days 00:00:18.345723,"{0: 1, 1: 10}",16.0,,810,COMPLETE
2366,2366,0.7708480336264718,2022-12-01 11:09:18.529850,2022-12-01 11:09:37.083373,0 days 00:00:18.553523,"{0: 1, 1: 10}",26.0,,810,COMPLETE
2367,2367,0.7632975527956394,2022-12-01 11:09:37.333938,2022-12-01 11:09:54.924565,0 days 00:00:17.590627,"{0: 1, 1: 10}",11.0,,760,COMPLETE
2368,2368,0.7673272493406484,2022-12-01 11:09:55.182279,2022-12-01 11:10:14.542136,0 days 00:00:19.359857,"{0: 1, 1: 10}",10.0,,860,COMPLETE
2369,2369,0.7710913538369003,2022-12-01 11:10:14.784684,2022-12-01 11:10:33.897331,0 days 00:00:19.112647,"{0: 1, 1: 10}",11.0,,860,COMPLETE
2370,2370,0.7651530946442282,2022-12-01 11:10:34.142601,2022-12-01 11:10:52.700311,0 days 00:00:18.557710,"{0: 1, 1: 10}",38.0,,810,COMPLETE
2371,2371,0.7685548970844069,2022-12-01 11:10:52.946741,2022-12-01 11:11:12.130453,0 days 00:00:19.183712,"{0: 1, 1: 10}",25.0,,860,COMPLETE
2372,2372,0.7688898501607512,2022-12-01 11:11:12.382414,2022-12-01 11:11:30.723360,0 days 00:00:18.340946,"{0: 1, 1: 10}",11.0,,810,COMPLETE
2373,2373,0.7731551284817622,2022-12-01 11:11:30.988097,2022-12-01 11:11:49.995542,0 days 00:00:19.007445,"{0: 1, 1: 10}",9.0,,860,COMPLETE
2374,2374,0.767138840628184,2022-12-01 11:11:50.254666,2022-12-01 11:12:08.657528,0 days 00:00:18.402862,"{0: 1, 1: 10}",34.0,,810,COMPLETE
2375,2375,0.7643618597349061,2022-12-01 11:12:08.908872,2022-12-01 11:12:26.576342,0 days 00:00:17.667470,"{0: 1, 1: 10}",35.0,,760,COMPLETE
2376,2376,0.7687692253224337,2022-12-01 11:12:26.819739,2022-12-01 11:12:45.993797,0 days 00:00:19.174058,"{0: 1, 1: 10}",14.0,,860,COMPLETE
2377,2377,0.7696384091897495,2022-12-01 11:12:46.244744,2022-12-01 11:13:05.264666,0 days 00:00:19.019922,"{0: 1, 1: 10}",11.0,,860,COMPLETE
2378,2378,0.7511106142597188,2022-12-01 11:13:05.516940,2022-12-01 11:13:23.571611,0 days 00:00:18.054671,"{0: 1, 1: 10}",6.0,,810,COMPLETE
2379,2379,0.75673662386891,2022-12-01 11:13:23.813293,2022-12-01 11:13:42.056858,0 days 00:00:18.243565,"{0: 1, 1: 10}",5.0,,810,COMPLETE
2380,2380,0.7669499017531113,2022-12-01 11:13:42.311190,2022-12-01 11:14:01.430489,0 days 00:00:19.119299,"{0: 1, 1: 10}",15.0,,860,COMPLETE
2381,2381,0.765061948791937,2022-12-01 11:14:01.679805,2022-12-01 11:14:19.288815,0 days 00:00:17.609010,"{0: 1, 1: 10}",17.0,,760,COMPLETE
2382,2382,0.7659558849953879,2022-12-01 11:14:19.539386,2022-12-01 11:14:38.625153,0 days 00:00:19.085767,"{0: 1, 1: 10}",18.0,,860,COMPLETE
2383,2383,0.7643972783860074,2022-12-01 11:14:38.888835,2022-12-01 11:14:57.344677,0 days 00:00:18.455842,"{0: 1, 1: 10}",11.0,,810,COMPLETE
2384,2384,0.7675435034233826,2022-12-01 11:14:57.609388,2022-12-01 11:15:16.820329,0 days 00:00:19.210941,"{0: 1, 1: 10}",11.0,,860,COMPLETE
2385,2385,0.7689966172546752,2022-12-01 11:15:17.062716,2022-12-01 11:15:35.660284,0 days 00:00:18.597568,"{0: 1, 1: 10}",11.0,,810,COMPLETE
2386,2386,0.7574034900357673,2022-12-01 11:15:35.920043,2022-12-01 11:15:54.561105,0 days 00:00:18.641062,"{0: 1, 1: 10}",4.0,,860,COMPLETE
2387,2387,0.7651167962593952,2022-12-01 11:15:54.814162,2022-12-01 11:16:12.479676,0 days 00:00:17.665514,"{0: 1, 1: 10}",29.0,,760,COMPLETE
2388,2388,0.7689546420746702,2022-12-01 11:16:12.703429,2022-12-01 11:16:31.202572,0 days 00:00:18.499143,"{0: 1, 1: 10}",19.0,,810,COMPLETE
2389,2389,0.7674875408156392,2022-12-01 11:16:31.467707,2022-12-01 11:16:50.651771,0 days 00:00:19.184064,"{0: 1, 1: 10}",21.0,,860,COMPLETE
2390,2390,0.7303424565373283,2022-12-01 11:16:50.902436,2022-12-01 11:17:05.800770,0 days 00:00:14.898334,"{0: 1, 1: 10}",2.0,,810,COMPLETE
2391,2391,0.7694280872723361,2022-12-01 11:17:06.061038,2022-12-01 11:17:25.169840,0 days 00:00:19.108802,"{0: 1, 1: 10}",39.0,,860,COMPLETE
2392,2392,0.7625754648775611,2022-12-01 11:17:25.420578,2022-12-01 11:17:43.884533,0 days 00:00:18.463955,"{0: 1, 1: 10}",11.0,,810,COMPLETE
2393,2393,0.7465788547566068,2022-12-01 11:17:44.126833,2022-12-01 11:17:59.548074,0 days 00:00:15.421241,"{0: 1, 1: 10}",26.0,0.6,860,COMPLETE
2394,2394,0.6872243251107462,2022-12-01 11:17:59.792696,2022-12-01 11:18:09.372877,0 days 00:00:09.580181,"{0: 1, 1: 10}",13.0,sqrt,860,COMPLETE
2395,2395,0.7675296355390955,2022-12-01 11:18:09.625949,2022-12-01 11:18:28.030250,0 days 00:00:18.404301,"{0: 1, 1: 10}",28.0,,810,COMPLETE
2396,2396,0.767270888410024,2022-12-01 11:18:28.293897,2022-12-01 11:18:47.590800,0 days 00:00:19.296903,"{0: 1, 1: 10}",20.0,,860,COMPLETE
2397,2397,0.7668771303440097,2022-12-01 11:18:47.842365,2022-12-01 11:19:04.533320,0 days 00:00:16.690955,"{0: 1, 1: 10}",11.0,0.9,760,COMPLETE
2398,2398,0.577927550886814,2022-12-01 11:19:04.784009,2022-12-01 11:19:14.183618,0 days 00:00:09.399609,"{0: 1, 1: 10}",34.0,log2,810,COMPLETE
2399,2399,0.7671824821704446,2022-12-01 11:19:14.428080,2022-12-01 11:19:33.422534,0 days 00:00:18.994454,"{0: 1, 1: 10}",11.0,,860,COMPLETE
2400,2400,0.7507372430353363,2022-12-01 11:19:33.662645,2022-12-01 11:19:49.318533,0 days 00:00:15.655888,"{0: 1, 1: 10}",30.0,0.7,810,COMPLETE
2401,2401,0.767286179235777,2022-12-01 11:19:49.569107,2022-12-01 11:20:07.885775,0 days 00:00:18.316668,"{0: 1, 1: 10}",12.0,,810,COMPLETE
2402,2402,0.7572464219399435,2022-12-01 11:20:08.145865,2022-12-01 11:20:25.640878,0 days 00:00:17.495013,"{0: 1, 1: 10}",16.0,0.8,860,COMPLETE
2403,2403,0.689194568537758,2022-12-01 11:20:25.890319,2022-12-01 11:20:34.930469,0 days 00:00:09.040150,"{0: 1, 1: 10}",11.0,sqrt,760,COMPLETE
2404,2404,0.768692042770466,2022-12-01 11:20:35.174669,2022-12-01 11:20:54.335586,0 days 00:00:19.160917,"{0: 1, 1: 10}",10.0,,860,COMPLETE
2405,2405,0.7549327384740483,2022-12-01 11:20:54.593694,2022-12-01 11:21:12.905770,0 days 00:00:18.312076,"{0: 1, 1: 10}",7.0,,810,COMPLETE
2406,2406,0.5680045952385255,2022-12-01 11:21:13.155882,2022-12-01 11:21:25.779610,0 days 00:00:12.623728,"{0: 1, 1: 10}",1.0,,860,COMPLETE
2407,2407,0.7478188104592821,2022-12-01 11:21:26.031246,2022-12-01 11:21:40.956927,0 days 00:00:14.925681,"{0: 1, 1: 10}",11.0,0.6,810,COMPLETE
2408,2408,0.768814675426555,2022-12-01 11:21:41.198428,2022-12-01 11:21:59.387591,0 days 00:00:18.189163,"{0: 1, 1: 10}",11.0,0.9,860,COMPLETE
2409,2409,0.7642328061344383,2022-12-01 11:21:59.637706,2022-12-01 11:22:17.867824,0 days 00:00:18.230118,"{0: 1, 1: 10}",8.0,,810,COMPLETE
2410,2410,0.75631590779541,2022-12-01 11:22:18.121584,2022-12-01 11:22:34.205821,0 days 00:00:16.084237,"{0: 1, 1: 10}",11.0,0.8,760,COMPLETE
2411,2411,0.6307983792541799,2022-12-01 11:22:34.461426,2022-12-01 11:22:44.393852,0 days 00:00:09.932426,"{0: 1, 1: 10}",11.0,log2,860,COMPLETE
2412,2412,0.7698681310572535,2022-12-01 11:22:44.647688,2022-12-01 11:23:03.913828,0 days 00:00:19.266140,"{0: 1, 1: 10}",33.0,,860,COMPLETE
2413,2413,0.765830139596249,2022-12-01 11:23:04.164944,2022-12-01 11:23:22.538805,0 days 00:00:18.373861,"{0: 1, 1: 10}",34.0,,810,COMPLETE
2414,2414,0.7698994962653868,2022-12-01 11:23:22.783411,2022-12-01 11:23:39.560170,0 days 00:00:16.776759,"{0: 1, 1: 10}",11.0,,710,COMPLETE
2415,2415,0.7476575412283205,2022-12-01 11:23:39.804859,2022-12-01 11:23:56.089704,0 days 00:00:16.284845,"{0: 1, 1: 10}",27.0,0.7,860,COMPLETE
2416,2416,0.6865715079757718,2022-12-01 11:23:56.350920,2022-12-01 11:24:05.600178,0 days 00:00:09.249258,"{0: 1, 1: 10}",11.0,sqrt,810,COMPLETE
2417,2417,0.7630020120666046,2022-12-01 11:24:05.848948,2022-12-01 11:24:25.050454,0 days 00:00:19.201506,"{0: 1, 1: 10}",28.0,,860,COMPLETE
2418,2418,0.7657737426869721,2022-12-01 11:24:25.302446,2022-12-01 11:24:42.747531,0 days 00:00:17.445085,"{0: 1, 1: 10}",11.0,0.9,810,COMPLETE
2419,2419,0.7442970545115181,2022-12-01 11:24:42.998265,2022-12-01 11:24:58.413157,0 days 00:00:15.414892,"{0: 1, 1: 10}",,0.6,860,COMPLETE
2420,2420,0.7603685022004881,2022-12-01 11:24:58.670983,2022-12-01 11:25:14.706114,0 days 00:00:16.035131,"{0: 1, 1: 10}",3.0,,760,COMPLETE
2421,2421,0.7657998683018294,2022-12-01 11:25:14.958492,2022-12-01 11:25:33.491886,0 days 00:00:18.533394,"{0: 1, 1: 10}",26.0,,810,COMPLETE
2422,2422,0.7650632512863701,2022-12-01 11:25:33.745985,2022-12-01 11:25:51.043505,0 days 00:00:17.297520,"{0: 1, 1: 10}",37.0,0.8,860,COMPLETE
2423,2423,0.6303816681241873,2022-12-01 11:25:51.295838,2022-12-01 11:26:01.186180,0 days 00:00:09.890342,"{0: 1, 1: 10}",11.0,log2,860,COMPLETE
2424,2424,0.7679308781730534,2022-12-01 11:26:01.447018,2022-12-01 11:26:19.912637,0 days 00:00:18.465619,"{0: 1, 1: 10}",25.0,,810,COMPLETE
2425,2425,0.7526938788665485,2022-12-01 11:26:20.166557,2022-12-01 11:26:35.521707,0 days 00:00:15.355150,"{0: 1, 1: 10}",31.0,0.7,760,COMPLETE
2426,2426,0.678771542903984,2022-12-01 11:26:35.777690,2022-12-01 11:26:45.309069,0 days 00:00:09.531379,"{0: 1, 1: 10}",16.0,sqrt,860,COMPLETE
2427,2427,0.7633930015077556,2022-12-01 11:26:45.562136,2022-12-01 11:27:04.000524,0 days 00:00:18.438388,"{0: 1, 1: 10}",11.0,,810,COMPLETE
2428,2428,0.7705221071463804,2022-12-01 11:27:04.257170,2022-12-01 11:27:22.611341,0 days 00:00:18.354171,"{0: 1, 1: 10}",10.0,,810,COMPLETE
2429,2429,0.7469888668824713,2022-12-01 11:27:22.858597,2022-12-01 11:27:38.262225,0 days 00:00:15.403628,"{0: 1, 1: 10}",11.0,0.6,860,COMPLETE
2430,2430,0.7642277290879249,2022-12-01 11:27:38.515570,2022-12-01 11:27:56.599220,0 days 00:00:18.083650,"{0: 1, 1: 10}",18.0,0.9,860,COMPLETE
2431,2431,0.7669748620015338,2022-12-01 11:27:56.850042,2022-12-01 11:28:15.135937,0 days 00:00:18.285895,"{0: 1, 1: 10}",11.0,,810,COMPLETE
2432,2432,0.7645455455909264,2022-12-01 11:28:15.393276,2022-12-01 11:28:32.974907,0 days 00:00:17.581631,"{0: 1, 1: 10}",35.0,,760,COMPLETE
2433,2433,0.5795354229218896,2022-12-01 11:28:33.220658,2022-12-01 11:28:42.826438,0 days 00:00:09.605780,"{0: 1, 1: 10}",38.0,log2,860,COMPLETE
2434,2434,0.7681546121986697,2022-12-01 11:28:43.081649,2022-12-01 11:28:59.808504,0 days 00:00:16.726855,"{0: 1, 1: 10}",9.0,0.8,810,COMPLETE
2435,2435,0.7548251432242836,2022-12-01 11:29:00.075366,2022-12-01 11:29:18.930317,0 days 00:00:18.854951,"{0: 1, 1: 10}",6.0,,860,COMPLETE
2436,2436,0.6815209104592659,2022-12-01 11:29:19.174648,2022-12-01 11:29:28.515523,0 days 00:00:09.340875,"{0: 1, 1: 10}",34.0,sqrt,810,COMPLETE
2437,2437,0.7498147854601966,2022-12-01 11:29:28.776717,2022-12-01 11:29:44.959404,0 days 00:00:16.182687,"{0: 1, 1: 10}",11.0,0.7,860,COMPLETE
2438,2438,0.7654023964245809,2022-12-01 11:29:45.217101,2022-12-01 11:30:02.801820,0 days 00:00:17.584719,"{0: 1, 1: 10}",14.0,,760,COMPLETE
2439,2439,0.7690741883397149,2022-12-01 11:30:03.058879,2022-12-01 11:30:21.510681,0 days 00:00:18.451802,"{0: 1, 1: 10}",17.0,,810,COMPLETE
2440,2440,0.7429553939503447,2022-12-01 11:30:21.763614,2022-12-01 11:30:37.191627,0 days 00:00:15.428013,"{0: 1, 1: 10}",11.0,0.6,860,COMPLETE
2441,2441,0.7641997691823498,2022-12-01 11:30:37.447042,2022-12-01 11:30:55.749387,0 days 00:00:18.302345,"{0: 1, 1: 10}",15.0,,810,COMPLETE
2442,2442,0.755379181930172,2022-12-01 11:30:55.993598,2022-12-01 11:31:13.789453,0 days 00:00:17.795855,"{0: 1, 1: 10}",5.0,0.9,860,COMPLETE
2443,2443,0.7694108011664227,2022-12-01 11:31:14.037007,2022-12-01 11:31:32.356652,0 days 00:00:18.319645,"{0: 1, 1: 10}",11.0,,810,COMPLETE
2444,2444,0.5793003801203679,2022-12-01 11:31:32.604805,2022-12-01 11:31:42.087003,0 days 00:00:09.482198,"{0: 1, 1: 10}",29.0,log2,860,COMPLETE
2445,2445,0.768989001260845,2022-12-01 11:31:42.335792,2022-12-01 11:31:59.922507,0 days 00:00:17.586715,"{0: 1, 1: 10}",39.0,,760,COMPLETE
2446,2446,0.759119728132839,2022-12-01 11:32:00.176066,2022-12-01 11:32:17.668406,0 days 00:00:17.492340,"{0: 1, 1: 10}",21.0,0.8,860,COMPLETE
2447,2447,0.7651838496876996,2022-12-01 11:32:17.911996,2022-12-01 11:32:36.420208,0 days 00:00:18.508212,"{0: 1, 1: 10}",19.0,,810,COMPLETE
2448,2448,0.7532645348567768,2022-12-01 11:32:36.663221,2022-12-01 11:32:52.958755,0 days 00:00:16.295534,"{0: 1, 1: 10}",11.0,0.7,860,COMPLETE
2449,2449,0.7285660639274777,2022-12-01 11:32:53.222236,2022-12-01 11:33:08.101291,0 days 00:00:14.879055,"{0: 1, 1: 10}",2.0,,810,COMPLETE
2450,2450,0.7716559913440263,2022-12-01 11:33:08.353647,2022-12-01 11:33:27.519834,0 days 00:00:19.166187,"{0: 1, 1: 10}",26.0,,860,COMPLETE
2451,2451,0.735379139542993,2022-12-01 11:33:27.779976,2022-12-01 11:33:41.936225,0 days 00:00:14.156249,"{0: 1, 1: 10}",4.0,0.6,810,COMPLETE
2452,2452,0.7664553259709151,2022-12-01 11:33:42.184859,2022-12-01 11:33:58.997835,0 days 00:00:16.812976,"{0: 1, 1: 10}",11.0,0.9,760,COMPLETE
2453,2453,0.7647776606930071,2022-12-01 11:33:59.251384,2022-12-01 11:34:18.462286,0 days 00:00:19.210902,"{0: 1, 1: 10}",28.0,,860,COMPLETE
2454,2454,0.7686954368913328,2022-12-01 11:34:18.718017,2022-12-01 11:34:37.840575,0 days 00:00:19.122558,"{0: 1, 1: 10}",13.0,,860,COMPLETE
2455,2455,0.6881572884558168,2022-12-01 11:34:38.085638,2022-12-01 11:34:47.521097,0 days 00:00:09.435459,balanced,11.0,sqrt,860,COMPLETE
2456,2456,0.5767146814712742,2022-12-01 11:34:47.770931,2022-12-01 11:34:57.198782,0 days 00:00:09.427851,"{0: 1, 1: 10}",34.0,log2,810,COMPLETE
2457,2457,0.7603699704787237,2022-12-01 11:34:57.444771,2022-12-01 11:35:14.130309,0 days 00:00:16.685538,"{0: 1, 1: 10}",30.0,0.8,810,COMPLETE
2458,2458,0.7647804547382007,2022-12-01 11:35:14.384620,2022-12-01 11:35:33.647703,0 days 00:00:19.263083,"{0: 1, 1: 10}",20.0,,860,COMPLETE
2459,2459,0.7484471582938436,2022-12-01 11:35:33.901639,2022-12-01 11:35:49.623934,0 days 00:00:15.722295,"{0: 1, 1: 10}",16.0,0.7,810,COMPLETE
2460,2460,0.7575374076543078,2022-12-01 11:35:49.887159,2022-12-01 11:36:08.970055,0 days 00:00:19.082896,"{0: 1, 1: 10}",7.0,,860,COMPLETE
2461,2461,0.6894756802525615,2022-12-01 11:36:09.216862,2022-12-01 11:36:18.343698,0 days 00:00:09.126836,"{0: 1, 1: 10}",11.0,sqrt,760,COMPLETE
2462,2462,0.7658065386813198,2022-12-01 11:36:18.589051,2022-12-01 11:36:37.135315,0 days 00:00:18.546264,"{0: 1, 1: 10}",12.0,1.0,810,COMPLETE
2463,2463,0.7723709530426682,2022-12-01 11:36:37.386330,2022-12-01 11:36:56.735920,0 days 00:00:19.349590,"{0: 1, 1: 10}",11.0,1.0,860,COMPLETE
2464,2464,0.5992105233042965,2022-12-01 11:36:56.979794,2022-12-01 11:37:09.115096,0 days 00:00:12.135302,"{0: 1, 1: 10}",1.0,1.0,810,COMPLETE
2465,2465,0.7688393173251518,2022-12-01 11:37:09.369115,2022-12-01 11:37:26.883412,0 days 00:00:17.514297,"{0: 1, 1: 10}",10.0,,760,COMPLETE
2466,2466,0.768131457508784,2022-12-01 11:37:27.148347,2022-12-01 11:37:46.275109,0 days 00:00:19.126762,"{0: 1, 1: 10}",11.0,1.0,860,COMPLETE
2467,2467,0.7682679173323581,2022-12-01 11:37:46.530740,2022-12-01 11:38:05.702549,0 days 00:00:19.171809,"{0: 1, 1: 10}",11.0,1.0,860,COMPLETE
2468,2468,0.7662686012315301,2022-12-01 11:38:05.965028,2022-12-01 11:38:24.296397,0 days 00:00:18.331369,"{0: 1, 1: 10}",11.0,1.0,810,COMPLETE
2469,2469,0.7525837063545158,2022-12-01 11:38:24.545732,2022-12-01 11:38:39.340027,0 days 00:00:14.794295,"{0: 1, 1: 10}",8.0,0.6,810,COMPLETE
2470,2470,0.761862118537655,2022-12-01 11:38:39.592943,2022-12-01 11:38:58.862284,0 days 00:00:19.269341,"{0: 1, 1: 10}",33.0,1.0,860,COMPLETE
2471,2471,0.7704228043186963,2022-12-01 11:38:59.117275,2022-12-01 11:39:17.346316,0 days 00:00:18.229041,"{0: 1, 1: 10}",11.0,,810,COMPLETE
2472,2472,0.7692996250511619,2022-12-01 11:39:17.600117,2022-12-01 11:39:36.819452,0 days 00:00:19.219335,"{0: 1, 1: 10}",27.0,1.0,860,COMPLETE
2473,2473,0.7612474847705115,2022-12-01 11:39:37.072167,2022-12-01 11:39:53.149604,0 days 00:00:16.077437,"{0: 1, 1: 10}",34.0,0.9,710,COMPLETE
2474,2474,0.7699115613791883,2022-12-01 11:39:53.398656,2022-12-01 11:40:11.026938,0 days 00:00:17.628282,"{0: 1, 1: 10}",11.0,1.0,760,COMPLETE
2475,2475,0.7629281656707356,2022-12-01 11:40:11.273811,2022-12-01 11:40:30.347695,0 days 00:00:19.073884,"{0: 1, 1: 10}",11.0,1.0,860,COMPLETE
2476,2476,0.769985172029258,2022-12-01 11:40:30.597446,2022-12-01 11:40:48.979964,0 days 00:00:18.382518,"{0: 1, 1: 10}",28.0,,810,COMPLETE
2477,2477,0.6344781394914378,2022-12-01 11:40:49.232223,2022-12-01 11:41:04.139883,0 days 00:00:14.907660,balanced,3.0,1.0,860,COMPLETE
2478,2478,0.7651276575424808,2022-12-01 11:41:04.384781,2022-12-01 11:41:22.724702,0 days 00:00:18.339921,"{0: 1, 1: 10}",26.0,1.0,810,COMPLETE
2479,2479,0.7681530337322163,2022-12-01 11:41:22.979198,2022-12-01 11:41:42.266472,0 days 00:00:19.287274,"{0: 1, 1: 10}",37.0,1.0,860,COMPLETE
2480,2480,0.7700051974715326,2022-12-01 11:41:42.521971,2022-12-01 11:42:00.087160,0 days 00:00:17.565189,"{0: 1, 1: 10}",11.0,1.0,760,COMPLETE
2481,2481,0.7670407089874878,2022-12-01 11:42:00.332748,2022-12-01 11:42:18.881679,0 days 00:00:18.548931,"{0: 1, 1: 10}",25.0,,810,COMPLETE
2482,2482,0.7661881955299223,2022-12-01 11:42:19.137245,2022-12-01 11:42:38.333199,0 days 00:00:19.195954,"{0: 1, 1: 10}",11.0,1.0,860,COMPLETE
2483,2483,0.5753066919110802,2022-12-01 11:42:38.586349,2022-12-01 11:42:48.270198,0 days 00:00:09.683849,"{0: 1, 1: 10}",,log2,860,COMPLETE
2484,2484,0.7667456086683905,2022-12-01 11:42:48.523175,2022-12-01 11:43:06.913540,0 days 00:00:18.390365,"{0: 1, 1: 10}",31.0,1.0,810,COMPLETE
2485,2485,0.7574110593751513,2022-12-01 11:43:07.158543,2022-12-01 11:43:24.364166,0 days 00:00:17.205623,"{0: 1, 1: 10}",10.0,0.8,860,COMPLETE
