,number,value,datetime_start,datetime_complete,duration,params_class_weight,params_max_depth,params_max_features,params_n_estimators,state
1722,1722,0.7651477466007259,2022-12-01 07:50:20.568343,2022-12-01 07:50:40.360305,0 days 00:00:19.791962,"{0: 1, 1: 10}",37.0,1.0,910,COMPLETE
1723,1723,0.7648528614195276,2022-12-01 07:50:40.603791,2022-12-01 07:50:58.896594,0 days 00:00:18.292803,"{0: 1, 1: 10}",25.0,1.0,810,COMPLETE
1724,1724,0.7641429465670998,2022-12-01 07:50:59.136701,2022-12-01 07:51:18.284004,0 days 00:00:19.147303,"{0: 1, 1: 10}",16.0,1.0,860,COMPLETE
1725,1725,0.7698059160381999,2022-12-01 07:51:18.528749,2022-12-01 07:51:38.524655,0 days 00:00:19.995906,"{0: 1, 1: 10}",38.0,1.0,910,COMPLETE
1726,1726,0.7714691786884668,2022-12-01 07:51:38.766831,2022-12-01 07:51:58.820516,0 days 00:00:20.053685,"{0: 1, 1: 10}",23.0,1.0,910,COMPLETE
1727,1727,0.7595939833188429,2022-12-01 07:51:59.059202,2022-12-01 07:52:16.425747,0 days 00:00:17.366545,"{0: 1, 1: 10}",3.0,1.0,860,COMPLETE
1728,1728,0.7745105567224833,2022-12-01 07:52:16.669755,2022-12-01 07:52:35.038815,0 days 00:00:18.369060,"{0: 1, 1: 10}",11.0,1.0,810,COMPLETE
1729,1729,0.7645757075899484,2022-12-01 07:52:35.277040,2022-12-01 07:52:53.586294,0 days 00:00:18.309254,"{0: 1, 1: 10}",11.0,1.0,810,COMPLETE
1730,1730,0.773297810461837,2022-12-01 07:52:53.823984,2022-12-01 07:53:12.243347,0 days 00:00:18.419363,"{0: 1, 1: 10}",11.0,1.0,810,COMPLETE
1731,1731,0.7658214777938526,2022-12-01 07:53:12.479923,2022-12-01 07:53:31.463497,0 days 00:00:18.983574,"{0: 1, 1: 10}",11.0,1.0,860,COMPLETE
1732,1732,0.7782667605905385,2022-12-01 07:53:31.703508,2022-12-01 07:53:50.121503,0 days 00:00:18.417995,"{0: 1, 1: 10}",11.0,1.0,810,COMPLETE
1733,1733,0.77041464297992,2022-12-01 07:53:50.351698,2022-12-01 07:54:08.645848,0 days 00:00:18.294150,"{0: 1, 1: 10}",11.0,1.0,810,COMPLETE
1734,1734,0.7693360146578795,2022-12-01 07:54:08.892025,2022-12-01 07:54:26.724903,0 days 00:00:17.832878,"{0: 1, 1: 10}",11.0,1.0,760,COMPLETE
1735,1735,0.764569464102105,2022-12-01 07:54:26.964721,2022-12-01 07:54:44.488254,0 days 00:00:17.523533,"{0: 1, 1: 10}",11.0,1.0,760,COMPLETE
1736,1736,0.7656257106919251,2022-12-01 07:54:44.723878,2022-12-01 07:55:02.862257,0 days 00:00:18.138379,"{0: 1, 1: 10}",11.0,1.0,810,COMPLETE
1737,1737,0.7720465987429368,2022-12-01 07:55:03.095982,2022-12-01 07:55:21.421243,0 days 00:00:18.325261,"{0: 1, 1: 10}",11.0,1.0,810,COMPLETE
1738,1738,0.7669517173811641,2022-12-01 07:55:21.655009,2022-12-01 07:55:39.993896,0 days 00:00:18.338887,"{0: 1, 1: 10}",11.0,1.0,810,COMPLETE
1739,1739,0.7649902758076137,2022-12-01 07:55:40.231709,2022-12-01 07:55:57.763084,0 days 00:00:17.531375,"{0: 1, 1: 10}",11.0,1.0,760,COMPLETE
1740,1740,0.7670683648287597,2022-12-01 07:55:58.002837,2022-12-01 07:56:15.655376,0 days 00:00:17.652539,"{0: 1, 1: 10}",11.0,1.0,760,COMPLETE
1741,1741,0.7748865584497981,2022-12-01 07:56:15.896427,2022-12-01 07:56:34.206033,0 days 00:00:18.309606,"{0: 1, 1: 10}",11.0,1.0,810,COMPLETE
1742,1742,0.766322808063628,2022-12-01 07:56:34.446426,2022-12-01 07:56:52.803011,0 days 00:00:18.356585,"{0: 1, 1: 10}",11.0,1.0,810,COMPLETE
1743,1743,0.7612410101660664,2022-12-01 07:56:53.044903,2022-12-01 07:57:10.526777,0 days 00:00:17.481874,"{0: 1, 1: 10}",11.0,1.0,760,COMPLETE
1744,1744,0.7663700658858329,2022-12-01 07:57:10.759562,2022-12-01 07:57:28.259901,0 days 00:00:17.500339,"{0: 1, 1: 10}",11.0,1.0,760,COMPLETE
1745,1745,0.7682868506737573,2022-12-01 07:57:28.495545,2022-12-01 07:57:46.816783,0 days 00:00:18.321238,"{0: 1, 1: 10}",11.0,1.0,810,COMPLETE
1746,1746,0.7630200522805716,2022-12-01 07:57:47.067190,2022-12-01 07:58:05.275838,0 days 00:00:18.208648,"{0: 1, 1: 10}",11.0,1.0,810,COMPLETE
1747,1747,0.7709544256075713,2022-12-01 07:58:05.522892,2022-12-01 07:58:23.927205,0 days 00:00:18.404313,"{0: 1, 1: 10}",11.0,1.0,810,COMPLETE
1748,1748,0.7671175743191954,2022-12-01 07:58:24.166142,2022-12-01 07:58:41.710456,0 days 00:00:17.544314,"{0: 1, 1: 10}",11.0,1.0,760,COMPLETE
1749,1749,0.7686245989069733,2022-12-01 07:58:41.956349,2022-12-01 07:59:00.339927,0 days 00:00:18.383578,"{0: 1, 1: 10}",11.0,1.0,810,COMPLETE
1750,1750,0.7705610849191542,2022-12-01 07:59:00.578224,2022-12-01 07:59:18.975108,0 days 00:00:18.396884,"{0: 1, 1: 10}",11.0,1.0,810,COMPLETE
1751,1751,0.7645236175387312,2022-12-01 07:59:19.213984,2022-12-01 07:59:36.705895,0 days 00:00:17.491911,"{0: 1, 1: 10}",11.0,1.0,760,COMPLETE
1752,1752,0.7682617253631732,2022-12-01 07:59:36.947769,2022-12-01 07:59:55.285203,0 days 00:00:18.337434,"{0: 1, 1: 10}",11.0,1.0,810,COMPLETE
1753,1753,0.7717974112031293,2022-12-01 07:59:55.521302,2022-12-01 08:00:13.897350,0 days 00:00:18.376048,"{0: 1, 1: 10}",11.0,1.0,810,COMPLETE
1754,1754,0.7635421333018162,2022-12-01 08:00:14.144867,2022-12-01 08:00:31.598910,0 days 00:00:17.454043,"{0: 1, 1: 10}",11.0,1.0,760,COMPLETE
1755,1755,0.7700688439468547,2022-12-01 08:00:31.836714,2022-12-01 08:00:50.142935,0 days 00:00:18.306221,"{0: 1, 1: 10}",11.0,1.0,810,COMPLETE
1756,1756,0.7695858264397504,2022-12-01 08:00:50.375331,2022-12-01 08:01:08.768164,0 days 00:00:18.392833,"{0: 1, 1: 10}",11.0,1.0,810,COMPLETE
1757,1757,0.7718830142560777,2022-12-01 08:01:08.999831,2022-12-01 08:01:26.563799,0 days 00:00:17.563968,"{0: 1, 1: 10}",11.0,1.0,760,COMPLETE
1758,1758,0.7695432662374648,2022-12-01 08:01:26.802764,2022-12-01 08:01:44.987404,0 days 00:00:18.184640,"{0: 1, 1: 10}",11.0,1.0,810,COMPLETE
1759,1759,0.7682814831216074,2022-12-01 08:01:45.224914,2022-12-01 08:02:03.574420,0 days 00:00:18.349506,"{0: 1, 1: 10}",11.0,1.0,810,COMPLETE
1760,1760,0.7636229336062592,2022-12-01 08:02:03.818225,2022-12-01 08:02:22.166513,0 days 00:00:18.348288,"{0: 1, 1: 10}",11.0,1.0,810,COMPLETE
1761,1761,0.767606381664198,2022-12-01 08:02:22.408114,2022-12-01 08:02:40.672652,0 days 00:00:18.264538,"{0: 1, 1: 10}",11.0,1.0,810,COMPLETE
1762,1762,0.7689724204619017,2022-12-01 08:02:40.925806,2022-12-01 08:02:59.288203,0 days 00:00:18.362397,"{0: 1, 1: 10}",11.0,1.0,810,COMPLETE
1763,1763,0.767395820323103,2022-12-01 08:02:59.520086,2022-12-01 08:03:17.163631,0 days 00:00:17.643545,"{0: 1, 1: 10}",11.0,1.0,760,COMPLETE
1764,1764,0.764970218668134,2022-12-01 08:03:17.406930,2022-12-01 08:03:35.639348,0 days 00:00:18.232418,"{0: 1, 1: 10}",11.0,1.0,810,COMPLETE
1765,1765,0.7678030460502839,2022-12-01 08:03:35.881900,2022-12-01 08:03:54.170722,0 days 00:00:18.288822,"{0: 1, 1: 10}",11.0,1.0,810,COMPLETE
1766,1766,0.7687955391859614,2022-12-01 08:03:54.418731,2022-12-01 08:04:12.642424,0 days 00:00:18.223693,"{0: 1, 1: 10}",11.0,1.0,810,COMPLETE
1767,1767,0.7610152783896341,2022-12-01 08:04:12.881845,2022-12-01 08:04:31.320146,0 days 00:00:18.438301,"{0: 1, 1: 10}",28.0,1.0,810,COMPLETE
1768,1768,0.7668173811465749,2022-12-01 08:04:31.560857,2022-12-01 08:04:49.956972,0 days 00:00:18.396115,"{0: 1, 1: 10}",18.0,1.0,810,COMPLETE
1769,1769,0.7668259994595366,2022-12-01 08:04:50.192605,2022-12-01 08:05:08.416321,0 days 00:00:18.223716,"{0: 1, 1: 10}",11.0,1.0,810,COMPLETE
1770,1770,0.7634164225389412,2022-12-01 08:05:08.654502,2022-12-01 08:05:26.316167,0 days 00:00:17.661665,"{0: 1, 1: 10}",11.0,1.0,760,COMPLETE
1771,1771,0.770327540834917,2022-12-01 08:05:26.549314,2022-12-01 08:05:44.096725,0 days 00:00:17.547411,"{0: 1, 1: 10}",9.0,1.0,760,COMPLETE
1772,1772,0.7544680074936737,2022-12-01 08:05:44.338128,2022-12-01 08:06:02.441709,0 days 00:00:18.103581,"{0: 1, 1: 10}",6.0,1.0,810,COMPLETE
1773,1773,0.771243343164487,2022-12-01 08:06:02.688236,2022-12-01 08:06:21.115961,0 days 00:00:18.427725,"{0: 1, 1: 10}",14.0,1.0,810,COMPLETE
1774,1774,0.7699510315401212,2022-12-01 08:06:21.354750,2022-12-01 08:06:39.652899,0 days 00:00:18.298149,"{0: 1, 1: 10}",11.0,1.0,810,COMPLETE
1775,1775,0.7629037649445466,2022-12-01 08:06:39.894062,2022-12-01 08:06:58.364789,0 days 00:00:18.470727,"{0: 1, 1: 10}",35.0,1.0,810,COMPLETE
1776,1776,0.7636167167499142,2022-12-01 08:06:58.598719,2022-12-01 08:07:16.928256,0 days 00:00:18.329537,"{0: 1, 1: 10}",11.0,1.0,810,COMPLETE
1777,1777,0.7699156133980243,2022-12-01 08:07:17.169010,2022-12-01 08:07:36.347681,0 days 00:00:19.178671,"{0: 1, 1: 10}",11.0,1.0,860,COMPLETE
1778,1778,0.7684327873820834,2022-12-01 08:07:36.587742,2022-12-01 08:07:54.232462,0 days 00:00:17.644720,"{0: 1, 1: 10}",17.0,1.0,760,COMPLETE
1779,1779,0.7616296403282279,2022-12-01 08:07:54.473511,2022-12-01 08:08:12.943772,0 days 00:00:18.470261,"{0: 1, 1: 10}",32.0,1.0,810,COMPLETE
1780,1780,0.7516722839100272,2022-12-01 08:08:13.181882,2022-12-01 08:08:31.932347,0 days 00:00:18.750465,"{0: 1, 1: 10}",5.0,1.0,860,COMPLETE
1781,1781,0.757548796794177,2022-12-01 08:08:32.169246,2022-12-01 08:08:50.797525,0 days 00:00:18.628279,"{0: 1, 1: 10}",4.0,1.0,860,COMPLETE
1782,1782,0.7670857310088738,2022-12-01 08:08:51.029413,2022-12-01 08:09:10.050583,0 days 00:00:19.021170,"{0: 1, 1: 10}",11.0,1.0,860,COMPLETE
1783,1783,0.7651259268911355,2022-12-01 08:09:10.288007,2022-12-01 08:09:28.790145,0 days 00:00:18.502138,"{0: 1, 1: 10}",11.0,1.0,810,COMPLETE
1784,1784,0.7706135049232559,2022-12-01 08:09:29.023364,2022-12-01 08:09:48.165495,0 days 00:00:19.142131,"{0: 1, 1: 10}",19.0,1.0,860,COMPLETE
1785,1785,0.7697384399676871,2022-12-01 08:09:48.402625,2022-12-01 08:10:07.541361,0 days 00:00:19.138736,"{0: 1, 1: 10}",11.0,1.0,860,COMPLETE
1786,1786,0.7626170781395691,2022-12-01 08:10:07.773969,2022-12-01 08:10:26.203048,0 days 00:00:18.429079,"{0: 1, 1: 10}",21.0,1.0,810,COMPLETE
1787,1787,0.7677952100057592,2022-12-01 08:10:26.445982,2022-12-01 08:10:44.086457,0 days 00:00:17.640475,"{0: 1, 1: 10}",39.0,1.0,760,COMPLETE
1788,1788,0.7637405549846153,2022-12-01 08:10:44.327180,2022-12-01 08:11:03.350207,0 days 00:00:19.023027,"{0: 1, 1: 10}",11.0,1.0,860,COMPLETE
1789,1789,0.7634017205390482,2022-12-01 08:11:03.597903,2022-12-01 08:11:22.947486,0 days 00:00:19.349583,"{0: 1, 1: 10}",24.0,1.0,860,COMPLETE
1790,1790,0.7644580289765399,2022-12-01 08:11:23.189470,2022-12-01 08:11:41.455082,0 days 00:00:18.265612,"{0: 1, 1: 10}",29.0,1.0,810,COMPLETE
1791,1791,0.7668770090147905,2022-12-01 08:11:41.692448,2022-12-01 08:12:00.898557,0 days 00:00:19.206109,"{0: 1, 1: 10}",12.0,1.0,860,COMPLETE
1792,1792,0.7684992943499193,2022-12-01 08:12:01.137228,2022-12-01 08:12:20.262581,0 days 00:00:19.125353,"{0: 1, 1: 10}",13.0,1.0,860,COMPLETE
1793,1793,0.765304938450582,2022-12-01 08:12:20.504037,2022-12-01 08:12:38.977693,0 days 00:00:18.473656,"{0: 1, 1: 10}",20.0,1.0,810,COMPLETE
1794,1794,0.7659134883447625,2022-12-01 08:12:39.191170,2022-12-01 08:12:58.264041,0 days 00:00:19.072871,"{0: 1, 1: 10}",11.0,1.0,860,COMPLETE
1795,1795,0.7306106117996612,2022-12-01 08:12:58.508076,2022-12-01 08:13:13.307425,0 days 00:00:14.799349,"{0: 1, 1: 10}",2.0,1.0,810,COMPLETE
1796,1796,0.7695010053632931,2022-12-01 08:13:13.549858,2022-12-01 08:13:32.495344,0 days 00:00:18.945486,"{0: 1, 1: 10}",11.0,1.0,860,COMPLETE
1797,1797,0.5858116362034544,2022-12-01 08:13:32.741384,2022-12-01 08:13:45.360747,0 days 00:00:12.619363,"{0: 1, 1: 10}",1.0,1.0,860,COMPLETE
1798,1798,0.7644005611212396,2022-12-01 08:13:45.593897,2022-12-01 08:14:03.900988,0 days 00:00:18.307091,"{0: 1, 1: 10}",11.0,1.0,810,COMPLETE
1799,1799,0.7680599226714622,2022-12-01 08:14:04.144283,2022-12-01 08:14:23.371717,0 days 00:00:19.227434,"{0: 1, 1: 10}",11.0,1.0,860,COMPLETE
1800,1800,0.7567903109107263,2022-12-01 08:14:23.622388,2022-12-01 08:14:43.275976,0 days 00:00:19.653588,"{0: 1, 1: 10}",7.0,1.0,910,COMPLETE
1801,1801,0.7677584203471921,2022-12-01 08:14:43.509600,2022-12-01 08:15:02.665026,0 days 00:00:19.155426,"{0: 1, 1: 10}",11.0,1.0,860,COMPLETE
1802,1802,0.7603475389595242,2022-12-01 08:15:02.909078,2022-12-01 08:15:20.398798,0 days 00:00:17.489720,"{0: 1, 1: 10}",8.0,1.0,760,COMPLETE
1803,1803,0.7633345930967967,2022-12-01 08:15:20.645663,2022-12-01 08:15:39.062201,0 days 00:00:18.416538,"{0: 1, 1: 10}",,1.0,810,COMPLETE
1804,1804,0.7687814106514825,2022-12-01 08:15:39.293908,2022-12-01 08:15:59.173664,0 days 00:00:19.879756,"{0: 1, 1: 10}",11.0,1.0,910,COMPLETE
1805,1805,0.7678015774288097,2022-12-01 08:15:59.414678,2022-12-01 08:16:18.577750,0 days 00:00:19.163072,"{0: 1, 1: 10}",32.0,1.0,860,COMPLETE
1806,1806,0.7652744997780452,2022-12-01 08:16:18.810049,2022-12-01 08:16:38.767202,0 days 00:00:19.957153,"{0: 1, 1: 10}",26.0,1.0,910,COMPLETE
1807,1807,0.7685406839516012,2022-12-01 08:16:39.006106,2022-12-01 08:16:57.405638,0 days 00:00:18.399532,"{0: 1, 1: 10}",11.0,1.0,810,COMPLETE
1808,1808,0.7648263423171733,2022-12-01 08:16:57.650482,2022-12-01 08:17:16.757620,0 days 00:00:19.107138,"{0: 1, 1: 10}",10.0,1.0,860,COMPLETE
1809,1809,0.769614145256045,2022-12-01 08:17:16.996894,2022-12-01 08:17:36.881719,0 days 00:00:19.884825,"{0: 1, 1: 10}",33.0,1.0,910,COMPLETE
1810,1810,0.7668361511317662,2022-12-01 08:17:37.120466,2022-12-01 08:17:56.199983,0 days 00:00:19.079517,"{0: 1, 1: 10}",11.0,1.0,860,COMPLETE
1811,1811,0.7744446687000341,2022-12-01 08:17:56.433843,2022-12-01 08:18:16.499774,0 days 00:00:20.065931,"{0: 1, 1: 10}",36.0,1.0,910,COMPLETE
1812,1812,0.7655067544054275,2022-12-01 08:18:16.732984,2022-12-01 08:18:36.527846,0 days 00:00:19.794862,"{0: 1, 1: 10}",9.0,1.0,910,COMPLETE
1813,1813,0.7662786169206893,2022-12-01 08:18:36.767963,2022-12-01 08:18:55.893130,0 days 00:00:19.125167,"{0: 1, 1: 10}",16.0,1.0,860,COMPLETE
1814,1814,0.7692294706490277,2022-12-01 08:18:56.127277,2022-12-01 08:19:16.082438,0 days 00:00:19.955161,"{0: 1, 1: 10}",36.0,1.0,910,COMPLETE
1815,1815,0.7624337662921652,2022-12-01 08:19:16.329175,2022-12-01 08:19:34.724611,0 days 00:00:18.395436,"{0: 1, 1: 10}",27.0,1.0,810,COMPLETE
1816,1816,0.7734623584346831,2022-12-01 08:19:34.961450,2022-12-01 08:19:54.144328,0 days 00:00:19.182878,"{0: 1, 1: 10}",36.0,1.0,860,COMPLETE
1817,1817,0.7697139485030755,2022-12-01 08:19:54.376929,2022-12-01 08:20:12.778137,0 days 00:00:18.401208,"{0: 1, 1: 10}",36.0,1.0,810,COMPLETE
1818,1818,0.7707301892712298,2022-12-01 08:20:13.020728,2022-12-01 08:20:32.119777,0 days 00:00:19.099049,"{0: 1, 1: 10}",24.0,1.0,860,COMPLETE
1819,1819,0.7659751162347136,2022-12-01 08:20:32.351028,2022-12-01 08:20:50.734231,0 days 00:00:18.383203,"{0: 1, 1: 10}",36.0,1.0,810,COMPLETE
1820,1820,0.7698202181395845,2022-12-01 08:20:50.966029,2022-12-01 08:21:10.034997,0 days 00:00:19.068968,"{0: 1, 1: 10}",36.0,1.0,860,COMPLETE
1821,1821,0.7684672047686576,2022-12-01 08:21:10.277100,2022-12-01 08:21:29.560160,0 days 00:00:19.283060,"{0: 1, 1: 10}",34.0,1.0,860,COMPLETE
1822,1822,0.7658082519694304,2022-12-01 08:21:29.809248,2022-12-01 08:21:48.302523,0 days 00:00:18.493275,"{0: 1, 1: 10}",36.0,1.0,810,COMPLETE
1823,1823,0.7681783980873526,2022-12-01 08:21:48.543914,2022-12-01 08:22:07.846999,0 days 00:00:19.303085,"{0: 1, 1: 10}",25.0,1.0,860,COMPLETE
1824,1824,0.7695735878415804,2022-12-01 08:22:08.078607,2022-12-01 08:22:25.634372,0 days 00:00:17.555765,"{0: 1, 1: 10}",36.0,1.0,760,COMPLETE
1825,1825,0.7641001059884337,2022-12-01 08:22:25.878366,2022-12-01 08:22:45.055281,0 days 00:00:19.176915,"{0: 1, 1: 10}",36.0,1.0,860,COMPLETE
1826,1826,0.7675790301108155,2022-12-01 08:22:45.297004,2022-12-01 08:23:04.468741,0 days 00:00:19.171737,"{0: 1, 1: 10}",36.0,1.0,860,COMPLETE
1827,1827,0.7678960435173606,2022-12-01 08:23:04.703735,2022-12-01 08:23:23.097949,0 days 00:00:18.394214,"{0: 1, 1: 10}",28.0,1.0,810,COMPLETE
1828,1828,0.7580119908030063,2022-12-01 08:23:23.331371,2022-12-01 08:23:40.665974,0 days 00:00:17.334603,"{0: 1, 1: 10}",3.0,1.0,860,COMPLETE
1829,1829,0.7682894311495011,2022-12-01 08:23:40.899290,2022-12-01 08:23:59.345203,0 days 00:00:18.445913,"{0: 1, 1: 10}",18.0,1.0,810,COMPLETE
1830,1830,0.7694438970070991,2022-12-01 08:23:59.580906,2022-12-01 08:24:18.888174,0 days 00:00:19.307268,"{0: 1, 1: 10}",36.0,1.0,860,COMPLETE
1831,1831,0.766113421578423,2022-12-01 08:24:19.124502,2022-12-01 08:24:37.371591,0 days 00:00:18.247089,"{0: 1, 1: 10}",36.0,1.0,810,COMPLETE
1832,1832,0.7688099937602744,2022-12-01 08:24:37.618535,2022-12-01 08:24:56.765079,0 days 00:00:19.146544,"{0: 1, 1: 10}",36.0,1.0,860,COMPLETE
1833,1833,0.7657680049844824,2022-12-01 08:24:57.007081,2022-12-01 08:25:16.212190,0 days 00:00:19.205109,"{0: 1, 1: 10}",36.0,1.0,860,COMPLETE
1834,1834,0.7647777106096496,2022-12-01 08:25:16.449821,2022-12-01 08:25:35.443421,0 days 00:00:18.993600,"{0: 1, 1: 10}",32.0,1.0,860,COMPLETE
1835,1835,0.7644637594846733,2022-12-01 08:25:35.684155,2022-12-01 08:25:53.303637,0 days 00:00:17.619482,"{0: 1, 1: 10}",31.0,1.0,760,COMPLETE
1836,1836,0.7701470064445018,2022-12-01 08:25:53.524538,2022-12-01 08:26:11.934622,0 days 00:00:18.410084,"{0: 1, 1: 10}",14.0,1.0,810,COMPLETE
1837,1837,0.770853565469271,2022-12-01 08:26:12.174971,2022-12-01 08:26:31.165532,0 days 00:00:18.990561,"{0: 1, 1: 10}",36.0,1.0,860,COMPLETE
1838,1838,0.76419970951382,2022-12-01 08:26:31.414255,2022-12-01 08:26:49.795495,0 days 00:00:18.381240,"{0: 1, 1: 10}",36.0,1.0,810,COMPLETE
1839,1839,0.764649704985929,2022-12-01 08:26:50.038444,2022-12-01 08:27:09.212796,0 days 00:00:19.174352,"{0: 1, 1: 10}",37.0,1.0,860,COMPLETE
1840,1840,0.7694099133322164,2022-12-01 08:27:09.453847,2022-12-01 08:27:27.788373,0 days 00:00:18.334526,"{0: 1, 1: 10}",36.0,1.0,810,COMPLETE
1841,1841,0.7679313166224166,2022-12-01 08:27:28.017308,2022-12-01 08:27:47.181673,0 days 00:00:19.164365,"{0: 1, 1: 10}",38.0,1.0,860,COMPLETE
1842,1842,0.7441525749301222,2022-12-01 08:27:47.421523,2022-12-01 08:28:02.748280,0 days 00:00:15.326757,"{0: 1, 1: 10}",36.0,0.6,860,COMPLETE
1843,1843,0.7716249154236132,2022-12-01 08:28:02.956042,2022-12-01 08:28:21.250998,0 days 00:00:18.294956,"{0: 1, 1: 10}",36.0,1.0,810,COMPLETE
1844,1844,0.7722277568171863,2022-12-01 08:28:21.488671,2022-12-01 08:28:40.649211,0 days 00:00:19.160540,"{0: 1, 1: 10}",36.0,1.0,860,COMPLETE
1845,1845,0.7664223113073081,2022-12-01 08:28:40.886761,2022-12-01 08:29:00.682539,0 days 00:00:19.795778,"{0: 1, 1: 10}",36.0,1.0,910,COMPLETE
1846,1846,0.7678449197796816,2022-12-01 08:29:00.916620,2022-12-01 08:29:20.157134,0 days 00:00:19.240514,"{0: 1, 1: 10}",17.0,1.0,860,COMPLETE
1847,1847,0.7657313491796454,2022-12-01 08:29:20.399175,2022-12-01 08:29:40.453551,0 days 00:00:20.054376,"{0: 1, 1: 10}",36.0,1.0,910,COMPLETE
1848,1848,0.7629662688830187,2022-12-01 08:29:40.697889,2022-12-01 08:29:59.910778,0 days 00:00:19.212889,"{0: 1, 1: 10}",36.0,1.0,860,COMPLETE
1849,1849,0.7605944781970696,2022-12-01 08:30:00.147647,2022-12-01 08:30:17.425119,0 days 00:00:17.277472,"{0: 1, 1: 10}",5.0,1.0,760,COMPLETE
1850,1850,0.7631498756982107,2022-12-01 08:30:17.678111,2022-12-01 08:30:37.649191,0 days 00:00:19.971080,"{0: 1, 1: 10}",36.0,1.0,910,COMPLETE
1851,1851,0.7509959947234167,2022-12-01 08:30:37.897489,2022-12-01 08:30:55.894486,0 days 00:00:17.996997,"{0: 1, 1: 10}",6.0,1.0,810,COMPLETE
1852,1852,0.7677591686788553,2022-12-01 08:30:56.135153,2022-12-01 08:31:15.265874,0 days 00:00:19.130721,"{0: 1, 1: 10}",35.0,1.0,860,COMPLETE
1853,1853,0.756443955856763,2022-12-01 08:31:15.500712,2022-12-01 08:31:34.848113,0 days 00:00:19.347401,"{0: 1, 1: 10}",4.0,1.0,910,COMPLETE
1854,1854,0.771613011397736,2022-12-01 08:31:35.090827,2022-12-01 08:31:54.237957,0 days 00:00:19.147130,"{0: 1, 1: 10}",36.0,1.0,860,COMPLETE
1855,1855,0.7666061498169994,2022-12-01 08:31:54.488218,2022-12-01 08:32:12.904583,0 days 00:00:18.416365,"{0: 1, 1: 10}",19.0,1.0,810,COMPLETE
1856,1856,0.7661426939010447,2022-12-01 08:32:13.142881,2022-12-01 08:32:32.982514,0 days 00:00:19.839633,"{0: 1, 1: 10}",36.0,1.0,910,COMPLETE
1857,1857,0.7666654378602412,2022-12-01 08:32:33.215799,2022-12-01 08:32:52.443805,0 days 00:00:19.228006,"{0: 1, 1: 10}",13.0,1.0,860,COMPLETE
1858,1858,0.7673720833582209,2022-12-01 08:32:52.693984,2022-12-01 08:33:12.608781,0 days 00:00:19.914797,"{0: 1, 1: 10}",36.0,1.0,910,COMPLETE
1859,1859,0.7657313919749372,2022-12-01 08:33:12.851399,2022-12-01 08:33:32.006914,0 days 00:00:19.155515,"{0: 1, 1: 10}",36.0,1.0,860,COMPLETE
1860,1860,0.7608100867705476,2022-12-01 08:33:32.250165,2022-12-01 08:33:50.687625,0 days 00:00:18.437460,"{0: 1, 1: 10}",24.0,1.0,810,COMPLETE
1861,1861,0.7618644638377445,2022-12-01 08:33:50.925080,2022-12-01 08:34:10.889481,0 days 00:00:19.964401,"{0: 1, 1: 10}",39.0,1.0,910,COMPLETE
1862,1862,0.7625023808168067,2022-12-01 08:34:11.131083,2022-12-01 08:34:30.306806,0 days 00:00:19.175723,"{0: 1, 1: 10}",21.0,1.0,860,COMPLETE
1863,1863,0.7718519114009341,2022-12-01 08:34:30.536403,2022-12-01 08:34:50.457262,0 days 00:00:19.920859,"{0: 1, 1: 10}",29.0,1.0,910,COMPLETE
1864,1864,0.7394039047513398,2022-12-01 08:34:50.701311,2022-12-01 08:35:06.086202,0 days 00:00:15.384891,"{0: 1, 1: 10}",36.0,0.6,860,COMPLETE
1865,1865,0.5971905045588597,2022-12-01 08:35:06.323448,2022-12-01 08:35:18.491922,0 days 00:00:12.168474,"{0: 1, 1: 10}",1.0,1.0,810,COMPLETE
1866,1866,0.7699323638858675,2022-12-01 08:35:18.736800,2022-12-01 08:35:38.601259,0 days 00:00:19.864459,"{0: 1, 1: 10}",12.0,1.0,910,COMPLETE
1867,1867,0.7690233121996027,2022-12-01 08:35:38.855147,2022-12-01 08:35:58.183521,0 days 00:00:19.328374,"{0: 1, 1: 10}",20.0,1.0,860,COMPLETE
1868,1868,0.7673553663260948,2022-12-01 08:35:58.439717,2022-12-01 08:36:16.762390,0 days 00:00:18.322673,"{0: 1, 1: 10}",32.0,1.0,810,COMPLETE
1869,1869,0.7665716786945953,2022-12-01 08:36:16.983416,2022-12-01 08:36:36.857540,0 days 00:00:19.874124,"{0: 1, 1: 10}",34.0,1.0,910,COMPLETE
1870,1870,0.7246547142977054,2022-12-01 08:36:37.102826,2022-12-01 08:36:52.988088,0 days 00:00:15.885262,"{0: 1, 1: 10}",2.0,1.0,910,COMPLETE
1871,1871,0.7597481458022101,2022-12-01 08:36:53.238590,2022-12-01 08:37:12.180062,0 days 00:00:18.941472,"{0: 1, 1: 10}",8.0,1.0,860,COMPLETE
1872,1872,0.7707877565425507,2022-12-01 08:37:12.417312,2022-12-01 08:37:29.926729,0 days 00:00:17.509417,"{0: 1, 1: 10}",10.0,1.0,760,COMPLETE
1873,1873,0.7627134661434607,2022-12-01 08:37:30.171130,2022-12-01 08:37:50.330211,0 days 00:00:20.159081,"{0: 1, 1: 10}",36.0,1.0,910,COMPLETE
