,number,value,datetime_start,datetime_complete,duration,params_class_weight,params_max_depth,params_max_features,params_n_estimators,state
321,321,0.5769034217710847,2022-12-01 01:40:36.027869,2022-12-01 01:40:45.210068,0 days 00:00:09.182199,"{0: 1, 1: 10}",33.0,log2,760,COMPLETE
322,322,0.6706404303630271,2022-12-01 01:40:45.425333,2022-12-01 01:40:55.748656,0 days 00:00:10.323323,balanced,37.0,0.6,510,COMPLETE
323,323,0.7387163013177618,2022-12-01 01:40:55.960965,2022-12-01 01:41:03.039713,0 days 00:00:07.078748,"{0: 1, 1: 10}",10.0,0.9,60,COMPLETE
324,324,0.7051733972414632,2022-12-01 01:41:03.250173,2022-12-01 01:41:10.302399,0 days 00:00:07.052226,balanced,39.0,sqrt,110,COMPLETE
325,325,0.6380526721494557,2022-12-01 01:41:10.509575,2022-12-01 01:41:22.307879,0 days 00:00:11.798304,balanced,35.0,1.0,510,COMPLETE
326,326,0.7599678775933729,2022-12-01 01:41:22.542147,2022-12-01 01:41:37.582912,0 days 00:00:15.040765,"{0: 1, 1: 10}",38.0,0.8,710,COMPLETE
327,327,0.7374036087250692,2022-12-01 01:41:37.791752,2022-12-01 01:41:50.125317,0 days 00:00:12.333565,,,0.6,360,COMPLETE
328,328,0.7474979804056807,2022-12-01 01:41:50.337317,2022-12-01 01:42:05.434921,0 days 00:00:15.097604,"{0: 1, 1: 10}",29.0,0.6,860,COMPLETE
329,329,0.7551277693703453,2022-12-01 01:42:05.641904,2022-12-01 01:42:21.666521,0 days 00:00:16.024617,,4.0,1.0,460,COMPLETE
330,330,0.6725384142759032,2022-12-01 01:42:21.878370,2022-12-01 01:42:28.765729,0 days 00:00:06.887359,"{0: 1, 1: 10}",19.0,0.8,10,COMPLETE
331,331,0.6383421441019989,2022-12-01 01:42:28.976611,2022-12-01 01:42:39.681172,0 days 00:00:10.704561,balanced,12.0,0.9,460,COMPLETE
332,332,0.7359858959724752,2022-12-01 01:42:39.892305,2022-12-01 01:42:49.590632,0 days 00:00:09.698327,,17.0,0.6,210,COMPLETE
333,333,0.7355346030336405,2022-12-01 01:42:49.802680,2022-12-01 01:43:14.913301,0 days 00:00:25.110621,,14.0,0.9,760,COMPLETE
334,334,0.6464372009283983,2022-12-01 01:43:15.127844,2022-12-01 01:43:25.608618,0 days 00:00:10.480774,balanced,11.0,0.8,460,COMPLETE
335,335,0.6512957814937098,2022-12-01 01:43:25.825647,2022-12-01 01:43:33.755134,0 days 00:00:07.929487,"{0: 1, 1: 100}",11.0,0.6,260,COMPLETE
336,336,0.712369420784029,2022-12-01 01:43:33.968760,2022-12-01 01:43:41.831891,0 days 00:00:07.863131,"{0: 1, 1: 100}",25.0,sqrt,510,COMPLETE
337,337,0.5917041040966261,2022-12-01 01:43:42.047922,2022-12-01 01:43:48.995630,0 days 00:00:06.947708,"{0: 1, 1: 100}",6.0,,60,COMPLETE
338,338,0.7543250171259184,2022-12-01 01:43:49.204554,2022-12-01 01:44:00.380872,0 days 00:00:11.176318,"{0: 1, 1: 10}",10.0,1.0,360,COMPLETE
339,339,0.61368608738264,2022-12-01 01:44:00.594077,2022-12-01 01:44:11.953679,0 days 00:00:11.359602,balanced,3.0,log2,910,COMPLETE
340,340,0.584628785833618,2022-12-01 01:44:12.164034,2022-12-01 01:44:20.656906,0 days 00:00:08.492872,"{0: 1, 1: 10}",39.0,log2,610,COMPLETE
341,341,0.6276217649727132,2022-12-01 01:44:20.868147,2022-12-01 01:44:30.699113,0 days 00:00:09.830966,,7.0,log2,710,COMPLETE
342,342,0.5885412136664046,2022-12-01 01:44:31.023438,2022-12-01 01:44:39.223476,0 days 00:00:08.200038,"{0: 1, 1: 100}",10.0,,10,COMPLETE
343,343,0.6534242087186285,2022-12-01 01:44:39.441054,2022-12-01 01:44:52.752603,0 days 00:00:13.311549,"{0: 1, 1: 100}",22.0,0.8,760,COMPLETE
344,344,0.6551813513709233,2022-12-01 01:44:52.964902,2022-12-01 01:44:59.820124,0 days 00:00:06.855222,balanced,3.0,,10,COMPLETE
345,345,0.6359205694221208,2022-12-01 01:45:00.035375,2022-12-01 01:45:07.969976,0 days 00:00:07.934601,"{0: 1, 1: 100}",36.0,log2,510,COMPLETE
346,346,0.5649075473382986,2022-12-01 01:45:08.181973,2022-12-01 01:45:16.060558,0 days 00:00:07.878585,"{0: 1, 1: 100}",4.0,,210,COMPLETE
347,347,0.6587544146319673,2022-12-01 01:45:16.275406,2022-12-01 01:45:24.561237,0 days 00:00:08.285831,,4.0,sqrt,510,COMPLETE
348,348,0.6599896473498343,2022-12-01 01:45:24.774375,2022-12-01 01:45:34.484869,0 days 00:00:09.710494,balanced,27.0,0.7,410,COMPLETE
349,349,0.6003488946959312,2022-12-01 01:45:34.697046,2022-12-01 01:45:42.788679,0 days 00:00:08.091633,"{0: 1, 1: 100}",5.0,0.7,260,COMPLETE
350,350,0.7343565022553473,2022-12-01 01:45:43.289970,2022-12-01 01:46:14.100503,0 days 00:00:30.810533,,28.0,,910,COMPLETE
351,351,0.6631919572672975,2022-12-01 01:46:14.620687,2022-12-01 01:46:21.661327,0 days 00:00:07.040640,"{0: 1, 1: 10}",24.0,sqrt,260,COMPLETE
352,352,0.6881654607566443,2022-12-01 01:46:21.876049,2022-12-01 01:46:28.608266,0 days 00:00:06.732217,"{0: 1, 1: 10}",12.0,0.9,10,COMPLETE
353,353,0.6570577232679846,2022-12-01 01:46:28.825217,2022-12-01 01:46:40.537698,0 days 00:00:11.712481,"{0: 1, 1: 100}",17.0,0.7,660,COMPLETE
354,354,0.5995138984833004,2022-12-01 01:46:40.750248,2022-12-01 01:46:47.581387,0 days 00:00:06.831139,"{0: 1, 1: 100}",8.0,0.9,10,COMPLETE
355,355,0.657536454900348,2022-12-01 01:46:47.790699,2022-12-01 01:47:01.910174,0 days 00:00:14.119475,"{0: 1, 1: 100}",27.0,0.7,760,COMPLETE
356,356,0.6353845142368686,2022-12-01 01:47:02.517481,2022-12-01 01:47:18.098980,0 days 00:00:15.581499,balanced,15.0,1.0,610,COMPLETE
357,357,0.6604783180782335,2022-12-01 01:47:18.309234,2022-12-01 01:47:27.419945,0 days 00:00:09.110711,,1.0,0.7,560,COMPLETE
358,358,0.7608187919568031,2022-12-01 01:47:27.629724,2022-12-01 01:47:45.633338,0 days 00:00:18.003614,"{0: 1, 1: 10}",39.0,1.0,760,COMPLETE
359,359,0.6989454034593565,2022-12-01 01:47:45.844191,2022-12-01 01:47:54.142932,0 days 00:00:08.298741,"{0: 1, 1: 10}",4.0,sqrt,510,COMPLETE
360,360,0.606299016074585,2022-12-01 01:47:54.353758,2022-12-01 01:48:03.282445,0 days 00:00:08.928687,"{0: 1, 1: 100}",4.0,0.8,360,COMPLETE
361,361,0.6419399583369038,2022-12-01 01:48:03.499761,2022-12-01 01:48:12.002372,0 days 00:00:08.502611,balanced,4.0,log2,460,COMPLETE
362,362,0.6156458996469824,2022-12-01 01:48:12.215462,2022-12-01 01:48:21.767656,0 days 00:00:09.552194,,14.0,log2,810,COMPLETE
363,363,0.74574122217203,2022-12-01 01:48:21.978868,2022-12-01 01:48:37.916470,0 days 00:00:15.937602,"{0: 1, 1: 10}",3.0,0.8,910,COMPLETE
364,364,0.7124395303058717,2022-12-01 01:48:38.123308,2022-12-01 01:48:45.335953,0 days 00:00:07.212645,"{0: 1, 1: 100}",26.0,sqrt,260,COMPLETE
365,365,0.7588310250906325,2022-12-01 01:48:45.555741,2022-12-01 01:48:53.763932,0 days 00:00:08.208191,"{0: 1, 1: 10}",30.0,1.0,160,COMPLETE
366,366,0.7344727824379779,2022-12-01 01:48:53.977476,2022-12-01 01:49:15.052165,0 days 00:00:21.074689,,26.0,0.8,660,COMPLETE
367,367,0.7509406907218403,2022-12-01 01:49:15.262064,2022-12-01 01:49:28.677973,0 days 00:00:13.415909,"{0: 1, 1: 10}",6.0,1.0,510,COMPLETE
368,368,0.6395316151714867,2022-12-01 01:49:28.888907,2022-12-01 01:49:41.706385,0 days 00:00:12.817478,balanced,39.0,,610,COMPLETE
369,369,0.6194062145797934,2022-12-01 01:49:41.920499,2022-12-01 01:49:50.022141,0 days 00:00:08.101642,"{0: 1, 1: 10}",18.0,log2,510,COMPLETE
370,370,0.6599534451352603,2022-12-01 01:49:50.236794,2022-12-01 01:50:03.941794,0 days 00:00:13.705000,"{0: 1, 1: 100}",20.0,0.7,860,COMPLETE
371,371,0.7362471441003082,2022-12-01 01:50:04.154063,2022-12-01 01:50:28.178905,0 days 00:00:24.024842,,29.0,,660,COMPLETE
372,372,0.6584685653555576,2022-12-01 01:50:28.397739,2022-12-01 01:50:43.161635,0 days 00:00:14.763896,"{0: 1, 1: 100}",37.0,0.8,910,COMPLETE
373,373,0.6801557259692526,2022-12-01 01:50:43.362037,2022-12-01 01:50:50.111936,0 days 00:00:06.749899,"{0: 1, 1: 10}",7.0,sqrt,60,COMPLETE
374,374,0.6370501234682043,2022-12-01 01:50:50.321874,2022-12-01 01:51:05.618475,0 days 00:00:15.296601,"{0: 1, 1: 100}",30.0,1.0,860,COMPLETE
375,375,0.7363026986966233,2022-12-01 01:51:05.832678,2022-12-01 01:51:30.535635,0 days 00:00:24.702957,,18.0,0.7,910,COMPLETE
376,376,0.7071194013388353,2022-12-01 01:51:30.746340,2022-12-01 01:51:38.521796,0 days 00:00:07.775456,"{0: 1, 1: 100}",19.0,sqrt,460,COMPLETE
377,377,0.770567321060881,2022-12-01 01:51:38.730438,2022-12-01 01:51:53.720072,0 days 00:00:14.989634,"{0: 1, 1: 10}",15.0,1.0,610,COMPLETE
378,378,0.665098741380899,2022-12-01 01:51:53.928891,2022-12-01 01:52:00.992087,0 days 00:00:07.063196,balanced,33.0,0.7,60,COMPLETE
379,379,0.6675915679513835,2022-12-01 01:52:01.295510,2022-12-01 01:52:10.778710,0 days 00:00:09.483200,"{0: 1, 1: 100}",8.0,sqrt,910,COMPLETE
380,380,0.635763782906723,2022-12-01 01:52:10.998121,2022-12-01 01:52:19.655373,0 days 00:00:08.657252,,31.0,sqrt,660,COMPLETE
381,381,0.6544356183936675,2022-12-01 01:52:19.865549,2022-12-01 01:52:34.127153,0 days 00:00:14.261604,"{0: 1, 1: 100}",24.0,0.9,810,COMPLETE
382,382,0.7005292702537048,2022-12-01 01:52:34.329449,2022-12-01 01:52:41.058984,0 days 00:00:06.729535,"{0: 1, 1: 10}",17.0,0.8,10,COMPLETE
383,383,0.6334477781682688,2022-12-01 01:52:41.267468,2022-12-01 01:52:54.677396,0 days 00:00:13.409928,balanced,,1.0,660,COMPLETE
384,384,0.6450841399323279,2022-12-01 01:52:54.886507,2022-12-01 01:53:04.420209,0 days 00:00:09.533702,"{0: 1, 1: 100}",39.0,log2,910,COMPLETE
385,385,0.6128850785905489,2022-12-01 01:53:04.633983,2022-12-01 01:53:13.553927,0 days 00:00:08.919944,"{0: 1, 1: 100}",4.0,0.6,410,COMPLETE
386,386,0.725502266815262,2022-12-01 01:53:13.765550,2022-12-01 01:53:22.358936,0 days 00:00:08.593386,"{0: 1, 1: 10}",2.0,,260,COMPLETE
387,387,0.7182052165682219,2022-12-01 01:53:22.568404,2022-12-01 01:53:29.613547,0 days 00:00:07.045143,"{0: 1, 1: 100}",30.0,sqrt,260,COMPLETE
388,388,0.6785810808665141,2022-12-01 01:53:29.833927,2022-12-01 01:53:39.044345,0 days 00:00:09.210418,"{0: 1, 1: 10}",17.0,sqrt,810,COMPLETE
389,389,0.6071147013828636,2022-12-01 01:53:39.252128,2022-12-01 01:53:47.197693,0 days 00:00:07.945565,,18.0,log2,460,COMPLETE
390,390,0.7403503808371807,2022-12-01 01:53:47.417009,2022-12-01 01:53:54.394517,0 days 00:00:06.977508,"{0: 1, 1: 10}",12.0,0.7,60,COMPLETE
391,391,0.6087633996755322,2022-12-01 01:53:54.611227,2022-12-01 01:54:05.540145,0 days 00:00:10.928918,balanced,9.0,,460,COMPLETE
392,392,0.6436562289996468,2022-12-01 01:54:05.752503,2022-12-01 01:54:16.242227,0 days 00:00:10.489724,balanced,16.0,,410,COMPLETE
393,393,0.6985326695961637,2022-12-01 01:54:16.453482,2022-12-01 01:54:24.283601,0 days 00:00:07.830119,"{0: 1, 1: 10}",5.0,sqrt,410,COMPLETE
394,394,0.6091512307131921,2022-12-01 01:54:24.492978,2022-12-01 01:54:31.386054,0 days 00:00:06.893076,balanced,22.0,0.8,10,COMPLETE
395,395,0.6404638619837129,2022-12-01 01:54:31.597242,2022-12-01 01:54:44.184485,0 days 00:00:12.587243,balanced,4.0,0.6,860,COMPLETE
396,396,0.635184514293415,2022-12-01 01:54:44.396213,2022-12-01 01:54:59.697583,0 days 00:00:15.301370,"{0: 1, 1: 100}",,,860,COMPLETE
397,397,0.7202503304089961,2022-12-01 01:54:59.926848,2022-12-01 01:55:09.175379,0 days 00:00:09.248531,"{0: 1, 1: 100}",32.0,sqrt,860,COMPLETE
398,398,0.6487039815696274,2022-12-01 01:55:09.386153,2022-12-01 01:55:22.755305,0 days 00:00:13.369152,"{0: 1, 1: 100}",2.0,,810,COMPLETE
399,399,0.5997174563815719,2022-12-01 01:55:22.979988,2022-12-01 01:55:37.218605,0 days 00:00:14.238617,"{0: 1, 1: 100}",3.0,0.9,910,COMPLETE
400,400,0.5982865504840102,2022-12-01 01:55:37.432278,2022-12-01 01:55:44.355595,0 days 00:00:06.923317,,5.0,sqrt,10,COMPLETE
401,401,0.7644673924258026,2022-12-01 01:55:44.570369,2022-12-01 01:56:01.751555,0 days 00:00:17.181186,"{0: 1, 1: 10}",31.0,0.9,810,COMPLETE
402,402,0.6328484510925015,2022-12-01 01:56:01.960130,2022-12-01 01:56:16.229744,0 days 00:00:14.269614,"{0: 1, 1: 100}",24.0,1.0,760,COMPLETE
403,403,0.6360403434175443,2022-12-01 01:56:16.440608,2022-12-01 01:56:32.741784,0 days 00:00:16.301176,balanced,37.0,,910,COMPLETE
404,404,0.6442356351349974,2022-12-01 01:56:32.959992,2022-12-01 01:56:40.191464,0 days 00:00:07.231472,"{0: 1, 1: 100}",29.0,0.8,110,COMPLETE
405,405,0.6943970227678823,2022-12-01 01:56:40.399568,2022-12-01 01:56:47.526003,0 days 00:00:07.126435,balanced,16.0,sqrt,160,COMPLETE
406,406,0.7339078946577918,2022-12-01 01:56:47.740501,2022-12-01 01:57:10.083426,0 days 00:00:22.342925,,20.0,0.9,660,COMPLETE
407,407,0.7639415684377807,2022-12-01 01:57:10.305666,2022-12-01 01:57:27.720730,0 days 00:00:17.415064,"{0: 1, 1: 10}",29.0,0.9,810,COMPLETE
408,408,0.6599789022311748,2022-12-01 01:57:27.941778,2022-12-01 01:57:36.579276,0 days 00:00:08.637498,"{0: 1, 1: 100}",30.0,log2,660,COMPLETE
409,409,0.6382385806350003,2022-12-01 01:57:36.795527,2022-12-01 01:57:44.390871,0 days 00:00:07.595344,balanced,16.0,,160,COMPLETE
410,410,0.6617902343627987,2022-12-01 01:57:44.601407,2022-12-01 01:57:53.264505,0 days 00:00:08.663098,"{0: 1, 1: 100}",34.0,log2,660,COMPLETE
411,411,0.7524721228275134,2022-12-01 01:57:53.485203,2022-12-01 01:58:01.697346,0 days 00:00:08.212143,"{0: 1, 1: 10}",4.0,0.7,210,COMPLETE
412,412,0.6988887246534318,2022-12-01 01:58:01.906397,2022-12-01 01:58:09.100717,0 days 00:00:07.194320,"{0: 1, 1: 100}",17.0,sqrt,310,COMPLETE
413,413,0.7228488709609979,2022-12-01 01:58:09.311396,2022-12-01 01:58:16.887216,0 days 00:00:07.575820,"{0: 1, 1: 100}",,sqrt,410,COMPLETE
414,414,0.6081008209271329,2022-12-01 01:58:17.096490,2022-12-01 01:58:30.351141,0 days 00:00:13.254651,balanced,9.0,0.8,760,COMPLETE
415,415,0.6332282750569888,2022-12-01 01:58:30.566067,2022-12-01 01:58:44.162837,0 days 00:00:13.596770,"{0: 1, 1: 100}",14.0,,710,COMPLETE
416,416,0.6221483831862349,2022-12-01 01:58:44.377369,2022-12-01 01:58:52.395669,0 days 00:00:08.018300,balanced,25.0,log2,510,COMPLETE
417,417,0.6212564410594922,2022-12-01 01:58:52.605538,2022-12-01 01:59:01.619962,0 days 00:00:09.014424,balanced,6.0,log2,560,COMPLETE
418,418,0.5905492931308364,2022-12-01 01:59:01.828205,2022-12-01 01:59:11.106978,0 days 00:00:09.278773,"{0: 1, 1: 10}",25.0,log2,860,COMPLETE
419,419,0.7452478242868004,2022-12-01 01:59:11.319665,2022-12-01 01:59:19.489331,0 days 00:00:08.169666,"{0: 1, 1: 10}",3.0,0.8,210,COMPLETE
420,420,0.6058004355857415,2022-12-01 01:59:19.697456,2022-12-01 01:59:26.598731,0 days 00:00:06.901275,"{0: 1, 1: 100}",30.0,,10,COMPLETE
421,421,0.6928349695652648,2022-12-01 01:59:26.812147,2022-12-01 01:59:33.718241,0 days 00:00:06.906094,"{0: 1, 1: 10}",25.0,1.0,10,COMPLETE
422,422,0.7641186132385465,2022-12-01 01:59:33.929218,2022-12-01 01:59:49.107853,0 days 00:00:15.178635,"{0: 1, 1: 10}",33.0,0.9,660,COMPLETE
423,423,0.6207735438645892,2022-12-01 01:59:49.320006,2022-12-01 01:59:57.721289,0 days 00:00:08.401283,"{0: 1, 1: 100}",15.0,log2,460,COMPLETE
424,424,0.631740485321117,2022-12-01 01:59:57.936823,2022-12-01 02:00:05.028130,0 days 00:00:07.091307,,18.0,sqrt,160,COMPLETE
425,425,0.7346544840402023,2022-12-01 02:00:05.245190,2022-12-01 02:00:25.007190,0 days 00:00:19.762000,,26.0,0.9,560,COMPLETE
426,426,0.6319756180846303,2022-12-01 02:00:25.221193,2022-12-01 02:00:36.698630,0 days 00:00:11.477437,"{0: 1, 1: 100}",30.0,,510,COMPLETE
427,427,0.7121127973978895,2022-12-01 02:00:36.913969,2022-12-01 02:00:44.245896,0 days 00:00:07.331927,balanced,24.0,sqrt,360,COMPLETE
428,428,0.6600255516895943,2022-12-01 02:00:44.458852,2022-12-01 02:00:56.280157,0 days 00:00:11.821305,"{0: 1, 1: 100}",23.0,0.7,660,COMPLETE
429,429,0.7623067638813671,2022-12-01 02:00:56.500687,2022-12-01 02:01:08.131743,0 days 00:00:11.631056,"{0: 1, 1: 10}",18.0,0.9,410,COMPLETE
430,430,0.6419952990443707,2022-12-01 02:01:08.350221,2022-12-01 02:01:21.493900,0 days 00:00:13.143679,"{0: 1, 1: 100}",36.0,1.0,660,COMPLETE
431,431,0.7374145469971635,2022-12-01 02:01:21.709470,2022-12-01 02:01:30.323863,0 days 00:00:08.614393,,36.0,0.6,160,COMPLETE
432,432,0.7557128767763351,2022-12-01 02:01:30.537647,2022-12-01 02:01:43.570414,0 days 00:00:13.032767,"{0: 1, 1: 10}",8.0,0.7,610,COMPLETE
433,433,0.7498167794711574,2022-12-01 02:01:43.792390,2022-12-01 02:01:54.395446,0 days 00:00:10.603056,"{0: 1, 1: 10}",32.0,0.7,410,COMPLETE
434,434,0.602649680363622,2022-12-01 02:01:54.615362,2022-12-01 02:02:04.571848,0 days 00:00:09.956486,"{0: 1, 1: 100}",6.0,0.9,410,COMPLETE
435,435,0.6076372736452993,2022-12-01 02:02:04.784452,2022-12-01 02:02:13.321876,0 days 00:00:08.537424,"{0: 1, 1: 10}",20.0,log2,660,COMPLETE
436,436,0.7367270796834512,2022-12-01 02:02:13.530331,2022-12-01 02:02:30.001651,0 days 00:00:16.471320,,17.0,0.7,510,COMPLETE
437,437,0.6345468935631344,2022-12-01 02:02:30.223178,2022-12-01 02:02:43.108266,0 days 00:00:12.885088,balanced,21.0,,610,COMPLETE
438,438,0.7641408212511568,2022-12-01 02:02:43.319615,2022-12-01 02:02:53.671514,0 days 00:00:10.351899,"{0: 1, 1: 10}",26.0,1.0,310,COMPLETE
439,439,0.7339269405814337,2022-12-01 02:02:53.881372,2022-12-01 02:03:08.181412,0 days 00:00:14.300040,,27.0,,310,COMPLETE
440,440,0.5905335992542036,2022-12-01 02:03:08.396045,2022-12-01 02:03:22.482052,0 days 00:00:14.086007,balanced,5.0,0.8,860,COMPLETE
441,441,0.5844058271143411,2022-12-01 02:03:22.695200,2022-12-01 02:03:30.115921,0 days 00:00:07.420721,"{0: 1, 1: 10}",29.0,log2,360,COMPLETE
442,442,0.7680631514723171,2022-12-01 02:03:30.326731,2022-12-01 02:03:50.817951,0 days 00:00:20.491220,"{0: 1, 1: 10}",30.0,,960,COMPLETE
443,443,0.6560867312853872,2022-12-01 02:03:51.033916,2022-12-01 02:04:01.206807,0 days 00:00:10.172891,balanced,35.0,0.7,460,COMPLETE
444,444,0.6382803922741911,2022-12-01 02:04:01.420382,2022-12-01 02:04:14.583923,0 days 00:00:13.163541,"{0: 1, 1: 100}",27.0,1.0,660,COMPLETE
445,445,0.7113904683627482,2022-12-01 02:04:14.796376,2022-12-01 02:04:24.168606,0 days 00:00:09.372230,balanced,25.0,sqrt,860,COMPLETE
446,446,0.7379580929941245,2022-12-01 02:04:24.378087,2022-12-01 02:04:33.154585,0 days 00:00:08.776498,,33.0,1.0,110,COMPLETE
447,447,0.7330664299491243,2022-12-01 02:04:33.363877,2022-12-01 02:04:46.220542,0 days 00:00:12.856665,,24.0,,260,COMPLETE
448,448,0.7628742331533316,2022-12-01 02:04:46.431222,2022-12-01 02:05:00.076245,0 days 00:00:13.645023,"{0: 1, 1: 10}",14.0,,510,COMPLETE
449,449,0.7424211479692789,2022-12-01 02:05:00.289359,2022-12-01 02:05:12.650230,0 days 00:00:12.360871,"{0: 1, 1: 10}",10.0,0.6,610,COMPLETE
450,450,0.7455863967990236,2022-12-01 02:05:12.863386,2022-12-01 02:05:25.315065,0 days 00:00:12.451679,"{0: 1, 1: 10}",11.0,0.6,610,COMPLETE
451,451,0.7053155814868861,2022-12-01 02:05:25.526112,2022-12-01 02:05:33.626316,0 days 00:00:08.100204,balanced,17.0,sqrt,560,COMPLETE
452,452,0.7365948536661466,2022-12-01 02:05:33.842902,2022-12-01 02:05:50.777490,0 days 00:00:16.934588,,16.0,,410,COMPLETE
453,453,0.7339990736640896,2022-12-01 02:05:50.996951,2022-12-01 02:06:16.630362,0 days 00:00:25.633411,,37.0,0.8,860,COMPLETE
454,454,0.7340876379284302,2022-12-01 02:06:16.849618,2022-12-01 02:06:25.994845,0 days 00:00:09.145227,,36.0,0.7,160,COMPLETE
455,455,0.749564637368847,2022-12-01 02:06:26.198032,2022-12-01 02:06:36.926563,0 days 00:00:10.728531,"{0: 1, 1: 10}",9.0,0.6,460,COMPLETE
456,456,0.6729357339571607,2022-12-01 02:06:37.147395,2022-12-01 02:06:44.484502,0 days 00:00:07.337107,"{0: 1, 1: 10}",35.0,sqrt,310,COMPLETE
457,457,0.5985383339956732,2022-12-01 02:06:44.694657,2022-12-01 02:06:51.681624,0 days 00:00:06.986967,"{0: 1, 1: 10}",26.0,log2,60,COMPLETE
458,458,0.734789695109914,2022-12-01 02:06:51.891125,2022-12-01 02:07:10.284816,0 days 00:00:18.393691,,26.0,0.7,610,COMPLETE
459,459,0.7604818082875705,2022-12-01 02:07:10.495077,2022-12-01 02:07:20.121563,0 days 00:00:09.626486,"{0: 1, 1: 10}",27.0,,260,COMPLETE
460,460,0.6539444959354201,2022-12-01 02:07:20.334782,2022-12-01 02:07:31.090270,0 days 00:00:10.755488,balanced,19.0,0.7,510,COMPLETE
461,461,0.6291197673411907,2022-12-01 02:07:31.307984,2022-12-01 02:07:38.202949,0 days 00:00:06.894965,,27.0,sqrt,110,COMPLETE
462,462,0.7650007253172043,2022-12-01 02:07:38.417820,2022-12-01 02:07:52.159808,0 days 00:00:13.741988,"{0: 1, 1: 10}",11.0,0.9,560,COMPLETE
463,463,0.624801982701716,2022-12-01 02:07:52.383822,2022-12-01 02:07:59.517572,0 days 00:00:07.133750,balanced,31.0,log2,110,COMPLETE
464,464,0.658968377616088,2022-12-01 02:07:59.729666,2022-12-01 02:08:07.418717,0 days 00:00:07.689051,balanced,17.0,0.6,210,COMPLETE
465,465,0.5807054290617368,2022-12-01 02:08:07.639362,2022-12-01 02:08:16.639317,0 days 00:00:08.999955,"{0: 1, 1: 100}",5.0,1.0,310,COMPLETE
466,466,0.7260743884880678,2022-12-01 02:08:16.849938,2022-12-01 02:08:23.977518,0 days 00:00:07.127580,"{0: 1, 1: 10}",8.0,0.6,60,COMPLETE
467,467,0.7352789086200227,2022-12-01 02:08:24.189088,2022-12-01 02:08:38.477381,0 days 00:00:14.288293,,23.0,,310,COMPLETE
468,468,0.6380080469123653,2022-12-01 02:08:38.686575,2022-12-01 02:08:49.957347,0 days 00:00:11.270772,balanced,28.0,0.9,510,COMPLETE
469,469,0.6973593352132761,2022-12-01 02:08:50.168524,2022-12-01 02:08:57.107472,0 days 00:00:06.938948,,,0.7,10,COMPLETE
470,470,0.6042989869306817,2022-12-01 02:08:57.319603,2022-12-01 02:09:10.332032,0 days 00:00:13.012429,"{0: 1, 1: 10}",1.0,,960,COMPLETE
471,471,0.7207887932108045,2022-12-01 02:09:10.555100,2022-12-01 02:09:20.157421,0 days 00:00:09.602321,,2.0,1.0,310,COMPLETE
472,472,0.6315339243524137,2022-12-01 02:09:20.366890,2022-12-01 02:09:30.825413,0 days 00:00:10.458523,balanced,30.0,1.0,410,COMPLETE
473,473,0.6600203750696932,2022-12-01 02:09:31.042136,2022-12-01 02:09:44.898371,0 days 00:00:13.856235,"{0: 1, 1: 100}",14.0,0.6,960,COMPLETE
474,474,0.6207434240397035,2022-12-01 02:09:45.114256,2022-12-01 02:09:53.377657,0 days 00:00:08.263401,balanced,10.0,log2,410,COMPLETE
475,475,0.754863518526512,2022-12-01 02:09:53.593351,2022-12-01 02:10:00.825872,0 days 00:00:07.232521,"{0: 1, 1: 10}",22.0,0.8,60,COMPLETE
476,476,0.6167088055324624,2022-12-01 02:10:01.045851,2022-12-01 02:10:08.976704,0 days 00:00:07.930853,balanced,6.0,0.6,210,COMPLETE
477,477,0.6371738962665023,2022-12-01 02:10:09.189356,2022-12-01 02:10:16.682091,0 days 00:00:07.492735,,12.0,sqrt,410,COMPLETE
478,478,0.7525576052938651,2022-12-01 02:10:16.895119,2022-12-01 02:10:25.142643,0 days 00:00:08.247524,"{0: 1, 1: 10}",19.0,,160,COMPLETE
479,479,0.6727297365003003,2022-12-01 02:10:25.354525,2022-12-01 02:10:33.744966,0 days 00:00:08.390441,"{0: 1, 1: 10}",19.0,sqrt,610,COMPLETE
