,number,value,datetime_start,datetime_complete,duration,params_class_weight,params_max_depth,params_max_features,params_n_estimators,state
640,640,0.76470267538821,2022-12-01 02:41:29.281894,2022-12-01 02:41:47.154065,0 days 00:00:17.872171,"{0: 1, 1: 10}",37.0,0.9,860,COMPLETE
641,641,0.7472053321114569,2022-12-01 02:41:47.368734,2022-12-01 02:41:58.766716,0 days 00:00:11.397982,"{0: 1, 1: 10}",24.0,0.6,510,COMPLETE
642,642,0.6488014047166814,2022-12-01 02:41:58.985734,2022-12-01 02:42:09.471971,0 days 00:00:10.486237,"{0: 1, 1: 100}",11.0,0.9,460,COMPLETE
643,643,0.7333306682718762,2022-12-01 02:42:09.689425,2022-12-01 02:42:16.919717,0 days 00:00:07.230292,,29.0,0.7,60,COMPLETE
644,644,0.6371847532220097,2022-12-01 02:42:17.136209,2022-12-01 02:42:24.328163,0 days 00:00:07.191954,,11.0,sqrt,110,COMPLETE
645,645,0.659295119788329,2022-12-01 02:42:24.545122,2022-12-01 02:42:39.142856,0 days 00:00:14.597734,"{0: 1, 1: 100}",16.0,0.7,960,COMPLETE
646,646,0.7302297969107882,2022-12-01 02:42:39.360904,2022-12-01 02:42:50.736244,0 days 00:00:11.375340,,29.0,0.6,310,COMPLETE
647,647,0.6381458136156115,2022-12-01 02:42:50.946967,2022-12-01 02:43:06.171912,0 days 00:00:15.224945,balanced,20.0,,810,COMPLETE
648,648,0.6590891068904949,2022-12-01 02:43:06.386317,2022-12-01 02:43:17.816275,0 days 00:00:11.429958,"{0: 1, 1: 100}",13.0,0.6,660,COMPLETE
649,649,0.6404551947209538,2022-12-01 02:43:18.034959,2022-12-01 02:43:25.641596,0 days 00:00:07.606637,"{0: 1, 1: 100}",25.0,log2,310,COMPLETE
650,650,0.6769977998373267,2022-12-01 02:43:25.862870,2022-12-01 02:43:32.928440,0 days 00:00:07.065570,"{0: 1, 1: 10}",9.0,sqrt,110,COMPLETE
651,651,0.6450180607555058,2022-12-01 02:43:33.151188,2022-12-01 02:43:41.315419,0 days 00:00:08.164231,"{0: 1, 1: 100}",37.0,log2,510,COMPLETE
652,652,0.7672813743457412,2022-12-01 02:43:41.550210,2022-12-01 02:44:01.990154,0 days 00:00:20.439944,"{0: 1, 1: 10}",11.0,,960,COMPLETE
653,653,0.6514238248384097,2022-12-01 02:44:02.205451,2022-12-01 02:44:09.348483,0 days 00:00:07.143032,"{0: 1, 1: 100}",29.0,0.7,110,COMPLETE
654,654,0.7303704412348138,2022-12-01 02:44:09.564361,2022-12-01 02:44:17.211296,0 days 00:00:07.646935,"{0: 1, 1: 10}",31.0,0.6,160,COMPLETE
655,655,0.7616558551803103,2022-12-01 02:44:17.425327,2022-12-01 02:44:26.953772,0 days 00:00:09.528445,"{0: 1, 1: 10}",10.0,0.9,260,COMPLETE
656,656,0.7408830896830347,2022-12-01 02:44:27.175665,2022-12-01 02:44:35.005636,0 days 00:00:07.829971,"{0: 1, 1: 10}",19.0,0.7,160,COMPLETE
657,657,0.735968191632337,2022-12-01 02:44:35.225882,2022-12-01 02:44:50.405722,0 days 00:00:15.179840,,20.0,0.8,410,COMPLETE
658,658,0.6188233896136796,2022-12-01 02:44:50.622704,2022-12-01 02:44:59.572754,0 days 00:00:08.950050,"{0: 1, 1: 10}",16.0,log2,660,COMPLETE
659,659,0.6522181766886621,2022-12-01 02:44:59.787453,2022-12-01 02:45:07.034584,0 days 00:00:07.247131,balanced,13.0,0.8,110,COMPLETE
660,660,0.6377271770887399,2022-12-01 02:45:07.250201,2022-12-01 02:45:20.616081,0 days 00:00:13.365880,balanced,12.0,,660,COMPLETE
661,661,0.6397013419965778,2022-12-01 02:45:20.829553,2022-12-01 02:45:28.027663,0 days 00:00:07.198110,"{0: 1, 1: 100}",25.0,log2,160,COMPLETE
662,662,0.755408584608802,2022-12-01 02:45:28.237401,2022-12-01 02:45:40.532908,0 days 00:00:12.295507,"{0: 1, 1: 10}",36.0,0.9,460,COMPLETE
663,663,0.6414047204293365,2022-12-01 02:45:40.748988,2022-12-01 02:45:50.704116,0 days 00:00:09.955128,balanced,30.0,1.0,360,COMPLETE
664,664,0.6075203500239351,2022-12-01 02:45:50.922163,2022-12-01 02:45:58.273606,0 days 00:00:07.351443,,28.0,log2,210,COMPLETE
665,665,0.5964023264140187,2022-12-01 02:45:58.488942,2022-12-01 02:46:12.270206,0 days 00:00:13.781264,balanced,8.0,,710,COMPLETE
666,666,0.7667786265887397,2022-12-01 02:46:12.486662,2022-12-01 02:46:22.202500,0 days 00:00:09.715838,"{0: 1, 1: 10}",8.0,,260,COMPLETE
667,667,0.5833084770107329,2022-12-01 02:46:22.418295,2022-12-01 02:46:29.513834,0 days 00:00:07.095539,"{0: 1, 1: 10}",28.0,log2,210,COMPLETE
668,668,0.6315000893514908,2022-12-01 02:46:29.727120,2022-12-01 02:46:40.628457,0 days 00:00:10.901337,"{0: 1, 1: 100}",36.0,,460,COMPLETE
669,669,0.6594928831343719,2022-12-01 02:46:40.846127,2022-12-01 02:46:48.024935,0 days 00:00:07.178808,"{0: 1, 1: 100}",29.0,0.6,160,COMPLETE
670,670,0.7358718966077172,2022-12-01 02:46:48.240197,2022-12-01 02:46:55.488366,0 days 00:00:07.248169,,34.0,0.8,60,COMPLETE
671,671,0.6454450470764794,2022-12-01 02:46:55.718120,2022-12-01 02:47:03.226206,0 days 00:00:07.508086,balanced,36.0,0.9,160,COMPLETE
672,672,0.7674866688054507,2022-12-01 02:47:03.439350,2022-12-01 02:47:20.858430,0 days 00:00:17.419080,"{0: 1, 1: 10}",20.0,1.0,760,COMPLETE
673,673,0.6559976082724537,2022-12-01 02:47:21.075681,2022-12-01 02:47:35.667501,0 days 00:00:14.591820,balanced,34.0,0.7,910,COMPLETE
674,674,0.5802311227983228,2022-12-01 02:47:35.878378,2022-12-01 02:47:43.185608,0 days 00:00:07.307230,,1.0,sqrt,110,COMPLETE
675,675,0.7173236319042785,2022-12-01 02:47:43.401288,2022-12-01 02:47:50.771190,0 days 00:00:07.369902,"{0: 1, 1: 100}",34.0,sqrt,360,COMPLETE
676,676,0.6565491608596703,2022-12-01 02:47:50.998197,2022-12-01 02:47:58.127615,0 days 00:00:07.129418,"{0: 1, 1: 100}",25.0,0.7,110,COMPLETE
677,677,0.7536278763539059,2022-12-01 02:47:58.344000,2022-12-01 02:48:05.688168,0 days 00:00:07.344168,"{0: 1, 1: 10}",29.0,,110,COMPLETE
678,678,0.6518789467738969,2022-12-01 02:48:05.898664,2022-12-01 02:48:18.951942,0 days 00:00:13.053278,balanced,38.0,0.7,760,COMPLETE
679,679,0.7064439976212064,2022-12-01 02:48:19.168722,2022-12-01 02:48:28.615967,0 days 00:00:09.447245,"{0: 1, 1: 100}",17.0,sqrt,910,COMPLETE
680,680,0.6747786266005125,2022-12-01 02:48:28.834786,2022-12-01 02:48:37.475385,0 days 00:00:08.640599,"{0: 1, 1: 10}",15.0,sqrt,660,COMPLETE
681,681,0.6050354264945506,2022-12-01 02:48:37.693731,2022-12-01 02:48:44.737349,0 days 00:00:07.043618,"{0: 1, 1: 100}",7.0,0.8,60,COMPLETE
682,682,0.6176588502578597,2022-12-01 02:48:44.953756,2022-12-01 02:48:51.994202,0 days 00:00:07.040446,balanced,1.0,,60,COMPLETE
683,683,0.6458438380550282,2022-12-01 02:48:52.214943,2022-12-01 02:49:00.313619,0 days 00:00:08.098676,"{0: 1, 1: 100}",39.0,0.9,110,COMPLETE
684,684,0.7629563281643867,2022-12-01 02:49:00.562007,2022-12-01 02:49:14.149398,0 days 00:00:13.587391,"{0: 1, 1: 10}",15.0,,510,COMPLETE
685,685,0.6135525215186429,2022-12-01 02:49:14.367810,2022-12-01 02:49:23.480424,0 days 00:00:09.112614,,23.0,log2,810,COMPLETE
686,686,0.6042890401182953,2022-12-01 02:49:23.701907,2022-12-01 02:49:31.262783,0 days 00:00:07.560876,balanced,1.0,,210,COMPLETE
687,687,0.7468605749928071,2022-12-01 02:49:31.478428,2022-12-01 02:49:38.759434,0 days 00:00:07.281006,"{0: 1, 1: 10}",3.0,1.0,110,COMPLETE
688,688,0.6794829713543787,2022-12-01 02:49:38.985200,2022-12-01 02:49:45.969061,0 days 00:00:06.983861,balanced,3.0,0.7,10,COMPLETE
689,689,0.6585050583077703,2022-12-01 02:49:46.187767,2022-12-01 02:49:53.465477,0 days 00:00:07.277710,"{0: 1, 1: 10}",36.0,sqrt,310,COMPLETE
690,690,0.7334981911460072,2022-12-01 02:49:53.678880,2022-12-01 02:50:04.358758,0 days 00:00:10.679878,,39.0,0.8,210,COMPLETE
691,691,0.6538098075596792,2022-12-01 02:50:04.579760,2022-12-01 02:50:16.223401,0 days 00:00:11.643641,balanced,16.0,0.7,610,COMPLETE
692,692,0.6828059364842135,2022-12-01 02:50:16.440735,2022-12-01 02:50:25.084048,0 days 00:00:08.643313,"{0: 1, 1: 100}",13.0,sqrt,660,COMPLETE
693,693,0.6431144360260513,2022-12-01 02:50:25.301013,2022-12-01 02:50:34.163050,0 days 00:00:08.862037,balanced,26.0,1.0,260,COMPLETE
694,694,0.633666717288735,2022-12-01 02:50:34.377709,2022-12-01 02:50:43.483926,0 days 00:00:09.106217,"{0: 1, 1: 100}",2.0,1.0,360,COMPLETE
695,695,0.6350049148393534,2022-12-01 02:50:43.702854,2022-12-01 02:50:56.835984,0 days 00:00:13.133130,"{0: 1, 1: 100}",10.0,0.7,810,COMPLETE
696,696,0.7342480471653463,2022-12-01 02:50:57.052177,2022-12-01 02:51:19.814650,0 days 00:00:22.762473,,15.0,1.0,610,COMPLETE
697,697,0.7349101507517852,2022-12-01 02:51:20.030944,2022-12-01 02:51:35.274187,0 days 00:00:15.243243,,35.0,0.8,410,COMPLETE
698,698,0.7524875963253439,2022-12-01 02:51:35.493348,2022-12-01 02:51:47.373228,0 days 00:00:11.879880,"{0: 1, 1: 10}",6.0,,410,COMPLETE
699,699,0.7576448336852156,2022-12-01 02:51:47.586817,2022-12-01 02:51:57.069442,0 days 00:00:09.482625,"{0: 1, 1: 10}",21.0,0.7,310,COMPLETE
700,700,0.6213260746895284,2022-12-01 02:51:57.288464,2022-12-01 02:52:04.820607,0 days 00:00:07.532143,"{0: 1, 1: 100}",21.0,1.0,160,COMPLETE
701,701,0.7351481260862249,2022-12-01 02:52:05.038052,2022-12-01 02:52:28.291143,0 days 00:00:23.253091,,38.0,0.8,760,COMPLETE
702,702,0.7509332851309736,2022-12-01 02:52:28.502545,2022-12-01 02:52:35.872201,0 days 00:00:07.369656,"{0: 1, 1: 10}",25.0,0.9,110,COMPLETE
703,703,0.6454565147220827,2022-12-01 02:52:36.093176,2022-12-01 02:52:47.667799,0 days 00:00:11.574623,balanced,34.0,0.8,560,COMPLETE
704,704,0.6896013879154428,2022-12-01 02:52:47.886305,2022-12-01 02:52:55.861326,0 days 00:00:07.975021,balanced,12.0,sqrt,510,COMPLETE
705,705,0.6059238017906788,2022-12-01 02:52:56.074193,2022-12-01 02:53:11.046582,0 days 00:00:14.972389,"{0: 1, 1: 100}",6.0,1.0,860,COMPLETE
706,706,0.5972284166172142,2022-12-01 02:53:11.265067,2022-12-01 02:53:24.675661,0 days 00:00:13.410594,balanced,8.0,0.8,760,COMPLETE
707,707,0.663704046705136,2022-12-01 02:53:24.897793,2022-12-01 02:53:32.361029,0 days 00:00:07.463236,"{0: 1, 1: 10}",30.0,sqrt,60,COMPLETE
708,708,0.6398089323382734,2022-12-01 02:53:32.578840,2022-12-01 02:53:41.192105,0 days 00:00:08.613265,,23.0,sqrt,610,COMPLETE
709,709,0.7363609435894125,2022-12-01 02:53:41.413473,2022-12-01 02:54:00.796288,0 days 00:00:19.382815,,29.0,0.7,660,COMPLETE
710,710,0.7644802465823942,2022-12-01 02:54:01.013373,2022-12-01 02:54:16.242113,0 days 00:00:15.228740,"{0: 1, 1: 10}",26.0,,610,COMPLETE
711,711,0.6122161442920746,2022-12-01 02:54:16.458999,2022-12-01 02:54:27.634106,0 days 00:00:11.175107,"{0: 1, 1: 100}",9.0,0.6,660,COMPLETE
712,712,0.6265173871961233,2022-12-01 02:54:27.858198,2022-12-01 02:54:35.313584,0 days 00:00:07.455386,balanced,5.0,log2,260,COMPLETE
713,713,0.6385931209116322,2022-12-01 02:54:35.524854,2022-12-01 02:54:43.441572,0 days 00:00:07.916718,,30.0,sqrt,460,COMPLETE
714,714,0.7555359640030921,2022-12-01 02:54:43.661191,2022-12-01 02:54:54.154179,0 days 00:00:10.492988,"{0: 1, 1: 10}",12.0,0.8,360,COMPLETE
715,715,0.7150691377066691,2022-12-01 02:54:54.371873,2022-12-01 02:55:08.939869,0 days 00:00:14.567996,,2.0,0.9,760,COMPLETE
716,716,0.6621050134273585,2022-12-01 02:55:09.161529,2022-12-01 02:55:20.136543,0 days 00:00:10.975014,"{0: 1, 1: 100}",31.0,0.7,560,COMPLETE
717,717,0.6013567200048261,2022-12-01 02:55:20.356902,2022-12-01 02:55:32.378877,0 days 00:00:12.021975,"{0: 1, 1: 100}",6.0,0.8,660,COMPLETE
718,718,0.5836073205101167,2022-12-01 02:55:32.600820,2022-12-01 02:55:40.048347,0 days 00:00:07.447527,"{0: 1, 1: 10}",30.0,log2,360,COMPLETE
719,719,0.6108512379826231,2022-12-01 02:55:40.265798,2022-12-01 02:55:53.105157,0 days 00:00:12.839359,"{0: 1, 1: 100}",8.0,0.6,860,COMPLETE
720,720,0.7426367531211383,2022-12-01 02:55:53.321221,2022-12-01 02:56:07.809131,0 days 00:00:14.487910,"{0: 1, 1: 10}",6.0,0.6,810,COMPLETE
721,721,0.6131861812244416,2022-12-01 02:56:08.024146,2022-12-01 02:56:17.174545,0 days 00:00:09.150399,"{0: 1, 1: 100}",10.0,log2,610,COMPLETE
722,722,0.6179636264622791,2022-12-01 02:56:17.389506,2022-12-01 02:56:24.368626,0 days 00:00:06.979120,"{0: 1, 1: 100}",34.0,0.9,10,COMPLETE
723,723,0.7366164558890087,2022-12-01 02:56:24.584642,2022-12-01 02:56:47.206642,0 days 00:00:22.622000,,35.0,0.7,810,COMPLETE
724,724,0.6556929275796687,2022-12-01 02:56:47.424959,2022-12-01 02:56:56.397972,0 days 00:00:08.973013,"{0: 1, 1: 100}",39.0,0.7,360,COMPLETE
725,725,0.614044231078309,2022-12-01 02:56:56.615265,2022-12-01 02:57:06.010028,0 days 00:00:09.394763,"{0: 1, 1: 10}",17.0,log2,860,COMPLETE
726,726,0.7670612911237603,2022-12-01 02:57:06.228019,2022-12-01 02:57:25.890575,0 days 00:00:19.662556,"{0: 1, 1: 10}",14.0,,910,COMPLETE
727,727,0.7596489176807604,2022-12-01 02:57:26.111257,2022-12-01 02:57:38.510051,0 days 00:00:12.398794,"{0: 1, 1: 10}",11.0,0.8,510,COMPLETE
728,728,0.6376257026498605,2022-12-01 02:57:38.733345,2022-12-01 02:57:46.841598,0 days 00:00:08.108253,,24.0,sqrt,510,COMPLETE
729,729,0.7348076893614198,2022-12-01 02:57:47.066143,2022-12-01 02:58:09.662470,0 days 00:00:22.596327,,31.0,0.7,810,COMPLETE
730,730,0.7084802781429972,2022-12-01 02:58:09.880544,2022-12-01 02:58:18.690934,0 days 00:00:08.810390,balanced,38.0,sqrt,660,COMPLETE
731,731,0.6136041902724779,2022-12-01 02:58:18.912922,2022-12-01 02:58:27.831500,0 days 00:00:08.918578,,24.0,log2,760,COMPLETE
732,732,0.6358211327940696,2022-12-01 02:58:28.053417,2022-12-01 02:58:37.913070,0 days 00:00:09.859653,,23.0,sqrt,960,COMPLETE
733,733,0.5815205277758404,2022-12-01 02:58:38.130187,2022-12-01 02:58:48.428922,0 days 00:00:10.298735,balanced,6.0,1.0,410,COMPLETE
734,734,0.7345122330276971,2022-12-01 02:58:48.644697,2022-12-01 02:59:10.258573,0 days 00:00:21.613876,,22.0,0.6,860,COMPLETE
735,735,0.7274517414424572,2022-12-01 02:59:10.476593,2022-12-01 02:59:21.439661,0 days 00:00:10.963068,,2.0,1.0,410,COMPLETE
736,736,0.5826150628672887,2022-12-01 02:59:21.659299,2022-12-01 02:59:37.454722,0 days 00:00:15.795423,balanced,5.0,0.9,960,COMPLETE
737,737,0.7486420277931498,2022-12-01 02:59:37.683603,2022-12-01 02:59:50.601720,0 days 00:00:12.918117,"{0: 1, 1: 10}",10.0,0.6,660,COMPLETE
738,738,0.6561446221492997,2022-12-01 02:59:50.817710,2022-12-01 02:59:59.472931,0 days 00:00:08.655221,"{0: 1, 1: 100}",28.0,log2,610,COMPLETE
739,739,0.7552261189955795,2022-12-01 02:59:59.692835,2022-12-01 03:00:10.946884,0 days 00:00:11.254049,"{0: 1, 1: 10}",16.0,,360,COMPLETE
740,740,0.6448453231245119,2022-12-01 03:00:11.163733,2022-12-01 03:00:18.379910,0 days 00:00:07.216177,"{0: 1, 1: 10}",6.0,log2,110,COMPLETE
741,741,0.7626529459245934,2022-12-01 03:00:18.599770,2022-12-01 03:00:28.788199,0 days 00:00:10.188429,"{0: 1, 1: 10}",35.0,0.8,310,COMPLETE
742,742,0.733395301643813,2022-12-01 03:00:29.007419,2022-12-01 03:00:37.663672,0 days 00:00:08.656253,,21.0,,110,COMPLETE
743,743,0.6053603016285722,2022-12-01 03:00:37.884255,2022-12-01 03:00:47.634667,0 days 00:00:09.750412,"{0: 1, 1: 10}",1.0,1.0,510,COMPLETE
744,744,0.6813616351307334,2022-12-01 03:00:47.848665,2022-12-01 03:00:56.590333,0 days 00:00:08.741668,balanced,10.0,sqrt,760,COMPLETE
745,745,0.7345702721790162,2022-12-01 03:00:56.805198,2022-12-01 03:01:16.650967,0 days 00:00:19.845769,,19.0,,510,COMPLETE
746,746,0.6444303308555421,2022-12-01 03:01:16.867222,2022-12-01 03:01:23.892514,0 days 00:00:07.025292,"{0: 1, 1: 100}",23.0,0.8,110,COMPLETE
747,747,0.6375625966350796,2022-12-01 03:01:24.113311,2022-12-01 03:01:39.026930,0 days 00:00:14.913619,"{0: 1, 1: 100}",25.0,1.0,810,COMPLETE
748,748,0.6383634775668791,2022-12-01 03:01:39.246498,2022-12-01 03:01:54.557814,0 days 00:00:15.311316,"{0: 1, 1: 100}",23.0,1.0,860,COMPLETE
749,749,0.7699015982342768,2022-12-01 03:01:54.780692,2022-12-01 03:02:09.911770,0 days 00:00:15.131078,"{0: 1, 1: 10}",34.0,,610,COMPLETE
750,750,0.6396686320288373,2022-12-01 03:02:10.132332,2022-12-01 03:02:17.641923,0 days 00:00:07.509591,,21.0,sqrt,360,COMPLETE
751,751,0.754134873874951,2022-12-01 03:02:17.862226,2022-12-01 03:02:24.809577,0 days 00:00:06.947351,"{0: 1, 1: 10}",16.0,0.9,60,COMPLETE
752,752,0.6419318411767472,2022-12-01 03:02:25.039545,2022-12-01 03:02:34.503968,0 days 00:00:09.464423,balanced,24.0,1.0,310,COMPLETE
753,753,0.6315894664981536,2022-12-01 03:02:34.725606,2022-12-01 03:02:45.573209,0 days 00:00:10.847603,"{0: 1, 1: 100}",10.0,,460,COMPLETE
754,754,0.6110215124415771,2022-12-01 03:02:45.791256,2022-12-01 03:02:52.839312,0 days 00:00:07.048056,,20.0,log2,160,COMPLETE
755,755,0.6475304254362347,2022-12-01 03:02:53.058992,2022-12-01 03:03:00.334940,0 days 00:00:07.275948,"{0: 1, 1: 100}",34.0,log2,210,COMPLETE
756,756,0.6679473303409702,2022-12-01 03:03:00.547287,2022-12-01 03:03:10.838590,0 days 00:00:10.291303,balanced,37.0,0.6,510,COMPLETE
757,757,0.7309140659784873,2022-12-01 03:03:11.058247,2022-12-01 03:03:18.397862,0 days 00:00:07.339615,"{0: 1, 1: 10}",32.0,0.7,110,COMPLETE
758,758,0.7514505996348475,2022-12-01 03:03:18.618924,2022-12-01 03:03:28.076488,0 days 00:00:09.457564,"{0: 1, 1: 10}",18.0,0.7,260,COMPLETE
759,759,0.7491774569015652,2022-12-01 03:03:28.285565,2022-12-01 03:03:45.808237,0 days 00:00:17.522672,"{0: 1, 1: 10}",17.0,0.7,960,COMPLETE
760,760,0.7212933614296094,2022-12-01 03:03:46.028438,2022-12-01 03:03:53.956294,0 days 00:00:07.927856,,3.0,0.7,160,COMPLETE
761,761,0.6657581576087603,2022-12-01 03:03:54.176852,2022-12-01 03:04:05.770842,0 days 00:00:11.593990,balanced,34.0,0.6,660,COMPLETE
762,762,0.7514609203690332,2022-12-01 03:04:05.990210,2022-12-01 03:04:23.401041,0 days 00:00:17.410831,"{0: 1, 1: 10}",6.0,0.8,910,COMPLETE
763,763,0.6547053354974395,2022-12-01 03:04:23.614783,2022-12-01 03:04:36.383774,0 days 00:00:12.768991,"{0: 1, 1: 100}",29.0,0.8,710,COMPLETE
764,764,0.6680041994202234,2022-12-01 03:04:36.601687,2022-12-01 03:04:46.561786,0 days 00:00:09.960099,balanced,35.0,0.6,460,COMPLETE
765,765,0.6373397463803117,2022-12-01 03:04:46.783911,2022-12-01 03:04:56.605717,0 days 00:00:09.821806,balanced,26.0,,360,COMPLETE
766,766,0.6130515885655171,2022-12-01 03:04:56.821923,2022-12-01 03:05:05.302336,0 days 00:00:08.480413,"{0: 1, 1: 100}",3.0,,260,COMPLETE
767,767,0.5838781565948222,2022-12-01 03:05:05.521149,2022-12-01 03:05:14.537431,0 days 00:00:09.016282,balanced,4.0,0.9,310,COMPLETE
768,768,0.6571743846144088,2022-12-01 03:05:14.755005,2022-12-01 03:05:27.537417,0 days 00:00:12.782412,"{0: 1, 1: 100}",12.0,0.7,760,COMPLETE
769,769,0.6677804813456751,2022-12-01 03:05:27.760227,2022-12-01 03:05:42.009100,0 days 00:00:14.248873,balanced,29.0,0.6,960,COMPLETE
770,770,0.742721842081187,2022-12-01 03:05:42.231356,2022-12-01 03:05:54.243741,0 days 00:00:12.012385,"{0: 1, 1: 10}",4.0,0.6,610,COMPLETE
771,771,0.5949486734498399,2022-12-01 03:05:54.470395,2022-12-01 03:06:01.898063,0 days 00:00:07.427668,balanced,1.0,log2,210,COMPLETE
772,772,0.6426752470291162,2022-12-01 03:06:02.121728,2022-12-01 03:06:16.681239,0 days 00:00:14.559511,balanced,20.0,0.8,860,COMPLETE
773,773,0.7186102803101663,2022-12-01 03:06:16.896410,2022-12-01 03:06:23.873525,0 days 00:00:06.977115,,30.0,0.7,10,COMPLETE
774,774,0.7302837849922807,2022-12-01 03:06:24.092642,2022-12-01 03:06:31.947450,0 days 00:00:07.854808,,33.0,0.6,110,COMPLETE
775,775,0.710782301605833,2022-12-01 03:06:32.166654,2022-12-01 03:06:39.100317,0 days 00:00:06.933663,"{0: 1, 1: 10}",16.0,0.7,10,COMPLETE
776,776,0.7347713496575665,2022-12-01 03:06:39.312779,2022-12-01 03:06:56.431479,0 days 00:00:17.118700,,28.0,1.0,410,COMPLETE
777,777,0.6315891543599543,2022-12-01 03:06:56.653287,2022-12-01 03:07:05.421198,0 days 00:00:08.767911,balanced,24.0,log2,660,COMPLETE
778,778,0.6128808794435755,2022-12-01 03:07:05.641612,2022-12-01 03:07:12.868648,0 days 00:00:07.227036,balanced,9.0,0.9,110,COMPLETE
779,779,0.6424956455728679,2022-12-01 03:07:13.083088,2022-12-01 03:07:27.819607,0 days 00:00:14.736519,balanced,37.0,0.9,810,COMPLETE
780,780,0.6417508440449005,2022-12-01 03:07:28.048984,2022-12-01 03:07:43.936436,0 days 00:00:15.887452,"{0: 1, 1: 100}",30.0,,910,COMPLETE
781,781,0.6294247727718912,2022-12-01 03:07:44.154083,2022-12-01 03:07:51.093248,0 days 00:00:06.939165,"{0: 1, 1: 100}",24.0,,10,COMPLETE
782,782,0.6547575709668301,2022-12-01 03:07:51.313780,2022-12-01 03:08:04.773589,0 days 00:00:13.459809,"{0: 1, 1: 100}",30.0,0.8,760,COMPLETE
783,783,0.7650458034182486,2022-12-01 03:08:04.994942,2022-12-01 03:08:20.060189,0 days 00:00:15.065247,"{0: 1, 1: 10}",34.0,0.8,710,COMPLETE
784,784,0.6018799881114755,2022-12-01 03:08:20.272434,2022-12-01 03:08:28.018613,0 days 00:00:07.746179,balanced,37.0,log2,410,COMPLETE
785,785,0.6773461120261477,2022-12-01 03:08:28.235350,2022-12-01 03:08:37.094755,0 days 00:00:08.859405,balanced,9.0,sqrt,710,COMPLETE
786,786,0.5950501836924267,2022-12-01 03:08:37.316334,2022-12-01 03:08:44.665423,0 days 00:00:07.349089,"{0: 1, 1: 100}",5.0,0.8,160,COMPLETE
787,787,0.6482326779276282,2022-12-01 03:08:44.887893,2022-12-01 03:08:55.003815,0 days 00:00:10.115922,balanced,30.0,0.8,410,COMPLETE
788,788,0.7678738475439119,2022-12-01 03:08:55.225049,2022-12-01 03:09:14.141968,0 days 00:00:18.916919,"{0: 1, 1: 10}",20.0,1.0,860,COMPLETE
789,789,0.7708299546060818,2022-12-01 03:09:14.370237,2022-12-01 03:09:30.113079,0 days 00:00:15.742842,"{0: 1, 1: 10}",9.0,0.9,710,COMPLETE
790,790,0.7647835715997228,2022-12-01 03:09:30.328797,2022-12-01 03:09:39.283868,0 days 00:00:08.955071,"{0: 1, 1: 10}",26.0,1.0,210,COMPLETE
791,791,0.7339335520694023,2022-12-01 03:09:39.497782,2022-12-01 03:09:59.986808,0 days 00:00:20.489026,,27.0,0.7,710,COMPLETE
792,792,0.6291664457236222,2022-12-01 03:10:00.208113,2022-12-01 03:10:07.343723,0 days 00:00:07.135610,,35.0,sqrt,160,COMPLETE
793,793,0.7351165719955104,2022-12-01 03:10:07.560785,2022-12-01 03:10:27.055181,0 days 00:00:19.494396,,27.0,0.7,660,COMPLETE
794,794,0.6606453124421939,2022-12-01 03:10:27.276519,2022-12-01 03:10:37.531752,0 days 00:00:10.255233,balanced,19.0,0.7,460,COMPLETE
795,795,0.6421701117613089,2022-12-01 03:10:37.751131,2022-12-01 03:10:44.965262,0 days 00:00:07.214131,balanced,18.0,0.9,110,COMPLETE
796,796,0.5685212067644916,2022-12-01 03:10:45.183523,2022-12-01 03:10:52.409156,0 days 00:00:07.225633,balanced,5.0,,110,COMPLETE
797,797,0.7345740601185232,2022-12-01 03:10:52.624795,2022-12-01 03:11:11.055643,0 days 00:00:18.430848,,33.0,0.7,610,COMPLETE
798,798,0.6431193813745898,2022-12-01 03:11:11.275773,2022-12-01 03:11:20.670110,0 days 00:00:09.394337,balanced,13.0,,310,COMPLETE
799,799,0.7340275774749994,2022-12-01 03:11:20.890339,2022-12-01 03:11:33.030413,0 days 00:00:12.140074,,37.0,0.7,310,COMPLETE
