,number,value,datetime_start,datetime_complete,duration,params_class_weight,params_max_depth,params_max_features,params_n_estimators,state
1115,1115,0.7675170966889643,2022-12-01 04:30:28.656110,2022-12-01 04:30:49.360647,0 days 00:00:20.704537,"{0: 1, 1: 10}",22.0,1.0,960,COMPLETE
1116,1116,0.7649416845277907,2022-12-01 04:30:49.589157,2022-12-01 04:31:10.262846,0 days 00:00:20.673689,"{0: 1, 1: 10}",22.0,1.0,960,COMPLETE
1117,1117,0.7650041242485506,2022-12-01 04:31:10.485733,2022-12-01 04:31:31.011732,0 days 00:00:20.525999,"{0: 1, 1: 10}",22.0,1.0,960,COMPLETE
1118,1118,0.7645036618263197,2022-12-01 04:31:31.237011,2022-12-01 04:31:52.079855,0 days 00:00:20.842844,"{0: 1, 1: 10}",22.0,1.0,960,COMPLETE
1119,1119,0.7681602329268911,2022-12-01 04:31:52.306959,2022-12-01 04:32:12.243325,0 days 00:00:19.936366,"{0: 1, 1: 10}",22.0,1.0,910,COMPLETE
1120,1120,0.7646223033800039,2022-12-01 04:32:12.467381,2022-12-01 04:32:33.097122,0 days 00:00:20.629741,"{0: 1, 1: 10}",22.0,1.0,960,COMPLETE
1121,1121,0.7726015288542277,2022-12-01 04:32:33.320757,2022-12-01 04:32:53.940179,0 days 00:00:20.619422,"{0: 1, 1: 10}",22.0,1.0,960,COMPLETE
1122,1122,0.7682297719135861,2022-12-01 04:32:54.167604,2022-12-01 04:33:14.737906,0 days 00:00:20.570302,"{0: 1, 1: 10}",22.0,1.0,960,COMPLETE
1123,1123,0.7637086145696884,2022-12-01 04:33:14.968289,2022-12-01 04:33:35.638344,0 days 00:00:20.670055,"{0: 1, 1: 10}",22.0,1.0,960,COMPLETE
1124,1124,0.7718377273892891,2022-12-01 04:33:35.858691,2022-12-01 04:33:56.571628,0 days 00:00:20.712937,"{0: 1, 1: 10}",22.0,1.0,960,COMPLETE
1125,1125,0.7690901193253682,2022-12-01 04:33:56.796463,2022-12-01 04:34:17.581143,0 days 00:00:20.784680,"{0: 1, 1: 10}",15.0,1.0,960,COMPLETE
1126,1126,0.7670896293675391,2022-12-01 04:34:17.810765,2022-12-01 04:34:38.461334,0 days 00:00:20.650569,"{0: 1, 1: 10}",22.0,1.0,960,COMPLETE
1127,1127,0.7605461237889732,2022-12-01 04:34:38.686641,2022-12-01 04:34:59.461799,0 days 00:00:20.775158,"{0: 1, 1: 10}",22.0,1.0,960,COMPLETE
1128,1128,0.766885800879161,2022-12-01 04:34:59.689482,2022-12-01 04:35:20.272953,0 days 00:00:20.583471,"{0: 1, 1: 10}",22.0,1.0,960,COMPLETE
1129,1129,0.7670141720621493,2022-12-01 04:35:20.499593,2022-12-01 04:35:41.075957,0 days 00:00:20.576364,"{0: 1, 1: 10}",22.0,1.0,960,COMPLETE
1130,1130,0.7628133738206861,2022-12-01 04:35:41.300067,2022-12-01 04:36:01.947083,0 days 00:00:20.647016,"{0: 1, 1: 10}",22.0,1.0,960,COMPLETE
1131,1131,0.768910165511633,2022-12-01 04:36:02.172153,2022-12-01 04:36:22.877220,0 days 00:00:20.705067,"{0: 1, 1: 10}",22.0,1.0,960,COMPLETE
1132,1132,0.7647246223329137,2022-12-01 04:36:23.102781,2022-12-01 04:36:42.914279,0 days 00:00:19.811498,"{0: 1, 1: 10}",15.0,1.0,910,COMPLETE
1133,1133,0.7696445503040307,2022-12-01 04:36:43.139747,2022-12-01 04:37:03.848829,0 days 00:00:20.709082,"{0: 1, 1: 10}",22.0,1.0,960,COMPLETE
1134,1134,0.7666550056313707,2022-12-01 04:37:04.076552,2022-12-01 04:37:23.972067,0 days 00:00:19.895515,"{0: 1, 1: 10}",22.0,1.0,910,COMPLETE
1135,1135,0.7713737398242138,2022-12-01 04:37:24.194429,2022-12-01 04:37:44.813699,0 days 00:00:20.619270,"{0: 1, 1: 10}",22.0,1.0,960,COMPLETE
1136,1136,0.7656309210733819,2022-12-01 04:37:45.040814,2022-12-01 04:38:05.982648,0 days 00:00:20.941834,"{0: 1, 1: 10}",22.0,1.0,960,COMPLETE
1137,1137,0.767418843556962,2022-12-01 04:38:06.207959,2022-12-01 04:38:26.924158,0 days 00:00:20.716199,"{0: 1, 1: 10}",22.0,1.0,960,COMPLETE
1138,1138,0.7687520707222901,2022-12-01 04:38:27.150703,2022-12-01 04:38:47.843888,0 days 00:00:20.693185,"{0: 1, 1: 10}",22.0,1.0,960,COMPLETE
1139,1139,0.7694307059873517,2022-12-01 04:38:48.073558,2022-12-01 04:39:08.638149,0 days 00:00:20.564591,"{0: 1, 1: 10}",11.0,1.0,960,COMPLETE
1140,1140,0.7654623633670995,2022-12-01 04:39:08.865650,2022-12-01 04:39:29.388381,0 days 00:00:20.522731,"{0: 1, 1: 10}",22.0,1.0,960,COMPLETE
1141,1141,0.7669098225757693,2022-12-01 04:39:29.608087,2022-12-01 04:39:50.362574,0 days 00:00:20.754487,"{0: 1, 1: 10}",15.0,1.0,960,COMPLETE
1142,1142,0.7659222047787277,2022-12-01 04:39:50.583034,2022-12-01 04:40:11.259971,0 days 00:00:20.676937,"{0: 1, 1: 10}",22.0,1.0,960,COMPLETE
1143,1143,0.7674634223744771,2022-12-01 04:40:11.490803,2022-12-01 04:40:32.069908,0 days 00:00:20.579105,"{0: 1, 1: 10}",22.0,1.0,960,COMPLETE
1144,1144,0.7660992435731759,2022-12-01 04:40:32.296667,2022-12-01 04:40:52.825017,0 days 00:00:20.528350,"{0: 1, 1: 10}",22.0,1.0,960,COMPLETE
1145,1145,0.765800444873239,2022-12-01 04:40:53.068484,2022-12-01 04:41:12.844560,0 days 00:00:19.776076,"{0: 1, 1: 10}",22.0,1.0,910,COMPLETE
1146,1146,0.7640798360619315,2022-12-01 04:41:13.081539,2022-12-01 04:41:33.865277,0 days 00:00:20.783738,"{0: 1, 1: 10}",22.0,1.0,960,COMPLETE
1147,1147,0.7660522651389159,2022-12-01 04:41:34.097241,2022-12-01 04:41:53.987718,0 days 00:00:19.890477,"{0: 1, 1: 10}",22.0,1.0,910,COMPLETE
1148,1148,0.7674096865989561,2022-12-01 04:41:54.218860,2022-12-01 04:42:14.899212,0 days 00:00:20.680352,"{0: 1, 1: 10}",22.0,1.0,960,COMPLETE
1149,1149,0.7701529842788297,2022-12-01 04:42:15.125519,2022-12-01 04:42:34.845675,0 days 00:00:19.720156,"{0: 1, 1: 10}",11.0,1.0,910,COMPLETE
1150,1150,0.7662447562225306,2022-12-01 04:42:35.074560,2022-12-01 04:42:55.826675,0 days 00:00:20.752115,"{0: 1, 1: 10}",22.0,1.0,960,COMPLETE
1151,1151,0.7684551440415227,2022-12-01 04:42:56.054249,2022-12-01 04:43:16.742140,0 days 00:00:20.687891,"{0: 1, 1: 10}",15.0,1.0,960,COMPLETE
1152,1152,0.7655230588358551,2022-12-01 04:43:16.970850,2022-12-01 04:43:37.558678,0 days 00:00:20.587828,"{0: 1, 1: 10}",22.0,1.0,960,COMPLETE
1153,1153,0.7647649861927979,2022-12-01 04:43:37.788164,2022-12-01 04:43:57.573398,0 days 00:00:19.785234,"{0: 1, 1: 10}",22.0,1.0,910,COMPLETE
1154,1154,0.7685913336533413,2022-12-01 04:43:57.797201,2022-12-01 04:44:18.511028,0 days 00:00:20.713827,"{0: 1, 1: 10}",22.0,1.0,960,COMPLETE
1155,1155,0.7651072278992543,2022-12-01 04:44:18.737583,2022-12-01 04:44:38.594947,0 days 00:00:19.857364,"{0: 1, 1: 10}",22.0,1.0,910,COMPLETE
1156,1156,0.767009020589409,2022-12-01 04:44:38.825881,2022-12-01 04:44:59.365757,0 days 00:00:20.539876,"{0: 1, 1: 10}",22.0,1.0,960,COMPLETE
1157,1157,0.7703648910172737,2022-12-01 04:44:59.588530,2022-12-01 04:45:20.345314,0 days 00:00:20.756784,"{0: 1, 1: 10}",15.0,1.0,960,COMPLETE
1158,1158,0.7708026589581605,2022-12-01 04:45:20.567504,2022-12-01 04:45:40.520405,0 days 00:00:19.952901,"{0: 1, 1: 10}",22.0,1.0,910,COMPLETE
1159,1159,0.7685032573932485,2022-12-01 04:45:40.750176,2022-12-01 04:46:00.543011,0 days 00:00:19.792835,"{0: 1, 1: 10}",22.0,1.0,910,COMPLETE
1160,1160,0.7674459335399243,2022-12-01 04:46:00.771087,2022-12-01 04:46:20.463859,0 days 00:00:19.692772,"{0: 1, 1: 10}",11.0,1.0,910,COMPLETE
1161,1161,0.7673937868418507,2022-12-01 04:46:20.681010,2022-12-01 04:46:40.777908,0 days 00:00:20.096898,"{0: 1, 1: 10}",22.0,1.0,910,COMPLETE
1162,1162,0.7683241570069907,2022-12-01 04:46:41.007042,2022-12-01 04:47:00.952261,0 days 00:00:19.945219,"{0: 1, 1: 10}",22.0,1.0,910,COMPLETE
1163,1163,0.7671441963596057,2022-12-01 04:47:01.176450,2022-12-01 04:47:21.027433,0 days 00:00:19.850983,"{0: 1, 1: 10}",22.0,1.0,910,COMPLETE
1164,1164,0.7684312457092237,2022-12-01 04:47:21.256580,2022-12-01 04:47:41.982722,0 days 00:00:20.726142,"{0: 1, 1: 10}",22.0,1.0,960,COMPLETE
1165,1165,0.7657792796503496,2022-12-01 04:47:42.190583,2022-12-01 04:48:02.008789,0 days 00:00:19.818206,"{0: 1, 1: 10}",28.0,1.0,910,COMPLETE
1166,1166,0.767759310275818,2022-12-01 04:48:02.238601,2022-12-01 04:48:22.850651,0 days 00:00:20.612050,"{0: 1, 1: 10}",22.0,1.0,960,COMPLETE
1167,1167,0.7676274668518162,2022-12-01 04:48:23.081254,2022-12-01 04:48:43.102630,0 days 00:00:20.021376,"{0: 1, 1: 10}",15.0,1.0,910,COMPLETE
1168,1168,0.7704292260598593,2022-12-01 04:48:43.329976,2022-12-01 04:49:04.016030,0 days 00:00:20.686054,"{0: 1, 1: 10}",22.0,1.0,960,COMPLETE
1169,1169,0.7694146044130314,2022-12-01 04:49:04.239861,2022-12-01 04:49:24.827855,0 days 00:00:20.587994,"{0: 1, 1: 10}",22.0,1.0,960,COMPLETE
1170,1170,0.7646458843130749,2022-12-01 04:49:25.058432,2022-12-01 04:49:45.490078,0 days 00:00:20.431646,"{0: 1, 1: 10}",22.0,1.0,960,COMPLETE
1171,1171,0.7694737634645268,2022-12-01 04:49:45.718535,2022-12-01 04:50:06.191921,0 days 00:00:20.473386,"{0: 1, 1: 10}",22.0,1.0,960,COMPLETE
1172,1172,0.7662728879080869,2022-12-01 04:50:06.420813,2022-12-01 04:50:27.194000,0 days 00:00:20.773187,"{0: 1, 1: 10}",22.0,1.0,960,COMPLETE
1173,1173,0.7655216936794611,2022-12-01 04:50:27.429276,2022-12-01 04:50:48.083496,0 days 00:00:20.654220,"{0: 1, 1: 10}",22.0,1.0,960,COMPLETE
1174,1174,0.7650957342187912,2022-12-01 04:50:48.312514,2022-12-01 04:51:09.044912,0 days 00:00:20.732398,"{0: 1, 1: 10}",22.0,1.0,960,COMPLETE
1175,1175,0.7678458123167479,2022-12-01 04:51:09.281147,2022-12-01 04:51:30.169661,0 days 00:00:20.888514,"{0: 1, 1: 10}",22.0,1.0,960,COMPLETE
1176,1176,0.7649675380836657,2022-12-01 04:51:30.393829,2022-12-01 04:51:51.059789,0 days 00:00:20.665960,"{0: 1, 1: 10}",22.0,1.0,960,COMPLETE
1177,1177,0.7676336677330676,2022-12-01 04:51:51.287937,2022-12-01 04:52:11.179990,0 days 00:00:19.892053,"{0: 1, 1: 10}",22.0,1.0,910,COMPLETE
1178,1178,0.7715896627678098,2022-12-01 04:52:11.405525,2022-12-01 04:52:31.975230,0 days 00:00:20.569705,"{0: 1, 1: 10}",24.0,1.0,960,COMPLETE
1179,1179,0.7668052148674883,2022-12-01 04:52:32.217923,2022-12-01 04:52:52.094216,0 days 00:00:19.876293,"{0: 1, 1: 10}",24.0,1.0,910,COMPLETE
1180,1180,0.7660654463593856,2022-12-01 04:52:52.318409,2022-12-01 04:53:12.869735,0 days 00:00:20.551326,"{0: 1, 1: 10}",24.0,1.0,960,COMPLETE
1181,1181,0.762446496069035,2022-12-01 04:53:13.098255,2022-12-01 04:53:33.659642,0 days 00:00:20.561387,"{0: 1, 1: 10}",24.0,1.0,960,COMPLETE
1182,1182,0.7695329059726382,2022-12-01 04:53:33.888057,2022-12-01 04:53:53.648205,0 days 00:00:19.760148,"{0: 1, 1: 10}",24.0,1.0,910,COMPLETE
1183,1183,0.7696093549190482,2022-12-01 04:53:53.871823,2022-12-01 04:54:14.538971,0 days 00:00:20.667148,"{0: 1, 1: 10}",24.0,1.0,960,COMPLETE
1184,1184,0.7667063904477951,2022-12-01 04:54:14.762960,2022-12-01 04:54:34.701614,0 days 00:00:19.938654,"{0: 1, 1: 10}",24.0,1.0,910,COMPLETE
1185,1185,0.7676509265570568,2022-12-01 04:54:34.924835,2022-12-01 04:54:55.443305,0 days 00:00:20.518470,"{0: 1, 1: 10}",24.0,1.0,960,COMPLETE
1186,1186,0.769234523616133,2022-12-01 04:54:55.670184,2022-12-01 04:55:16.443642,0 days 00:00:20.773458,"{0: 1, 1: 10}",24.0,1.0,960,COMPLETE
1187,1187,0.7712711887986585,2022-12-01 04:55:16.672163,2022-12-01 04:55:36.386455,0 days 00:00:19.714292,"{0: 1, 1: 10}",11.0,1.0,910,COMPLETE
1188,1188,0.7644240966507085,2022-12-01 04:55:36.613900,2022-12-01 04:55:56.255429,0 days 00:00:19.641529,"{0: 1, 1: 10}",9.0,1.0,910,COMPLETE
1189,1189,0.7727906279456577,2022-12-01 04:55:56.465315,2022-12-01 04:56:16.257493,0 days 00:00:19.792178,"{0: 1, 1: 10}",11.0,1.0,910,COMPLETE
1190,1190,0.7680716561521994,2022-12-01 04:56:16.481068,2022-12-01 04:56:36.277217,0 days 00:00:19.796149,"{0: 1, 1: 10}",11.0,1.0,910,COMPLETE
1191,1191,0.7695977657884496,2022-12-01 04:56:36.512192,2022-12-01 04:56:56.400424,0 days 00:00:19.888232,"{0: 1, 1: 10}",11.0,1.0,910,COMPLETE
1192,1192,0.7689773629686208,2022-12-01 04:56:56.629558,2022-12-01 04:57:16.431589,0 days 00:00:19.802031,"{0: 1, 1: 10}",11.0,1.0,910,COMPLETE
1193,1193,0.7668742322498376,2022-12-01 04:57:16.663306,2022-12-01 04:57:36.533330,0 days 00:00:19.870024,"{0: 1, 1: 10}",11.0,1.0,910,COMPLETE
1194,1194,0.7691177221211103,2022-12-01 04:57:36.759838,2022-12-01 04:57:56.572764,0 days 00:00:19.812926,"{0: 1, 1: 10}",11.0,1.0,910,COMPLETE
1195,1195,0.7697002530963997,2022-12-01 04:57:56.801071,2022-12-01 04:58:16.530305,0 days 00:00:19.729234,"{0: 1, 1: 10}",11.0,1.0,910,COMPLETE
1196,1196,0.757184808189467,2022-12-01 04:58:16.757458,2022-12-01 04:58:35.953699,0 days 00:00:19.196241,"{0: 1, 1: 10}",4.0,1.0,910,COMPLETE
1197,1197,0.7674965902456522,2022-12-01 04:58:36.189210,2022-12-01 04:58:55.282670,0 days 00:00:19.093460,"{0: 1, 1: 10}",24.0,1.0,860,COMPLETE
1198,1198,0.7687355884800255,2022-12-01 04:58:55.507448,2022-12-01 04:59:15.284191,0 days 00:00:19.776743,"{0: 1, 1: 10}",11.0,1.0,910,COMPLETE
1199,1199,0.769319996124137,2022-12-01 04:59:15.514093,2022-12-01 04:59:35.347700,0 days 00:00:19.833607,"{0: 1, 1: 10}",11.0,1.0,910,COMPLETE
1200,1200,0.7685093672483524,2022-12-01 04:59:35.574018,2022-12-01 04:59:56.070053,0 days 00:00:20.496035,"{0: 1, 1: 10}",12.0,1.0,960,COMPLETE
1201,1201,0.7667436680862189,2022-12-01 04:59:56.300461,2022-12-01 05:00:16.170889,0 days 00:00:19.870428,"{0: 1, 1: 10}",11.0,1.0,910,COMPLETE
1202,1202,0.7690080737808069,2022-12-01 05:00:16.390060,2022-12-01 05:00:35.996240,0 days 00:00:19.606180,"{0: 1, 1: 10}",11.0,1.0,910,COMPLETE
1203,1203,0.7711174397781512,2022-12-01 05:00:36.224430,2022-12-01 05:00:56.837687,0 days 00:00:20.613257,"{0: 1, 1: 10}",11.0,1.0,960,COMPLETE
1204,1204,0.7720645650406097,2022-12-01 05:00:57.065843,2022-12-01 05:01:17.604654,0 days 00:00:20.538811,"{0: 1, 1: 10}",11.0,1.0,960,COMPLETE
1205,1205,0.7700189907557748,2022-12-01 05:01:17.842975,2022-12-01 05:01:38.395215,0 days 00:00:20.552240,"{0: 1, 1: 10}",11.0,1.0,960,COMPLETE
1206,1206,0.7689160149441082,2022-12-01 05:01:38.625231,2022-12-01 05:01:58.993660,0 days 00:00:20.368429,"{0: 1, 1: 10}",9.0,1.0,960,COMPLETE
1207,1207,0.7698712323508908,2022-12-01 05:01:59.225207,2022-12-01 05:02:19.711664,0 days 00:00:20.486457,"{0: 1, 1: 10}",11.0,1.0,960,COMPLETE
1208,1208,0.7719915955838463,2022-12-01 05:02:19.938609,2022-12-01 05:02:40.659032,0 days 00:00:20.720423,"{0: 1, 1: 10}",11.0,1.0,960,COMPLETE
1209,1209,0.7695655322397646,2022-12-01 05:02:40.881861,2022-12-01 05:03:01.377361,0 days 00:00:20.495500,"{0: 1, 1: 10}",11.0,1.0,960,COMPLETE
1210,1210,0.7692523832740019,2022-12-01 05:03:01.603957,2022-12-01 05:03:22.399070,0 days 00:00:20.795113,"{0: 1, 1: 10}",11.0,1.0,960,COMPLETE
1211,1211,0.7733520332413197,2022-12-01 05:03:22.621967,2022-12-01 05:03:43.231657,0 days 00:00:20.609690,"{0: 1, 1: 10}",11.0,1.0,960,COMPLETE
1212,1212,0.7705472905429337,2022-12-01 05:03:43.459509,2022-12-01 05:04:04.018540,0 days 00:00:20.559031,"{0: 1, 1: 10}",11.0,1.0,960,COMPLETE
1213,1213,0.7701066159689203,2022-12-01 05:04:04.240819,2022-12-01 05:04:24.937963,0 days 00:00:20.697144,"{0: 1, 1: 10}",11.0,1.0,960,COMPLETE
1214,1214,0.7663093991012324,2022-12-01 05:04:25.175587,2022-12-01 05:04:45.937550,0 days 00:00:20.761963,"{0: 1, 1: 10}",11.0,1.0,960,COMPLETE
1215,1215,0.7692111322602954,2022-12-01 05:04:46.159511,2022-12-01 05:05:06.801738,0 days 00:00:20.642227,"{0: 1, 1: 10}",11.0,1.0,960,COMPLETE
1216,1216,0.7669520011020302,2022-12-01 05:05:07.030030,2022-12-01 05:05:27.717886,0 days 00:00:20.687856,"{0: 1, 1: 10}",11.0,1.0,960,COMPLETE
1217,1217,0.7669806793795895,2022-12-01 05:05:27.954489,2022-12-01 05:05:48.501544,0 days 00:00:20.547055,"{0: 1, 1: 10}",11.0,1.0,960,COMPLETE
1218,1218,0.7698871658479762,2022-12-01 05:05:48.731491,2022-12-01 05:06:09.302853,0 days 00:00:20.571362,"{0: 1, 1: 10}",11.0,1.0,960,COMPLETE
1219,1219,0.7686285793363181,2022-12-01 05:06:09.523587,2022-12-01 05:06:30.198375,0 days 00:00:20.674788,"{0: 1, 1: 10}",11.0,1.0,960,COMPLETE
1220,1220,0.763393804774406,2022-12-01 05:06:30.426507,2022-12-01 05:06:51.094673,0 days 00:00:20.668166,"{0: 1, 1: 10}",11.0,1.0,960,COMPLETE
1221,1221,0.769354928459108,2022-12-01 05:06:51.323823,2022-12-01 05:07:11.174481,0 days 00:00:19.850658,"{0: 1, 1: 10}",11.0,1.0,910,COMPLETE
1222,1222,0.7622714731821094,2022-12-01 05:07:11.405451,2022-12-01 05:07:32.063684,0 days 00:00:20.658233,"{0: 1, 1: 10}",24.0,1.0,960,COMPLETE
1223,1223,0.7662261735315119,2022-12-01 05:07:32.292954,2022-12-01 05:07:52.130869,0 days 00:00:19.837915,"{0: 1, 1: 10}",11.0,1.0,910,COMPLETE
1224,1224,0.766089913923671,2022-12-01 05:07:52.352826,2022-12-01 05:08:12.955415,0 days 00:00:20.602589,"{0: 1, 1: 10}",11.0,1.0,960,COMPLETE
1225,1225,0.7636121040525109,2022-12-01 05:08:13.184904,2022-12-01 05:08:33.650139,0 days 00:00:20.465235,"{0: 1, 1: 10}",11.0,1.0,960,COMPLETE
1226,1226,0.7679651463245988,2022-12-01 05:08:33.877573,2022-12-01 05:08:53.451776,0 days 00:00:19.574203,"{0: 1, 1: 10}",11.0,1.0,910,COMPLETE
1227,1227,0.7639206050390217,2022-12-01 05:08:53.681319,2022-12-01 05:09:14.343055,0 days 00:00:20.661736,"{0: 1, 1: 10}",11.0,1.0,960,COMPLETE
1228,1228,0.7633297888136409,2022-12-01 05:09:14.573581,2022-12-01 05:09:35.304771,0 days 00:00:20.731190,"{0: 1, 1: 10}",11.0,1.0,960,COMPLETE
1229,1229,0.7738599404155457,2022-12-01 05:09:35.533064,2022-12-01 05:09:55.290207,0 days 00:00:19.757143,"{0: 1, 1: 10}",11.0,1.0,910,COMPLETE
1230,1230,0.7661388560371816,2022-12-01 05:09:55.519175,2022-12-01 05:10:15.435681,0 days 00:00:19.916506,"{0: 1, 1: 10}",12.0,1.0,910,COMPLETE
1231,1231,0.7682818567839432,2022-12-01 05:10:15.657746,2022-12-01 05:10:35.407891,0 days 00:00:19.750145,"{0: 1, 1: 10}",11.0,1.0,910,COMPLETE
1232,1232,0.7624246731077415,2022-12-01 05:10:35.642235,2022-12-01 05:10:55.372978,0 days 00:00:19.730743,"{0: 1, 1: 10}",11.0,1.0,910,COMPLETE
1233,1233,0.770698021711589,2022-12-01 05:10:55.604730,2022-12-01 05:11:14.811719,0 days 00:00:19.206989,"{0: 1, 1: 10}",11.0,1.0,860,COMPLETE
1234,1234,0.7698434701300315,2022-12-01 05:11:15.040107,2022-12-01 05:11:35.037296,0 days 00:00:19.997189,"{0: 1, 1: 10}",11.0,1.0,910,COMPLETE
1235,1235,0.7713389227991145,2022-12-01 05:11:35.268622,2022-12-01 05:11:54.995090,0 days 00:00:19.726468,"{0: 1, 1: 10}",11.0,1.0,910,COMPLETE
1236,1236,0.7665712154125386,2022-12-01 05:11:55.222202,2022-12-01 05:12:14.229105,0 days 00:00:19.006903,"{0: 1, 1: 10}",11.0,1.0,860,COMPLETE
1237,1237,0.7688678405050273,2022-12-01 05:12:14.460043,2022-12-01 05:12:34.238183,0 days 00:00:19.778140,"{0: 1, 1: 10}",11.0,1.0,910,COMPLETE
1238,1238,0.7659308413412815,2022-12-01 05:12:34.468667,2022-12-01 05:12:54.277412,0 days 00:00:19.808745,"{0: 1, 1: 10}",11.0,1.0,910,COMPLETE
1239,1239,0.769767883797719,2022-12-01 05:12:54.507892,2022-12-01 05:13:14.354867,0 days 00:00:19.846975,"{0: 1, 1: 10}",11.0,1.0,910,COMPLETE
1240,1240,0.771708569880323,2022-12-01 05:13:14.585062,2022-12-01 05:13:35.305449,0 days 00:00:20.720387,"{0: 1, 1: 10}",11.0,1.0,960,COMPLETE
1241,1241,0.7701595672240541,2022-12-01 05:13:35.536581,2022-12-01 05:13:56.219013,0 days 00:00:20.682432,"{0: 1, 1: 10}",11.0,1.0,960,COMPLETE
1242,1242,0.771666833245154,2022-12-01 05:13:56.440087,2022-12-01 05:14:16.058686,0 days 00:00:19.618599,"{0: 1, 1: 10}",11.0,1.0,910,COMPLETE
1243,1243,0.7689679619639673,2022-12-01 05:14:16.288101,2022-12-01 05:14:35.199387,0 days 00:00:18.911286,"{0: 1, 1: 10}",11.0,1.0,860,COMPLETE
1244,1244,0.763038637050389,2022-12-01 05:14:35.429430,2022-12-01 05:14:54.492961,0 days 00:00:19.063531,"{0: 1, 1: 10}",24.0,1.0,860,COMPLETE
1245,1245,0.7678587340485045,2022-12-01 05:14:54.714444,2022-12-01 05:15:14.709633,0 days 00:00:19.995189,"{0: 1, 1: 10}",11.0,1.0,910,COMPLETE
1246,1246,0.7681020596398407,2022-12-01 05:15:14.935789,2022-12-01 05:15:34.759563,0 days 00:00:19.823774,"{0: 1, 1: 10}",11.0,1.0,910,COMPLETE
1247,1247,0.7710580307767002,2022-12-01 05:15:34.986059,2022-12-01 05:15:54.678717,0 days 00:00:19.692658,"{0: 1, 1: 10}",11.0,1.0,910,COMPLETE
1248,1248,0.7696159267039706,2022-12-01 05:15:54.917431,2022-12-01 05:16:14.153897,0 days 00:00:19.236466,"{0: 1, 1: 10}",11.0,1.0,860,COMPLETE
1249,1249,0.7673202607720794,2022-12-01 05:16:14.383387,2022-12-01 05:16:34.203395,0 days 00:00:19.820008,"{0: 1, 1: 10}",11.0,1.0,910,COMPLETE
1250,1250,0.7644720615147034,2022-12-01 05:16:34.431056,2022-12-01 05:16:54.236815,0 days 00:00:19.805759,"{0: 1, 1: 10}",11.0,1.0,910,COMPLETE
1251,1251,0.7659544237208407,2022-12-01 05:16:54.473284,2022-12-01 05:17:14.155352,0 days 00:00:19.682068,"{0: 1, 1: 10}",11.0,1.0,910,COMPLETE
1252,1252,0.7648861412129854,2022-12-01 05:17:14.391041,2022-12-01 05:17:34.220714,0 days 00:00:19.829673,"{0: 1, 1: 10}",11.0,1.0,910,COMPLETE
1253,1253,0.770939473920909,2022-12-01 05:17:34.453137,2022-12-01 05:17:55.120394,0 days 00:00:20.667257,"{0: 1, 1: 10}",11.0,1.0,960,COMPLETE
1254,1254,0.7696459276390805,2022-12-01 05:17:55.359552,2022-12-01 05:18:15.164134,0 days 00:00:19.804582,"{0: 1, 1: 10}",11.0,1.0,910,COMPLETE
1255,1255,0.7647952321438256,2022-12-01 05:18:15.390773,2022-12-01 05:18:35.317616,0 days 00:00:19.926843,"{0: 1, 1: 10}",11.0,1.0,910,COMPLETE
1256,1256,0.7658825127164292,2022-12-01 05:18:35.541309,2022-12-01 05:18:54.510705,0 days 00:00:18.969396,"{0: 1, 1: 10}",11.0,1.0,860,COMPLETE
1257,1257,0.7694828763795452,2022-12-01 05:18:54.732671,2022-12-01 05:19:15.400321,0 days 00:00:20.667650,"{0: 1, 1: 10}",11.0,1.0,960,COMPLETE
1258,1258,0.7661166001001082,2022-12-01 05:19:15.623625,2022-12-01 05:19:35.447370,0 days 00:00:19.823745,"{0: 1, 1: 10}",11.0,1.0,910,COMPLETE
1259,1259,0.7696845769955034,2022-12-01 05:19:35.670540,2022-12-01 05:19:54.556532,0 days 00:00:18.885992,"{0: 1, 1: 10}",11.0,1.0,860,COMPLETE
1260,1260,0.7660246405924684,2022-12-01 05:19:54.787207,2022-12-01 05:20:15.486700,0 days 00:00:20.699493,"{0: 1, 1: 10}",11.0,1.0,960,COMPLETE
1261,1261,0.7757837028818526,2022-12-01 05:20:15.722320,2022-12-01 05:20:35.506942,0 days 00:00:19.784622,"{0: 1, 1: 10}",11.0,1.0,910,COMPLETE
1262,1262,0.7686879180858055,2022-12-01 05:20:35.728917,2022-12-01 05:20:54.922682,0 days 00:00:19.193765,"{0: 1, 1: 10}",11.0,1.0,860,COMPLETE
1263,1263,0.7681899566440854,2022-12-01 05:20:55.148083,2022-12-01 05:21:14.168623,0 days 00:00:19.020540,"{0: 1, 1: 10}",11.0,1.0,860,COMPLETE
1264,1264,0.7745572390651931,2022-12-01 05:21:14.398283,2022-12-01 05:21:34.197908,0 days 00:00:19.799625,"{0: 1, 1: 10}",11.0,1.0,910,COMPLETE
1265,1265,0.7660247440492711,2022-12-01 05:21:34.430829,2022-12-01 05:21:54.260745,0 days 00:00:19.829916,"{0: 1, 1: 10}",11.0,1.0,910,COMPLETE
