,number,value,datetime_start,datetime_complete,duration,params_class_weight,params_max_depth,params_max_features,params_n_estimators,state
1570,1570,0.7663000155295322,2022-12-01 07:00:47.289877,2022-12-01 07:01:07.928060,0 days 00:00:20.638183,"{0: 1, 1: 10}",36.0,1.0,960,COMPLETE
1571,1571,0.7663637876857001,2022-12-01 07:01:08.158406,2022-12-01 07:01:27.207283,0 days 00:00:19.048877,"{0: 1, 1: 10}",33.0,1.0,860,COMPLETE
1572,1572,0.7663183634522678,2022-12-01 07:01:27.438397,2022-12-01 07:01:47.383817,0 days 00:00:19.945420,"{0: 1, 1: 10}",34.0,1.0,910,COMPLETE
1573,1573,0.761029893428845,2022-12-01 07:01:47.624742,2022-12-01 07:02:05.980486,0 days 00:00:18.355744,"{0: 1, 1: 10}",11.0,1.0,810,COMPLETE
1574,1574,0.7663961040650239,2022-12-01 07:02:06.211857,2022-12-01 07:02:26.947996,0 days 00:00:20.736139,"{0: 1, 1: 10}",26.0,1.0,960,COMPLETE
1575,1575,0.763404687422635,2022-12-01 07:02:27.179722,2022-12-01 07:02:46.233710,0 days 00:00:19.053988,"{0: 1, 1: 10}",27.0,1.0,860,COMPLETE
1576,1576,0.7687894498561338,2022-12-01 07:02:46.463135,2022-12-01 07:03:06.471581,0 days 00:00:20.008446,"{0: 1, 1: 10}",11.0,1.0,910,COMPLETE
1577,1577,0.7658412188071734,2022-12-01 07:03:06.706352,2022-12-01 07:03:25.363709,0 days 00:00:18.657357,"{0: 1, 1: 10}",3.0,1.0,960,COMPLETE
1578,1578,0.7685484548336362,2022-12-01 07:03:25.599756,2022-12-01 07:03:45.661455,0 days 00:00:20.061699,"{0: 1, 1: 10}",24.0,1.0,910,COMPLETE
1579,1579,0.7664611255352161,2022-12-01 07:03:45.897062,2022-12-01 07:04:05.659883,0 days 00:00:19.762821,"{0: 1, 1: 10}",10.0,1.0,910,COMPLETE
1580,1580,0.7670346049861599,2022-12-01 07:04:05.909618,2022-12-01 07:04:24.906605,0 days 00:00:18.996987,"{0: 1, 1: 10}",11.0,1.0,860,COMPLETE
1581,1581,0.7676401664863742,2022-12-01 07:04:25.154289,2022-12-01 07:04:45.767493,0 days 00:00:20.613204,"{0: 1, 1: 10}",11.0,1.0,960,COMPLETE
1582,1582,0.7702530916285375,2022-12-01 07:04:46.003003,2022-12-01 07:05:05.750234,0 days 00:00:19.747231,"{0: 1, 1: 10}",11.0,1.0,910,COMPLETE
1583,1583,0.7713322828252974,2022-12-01 07:05:05.986532,2022-12-01 07:05:25.173724,0 days 00:00:19.187192,"{0: 1, 1: 10}",11.0,1.0,860,COMPLETE
1584,1584,0.769002425503938,2022-12-01 07:05:25.411671,2022-12-01 07:05:46.136752,0 days 00:00:20.725081,"{0: 1, 1: 10}",31.0,1.0,960,COMPLETE
1585,1585,0.7641105287300325,2022-12-01 07:05:46.367749,2022-12-01 07:06:04.568309,0 days 00:00:18.200560,"{0: 1, 1: 10}",37.0,1.0,810,COMPLETE
1586,1586,0.7656461766079606,2022-12-01 07:06:04.803073,2022-12-01 07:06:24.765338,0 days 00:00:19.962265,"{0: 1, 1: 10}",16.0,1.0,910,COMPLETE
1587,1587,0.7689623025005872,2022-12-01 07:06:24.996936,2022-12-01 07:06:45.578722,0 days 00:00:20.581786,"{0: 1, 1: 10}",25.0,1.0,960,COMPLETE
1588,1588,0.7636890648054707,2022-12-01 07:06:45.808619,2022-12-01 07:07:05.037361,0 days 00:00:19.228742,"{0: 1, 1: 10}",38.0,1.0,860,COMPLETE
1589,1589,0.7697387607010115,2022-12-01 07:07:05.274069,2022-12-01 07:07:25.250840,0 days 00:00:19.976771,"{0: 1, 1: 10}",18.0,1.0,910,COMPLETE
1590,1590,0.7713189428287429,2022-12-01 07:07:25.482808,2022-12-01 07:07:46.305759,0 days 00:00:20.822951,"{0: 1, 1: 10}",28.0,1.0,960,COMPLETE
1591,1591,0.7667270748471127,2022-12-01 07:07:46.544066,2022-12-01 07:08:05.654429,0 days 00:00:19.110363,"{0: 1, 1: 10}",11.0,1.0,860,COMPLETE
1592,1592,0.7660050127175353,2022-12-01 07:08:05.896009,2022-12-01 07:08:25.745998,0 days 00:00:19.849989,"{0: 1, 1: 10}",17.0,1.0,910,COMPLETE
1593,1593,0.7602255676397378,2022-12-01 07:08:25.987344,2022-12-01 07:08:45.437505,0 days 00:00:19.450161,"{0: 1, 1: 10}",5.0,1.0,910,COMPLETE
1594,1594,0.7646557610553517,2022-12-01 07:08:45.674405,2022-12-01 07:09:03.956313,0 days 00:00:18.281908,"{0: 1, 1: 10}",32.0,1.0,810,COMPLETE
1595,1595,0.7676968541384676,2022-12-01 07:09:04.190065,2022-12-01 07:09:24.856666,0 days 00:00:20.666601,"{0: 1, 1: 10}",11.0,1.0,960,COMPLETE
1596,1596,0.7700065619915276,2022-12-01 07:09:25.087320,2022-12-01 07:09:44.232905,0 days 00:00:19.145585,"{0: 1, 1: 10}",35.0,1.0,860,COMPLETE
1597,1597,0.772385351181254,2022-12-01 07:09:44.467962,2022-12-01 07:10:04.334408,0 days 00:00:19.866446,"{0: 1, 1: 10}",30.0,1.0,910,COMPLETE
1598,1598,0.7619305233060815,2022-12-01 07:10:04.567413,2022-12-01 07:10:25.318997,0 days 00:00:20.751584,"{0: 1, 1: 10}",30.0,1.0,960,COMPLETE
1599,1599,0.7653809285003137,2022-12-01 07:10:25.556494,2022-12-01 07:10:45.315912,0 days 00:00:19.759418,"{0: 1, 1: 10}",14.0,1.0,910,COMPLETE
1600,1600,0.7701548437471573,2022-12-01 07:10:45.554890,2022-12-01 07:11:06.228463,0 days 00:00:20.673573,"{0: 1, 1: 10}",39.0,1.0,960,COMPLETE
1601,1601,0.7629173436656507,2022-12-01 07:11:06.464124,2022-12-01 07:11:25.627473,0 days 00:00:19.163349,"{0: 1, 1: 10}",30.0,1.0,860,COMPLETE
1602,1602,0.7554114750210014,2022-12-01 07:11:25.853899,2022-12-01 07:11:44.744215,0 days 00:00:18.890316,"{0: 1, 1: 10}",7.0,1.0,860,COMPLETE
1603,1603,0.7628208648334511,2022-12-01 07:11:44.975149,2022-12-01 07:12:04.784980,0 days 00:00:19.809831,"{0: 1, 1: 10}",21.0,1.0,910,COMPLETE
1604,1604,0.7718475802356627,2022-12-01 07:12:05.020197,2022-12-01 07:12:24.895541,0 days 00:00:19.875344,"{0: 1, 1: 10}",30.0,1.0,910,COMPLETE
1605,1605,0.7553148316083963,2022-12-01 07:12:25.134155,2022-12-01 07:12:45.439474,0 days 00:00:20.305319,"{0: 1, 1: 10}",6.0,1.0,960,COMPLETE
1606,1606,0.7636188698220654,2022-12-01 07:12:45.675856,2022-12-01 07:13:04.713222,0 days 00:00:19.037366,"{0: 1, 1: 10}",30.0,1.0,860,COMPLETE
1607,1607,0.7275905961893304,2022-12-01 07:13:04.943935,2022-12-01 07:13:20.781874,0 days 00:00:15.837939,"{0: 1, 1: 10}",2.0,1.0,910,COMPLETE
1608,1608,0.7592962599575274,2022-12-01 07:13:21.019724,2022-12-01 07:13:41.015576,0 days 00:00:19.995852,"{0: 1, 1: 10}",4.0,1.0,960,COMPLETE
1609,1609,0.7686503940900024,2022-12-01 07:13:41.253619,2022-12-01 07:14:01.251494,0 days 00:00:19.997875,"{0: 1, 1: 10}",30.0,1.0,910,COMPLETE
1610,1610,0.7710705679356201,2022-12-01 07:14:01.488460,2022-12-01 07:14:20.706648,0 days 00:00:19.218188,"{0: 1, 1: 10}",30.0,1.0,860,COMPLETE
1611,1611,0.7674524942388363,2022-12-01 07:14:20.943113,2022-12-01 07:14:39.306550,0 days 00:00:18.363437,"{0: 1, 1: 10}",30.0,1.0,810,COMPLETE
1612,1612,0.7713890193767577,2022-12-01 07:14:39.535174,2022-12-01 07:14:59.562627,0 days 00:00:20.027453,"{0: 1, 1: 10}",30.0,1.0,910,COMPLETE
1613,1613,0.7670755940280756,2022-12-01 07:14:59.798976,2022-12-01 07:15:20.478284,0 days 00:00:20.679308,"{0: 1, 1: 10}",30.0,1.0,960,COMPLETE
1614,1614,0.7696371520857629,2022-12-01 07:15:20.724243,2022-12-01 07:15:39.885051,0 days 00:00:19.160808,"{0: 1, 1: 10}",24.0,1.0,860,COMPLETE
1615,1615,0.7689241717932351,2022-12-01 07:15:40.121059,2022-12-01 07:16:00.030243,0 days 00:00:19.909184,"{0: 1, 1: 10}",19.0,1.0,910,COMPLETE
1616,1616,0.7678390332204643,2022-12-01 07:16:00.265365,2022-12-01 07:16:21.112648,0 days 00:00:20.847283,"{0: 1, 1: 10}",30.0,1.0,960,COMPLETE
1617,1617,0.7669089866013887,2022-12-01 07:16:21.346855,2022-12-01 07:16:41.086118,0 days 00:00:19.739263,"{0: 1, 1: 10}",12.0,1.0,910,COMPLETE
1618,1618,0.7656587514685144,2022-12-01 07:16:41.322433,2022-12-01 07:17:01.212271,0 days 00:00:19.889838,"{0: 1, 1: 10}",13.0,1.0,910,COMPLETE
1619,1619,0.7668623454142789,2022-12-01 07:17:01.450643,2022-12-01 07:17:22.111363,0 days 00:00:20.660720,"{0: 1, 1: 10}",30.0,1.0,960,COMPLETE
1620,1620,0.7706630146108305,2022-12-01 07:17:22.348053,2022-12-01 07:17:41.378132,0 days 00:00:19.030079,"{0: 1, 1: 10}",30.0,1.0,860,COMPLETE
1621,1621,0.7675240141750844,2022-12-01 07:17:41.621006,2022-12-01 07:18:00.593811,0 days 00:00:18.972805,"{0: 1, 1: 10}",29.0,1.0,860,COMPLETE
1622,1622,0.767762749569753,2022-12-01 07:18:00.833741,2022-12-01 07:18:19.133653,0 days 00:00:18.299912,"{0: 1, 1: 10}",20.0,1.0,810,COMPLETE
1623,1623,0.7667219141791276,2022-12-01 07:18:19.378555,2022-12-01 07:18:40.054686,0 days 00:00:20.676131,"{0: 1, 1: 10}",30.0,1.0,960,COMPLETE
1624,1624,0.766271949432627,2022-12-01 07:18:40.291413,2022-12-01 07:19:00.168862,0 days 00:00:19.877449,"{0: 1, 1: 10}",10.0,1.0,910,COMPLETE
1625,1625,0.7637215123185187,2022-12-01 07:19:00.410148,2022-12-01 07:19:20.046559,0 days 00:00:19.636411,"{0: 1, 1: 10}",8.0,1.0,910,COMPLETE
1626,1626,0.7657005512545029,2022-12-01 07:19:20.278063,2022-12-01 07:19:40.779449,0 days 00:00:20.501386,"{0: 1, 1: 10}",36.0,1.0,960,COMPLETE
1627,1627,0.7726740597288198,2022-12-01 07:19:41.006170,2022-12-01 07:20:00.046497,0 days 00:00:19.040327,"{0: 1, 1: 10}",23.0,1.0,860,COMPLETE
1628,1628,0.7636181705446106,2022-12-01 07:20:00.280150,2022-12-01 07:20:18.638818,0 days 00:00:18.358668,"{0: 1, 1: 10}",23.0,1.0,810,COMPLETE
1629,1629,0.7668813423542213,2022-12-01 07:20:18.880434,2022-12-01 07:20:37.193703,0 days 00:00:18.313269,"{0: 1, 1: 10}",23.0,1.0,810,COMPLETE
1630,1630,0.597073169668358,2022-12-01 07:20:37.429612,2022-12-01 07:20:49.456637,0 days 00:00:12.027025,"{0: 1, 1: 10}",1.0,1.0,810,COMPLETE
1631,1631,0.7679489091851983,2022-12-01 07:20:49.692852,2022-12-01 07:21:08.734949,0 days 00:00:19.042097,"{0: 1, 1: 10}",33.0,1.0,860,COMPLETE
1632,1632,0.7677103175745217,2022-12-01 07:21:08.971333,2022-12-01 07:21:28.108165,0 days 00:00:19.136832,"{0: 1, 1: 10}",34.0,1.0,860,COMPLETE
1633,1633,0.7715309602873499,2022-12-01 07:21:28.346954,2022-12-01 07:21:47.379603,0 days 00:00:19.032649,"{0: 1, 1: 10}",23.0,1.0,860,COMPLETE
1634,1634,0.7654487659818178,2022-12-01 07:21:47.611426,2022-12-01 07:22:06.711941,0 days 00:00:19.100515,"{0: 1, 1: 10}",23.0,1.0,860,COMPLETE
1635,1635,0.7723400332221049,2022-12-01 07:22:06.952499,2022-12-01 07:22:25.162930,0 days 00:00:18.210431,"{0: 1, 1: 10}",26.0,1.0,810,COMPLETE
1636,1636,0.7655892484182951,2022-12-01 07:22:25.406969,2022-12-01 07:22:44.362837,0 days 00:00:18.955868,"{0: 1, 1: 10}",32.0,1.0,860,COMPLETE
1637,1637,0.7676245243322095,2022-12-01 07:22:44.599220,2022-12-01 07:23:03.139595,0 days 00:00:18.540375,"{0: 1, 1: 10}",24.0,1.0,810,COMPLETE
1638,1638,0.7674382244299744,2022-12-01 07:23:03.377855,2022-12-01 07:23:22.446702,0 days 00:00:19.068847,"{0: 1, 1: 10}",,1.0,860,COMPLETE
1639,1639,0.774002627434888,2022-12-01 07:23:22.685688,2022-12-01 07:23:41.875986,0 days 00:00:19.190298,"{0: 1, 1: 10}",11.0,1.0,860,COMPLETE
1640,1640,0.759753491035087,2022-12-01 07:23:42.115048,2022-12-01 07:23:59.596275,0 days 00:00:17.481227,"{0: 1, 1: 10}",3.0,1.0,860,COMPLETE
1641,1641,0.763342623051247,2022-12-01 07:23:59.836812,2022-12-01 07:24:18.952785,0 days 00:00:19.115973,"{0: 1, 1: 10}",23.0,1.0,860,COMPLETE
1642,1642,0.7676046080702468,2022-12-01 07:24:19.198584,2022-12-01 07:24:37.524426,0 days 00:00:18.325842,"{0: 1, 1: 10}",11.0,1.0,810,COMPLETE
1643,1643,0.7627966307102286,2022-12-01 07:24:37.761672,2022-12-01 07:24:56.760392,0 days 00:00:18.998720,"{0: 1, 1: 10}",37.0,1.0,860,COMPLETE
1644,1644,0.7644078082853606,2022-12-01 07:24:56.985360,2022-12-01 07:25:16.178354,0 days 00:00:19.192994,"{0: 1, 1: 10}",31.0,1.0,860,COMPLETE
1645,1645,0.7627361855804053,2022-12-01 07:25:16.415337,2022-12-01 07:25:34.708438,0 days 00:00:18.293101,"{0: 1, 1: 10}",11.0,1.0,810,COMPLETE
1646,1646,0.7635051666790593,2022-12-01 07:25:34.942349,2022-12-01 07:25:54.087829,0 days 00:00:19.145480,"{0: 1, 1: 10}",23.0,1.0,860,COMPLETE
1647,1647,0.7643791696199994,2022-12-01 07:25:54.320610,2022-12-01 07:26:13.465039,0 days 00:00:19.144429,"{0: 1, 1: 10}",28.0,1.0,860,COMPLETE
1648,1648,0.7710497811740016,2022-12-01 07:26:13.697953,2022-12-01 07:26:34.498744,0 days 00:00:20.800791,"{0: 1, 1: 10}",23.0,1.0,960,COMPLETE
1649,1649,0.7673333278403061,2022-12-01 07:26:34.728263,2022-12-01 07:26:54.467884,0 days 00:00:19.739621,"{0: 1, 1: 10}",11.0,1.0,910,COMPLETE
1650,1650,0.7634446640977204,2022-12-01 07:26:54.699170,2022-12-01 07:27:15.422046,0 days 00:00:20.722876,"{0: 1, 1: 10}",27.0,1.0,960,COMPLETE
1651,1651,0.7669031502681223,2022-12-01 07:27:15.656440,2022-12-01 07:27:34.745784,0 days 00:00:19.089344,"{0: 1, 1: 10}",16.0,1.0,860,COMPLETE
1652,1652,0.7699879624280018,2022-12-01 07:27:34.977177,2022-12-01 07:27:54.931517,0 days 00:00:19.954340,"{0: 1, 1: 10}",23.0,1.0,910,COMPLETE
1653,1653,0.766302565410885,2022-12-01 07:27:55.169178,2022-12-01 07:28:15.925016,0 days 00:00:20.755838,"{0: 1, 1: 10}",23.0,1.0,960,COMPLETE
1654,1654,0.7705883239154845,2022-12-01 07:28:16.162777,2022-12-01 07:28:35.323012,0 days 00:00:19.160235,"{0: 1, 1: 10}",18.0,1.0,860,COMPLETE
1655,1655,0.7632940684889978,2022-12-01 07:28:35.563261,2022-12-01 07:28:55.433586,0 days 00:00:19.870325,"{0: 1, 1: 10}",25.0,1.0,910,COMPLETE
1656,1656,0.7651112075911679,2022-12-01 07:28:55.664105,2022-12-01 07:29:14.038288,0 days 00:00:18.374183,"{0: 1, 1: 10}",11.0,1.0,810,COMPLETE
1657,1657,0.7680692767011743,2022-12-01 07:29:14.273790,2022-12-01 07:29:34.097466,0 days 00:00:19.823676,"{0: 1, 1: 10}",23.0,1.0,910,COMPLETE
1658,1658,0.7685960626138122,2022-12-01 07:29:34.335494,2022-12-01 07:29:53.401393,0 days 00:00:19.065899,"{0: 1, 1: 10}",23.0,1.0,860,COMPLETE
1659,1659,0.76552368609166,2022-12-01 07:29:53.645412,2022-12-01 07:30:14.362787,0 days 00:00:20.717375,"{0: 1, 1: 10}",23.0,1.0,960,COMPLETE
1660,1660,0.7654171243599998,2022-12-01 07:30:14.594491,2022-12-01 07:30:34.468571,0 days 00:00:19.874080,"{0: 1, 1: 10}",23.0,1.0,910,COMPLETE
1661,1661,0.7648221718872384,2022-12-01 07:30:34.706908,2022-12-01 07:30:55.339547,0 days 00:00:20.632639,"{0: 1, 1: 10}",35.0,1.0,960,COMPLETE
1662,1662,0.7674438465354716,2022-12-01 07:30:55.580373,2022-12-01 07:31:15.263034,0 days 00:00:19.682661,"{0: 1, 1: 10}",9.0,1.0,910,COMPLETE
1663,1663,0.7533074462052379,2022-12-01 07:31:15.499325,2022-12-01 07:31:33.728821,0 days 00:00:18.229496,"{0: 1, 1: 10}",6.0,1.0,810,COMPLETE
1664,1664,0.7676541627150913,2022-12-01 07:31:33.964715,2022-12-01 07:31:53.041686,0 days 00:00:19.076971,"{0: 1, 1: 10}",14.0,1.0,860,COMPLETE
1665,1665,0.7666837178724478,2022-12-01 07:31:53.271292,2022-12-01 07:32:12.393705,0 days 00:00:19.122413,"{0: 1, 1: 10}",38.0,1.0,860,COMPLETE
1666,1666,0.7694323439073893,2022-12-01 07:32:12.630599,2022-12-01 07:32:32.497824,0 days 00:00:19.867225,"{0: 1, 1: 10}",32.0,1.0,910,COMPLETE
1667,1667,0.757458919225367,2022-12-01 07:32:32.730417,2022-12-01 07:32:52.976199,0 days 00:00:20.245782,"{0: 1, 1: 10}",5.0,1.0,960,COMPLETE
1668,1668,0.7682181284961085,2022-12-01 07:32:53.205805,2022-12-01 07:33:13.251188,0 days 00:00:20.045383,"{0: 1, 1: 10}",11.0,1.0,910,COMPLETE
1669,1669,0.7712987235937179,2022-12-01 07:33:13.498713,2022-12-01 07:33:32.564570,0 days 00:00:19.065857,"{0: 1, 1: 10}",11.0,1.0,860,COMPLETE
1670,1670,0.7586667242672044,2022-12-01 07:33:32.791798,2022-12-01 07:33:52.970093,0 days 00:00:20.178295,"{0: 1, 1: 10}",4.0,1.0,960,COMPLETE
1671,1671,0.761699985439894,2022-12-01 07:33:53.200289,2022-12-01 07:34:13.130640,0 days 00:00:19.930351,"{0: 1, 1: 10}",39.0,1.0,910,COMPLETE
1672,1672,0.7684750684179958,2022-12-01 07:34:13.364018,2022-12-01 07:34:32.439414,0 days 00:00:19.075396,"{0: 1, 1: 10}",11.0,1.0,860,COMPLETE
1673,1673,0.7633757275956896,2022-12-01 07:34:32.678747,2022-12-01 07:34:53.403395,0 days 00:00:20.724648,"{0: 1, 1: 10}",11.0,1.0,960,COMPLETE
1674,1674,0.769835088228236,2022-12-01 07:34:53.640921,2022-12-01 07:35:13.587144,0 days 00:00:19.946223,"{0: 1, 1: 10}",17.0,1.0,910,COMPLETE
1675,1675,0.7648000536811285,2022-12-01 07:35:13.822698,2022-12-01 07:35:33.866398,0 days 00:00:20.043700,"{0: 1, 1: 10}",29.0,1.0,910,COMPLETE
1676,1676,0.7675988534354975,2022-12-01 07:35:34.098234,2022-12-01 07:35:52.568796,0 days 00:00:18.470562,"{0: 1, 1: 10}",24.0,1.0,810,COMPLETE
1677,1677,0.7682456262622087,2022-12-01 07:35:52.813731,2022-12-01 07:36:11.855176,0 days 00:00:19.041445,"{0: 1, 1: 10}",13.0,1.0,860,COMPLETE
1678,1678,0.7710614526114051,2022-12-01 07:36:12.085262,2022-12-01 07:36:32.782103,0 days 00:00:20.696841,"{0: 1, 1: 10}",11.0,1.0,960,COMPLETE
1679,1679,0.7674965892361938,2022-12-01 07:36:33.019508,2022-12-01 07:36:52.955052,0 days 00:00:19.935544,"{0: 1, 1: 10}",21.0,1.0,910,COMPLETE
1680,1680,0.7691268206278201,2022-12-01 07:36:53.189291,2022-12-01 07:37:13.903939,0 days 00:00:20.714648,"{0: 1, 1: 10}",20.0,1.0,960,COMPLETE
1681,1681,0.7637035040333914,2022-12-01 07:37:14.142831,2022-12-01 07:37:33.154314,0 days 00:00:19.011483,"{0: 1, 1: 10}",11.0,1.0,860,COMPLETE
1682,1682,0.7677998128486881,2022-12-01 07:37:33.401241,2022-12-01 07:37:53.286189,0 days 00:00:19.884948,"{0: 1, 1: 10}",19.0,1.0,910,COMPLETE
1683,1683,0.7570539008368574,2022-12-01 07:37:53.523576,2022-12-01 07:38:12.508126,0 days 00:00:18.984550,"{0: 1, 1: 10}",7.0,1.0,860,COMPLETE
1684,1684,0.7684234804880979,2022-12-01 07:38:12.745695,2022-12-01 07:38:32.529378,0 days 00:00:19.783683,"{0: 1, 1: 10}",11.0,1.0,910,COMPLETE
1685,1685,0.7288286959926553,2022-12-01 07:38:32.774925,2022-12-01 07:38:49.180296,0 days 00:00:16.405371,"{0: 1, 1: 10}",2.0,1.0,960,COMPLETE
1686,1686,0.7663975323426191,2022-12-01 07:38:49.409219,2022-12-01 07:39:08.428196,0 days 00:00:19.018977,"{0: 1, 1: 10}",11.0,1.0,860,COMPLETE
1687,1687,0.6038819665373388,2022-12-01 07:39:08.660567,2022-12-01 07:39:21.839294,0 days 00:00:13.178727,"{0: 1, 1: 10}",1.0,1.0,960,COMPLETE
1688,1688,0.7655738524062637,2022-12-01 07:39:22.076228,2022-12-01 07:39:41.898662,0 days 00:00:19.822434,"{0: 1, 1: 10}",12.0,1.0,910,COMPLETE
1689,1689,0.7696922365845413,2022-12-01 07:39:42.134052,2022-12-01 07:40:01.220627,0 days 00:00:19.086575,"{0: 1, 1: 10}",11.0,1.0,860,COMPLETE
1690,1690,0.7593023434607501,2022-12-01 07:40:01.452752,2022-12-01 07:40:21.132162,0 days 00:00:19.679410,"{0: 1, 1: 10}",8.0,1.0,910,COMPLETE
1691,1691,0.7668911287413442,2022-12-01 07:40:21.371252,2022-12-01 07:40:42.017420,0 days 00:00:20.646168,"{0: 1, 1: 10}",23.0,1.0,960,COMPLETE
1692,1692,0.769366636725396,2022-12-01 07:40:42.234167,2022-12-01 07:41:00.714233,0 days 00:00:18.480066,"{0: 1, 1: 10}",32.0,1.0,810,COMPLETE
1693,1693,0.7746004584623836,2022-12-01 07:41:00.946343,2022-12-01 07:41:20.172620,0 days 00:00:19.226277,"{0: 1, 1: 10}",11.0,1.0,860,COMPLETE
1694,1694,0.765068168574097,2022-12-01 07:41:20.410031,2022-12-01 07:41:38.692150,0 days 00:00:18.282119,"{0: 1, 1: 10}",11.0,1.0,810,COMPLETE
1695,1695,0.7702970247911629,2022-12-01 07:41:38.936210,2022-12-01 07:41:57.256222,0 days 00:00:18.320012,"{0: 1, 1: 10}",11.0,1.0,810,COMPLETE
1696,1696,0.7685833094979551,2022-12-01 07:41:57.490770,2022-12-01 07:42:16.736819,0 days 00:00:19.246049,"{0: 1, 1: 10}",11.0,1.0,860,COMPLETE
1697,1697,0.7646011617193496,2022-12-01 07:42:16.975252,2022-12-01 07:42:36.033486,0 days 00:00:19.058234,"{0: 1, 1: 10}",11.0,1.0,860,COMPLETE
1698,1698,0.7713721644112639,2022-12-01 07:42:36.267500,2022-12-01 07:42:55.456704,0 days 00:00:19.189204,"{0: 1, 1: 10}",11.0,1.0,860,COMPLETE
1699,1699,0.7711384127819714,2022-12-01 07:42:55.694234,2022-12-01 07:43:14.077435,0 days 00:00:18.383201,"{0: 1, 1: 10}",11.0,1.0,810,COMPLETE
1700,1700,0.7710204489123078,2022-12-01 07:43:14.311671,2022-12-01 07:43:33.515759,0 days 00:00:19.204088,"{0: 1, 1: 10}",11.0,1.0,860,COMPLETE
1701,1701,0.7669382311685918,2022-12-01 07:43:33.757272,2022-12-01 07:43:52.883607,0 days 00:00:19.126335,"{0: 1, 1: 10}",11.0,1.0,860,COMPLETE
1702,1702,0.7712039628054366,2022-12-01 07:43:53.120165,2022-12-01 07:44:11.553908,0 days 00:00:18.433743,"{0: 1, 1: 10}",11.0,1.0,810,COMPLETE
1703,1703,0.7663824310550028,2022-12-01 07:44:11.792223,2022-12-01 07:44:30.730919,0 days 00:00:18.938696,"{0: 1, 1: 10}",11.0,1.0,860,COMPLETE
1704,1704,0.7635594683337069,2022-12-01 07:44:30.975645,2022-12-01 07:44:50.223666,0 days 00:00:19.248021,"{0: 1, 1: 10}",11.0,1.0,860,COMPLETE
1705,1705,0.7657551358456092,2022-12-01 07:44:50.461867,2022-12-01 07:45:09.591660,0 days 00:00:19.129793,"{0: 1, 1: 10}",11.0,1.0,860,COMPLETE
1706,1706,0.7616151168112182,2022-12-01 07:45:09.824443,2022-12-01 07:45:29.035665,0 days 00:00:19.211222,"{0: 1, 1: 10}",11.0,1.0,860,COMPLETE
1707,1707,0.7671495354526577,2022-12-01 07:45:29.269173,2022-12-01 07:45:48.394932,0 days 00:00:19.125759,"{0: 1, 1: 10}",33.0,1.0,860,COMPLETE
1708,1708,0.7708037179338303,2022-12-01 07:45:48.631427,2022-12-01 07:46:07.025548,0 days 00:00:18.394121,"{0: 1, 1: 10}",11.0,1.0,810,COMPLETE
1709,1709,0.766054945406592,2022-12-01 07:46:07.258488,2022-12-01 07:46:26.324101,0 days 00:00:19.065613,"{0: 1, 1: 10}",,1.0,860,COMPLETE
1710,1710,0.7672214488891174,2022-12-01 07:46:26.562642,2022-12-01 07:46:45.011419,0 days 00:00:18.448777,"{0: 1, 1: 10}",36.0,1.0,810,COMPLETE
1711,1711,0.7635214373356447,2022-12-01 07:46:45.246303,2022-12-01 07:47:04.368170,0 days 00:00:19.121867,"{0: 1, 1: 10}",10.0,1.0,860,COMPLETE
1712,1712,0.7649899337698549,2022-12-01 07:47:04.603121,2022-12-01 07:47:23.881395,0 days 00:00:19.278274,"{0: 1, 1: 10}",34.0,1.0,860,COMPLETE
1713,1713,0.7648168250608508,2022-12-01 07:47:24.111068,2022-12-01 07:47:43.163862,0 days 00:00:19.052794,"{0: 1, 1: 10}",11.0,1.0,860,COMPLETE
1714,1714,0.764909253861324,2022-12-01 07:47:43.392388,2022-12-01 07:48:03.388374,0 days 00:00:19.995986,"{0: 1, 1: 10}",26.0,1.0,910,COMPLETE
1715,1715,0.7681988983472242,2022-12-01 07:48:03.618141,2022-12-01 07:48:21.912304,0 days 00:00:18.294163,"{0: 1, 1: 10}",27.0,1.0,810,COMPLETE
1716,1716,0.7654349551313774,2022-12-01 07:48:22.146842,2022-12-01 07:48:42.117037,0 days 00:00:19.970195,"{0: 1, 1: 10}",11.0,1.0,910,COMPLETE
1717,1717,0.7676758092468761,2022-12-01 07:48:42.349476,2022-12-01 07:49:01.497092,0 days 00:00:19.147616,"{0: 1, 1: 10}",24.0,1.0,860,COMPLETE
1718,1718,0.7656517801584871,2022-12-01 07:49:01.734262,2022-12-01 07:49:21.478238,0 days 00:00:19.743976,"{0: 1, 1: 10}",11.0,1.0,910,COMPLETE
1719,1719,0.7643773270278021,2022-12-01 07:49:21.708998,2022-12-01 07:49:40.847493,0 days 00:00:19.138495,"{0: 1, 1: 10}",11.0,1.0,860,COMPLETE
1720,1720,0.7689296987318051,2022-12-01 07:49:41.090058,2022-12-01 07:50:01.064830,0 days 00:00:19.974772,"{0: 1, 1: 10}",31.0,1.0,910,COMPLETE
1721,1721,0.7597599736983819,2022-12-01 07:50:01.299668,2022-12-01 07:50:20.338175,0 days 00:00:19.038507,"{0: 1, 1: 10}",11.0,1.0,860,COMPLETE
