,number,value,datetime_start,datetime_complete,duration,params_class_weight,params_max_depth,params_max_features,params_n_estimators,state
1874,1874,0.7572888513194844,2022-12-01 08:37:50.575980,2022-12-01 08:38:09.615367,0 days 00:00:19.039387,"{0: 1, 1: 10}",7.0,1.0,860,COMPLETE
1875,1875,0.7663884538184192,2022-12-01 08:38:09.857569,2022-12-01 08:38:28.435080,0 days 00:00:18.577511,"{0: 1, 1: 10}",33.0,1.0,810,COMPLETE
1876,1876,0.7674144998648323,2022-12-01 08:38:28.686544,2022-12-01 08:38:48.516170,0 days 00:00:19.829626,"{0: 1, 1: 10}",26.0,1.0,910,COMPLETE
1877,1877,0.7638514944401439,2022-12-01 08:38:48.753243,2022-12-01 08:39:06.136773,0 days 00:00:17.383530,"{0: 1, 1: 10}",3.0,1.0,860,COMPLETE
1878,1878,0.7715894399718303,2022-12-01 08:39:06.380084,2022-12-01 08:39:25.706670,0 days 00:00:19.326586,"{0: 1, 1: 10}",37.0,1.0,860,COMPLETE
1879,1879,0.7651440099609035,2022-12-01 08:39:25.941633,2022-12-01 08:39:45.928783,0 days 00:00:19.987150,"{0: 1, 1: 10}",,1.0,910,COMPLETE
1880,1880,0.7665518655341031,2022-12-01 08:39:46.170779,2022-12-01 08:40:05.349442,0 days 00:00:19.178663,"{0: 1, 1: 10}",27.0,1.0,860,COMPLETE
1881,1881,0.7686467815802703,2022-12-01 08:40:05.590938,2022-12-01 08:40:23.951199,0 days 00:00:18.360261,"{0: 1, 1: 10}",24.0,1.0,810,COMPLETE
1882,1882,0.7681680506644343,2022-12-01 08:40:24.193552,2022-12-01 08:40:44.162370,0 days 00:00:19.968818,"{0: 1, 1: 10}",31.0,1.0,910,COMPLETE
1883,1883,0.7680408919739561,2022-12-01 08:40:44.407323,2022-12-01 08:41:04.127935,0 days 00:00:19.720612,"{0: 1, 1: 10}",16.0,1.0,910,COMPLETE
1884,1884,0.7631782360054609,2022-12-01 08:41:04.361864,2022-12-01 08:41:21.959287,0 days 00:00:17.597423,"{0: 1, 1: 10}",28.0,1.0,760,COMPLETE
1885,1885,0.7690754272190511,2022-12-01 08:41:22.204105,2022-12-01 08:41:41.509242,0 days 00:00:19.305137,"{0: 1, 1: 10}",18.0,1.0,860,COMPLETE
1886,1886,0.7658772781377766,2022-12-01 08:41:41.746519,2022-12-01 08:42:00.103766,0 days 00:00:18.357247,"{0: 1, 1: 10}",9.0,1.0,810,COMPLETE
1887,1887,0.7672599872969796,2022-12-01 08:42:00.346403,2022-12-01 08:42:20.315753,0 days 00:00:19.969350,"{0: 1, 1: 10}",25.0,1.0,910,COMPLETE
1888,1888,0.7470510599379845,2022-12-01 08:42:20.567593,2022-12-01 08:42:35.935704,0 days 00:00:15.368111,"{0: 1, 1: 10}",35.0,0.6,860,COMPLETE
1889,1889,0.7680083948810447,2022-12-01 08:42:36.179823,2022-12-01 08:42:55.206684,0 days 00:00:19.026861,"{0: 1, 1: 10}",14.0,1.0,860,COMPLETE
1890,1890,0.7704857834687788,2022-12-01 08:42:55.448924,2022-12-01 08:43:15.353461,0 days 00:00:19.904537,"{0: 1, 1: 10}",36.0,1.0,910,COMPLETE
1891,1891,0.7713873199164327,2022-12-01 08:43:15.597516,2022-12-01 08:43:33.852415,0 days 00:00:18.254899,"{0: 1, 1: 10}",11.0,1.0,810,COMPLETE
1892,1892,0.7522332132713715,2022-12-01 08:43:34.103497,2022-12-01 08:43:53.624913,0 days 00:00:19.521416,"{0: 1, 1: 10}",6.0,1.0,910,COMPLETE
1893,1893,0.7699264138718671,2022-12-01 08:43:53.885357,2022-12-01 08:44:12.942067,0 days 00:00:19.056710,"{0: 1, 1: 10}",11.0,1.0,860,COMPLETE
1894,1894,0.7590740244082669,2022-12-01 08:44:13.182567,2022-12-01 08:44:31.938980,0 days 00:00:18.756413,"{0: 1, 1: 10}",5.0,1.0,860,COMPLETE
1895,1895,0.7709114275915077,2022-12-01 08:44:32.180600,2022-12-01 08:44:52.103009,0 days 00:00:19.922409,"{0: 1, 1: 10}",38.0,1.0,910,COMPLETE
1896,1896,0.7666071546491068,2022-12-01 08:44:52.344825,2022-12-01 08:45:10.813807,0 days 00:00:18.468982,"{0: 1, 1: 10}",32.0,1.0,810,COMPLETE
1897,1897,0.7636348342746859,2022-12-01 08:45:11.058240,2022-12-01 08:45:30.143715,0 days 00:00:19.085475,"{0: 1, 1: 10}",11.0,1.0,860,COMPLETE
1898,1898,0.7659650283808054,2022-12-01 08:45:30.396003,2022-12-01 08:45:50.117828,0 days 00:00:19.721825,"{0: 1, 1: 10}",17.0,1.0,910,COMPLETE
1899,1899,0.7662373457945751,2022-12-01 08:45:50.368542,2022-12-01 08:46:10.319382,0 days 00:00:19.950840,"{0: 1, 1: 10}",39.0,1.0,910,COMPLETE
1900,1900,0.7576711230511715,2022-12-01 08:46:10.564478,2022-12-01 08:46:28.241410,0 days 00:00:17.676932,"{0: 1, 1: 10}",4.0,1.0,810,COMPLETE
1901,1901,0.7621371925855663,2022-12-01 08:46:28.476431,2022-12-01 08:46:46.167510,0 days 00:00:17.691079,"{0: 1, 1: 10}",19.0,1.0,760,COMPLETE
1902,1902,0.7663344616703867,2022-12-01 08:46:46.410979,2022-12-01 08:47:05.767043,0 days 00:00:19.356064,"{0: 1, 1: 10}",11.0,1.0,860,COMPLETE
1903,1903,0.7710226492933412,2022-12-01 08:47:05.974250,2022-12-01 08:47:26.006893,0 days 00:00:20.032643,"{0: 1, 1: 10}",29.0,1.0,910,COMPLETE
1904,1904,0.7697246172831779,2022-12-01 08:47:26.249299,2022-12-01 08:47:45.453788,0 days 00:00:19.204489,"{0: 1, 1: 10}",21.0,1.0,860,COMPLETE
1905,1905,0.7298569254053555,2022-12-01 08:47:45.695966,2022-12-01 08:48:01.057686,0 days 00:00:15.361720,"{0: 1, 1: 10}",2.0,1.0,860,COMPLETE
1906,1906,0.7577636218843434,2022-12-01 08:48:01.301231,2022-12-01 08:48:21.349153,0 days 00:00:20.047922,"{0: 1, 1: 10}",13.0,1.0,910,COMPLETE
1907,1907,0.7674467029860177,2022-12-01 08:48:21.586238,2022-12-01 08:48:39.902561,0 days 00:00:18.316323,"{0: 1, 1: 10}",11.0,1.0,810,COMPLETE
1908,1908,0.7670060246315793,2022-12-01 08:48:40.135525,2022-12-01 08:49:00.022266,0 days 00:00:19.886741,"{0: 1, 1: 10}",11.0,1.0,910,COMPLETE
1909,1909,0.7699615050811505,2022-12-01 08:49:00.276455,2022-12-01 08:49:19.374881,0 days 00:00:19.098426,"{0: 1, 1: 10}",24.0,1.0,860,COMPLETE
1910,1910,0.766683566761351,2022-12-01 08:49:19.616226,2022-12-01 08:49:39.547964,0 days 00:00:19.931738,"{0: 1, 1: 10}",20.0,1.0,910,COMPLETE
1911,1911,0.7405105309687704,2022-12-01 08:49:39.783904,2022-12-01 08:49:54.684169,0 days 00:00:14.900265,"{0: 1, 1: 10}",36.0,0.6,810,COMPLETE
1912,1912,0.7701975867823864,2022-12-01 08:49:54.920083,2022-12-01 08:50:14.068216,0 days 00:00:19.148133,"{0: 1, 1: 10}",12.0,1.0,860,COMPLETE
1913,1913,0.7635997761439395,2022-12-01 08:50:14.308814,2022-12-01 08:50:34.274097,0 days 00:00:19.965283,"{0: 1, 1: 10}",11.0,1.0,910,COMPLETE
1914,1914,0.7721704999154035,2022-12-01 08:50:34.509778,2022-12-01 08:50:53.725839,0 days 00:00:19.216061,"{0: 1, 1: 10}",11.0,1.0,860,COMPLETE
1915,1915,0.7698554068580558,2022-12-01 08:50:53.971803,2022-12-01 08:51:13.967800,0 days 00:00:19.995997,"{0: 1, 1: 10}",11.0,1.0,910,COMPLETE
1916,1916,0.7683753169454,2022-12-01 08:51:14.212159,2022-12-01 08:51:33.476381,0 days 00:00:19.264222,"{0: 1, 1: 10}",11.0,1.0,860,COMPLETE
1917,1917,0.7524770961658664,2022-12-01 08:51:33.716772,2022-12-01 08:51:51.074255,0 days 00:00:17.357483,"{0: 1, 1: 10}",7.0,0.9,810,COMPLETE
1918,1918,0.6038559059931521,2022-12-01 08:51:51.324889,2022-12-01 08:52:04.336057,0 days 00:00:13.011168,"{0: 1, 1: 10}",1.0,1.0,910,COMPLETE
1919,1919,0.7668638557031353,2022-12-01 08:52:04.578640,2022-12-01 08:52:23.600744,0 days 00:00:19.022104,"{0: 1, 1: 10}",8.0,1.0,860,COMPLETE
1920,1920,0.7631275302247617,2022-12-01 08:52:23.833978,2022-12-01 08:52:43.749050,0 days 00:00:19.915072,"{0: 1, 1: 10}",11.0,1.0,910,COMPLETE
1921,1921,0.768557176028597,2022-12-01 08:52:44.000180,2022-12-01 08:53:02.484494,0 days 00:00:18.484314,"{0: 1, 1: 10}",11.0,1.0,810,COMPLETE
1922,1922,0.7632341335158138,2022-12-01 08:53:02.724197,2022-12-01 08:53:21.911722,0 days 00:00:19.187525,"{0: 1, 1: 10}",32.0,1.0,860,COMPLETE
1923,1923,0.7655885994403585,2022-12-01 08:53:22.155938,2022-12-01 08:53:39.712007,0 days 00:00:17.556069,"{0: 1, 1: 10}",,1.0,760,COMPLETE
1924,1924,0.7740320734919888,2022-12-01 08:53:39.957694,2022-12-01 08:54:00.019757,0 days 00:00:20.062063,"{0: 1, 1: 10}",34.0,1.0,910,COMPLETE
1925,1925,0.764840266267534,2022-12-01 08:54:00.253608,2022-12-01 08:54:20.299378,0 days 00:00:20.045770,"{0: 1, 1: 10}",36.0,1.0,910,COMPLETE
1926,1926,0.7720457763133733,2022-12-01 08:54:20.542157,2022-12-01 08:54:40.589407,0 days 00:00:20.047250,"{0: 1, 1: 10}",34.0,1.0,910,COMPLETE
1927,1927,0.760378625306899,2022-12-01 08:54:40.822787,2022-12-01 08:55:00.949599,0 days 00:00:20.126812,"{0: 1, 1: 10}",34.0,1.0,910,COMPLETE
1928,1928,0.7586622527707896,2022-12-01 08:55:01.195852,2022-12-01 08:55:19.242599,0 days 00:00:18.046747,"{0: 1, 1: 10}",3.0,1.0,910,COMPLETE
1929,1929,0.7656539277942241,2022-12-01 08:55:19.484884,2022-12-01 08:55:39.557443,0 days 00:00:20.072559,"{0: 1, 1: 10}",34.0,1.0,910,COMPLETE
1930,1930,0.7694183060234676,2022-12-01 08:55:39.800276,2022-12-01 08:55:59.683694,0 days 00:00:19.883418,"{0: 1, 1: 10}",33.0,1.0,910,COMPLETE
1931,1931,0.7623696582816567,2022-12-01 08:55:59.921021,2022-12-01 08:56:19.875894,0 days 00:00:19.954873,"{0: 1, 1: 10}",34.0,1.0,910,COMPLETE
1932,1932,0.7644256415611269,2022-12-01 08:56:20.113307,2022-12-01 08:56:40.101633,0 days 00:00:19.988326,"{0: 1, 1: 10}",37.0,1.0,910,COMPLETE
1933,1933,0.7701498505660656,2022-12-01 08:56:40.344770,2022-12-01 08:57:00.210496,0 days 00:00:19.865726,"{0: 1, 1: 10}",24.0,1.0,910,COMPLETE
1934,1934,0.7716506441436813,2022-12-01 08:57:00.445269,2022-12-01 08:57:20.465520,0 days 00:00:20.020251,"{0: 1, 1: 10}",10.0,1.0,910,COMPLETE
1935,1935,0.7651979182324896,2022-12-01 08:57:20.701391,2022-12-01 08:57:40.887902,0 days 00:00:20.186511,"{0: 1, 1: 10}",34.0,1.0,910,COMPLETE
1936,1936,0.7668835953094217,2022-12-01 08:57:41.112571,2022-12-01 08:58:01.257436,0 days 00:00:20.144865,"{0: 1, 1: 10}",34.0,1.0,910,COMPLETE
1937,1937,0.7405865098541027,2022-12-01 08:58:01.500900,2022-12-01 08:58:17.593702,0 days 00:00:16.092802,"{0: 1, 1: 10}",34.0,0.6,910,COMPLETE
1938,1938,0.7708471055744357,2022-12-01 08:58:17.837448,2022-12-01 08:58:37.604215,0 days 00:00:19.766767,"{0: 1, 1: 10}",16.0,1.0,910,COMPLETE
1939,1939,0.769816110507359,2022-12-01 08:58:37.844610,2022-12-01 08:58:57.762979,0 days 00:00:19.918369,"{0: 1, 1: 10}",34.0,1.0,910,COMPLETE
1940,1940,0.7662276415097771,2022-12-01 08:58:58.002667,2022-12-01 08:59:17.979527,0 days 00:00:19.976860,"{0: 1, 1: 10}",34.0,1.0,910,COMPLETE
1941,1941,0.7655474466265346,2022-12-01 08:59:18.223157,2022-12-01 08:59:38.161156,0 days 00:00:19.937999,"{0: 1, 1: 10}",34.0,1.0,910,COMPLETE
1942,1942,0.7686538016145132,2022-12-01 08:59:38.397945,2022-12-01 08:59:57.340527,0 days 00:00:18.942582,"{0: 1, 1: 10}",34.0,0.9,910,COMPLETE
1943,1943,0.7655085596892209,2022-12-01 08:59:57.584289,2022-12-01 09:00:18.187585,0 days 00:00:20.603296,"{0: 1, 1: 10}",27.0,1.0,960,COMPLETE
1944,1944,0.7753955918064075,2022-12-01 09:00:18.425026,2022-12-01 09:00:38.306382,0 days 00:00:19.881356,"{0: 1, 1: 10}",34.0,1.0,910,COMPLETE
1945,1945,0.767655256907498,2022-12-01 09:00:38.558299,2022-12-01 09:00:59.243336,0 days 00:00:20.685037,"{0: 1, 1: 10}",34.0,1.0,960,COMPLETE
1946,1946,0.7629569941245647,2022-12-01 09:00:59.487453,2022-12-01 09:01:20.289906,0 days 00:00:20.802453,"{0: 1, 1: 10}",34.0,1.0,960,COMPLETE
1947,1947,0.7648122226114726,2022-12-01 09:01:20.544586,2022-12-01 09:01:40.521842,0 days 00:00:19.977256,"{0: 1, 1: 10}",26.0,1.0,910,COMPLETE
1948,1948,0.764347610380929,2022-12-01 09:01:40.768106,2022-12-01 09:02:00.771095,0 days 00:00:20.002989,"{0: 1, 1: 10}",34.0,1.0,910,COMPLETE
1949,1949,0.7702372568512048,2022-12-01 09:02:01.015800,2022-12-01 09:02:21.755519,0 days 00:00:20.739719,"{0: 1, 1: 10}",34.0,1.0,960,COMPLETE
1950,1950,0.7673199007440235,2022-12-01 09:02:21.995378,2022-12-01 09:02:41.835508,0 days 00:00:19.840130,"{0: 1, 1: 10}",9.0,1.0,910,COMPLETE
1951,1951,0.7701630461615457,2022-12-01 09:02:42.080657,2022-12-01 09:03:02.055342,0 days 00:00:19.974685,"{0: 1, 1: 10}",34.0,1.0,910,COMPLETE
1952,1952,0.7608776562898781,2022-12-01 09:03:02.298247,2022-12-01 09:03:20.939897,0 days 00:00:18.641650,"{0: 1, 1: 10}",28.0,0.8,960,COMPLETE
1953,1953,0.7660827347905796,2022-12-01 09:03:21.173552,2022-12-01 09:03:41.272446,0 days 00:00:20.098894,"{0: 1, 1: 10}",34.0,1.0,910,COMPLETE
1954,1954,0.7725128374873976,2022-12-01 09:03:41.500363,2022-12-01 09:04:01.374438,0 days 00:00:19.874075,"{0: 1, 1: 10}",31.0,1.0,910,COMPLETE
1955,1955,0.7618691448556641,2022-12-01 09:04:01.611396,2022-12-01 09:04:22.246189,0 days 00:00:20.634793,"{0: 1, 1: 10}",34.0,1.0,960,COMPLETE
1956,1956,0.76714759169984,2022-12-01 09:04:22.490924,2022-12-01 09:04:42.448951,0 days 00:00:19.958027,"{0: 1, 1: 10}",34.0,1.0,910,COMPLETE
1957,1957,0.766419698980924,2022-12-01 09:04:42.684728,2022-12-01 09:05:03.521322,0 days 00:00:20.836594,"{0: 1, 1: 10}",34.0,1.0,960,COMPLETE
1958,1958,0.7654111984698508,2022-12-01 09:05:03.759930,2022-12-01 09:05:23.656922,0 days 00:00:19.896992,"{0: 1, 1: 10}",34.0,1.0,910,COMPLETE
1959,1959,0.7665197183952304,2022-12-01 09:05:23.909323,2022-12-01 09:05:43.741235,0 days 00:00:19.831912,"{0: 1, 1: 10}",34.0,1.0,910,COMPLETE
1960,1960,0.771063845269969,2022-12-01 09:05:43.985256,2022-12-01 09:06:04.756208,0 days 00:00:20.770952,"{0: 1, 1: 10}",34.0,1.0,960,COMPLETE
1961,1961,0.7659266875579209,2022-12-01 09:06:04.995318,2022-12-01 09:06:25.054642,0 days 00:00:20.059324,"{0: 1, 1: 10}",34.0,1.0,910,COMPLETE
1962,1962,0.7634280209889343,2022-12-01 09:06:25.296658,2022-12-01 09:06:45.209108,0 days 00:00:19.912450,"{0: 1, 1: 10}",34.0,1.0,910,COMPLETE
1963,1963,0.7437457880363164,2022-12-01 09:06:45.444573,2022-12-01 09:07:01.975011,0 days 00:00:16.530438,"{0: 1, 1: 10}",34.0,0.6,960,COMPLETE
1964,1964,0.7680785331011009,2022-12-01 09:07:02.220100,2022-12-01 09:07:22.282542,0 days 00:00:20.062442,"{0: 1, 1: 10}",34.0,1.0,910,COMPLETE
1965,1965,0.7607113792368414,2022-12-01 09:07:22.517985,2022-12-01 09:07:40.113870,0 days 00:00:17.595885,"{0: 1, 1: 10}",25.0,1.0,760,COMPLETE
1966,1966,0.7711072586348097,2022-12-01 09:07:40.358721,2022-12-01 09:08:00.232298,0 days 00:00:19.873577,"{0: 1, 1: 10}",14.0,1.0,910,COMPLETE
1967,1967,0.7646120537680611,2022-12-01 09:08:00.468752,2022-12-01 09:08:21.211417,0 days 00:00:20.742665,"{0: 1, 1: 10}",34.0,1.0,960,COMPLETE
1968,1968,0.7683708670470775,2022-12-01 09:08:21.451154,2022-12-01 09:08:41.360166,0 days 00:00:19.909012,"{0: 1, 1: 10}",36.0,1.0,910,COMPLETE
1969,1969,0.7657721717432557,2022-12-01 09:08:41.602387,2022-12-01 09:09:01.345002,0 days 00:00:19.742615,"{0: 1, 1: 10}",18.0,0.9,960,COMPLETE
1970,1970,0.7622073517292806,2022-12-01 09:09:01.591619,2022-12-01 09:09:21.428654,0 days 00:00:19.837035,"{0: 1, 1: 10}",35.0,1.0,910,COMPLETE
1971,1971,0.7578155083514453,2022-12-01 09:09:21.664377,2022-12-01 09:09:41.277873,0 days 00:00:19.613496,"{0: 1, 1: 10}",5.0,1.0,910,COMPLETE
1972,1972,0.7654348653463876,2022-12-01 09:09:41.516291,2022-12-01 09:10:02.170787,0 days 00:00:20.654496,"{0: 1, 1: 10}",38.0,1.0,960,COMPLETE
1973,1973,0.7674090535981366,2022-12-01 09:10:02.417534,2022-12-01 09:10:22.384107,0 days 00:00:19.966573,"{0: 1, 1: 10}",32.0,1.0,910,COMPLETE
1974,1974,0.7524850034477609,2022-12-01 09:10:22.623453,2022-12-01 09:10:42.614483,0 days 00:00:19.991030,"{0: 1, 1: 10}",4.0,1.0,960,COMPLETE
1975,1975,0.7684049288683584,2022-12-01 09:10:42.858916,2022-12-01 09:11:02.814213,0 days 00:00:19.955297,"{0: 1, 1: 10}",39.0,1.0,910,COMPLETE
1976,1976,0.7669938114272856,2022-12-01 09:11:03.058456,2022-12-01 09:11:22.947395,0 days 00:00:19.888939,"{0: 1, 1: 10}",34.0,1.0,910,COMPLETE
1977,1977,0.7619596324594553,2022-12-01 09:11:23.190182,2022-12-01 09:11:42.899994,0 days 00:00:19.709812,"{0: 1, 1: 10}",8.0,1.0,910,COMPLETE
1978,1978,0.7585722997779373,2022-12-01 09:11:43.149523,2022-12-01 09:12:01.685288,0 days 00:00:18.535765,"{0: 1, 1: 10}",17.0,0.8,960,COMPLETE
1979,1979,0.7660075066952989,2022-12-01 09:12:01.930568,2022-12-01 09:12:21.933767,0 days 00:00:20.003199,"{0: 1, 1: 10}",29.0,1.0,910,COMPLETE
1980,1980,0.7542869531774131,2022-12-01 09:12:22.188003,2022-12-01 09:12:42.658570,0 days 00:00:20.470567,"{0: 1, 1: 10}",6.0,1.0,960,COMPLETE
1981,1981,0.7628067867599526,2022-12-01 09:12:42.903648,2022-12-01 09:13:03.025497,0 days 00:00:20.121849,"{0: 1, 1: 10}",19.0,1.0,910,COMPLETE
1982,1982,0.7670662951005842,2022-12-01 09:13:03.274859,2022-12-01 09:13:22.539646,0 days 00:00:19.264787,"{0: 1, 1: 10}",24.0,1.0,860,COMPLETE
1983,1983,0.7699992165158008,2022-12-01 09:13:22.781100,2022-12-01 09:13:43.535342,0 days 00:00:20.754242,"{0: 1, 1: 10}",13.0,1.0,960,COMPLETE
1984,1984,0.7333103957780318,2022-12-01 09:13:43.785316,2022-12-01 09:13:59.709279,0 days 00:00:15.923963,"{0: 1, 1: 10}",2.0,1.0,910,COMPLETE
1985,1985,0.767845437734073,2022-12-01 09:13:59.947923,2022-12-01 09:14:19.359107,0 days 00:00:19.411184,"{0: 1, 1: 10}",20.0,1.0,860,COMPLETE
1986,1986,0.762587193276521,2022-12-01 09:14:19.606574,2022-12-01 09:14:37.281653,0 days 00:00:17.675079,"{0: 1, 1: 10}",21.0,1.0,760,COMPLETE
1987,1987,0.7634717974126555,2022-12-01 09:14:37.523730,2022-12-01 09:14:57.284091,0 days 00:00:19.760361,"{0: 1, 1: 10}",12.0,1.0,910,COMPLETE
1988,1988,0.7610952770620507,2022-12-01 09:14:57.527548,2022-12-01 09:15:18.262483,0 days 00:00:20.734935,"{0: 1, 1: 10}",36.0,1.0,960,COMPLETE
1989,1989,0.7539524357958562,2022-12-01 09:15:18.505441,2022-12-01 09:15:37.618989,0 days 00:00:19.113548,"{0: 1, 1: 10}",7.0,1.0,860,COMPLETE
1990,1990,0.7661377874441451,2022-12-01 09:15:37.868878,2022-12-01 09:15:57.955700,0 days 00:00:20.086822,"{0: 1, 1: 10}",32.0,1.0,910,COMPLETE
1991,1991,0.7650846851464211,2022-12-01 09:15:58.195392,2022-12-01 09:16:18.478170,0 days 00:00:20.282778,"{0: 1, 1: 10}",,1.0,910,COMPLETE
1992,1992,0.7673080686005209,2022-12-01 09:16:18.722588,2022-12-01 09:16:37.880915,0 days 00:00:19.158327,"{0: 1, 1: 10}",34.0,1.0,860,COMPLETE
1993,1993,0.7406958765344199,2022-12-01 09:16:38.120421,2022-12-01 09:16:54.046123,0 days 00:00:15.925702,"{0: 1, 1: 10}",33.0,0.6,910,COMPLETE
1994,1994,0.7632188225563029,2022-12-01 09:16:54.289619,2022-12-01 09:17:12.774884,0 days 00:00:18.485265,"{0: 1, 1: 10}",3.0,1.0,960,COMPLETE
1995,1995,0.7635003440637051,2022-12-01 09:17:13.030583,2022-12-01 09:17:31.347477,0 days 00:00:18.316894,"{0: 1, 1: 10}",10.0,0.9,860,COMPLETE
1996,1996,0.5997618656663329,2022-12-01 09:17:31.591493,2022-12-01 09:17:44.188406,0 days 00:00:12.596913,"{0: 1, 1: 10}",1.0,1.0,860,COMPLETE
1997,1997,0.7689946188819978,2022-12-01 09:17:44.426558,2022-12-01 09:18:05.104651,0 days 00:00:20.678093,"{0: 1, 1: 10}",36.0,1.0,960,COMPLETE
1998,1998,0.7702321294416751,2022-12-01 09:18:05.340984,2022-12-01 09:18:25.179790,0 days 00:00:19.838806,"{0: 1, 1: 10}",27.0,1.0,910,COMPLETE
1999,1999,0.7668840378498555,2022-12-01 09:18:25.436619,2022-12-01 09:18:45.690922,0 days 00:00:20.254303,"{0: 1, 1: 10}",26.0,1.0,910,COMPLETE
2000,2000,0.765474197961295,2022-12-01 09:18:45.967179,2022-12-01 09:19:04.669824,0 days 00:00:18.702645,"{0: 1, 1: 10}",25.0,1.0,760,COMPLETE
2001,2001,0.7652851815664963,2022-12-01 09:19:04.923463,2022-12-01 09:19:24.843521,0 days 00:00:19.920058,"{0: 1, 1: 10}",24.0,1.0,860,COMPLETE
2002,2002,0.766036459652779,2022-12-01 09:19:25.099390,2022-12-01 09:19:46.619002,0 days 00:00:21.519612,"{0: 1, 1: 10}",37.0,1.0,960,COMPLETE
2003,2003,0.7666265957792995,2022-12-01 09:19:46.882273,2022-12-01 09:20:07.572508,0 days 00:00:20.690235,"{0: 1, 1: 10}",35.0,1.0,910,COMPLETE
2004,2004,0.7655373603199178,2022-12-01 09:20:07.798761,2022-12-01 09:20:27.014593,0 days 00:00:19.215832,"{0: 1, 1: 10}",16.0,1.0,860,COMPLETE
2005,2005,0.769526605052014,2022-12-01 09:20:27.257897,2022-12-01 09:20:47.357879,0 days 00:00:20.099982,"{0: 1, 1: 10}",34.0,1.0,910,COMPLETE
2006,2006,0.7574497175340235,2022-12-01 09:20:47.605267,2022-12-01 09:21:04.442293,0 days 00:00:16.837026,"{0: 1, 1: 10}",31.0,0.8,810,COMPLETE
2007,2007,0.7682710373539431,2022-12-01 09:21:04.679662,2022-12-01 09:21:24.540019,0 days 00:00:19.860357,"{0: 1, 1: 10}",18.0,1.0,860,COMPLETE
2008,2008,0.755629264986643,2022-12-01 09:21:24.806846,2022-12-01 09:21:45.594063,0 days 00:00:20.787217,"{0: 1, 1: 10}",5.0,1.0,960,COMPLETE
2009,2009,0.7701798220160184,2022-12-01 09:21:45.831353,2022-12-01 09:22:05.613249,0 days 00:00:19.781896,"{0: 1, 1: 10}",9.0,1.0,910,COMPLETE
2010,2010,0.7671041800631906,2022-12-01 09:22:05.854228,2022-12-01 09:22:25.146543,0 days 00:00:19.292315,"{0: 1, 1: 10}",14.0,1.0,860,COMPLETE
2011,2011,0.7692711755087144,2022-12-01 09:22:25.389916,2022-12-01 09:22:45.387260,0 days 00:00:19.997344,"{0: 1, 1: 10}",17.0,1.0,910,COMPLETE
2012,2012,0.7651863105328629,2022-12-01 09:22:45.679434,2022-12-01 09:23:06.267230,0 days 00:00:20.587796,"{0: 1, 1: 10}",38.0,1.0,960,COMPLETE
2013,2013,0.7571204973306904,2022-12-01 09:23:06.502925,2022-12-01 09:23:25.247994,0 days 00:00:18.745069,"{0: 1, 1: 10}",6.0,1.0,860,COMPLETE
2014,2014,0.7638521727287603,2022-12-01 09:23:25.495712,2022-12-01 09:23:45.364122,0 days 00:00:19.868410,"{0: 1, 1: 10}",36.0,1.0,910,COMPLETE
2015,2015,0.7575899200830337,2022-12-01 09:23:45.609978,2022-12-01 09:24:05.745012,0 days 00:00:20.135034,"{0: 1, 1: 10}",4.0,1.0,960,COMPLETE
2016,2016,0.7640122875157411,2022-12-01 09:24:05.982215,2022-12-01 09:24:25.918488,0 days 00:00:19.936273,"{0: 1, 1: 10}",11.0,1.0,910,COMPLETE
2017,2017,0.7434336677312082,2022-12-01 09:24:26.165839,2022-12-01 09:24:41.050467,0 days 00:00:14.884628,"{0: 1, 1: 10}",28.0,0.6,810,COMPLETE
2018,2018,0.7678562234877748,2022-12-01 09:24:41.294381,2022-12-01 09:25:00.472671,0 days 00:00:19.178290,"{0: 1, 1: 10}",21.0,1.0,860,COMPLETE
2019,2019,0.7281656541388108,2022-12-01 09:25:00.725913,2022-12-01 09:25:16.610605,0 days 00:00:15.884692,"{0: 1, 1: 10}",2.0,1.0,910,COMPLETE
2020,2020,0.770094745542117,2022-12-01 09:25:16.854818,2022-12-01 09:25:36.094444,0 days 00:00:19.239626,"{0: 1, 1: 10}",32.0,1.0,860,COMPLETE
2021,2021,0.7705283485535361,2022-12-01 09:25:36.337503,2022-12-01 09:25:53.897782,0 days 00:00:17.560279,"{0: 1, 1: 10}",39.0,0.9,810,COMPLETE
2022,2022,0.7634308142494785,2022-12-01 09:25:54.136366,2022-12-01 09:26:14.163466,0 days 00:00:20.027100,"{0: 1, 1: 10}",29.0,1.0,910,COMPLETE
2023,2023,0.7682819195181052,2022-12-01 09:26:14.405808,2022-12-01 09:26:35.217055,0 days 00:00:20.811247,"{0: 1, 1: 10}",19.0,1.0,960,COMPLETE
2024,2024,0.7661984743797812,2022-12-01 09:26:35.475882,2022-12-01 09:26:54.610520,0 days 00:00:19.134638,"{0: 1, 1: 10}",11.0,1.0,860,COMPLETE
2025,2025,0.7689490229470114,2022-12-01 09:26:54.851507,2022-12-01 09:27:14.891524,0 days 00:00:20.040017,"{0: 1, 1: 10}",34.0,1.0,910,COMPLETE
