,number,value,datetime_start,datetime_complete,duration,params_class_weight,params_max_depth,params_max_features,params_n_estimators,state
2178,2178,0.7518101977888152,2022-12-01 10:12:10.916005,2022-12-01 10:12:27.389095,0 days 00:00:16.473090,"{0: 1, 1: 10}",35.0,0.7,860,COMPLETE
2179,2179,0.7649438960497802,2022-12-01 10:12:27.633628,2022-12-01 10:12:45.952715,0 days 00:00:18.319087,"{0: 1, 1: 10}",39.0,,810,COMPLETE
2180,2180,0.7548456166699669,2022-12-01 10:12:46.207700,2022-12-01 10:13:03.564468,0 days 00:00:17.356768,"{0: 1, 1: 10}",6.0,1.0,760,COMPLETE
2181,2181,0.7559880708874328,2022-12-01 10:13:03.811440,2022-12-01 10:13:22.447214,0 days 00:00:18.635774,"{0: 1, 1: 10}",4.0,1.0,860,COMPLETE
2182,2182,0.6859377188334096,2022-12-01 10:13:22.687891,2022-12-01 10:13:31.913591,0 days 00:00:09.225700,"{0: 1, 1: 10}",15.0,sqrt,810,COMPLETE
2183,2183,0.7659741598600938,2022-12-01 10:13:32.163603,2022-12-01 10:13:51.434358,0 days 00:00:19.270755,"{0: 1, 1: 10}",17.0,1.0,860,COMPLETE
2184,2184,0.7633498120667108,2022-12-01 10:13:51.684761,2022-12-01 10:14:10.492042,0 days 00:00:18.807281,"{0: 1, 1: 10}",5.0,1.0,860,COMPLETE
2185,2185,0.725225398020168,2022-12-01 10:14:10.751159,2022-12-01 10:14:25.102928,0 days 00:00:14.351769,"{0: 1, 1: 10}",2.0,1.0,760,COMPLETE
2186,2186,0.7628417641675375,2022-12-01 10:14:25.344176,2022-12-01 10:14:43.703799,0 days 00:00:18.359623,"{0: 1, 1: 10}",29.0,1.0,810,COMPLETE
2187,2187,0.772773822693385,2022-12-01 10:14:43.949998,2022-12-01 10:15:03.167356,0 days 00:00:19.217358,"{0: 1, 1: 10}",19.0,1.0,860,COMPLETE
2188,2188,0.7648412355912882,2022-12-01 10:15:03.408186,2022-12-01 10:15:21.759412,0 days 00:00:18.351226,"{0: 1, 1: 10}",21.0,1.0,810,COMPLETE
2189,2189,0.7731490091178268,2022-12-01 10:15:22.002697,2022-12-01 10:15:41.396881,0 days 00:00:19.394184,"{0: 1, 1: 10}",34.0,1.0,860,COMPLETE
2190,2190,0.7434519747242934,2022-12-01 10:15:41.647071,2022-12-01 10:15:56.459188,0 days 00:00:14.812117,"{0: 1, 1: 10}",13.0,0.6,810,COMPLETE
2191,2191,0.7683798107099857,2022-12-01 10:15:56.697288,2022-12-01 10:16:15.921040,0 days 00:00:19.223752,"{0: 1, 1: 10}",26.0,1.0,860,COMPLETE
2192,2192,0.7615892006901271,2022-12-01 10:16:16.166348,2022-12-01 10:16:33.713215,0 days 00:00:17.546867,"{0: 1, 1: 10}",12.0,1.0,760,COMPLETE
2193,2193,0.7580155263425333,2022-12-01 10:16:33.954890,2022-12-01 10:16:52.941082,0 days 00:00:18.986192,"{0: 1, 1: 10}",7.0,1.0,860,COMPLETE
2194,2194,0.7660626158588257,2022-12-01 10:16:53.180056,2022-12-01 10:17:11.584894,0 days 00:00:18.404838,"{0: 1, 1: 10}",20.0,1.0,810,COMPLETE
2195,2195,0.7685343315590096,2022-12-01 10:17:11.826383,2022-12-01 10:17:30.151186,0 days 00:00:18.324803,"{0: 1, 1: 10}",11.0,1.0,810,COMPLETE
2196,2196,0.763176088384446,2022-12-01 10:17:30.391354,2022-12-01 10:17:48.480001,0 days 00:00:18.088647,"{0: 1, 1: 10}",36.0,0.9,860,COMPLETE
2197,2197,0.7720855436406714,2022-12-01 10:17:48.720699,2022-12-01 10:18:08.077080,0 days 00:00:19.356381,"{0: 1, 1: 10}",16.0,1.0,860,COMPLETE
2198,2198,0.60486888730382,2022-12-01 10:18:08.336059,2022-12-01 10:18:20.526130,0 days 00:00:12.190071,"{0: 1, 1: 10}",1.0,1.0,810,COMPLETE
2199,2199,0.768487773691392,2022-12-01 10:18:20.777322,2022-12-01 10:18:39.162700,0 days 00:00:18.385378,"{0: 1, 1: 10}",11.0,1.0,810,COMPLETE
2200,2200,0.7625991373277289,2022-12-01 10:18:39.412772,2022-12-01 10:18:58.454508,0 days 00:00:19.041736,"{0: 1, 1: 10}",8.0,1.0,860,COMPLETE
2201,2201,0.7627959420665331,2022-12-01 10:18:58.700217,2022-12-01 10:19:17.797726,0 days 00:00:19.097509,"{0: 1, 1: 10}",11.0,1.0,860,COMPLETE
2202,2202,0.7673097549683946,2022-12-01 10:19:18.060821,2022-12-01 10:19:36.479993,0 days 00:00:18.419172,"{0: 1, 1: 10}",,1.0,810,COMPLETE
2203,2203,0.6298786939683472,2022-12-01 10:19:36.730262,2022-12-01 10:19:46.200213,0 days 00:00:09.469951,"{0: 1, 1: 10}",11.0,log2,760,COMPLETE
2204,2204,0.7715045339774391,2022-12-01 10:19:46.441148,2022-12-01 10:20:05.722340,0 days 00:00:19.281192,"{0: 1, 1: 10}",34.0,1.0,860,COMPLETE
2205,2205,0.7649376480112366,2022-12-01 10:20:05.973767,2022-12-01 10:20:24.283363,0 days 00:00:18.309596,"{0: 1, 1: 10}",11.0,1.0,810,COMPLETE
2206,2206,0.7678706478551669,2022-12-01 10:20:24.534510,2022-12-01 10:20:43.663140,0 days 00:00:19.128630,"{0: 1, 1: 10}",27.0,1.0,860,COMPLETE
2207,2207,0.7548395874778828,2022-12-01 10:20:43.907434,2022-12-01 10:20:58.907533,0 days 00:00:15.000099,"{0: 1, 1: 10}",10.0,0.7,760,COMPLETE
2208,2208,0.7744275979486972,2022-12-01 10:20:59.153411,2022-12-01 10:21:18.325646,0 days 00:00:19.172235,"{0: 1, 1: 10}",11.0,,860,COMPLETE
2209,2209,0.7682908072717014,2022-12-01 10:21:18.582029,2022-12-01 10:21:37.916375,0 days 00:00:19.334346,"{0: 1, 1: 10}",11.0,,860,COMPLETE
2210,2210,0.7572591272295972,2022-12-01 10:21:38.174756,2022-12-01 10:21:55.450256,0 days 00:00:17.275500,"{0: 1, 1: 10}",3.0,,860,COMPLETE
2211,2211,0.7682404907366986,2022-12-01 10:21:55.698738,2022-12-01 10:22:14.032880,0 days 00:00:18.334142,"{0: 1, 1: 10}",36.0,,810,COMPLETE
2212,2212,0.7599970161525542,2022-12-01 10:22:14.272082,2022-12-01 10:22:30.936879,0 days 00:00:16.664797,"{0: 1, 1: 10}",33.0,0.8,810,COMPLETE
2213,2213,0.7526491833701109,2022-12-01 10:22:31.184640,2022-12-01 10:22:48.644935,0 days 00:00:17.460295,"{0: 1, 1: 10}",26.0,0.8,860,COMPLETE
2214,2214,0.7435741942631057,2022-12-01 10:22:48.895613,2022-12-01 10:23:03.705157,0 days 00:00:14.809544,"{0: 1, 1: 10}",11.0,0.6,810,COMPLETE
2215,2215,0.7661209672445667,2022-12-01 10:23:03.951412,2022-12-01 10:23:23.222063,0 days 00:00:19.270651,"{0: 1, 1: 10}",11.0,,860,COMPLETE
2216,2216,0.7637382375450386,2022-12-01 10:23:23.471221,2022-12-01 10:23:41.860244,0 days 00:00:18.389023,"{0: 1, 1: 10}",31.0,0.9,860,COMPLETE
2217,2217,0.6829891647224121,2022-12-01 10:23:42.107579,2022-12-01 10:23:51.482796,0 days 00:00:09.375217,"{0: 1, 1: 10}",37.0,sqrt,810,COMPLETE
2218,2218,0.6049428714104932,2022-12-01 10:23:51.723840,2022-12-01 10:24:01.060561,0 days 00:00:09.336721,"{0: 1, 1: 10}",25.0,log2,810,COMPLETE
2219,2219,0.7673286327363726,2022-12-01 10:24:01.305628,2022-12-01 10:24:20.418783,0 days 00:00:19.113155,"{0: 1, 1: 10}",16.0,,860,COMPLETE
2220,2220,0.766413144583898,2022-12-01 10:24:20.663137,2022-12-01 10:24:39.834751,0 days 00:00:19.171614,"{0: 1, 1: 10}",11.0,,860,COMPLETE
2221,2221,0.7582929962490637,2022-12-01 10:24:40.075310,2022-12-01 10:24:55.953746,0 days 00:00:15.878436,"{0: 1, 1: 10}",9.0,0.7,810,COMPLETE
2222,2222,0.773630184948145,2022-12-01 10:24:56.196612,2022-12-01 10:25:15.613643,0 days 00:00:19.417031,"{0: 1, 1: 10}",28.0,,860,COMPLETE
2223,2223,0.6789268989479954,2022-12-01 10:25:15.852370,2022-12-01 10:25:25.382456,0 days 00:00:09.530086,"{0: 1, 1: 10}",28.0,sqrt,810,COMPLETE
2224,2224,0.7702148457800727,2022-12-01 10:25:25.628677,2022-12-01 10:25:44.763752,0 days 00:00:19.135075,"{0: 1, 1: 10}",11.0,,860,COMPLETE
2225,2225,0.7635356976459318,2022-12-01 10:25:45.013221,2022-12-01 10:26:04.234647,0 days 00:00:19.221426,"{0: 1, 1: 10}",28.0,,860,COMPLETE
2226,2226,0.7705030337542923,2022-12-01 10:26:04.481011,2022-12-01 10:26:22.713919,0 days 00:00:18.232908,"{0: 1, 1: 10}",28.0,,810,COMPLETE
2227,2227,0.7654536344427704,2022-12-01 10:26:22.962633,2022-12-01 10:26:41.460479,0 days 00:00:18.497846,"{0: 1, 1: 10}",18.0,,810,COMPLETE
2228,2228,0.7688583936809905,2022-12-01 10:26:41.711837,2022-12-01 10:26:59.238448,0 days 00:00:17.526611,"{0: 1, 1: 10}",28.0,,760,COMPLETE
2229,2229,0.7674873932353006,2022-12-01 10:26:59.476400,2022-12-01 10:27:16.342626,0 days 00:00:16.866226,"{0: 1, 1: 10}",28.0,,710,COMPLETE
2230,2230,0.7696805770833424,2022-12-01 10:27:16.593433,2022-12-01 10:27:35.865678,0 days 00:00:19.272245,"{0: 1, 1: 10}",28.0,,860,COMPLETE
2231,2231,0.7667299121852621,2022-12-01 10:27:36.107552,2022-12-01 10:27:55.211709,0 days 00:00:19.104157,"{0: 1, 1: 10}",34.0,,860,COMPLETE
2232,2232,0.7670636388471032,2022-12-01 10:27:55.459582,2022-12-01 10:28:13.866369,0 days 00:00:18.406787,"{0: 1, 1: 10}",38.0,,810,COMPLETE
2233,2233,0.7643611702341274,2022-12-01 10:28:14.118520,2022-12-01 10:28:32.443172,0 days 00:00:18.324652,"{0: 1, 1: 10}",11.0,0.9,860,COMPLETE
2234,2234,0.6205200149008141,2022-12-01 10:28:32.689265,2022-12-01 10:28:42.056567,0 days 00:00:09.367302,"{0: 1, 1: 10}",14.0,log2,760,COMPLETE
2235,2235,0.7759638877599382,2022-12-01 10:28:42.292907,2022-12-01 10:29:01.436200,0 days 00:00:19.143293,"{0: 1, 1: 10}",11.0,,860,COMPLETE
2236,2236,0.7701952737596149,2022-12-01 10:29:01.677267,2022-12-01 10:29:20.966204,0 days 00:00:19.288937,"{0: 1, 1: 10}",11.0,,860,COMPLETE
2237,2237,0.7685438298108018,2022-12-01 10:29:21.215840,2022-12-01 10:29:40.566799,0 days 00:00:19.350959,"{0: 1, 1: 10}",28.0,,860,COMPLETE
2238,2238,0.7651005598987746,2022-12-01 10:29:40.812166,2022-12-01 10:30:00.112201,0 days 00:00:19.300035,"{0: 1, 1: 10}",11.0,,860,COMPLETE
2239,2239,0.7659193231120665,2022-12-01 10:30:00.351658,2022-12-01 10:30:19.352040,0 days 00:00:19.000382,"{0: 1, 1: 10}",11.0,,860,COMPLETE
2240,2240,0.7671392897320584,2022-12-01 10:30:19.613318,2022-12-01 10:30:38.875806,0 days 00:00:19.262488,"{0: 1, 1: 10}",28.0,,860,COMPLETE
2241,2241,0.7658327562614662,2022-12-01 10:30:39.118544,2022-12-01 10:30:58.169061,0 days 00:00:19.050517,"{0: 1, 1: 10}",28.0,,860,COMPLETE
2242,2242,0.762576554825458,2022-12-01 10:30:58.420021,2022-12-01 10:31:17.497867,0 days 00:00:19.077846,"{0: 1, 1: 10}",11.0,,860,COMPLETE
2243,2243,0.7670748654226942,2022-12-01 10:31:17.748226,2022-12-01 10:31:36.155080,0 days 00:00:18.406854,"{0: 1, 1: 10}",11.0,,810,COMPLETE
2244,2244,0.7634293497072979,2022-12-01 10:31:36.405815,2022-12-01 10:31:55.954438,0 days 00:00:19.548623,"{0: 1, 1: 10}",11.0,,860,COMPLETE
2245,2245,0.7628470976791568,2022-12-01 10:31:56.207666,2022-12-01 10:32:14.598149,0 days 00:00:18.390483,"{0: 1, 1: 10}",28.0,,810,COMPLETE
2246,2246,0.7719912612183847,2022-12-01 10:32:14.847711,2022-12-01 10:32:33.208426,0 days 00:00:18.360715,"{0: 1, 1: 10}",28.0,,810,COMPLETE
2247,2247,0.7678152675479067,2022-12-01 10:32:33.458103,2022-12-01 10:32:52.736989,0 days 00:00:19.278886,"{0: 1, 1: 10}",28.0,,860,COMPLETE
2248,2248,0.7677159119053368,2022-12-01 10:32:52.981480,2022-12-01 10:33:11.287391,0 days 00:00:18.305911,"{0: 1, 1: 10}",28.0,,810,COMPLETE
2249,2249,0.764952450079081,2022-12-01 10:33:11.534803,2022-12-01 10:33:30.642262,0 days 00:00:19.107459,"{0: 1, 1: 10}",28.0,,860,COMPLETE
2250,2250,0.7663275978926523,2022-12-01 10:33:30.887831,2022-12-01 10:33:52.133746,0 days 00:00:21.245915,"{0: 1, 1: 10}",11.0,,860,COMPLETE
2251,2251,0.7682874821540437,2022-12-01 10:33:52.390789,2022-12-01 10:34:11.675554,0 days 00:00:19.284765,"{0: 1, 1: 10}",11.0,,860,COMPLETE
2252,2252,0.7602720218458082,2022-12-01 10:34:11.917948,2022-12-01 10:34:28.617932,0 days 00:00:16.699984,"{0: 1, 1: 10}",28.0,0.8,810,COMPLETE
2253,2253,0.7652892426274861,2022-12-01 10:34:28.882594,2022-12-01 10:34:48.170163,0 days 00:00:19.287569,"{0: 1, 1: 10}",11.0,,860,COMPLETE
2254,2254,0.7687036140258983,2022-12-01 10:34:48.416729,2022-12-01 10:35:06.871524,0 days 00:00:18.454795,"{0: 1, 1: 10}",28.0,,810,COMPLETE
2255,2255,0.7621999139678759,2022-12-01 10:35:07.117609,2022-12-01 10:35:26.341255,0 days 00:00:19.223646,"{0: 1, 1: 10}",11.0,,860,COMPLETE
2256,2256,0.7678666049828443,2022-12-01 10:35:26.598113,2022-12-01 10:35:45.317869,0 days 00:00:18.719756,"{0: 1, 1: 10}",11.0,,810,COMPLETE
2257,2257,0.7664064317870352,2022-12-01 10:35:45.560648,2022-12-01 10:36:04.728753,0 days 00:00:19.168105,"{0: 1, 1: 10}",11.0,,860,COMPLETE
2258,2258,0.7715819935107945,2022-12-01 10:36:04.974160,2022-12-01 10:36:23.214703,0 days 00:00:18.240543,"{0: 1, 1: 10}",11.0,,810,COMPLETE
2259,2259,0.7452728673473026,2022-12-01 10:36:23.453605,2022-12-01 10:36:38.875852,0 days 00:00:15.422247,"{0: 1, 1: 10}",11.0,0.6,860,COMPLETE
2260,2260,0.7657110587251486,2022-12-01 10:36:39.126615,2022-12-01 10:36:58.264474,0 days 00:00:19.137859,"{0: 1, 1: 10}",11.0,,860,COMPLETE
2261,2261,0.7650762645439456,2022-12-01 10:36:58.515745,2022-12-01 10:37:16.991965,0 days 00:00:18.476220,"{0: 1, 1: 10}",35.0,,810,COMPLETE
2262,2262,0.7695444601546223,2022-12-01 10:37:17.252109,2022-12-01 10:37:34.947434,0 days 00:00:17.695325,"{0: 1, 1: 10}",11.0,,760,COMPLETE
2263,2263,0.7556215010787078,2022-12-01 10:37:35.197296,2022-12-01 10:37:54.059290,0 days 00:00:18.861994,"{0: 1, 1: 10}",6.0,,860,COMPLETE
2264,2264,0.7665449569650711,2022-12-01 10:37:54.310628,2022-12-01 10:38:12.724205,0 days 00:00:18.413577,"{0: 1, 1: 10}",17.0,,810,COMPLETE
2265,2265,0.7649681055213222,2022-12-01 10:38:12.972442,2022-12-01 10:38:32.183210,0 days 00:00:19.210768,"{0: 1, 1: 10}",15.0,,860,COMPLETE
2266,2266,0.7743267730466723,2022-12-01 10:38:32.439042,2022-12-01 10:38:51.166836,0 days 00:00:18.727794,"{0: 1, 1: 10}",11.0,,810,COMPLETE
2267,2267,0.7696077220543791,2022-12-01 10:38:51.407013,2022-12-01 10:39:08.977777,0 days 00:00:17.570764,"{0: 1, 1: 10}",11.0,,760,COMPLETE
2268,2268,0.7573071850351382,2022-12-01 10:39:09.229472,2022-12-01 10:39:26.331043,0 days 00:00:17.101571,"{0: 1, 1: 10}",4.0,,760,COMPLETE
2269,2269,0.7667242077124989,2022-12-01 10:39:26.577461,2022-12-01 10:39:44.271998,0 days 00:00:17.694537,"{0: 1, 1: 10}",39.0,,760,COMPLETE
2270,2270,0.7560739428162967,2022-12-01 10:39:44.528326,2022-12-01 10:40:01.882468,0 days 00:00:17.354142,"{0: 1, 1: 10}",5.0,,760,COMPLETE
2271,2271,0.7642463268009131,2022-12-01 10:40:02.177960,2022-12-01 10:40:20.497167,0 days 00:00:18.319207,"{0: 1, 1: 10}",11.0,,810,COMPLETE
2272,2272,0.7683993398999023,2022-12-01 10:40:20.747772,2022-12-01 10:40:39.084441,0 days 00:00:18.336669,"{0: 1, 1: 10}",11.0,,810,COMPLETE
2273,2273,0.7548458538153164,2022-12-01 10:40:39.326835,2022-12-01 10:40:55.023356,0 days 00:00:15.696521,"{0: 1, 1: 10}",19.0,0.7,810,COMPLETE
2274,2274,0.766125943564723,2022-12-01 10:40:55.268863,2022-12-01 10:41:12.170141,0 days 00:00:16.901278,"{0: 1, 1: 10}",11.0,,710,COMPLETE
2275,2275,0.7675432816216634,2022-12-01 10:41:12.420763,2022-12-01 10:41:29.992019,0 days 00:00:17.571256,"{0: 1, 1: 10}",29.0,,760,COMPLETE
2276,2276,0.7293132410657129,2022-12-01 10:41:30.242162,2022-12-01 10:41:44.689456,0 days 00:00:14.447294,"{0: 1, 1: 10}",2.0,,760,COMPLETE
2277,2277,0.7638874144662092,2022-12-01 10:41:44.944423,2022-12-01 10:42:03.294298,0 days 00:00:18.349875,"{0: 1, 1: 10}",21.0,,810,COMPLETE
2278,2278,0.7648210773257265,2022-12-01 10:42:03.544153,2022-12-01 10:42:22.132109,0 days 00:00:18.587956,"{0: 1, 1: 10}",20.0,,810,COMPLETE
2279,2279,0.76880067442355,2022-12-01 10:42:22.379937,2022-12-01 10:42:40.793366,0 days 00:00:18.413429,"{0: 1, 1: 10}",26.0,,810,COMPLETE
2280,2280,0.7735287543199715,2022-12-01 10:42:41.042717,2022-12-01 10:42:59.441538,0 days 00:00:18.398821,"{0: 1, 1: 10}",13.0,,810,COMPLETE
2281,2281,0.7671594856771937,2022-12-01 10:42:59.691080,2022-12-01 10:43:18.067367,0 days 00:00:18.376287,"{0: 1, 1: 10}",28.0,,810,COMPLETE
2282,2282,0.7657387349363496,2022-12-01 10:43:18.321433,2022-12-01 10:43:36.869776,0 days 00:00:18.548343,"{0: 1, 1: 10}",11.0,,810,COMPLETE
2283,2283,0.7652934724907331,2022-12-01 10:43:37.119467,2022-12-01 10:43:54.870621,0 days 00:00:17.751154,"{0: 1, 1: 10}",34.0,,760,COMPLETE
2284,2284,0.7677149678624231,2022-12-01 10:43:55.118951,2022-12-01 10:44:13.607374,0 days 00:00:18.488423,"{0: 1, 1: 10}",16.0,,810,COMPLETE
2285,2285,0.7634931858324158,2022-12-01 10:44:13.852778,2022-12-01 10:44:31.489991,0 days 00:00:17.637213,"{0: 1, 1: 10}",11.0,,760,COMPLETE
2286,2286,0.7649380017477926,2022-12-01 10:44:31.749610,2022-12-01 10:44:50.150110,0 days 00:00:18.400500,"{0: 1, 1: 10}",11.0,,810,COMPLETE
2287,2287,0.753808142145945,2022-12-01 10:44:50.411787,2022-12-01 10:45:08.487919,0 days 00:00:18.076132,"{0: 1, 1: 10}",7.0,,810,COMPLETE
2288,2288,0.5922172070853786,2022-12-01 10:45:08.737341,2022-12-01 10:45:20.888538,0 days 00:00:12.151197,"{0: 1, 1: 10}",1.0,,810,COMPLETE
2289,2289,0.7672189487480857,2022-12-01 10:45:21.137868,2022-12-01 10:45:39.606679,0 days 00:00:18.468811,"{0: 1, 1: 10}",12.0,,810,COMPLETE
2290,2290,0.7730175355651887,2022-12-01 10:45:39.854975,2022-12-01 10:45:57.579705,0 days 00:00:17.724730,"{0: 1, 1: 10}",11.0,,760,COMPLETE
2291,2291,0.762044427189173,2022-12-01 10:45:57.830002,2022-12-01 10:46:15.328270,0 days 00:00:17.498268,"{0: 1, 1: 10}",8.0,,760,COMPLETE
2292,2292,0.7654005950680842,2022-12-01 10:46:15.578716,2022-12-01 10:46:34.098141,0 days 00:00:18.519425,"{0: 1, 1: 10}",11.0,,810,COMPLETE
2293,2293,0.7703955052417212,2022-12-01 10:46:34.350806,2022-12-01 10:46:52.750124,0 days 00:00:18.399318,"{0: 1, 1: 10}",11.0,,810,COMPLETE
2294,2294,0.7651948485787743,2022-12-01 10:46:53.002017,2022-12-01 10:47:11.436453,0 days 00:00:18.434436,"{0: 1, 1: 10}",11.0,,810,COMPLETE
2295,2295,0.7686511761356053,2022-12-01 10:47:11.677811,2022-12-01 10:47:30.002378,0 days 00:00:18.324567,"{0: 1, 1: 10}",11.0,,810,COMPLETE
2296,2296,0.7647606152864095,2022-12-01 10:47:30.252210,2022-12-01 10:47:48.820792,0 days 00:00:18.568582,"{0: 1, 1: 10}",34.0,,810,COMPLETE
2297,2297,0.7587492697976878,2022-12-01 10:47:49.063695,2022-12-01 10:48:05.039344,0 days 00:00:15.975649,"{0: 1, 1: 10}",3.0,,760,COMPLETE
2298,2298,0.7652213084179509,2022-12-01 10:48:05.305702,2022-12-01 10:48:24.740655,0 days 00:00:19.434953,"{0: 1, 1: 10}",,,860,COMPLETE
2299,2299,0.7744398683136181,2022-12-01 10:48:24.989919,2022-12-01 10:48:44.150785,0 days 00:00:19.160866,"{0: 1, 1: 10}",10.0,,860,COMPLETE
2300,2300,0.7696655733781419,2022-12-01 10:48:44.407262,2022-12-01 10:49:03.565181,0 days 00:00:19.157919,"{0: 1, 1: 10}",33.0,,860,COMPLETE
2301,2301,0.7703215380261265,2022-12-01 10:49:03.818406,2022-12-01 10:49:22.272148,0 days 00:00:18.453742,"{0: 1, 1: 10}",10.0,,810,COMPLETE
2302,2302,0.7645607437374287,2022-12-01 10:49:22.529779,2022-12-01 10:49:41.678152,0 days 00:00:19.148373,"{0: 1, 1: 10}",10.0,,860,COMPLETE
2303,2303,0.7731008607736376,2022-12-01 10:49:41.922759,2022-12-01 10:50:00.286077,0 days 00:00:18.363318,"{0: 1, 1: 10}",10.0,,810,COMPLETE
2304,2304,0.7717566766192218,2022-12-01 10:50:00.536363,2022-12-01 10:50:19.949476,0 days 00:00:19.413113,"{0: 1, 1: 10}",28.0,,860,COMPLETE
2305,2305,0.7708074007738025,2022-12-01 10:50:20.203006,2022-12-01 10:50:39.344369,0 days 00:00:19.141363,"{0: 1, 1: 10}",10.0,,860,COMPLETE
2306,2306,0.7710908459315512,2022-12-01 10:50:39.600341,2022-12-01 10:50:58.786116,0 days 00:00:19.185775,"{0: 1, 1: 10}",10.0,,860,COMPLETE
2307,2307,0.7667559204633172,2022-12-01 10:50:59.037899,2022-12-01 10:51:17.366352,0 days 00:00:18.328453,"{0: 1, 1: 10}",10.0,,810,COMPLETE
2308,2308,0.7668494298283246,2022-12-01 10:51:17.610810,2022-12-01 10:51:35.927705,0 days 00:00:18.316895,"{0: 1, 1: 10}",10.0,,810,COMPLETE
2309,2309,0.7681887895273696,2022-12-01 10:51:36.177388,2022-12-01 10:51:55.436004,0 days 00:00:19.258616,"{0: 1, 1: 10}",10.0,,860,COMPLETE
2310,2310,0.7676236288401961,2022-12-01 10:51:55.687291,2022-12-01 10:52:13.986180,0 days 00:00:18.298889,"{0: 1, 1: 10}",10.0,,810,COMPLETE
2311,2311,0.7723610109901687,2022-12-01 10:52:14.240302,2022-12-01 10:52:32.729889,0 days 00:00:18.489587,"{0: 1, 1: 10}",10.0,,810,COMPLETE
2312,2312,0.7712697505676387,2022-12-01 10:52:32.976473,2022-12-01 10:52:52.090205,0 days 00:00:19.113732,"{0: 1, 1: 10}",27.0,,860,COMPLETE
2313,2313,0.7673725507579199,2022-12-01 10:52:52.339803,2022-12-01 10:53:11.682934,0 days 00:00:19.343131,"{0: 1, 1: 10}",26.0,,860,COMPLETE
2314,2314,0.7685179756908422,2022-12-01 10:53:11.935809,2022-12-01 10:53:30.264468,0 days 00:00:18.328659,"{0: 1, 1: 10}",10.0,,810,COMPLETE
2315,2315,0.7719847339409879,2022-12-01 10:53:30.524768,2022-12-01 10:53:49.658070,0 days 00:00:19.133302,"{0: 1, 1: 10}",10.0,,860,COMPLETE
2316,2316,0.7705361724398336,2022-12-01 10:53:49.906444,2022-12-01 10:54:09.042110,0 days 00:00:19.135666,"{0: 1, 1: 10}",37.0,,860,COMPLETE
2317,2317,0.7730608692587635,2022-12-01 10:54:09.294471,2022-12-01 10:54:27.837431,0 days 00:00:18.542960,"{0: 1, 1: 10}",10.0,,810,COMPLETE
2318,2318,0.7712722884598133,2022-12-01 10:54:28.093371,2022-12-01 10:54:45.791648,0 days 00:00:17.698277,"{0: 1, 1: 10}",10.0,,760,COMPLETE
2319,2319,0.7715183304414641,2022-12-01 10:54:46.032455,2022-12-01 10:55:05.187896,0 days 00:00:19.155441,"{0: 1, 1: 10}",31.0,,860,COMPLETE
2320,2320,0.7655291105168852,2022-12-01 10:55:05.443816,2022-12-01 10:55:23.899362,0 days 00:00:18.455546,"{0: 1, 1: 10}",25.0,,810,COMPLETE
2321,2321,0.7687770250324726,2022-12-01 10:55:24.154272,2022-12-01 10:55:42.505571,0 days 00:00:18.351299,"{0: 1, 1: 10}",10.0,,810,COMPLETE
2322,2322,0.7650303338764989,2022-12-01 10:55:42.755705,2022-12-01 10:56:01.951122,0 days 00:00:19.195417,"{0: 1, 1: 10}",38.0,,860,COMPLETE
2323,2323,0.766103853864616,2022-12-01 10:56:02.201978,2022-12-01 10:56:21.416226,0 days 00:00:19.214248,"{0: 1, 1: 10}",16.0,,860,COMPLETE
2324,2324,0.7669228292600507,2022-12-01 10:56:21.671311,2022-12-01 10:56:40.054588,0 days 00:00:18.383277,"{0: 1, 1: 10}",18.0,,810,COMPLETE
2325,2325,0.7710267075655468,2022-12-01 10:56:40.314670,2022-12-01 10:56:57.831676,0 days 00:00:17.517006,"{0: 1, 1: 10}",10.0,,760,COMPLETE
2326,2326,0.7651849175378528,2022-12-01 10:56:58.082855,2022-12-01 10:57:17.103761,0 days 00:00:19.020906,"{0: 1, 1: 10}",9.0,,860,COMPLETE
2327,2327,0.7672067339572688,2022-12-01 10:57:17.366708,2022-12-01 10:57:35.887977,0 days 00:00:18.521269,"{0: 1, 1: 10}",34.0,,810,COMPLETE
2328,2328,0.7579026738810936,2022-12-01 10:57:36.148641,2022-12-01 10:57:54.807365,0 days 00:00:18.658724,"{0: 1, 1: 10}",4.0,,860,COMPLETE
2329,2329,0.7680380882379364,2022-12-01 10:57:55.064444,2022-12-01 10:58:13.577248,0 days 00:00:18.512804,"{0: 1, 1: 10}",35.0,,810,COMPLETE
2330,2330,0.7663849535810341,2022-12-01 10:58:13.826810,2022-12-01 10:58:33.135833,0 days 00:00:19.309023,"{0: 1, 1: 10}",14.0,,860,COMPLETE
2331,2331,0.7663630321553033,2022-12-01 10:58:33.385914,2022-12-01 10:58:50.948002,0 days 00:00:17.562088,"{0: 1, 1: 10}",10.0,,760,COMPLETE
