,number,value,datetime_start,datetime_complete,duration,params_class_weight,params_max_depth,params_max_features,params_n_estimators,state
0,0,0.7512598882218569,2022-12-01 00:35:43.253266,2022-12-01 00:35:59.921979,0 days 00:00:16.668713,,5.0,0.9,460,COMPLETE
1,1,0.758850989597279,2022-12-01 00:36:00.163616,2022-12-01 00:36:13.455324,0 days 00:00:13.291708,"{0: 1, 1: 10}",18.0,0.8,560,COMPLETE
2,2,0.6343481818809276,2022-12-01 00:36:13.862453,2022-12-01 00:36:29.027539,0 days 00:00:15.165086,balanced,,1.0,710,COMPLETE
3,3,0.6340959097286402,2022-12-01 00:36:29.225820,2022-12-01 00:36:40.439183,0 days 00:00:11.213363,"{0: 1, 1: 100}",30.0,,260,COMPLETE
4,4,0.6750708249247472,2022-12-01 00:36:40.641344,2022-12-01 00:36:47.594754,0 days 00:00:06.953410,"{0: 1, 1: 10}",9.0,sqrt,110,COMPLETE
5,5,0.6533903591614924,2022-12-01 00:36:47.848322,2022-12-01 00:36:58.768429,0 days 00:00:10.920107,balanced,2.0,1.0,410,COMPLETE
6,6,0.6408282267314045,2022-12-01 00:36:58.973847,2022-12-01 00:37:10.741467,0 days 00:00:11.767620,balanced,24.0,0.9,560,COMPLETE
7,7,0.6646184389392455,2022-12-01 00:37:10.943351,2022-12-01 00:37:17.780571,0 days 00:00:06.837220,balanced,19.0,0.6,60,COMPLETE
8,8,0.6444648400785413,2022-12-01 00:37:17.995084,2022-12-01 00:37:27.148360,0 days 00:00:09.153276,balanced,,0.9,310,COMPLETE
9,9,0.7365653422521422,2022-12-01 00:37:27.351570,2022-12-01 00:37:41.371926,0 days 00:00:14.020356,,33.0,0.8,360,COMPLETE
10,10,0.7367258873923921,2022-12-01 00:37:42.073541,2022-12-01 00:37:53.142537,0 days 00:00:11.068996,,10.0,0.6,260,COMPLETE
11,11,0.7343047768062185,2022-12-01 00:37:53.343571,2022-12-01 00:38:21.350061,0 days 00:00:28.006490,,8.0,1.0,810,COMPLETE
12,12,0.6548008505809422,2022-12-01 00:38:21.558521,2022-12-01 00:38:32.525140,0 days 00:00:10.966619,balanced,14.0,0.7,560,COMPLETE
13,13,0.7328666509235078,2022-12-01 00:38:32.739060,2022-12-01 00:38:49.002537,0 days 00:00:16.263477,,36.0,0.7,510,COMPLETE
14,14,0.7107460680165187,2022-12-01 00:38:49.202607,2022-12-01 00:38:59.014471,0 days 00:00:09.811864,balanced,29.0,sqrt,960,COMPLETE
15,15,0.6536069019151152,2022-12-01 00:38:59.218792,2022-12-01 00:39:13.622478,0 days 00:00:14.403686,balanced,21.0,0.7,910,COMPLETE
16,16,0.6517764090750193,2022-12-01 00:39:13.842968,2022-12-01 00:39:20.709589,0 days 00:00:06.866621,,1.0,0.7,110,COMPLETE
17,17,0.6581242763402166,2022-12-01 00:39:20.894948,2022-12-01 00:39:27.675666,0 days 00:00:06.780718,,2.0,0.6,10,COMPLETE
18,18,0.6460644742748435,2022-12-01 00:39:28.153446,2022-12-01 00:39:41.327744,0 days 00:00:13.174298,"{0: 1, 1: 100}",15.0,0.9,660,COMPLETE
19,19,0.6416456227707895,2022-12-01 00:39:41.530192,2022-12-01 00:39:57.922669,0 days 00:00:16.392477,"{0: 1, 1: 100}",12.0,,960,COMPLETE
20,20,0.7358098959458179,2022-12-01 00:39:58.122757,2022-12-01 00:40:12.273982,0 days 00:00:14.151225,,27.0,1.0,310,COMPLETE
21,21,0.6431336556738305,2022-12-01 00:40:12.478844,2022-12-01 00:40:26.416783,0 days 00:00:13.937939,balanced,38.0,,710,COMPLETE
22,22,0.7614479819590664,2022-12-01 00:40:26.631619,2022-12-01 00:40:35.519418,0 days 00:00:08.887799,"{0: 1, 1: 10}",33.0,,210,COMPLETE
23,23,0.768725587959566,2022-12-01 00:40:35.722061,2022-12-01 00:40:52.145031,0 days 00:00:16.422970,"{0: 1, 1: 10}",31.0,0.9,760,COMPLETE
24,24,0.6609330481764848,2022-12-01 00:40:52.345026,2022-12-01 00:41:05.855188,0 days 00:00:13.510162,"{0: 1, 1: 100}",32.0,0.6,910,COMPLETE
25,25,0.7168458662888108,2022-12-01 00:41:06.060150,2022-12-01 00:41:14.086588,0 days 00:00:08.026438,"{0: 1, 1: 100}",36.0,sqrt,510,COMPLETE
26,26,0.664953685001672,2022-12-01 00:41:14.292248,2022-12-01 00:41:22.321972,0 days 00:00:08.029724,balanced,25.0,0.6,260,COMPLETE
27,27,0.767797961127275,2022-12-01 00:41:22.526605,2022-12-01 00:41:36.786392,0 days 00:00:14.259787,"{0: 1, 1: 10}",10.0,0.9,610,COMPLETE
28,28,0.5922933839742572,2022-12-01 00:41:36.992662,2022-12-01 00:41:47.846230,0 days 00:00:10.853568,balanced,8.0,1.0,460,COMPLETE
29,29,0.6387709492188209,2022-12-01 00:41:48.131479,2022-12-01 00:42:03.441890,0 days 00:00:15.310411,balanced,24.0,1.0,810,COMPLETE
30,30,0.6299557943379616,2022-12-01 00:42:03.641236,2022-12-01 00:42:10.857206,0 days 00:00:07.215970,balanced,23.0,log2,160,COMPLETE
31,31,0.7551380595734332,2022-12-01 00:42:11.065141,2022-12-01 00:42:23.722386,0 days 00:00:12.657245,"{0: 1, 1: 10}",7.0,,460,COMPLETE
32,32,0.6384741856946696,2022-12-01 00:42:23.927046,2022-12-01 00:42:36.962770,0 days 00:00:13.035724,balanced,17.0,1.0,610,COMPLETE
33,33,0.7551797750229077,2022-12-01 00:42:37.168312,2022-12-01 00:42:53.568507,0 days 00:00:16.400195,"{0: 1, 1: 10}",5.0,1.0,710,COMPLETE
34,34,0.6628467310750266,2022-12-01 00:42:53.772151,2022-12-01 00:43:01.014435,0 days 00:00:07.242284,"{0: 1, 1: 100}",24.0,0.6,160,COMPLETE
35,35,0.6282249714341638,2022-12-01 00:43:01.224813,2022-12-01 00:43:08.213566,0 days 00:00:06.988753,"{0: 1, 1: 100}",1.0,0.8,110,COMPLETE
36,36,0.7620839716654155,2022-12-01 00:43:08.506500,2022-12-01 00:43:26.490263,0 days 00:00:17.983763,"{0: 1, 1: 10}",21.0,0.8,810,COMPLETE
37,37,0.7557193421146124,2022-12-01 00:43:26.688605,2022-12-01 00:43:38.908691,0 days 00:00:12.220086,"{0: 1, 1: 10}",29.0,0.9,460,COMPLETE
38,38,0.7656937489345129,2022-12-01 00:43:39.112957,2022-12-01 00:43:54.952899,0 days 00:00:15.839942,"{0: 1, 1: 10}",31.0,1.0,660,COMPLETE
39,39,0.7521000210299207,2022-12-01 00:43:55.150901,2022-12-01 00:44:02.404100,0 days 00:00:07.253199,"{0: 1, 1: 10}",13.0,0.8,110,COMPLETE
40,40,0.6614233266613695,2022-12-01 00:44:02.603263,2022-12-01 00:44:15.616599,0 days 00:00:13.013336,"{0: 1, 1: 100}",20.0,0.6,860,COMPLETE
41,41,0.6357387481855385,2022-12-01 00:44:15.874448,2022-12-01 00:44:29.556651,0 days 00:00:13.682203,"{0: 1, 1: 100}",38.0,,710,COMPLETE
42,42,0.5763936372775997,2022-12-01 00:44:29.759149,2022-12-01 00:44:39.108398,0 days 00:00:09.349249,"{0: 1, 1: 10}",36.0,log2,860,COMPLETE
43,43,0.7452424723410033,2022-12-01 00:44:39.308305,2022-12-01 00:44:51.048737,0 days 00:00:11.740432,"{0: 1, 1: 10}",14.0,0.7,510,COMPLETE
44,44,0.6369248724562709,2022-12-01 00:44:51.250296,2022-12-01 00:45:05.717470,0 days 00:00:14.467174,balanced,21.0,,760,COMPLETE
45,45,0.6772670030753893,2022-12-01 00:45:05.920918,2022-12-01 00:45:13.318970,0 days 00:00:07.398052,"{0: 1, 1: 10}",11.0,sqrt,310,COMPLETE
46,46,0.6625665474824756,2022-12-01 00:45:13.517057,2022-12-01 00:45:22.441923,0 days 00:00:08.924866,"{0: 1, 1: 100}",25.0,0.7,360,COMPLETE
47,47,0.7371163655929427,2022-12-01 00:45:22.644701,2022-12-01 00:45:38.332600,0 days 00:00:15.687899,,35.0,,360,COMPLETE
48,48,0.6042635099786662,2022-12-01 00:45:38.533962,2022-12-01 00:45:45.501478,0 days 00:00:06.967516,"{0: 1, 1: 10}",25.0,log2,60,COMPLETE
49,49,0.6686004294039354,2022-12-01 00:45:45.700922,2022-12-01 00:45:55.989657,0 days 00:00:10.288735,balanced,19.0,0.6,510,COMPLETE
50,50,0.6359058861808997,2022-12-01 00:45:56.189515,2022-12-01 00:46:09.475123,0 days 00:00:13.285608,balanced,16.0,,660,COMPLETE
51,51,0.7509292974872008,2022-12-01 00:46:09.678138,2022-12-01 00:46:17.119954,0 days 00:00:07.441816,"{0: 1, 1: 10}",36.0,,110,COMPLETE
52,52,0.7584221263854258,2022-12-01 00:46:17.326380,2022-12-01 00:46:28.386811,0 days 00:00:11.060431,"{0: 1, 1: 10}",28.0,0.8,410,COMPLETE
53,53,0.6087232168896448,2022-12-01 00:46:28.590717,2022-12-01 00:46:43.365892,0 days 00:00:14.775175,"{0: 1, 1: 100}",3.0,,910,COMPLETE
54,54,0.6469198280741572,2022-12-01 00:46:43.568387,2022-12-01 00:46:50.772582,0 days 00:00:07.204195,"{0: 1, 1: 100}",,log2,310,COMPLETE
55,55,0.6578245379603119,2022-12-01 00:46:50.976884,2022-12-01 00:47:02.113453,0 days 00:00:11.136569,"{0: 1, 1: 100}",19.0,0.6,660,COMPLETE
56,56,0.7525292041964768,2022-12-01 00:47:02.325521,2022-12-01 00:47:20.696495,0 days 00:00:18.370974,,6.0,,460,COMPLETE
57,57,0.6052848765290372,2022-12-01 00:47:20.897050,2022-12-01 00:47:29.479409,0 days 00:00:08.582359,"{0: 1, 1: 10}",23.0,log2,660,COMPLETE
58,58,0.6019978288619703,2022-12-01 00:47:29.677865,2022-12-01 00:47:36.386237,0 days 00:00:06.708372,balanced,,0.8,10,COMPLETE
59,59,0.76293950346282,2022-12-01 00:47:36.587367,2022-12-01 00:47:46.250160,0 days 00:00:09.662793,"{0: 1, 1: 10}",24.0,1.0,260,COMPLETE
60,60,0.6808794438409556,2022-12-01 00:47:46.437987,2022-12-01 00:47:53.309404,0 days 00:00:06.871417,"{0: 1, 1: 10}",21.0,0.7,10,COMPLETE
61,61,0.6207109653478349,2022-12-01 00:47:53.512914,2022-12-01 00:48:00.430972,0 days 00:00:06.918058,balanced,4.0,0.6,110,COMPLETE
62,62,0.6526018653000673,2022-12-01 00:48:00.628147,2022-12-01 00:48:15.045963,0 days 00:00:14.417816,balanced,36.0,0.7,910,COMPLETE
63,63,0.6075864538469842,2022-12-01 00:48:15.250297,2022-12-01 00:48:26.503554,0 days 00:00:11.253257,balanced,9.0,0.8,560,COMPLETE
64,64,0.6018175086293305,2022-12-01 00:48:26.706717,2022-12-01 00:48:36.932396,0 days 00:00:10.225679,balanced,5.0,0.7,510,COMPLETE
65,65,0.7189988074139425,2022-12-01 00:48:37.155965,2022-12-01 00:48:46.715502,0 days 00:00:09.559537,"{0: 1, 1: 100}",31.0,sqrt,910,COMPLETE
66,66,0.7526551816002189,2022-12-01 00:48:46.924139,2022-12-01 00:48:58.615417,0 days 00:00:11.691278,"{0: 1, 1: 10}",21.0,0.8,460,COMPLETE
67,67,0.6358882819924181,2022-12-01 00:48:58.824448,2022-12-01 00:49:06.571445,0 days 00:00:07.746997,,19.0,sqrt,460,COMPLETE
68,68,0.6243524787878739,2022-12-01 00:49:06.775347,2022-12-01 00:49:14.182307,0 days 00:00:07.406960,balanced,14.0,log2,310,COMPLETE
69,69,0.735424892038415,2022-12-01 00:49:14.385756,2022-12-01 00:49:36.387888,0 days 00:00:22.002132,,29.0,0.8,710,COMPLETE
70,70,0.7076219360490279,2022-12-01 00:49:36.592083,2022-12-01 00:49:45.837905,0 days 00:00:09.245822,balanced,19.0,sqrt,860,COMPLETE
71,71,0.593127483629108,2022-12-01 00:49:46.047083,2022-12-01 00:49:56.165453,0 days 00:00:10.118370,"{0: 1, 1: 100}",5.0,0.7,510,COMPLETE
72,72,0.7339603701723589,2022-12-01 00:49:56.365518,2022-12-01 00:50:16.013690,0 days 00:00:19.648172,,33.0,,510,COMPLETE
73,73,0.7536914325589203,2022-12-01 00:50:16.217139,2022-12-01 00:50:25.060150,0 days 00:00:08.843011,"{0: 1, 1: 10}",5.0,,210,COMPLETE
74,74,0.640319165013122,2022-12-01 00:50:25.509065,2022-12-01 00:50:42.859186,0 days 00:00:17.350121,"{0: 1, 1: 100}",31.0,,960,COMPLETE
75,75,0.6460078431783653,2022-12-01 00:50:43.364450,2022-12-01 00:50:53.752806,0 days 00:00:10.388356,balanced,3.0,sqrt,910,COMPLETE
76,76,0.7691808192541577,2022-12-01 00:50:53.958970,2022-12-01 00:51:11.334374,0 days 00:00:17.375404,"{0: 1, 1: 10}",37.0,1.0,760,COMPLETE
77,77,0.662433106280429,2022-12-01 00:51:11.543805,2022-12-01 00:51:20.899101,0 days 00:00:09.355296,balanced,31.0,0.6,410,COMPLETE
78,78,0.7410118609054859,2022-12-01 00:51:21.106515,2022-12-01 00:51:28.482472,0 days 00:00:07.375957,,27.0,,60,COMPLETE
79,79,0.6616223800028839,2022-12-01 00:51:28.688115,2022-12-01 00:51:36.513876,0 days 00:00:07.825761,balanced,38.0,0.7,210,COMPLETE
80,80,0.6499555429987235,2022-12-01 00:51:36.718928,2022-12-01 00:51:51.432211,0 days 00:00:14.713283,"{0: 1, 1: 100}",22.0,0.9,860,COMPLETE
81,81,0.7341452914608474,2022-12-01 00:51:51.638157,2022-12-01 00:52:09.014983,0 days 00:00:17.376826,,33.0,0.9,460,COMPLETE
82,82,0.7399644583484973,2022-12-01 00:52:09.217035,2022-12-01 00:52:17.808872,0 days 00:00:08.591837,,7.0,1.0,110,COMPLETE
83,83,0.6461987300779171,2022-12-01 00:52:18.012015,2022-12-01 00:52:26.406263,0 days 00:00:08.394248,"{0: 1, 1: 100}",19.0,0.9,260,COMPLETE
84,84,0.6769399892506797,2022-12-01 00:52:26.611590,2022-12-01 00:52:35.837174,0 days 00:00:09.225584,"{0: 1, 1: 10}",22.0,sqrt,810,COMPLETE
85,85,0.6409319051886005,2022-12-01 00:52:36.038179,2022-12-01 00:52:51.283459,0 days 00:00:15.245280,balanced,25.0,,810,COMPLETE
86,86,0.6369913696639089,2022-12-01 00:52:51.484073,2022-12-01 00:53:01.698494,0 days 00:00:10.214421,"{0: 1, 1: 10}",10.0,log2,960,COMPLETE
87,87,0.6628880229921635,2022-12-01 00:53:01.907931,2022-12-01 00:53:08.973673,0 days 00:00:07.065742,"{0: 1, 1: 10}",14.0,sqrt,160,COMPLETE
88,88,0.6070964994838919,2022-12-01 00:53:09.180075,2022-12-01 00:53:18.179704,0 days 00:00:08.999629,"{0: 1, 1: 100}",6.0,,310,COMPLETE
89,89,0.7379283025979007,2022-12-01 00:53:18.385139,2022-12-01 00:53:34.364102,0 days 00:00:15.978963,,11.0,0.6,560,COMPLETE
90,90,0.6495768247682292,2022-12-01 00:53:34.563573,2022-12-01 00:53:48.227199,0 days 00:00:13.663626,"{0: 1, 1: 100}",38.0,0.9,760,COMPLETE
91,91,0.6312503813444588,2022-12-01 00:53:48.432175,2022-12-01 00:53:57.979143,0 days 00:00:09.546968,,7.0,log2,660,COMPLETE
92,92,0.5987687508811768,2022-12-01 00:53:58.185741,2022-12-01 00:54:12.493459,0 days 00:00:14.307718,balanced,8.0,0.8,860,COMPLETE
93,93,0.6392956695651895,2022-12-01 00:54:12.704392,2022-12-01 00:54:26.666254,0 days 00:00:13.961862,balanced,30.0,0.9,760,COMPLETE
94,94,0.6482431368364627,2022-12-01 00:54:26.868023,2022-12-01 00:54:34.363663,0 days 00:00:07.495640,balanced,22.0,0.9,160,COMPLETE
95,95,0.7187534935562025,2022-12-01 00:54:34.557878,2022-12-01 00:54:45.758683,0 days 00:00:11.200805,,3.0,0.7,410,COMPLETE
96,96,0.6326016086265545,2022-12-01 00:54:45.958381,2022-12-01 00:54:53.695848,0 days 00:00:07.737467,,21.0,sqrt,460,COMPLETE
97,97,0.6554710744717853,2022-12-01 00:54:53.905619,2022-12-01 00:55:00.806704,0 days 00:00:06.901085,balanced,24.0,sqrt,10,COMPLETE
98,98,0.7064647190463867,2022-12-01 00:55:01.014774,2022-12-01 00:55:08.209067,0 days 00:00:07.194293,balanced,23.0,sqrt,310,COMPLETE
99,99,0.6145462960123965,2022-12-01 00:55:08.414657,2022-12-01 00:55:19.655547,0 days 00:00:11.240890,"{0: 1, 1: 100}",9.0,0.7,610,COMPLETE
100,100,0.6414694300480764,2022-12-01 00:55:19.858523,2022-12-01 00:55:34.660171,0 days 00:00:14.801648,"{0: 1, 1: 100}",24.0,1.0,810,COMPLETE
101,101,0.7072803017327749,2022-12-01 00:55:34.865459,2022-12-01 00:55:43.293144,0 days 00:00:08.427685,balanced,20.0,sqrt,610,COMPLETE
102,102,0.677413736443529,2022-12-01 00:55:43.500531,2022-12-01 00:55:50.585468,0 days 00:00:07.084937,"{0: 1, 1: 100}",9.0,sqrt,160,COMPLETE
103,103,0.7623785685913693,2022-12-01 00:55:50.792224,2022-12-01 00:56:05.002615,0 days 00:00:14.210391,"{0: 1, 1: 10}",24.0,1.0,560,COMPLETE
104,104,0.6782935000496562,2022-12-01 00:56:05.219979,2022-12-01 00:56:14.665928,0 days 00:00:09.445949,"{0: 1, 1: 100}",11.0,sqrt,960,COMPLETE
105,105,0.7143722795320866,2022-12-01 00:56:14.871902,2022-12-01 00:56:21.763021,0 days 00:00:06.891119,"{0: 1, 1: 10}",,,10,COMPLETE
106,106,0.6425493123466232,2022-12-01 00:56:21.963329,2022-12-01 00:56:37.021867,0 days 00:00:15.058538,balanced,25.0,0.8,910,COMPLETE
107,107,0.6315500952735907,2022-12-01 00:56:37.224482,2022-12-01 00:56:51.814851,0 days 00:00:14.590369,"{0: 1, 1: 100}",11.0,,810,COMPLETE
108,108,0.63778585616537,2022-12-01 00:56:52.019619,2022-12-01 00:57:08.156050,0 days 00:00:16.136431,balanced,12.0,,910,COMPLETE
109,109,0.7140680699960598,2022-12-01 00:57:08.357288,2022-12-01 00:57:23.332141,0 days 00:00:14.974853,,2.0,0.7,960,COMPLETE
110,110,0.6860980242651078,2022-12-01 00:57:23.537607,2022-12-01 00:57:30.567202,0 days 00:00:07.029595,"{0: 1, 1: 10}",7.0,sqrt,210,COMPLETE
111,111,0.6109168969137849,2022-12-01 00:57:30.771627,2022-12-01 00:57:42.634668,0 days 00:00:11.863041,"{0: 1, 1: 100}",3.0,0.7,760,COMPLETE
112,112,0.7224601757327207,2022-12-01 00:57:42.840102,2022-12-01 00:57:49.750748,0 days 00:00:06.910646,"{0: 1, 1: 100}",32.0,sqrt,110,COMPLETE
113,113,0.7479610215466896,2022-12-01 00:57:49.958268,2022-12-01 00:58:05.397686,0 days 00:00:15.439418,"{0: 1, 1: 10}",5.0,0.6,910,COMPLETE
114,114,0.6565659728080518,2022-12-01 00:58:05.596605,2022-12-01 00:58:14.131809,0 days 00:00:08.535204,"{0: 1, 1: 100}",16.0,0.7,310,COMPLETE
115,115,0.653753979245474,2022-12-01 00:58:14.333697,2022-12-01 00:58:23.890655,0 days 00:00:09.556958,"{0: 1, 1: 100}",30.0,log2,960,COMPLETE
116,116,0.7333587104409625,2022-12-01 00:58:24.094859,2022-12-01 00:58:42.971817,0 days 00:00:18.876958,,35.0,0.6,710,COMPLETE
117,117,0.6574061030707177,2022-12-01 00:58:43.176784,2022-12-01 00:58:51.743580,0 days 00:00:08.566796,"{0: 1, 1: 100}",29.0,0.7,310,COMPLETE
118,118,0.7335764582291043,2022-12-01 00:58:51.949643,2022-12-01 00:59:04.269052,0 days 00:00:12.319409,,32.0,0.6,360,COMPLETE
119,119,0.6563010897474368,2022-12-01 00:59:04.474533,2022-12-01 00:59:18.492301,0 days 00:00:14.017768,balanced,25.0,0.7,860,COMPLETE
120,120,0.7349000930622382,2022-12-01 00:59:18.693558,2022-12-01 00:59:41.229001,0 days 00:00:22.535443,,38.0,0.7,810,COMPLETE
121,121,0.6285356554247913,2022-12-01 00:59:41.433175,2022-12-01 00:59:48.555542,0 days 00:00:07.122367,balanced,13.0,sqrt,10,COMPLETE
122,122,0.5745285697048778,2022-12-01 00:59:48.762089,2022-12-01 00:59:56.117140,0 days 00:00:07.355051,"{0: 1, 1: 10}",30.0,log2,310,COMPLETE
123,123,0.6281124142511298,2022-12-01 00:59:56.334660,2022-12-01 01:00:03.978986,0 days 00:00:07.644326,,4.0,log2,260,COMPLETE
124,124,0.7610720195879448,2022-12-01 01:00:04.185250,2022-12-01 01:00:19.211802,0 days 00:00:15.026552,"{0: 1, 1: 10}",30.0,0.9,660,COMPLETE
125,125,0.5991622299209899,2022-12-01 01:00:19.414811,2022-12-01 01:00:28.389778,0 days 00:00:08.974967,"{0: 1, 1: 100}",6.0,0.6,410,COMPLETE
126,126,0.6365316203172676,2022-12-01 01:00:28.593416,2022-12-01 01:00:35.650010,0 days 00:00:07.056594,"{0: 1, 1: 100}",34.0,,60,COMPLETE
127,127,0.733715597538389,2022-12-01 01:00:35.853062,2022-12-01 01:00:54.524385,0 days 00:00:18.671323,,10.0,0.6,710,COMPLETE
128,128,0.7529208110201439,2022-12-01 01:00:54.724548,2022-12-01 01:01:04.647218,0 days 00:00:09.922670,,4.0,0.7,260,COMPLETE
129,129,0.6729480327281366,2022-12-01 01:01:04.854879,2022-12-01 01:01:11.789989,0 days 00:00:06.935110,balanced,7.0,sqrt,210,COMPLETE
130,130,0.5887799339155144,2022-12-01 01:01:11.994954,2022-12-01 01:01:20.091049,0 days 00:00:08.096095,"{0: 1, 1: 10}",26.0,log2,560,COMPLETE
131,131,0.6569653212570038,2022-12-01 01:01:20.293530,2022-12-01 01:01:28.995638,0 days 00:00:08.702108,balanced,33.0,0.7,310,COMPLETE
132,132,0.7425201028145559,2022-12-01 01:01:29.201365,2022-12-01 01:01:37.271383,0 days 00:00:08.070018,,15.0,0.7,110,COMPLETE
133,133,0.6209469663822376,2022-12-01 01:01:37.476398,2022-12-01 01:01:52.822208,0 days 00:00:15.345810,"{0: 1, 1: 100}",3.0,1.0,960,COMPLETE
134,134,0.6683809346645108,2022-12-01 01:01:53.028718,2022-12-01 01:02:05.593932,0 days 00:00:12.565214,balanced,33.0,0.6,760,COMPLETE
135,135,0.679506893170977,2022-12-01 01:02:05.796789,2022-12-01 01:02:15.028861,0 days 00:00:09.232072,"{0: 1, 1: 10}",30.0,sqrt,810,COMPLETE
136,136,0.6381061575800623,2022-12-01 01:02:15.232309,2022-12-01 01:02:31.826213,0 days 00:00:16.593904,balanced,22.0,,910,COMPLETE
137,137,0.6570387112891938,2022-12-01 01:02:32.030802,2022-12-01 01:02:40.078110,0 days 00:00:08.047308,,7.0,sqrt,510,COMPLETE
138,138,0.7521270840603063,2022-12-01 01:02:40.281563,2022-12-01 01:02:48.527902,0 days 00:00:08.246339,"{0: 1, 1: 10}",17.0,,160,COMPLETE
139,139,0.7587101668642209,2022-12-01 01:02:48.734415,2022-12-01 01:03:03.859306,0 days 00:00:15.124891,"{0: 1, 1: 10}",8.0,0.9,660,COMPLETE
140,140,0.6230061800004316,2022-12-01 01:03:04.064674,2022-12-01 01:03:10.834247,0 days 00:00:06.769573,balanced,14.0,0.8,10,COMPLETE
141,141,0.7416991319472845,2022-12-01 01:03:11.039069,2022-12-01 01:03:26.454411,0 days 00:00:15.415342,"{0: 1, 1: 10}",29.0,0.7,810,COMPLETE
142,142,0.6046609236005528,2022-12-01 01:03:26.661822,2022-12-01 01:03:34.361289,0 days 00:00:07.699467,balanced,24.0,log2,110,COMPLETE
143,143,0.6390354661255472,2022-12-01 01:03:34.566572,2022-12-01 01:03:45.351273,0 days 00:00:10.784701,balanced,38.0,0.9,460,COMPLETE
144,144,0.734625247142749,2022-12-01 01:03:45.556472,2022-12-01 01:03:55.660491,0 days 00:00:10.104019,,18.0,1.0,160,COMPLETE
145,145,0.6551183328118746,2022-12-01 01:03:55.866303,2022-12-01 01:04:03.278386,0 days 00:00:07.412083,balanced,,0.7,160,COMPLETE
146,146,0.7353733168540088,2022-12-01 01:04:03.481480,2022-12-01 01:04:23.247178,0 days 00:00:19.765698,,13.0,,510,COMPLETE
147,147,0.7329589620925991,2022-12-01 01:04:23.456257,2022-12-01 01:04:33.526116,0 days 00:00:10.069859,,22.0,,160,COMPLETE
148,148,0.7100152707202111,2022-12-01 01:04:33.749913,2022-12-01 01:04:42.839657,0 days 00:00:09.089744,balanced,33.0,sqrt,810,COMPLETE
149,149,0.6592646444448077,2022-12-01 01:04:43.039862,2022-12-01 01:04:52.810627,0 days 00:00:09.770765,"{0: 1, 1: 100}",,log2,910,COMPLETE
150,150,0.7501744555600978,2022-12-01 01:04:53.019983,2022-12-01 01:05:03.379998,0 days 00:00:10.360015,"{0: 1, 1: 10}",18.0,1.0,310,COMPLETE
151,151,0.6530467317437141,2022-12-01 01:05:03.584804,2022-12-01 01:05:10.602225,0 days 00:00:07.017421,"{0: 1, 1: 100}",29.0,0.6,110,COMPLETE
152,152,0.7477127025075936,2022-12-01 01:05:10.787330,2022-12-01 01:05:25.784481,0 days 00:00:14.997151,"{0: 1, 1: 10}",30.0,0.7,760,COMPLETE
153,153,0.6540104921309453,2022-12-01 01:05:25.989073,2022-12-01 01:05:39.807019,0 days 00:00:13.817946,"{0: 1, 1: 100}",22.0,0.8,810,COMPLETE
154,154,0.7346457957869532,2022-12-01 01:05:40.020066,2022-12-01 01:06:06.762390,0 days 00:00:26.742324,,39.0,0.8,910,COMPLETE
155,155,0.6427978605261072,2022-12-01 01:06:06.969824,2022-12-01 01:06:16.161739,0 days 00:00:09.191915,,11.0,sqrt,810,COMPLETE
156,156,0.6688307998277022,2022-12-01 01:06:16.366129,2022-12-01 01:06:23.363072,0 days 00:00:06.996943,balanced,6.0,sqrt,160,COMPLETE
157,157,0.7185773384041326,2022-12-01 01:06:23.571115,2022-12-01 01:06:38.261197,0 days 00:00:14.690082,,2.0,1.0,710,COMPLETE
158,158,0.6780869666025888,2022-12-01 01:06:38.461067,2022-12-01 01:06:47.425817,0 days 00:00:08.964750,"{0: 1, 1: 10}",28.0,sqrt,760,COMPLETE
159,159,0.7426747208479354,2022-12-01 01:06:47.631321,2022-12-01 01:07:00.599516,0 days 00:00:12.968195,,6.0,0.6,410,COMPLETE
160,160,0.7356725267742152,2022-12-01 01:07:00.804598,2022-12-01 01:07:23.258475,0 days 00:00:22.453877,,28.0,1.0,610,COMPLETE
