,number,value,datetime_start,datetime_complete,duration,params_class_weight,params_max_depth,params_max_features,params_n_estimators,state
1418,1418,0.7695882105574314,2022-12-01 06:11:15.774286,2022-12-01 06:11:35.556894,0 days 00:00:19.782608,"{0: 1, 1: 10}",19.0,1.0,910,COMPLETE
1419,1419,0.7674295389788763,2022-12-01 06:11:35.787847,2022-12-01 06:11:55.634189,0 days 00:00:19.846342,"{0: 1, 1: 10}",11.0,1.0,910,COMPLETE
1420,1420,0.7730812120917413,2022-12-01 06:11:55.871854,2022-12-01 06:12:15.791858,0 days 00:00:19.920004,"{0: 1, 1: 10}",32.0,1.0,910,COMPLETE
1421,1421,0.7662026338925922,2022-12-01 06:12:16.018780,2022-12-01 06:12:35.847907,0 days 00:00:19.829127,"{0: 1, 1: 10}",32.0,1.0,910,COMPLETE
1422,1422,0.7282856013221265,2022-12-01 06:12:36.088351,2022-12-01 06:12:51.946623,0 days 00:00:15.858272,"{0: 1, 1: 10}",2.0,1.0,910,COMPLETE
1423,1423,0.7694807069125246,2022-12-01 06:12:52.190021,2022-12-01 06:13:11.954718,0 days 00:00:19.764697,"{0: 1, 1: 10}",32.0,1.0,910,COMPLETE
1424,1424,0.7672485503634718,2022-12-01 06:13:12.189076,2022-12-01 06:13:32.180604,0 days 00:00:19.991528,"{0: 1, 1: 10}",32.0,1.0,910,COMPLETE
1425,1425,0.7664612938020111,2022-12-01 06:13:32.407402,2022-12-01 06:13:52.299544,0 days 00:00:19.892142,"{0: 1, 1: 10}",13.0,1.0,910,COMPLETE
1426,1426,0.7651804601058483,2022-12-01 06:13:52.538091,2022-12-01 06:14:12.416924,0 days 00:00:19.878833,"{0: 1, 1: 10}",26.0,1.0,910,COMPLETE
1427,1427,0.7699286266737865,2022-12-01 06:14:12.655397,2022-12-01 06:14:32.754520,0 days 00:00:20.099123,"{0: 1, 1: 10}",21.0,1.0,910,COMPLETE
1428,1428,0.7594795958740945,2022-12-01 06:14:32.989990,2022-12-01 06:14:52.641299,0 days 00:00:19.651309,"{0: 1, 1: 10}",8.0,1.0,910,COMPLETE
1429,1429,0.7582730527048922,2022-12-01 06:14:52.870502,2022-12-01 06:15:12.656254,0 days 00:00:19.785752,"{0: 1, 1: 10}",7.0,1.0,910,COMPLETE
1430,1430,0.7682923517115898,2022-12-01 06:15:12.885281,2022-12-01 06:15:32.863517,0 days 00:00:19.978236,"{0: 1, 1: 10}",15.0,1.0,910,COMPLETE
1431,1431,0.7651250257936175,2022-12-01 06:15:33.089837,2022-12-01 06:15:52.833239,0 days 00:00:19.743402,"{0: 1, 1: 10}",32.0,1.0,910,COMPLETE
1432,1432,0.7677597655125432,2022-12-01 06:15:53.066820,2022-12-01 06:16:12.949961,0 days 00:00:19.883141,"{0: 1, 1: 10}",,1.0,910,COMPLETE
1433,1433,0.7607628020271502,2022-12-01 06:16:13.148349,2022-12-01 06:16:33.261192,0 days 00:00:20.112843,"{0: 1, 1: 10}",32.0,1.0,910,COMPLETE
1434,1434,0.768408815068115,2022-12-01 06:16:33.501371,2022-12-01 06:16:53.564108,0 days 00:00:20.062737,"{0: 1, 1: 10}",32.0,1.0,910,COMPLETE
1435,1435,0.7681503402627141,2022-12-01 06:16:53.792978,2022-12-01 06:17:13.899139,0 days 00:00:20.106161,"{0: 1, 1: 10}",27.0,1.0,910,COMPLETE
1436,1436,0.7658022154932584,2022-12-01 06:17:14.136534,2022-12-01 06:17:34.034351,0 days 00:00:19.897817,"{0: 1, 1: 10}",32.0,1.0,910,COMPLETE
1437,1437,0.5992181424056888,2022-12-01 06:17:34.266812,2022-12-01 06:17:47.165078,0 days 00:00:12.898266,"{0: 1, 1: 10}",1.0,1.0,910,COMPLETE
1438,1438,0.7676495656976497,2022-12-01 06:17:47.393071,2022-12-01 06:18:07.274783,0 days 00:00:19.881712,"{0: 1, 1: 10}",12.0,1.0,910,COMPLETE
1439,1439,0.767926045840234,2022-12-01 06:18:07.510106,2022-12-01 06:18:27.330028,0 days 00:00:19.819922,"{0: 1, 1: 10}",33.0,1.0,910,COMPLETE
1440,1440,0.7677853392218434,2022-12-01 06:18:27.561803,2022-12-01 06:18:47.467725,0 days 00:00:19.905922,"{0: 1, 1: 10}",32.0,1.0,910,COMPLETE
1441,1441,0.7678803527488502,2022-12-01 06:18:47.695529,2022-12-01 06:19:06.885125,0 days 00:00:19.189596,"{0: 1, 1: 10}",31.0,1.0,860,COMPLETE
1442,1442,0.7714854322040969,2022-12-01 06:19:07.119936,2022-12-01 06:19:27.089492,0 days 00:00:19.969556,"{0: 1, 1: 10}",32.0,1.0,910,COMPLETE
1443,1443,0.7679727196774002,2022-12-01 06:19:27.332681,2022-12-01 06:19:47.341288,0 days 00:00:20.008607,"{0: 1, 1: 10}",32.0,1.0,910,COMPLETE
1444,1444,0.7652005475777279,2022-12-01 06:19:47.568882,2022-12-01 06:20:06.598580,0 days 00:00:19.029698,"{0: 1, 1: 10}",16.0,1.0,860,COMPLETE
1445,1445,0.7666709683490026,2022-12-01 06:20:06.827582,2022-12-01 06:20:26.736320,0 days 00:00:19.908738,"{0: 1, 1: 10}",37.0,1.0,910,COMPLETE
1446,1446,0.7651236091483995,2022-12-01 06:20:26.969234,2022-12-01 06:20:46.177193,0 days 00:00:19.207959,"{0: 1, 1: 10}",15.0,1.0,860,COMPLETE
1447,1447,0.7689732250514163,2022-12-01 06:20:46.407802,2022-12-01 06:21:06.234941,0 days 00:00:19.827139,"{0: 1, 1: 10}",11.0,1.0,910,COMPLETE
1448,1448,0.7654886962323532,2022-12-01 06:21:06.484573,2022-12-01 06:21:26.402214,0 days 00:00:19.917641,"{0: 1, 1: 10}",32.0,1.0,910,COMPLETE
1449,1449,0.7671392791122047,2022-12-01 06:21:26.630586,2022-12-01 06:21:45.631637,0 days 00:00:19.001051,"{0: 1, 1: 10}",25.0,1.0,860,COMPLETE
1450,1450,0.7645120660656665,2022-12-01 06:21:45.868053,2022-12-01 06:22:05.895468,0 days 00:00:20.027415,"{0: 1, 1: 10}",18.0,1.0,910,COMPLETE
1451,1451,0.7673166097864393,2022-12-01 06:22:06.124828,2022-12-01 06:22:25.399903,0 days 00:00:19.275075,"{0: 1, 1: 10}",14.0,1.0,860,COMPLETE
1452,1452,0.7605892629417059,2022-12-01 06:22:25.647253,2022-12-01 06:22:43.685839,0 days 00:00:18.038586,"{0: 1, 1: 10}",3.0,1.0,910,COMPLETE
1453,1453,0.7536869192562319,2022-12-01 06:22:43.920074,2022-12-01 06:23:02.678372,0 days 00:00:18.758298,"{0: 1, 1: 10}",6.0,1.0,860,COMPLETE
1454,1454,0.7632225295615467,2022-12-01 06:23:02.908464,2022-12-01 06:23:22.923136,0 days 00:00:20.014672,"{0: 1, 1: 10}",17.0,1.0,910,COMPLETE
1455,1455,0.7689413688132437,2022-12-01 06:23:23.158809,2022-12-01 06:23:43.039356,0 days 00:00:19.880547,"{0: 1, 1: 10}",32.0,1.0,910,COMPLETE
1456,1456,0.7714755020185512,2022-12-01 06:23:43.266089,2022-12-01 06:24:03.299892,0 days 00:00:20.033803,"{0: 1, 1: 10}",35.0,1.0,910,COMPLETE
1457,1457,0.7694642654998933,2022-12-01 06:24:03.536843,2022-12-01 06:24:22.607671,0 days 00:00:19.070828,"{0: 1, 1: 10}",11.0,1.0,860,COMPLETE
1458,1458,0.7551617827959403,2022-12-01 06:24:22.842991,2022-12-01 06:24:42.286153,0 days 00:00:19.443162,"{0: 1, 1: 10}",5.0,1.0,910,COMPLETE
1459,1459,0.7664383355544225,2022-12-01 06:24:42.519692,2022-12-01 06:25:01.607450,0 days 00:00:19.087758,"{0: 1, 1: 10}",11.0,1.0,860,COMPLETE
1460,1460,0.7692495412384994,2022-12-01 06:25:01.854455,2022-12-01 06:25:21.726183,0 days 00:00:19.871728,"{0: 1, 1: 10}",11.0,1.0,910,COMPLETE
1461,1461,0.7669182162487269,2022-12-01 06:25:21.970233,2022-12-01 06:25:41.229414,0 days 00:00:19.259181,"{0: 1, 1: 10}",19.0,1.0,860,COMPLETE
1462,1462,0.7253472835865995,2022-12-01 06:25:41.471010,2022-12-01 06:25:57.410308,0 days 00:00:15.939298,"{0: 1, 1: 10}",2.0,1.0,910,COMPLETE
1463,1463,0.7683135086739457,2022-12-01 06:25:57.644013,2022-12-01 06:26:17.496136,0 days 00:00:19.852123,"{0: 1, 1: 10}",21.0,1.0,910,COMPLETE
1464,1464,0.7752743771911372,2022-12-01 06:26:17.727721,2022-12-01 06:26:36.848227,0 days 00:00:19.120506,"{0: 1, 1: 10}",11.0,1.0,860,COMPLETE
1465,1465,0.7696355451573137,2022-12-01 06:26:37.077467,2022-12-01 06:26:56.132556,0 days 00:00:19.055089,"{0: 1, 1: 10}",11.0,1.0,860,COMPLETE
1466,1466,0.7703871676204013,2022-12-01 06:26:56.365243,2022-12-01 06:27:15.377393,0 days 00:00:19.012150,"{0: 1, 1: 10}",11.0,1.0,860,COMPLETE
1467,1467,0.7655421295394051,2022-12-01 06:27:15.604778,2022-12-01 06:27:33.864111,0 days 00:00:18.259333,"{0: 1, 1: 10}",11.0,1.0,810,COMPLETE
1468,1468,0.766613588437923,2022-12-01 06:27:34.097083,2022-12-01 06:27:52.432570,0 days 00:00:18.335487,"{0: 1, 1: 10}",11.0,1.0,810,COMPLETE
1469,1469,0.7688685421939622,2022-12-01 06:27:52.672824,2022-12-01 06:28:11.799317,0 days 00:00:19.126493,"{0: 1, 1: 10}",11.0,1.0,860,COMPLETE
1470,1470,0.7700803780018026,2022-12-01 06:28:12.038303,2022-12-01 06:28:31.030091,0 days 00:00:18.991788,"{0: 1, 1: 10}",11.0,1.0,860,COMPLETE
1471,1471,0.7641641329160909,2022-12-01 06:28:31.263404,2022-12-01 06:28:50.261335,0 days 00:00:18.997931,"{0: 1, 1: 10}",11.0,1.0,860,COMPLETE
1472,1472,0.7628912751733645,2022-12-01 06:28:50.485429,2022-12-01 06:29:09.589815,0 days 00:00:19.104386,"{0: 1, 1: 10}",11.0,1.0,860,COMPLETE
1473,1473,0.7624844174450472,2022-12-01 06:29:09.825900,2022-12-01 06:29:29.011933,0 days 00:00:19.186033,"{0: 1, 1: 10}",11.0,1.0,860,COMPLETE
1474,1474,0.7644741924411017,2022-12-01 06:29:29.239456,2022-12-01 06:29:47.438982,0 days 00:00:18.199526,"{0: 1, 1: 10}",11.0,1.0,810,COMPLETE
1475,1475,0.7558390657453489,2022-12-01 06:29:47.672701,2022-12-01 06:30:06.120317,0 days 00:00:18.447616,"{0: 1, 1: 10}",4.0,1.0,860,COMPLETE
1476,1476,0.7642482332241695,2022-12-01 06:30:06.360147,2022-12-01 06:30:25.409508,0 days 00:00:19.049361,"{0: 1, 1: 10}",11.0,1.0,860,COMPLETE
1477,1477,0.761676415690516,2022-12-01 06:30:25.643787,2022-12-01 06:30:43.979462,0 days 00:00:18.335675,"{0: 1, 1: 10}",39.0,1.0,810,COMPLETE
1478,1478,0.7702979854787528,2022-12-01 06:30:44.212575,2022-12-01 06:31:03.298483,0 days 00:00:19.085908,"{0: 1, 1: 10}",13.0,1.0,860,COMPLETE
1479,1479,0.7695030948083073,2022-12-01 06:31:03.529885,2022-12-01 06:31:22.594753,0 days 00:00:19.064868,"{0: 1, 1: 10}",11.0,1.0,860,COMPLETE
1480,1480,0.7619267674961497,2022-12-01 06:31:22.822368,2022-12-01 06:31:40.940218,0 days 00:00:18.117850,"{0: 1, 1: 10}",11.0,1.0,810,COMPLETE
1481,1481,0.7687789949237307,2022-12-01 06:31:41.167102,2022-12-01 06:32:00.111556,0 days 00:00:18.944454,"{0: 1, 1: 10}",11.0,1.0,860,COMPLETE
1482,1482,0.7664135675081607,2022-12-01 06:32:00.340447,2022-12-01 06:32:20.171952,0 days 00:00:19.831505,"{0: 1, 1: 10}",11.0,1.0,910,COMPLETE
1483,1483,0.7679786892740572,2022-12-01 06:32:20.402860,2022-12-01 06:32:40.132887,0 days 00:00:19.730027,"{0: 1, 1: 10}",15.0,1.0,910,COMPLETE
1484,1484,0.7694241193671173,2022-12-01 06:32:40.362542,2022-12-01 06:32:59.537869,0 days 00:00:19.175327,"{0: 1, 1: 10}",11.0,1.0,860,COMPLETE
1485,1485,0.7598143941069269,2022-12-01 06:32:59.772389,2022-12-01 06:33:19.839170,0 days 00:00:20.066781,"{0: 1, 1: 10}",23.0,1.0,910,COMPLETE
1486,1486,0.6046773123720148,2022-12-01 06:33:20.080654,2022-12-01 06:33:32.827325,0 days 00:00:12.746671,"{0: 1, 1: 10}",1.0,1.0,910,COMPLETE
1487,1487,0.7690497667740163,2022-12-01 06:33:33.058707,2022-12-01 06:33:52.211758,0 days 00:00:19.153051,"{0: 1, 1: 10}",12.0,1.0,860,COMPLETE
1488,1488,0.7564520920220693,2022-12-01 06:33:52.445043,2022-12-01 06:34:12.154482,0 days 00:00:19.709439,"{0: 1, 1: 10}",7.0,1.0,910,COMPLETE
1489,1489,0.7662076409792843,2022-12-01 06:34:12.394838,2022-12-01 06:34:31.470401,0 days 00:00:19.075563,"{0: 1, 1: 10}",32.0,1.0,860,COMPLETE
1490,1490,0.7649158664167577,2022-12-01 06:34:31.701096,2022-12-01 06:34:51.425431,0 days 00:00:19.724335,"{0: 1, 1: 10}",11.0,1.0,910,COMPLETE
1491,1491,0.7652099717763108,2022-12-01 06:34:51.658216,2022-12-01 06:35:08.984355,0 days 00:00:17.326139,"{0: 1, 1: 10}",11.0,0.9,810,COMPLETE
1492,1492,0.7694009728653166,2022-12-01 06:35:09.217625,2022-12-01 06:35:28.263689,0 days 00:00:19.046064,"{0: 1, 1: 10}",20.0,1.0,860,COMPLETE
1493,1493,0.760957643170486,2022-12-01 06:35:28.496785,2022-12-01 06:35:48.290190,0 days 00:00:19.793405,"{0: 1, 1: 10}",8.0,1.0,910,COMPLETE
1494,1494,0.7736260424332387,2022-12-01 06:35:48.517837,2022-12-01 06:36:08.413736,0 days 00:00:19.895899,"{0: 1, 1: 10}",11.0,1.0,910,COMPLETE
1495,1495,0.7714411880439355,2022-12-01 06:36:08.643905,2022-12-01 06:36:27.979916,0 days 00:00:19.336011,"{0: 1, 1: 10}",11.0,1.0,860,COMPLETE
1496,1496,0.7677235657840844,2022-12-01 06:36:28.217292,2022-12-01 06:36:48.046896,0 days 00:00:19.829604,"{0: 1, 1: 10}",11.0,1.0,910,COMPLETE
1497,1497,0.7638617607024025,2022-12-01 06:36:48.275277,2022-12-01 06:37:08.010207,0 days 00:00:19.734930,"{0: 1, 1: 10}",11.0,1.0,910,COMPLETE
1498,1498,0.7684600807410408,2022-12-01 06:37:08.238793,2022-12-01 06:37:26.459781,0 days 00:00:18.220988,"{0: 1, 1: 10}",11.0,1.0,810,COMPLETE
1499,1499,0.7683503470191787,2022-12-01 06:37:26.695504,2022-12-01 06:37:45.699295,0 days 00:00:19.003791,"{0: 1, 1: 10}",11.0,1.0,860,COMPLETE
1500,1500,0.7705757178293339,2022-12-01 06:37:45.941077,2022-12-01 06:38:04.910952,0 days 00:00:18.969875,"{0: 1, 1: 10}",11.0,1.0,860,COMPLETE
1501,1501,0.7631988460248078,2022-12-01 06:38:05.142785,2022-12-01 06:38:24.939590,0 days 00:00:19.796805,"{0: 1, 1: 10}",11.0,1.0,910,COMPLETE
1502,1502,0.7698978855912421,2022-12-01 06:38:25.178036,2022-12-01 06:38:44.964196,0 days 00:00:19.786160,"{0: 1, 1: 10}",11.0,1.0,910,COMPLETE
1503,1503,0.7636516814929407,2022-12-01 06:38:45.200822,2022-12-01 06:39:04.333866,0 days 00:00:19.133044,"{0: 1, 1: 10}",11.0,1.0,860,COMPLETE
1504,1504,0.7655300609593432,2022-12-01 06:39:04.565872,2022-12-01 06:39:23.369800,0 days 00:00:18.803928,"{0: 1, 1: 10}",,0.9,910,COMPLETE
1505,1505,0.764160934612413,2022-12-01 06:39:23.602757,2022-12-01 06:39:41.975229,0 days 00:00:18.372472,"{0: 1, 1: 10}",33.0,1.0,810,COMPLETE
1506,1506,0.7676823102219672,2022-12-01 06:39:42.206275,2022-12-01 06:40:01.119522,0 days 00:00:18.913247,"{0: 1, 1: 10}",11.0,1.0,860,COMPLETE
1507,1507,0.7715758552622465,2022-12-01 06:40:01.348583,2022-12-01 06:40:21.240625,0 days 00:00:19.892042,"{0: 1, 1: 10}",11.0,1.0,910,COMPLETE
1508,1508,0.7545459179128298,2022-12-01 06:40:21.479835,2022-12-01 06:40:39.382711,0 days 00:00:17.902876,"{0: 1, 1: 10}",3.0,1.0,910,COMPLETE
1509,1509,0.7655307795398427,2022-12-01 06:40:39.615792,2022-12-01 06:40:59.432901,0 days 00:00:19.817109,"{0: 1, 1: 10}",34.0,1.0,910,COMPLETE
1510,1510,0.7719880478444792,2022-12-01 06:40:59.666137,2022-12-01 06:41:18.818364,0 days 00:00:19.152227,"{0: 1, 1: 10}",26.0,1.0,860,COMPLETE
1511,1511,0.7690297586540209,2022-12-01 06:41:19.054840,2022-12-01 06:41:38.842885,0 days 00:00:19.788045,"{0: 1, 1: 10}",10.0,1.0,910,COMPLETE
1512,1512,0.7693960481715107,2022-12-01 06:41:39.076838,2022-12-01 06:41:58.314219,0 days 00:00:19.237381,"{0: 1, 1: 10}",27.0,1.0,860,COMPLETE
1513,1513,0.773462248826877,2022-12-01 06:41:58.548931,2022-12-01 06:42:18.477616,0 days 00:00:19.928685,"{0: 1, 1: 10}",11.0,1.0,910,COMPLETE
1514,1514,0.7695252748336674,2022-12-01 06:42:18.707532,2022-12-01 06:42:38.646468,0 days 00:00:19.938936,"{0: 1, 1: 10}",11.0,1.0,910,COMPLETE
1515,1515,0.7691704774552328,2022-12-01 06:42:38.880615,2022-12-01 06:42:58.659705,0 days 00:00:19.779090,"{0: 1, 1: 10}",11.0,1.0,910,COMPLETE
1516,1516,0.767972188404981,2022-12-01 06:42:58.888501,2022-12-01 06:43:18.737228,0 days 00:00:19.848727,"{0: 1, 1: 10}",11.0,1.0,910,COMPLETE
1517,1517,0.7693845372031335,2022-12-01 06:43:18.983777,2022-12-01 06:43:38.804772,0 days 00:00:19.820995,"{0: 1, 1: 10}",11.0,1.0,910,COMPLETE
1518,1518,0.7707533135192879,2022-12-01 06:43:39.043187,2022-12-01 06:43:58.805015,0 days 00:00:19.761828,"{0: 1, 1: 10}",11.0,1.0,910,COMPLETE
1519,1519,0.766384499133848,2022-12-01 06:43:59.055810,2022-12-01 06:44:18.931942,0 days 00:00:19.876132,"{0: 1, 1: 10}",11.0,1.0,910,COMPLETE
1520,1520,0.7694116178671953,2022-12-01 06:44:19.157718,2022-12-01 06:44:38.161337,0 days 00:00:19.003619,"{0: 1, 1: 10}",11.0,1.0,860,COMPLETE
1521,1521,0.7683947463361575,2022-12-01 06:44:38.399860,2022-12-01 06:44:58.280025,0 days 00:00:19.880165,"{0: 1, 1: 10}",11.0,1.0,910,COMPLETE
1522,1522,0.7668585082247249,2022-12-01 06:44:58.510652,2022-12-01 06:45:17.591178,0 days 00:00:19.080526,"{0: 1, 1: 10}",11.0,1.0,860,COMPLETE
1523,1523,0.767822351889348,2022-12-01 06:45:17.827458,2022-12-01 06:45:36.917498,0 days 00:00:19.090040,"{0: 1, 1: 10}",11.0,1.0,860,COMPLETE
1524,1524,0.7697003868283159,2022-12-01 06:45:37.146812,2022-12-01 06:45:56.977218,0 days 00:00:19.830406,"{0: 1, 1: 10}",11.0,1.0,910,COMPLETE
1525,1525,0.7608865317978715,2022-12-01 06:45:57.209684,2022-12-01 06:46:17.375969,0 days 00:00:20.166285,"{0: 1, 1: 10}",24.0,1.0,910,COMPLETE
1526,1526,0.765641556660142,2022-12-01 06:46:17.621593,2022-12-01 06:46:37.389427,0 days 00:00:19.767834,"{0: 1, 1: 10}",11.0,1.0,910,COMPLETE
1527,1527,0.7671875083257272,2022-12-01 06:46:37.618415,2022-12-01 06:46:56.914803,0 days 00:00:19.296388,"{0: 1, 1: 10}",11.0,1.0,860,COMPLETE
1528,1528,0.7669590393735328,2022-12-01 06:46:57.143598,2022-12-01 06:47:17.753918,0 days 00:00:20.610320,"{0: 1, 1: 10}",11.0,1.0,960,COMPLETE
1529,1529,0.7627896506460056,2022-12-01 06:47:17.991040,2022-12-01 06:47:37.812652,0 days 00:00:19.821612,"{0: 1, 1: 10}",37.0,1.0,910,COMPLETE
1530,1530,0.7575598777645304,2022-12-01 06:47:38.048290,2022-12-01 06:47:58.551381,0 days 00:00:20.503091,"{0: 1, 1: 10}",31.0,1.0,960,COMPLETE
1531,1531,0.7646796788899242,2022-12-01 06:47:58.788596,2022-12-01 06:48:18.106740,0 days 00:00:19.318144,"{0: 1, 1: 10}",11.0,1.0,860,COMPLETE
1532,1532,0.7704061928255895,2022-12-01 06:48:18.328262,2022-12-01 06:48:38.235798,0 days 00:00:19.907536,"{0: 1, 1: 10}",16.0,1.0,910,COMPLETE
1533,1533,0.7695401068165494,2022-12-01 06:48:38.469793,2022-12-01 06:48:59.270546,0 days 00:00:20.800753,"{0: 1, 1: 10}",18.0,1.0,960,COMPLETE
1534,1534,0.769273765230419,2022-12-01 06:48:59.503504,2022-12-01 06:49:18.727993,0 days 00:00:19.224489,"{0: 1, 1: 10}",25.0,1.0,860,COMPLETE
1535,1535,0.765346867320307,2022-12-01 06:49:18.970721,2022-12-01 06:49:38.827765,0 days 00:00:19.857044,"{0: 1, 1: 10}",11.0,1.0,910,COMPLETE
1536,1536,0.771025841182319,2022-12-01 06:49:39.062964,2022-12-01 06:49:59.791426,0 days 00:00:20.728462,"{0: 1, 1: 10}",30.0,1.0,960,COMPLETE
1537,1537,0.7679361133991369,2022-12-01 06:50:00.022740,2022-12-01 06:50:19.262946,0 days 00:00:19.240206,"{0: 1, 1: 10}",35.0,1.0,860,COMPLETE
1538,1538,0.7539134559268745,2022-12-01 06:50:19.507303,2022-12-01 06:50:39.395357,0 days 00:00:19.888054,"{0: 1, 1: 10}",6.0,1.0,910,COMPLETE
1539,1539,0.7665440075056136,2022-12-01 06:50:39.625340,2022-12-01 06:51:00.157246,0 days 00:00:20.531906,"{0: 1, 1: 10}",11.0,1.0,960,COMPLETE
1540,1540,0.7667836997392823,2022-12-01 06:51:00.392410,2022-12-01 06:51:20.319927,0 days 00:00:19.927517,"{0: 1, 1: 10}",14.0,1.0,910,COMPLETE
1541,1541,0.7702661905704424,2022-12-01 06:51:20.555920,2022-12-01 06:51:39.115285,0 days 00:00:18.559365,"{0: 1, 1: 10}",32.0,1.0,810,COMPLETE
1542,1542,0.7683619200027013,2022-12-01 06:51:39.361125,2022-12-01 06:51:58.355913,0 days 00:00:18.994788,"{0: 1, 1: 10}",11.0,1.0,860,COMPLETE
1543,1543,0.7568464803330847,2022-12-01 06:51:58.588820,2022-12-01 06:52:18.077920,0 days 00:00:19.489100,"{0: 1, 1: 10}",5.0,1.0,910,COMPLETE
1544,1544,0.7672375951072374,2022-12-01 06:52:18.305931,2022-12-01 06:52:38.976865,0 days 00:00:20.670934,"{0: 1, 1: 10}",11.0,1.0,960,COMPLETE
1545,1545,0.7655649800784959,2022-12-01 06:52:39.207360,2022-12-01 06:52:59.188762,0 days 00:00:19.981402,"{0: 1, 1: 10}",39.0,1.0,910,COMPLETE
1546,1546,0.7657769874190303,2022-12-01 06:52:59.420268,2022-12-01 06:53:18.538276,0 days 00:00:19.118008,"{0: 1, 1: 10}",17.0,1.0,860,COMPLETE
1547,1547,0.755918290257952,2022-12-01 06:53:18.775427,2022-12-01 06:53:37.978368,0 days 00:00:19.202941,"{0: 1, 1: 10}",4.0,1.0,910,COMPLETE
1548,1548,0.7683127463278367,2022-12-01 06:53:38.205323,2022-12-01 06:53:58.860885,0 days 00:00:20.655562,"{0: 1, 1: 10}",21.0,1.0,960,COMPLETE
1549,1549,0.76892839392924,2022-12-01 06:53:59.095918,2022-12-01 06:54:17.402757,0 days 00:00:18.306839,"{0: 1, 1: 10}",19.0,1.0,810,COMPLETE
1550,1550,0.7631372171245702,2022-12-01 06:54:17.648805,2022-12-01 06:54:37.567388,0 days 00:00:19.918583,"{0: 1, 1: 10}",11.0,1.0,910,COMPLETE
1551,1551,0.7642167264225472,2022-12-01 06:54:37.802997,2022-12-01 06:54:57.153857,0 days 00:00:19.350860,"{0: 1, 1: 10}",24.0,1.0,860,COMPLETE
1552,1552,0.7647048891010113,2022-12-01 06:54:57.392082,2022-12-01 06:55:18.107294,0 days 00:00:20.715212,"{0: 1, 1: 10}",11.0,1.0,960,COMPLETE
1553,1553,0.7266473544119575,2022-12-01 06:55:18.342953,2022-12-01 06:55:34.297571,0 days 00:00:15.954618,"{0: 1, 1: 10}",2.0,1.0,910,COMPLETE
1554,1554,0.7628798942573821,2022-12-01 06:55:34.531054,2022-12-01 06:55:53.723393,0 days 00:00:19.192339,"{0: 1, 1: 10}",11.0,1.0,860,COMPLETE
1555,1555,0.7632212947484409,2022-12-01 06:55:53.954524,2022-12-01 06:56:14.597400,0 days 00:00:20.642876,"{0: 1, 1: 10}",20.0,1.0,960,COMPLETE
1556,1556,0.7649947971004413,2022-12-01 06:56:14.830524,2022-12-01 06:56:34.510731,0 days 00:00:19.680207,"{0: 1, 1: 10}",11.0,1.0,910,COMPLETE
1557,1557,0.7690872077110091,2022-12-01 06:56:34.743167,2022-12-01 06:56:53.054746,0 days 00:00:18.311579,"{0: 1, 1: 10}",12.0,1.0,810,COMPLETE
1558,1558,0.7681127206303244,2022-12-01 06:56:53.302361,2022-12-01 06:57:13.923905,0 days 00:00:20.621544,"{0: 1, 1: 10}",13.0,1.0,960,COMPLETE
1559,1559,0.7564396911920299,2022-12-01 06:57:14.161477,2022-12-01 06:57:33.144540,0 days 00:00:18.983063,"{0: 1, 1: 10}",7.0,1.0,860,COMPLETE
1560,1560,0.7665809069810059,2022-12-01 06:57:33.378108,2022-12-01 06:57:53.273663,0 days 00:00:19.895555,"{0: 1, 1: 10}",11.0,1.0,910,COMPLETE
1561,1561,0.7693170892652855,2022-12-01 06:57:53.522626,2022-12-01 06:58:14.253306,0 days 00:00:20.730680,"{0: 1, 1: 10}",23.0,1.0,960,COMPLETE
1562,1562,0.6119306831417247,2022-12-01 06:58:14.490295,2022-12-01 06:58:26.978104,0 days 00:00:12.487809,"{0: 1, 1: 10}",1.0,1.0,860,COMPLETE
1563,1563,0.7683799838287874,2022-12-01 06:58:27.207985,2022-12-01 06:58:47.181579,0 days 00:00:19.973594,"{0: 1, 1: 10}",11.0,1.0,910,COMPLETE
1564,1564,0.7619981622844635,2022-12-01 06:58:47.412506,2022-12-01 06:59:07.118065,0 days 00:00:19.705559,"{0: 1, 1: 10}",8.0,1.0,910,COMPLETE
1565,1565,0.7648862611784136,2022-12-01 06:59:07.353932,2022-12-01 06:59:26.509840,0 days 00:00:19.155908,"{0: 1, 1: 10}",32.0,1.0,860,COMPLETE
1566,1566,0.7645731180169149,2022-12-01 06:59:26.737734,2022-12-01 06:59:47.343580,0 days 00:00:20.605846,"{0: 1, 1: 10}",,1.0,960,COMPLETE
1567,1567,0.7652198252478523,2022-12-01 06:59:47.586663,2022-12-01 07:00:07.588972,0 days 00:00:20.002309,"{0: 1, 1: 10}",11.0,1.0,910,COMPLETE
1568,1568,0.7667938513087043,2022-12-01 07:00:07.832864,2022-12-01 07:00:27.780914,0 days 00:00:19.948050,"{0: 1, 1: 10}",11.0,1.0,910,COMPLETE
1569,1569,0.7672533004856167,2022-12-01 07:00:28.018194,2022-12-01 07:00:47.060373,0 days 00:00:19.042179,"{0: 1, 1: 10}",11.0,1.0,860,COMPLETE
