,number,value,datetime_start,datetime_complete,duration,params_class_weight,params_max_depth,params_max_features,params_n_estimators,state
2026,2026,0.7671522538074498,2022-12-01 09:27:15.135612,2022-12-01 09:27:35.849211,0 days 00:00:20.713599,"{0: 1, 1: 10}",24.0,1.0,960,COMPLETE
2027,2027,0.7690764181592953,2022-12-01 09:27:36.105552,2022-12-01 09:27:54.548892,0 days 00:00:18.443340,"{0: 1, 1: 10}",20.0,1.0,810,COMPLETE
2028,2028,0.7634885270460888,2022-12-01 09:27:54.787088,2022-12-01 09:28:12.420190,0 days 00:00:17.633102,"{0: 1, 1: 10}",11.0,1.0,760,COMPLETE
2029,2029,0.6601637532085463,2022-12-01 09:28:12.662467,2022-12-01 09:28:23.534675,0 days 00:00:10.872208,"{0: 1, 1: 10}",7.0,log2,860,COMPLETE
2030,2030,0.7662615067465307,2022-12-01 09:28:23.778695,2022-12-01 09:28:43.734247,0 days 00:00:19.955552,"{0: 1, 1: 10}",13.0,1.0,910,COMPLETE
2031,2031,0.7712700238269097,2022-12-01 09:28:43.978886,2022-12-01 09:29:03.839540,0 days 00:00:19.860654,"{0: 1, 1: 10}",11.0,1.0,910,COMPLETE
2032,2032,0.7617634558857993,2022-12-01 09:29:04.085566,2022-12-01 09:29:23.326996,0 days 00:00:19.241430,"{0: 1, 1: 10}",36.0,1.0,860,COMPLETE
2033,2033,0.7685741005051926,2022-12-01 09:29:23.571357,2022-12-01 09:29:44.193520,0 days 00:00:20.622163,"{0: 1, 1: 10}",11.0,1.0,960,COMPLETE
2034,2034,0.7614764581926925,2022-12-01 09:29:44.429008,2022-12-01 09:30:02.252708,0 days 00:00:17.823700,"{0: 1, 1: 10}",8.0,0.8,910,COMPLETE
2035,2035,0.774986388501416,2022-12-01 09:30:02.509017,2022-12-01 09:30:20.851200,0 days 00:00:18.342183,"{0: 1, 1: 10}",11.0,1.0,810,COMPLETE
2036,2036,0.765119788188375,2022-12-01 09:30:21.107092,2022-12-01 09:30:38.548242,0 days 00:00:17.441150,"{0: 1, 1: 10}",11.0,1.0,760,COMPLETE
2037,2037,0.7699587838907384,2022-12-01 09:30:38.800753,2022-12-01 09:30:57.292166,0 days 00:00:18.491413,"{0: 1, 1: 10}",11.0,1.0,810,COMPLETE
2038,2038,0.7613238042150993,2022-12-01 09:30:57.531435,2022-12-01 09:31:14.994554,0 days 00:00:17.463119,"{0: 1, 1: 10}",11.0,1.0,760,COMPLETE
2039,2039,0.768765359980502,2022-12-01 09:31:15.238008,2022-12-01 09:31:33.623064,0 days 00:00:18.385056,"{0: 1, 1: 10}",11.0,1.0,810,COMPLETE
2040,2040,0.7641876523148151,2022-12-01 09:31:33.861313,2022-12-01 09:31:52.174403,0 days 00:00:18.313090,"{0: 1, 1: 10}",11.0,1.0,810,COMPLETE
2041,2041,0.769820501503532,2022-12-01 09:31:52.420046,2022-12-01 09:32:10.044560,0 days 00:00:17.624514,"{0: 1, 1: 10}",11.0,1.0,760,COMPLETE
2042,2042,0.7697028075555397,2022-12-01 09:32:10.292968,2022-12-01 09:32:28.710679,0 days 00:00:18.417711,"{0: 1, 1: 10}",11.0,1.0,810,COMPLETE
2043,2043,0.7696881338582526,2022-12-01 09:32:28.963616,2022-12-01 09:32:47.438136,0 days 00:00:18.474520,"{0: 1, 1: 10}",11.0,1.0,810,COMPLETE
2044,2044,0.7702277772977915,2022-12-01 09:32:47.682379,2022-12-01 09:33:05.248723,0 days 00:00:17.566344,"{0: 1, 1: 10}",11.0,1.0,760,COMPLETE
2045,2045,0.747212795187217,2022-12-01 09:33:05.495964,2022-12-01 09:33:20.284665,0 days 00:00:14.788701,"{0: 1, 1: 10}",11.0,0.6,810,COMPLETE
2046,2046,0.7657737597760123,2022-12-01 09:33:20.522318,2022-12-01 09:33:38.798240,0 days 00:00:18.275922,"{0: 1, 1: 10}",11.0,1.0,810,COMPLETE
2047,2047,0.7631918753956223,2022-12-01 09:33:39.050460,2022-12-01 09:33:57.387934,0 days 00:00:18.337474,"{0: 1, 1: 10}",11.0,1.0,810,COMPLETE
2048,2048,0.7745450262117441,2022-12-01 09:33:57.634759,2022-12-01 09:34:15.985736,0 days 00:00:18.350977,"{0: 1, 1: 10}",11.0,1.0,810,COMPLETE
2049,2049,0.7662194008732527,2022-12-01 09:34:16.228947,2022-12-01 09:34:33.702229,0 days 00:00:17.473282,"{0: 1, 1: 10}",11.0,0.9,810,COMPLETE
2050,2050,0.7691332558843708,2022-12-01 09:34:33.946985,2022-12-01 09:34:51.603710,0 days 00:00:17.656725,"{0: 1, 1: 10}",11.0,1.0,760,COMPLETE
2051,2051,0.7655950282095653,2022-12-01 09:34:51.840305,2022-12-01 09:35:09.439481,0 days 00:00:17.599176,"{0: 1, 1: 10}",11.0,1.0,760,COMPLETE
2052,2052,0.7658928334492103,2022-12-01 09:35:09.695470,2022-12-01 09:35:27.191666,0 days 00:00:17.496196,"{0: 1, 1: 10}",11.0,1.0,760,COMPLETE
2053,2053,0.7691373039368694,2022-12-01 09:35:27.442748,2022-12-01 09:35:45.986501,0 days 00:00:18.543753,"{0: 1, 1: 10}",11.0,1.0,810,COMPLETE
2054,2054,0.7680813871502539,2022-12-01 09:35:46.223285,2022-12-01 09:36:04.741315,0 days 00:00:18.518030,"{0: 1, 1: 10}",11.0,1.0,810,COMPLETE
2055,2055,0.7715677080643976,2022-12-01 09:36:04.977064,2022-12-01 09:36:23.317716,0 days 00:00:18.340652,"{0: 1, 1: 10}",11.0,1.0,810,COMPLETE
2056,2056,0.7679545872869109,2022-12-01 09:36:23.562027,2022-12-01 09:36:42.042875,0 days 00:00:18.480848,"{0: 1, 1: 10}",11.0,1.0,810,COMPLETE
2057,2057,0.629208657635235,2022-12-01 09:36:42.299653,2022-12-01 09:36:51.808556,0 days 00:00:09.508903,"{0: 1, 1: 10}",11.0,log2,760,COMPLETE
2058,2058,0.7675102922039798,2022-12-01 09:36:52.046793,2022-12-01 09:37:10.410293,0 days 00:00:18.363500,"{0: 1, 1: 10}",11.0,1.0,810,COMPLETE
2059,2059,0.7675081797998079,2022-12-01 09:37:10.656400,2022-12-01 09:37:29.090705,0 days 00:00:18.434305,"{0: 1, 1: 10}",11.0,1.0,810,COMPLETE
2060,2060,0.7696611152848513,2022-12-01 09:37:29.330424,2022-12-01 09:37:47.689021,0 days 00:00:18.358597,"{0: 1, 1: 10}",11.0,1.0,810,COMPLETE
2061,2061,0.7647802595016145,2022-12-01 09:37:47.933026,2022-12-01 09:38:05.395260,0 days 00:00:17.462234,"{0: 1, 1: 10}",11.0,1.0,760,COMPLETE
2062,2062,0.7677659825523064,2022-12-01 09:38:05.637267,2022-12-01 09:38:23.913261,0 days 00:00:18.275994,"{0: 1, 1: 10}",11.0,1.0,810,COMPLETE
2063,2063,0.7707207444591803,2022-12-01 09:38:24.157970,2022-12-01 09:38:40.161849,0 days 00:00:16.003879,"{0: 1, 1: 10}",11.0,0.8,760,COMPLETE
2064,2064,0.769769136390239,2022-12-01 09:38:40.409261,2022-12-01 09:38:58.927462,0 days 00:00:18.518201,"{0: 1, 1: 10}",12.0,1.0,810,COMPLETE
2065,2065,0.7660569158429189,2022-12-01 09:38:59.175638,2022-12-01 09:39:17.447047,0 days 00:00:18.271409,"{0: 1, 1: 10}",11.0,1.0,810,COMPLETE
2066,2066,0.5822484356120383,2022-12-01 09:39:17.684098,2022-12-01 09:39:29.392777,0 days 00:00:11.708679,"{0: 1, 1: 10}",1.0,1.0,760,COMPLETE
2067,2067,0.76794947484475,2022-12-01 09:39:29.629381,2022-12-01 09:39:47.956237,0 days 00:00:18.326856,"{0: 1, 1: 10}",11.0,1.0,810,COMPLETE
2068,2068,0.7684816353101969,2022-12-01 09:39:48.191976,2022-12-01 09:40:06.629855,0 days 00:00:18.437879,"{0: 1, 1: 10}",11.0,1.0,810,COMPLETE
2069,2069,0.7736867903971395,2022-12-01 09:40:06.872235,2022-12-01 09:40:25.236675,0 days 00:00:18.364440,"{0: 1, 1: 10}",11.0,1.0,810,COMPLETE
2070,2070,0.7694332900237961,2022-12-01 09:40:25.482828,2022-12-01 09:40:43.076177,0 days 00:00:17.593349,"{0: 1, 1: 10}",11.0,1.0,760,COMPLETE
2071,2071,0.7439795583925755,2022-12-01 09:40:43.315829,2022-12-01 09:40:58.145783,0 days 00:00:14.829954,"{0: 1, 1: 10}",11.0,0.6,810,COMPLETE
2072,2072,0.7707417475315909,2022-12-01 09:40:58.383742,2022-12-01 09:41:16.814830,0 days 00:00:18.431088,"{0: 1, 1: 10}",11.0,1.0,810,COMPLETE
2073,2073,0.7649611449610965,2022-12-01 09:41:17.065395,2022-12-01 09:41:34.603579,0 days 00:00:17.538184,"{0: 1, 1: 10}",11.0,1.0,760,COMPLETE
2074,2074,0.7664526536957798,2022-12-01 09:41:34.840961,2022-12-01 09:41:52.320331,0 days 00:00:17.479370,"{0: 1, 1: 10}",11.0,1.0,760,COMPLETE
2075,2075,0.7705521197652644,2022-12-01 09:41:52.567018,2022-12-01 09:42:10.819809,0 days 00:00:18.252791,"{0: 1, 1: 10}",11.0,1.0,810,COMPLETE
2076,2076,0.7711196827966387,2022-12-01 09:42:11.069453,2022-12-01 09:42:28.516001,0 days 00:00:17.446548,"{0: 1, 1: 10}",11.0,0.9,810,COMPLETE
2077,2077,0.7714467154566009,2022-12-01 09:42:28.754640,2022-12-01 09:42:47.008620,0 days 00:00:18.253980,"{0: 1, 1: 10}",11.0,1.0,810,COMPLETE
2078,2078,0.7701285253310035,2022-12-01 09:42:47.257077,2022-12-01 09:43:05.682923,0 days 00:00:18.425846,"{0: 1, 1: 10}",11.0,1.0,810,COMPLETE
2079,2079,0.7681971528783808,2022-12-01 09:43:05.936508,2022-12-01 09:43:23.551353,0 days 00:00:17.614845,"{0: 1, 1: 10}",11.0,1.0,760,COMPLETE
2080,2080,0.7698611565438317,2022-12-01 09:43:23.799399,2022-12-01 09:43:42.250931,0 days 00:00:18.451532,"{0: 1, 1: 10}",11.0,1.0,810,COMPLETE
2081,2081,0.766617990037431,2022-12-01 09:43:42.495141,2022-12-01 09:44:00.826734,0 days 00:00:18.331593,"{0: 1, 1: 10}",11.0,1.0,810,COMPLETE
2082,2082,0.7688962097233774,2022-12-01 09:44:01.072820,2022-12-01 09:44:18.689163,0 days 00:00:17.616343,"{0: 1, 1: 10}",11.0,1.0,760,COMPLETE
2083,2083,0.7647670734776117,2022-12-01 09:44:18.926803,2022-12-01 09:44:37.270571,0 days 00:00:18.343768,"{0: 1, 1: 10}",11.0,1.0,810,COMPLETE
2084,2084,0.7750361698631827,2022-12-01 09:44:37.506951,2022-12-01 09:44:55.758355,0 days 00:00:18.251404,"{0: 1, 1: 10}",11.0,1.0,810,COMPLETE
2085,2085,0.7614883462630637,2022-12-01 09:44:56.000606,2022-12-01 09:45:13.642689,0 days 00:00:17.642083,"{0: 1, 1: 10}",,1.0,760,COMPLETE
2086,2086,0.768607556485811,2022-12-01 09:45:13.896757,2022-12-01 09:45:31.539311,0 days 00:00:17.642554,"{0: 1, 1: 10}",34.0,1.0,760,COMPLETE
2087,2087,0.7569800414757326,2022-12-01 09:45:31.778034,2022-12-01 09:45:48.300473,0 days 00:00:16.522439,"{0: 1, 1: 10}",33.0,0.8,810,COMPLETE
2088,2088,0.6317791724035334,2022-12-01 09:45:48.551793,2022-12-01 09:45:58.340840,0 days 00:00:09.789047,"{0: 1, 1: 10}",11.0,log2,810,COMPLETE
2089,2089,0.7696597638002445,2022-12-01 09:45:58.591242,2022-12-01 09:46:17.086892,0 days 00:00:18.495650,"{0: 1, 1: 10}",11.0,1.0,810,COMPLETE
2090,2090,0.76484066944001,2022-12-01 09:46:17.324147,2022-12-01 09:46:34.846451,0 days 00:00:17.522304,"{0: 1, 1: 10}",10.0,1.0,760,COMPLETE
2091,2091,0.7680271654829773,2022-12-01 09:46:35.084580,2022-12-01 09:46:53.466476,0 days 00:00:18.381896,"{0: 1, 1: 10}",11.0,1.0,810,COMPLETE
2092,2092,0.7709033576497667,2022-12-01 09:46:53.709824,2022-12-01 09:47:12.100648,0 days 00:00:18.390824,"{0: 1, 1: 10}",11.0,1.0,810,COMPLETE
2093,2093,0.7668437265344805,2022-12-01 09:47:12.341271,2022-12-01 09:47:29.970789,0 days 00:00:17.629518,"{0: 1, 1: 10}",36.0,1.0,760,COMPLETE
2094,2094,0.7608197239640976,2022-12-01 09:47:30.208189,2022-12-01 09:47:46.730233,0 days 00:00:16.522044,"{0: 1, 1: 10}",3.0,1.0,810,COMPLETE
2095,2095,0.7650837101191806,2022-12-01 09:47:46.969512,2022-12-01 09:48:05.337658,0 days 00:00:18.368146,"{0: 1, 1: 10}",27.0,1.0,810,COMPLETE
2096,2096,0.7690613580958848,2022-12-01 09:48:05.585564,2022-12-01 09:48:24.081177,0 days 00:00:18.495613,"{0: 1, 1: 10}",37.0,1.0,810,COMPLETE
2097,2097,0.7619342149348227,2022-12-01 09:48:24.329603,2022-12-01 09:48:42.682939,0 days 00:00:18.353336,"{0: 1, 1: 10}",11.0,1.0,810,COMPLETE
2098,2098,0.774967097138007,2022-12-01 09:48:42.931751,2022-12-01 09:49:01.495313,0 days 00:00:18.563562,"{0: 1, 1: 10}",26.0,1.0,810,COMPLETE
2099,2099,0.7492328102931787,2022-12-01 09:49:01.736701,2022-12-01 09:49:15.951383,0 days 00:00:14.214682,"{0: 1, 1: 10}",28.0,0.6,760,COMPLETE
2100,2100,0.7630682774250042,2022-12-01 09:49:16.193867,2022-12-01 09:49:34.556595,0 days 00:00:18.362728,"{0: 1, 1: 10}",26.0,1.0,810,COMPLETE
2101,2101,0.7715741584061833,2022-12-01 09:49:34.806273,2022-12-01 09:49:52.326393,0 days 00:00:17.520120,"{0: 1, 1: 10}",9.0,1.0,760,COMPLETE
2102,2102,0.7688122696034778,2022-12-01 09:49:52.570080,2022-12-01 09:50:11.046815,0 days 00:00:18.476735,"{0: 1, 1: 10}",25.0,1.0,810,COMPLETE
2103,2103,0.7657767896471027,2022-12-01 09:50:11.285865,2022-12-01 09:50:29.647650,0 days 00:00:18.361785,"{0: 1, 1: 10}",26.0,1.0,810,COMPLETE
2104,2104,0.7643848273034974,2022-12-01 09:50:29.889323,2022-12-01 09:50:47.302701,0 days 00:00:17.413378,"{0: 1, 1: 10}",38.0,0.9,810,COMPLETE
2105,2105,0.7764725600792473,2022-12-01 09:50:47.551645,2022-12-01 09:51:05.908131,0 days 00:00:18.356486,"{0: 1, 1: 10}",16.0,1.0,810,COMPLETE
2106,2106,0.7680344060272888,2022-12-01 09:51:06.150856,2022-12-01 09:51:24.599213,0 days 00:00:18.448357,"{0: 1, 1: 10}",16.0,1.0,810,COMPLETE
2107,2107,0.7702307765990719,2022-12-01 09:51:24.844306,2022-12-01 09:51:42.470450,0 days 00:00:17.626144,"{0: 1, 1: 10}",16.0,1.0,760,COMPLETE
2108,2108,0.7672727892127899,2022-12-01 09:51:42.706660,2022-12-01 09:52:00.452970,0 days 00:00:17.746310,"{0: 1, 1: 10}",26.0,1.0,760,COMPLETE
2109,2109,0.7672327488348049,2022-12-01 09:52:00.694571,2022-12-01 09:52:19.095941,0 days 00:00:18.401370,"{0: 1, 1: 10}",26.0,1.0,810,COMPLETE
2110,2110,0.7689077145906115,2022-12-01 09:52:19.344196,2022-12-01 09:52:37.646736,0 days 00:00:18.302540,"{0: 1, 1: 10}",16.0,1.0,810,COMPLETE
2111,2111,0.768317835350617,2022-12-01 09:52:37.888263,2022-12-01 09:52:56.204206,0 days 00:00:18.315943,"{0: 1, 1: 10}",34.0,1.0,810,COMPLETE
2112,2112,0.6209428798071089,2022-12-01 09:52:56.442125,2022-12-01 09:53:05.616177,0 days 00:00:09.174052,"{0: 1, 1: 10}",14.0,log2,760,COMPLETE
2113,2113,0.7696038458296789,2022-12-01 09:53:05.867373,2022-12-01 09:53:24.178712,0 days 00:00:18.311339,"{0: 1, 1: 10}",26.0,1.0,810,COMPLETE
2114,2114,0.7699687325135276,2022-12-01 09:53:24.416219,2022-12-01 09:53:42.045487,0 days 00:00:17.629268,"{0: 1, 1: 10}",16.0,1.0,760,COMPLETE
2115,2115,0.7652026338081368,2022-12-01 09:53:42.289064,2022-12-01 09:54:00.590773,0 days 00:00:18.301709,"{0: 1, 1: 10}",26.0,1.0,810,COMPLETE
2116,2116,0.7615262351896211,2022-12-01 09:54:00.833713,2022-12-01 09:54:17.524969,0 days 00:00:16.691256,"{0: 1, 1: 10}",16.0,0.8,810,COMPLETE
2117,2117,0.767285457980315,2022-12-01 09:54:17.774265,2022-12-01 09:54:36.232162,0 days 00:00:18.457897,"{0: 1, 1: 10}",16.0,,810,COMPLETE
2118,2118,0.7458800965100599,2022-12-01 09:54:36.469914,2022-12-01 09:54:52.174515,0 days 00:00:15.704601,"{0: 1, 1: 10}",26.0,0.7,810,COMPLETE
2119,2119,0.7636802712094076,2022-12-01 09:54:52.421735,2022-12-01 09:55:10.036263,0 days 00:00:17.614528,"{0: 1, 1: 10}",16.0,1.0,760,COMPLETE
2120,2120,0.7667527705628363,2022-12-01 09:55:10.282755,2022-12-01 09:55:28.056359,0 days 00:00:17.773604,"{0: 1, 1: 10}",26.0,1.0,760,COMPLETE
2121,2121,0.7642006548800977,2022-12-01 09:55:28.302745,2022-12-01 09:55:46.766117,0 days 00:00:18.463372,"{0: 1, 1: 10}",18.0,1.0,810,COMPLETE
2122,2122,0.7685809452145761,2022-12-01 09:55:47.015470,2022-12-01 09:56:05.423649,0 days 00:00:18.408179,"{0: 1, 1: 10}",31.0,1.0,810,COMPLETE
2123,2123,0.7694176230397988,2022-12-01 09:56:05.670942,2022-12-01 09:56:24.065444,0 days 00:00:18.394502,"{0: 1, 1: 10}",26.0,1.0,810,COMPLETE
2124,2124,0.7621604720273727,2022-12-01 09:56:24.314915,2022-12-01 09:56:42.729821,0 days 00:00:18.414906,"{0: 1, 1: 10}",16.0,1.0,810,COMPLETE
2125,2125,0.6818486638705693,2022-12-01 09:56:42.979934,2022-12-01 09:56:52.270174,0 days 00:00:09.290240,"{0: 1, 1: 10}",16.0,sqrt,810,COMPLETE
2126,2126,0.7659637745835669,2022-12-01 09:56:52.514992,2022-12-01 09:57:10.856030,0 days 00:00:18.341038,"{0: 1, 1: 10}",35.0,1.0,810,COMPLETE
2127,2127,0.7666613060149083,2022-12-01 09:57:11.114732,2022-12-01 09:57:28.638133,0 days 00:00:17.523401,"{0: 1, 1: 10}",26.0,1.0,760,COMPLETE
2128,2128,0.7590418386221232,2022-12-01 09:57:28.879603,2022-12-01 09:57:47.294116,0 days 00:00:18.414513,"{0: 1, 1: 10}",26.0,1.0,810,COMPLETE
2129,2129,0.7410397545759921,2022-12-01 09:57:47.540821,2022-12-01 09:58:02.312893,0 days 00:00:14.772072,"{0: 1, 1: 10}",26.0,0.6,810,COMPLETE
2130,2130,0.7661709705148174,2022-12-01 09:58:02.559412,2022-12-01 09:58:20.048813,0 days 00:00:17.489401,"{0: 1, 1: 10}",26.0,1.0,760,COMPLETE
2131,2131,0.7681752676815858,2022-12-01 09:58:20.298038,2022-12-01 09:58:38.737076,0 days 00:00:18.439038,"{0: 1, 1: 10}",16.0,1.0,810,COMPLETE
2132,2132,0.7695237981792745,2022-12-01 09:58:38.986090,2022-12-01 09:58:57.414460,0 days 00:00:18.428370,"{0: 1, 1: 10}",36.0,1.0,810,COMPLETE
2133,2133,0.7678319512234688,2022-12-01 09:58:57.665266,2022-12-01 09:59:16.099530,0 days 00:00:18.434264,"{0: 1, 1: 10}",16.0,1.0,810,COMPLETE
2134,2134,0.7641511355546012,2022-12-01 09:59:16.344130,2022-12-01 09:59:33.216036,0 days 00:00:16.871906,"{0: 1, 1: 10}",21.0,0.9,760,COMPLETE
2135,2135,0.7642597949623722,2022-12-01 09:59:33.465195,2022-12-01 09:59:51.871996,0 days 00:00:18.406801,"{0: 1, 1: 10}",26.0,1.0,810,COMPLETE
2136,2136,0.755027541791456,2022-12-01 09:59:52.109604,2022-12-01 10:00:10.380161,0 days 00:00:18.270557,"{0: 1, 1: 10}",6.0,1.0,810,COMPLETE
2137,2137,0.765644504815643,2022-12-01 10:00:10.633520,2022-12-01 10:00:28.203763,0 days 00:00:17.570243,"{0: 1, 1: 10}",16.0,1.0,760,COMPLETE
2138,2138,0.7618250551859074,2022-12-01 10:00:28.451892,2022-12-01 10:00:46.878075,0 days 00:00:18.426183,"{0: 1, 1: 10}",26.0,1.0,810,COMPLETE
2139,2139,0.7666070759763447,2022-12-01 10:00:47.113249,2022-12-01 10:01:05.431450,0 days 00:00:18.318201,"{0: 1, 1: 10}",17.0,1.0,810,COMPLETE
2140,2140,0.7699646162030426,2022-12-01 10:01:05.668025,2022-12-01 10:01:24.122271,0 days 00:00:18.454246,"{0: 1, 1: 10}",16.0,1.0,810,COMPLETE
2141,2141,0.7614802560779532,2022-12-01 10:01:24.373835,2022-12-01 10:01:41.686604,0 days 00:00:17.312769,"{0: 1, 1: 10}",5.0,1.0,760,COMPLETE
2142,2142,0.7603847175393195,2022-12-01 10:01:41.940069,2022-12-01 10:01:59.715814,0 days 00:00:17.775745,"{0: 1, 1: 10}",4.0,1.0,810,COMPLETE
2143,2143,0.6169437650513728,2022-12-01 10:01:59.954628,2022-12-01 10:02:09.387947,0 days 00:00:09.433319,"{0: 1, 1: 10}",16.0,log2,810,COMPLETE
2144,2144,0.7711726002745343,2022-12-01 10:02:09.637017,2022-12-01 10:02:27.219622,0 days 00:00:17.582605,"{0: 1, 1: 10}",39.0,1.0,760,COMPLETE
2145,2145,0.7609643734528762,2022-12-01 10:02:27.467072,2022-12-01 10:02:44.933419,0 days 00:00:17.466347,"{0: 1, 1: 10}",29.0,0.8,860,COMPLETE
2146,2146,0.7671329683056922,2022-12-01 10:02:45.180374,2022-12-01 10:03:03.611204,0 days 00:00:18.430830,"{0: 1, 1: 10}",16.0,1.0,810,COMPLETE
2147,2147,0.764392285792536,2022-12-01 10:03:03.858640,2022-12-01 10:03:23.094518,0 days 00:00:19.235878,"{0: 1, 1: 10}",19.0,,860,COMPLETE
2148,2148,0.7695555767248747,2022-12-01 10:03:23.337215,2022-12-01 10:03:42.534990,0 days 00:00:19.197775,"{0: 1, 1: 10}",26.0,1.0,860,COMPLETE
2149,2149,0.7083900136409852,2022-12-01 10:03:42.784061,2022-12-01 10:03:55.746087,0 days 00:00:12.962026,"{0: 1, 1: 10}",2.0,0.7,810,COMPLETE
2150,2150,0.7663323703336429,2022-12-01 10:03:55.995525,2022-12-01 10:04:14.321064,0 days 00:00:18.325539,"{0: 1, 1: 10}",34.0,1.0,810,COMPLETE
2151,2151,0.767951731095464,2022-12-01 10:04:14.558557,2022-12-01 10:04:33.687903,0 days 00:00:19.129346,"{0: 1, 1: 10}",36.0,1.0,860,COMPLETE
2152,2152,0.7674250106818434,2022-12-01 10:04:33.930424,2022-12-01 10:04:51.614230,0 days 00:00:17.683806,"{0: 1, 1: 10}",13.0,1.0,760,COMPLETE
2153,2153,0.7681201064418933,2022-12-01 10:04:51.864679,2022-12-01 10:05:11.107898,0 days 00:00:19.243219,"{0: 1, 1: 10}",16.0,1.0,860,COMPLETE
2154,2154,0.7660872310860409,2022-12-01 10:05:11.356790,2022-12-01 10:05:29.779980,0 days 00:00:18.423190,"{0: 1, 1: 10}",20.0,1.0,810,COMPLETE
2155,2155,0.6836068617032421,2022-12-01 10:05:30.036200,2022-12-01 10:05:39.646963,0 days 00:00:09.610763,"{0: 1, 1: 10}",,sqrt,860,COMPLETE
2156,2156,0.6028866823390545,2022-12-01 10:05:39.885187,2022-12-01 10:05:52.378618,0 days 00:00:12.493431,"{0: 1, 1: 10}",1.0,1.0,860,COMPLETE
2157,2157,0.7637803576940418,2022-12-01 10:05:52.626500,2022-12-01 10:06:11.128396,0 days 00:00:18.501896,"{0: 1, 1: 10}",33.0,1.0,810,COMPLETE
2158,2158,0.7576618775265682,2022-12-01 10:06:11.378533,2022-12-01 10:06:29.565329,0 days 00:00:18.186796,"{0: 1, 1: 10}",7.0,1.0,810,COMPLETE
2159,2159,0.7402073385308305,2022-12-01 10:06:29.815068,2022-12-01 10:06:45.094259,0 days 00:00:15.279191,"{0: 1, 1: 10}",12.0,0.6,860,COMPLETE
2160,2160,0.7615047447617427,2022-12-01 10:06:45.332995,2022-12-01 10:07:02.896789,0 days 00:00:17.563794,"{0: 1, 1: 10}",8.0,1.0,760,COMPLETE
2161,2161,0.769883581626254,2022-12-01 10:07:03.149098,2022-12-01 10:07:22.253856,0 days 00:00:19.104758,"{0: 1, 1: 10}",10.0,1.0,860,COMPLETE
2162,2162,0.7591381548355594,2022-12-01 10:07:22.494246,2022-12-01 10:07:40.811979,0 days 00:00:18.317733,"{0: 1, 1: 10}",34.0,1.0,810,COMPLETE
2163,2163,0.7639417133725367,2022-12-01 10:07:41.057743,2022-12-01 10:07:59.523930,0 days 00:00:18.466187,"{0: 1, 1: 10}",31.0,1.0,810,COMPLETE
2164,2164,0.7653252455551629,2022-12-01 10:07:59.775507,2022-12-01 10:08:18.926168,0 days 00:00:19.150661,"{0: 1, 1: 10}",27.0,1.0,860,COMPLETE
2165,2165,0.7540279823509057,2022-12-01 10:08:19.179248,2022-12-01 10:08:35.634421,0 days 00:00:16.455173,"{0: 1, 1: 10}",3.0,0.9,860,COMPLETE
2166,2166,0.7675361117824233,2022-12-01 10:08:35.873081,2022-12-01 10:08:54.199015,0 days 00:00:18.325934,"{0: 1, 1: 10}",26.0,1.0,810,COMPLETE
2167,2167,0.769335013888441,2022-12-01 10:08:54.440005,2022-12-01 10:09:11.929367,0 days 00:00:17.489362,"{0: 1, 1: 10}",36.0,1.0,760,COMPLETE
2168,2168,0.7609991854377018,2022-12-01 10:09:12.167490,2022-12-01 10:09:31.404068,0 days 00:00:19.236578,"{0: 1, 1: 10}",37.0,1.0,860,COMPLETE
2169,2169,0.7629240557717678,2022-12-01 10:09:31.653910,2022-12-01 10:09:50.687684,0 days 00:00:19.033774,"{0: 1, 1: 10}",25.0,1.0,860,COMPLETE
2170,2170,0.7654961121076004,2022-12-01 10:09:50.930407,2022-12-01 10:10:09.439062,0 days 00:00:18.508655,"{0: 1, 1: 10}",34.0,1.0,810,COMPLETE
2171,2171,0.7688052363424905,2022-12-01 10:10:09.685505,2022-12-01 10:10:28.134718,0 days 00:00:18.449213,"{0: 1, 1: 10}",28.0,1.0,810,COMPLETE
2172,2172,0.6369088601861613,2022-12-01 10:10:28.382889,2022-12-01 10:10:38.590906,0 days 00:00:10.208017,"{0: 1, 1: 10}",9.0,log2,860,COMPLETE
2173,2173,0.7645075020747047,2022-12-01 10:10:38.829841,2022-12-01 10:10:56.402884,0 days 00:00:17.573043,"{0: 1, 1: 10}",14.0,1.0,760,COMPLETE
2174,2174,0.7652565925950144,2022-12-01 10:10:56.652690,2022-12-01 10:11:15.007732,0 days 00:00:18.355042,"{0: 1, 1: 10}",16.0,1.0,810,COMPLETE
2175,2175,0.7630094795039539,2022-12-01 10:11:15.257513,2022-12-01 10:11:34.452491,0 days 00:00:19.194978,"{0: 1, 1: 10}",38.0,1.0,860,COMPLETE
2176,2176,0.7578397386825992,2022-12-01 10:11:34.700017,2022-12-01 10:11:52.066674,0 days 00:00:17.366657,"{0: 1, 1: 10}",36.0,0.8,860,COMPLETE
2177,2177,0.7696587696922556,2022-12-01 10:11:52.309707,2022-12-01 10:12:10.669729,0 days 00:00:18.360022,"{0: 1, 1: 10}",18.0,1.0,810,COMPLETE
