,number,value,datetime_start,datetime_complete,duration,params_class_weight,params_max_depth,params_max_features,params_n_estimators,state
480,480,0.7335067866578608,2022-12-01 02:10:33.959901,2022-12-01 02:10:59.269732,0 days 00:00:25.309831,,23.0,1.0,710,COMPLETE
481,481,0.7665634486282944,2022-12-01 02:10:59.483267,2022-12-01 02:11:13.028061,0 days 00:00:13.544794,"{0: 1, 1: 10}",31.0,1.0,510,COMPLETE
482,482,0.6452589919816674,2022-12-01 02:11:13.241788,2022-12-01 02:11:20.080595,0 days 00:00:06.838807,"{0: 1, 1: 100}",2.0,1.0,10,COMPLETE
483,483,0.6052578802003471,2022-12-01 02:11:20.296403,2022-12-01 02:11:36.909242,0 days 00:00:16.612839,balanced,9.0,1.0,960,COMPLETE
484,484,0.6548522599300961,2022-12-01 02:11:37.121987,2022-12-01 02:11:45.338127,0 days 00:00:08.216140,balanced,15.0,0.7,260,COMPLETE
485,485,0.7328580211728418,2022-12-01 02:11:45.558858,2022-12-01 02:12:03.447303,0 days 00:00:17.888445,,28.0,0.6,660,COMPLETE
486,486,0.6817033295585748,2022-12-01 02:12:03.668373,2022-12-01 02:12:13.278878,0 days 00:00:09.610505,"{0: 1, 1: 10}",32.0,sqrt,910,COMPLETE
487,487,0.6398769112678323,2022-12-01 02:12:13.497363,2022-12-01 02:12:28.205500,0 days 00:00:14.708137,balanced,25.0,0.9,810,COMPLETE
488,488,0.734113424229528,2022-12-01 02:12:28.417878,2022-12-01 02:12:41.954849,0 days 00:00:13.536971,,13.0,0.9,310,COMPLETE
489,489,0.6074148780881359,2022-12-01 02:12:42.158387,2022-12-01 02:12:50.218172,0 days 00:00:08.059785,,36.0,log2,510,COMPLETE
490,490,0.6477252125909788,2022-12-01 02:12:50.430626,2022-12-01 02:12:57.386783,0 days 00:00:06.956157,"{0: 1, 1: 100}",39.0,0.7,60,COMPLETE
491,491,0.7360577404137305,2022-12-01 02:12:57.592760,2022-12-01 02:13:23.110098,0 days 00:00:25.517338,,34.0,,710,COMPLETE
492,492,0.7547535371807433,2022-12-01 02:13:23.324689,2022-12-01 02:13:33.153774,0 days 00:00:09.829085,"{0: 1, 1: 10}",26.0,0.8,310,COMPLETE
493,493,0.7350091269705608,2022-12-01 02:13:33.370718,2022-12-01 02:13:45.108716,0 days 00:00:11.737998,,28.0,0.8,260,COMPLETE
494,494,0.613310412032825,2022-12-01 02:13:45.325289,2022-12-01 02:13:58.647984,0 days 00:00:13.322695,balanced,9.0,0.8,760,COMPLETE
495,495,0.6795717318863688,2022-12-01 02:13:58.864370,2022-12-01 02:14:05.715493,0 days 00:00:06.851123,"{0: 1, 1: 10}",11.0,0.8,10,COMPLETE
496,496,0.685752900935819,2022-12-01 02:14:05.926233,2022-12-01 02:14:15.435653,0 days 00:00:09.509420,"{0: 1, 1: 100}",13.0,sqrt,910,COMPLETE
497,497,0.6373546826215706,2022-12-01 02:14:15.646239,2022-12-01 02:14:22.597727,0 days 00:00:06.951488,balanced,20.0,,60,COMPLETE
498,498,0.6354235026610511,2022-12-01 02:14:22.811143,2022-12-01 02:14:37.678210,0 days 00:00:14.867067,"{0: 1, 1: 100}",33.0,1.0,810,COMPLETE
499,499,0.5900750660867714,2022-12-01 02:14:37.893263,2022-12-01 02:14:49.022501,0 days 00:00:11.129238,balanced,7.0,0.9,510,COMPLETE
500,500,0.7330664236507176,2022-12-01 02:14:49.238748,2022-12-01 02:14:57.927873,0 days 00:00:08.689125,,,0.6,160,COMPLETE
501,501,0.7500716684876916,2022-12-01 02:14:58.144163,2022-12-01 02:15:06.184186,0 days 00:00:08.040023,"{0: 1, 1: 10}",17.0,0.9,160,COMPLETE
502,502,0.76375272873071,2022-12-01 02:15:06.400379,2022-12-01 02:15:25.837433,0 days 00:00:19.437054,"{0: 1, 1: 10}",37.0,0.9,960,COMPLETE
503,503,0.6042406752517351,2022-12-01 02:15:26.047541,2022-12-01 02:15:32.992644,0 days 00:00:06.945103,balanced,38.0,0.8,10,COMPLETE
504,504,0.6248789387202358,2022-12-01 02:15:33.207430,2022-12-01 02:15:40.415103,0 days 00:00:07.207673,"{0: 1, 1: 100}",9.0,0.7,160,COMPLETE
505,505,0.5923549330118522,2022-12-01 02:15:40.626818,2022-12-01 02:15:55.305096,0 days 00:00:14.678278,balanced,8.0,0.8,910,COMPLETE
506,506,0.6226158997768072,2022-12-01 02:15:55.519385,2022-12-01 02:16:03.624409,0 days 00:00:08.105024,balanced,31.0,log2,510,COMPLETE
507,507,0.6771908840598584,2022-12-01 02:16:03.838137,2022-12-01 02:16:13.072730,0 days 00:00:09.234593,"{0: 1, 1: 10}",31.0,sqrt,810,COMPLETE
508,508,0.6497780848230196,2022-12-01 02:16:13.263327,2022-12-01 02:16:20.407530,0 days 00:00:07.144203,"{0: 1, 1: 100}",20.0,0.8,110,COMPLETE
509,509,0.7584408482652633,2022-12-01 02:16:20.623079,2022-12-01 02:16:45.532543,0 days 00:00:24.909464,,4.0,,860,COMPLETE
510,510,0.6361925600087853,2022-12-01 02:16:45.749481,2022-12-01 02:16:52.860804,0 days 00:00:07.111323,balanced,30.0,,110,COMPLETE
511,511,0.7612383173549878,2022-12-01 02:16:53.072465,2022-12-01 02:17:08.814119,0 days 00:00:15.741654,"{0: 1, 1: 10}",13.0,0.8,760,COMPLETE
512,512,0.7322995390819542,2022-12-01 02:17:09.028378,2022-12-01 02:17:17.861269,0 days 00:00:08.832891,,27.0,,110,COMPLETE
513,513,0.7279381237680732,2022-12-01 02:17:18.071427,2022-12-01 02:17:24.919511,0 days 00:00:06.848084,,15.0,,10,COMPLETE
514,514,0.6494259914148045,2022-12-01 02:17:25.137282,2022-12-01 02:17:35.504755,0 days 00:00:10.367473,balanced,13.0,0.8,460,COMPLETE
515,515,0.7342933493897181,2022-12-01 02:17:35.726170,2022-12-01 02:17:59.194339,0 days 00:00:23.468169,,35.0,0.6,960,COMPLETE
516,516,0.5972122162095592,2022-12-01 02:17:59.412523,2022-12-01 02:18:13.072221,0 days 00:00:13.659698,"{0: 1, 1: 100}",6.0,0.7,910,COMPLETE
517,517,0.7347348845252804,2022-12-01 02:18:13.280347,2022-12-01 02:18:26.398768,0 days 00:00:13.118421,,36.0,1.0,260,COMPLETE
518,518,0.6170338298794217,2022-12-01 02:18:26.611657,2022-12-01 02:18:33.675929,0 days 00:00:07.064272,,25.0,sqrt,60,COMPLETE
519,519,0.7209734357450628,2022-12-01 02:18:33.892161,2022-12-01 02:18:42.457496,0 days 00:00:08.565335,"{0: 1, 1: 10}",2.0,1.0,260,COMPLETE
520,520,0.6566901169125539,2022-12-01 02:18:42.675142,2022-12-01 02:18:51.391352,0 days 00:00:08.716210,balanced,37.0,0.7,310,COMPLETE
521,521,0.7334395770897729,2022-12-01 02:18:51.598559,2022-12-01 02:19:03.969998,0 days 00:00:12.371439,,32.0,0.6,360,COMPLETE
522,522,0.7286580748230567,2022-12-01 02:19:04.190531,2022-12-01 02:19:14.386647,0 days 00:00:10.196116,,2.0,,360,COMPLETE
523,523,0.641987474168016,2022-12-01 02:19:14.598998,2022-12-01 02:19:29.791895,0 days 00:00:15.192897,balanced,14.0,0.9,860,COMPLETE
524,524,0.572008996230678,2022-12-01 02:19:30.013604,2022-12-01 02:19:37.166857,0 days 00:00:07.153253,balanced,5.0,,110,COMPLETE
525,525,0.6390607800487988,2022-12-01 02:19:37.385505,2022-12-01 02:19:53.670566,0 days 00:00:16.285061,balanced,33.0,0.9,960,COMPLETE
526,526,0.6371596931280388,2022-12-01 02:19:53.883826,2022-12-01 02:20:07.078600,0 days 00:00:13.194774,"{0: 1, 1: 100}",20.0,1.0,660,COMPLETE
527,527,0.6462207492109281,2022-12-01 02:20:07.289735,2022-12-01 02:20:14.336896,0 days 00:00:07.047161,"{0: 1, 1: 100}",30.0,0.8,110,COMPLETE
528,528,0.6372659766238197,2022-12-01 02:20:14.552521,2022-12-01 02:20:25.233661,0 days 00:00:10.681140,balanced,3.0,log2,810,COMPLETE
529,529,0.5786397643303675,2022-12-01 02:20:25.447991,2022-12-01 02:20:34.711143,0 days 00:00:09.263152,balanced,6.0,,310,COMPLETE
530,530,0.6700488707696716,2022-12-01 02:20:34.925491,2022-12-01 02:20:42.112558,0 days 00:00:07.187067,,1.0,1.0,160,COMPLETE
531,531,0.7654628160437323,2022-12-01 02:20:42.325769,2022-12-01 02:21:02.700575,0 days 00:00:20.374806,"{0: 1, 1: 10}",23.0,1.0,960,COMPLETE
532,532,0.612341817900179,2022-12-01 02:21:02.909608,2022-12-01 02:21:11.951565,0 days 00:00:09.041957,"{0: 1, 1: 100}",1.0,1.0,410,COMPLETE
533,533,0.7346685568783232,2022-12-01 02:21:12.167863,2022-12-01 02:21:27.480870,0 days 00:00:15.313007,,29.0,0.7,460,COMPLETE
534,534,0.6352319714749766,2022-12-01 02:21:27.687777,2022-12-01 02:21:35.273253,0 days 00:00:07.585476,"{0: 1, 1: 100}",34.0,,160,COMPLETE
535,535,0.6535575935552826,2022-12-01 02:21:35.486528,2022-12-01 02:21:49.340162,0 days 00:00:13.853634,"{0: 1, 1: 100}",30.0,0.9,760,COMPLETE
536,536,0.5894851759112261,2022-12-01 02:21:49.552925,2022-12-01 02:22:03.230160,0 days 00:00:13.677235,"{0: 1, 1: 100}",4.0,0.9,810,COMPLETE
537,537,0.6724889225824242,2022-12-01 02:22:03.439630,2022-12-01 02:22:10.877455,0 days 00:00:07.437825,"{0: 1, 1: 100}",9.0,sqrt,260,COMPLETE
538,538,0.6304609621918128,2022-12-01 02:22:11.090186,2022-12-01 02:22:18.093612,0 days 00:00:07.003426,,19.0,sqrt,60,COMPLETE
539,539,0.7326273457195569,2022-12-01 02:22:18.307874,2022-12-01 02:22:29.906113,0 days 00:00:11.598239,,17.0,,210,COMPLETE
540,540,0.6653061185713567,2022-12-01 02:22:30.119826,2022-12-01 02:22:39.464597,0 days 00:00:09.344771,"{0: 1, 1: 100}",32.0,log2,860,COMPLETE
541,541,0.7640062929124055,2022-12-01 02:22:39.686617,2022-12-01 02:22:50.938233,0 days 00:00:11.251616,"{0: 1, 1: 10}",11.0,,360,COMPLETE
542,542,0.6102026089745761,2022-12-01 02:22:51.149781,2022-12-01 02:22:59.067283,0 days 00:00:07.917502,,29.0,log2,460,COMPLETE
543,543,0.7663930803043247,2022-12-01 02:22:59.282710,2022-12-01 02:23:18.984139,0 days 00:00:19.701429,"{0: 1, 1: 10}",23.0,,910,COMPLETE
544,544,0.6388337009268591,2022-12-01 02:23:19.197228,2022-12-01 02:23:34.291073,0 days 00:00:15.093845,balanced,25.0,0.9,860,COMPLETE
545,545,0.7224413450553866,2022-12-01 02:23:34.503451,2022-12-01 02:23:43.770242,0 days 00:00:09.266791,"{0: 1, 1: 100}",28.0,sqrt,810,COMPLETE
546,546,0.6432054241665079,2022-12-01 02:23:43.985754,2022-12-01 02:23:51.448764,0 days 00:00:07.463010,,9.0,sqrt,360,COMPLETE
547,547,0.7337026831438873,2022-12-01 02:23:51.665035,2022-12-01 02:23:58.735948,0 days 00:00:07.070913,"{0: 1, 1: 10}",10.0,0.6,110,COMPLETE
548,548,0.5794083215908794,2022-12-01 02:23:58.950231,2022-12-01 02:24:07.528056,0 days 00:00:08.577825,"{0: 1, 1: 10}",30.0,log2,610,COMPLETE
549,549,0.7729337911183707,2022-12-01 02:24:07.746828,2022-12-01 02:24:28.236440,0 days 00:00:20.489612,"{0: 1, 1: 10}",24.0,1.0,960,COMPLETE
550,550,0.6778810520143166,2022-12-01 02:24:28.449716,2022-12-01 02:24:37.675888,0 days 00:00:09.226172,"{0: 1, 1: 10}",,sqrt,810,COMPLETE
551,551,0.5734633322374137,2022-12-01 02:24:37.893426,2022-12-01 02:24:44.667583,0 days 00:00:06.774157,"{0: 1, 1: 100}",7.0,log2,10,COMPLETE
552,552,0.6520334508612194,2022-12-01 02:24:44.880147,2022-12-01 02:24:53.155504,0 days 00:00:08.275357,balanced,12.0,0.7,260,COMPLETE
553,553,0.6526846351613343,2022-12-01 02:24:53.372133,2022-12-01 02:25:00.488572,0 days 00:00:07.116439,balanced,38.0,0.6,60,COMPLETE
554,554,0.6269188306192482,2022-12-01 02:25:00.701858,2022-12-01 02:25:07.487262,0 days 00:00:06.785404,"{0: 1, 1: 100}",17.0,0.7,10,COMPLETE
555,555,0.6176905776703241,2022-12-01 02:25:07.702676,2022-12-01 02:25:16.670779,0 days 00:00:08.968103,balanced,34.0,log2,760,COMPLETE
556,556,0.705745594406083,2022-12-01 02:25:16.886631,2022-12-01 02:25:23.796664,0 days 00:00:06.910033,balanced,34.0,sqrt,110,COMPLETE
557,557,0.7354352780884998,2022-12-01 02:25:24.012861,2022-12-01 02:25:36.161704,0 days 00:00:12.148843,,24.0,0.7,310,COMPLETE
558,558,0.7344710231726621,2022-12-01 02:25:36.378226,2022-12-01 02:25:56.172596,0 days 00:00:19.794370,,18.0,0.8,610,COMPLETE
559,559,0.6381050593918951,2022-12-01 02:25:56.388964,2022-12-01 02:26:12.076385,0 days 00:00:15.687421,"{0: 1, 1: 100}",10.0,1.0,910,COMPLETE
560,560,0.6754166328577237,2022-12-01 02:26:12.294373,2022-12-01 02:26:20.937528,0 days 00:00:08.643155,"{0: 1, 1: 10}",32.0,sqrt,660,COMPLETE
561,561,0.6423227305759946,2022-12-01 02:26:21.146196,2022-12-01 02:26:28.088778,0 days 00:00:06.942582,"{0: 1, 1: 10}",1.0,1.0,10,COMPLETE
562,562,0.7684642153039893,2022-12-01 02:26:28.297935,2022-12-01 02:26:46.527451,0 days 00:00:18.229516,"{0: 1, 1: 10}",22.0,1.0,810,COMPLETE
563,563,0.6524999193643561,2022-12-01 02:26:46.742159,2022-12-01 02:26:54.683599,0 days 00:00:07.941440,"{0: 1, 1: 100}",29.0,log2,460,COMPLETE
564,564,0.6382700516224803,2022-12-01 02:26:54.894836,2022-12-01 02:27:02.872974,0 days 00:00:07.978138,,19.0,sqrt,510,COMPLETE
565,565,0.7201941960209746,2022-12-01 02:27:03.089297,2022-12-01 02:27:12.791944,0 days 00:00:09.702647,"{0: 1, 1: 100}",30.0,sqrt,910,COMPLETE
566,566,0.6315310706181552,2022-12-01 02:27:13.005190,2022-12-01 02:27:21.969098,0 days 00:00:08.963908,balanced,20.0,log2,710,COMPLETE
567,567,0.6146394833468567,2022-12-01 02:27:22.180724,2022-12-01 02:27:32.975638,0 days 00:00:10.794914,"{0: 1, 1: 100}",9.0,log2,910,COMPLETE
568,568,0.7346785657654873,2022-12-01 02:27:33.197490,2022-12-01 02:28:05.500687,0 days 00:00:32.303197,,9.0,1.0,960,COMPLETE
569,569,0.6021798810536182,2022-12-01 02:28:05.712623,2022-12-01 02:28:12.540003,0 days 00:00:06.827380,"{0: 1, 1: 100}",35.0,0.7,10,COMPLETE
570,570,0.6838500451480383,2022-12-01 02:28:12.753732,2022-12-01 02:28:19.655058,0 days 00:00:06.901326,"{0: 1, 1: 10}",16.0,0.6,10,COMPLETE
571,571,0.7326534189832933,2022-12-01 02:28:19.872823,2022-12-01 02:28:40.136046,0 days 00:00:20.263223,,7.0,0.7,710,COMPLETE
572,572,0.7591069878398181,2022-12-01 02:28:40.350291,2022-12-01 02:28:55.430635,0 days 00:00:15.080344,"{0: 1, 1: 10}",8.0,0.9,660,COMPLETE
573,573,0.6520800271356572,2022-12-01 02:28:55.644035,2022-12-01 02:29:03.898700,0 days 00:00:08.254665,"{0: 1, 1: 100}",28.0,log2,560,COMPLETE
574,574,0.7677603456941563,2022-12-01 02:29:04.112620,2022-12-01 02:29:14.644001,0 days 00:00:10.531381,"{0: 1, 1: 10}",13.0,0.8,360,COMPLETE
575,575,0.7117364288981354,2022-12-01 02:29:14.861736,2022-12-01 02:29:21.776493,0 days 00:00:06.914757,,24.0,0.8,10,COMPLETE
576,576,0.6585299107002415,2022-12-01 02:29:21.993128,2022-12-01 02:29:30.215976,0 days 00:00:08.222848,"{0: 1, 1: 100}",26.0,0.7,260,COMPLETE
577,577,0.7701291293792162,2022-12-01 02:29:30.432458,2022-12-01 02:29:49.519086,0 days 00:00:19.086628,"{0: 1, 1: 10}",19.0,1.0,860,COMPLETE
578,578,0.6558755743260125,2022-12-01 02:29:49.737005,2022-12-01 02:29:59.498860,0 days 00:00:09.761855,balanced,34.0,0.7,410,COMPLETE
579,579,0.7611704548031245,2022-12-01 02:29:59.711248,2022-12-01 02:30:10.945445,0 days 00:00:11.234197,"{0: 1, 1: 10}",14.0,,360,COMPLETE
580,580,0.7630826302261363,2022-12-01 02:30:11.166597,2022-12-01 02:30:22.349838,0 days 00:00:11.183241,"{0: 1, 1: 10}",27.0,0.8,410,COMPLETE
581,581,0.6011440243404198,2022-12-01 02:30:22.566021,2022-12-01 02:30:35.707187,0 days 00:00:13.141166,balanced,8.0,0.7,810,COMPLETE
582,582,0.7579746970959251,2022-12-01 02:30:35.922311,2022-12-01 02:30:43.312111,0 days 00:00:07.389800,"{0: 1, 1: 10}",23.0,0.9,110,COMPLETE
583,583,0.5928356280899999,2022-12-01 02:30:43.528358,2022-12-01 02:30:50.495113,0 days 00:00:06.966755,balanced,5.0,,10,COMPLETE
584,584,0.627460047397314,2022-12-01 02:30:50.711641,2022-12-01 02:30:59.589791,0 days 00:00:08.878150,"{0: 1, 1: 100}",18.0,log2,710,COMPLETE
585,585,0.6492837754997338,2022-12-01 02:30:59.801198,2022-12-01 02:31:14.165426,0 days 00:00:14.364228,"{0: 1, 1: 100}",13.0,0.9,810,COMPLETE
586,586,0.6646743679741496,2022-12-01 02:31:14.374730,2022-12-01 02:31:24.120783,0 days 00:00:09.746053,"{0: 1, 1: 100}",37.0,0.6,460,COMPLETE
587,587,0.6422507578842264,2022-12-01 02:31:24.333731,2022-12-01 02:31:39.705320,0 days 00:00:15.371589,"{0: 1, 1: 100}",39.0,,860,COMPLETE
588,588,0.7331761528670577,2022-12-01 02:31:39.919032,2022-12-01 02:31:53.940427,0 days 00:00:14.021395,,29.0,0.8,360,COMPLETE
589,589,0.657729685098542,2022-12-01 02:31:54.162079,2022-12-01 02:32:05.010590,0 days 00:00:10.848511,"{0: 1, 1: 100}",,0.7,560,COMPLETE
590,590,0.6482799094560546,2022-12-01 02:32:05.231709,2022-12-01 02:32:14.662917,0 days 00:00:09.431208,"{0: 1, 1: 100}",2.0,0.9,410,COMPLETE
591,591,0.6408793054453804,2022-12-01 02:32:15.110272,2022-12-01 02:32:24.263157,0 days 00:00:09.152885,balanced,17.0,0.9,310,COMPLETE
592,592,0.6159144497975386,2022-12-01 02:32:24.730504,2022-12-01 02:32:35.440073,0 days 00:00:10.709569,balanced,2.0,sqrt,760,COMPLETE
593,593,0.7675800203057612,2022-12-01 02:32:35.657205,2022-12-01 02:32:51.699261,0 days 00:00:16.042056,"{0: 1, 1: 10}",30.0,1.0,660,COMPLETE
594,594,0.7366507166841989,2022-12-01 02:32:51.924724,2022-12-01 02:33:03.385913,0 days 00:00:11.461189,,23.0,1.0,210,COMPLETE
595,595,0.7421161012443476,2022-12-01 02:33:03.602627,2022-12-01 02:33:14.863010,0 days 00:00:11.260383,"{0: 1, 1: 10}",34.0,0.6,510,COMPLETE
596,596,0.5884030929047582,2022-12-01 02:33:15.084199,2022-12-01 02:33:26.567914,0 days 00:00:11.483715,balanced,7.0,,510,COMPLETE
597,597,0.7714573649626426,2022-12-01 02:33:26.788205,2022-12-01 02:33:40.323293,0 days 00:00:13.535088,"{0: 1, 1: 10}",22.0,1.0,510,COMPLETE
598,598,0.6366644883515082,2022-12-01 02:33:40.538392,2022-12-01 02:33:48.790323,0 days 00:00:08.251931,"{0: 1, 1: 100}",28.0,1.0,210,COMPLETE
599,599,0.6399642266672206,2022-12-01 02:33:49.008901,2022-12-01 02:34:03.439878,0 days 00:00:14.430977,"{0: 1, 1: 100}",16.0,1.0,760,COMPLETE
600,600,0.6400583201306536,2022-12-01 02:34:03.654821,2022-12-01 02:34:18.459527,0 days 00:00:14.804706,"{0: 1, 1: 100}",32.0,,810,COMPLETE
601,601,0.6748760806628733,2022-12-01 02:34:18.680428,2022-12-01 02:34:27.019829,0 days 00:00:08.339401,"{0: 1, 1: 10}",36.0,sqrt,560,COMPLETE
602,602,0.6394472578422672,2022-12-01 02:34:27.229471,2022-12-01 02:34:37.174687,0 days 00:00:09.945216,balanced,31.0,,360,COMPLETE
603,603,0.6689586784480208,2022-12-01 02:34:37.388553,2022-12-01 02:34:44.519897,0 days 00:00:07.131344,balanced,7.0,sqrt,160,COMPLETE
604,604,0.6287288261977412,2022-12-01 02:34:44.736650,2022-12-01 02:34:51.948008,0 days 00:00:07.211358,balanced,23.0,log2,210,COMPLETE
605,605,0.6109584379594696,2022-12-01 02:34:52.167383,2022-12-01 02:34:59.594890,0 days 00:00:07.427507,balanced,32.0,log2,360,COMPLETE
606,606,0.6358164164664204,2022-12-01 02:34:59.807369,2022-12-01 02:35:13.576556,0 days 00:00:13.769187,"{0: 1, 1: 100}",31.0,,710,COMPLETE
607,607,0.6394052806388726,2022-12-01 02:35:13.795833,2022-12-01 02:35:28.406111,0 days 00:00:14.610278,balanced,14.0,1.0,760,COMPLETE
608,608,0.7348211017403575,2022-12-01 02:35:28.621877,2022-12-01 02:35:49.195052,0 days 00:00:20.573175,,10.0,0.7,710,COMPLETE
609,609,0.6326411950044354,2022-12-01 02:35:49.414358,2022-12-01 02:36:00.339153,0 days 00:00:10.924795,"{0: 1, 1: 100}",13.0,,460,COMPLETE
610,610,0.7495049843660021,2022-12-01 02:36:00.553442,2022-12-01 02:36:08.090363,0 days 00:00:07.536921,"{0: 1, 1: 10}",24.0,1.0,110,COMPLETE
611,611,0.6538542083132961,2022-12-01 02:36:08.320331,2022-12-01 02:36:19.724461,0 days 00:00:11.404130,,1.0,0.7,910,COMPLETE
612,612,0.644968902190435,2022-12-01 02:36:19.946042,2022-12-01 02:36:26.941610,0 days 00:00:06.995568,balanced,27.0,0.7,60,COMPLETE
613,613,0.6437286464853393,2022-12-01 02:36:27.150463,2022-12-01 02:36:38.360625,0 days 00:00:11.210162,balanced,38.0,0.9,510,COMPLETE
614,614,0.7226959849508376,2022-12-01 02:36:38.579911,2022-12-01 02:36:47.580285,0 days 00:00:09.000374,"{0: 1, 1: 100}",31.0,sqrt,710,COMPLETE
615,615,0.6438647458528994,2022-12-01 02:36:47.801002,2022-12-01 02:36:54.715909,0 days 00:00:06.914907,balanced,29.0,sqrt,10,COMPLETE
616,616,0.598328872770267,2022-12-01 02:36:54.928735,2022-12-01 02:37:01.889245,0 days 00:00:06.960510,balanced,8.0,0.9,60,COMPLETE
617,617,0.6474895209479583,2022-12-01 02:37:02.107176,2022-12-01 02:37:17.537116,0 days 00:00:15.429940,"{0: 1, 1: 100}",29.0,0.9,910,COMPLETE
618,618,0.763271382601934,2022-12-01 02:37:17.753486,2022-12-01 02:37:27.602726,0 days 00:00:09.849240,"{0: 1, 1: 10}",22.0,,260,COMPLETE
619,619,0.5682985928326326,2022-12-01 02:37:27.813664,2022-12-01 02:37:34.687134,0 days 00:00:06.873470,,39.0,log2,10,COMPLETE
620,620,0.6101559847246771,2022-12-01 02:37:34.901377,2022-12-01 02:37:43.502319,0 days 00:00:08.600942,"{0: 1, 1: 100}",1.0,0.7,460,COMPLETE
621,621,0.6463194609843967,2022-12-01 02:37:43.715632,2022-12-01 02:37:51.603288,0 days 00:00:07.887656,"{0: 1, 1: 100}",38.0,log2,460,COMPLETE
622,622,0.6565412451311452,2022-12-01 02:37:51.820935,2022-12-01 02:37:58.816370,0 days 00:00:06.995435,balanced,3.0,0.6,110,COMPLETE
623,623,0.687690231259796,2022-12-01 02:37:59.031995,2022-12-01 02:38:07.392665,0 days 00:00:08.360670,"{0: 1, 1: 10}",12.0,sqrt,610,COMPLETE
624,624,0.7348911890359979,2022-12-01 02:38:07.610108,2022-12-01 02:38:19.003873,0 days 00:00:11.393765,,11.0,0.6,310,COMPLETE
625,625,0.6648762569325006,2022-12-01 02:38:19.217977,2022-12-01 02:38:31.541463,0 days 00:00:12.323486,"{0: 1, 1: 100}",22.0,0.6,760,COMPLETE
626,626,0.6487793794172727,2022-12-01 02:38:31.758087,2022-12-01 02:38:41.046873,0 days 00:00:09.288786,,10.0,sqrt,860,COMPLETE
627,627,0.6617027257826902,2022-12-01 02:38:41.264886,2022-12-01 02:38:50.451710,0 days 00:00:09.186824,"{0: 1, 1: 100}",17.0,0.6,410,COMPLETE
628,628,0.7453148030388113,2022-12-01 02:38:50.669718,2022-12-01 02:39:01.596613,0 days 00:00:10.926895,"{0: 1, 1: 10}",23.0,0.6,460,COMPLETE
629,629,0.7354357745427772,2022-12-01 02:39:01.812452,2022-12-01 02:39:33.980269,0 days 00:00:32.167817,,23.0,,960,COMPLETE
630,630,0.732666705983966,2022-12-01 02:39:34.195148,2022-12-01 02:39:47.065954,0 days 00:00:12.870806,,15.0,,260,COMPLETE
631,631,0.6489034820218065,2022-12-01 02:39:47.289200,2022-12-01 02:40:01.500441,0 days 00:00:14.211241,balanced,26.0,0.8,810,COMPLETE
632,632,0.7069421112960301,2022-12-01 02:40:01.715469,2022-12-01 02:40:12.469597,0 days 00:00:10.754128,"{0: 1, 1: 10}",2.0,0.7,560,COMPLETE
633,633,0.7722556925813195,2022-12-01 02:40:12.691463,2022-12-01 02:40:25.825553,0 days 00:00:13.134090,"{0: 1, 1: 10}",15.0,0.9,510,COMPLETE
634,634,0.7331266363663413,2022-12-01 02:40:26.040306,2022-12-01 02:40:44.001761,0 days 00:00:17.961455,,35.0,0.6,660,COMPLETE
635,635,0.6942851128353114,2022-12-01 02:40:44.224922,2022-12-01 02:40:53.703470,0 days 00:00:09.478548,"{0: 1, 1: 10}",6.0,sqrt,960,COMPLETE
636,636,0.7302699910217281,2022-12-01 02:40:53.933742,2022-12-01 02:41:01.201588,0 days 00:00:07.267846,,25.0,0.6,60,COMPLETE
637,637,0.6597744840714269,2022-12-01 02:41:01.417776,2022-12-01 02:41:08.434391,0 days 00:00:07.016615,"{0: 1, 1: 100}",,0.7,60,COMPLETE
638,638,0.6541082625987944,2022-12-01 02:41:08.647200,2022-12-01 02:41:16.703963,0 days 00:00:08.056763,balanced,11.0,0.9,210,COMPLETE
639,639,0.634417738162236,2022-12-01 02:41:16.921780,2022-12-01 02:41:29.057609,0 days 00:00:12.135829,balanced,12.0,1.0,560,COMPLETE
