,number,value,datetime_start,datetime_complete,duration,params_class_weight,params_max_depth,params_max_features,params_n_estimators,state
961,961,0.7492666056627632,2022-12-01 03:43:42.159875,2022-12-01 03:43:51.024558,0 days 00:00:08.864683,"{0: 1, 1: 10}",22.0,0.7,260,COMPLETE
962,962,0.7360699630722373,2022-12-01 03:43:51.260014,2022-12-01 03:44:07.555054,0 days 00:00:16.295040,"{0: 1, 1: 10}",33.0,0.6,960,COMPLETE
963,963,0.7342325121956652,2022-12-01 03:44:07.781142,2022-12-01 03:44:34.584733,0 days 00:00:26.803591,,9.0,0.8,910,COMPLETE
964,964,0.6556807786189001,2022-12-01 03:44:34.810222,2022-12-01 03:44:43.760614,0 days 00:00:08.950392,"{0: 1, 1: 100}",37.0,0.8,310,COMPLETE
965,965,0.706766269664591,2022-12-01 03:44:43.978994,2022-12-01 03:44:54.114623,0 days 00:00:10.135629,"{0: 1, 1: 10}",2.0,0.8,460,COMPLETE
966,966,0.666663340588514,2022-12-01 03:44:54.347924,2022-12-01 03:45:08.659498,0 days 00:00:14.311574,balanced,26.0,0.6,960,COMPLETE
967,967,0.6446865812057991,2022-12-01 03:45:08.928506,2022-12-01 03:45:16.295075,0 days 00:00:07.366569,"{0: 1, 1: 100}",26.0,0.8,160,COMPLETE
968,968,0.7330832062227909,2022-12-01 03:45:16.521577,2022-12-01 03:45:32.236689,0 days 00:00:15.715112,,27.0,1.0,360,COMPLETE
969,969,0.6394341790330179,2022-12-01 03:45:32.454487,2022-12-01 03:45:41.343541,0 days 00:00:08.889054,,32.0,sqrt,710,COMPLETE
970,970,0.6920290140659906,2022-12-01 03:45:41.561540,2022-12-01 03:45:50.139956,0 days 00:00:08.578416,"{0: 1, 1: 10}",5.0,sqrt,660,COMPLETE
971,971,0.617088673546346,2022-12-01 03:45:50.360584,2022-12-01 03:46:06.473354,0 days 00:00:16.112770,"{0: 1, 1: 100}",8.0,1.0,960,COMPLETE
972,972,0.6020875758478614,2022-12-01 03:46:06.699808,2022-12-01 03:46:13.782515,0 days 00:00:07.082707,balanced,38.0,log2,110,COMPLETE
973,973,0.6071149351853595,2022-12-01 03:46:14.004673,2022-12-01 03:46:27.558504,0 days 00:00:13.553831,"{0: 1, 1: 100}",8.0,0.8,810,COMPLETE
974,974,0.6375196720617636,2022-12-01 03:46:27.780381,2022-12-01 03:46:39.617794,0 days 00:00:11.837413,balanced,23.0,1.0,510,COMPLETE
975,975,0.6051880754524595,2022-12-01 03:46:39.831764,2022-12-01 03:46:46.911928,0 days 00:00:07.080164,"{0: 1, 1: 100}",26.0,0.9,10,COMPLETE
976,976,0.6627678417960504,2022-12-01 03:46:47.137405,2022-12-01 03:46:56.408072,0 days 00:00:09.270667,balanced,24.0,0.7,360,COMPLETE
977,977,0.6396545780833924,2022-12-01 03:46:56.628725,2022-12-01 03:47:10.927074,0 days 00:00:14.298349,"{0: 1, 1: 100}",19.0,1.0,760,COMPLETE
978,978,0.6301872113960493,2022-12-01 03:47:11.149928,2022-12-01 03:47:18.860547,0 days 00:00:07.710619,balanced,37.0,,160,COMPLETE
979,979,0.7305256119245096,2022-12-01 03:47:19.083861,2022-12-01 03:47:26.457047,0 days 00:00:07.373186,,10.0,0.8,60,COMPLETE
980,980,0.631942796499716,2022-12-01 03:47:26.675237,2022-12-01 03:47:34.019865,0 days 00:00:07.344628,"{0: 1, 1: 100}",11.0,,110,COMPLETE
981,981,0.7339688819805025,2022-12-01 03:47:34.239701,2022-12-01 03:47:54.762568,0 days 00:00:20.522867,,36.0,0.7,710,COMPLETE
982,982,0.6143394267259189,2022-12-01 03:47:54.984093,2022-12-01 03:48:04.573351,0 days 00:00:09.589258,balanced,33.0,log2,910,COMPLETE
983,983,0.6080933098609007,2022-12-01 03:48:04.795730,2022-12-01 03:48:14.679577,0 days 00:00:09.883847,"{0: 1, 1: 10}",21.0,log2,960,COMPLETE
984,984,0.7338983475451105,2022-12-01 03:48:14.905235,2022-12-01 03:48:37.715123,0 days 00:00:22.809888,,38.0,0.7,810,COMPLETE
985,985,0.6378766397137747,2022-12-01 03:48:37.940661,2022-12-01 03:48:47.120977,0 days 00:00:09.180316,,13.0,sqrt,760,COMPLETE
986,986,0.5644788593537649,2022-12-01 03:48:47.346375,2022-12-01 03:48:54.272222,0 days 00:00:06.925847,"{0: 1, 1: 10}",16.0,log2,10,COMPLETE
987,987,0.6614658405906084,2022-12-01 03:48:54.491225,2022-12-01 03:49:02.124386,0 days 00:00:07.633161,balanced,29.0,0.6,210,COMPLETE
988,988,0.7363163759348182,2022-12-01 03:49:02.341103,2022-12-01 03:49:16.583797,0 days 00:00:14.242694,,36.0,0.6,460,COMPLETE
989,989,0.7334667991825892,2022-12-01 03:49:16.812274,2022-12-01 03:49:25.872297,0 days 00:00:09.060023,,29.0,0.7,160,COMPLETE
990,990,0.6463076587672865,2022-12-01 03:49:26.093103,2022-12-01 03:49:37.384261,0 days 00:00:11.291158,"{0: 1, 1: 100}",34.0,0.9,510,COMPLETE
991,991,0.6614851980991991,2022-12-01 03:49:37.615893,2022-12-01 03:49:45.478872,0 days 00:00:07.862979,balanced,14.0,0.7,210,COMPLETE
992,992,0.7375277388611278,2022-12-01 03:49:45.704979,2022-12-01 03:49:52.538237,0 days 00:00:06.833258,,16.0,1.0,10,COMPLETE
993,993,0.621680751621838,2022-12-01 03:49:52.762050,2022-12-01 03:50:01.979038,0 days 00:00:09.216988,balanced,12.0,log2,760,COMPLETE
994,994,0.6359630274574222,2022-12-01 03:50:02.200242,2022-12-01 03:50:16.290602,0 days 00:00:14.090360,balanced,35.0,1.0,710,COMPLETE
995,995,0.5973976560663359,2022-12-01 03:50:16.515407,2022-12-01 03:50:23.486572,0 days 00:00:06.971165,"{0: 1, 1: 100}",33.0,0.9,10,COMPLETE
996,996,0.7283856763829952,2022-12-01 03:50:23.712013,2022-12-01 03:50:30.709323,0 days 00:00:06.997310,"{0: 1, 1: 100}",35.0,sqrt,160,COMPLETE
997,997,0.6784855666183274,2022-12-01 03:50:30.937446,2022-12-01 03:50:39.859734,0 days 00:00:08.922288,"{0: 1, 1: 10}",22.0,sqrt,710,COMPLETE
998,998,0.6406505792389061,2022-12-01 03:50:40.076720,2022-12-01 03:50:47.168902,0 days 00:00:07.092182,"{0: 1, 1: 100}",38.0,log2,260,COMPLETE
999,999,0.7351250445032105,2022-12-01 03:50:47.393176,2022-12-01 03:51:01.709765,0 days 00:00:14.316589,,36.0,0.6,460,COMPLETE
1000,1000,0.7617663761678939,2022-12-01 03:51:01.938515,2022-12-01 03:51:22.675195,0 days 00:00:20.736680,"{0: 1, 1: 10}",11.0,1.0,960,COMPLETE
1001,1001,0.7678870018834341,2022-12-01 03:51:22.899813,2022-12-01 03:51:43.404382,0 days 00:00:20.504569,"{0: 1, 1: 10}",22.0,1.0,960,COMPLETE
1002,1002,0.7613989230412297,2022-12-01 03:51:43.625034,2022-12-01 03:52:04.136495,0 days 00:00:20.511461,"{0: 1, 1: 10}",22.0,1.0,960,COMPLETE
1003,1003,0.7631281526152286,2022-12-01 03:52:04.358146,2022-12-01 03:52:25.066318,0 days 00:00:20.708172,"{0: 1, 1: 10}",22.0,1.0,960,COMPLETE
1004,1004,0.7659731055277919,2022-12-01 03:52:25.294967,2022-12-01 03:52:45.723808,0 days 00:00:20.428841,"{0: 1, 1: 10}",15.0,1.0,960,COMPLETE
1005,1005,0.7689783405436177,2022-12-01 03:52:45.954840,2022-12-01 03:53:06.513886,0 days 00:00:20.559046,"{0: 1, 1: 10}",22.0,1.0,960,COMPLETE
1006,1006,0.7650508401599015,2022-12-01 03:53:06.742113,2022-12-01 03:53:27.385609,0 days 00:00:20.643496,"{0: 1, 1: 10}",22.0,1.0,960,COMPLETE
1007,1007,0.764598024020044,2022-12-01 03:53:27.608789,2022-12-01 03:53:48.259571,0 days 00:00:20.650782,"{0: 1, 1: 10}",22.0,1.0,960,COMPLETE
1008,1008,0.767130165841736,2022-12-01 03:53:48.484978,2022-12-01 03:54:09.184399,0 days 00:00:20.699421,"{0: 1, 1: 10}",22.0,1.0,960,COMPLETE
1009,1009,0.7711403488822961,2022-12-01 03:54:09.411850,2022-12-01 03:54:29.936280,0 days 00:00:20.524430,"{0: 1, 1: 10}",22.0,1.0,960,COMPLETE
1010,1010,0.7664033061143084,2022-12-01 03:54:30.175629,2022-12-01 03:54:50.934595,0 days 00:00:20.758966,"{0: 1, 1: 10}",22.0,1.0,960,COMPLETE
1011,1011,0.7680437877123123,2022-12-01 03:54:51.156268,2022-12-01 03:55:11.673497,0 days 00:00:20.517229,"{0: 1, 1: 10}",22.0,1.0,960,COMPLETE
1012,1012,0.7668453622316149,2022-12-01 03:55:11.876912,2022-12-01 03:55:32.657427,0 days 00:00:20.780515,"{0: 1, 1: 10}",22.0,1.0,960,COMPLETE
1013,1013,0.7669267532491533,2022-12-01 03:55:32.864660,2022-12-01 03:55:53.339754,0 days 00:00:20.475094,"{0: 1, 1: 10}",22.0,1.0,960,COMPLETE
1014,1014,0.7642112396207482,2022-12-01 03:55:53.565154,2022-12-01 03:56:14.159480,0 days 00:00:20.594326,"{0: 1, 1: 10}",22.0,1.0,960,COMPLETE
1015,1015,0.7663802235369552,2022-12-01 03:56:14.372743,2022-12-01 03:56:34.964192,0 days 00:00:20.591449,"{0: 1, 1: 10}",22.0,1.0,960,COMPLETE
1016,1016,0.7638909386443139,2022-12-01 03:56:35.186853,2022-12-01 03:56:55.730799,0 days 00:00:20.543946,"{0: 1, 1: 10}",22.0,1.0,960,COMPLETE
1017,1017,0.7644390736594968,2022-12-01 03:56:55.958470,2022-12-01 03:57:16.658568,0 days 00:00:20.700098,"{0: 1, 1: 10}",22.0,1.0,960,COMPLETE
1018,1018,0.7664309918152667,2022-12-01 03:57:16.883166,2022-12-01 03:57:37.381545,0 days 00:00:20.498379,"{0: 1, 1: 10}",22.0,1.0,960,COMPLETE
1019,1019,0.7648729376552386,2022-12-01 03:57:37.612299,2022-12-01 03:57:58.280708,0 days 00:00:20.668409,"{0: 1, 1: 10}",22.0,1.0,960,COMPLETE
1020,1020,0.7616565210382038,2022-12-01 03:57:58.506934,2022-12-01 03:58:19.117146,0 days 00:00:20.610212,"{0: 1, 1: 10}",22.0,1.0,960,COMPLETE
1021,1021,0.7639183649236412,2022-12-01 03:58:19.347026,2022-12-01 03:58:40.002827,0 days 00:00:20.655801,"{0: 1, 1: 10}",15.0,1.0,960,COMPLETE
1022,1022,0.7708558209399723,2022-12-01 03:58:40.226768,2022-12-01 03:59:00.938525,0 days 00:00:20.711757,"{0: 1, 1: 10}",22.0,1.0,960,COMPLETE
1023,1023,0.7668318796532394,2022-12-01 03:59:01.166774,2022-12-01 03:59:21.779258,0 days 00:00:20.612484,"{0: 1, 1: 10}",22.0,1.0,960,COMPLETE
1024,1024,0.7630666911166412,2022-12-01 03:59:21.993974,2022-12-01 03:59:42.600187,0 days 00:00:20.606213,"{0: 1, 1: 10}",22.0,1.0,960,COMPLETE
1025,1025,0.7693698209464679,2022-12-01 03:59:42.826196,2022-12-01 04:00:03.441315,0 days 00:00:20.615119,"{0: 1, 1: 10}",22.0,1.0,960,COMPLETE
1026,1026,0.765227556355326,2022-12-01 04:00:03.663399,2022-12-01 04:00:24.120205,0 days 00:00:20.456806,"{0: 1, 1: 10}",22.0,1.0,960,COMPLETE
1027,1027,0.7672761285262071,2022-12-01 04:00:24.343197,2022-12-01 04:00:44.995880,0 days 00:00:20.652683,"{0: 1, 1: 10}",22.0,1.0,960,COMPLETE
1028,1028,0.7657262336782675,2022-12-01 04:00:45.217304,2022-12-01 04:01:05.665933,0 days 00:00:20.448629,"{0: 1, 1: 10}",22.0,1.0,960,COMPLETE
1029,1029,0.7664330965125975,2022-12-01 04:01:05.891446,2022-12-01 04:01:25.657609,0 days 00:00:19.766163,"{0: 1, 1: 10}",22.0,1.0,910,COMPLETE
1030,1030,0.7695439695853986,2022-12-01 04:01:25.881109,2022-12-01 04:01:46.343720,0 days 00:00:20.462611,"{0: 1, 1: 10}",22.0,1.0,960,COMPLETE
1031,1031,0.7721642064094169,2022-12-01 04:01:46.575360,2022-12-01 04:02:07.101282,0 days 00:00:20.525922,"{0: 1, 1: 10}",22.0,1.0,960,COMPLETE
1032,1032,0.7680220175747577,2022-12-01 04:02:07.321111,2022-12-01 04:02:27.912809,0 days 00:00:20.591698,"{0: 1, 1: 10}",22.0,1.0,960,COMPLETE
1033,1033,0.7647896514966787,2022-12-01 04:02:28.139128,2022-12-01 04:02:48.704391,0 days 00:00:20.565263,"{0: 1, 1: 10}",22.0,1.0,960,COMPLETE
1034,1034,0.7671491389860398,2022-12-01 04:02:48.928055,2022-12-01 04:03:09.634925,0 days 00:00:20.706870,"{0: 1, 1: 10}",22.0,1.0,960,COMPLETE
1035,1035,0.7727645709923944,2022-12-01 04:03:09.868707,2022-12-01 04:03:30.392188,0 days 00:00:20.523481,"{0: 1, 1: 10}",22.0,1.0,960,COMPLETE
1036,1036,0.7724897579454753,2022-12-01 04:03:30.615981,2022-12-01 04:03:51.465683,0 days 00:00:20.849702,"{0: 1, 1: 10}",22.0,1.0,960,COMPLETE
1037,1037,0.7696215654539389,2022-12-01 04:03:51.688795,2022-12-01 04:04:12.402040,0 days 00:00:20.713245,"{0: 1, 1: 10}",22.0,1.0,960,COMPLETE
1038,1038,0.7632692447690717,2022-12-01 04:04:12.628397,2022-12-01 04:04:33.186867,0 days 00:00:20.558470,"{0: 1, 1: 10}",22.0,1.0,960,COMPLETE
1039,1039,0.7701785142989521,2022-12-01 04:04:33.407896,2022-12-01 04:04:53.997656,0 days 00:00:20.589760,"{0: 1, 1: 10}",22.0,1.0,960,COMPLETE
1040,1040,0.76771823052087,2022-12-01 04:04:54.223488,2022-12-01 04:05:14.914322,0 days 00:00:20.690834,"{0: 1, 1: 10}",22.0,1.0,960,COMPLETE
1041,1041,0.765868540853307,2022-12-01 04:05:15.140745,2022-12-01 04:05:34.953416,0 days 00:00:19.812671,"{0: 1, 1: 10}",22.0,1.0,910,COMPLETE
1042,1042,0.7693963579663441,2022-12-01 04:05:35.177193,2022-12-01 04:05:55.877700,0 days 00:00:20.700507,"{0: 1, 1: 10}",22.0,1.0,960,COMPLETE
1043,1043,0.7645477201142439,2022-12-01 04:05:56.104084,2022-12-01 04:06:16.688403,0 days 00:00:20.584319,"{0: 1, 1: 10}",22.0,1.0,960,COMPLETE
1044,1044,0.7636646282952662,2022-12-01 04:06:16.908757,2022-12-01 04:06:36.691902,0 days 00:00:19.783145,"{0: 1, 1: 10}",22.0,1.0,910,COMPLETE
1045,1045,0.7638731165291419,2022-12-01 04:06:36.912410,2022-12-01 04:06:57.496808,0 days 00:00:20.584398,"{0: 1, 1: 10}",22.0,1.0,960,COMPLETE
1046,1046,0.7676203519426077,2022-12-01 04:06:57.721628,2022-12-01 04:07:18.337467,0 days 00:00:20.615839,"{0: 1, 1: 10}",22.0,1.0,960,COMPLETE
1047,1047,0.7706217019246525,2022-12-01 04:07:18.562327,2022-12-01 04:07:39.308781,0 days 00:00:20.746454,"{0: 1, 1: 10}",22.0,1.0,960,COMPLETE
1048,1048,0.7722045788630242,2022-12-01 04:07:39.531266,2022-12-01 04:07:59.506265,0 days 00:00:19.974999,"{0: 1, 1: 10}",22.0,1.0,910,COMPLETE
1049,1049,0.7650583750837032,2022-12-01 04:07:59.730002,2022-12-01 04:08:19.546770,0 days 00:00:19.816768,"{0: 1, 1: 10}",22.0,1.0,910,COMPLETE
1050,1050,0.769349519434163,2022-12-01 04:08:19.771951,2022-12-01 04:08:39.717181,0 days 00:00:19.945230,"{0: 1, 1: 10}",22.0,1.0,910,COMPLETE
1051,1051,0.7657796851227369,2022-12-01 04:08:39.940954,2022-12-01 04:08:59.693676,0 days 00:00:19.752722,"{0: 1, 1: 10}",22.0,1.0,910,COMPLETE
1052,1052,0.7680578843557115,2022-12-01 04:08:59.925385,2022-12-01 04:09:19.773921,0 days 00:00:19.848536,"{0: 1, 1: 10}",22.0,1.0,910,COMPLETE
1053,1053,0.7734829718694904,2022-12-01 04:09:19.997324,2022-12-01 04:09:40.555797,0 days 00:00:20.558473,"{0: 1, 1: 10}",22.0,1.0,960,COMPLETE
1054,1054,0.7668750912765755,2022-12-01 04:09:40.789237,2022-12-01 04:10:00.720284,0 days 00:00:19.931047,"{0: 1, 1: 10}",22.0,1.0,910,COMPLETE
1055,1055,0.7645517172945204,2022-12-01 04:10:00.942831,2022-12-01 04:10:21.604187,0 days 00:00:20.661356,"{0: 1, 1: 10}",22.0,1.0,960,COMPLETE
1056,1056,0.770140884590364,2022-12-01 04:10:21.824052,2022-12-01 04:10:41.762710,0 days 00:00:19.938658,"{0: 1, 1: 10}",22.0,1.0,910,COMPLETE
1057,1057,0.7625067941945866,2022-12-01 04:10:41.988197,2022-12-01 04:11:01.923047,0 days 00:00:19.934850,"{0: 1, 1: 10}",22.0,1.0,910,COMPLETE
1058,1058,0.7711025550053112,2022-12-01 04:11:02.156164,2022-12-01 04:11:21.944347,0 days 00:00:19.788183,"{0: 1, 1: 10}",22.0,1.0,910,COMPLETE
1059,1059,0.7635862411743769,2022-12-01 04:11:22.170086,2022-12-01 04:11:42.030605,0 days 00:00:19.860519,"{0: 1, 1: 10}",22.0,1.0,910,COMPLETE
1060,1060,0.7603677888712409,2022-12-01 04:11:42.256696,2022-12-01 04:12:02.145500,0 days 00:00:19.888804,"{0: 1, 1: 10}",22.0,1.0,910,COMPLETE
1061,1061,0.7687926891790279,2022-12-01 04:12:02.364362,2022-12-01 04:12:22.217849,0 days 00:00:19.853487,"{0: 1, 1: 10}",22.0,1.0,910,COMPLETE
1062,1062,0.7663593663652214,2022-12-01 04:12:22.443047,2022-12-01 04:12:42.366504,0 days 00:00:19.923457,"{0: 1, 1: 10}",22.0,1.0,910,COMPLETE
1063,1063,0.7641020181990543,2022-12-01 04:12:42.598209,2022-12-01 04:13:03.257904,0 days 00:00:20.659695,"{0: 1, 1: 10}",22.0,1.0,960,COMPLETE
1064,1064,0.7686239053756284,2022-12-01 04:13:03.482613,2022-12-01 04:13:23.995357,0 days 00:00:20.512744,"{0: 1, 1: 10}",22.0,1.0,960,COMPLETE
1065,1065,0.7679350321434768,2022-12-01 04:13:24.218151,2022-12-01 04:13:44.724002,0 days 00:00:20.505851,"{0: 1, 1: 10}",22.0,1.0,960,COMPLETE
1066,1066,0.7644768662821121,2022-12-01 04:13:44.956755,2022-12-01 04:14:04.808301,0 days 00:00:19.851546,"{0: 1, 1: 10}",22.0,1.0,910,COMPLETE
1067,1067,0.7658778945309075,2022-12-01 04:14:05.039117,2022-12-01 04:14:24.922345,0 days 00:00:19.883228,"{0: 1, 1: 10}",22.0,1.0,910,COMPLETE
1068,1068,0.7687659161369791,2022-12-01 04:14:25.150013,2022-12-01 04:14:45.824432,0 days 00:00:20.674419,"{0: 1, 1: 10}",22.0,1.0,960,COMPLETE
1069,1069,0.7666685593575103,2022-12-01 04:14:46.055512,2022-12-01 04:15:06.711157,0 days 00:00:20.655645,"{0: 1, 1: 10}",22.0,1.0,960,COMPLETE
1070,1070,0.7639908300009102,2022-12-01 04:15:06.937002,2022-12-01 04:15:26.798688,0 days 00:00:19.861686,"{0: 1, 1: 10}",22.0,1.0,910,COMPLETE
1071,1071,0.7694221490147629,2022-12-01 04:15:27.022059,2022-12-01 04:15:47.570769,0 days 00:00:20.548710,"{0: 1, 1: 10}",22.0,1.0,960,COMPLETE
1072,1072,0.7624133188912013,2022-12-01 04:15:47.806997,2022-12-01 04:16:08.413900,0 days 00:00:20.606903,"{0: 1, 1: 10}",22.0,1.0,960,COMPLETE
1073,1073,0.7680871455801486,2022-12-01 04:16:08.636549,2022-12-01 04:16:29.183946,0 days 00:00:20.547397,"{0: 1, 1: 10}",22.0,1.0,960,COMPLETE
1074,1074,0.7691406112677398,2022-12-01 04:16:29.413194,2022-12-01 04:16:50.159535,0 days 00:00:20.746341,"{0: 1, 1: 10}",22.0,1.0,960,COMPLETE
1075,1075,0.7672494512452648,2022-12-01 04:16:50.357562,2022-12-01 04:17:11.088966,0 days 00:00:20.731404,"{0: 1, 1: 10}",22.0,1.0,960,COMPLETE
1076,1076,0.7678306371356338,2022-12-01 04:17:11.314100,2022-12-01 04:17:31.996355,0 days 00:00:20.682255,"{0: 1, 1: 10}",22.0,1.0,960,COMPLETE
1077,1077,0.7684140306626602,2022-12-01 04:17:32.232426,2022-12-01 04:17:52.985871,0 days 00:00:20.753445,"{0: 1, 1: 10}",22.0,1.0,960,COMPLETE
1078,1078,0.7683106806788981,2022-12-01 04:17:53.213555,2022-12-01 04:18:13.896811,0 days 00:00:20.683256,"{0: 1, 1: 10}",22.0,1.0,960,COMPLETE
1079,1079,0.7660058602526922,2022-12-01 04:18:14.123127,2022-12-01 04:18:34.798293,0 days 00:00:20.675166,"{0: 1, 1: 10}",22.0,1.0,960,COMPLETE
1080,1080,0.76368369389051,2022-12-01 04:18:35.017953,2022-12-01 04:18:55.800465,0 days 00:00:20.782512,"{0: 1, 1: 10}",15.0,1.0,960,COMPLETE
1081,1081,0.7684663366262922,2022-12-01 04:18:56.027877,2022-12-01 04:19:15.897334,0 days 00:00:19.869457,"{0: 1, 1: 10}",22.0,1.0,910,COMPLETE
1082,1082,0.7665758737055859,2022-12-01 04:19:16.121572,2022-12-01 04:19:36.756014,0 days 00:00:20.634442,"{0: 1, 1: 10}",22.0,1.0,960,COMPLETE
1083,1083,0.7677973438435937,2022-12-01 04:19:36.991069,2022-12-01 04:19:57.014349,0 days 00:00:20.023280,"{0: 1, 1: 10}",22.0,1.0,910,COMPLETE
1084,1084,0.7663222084634516,2022-12-01 04:19:57.237247,2022-12-01 04:20:17.906275,0 days 00:00:20.669028,"{0: 1, 1: 10}",22.0,1.0,960,COMPLETE
1085,1085,0.7646008067418745,2022-12-01 04:20:18.131705,2022-12-01 04:20:38.111982,0 days 00:00:19.980277,"{0: 1, 1: 10}",15.0,1.0,910,COMPLETE
1086,1086,0.7708153362397819,2022-12-01 04:20:38.340037,2022-12-01 04:20:59.063881,0 days 00:00:20.723844,"{0: 1, 1: 10}",22.0,1.0,960,COMPLETE
1087,1087,0.770285022211282,2022-12-01 04:20:59.284669,2022-12-01 04:21:20.027776,0 days 00:00:20.743107,"{0: 1, 1: 10}",22.0,1.0,960,COMPLETE
1088,1088,0.7658357645477191,2022-12-01 04:21:20.255690,2022-12-01 04:21:41.003879,0 days 00:00:20.748189,"{0: 1, 1: 10}",22.0,1.0,960,COMPLETE
1089,1089,0.7731155753504532,2022-12-01 04:21:41.230482,2022-12-01 04:22:01.052669,0 days 00:00:19.822187,"{0: 1, 1: 10}",22.0,1.0,910,COMPLETE
1090,1090,0.7675079205941012,2022-12-01 04:22:01.276868,2022-12-01 04:22:21.006776,0 days 00:00:19.729908,"{0: 1, 1: 10}",22.0,1.0,910,COMPLETE
1091,1091,0.765363376490238,2022-12-01 04:22:21.242981,2022-12-01 04:22:40.982462,0 days 00:00:19.739481,"{0: 1, 1: 10}",15.0,1.0,910,COMPLETE
1092,1092,0.7713618155216582,2022-12-01 04:22:41.208027,2022-12-01 04:23:01.206078,0 days 00:00:19.998051,"{0: 1, 1: 10}",22.0,1.0,910,COMPLETE
1093,1093,0.7640018954272445,2022-12-01 04:23:01.433576,2022-12-01 04:23:21.258230,0 days 00:00:19.824654,"{0: 1, 1: 10}",22.0,1.0,910,COMPLETE
1094,1094,0.7688356466133358,2022-12-01 04:23:21.481392,2022-12-01 04:23:41.383783,0 days 00:00:19.902391,"{0: 1, 1: 10}",22.0,1.0,910,COMPLETE
1095,1095,0.7676540648318466,2022-12-01 04:23:41.606172,2022-12-01 04:24:01.561901,0 days 00:00:19.955729,"{0: 1, 1: 10}",22.0,1.0,910,COMPLETE
1096,1096,0.7681815599832738,2022-12-01 04:24:01.794059,2022-12-01 04:24:21.704048,0 days 00:00:19.909989,"{0: 1, 1: 10}",22.0,1.0,910,COMPLETE
1097,1097,0.7702771170816162,2022-12-01 04:24:21.925241,2022-12-01 04:24:41.822579,0 days 00:00:19.897338,"{0: 1, 1: 10}",22.0,1.0,910,COMPLETE
1098,1098,0.7670838888489737,2022-12-01 04:24:42.046848,2022-12-01 04:25:01.751867,0 days 00:00:19.705019,"{0: 1, 1: 10}",22.0,1.0,910,COMPLETE
1099,1099,0.7629002919218696,2022-12-01 04:25:01.980036,2022-12-01 04:25:21.758019,0 days 00:00:19.777983,"{0: 1, 1: 10}",15.0,1.0,910,COMPLETE
1100,1100,0.7675647996195473,2022-12-01 04:25:21.981013,2022-12-01 04:25:41.756622,0 days 00:00:19.775609,"{0: 1, 1: 10}",22.0,1.0,910,COMPLETE
1101,1101,0.7673343320269,2022-12-01 04:25:41.986782,2022-12-01 04:26:01.703338,0 days 00:00:19.716556,"{0: 1, 1: 10}",22.0,1.0,910,COMPLETE
1102,1102,0.7682651690562361,2022-12-01 04:26:01.930806,2022-12-01 04:26:21.827564,0 days 00:00:19.896758,"{0: 1, 1: 10}",22.0,1.0,910,COMPLETE
1103,1103,0.7684739499163833,2022-12-01 04:26:22.044968,2022-12-01 04:26:41.898253,0 days 00:00:19.853285,"{0: 1, 1: 10}",22.0,1.0,910,COMPLETE
1104,1104,0.765393145420268,2022-12-01 04:26:42.127827,2022-12-01 04:27:01.944741,0 days 00:00:19.816914,"{0: 1, 1: 10}",22.0,1.0,910,COMPLETE
1105,1105,0.7688490120692627,2022-12-01 04:27:02.172216,2022-12-01 04:27:22.149329,0 days 00:00:19.977113,"{0: 1, 1: 10}",15.0,1.0,910,COMPLETE
1106,1106,0.7648837538400938,2022-12-01 04:27:22.378670,2022-12-01 04:27:42.239007,0 days 00:00:19.860337,"{0: 1, 1: 10}",22.0,1.0,910,COMPLETE
1107,1107,0.7654330002665373,2022-12-01 04:27:42.464473,2022-12-01 04:28:03.151333,0 days 00:00:20.686860,"{0: 1, 1: 10}",22.0,1.0,960,COMPLETE
1108,1108,0.7651230726601326,2022-12-01 04:28:03.377900,2022-12-01 04:28:23.823201,0 days 00:00:20.445301,"{0: 1, 1: 10}",22.0,1.0,960,COMPLETE
1109,1109,0.7675841074184677,2022-12-01 04:28:24.044677,2022-12-01 04:28:44.006083,0 days 00:00:19.961406,"{0: 1, 1: 10}",22.0,1.0,910,COMPLETE
1110,1110,0.7708729011538721,2022-12-01 04:28:44.237698,2022-12-01 04:29:04.933754,0 days 00:00:20.696056,"{0: 1, 1: 10}",22.0,1.0,960,COMPLETE
1111,1111,0.7639819688149775,2022-12-01 04:29:05.162348,2022-12-01 04:29:25.875913,0 days 00:00:20.713565,"{0: 1, 1: 10}",22.0,1.0,960,COMPLETE
1112,1112,0.7719910685809671,2022-12-01 04:29:26.098841,2022-12-01 04:29:46.755476,0 days 00:00:20.656635,"{0: 1, 1: 10}",22.0,1.0,960,COMPLETE
1113,1113,0.7655636886772709,2022-12-01 04:29:46.981729,2022-12-01 04:30:07.484480,0 days 00:00:20.502751,"{0: 1, 1: 10}",22.0,1.0,960,COMPLETE
1114,1114,0.7700289784451841,2022-12-01 04:30:07.698056,2022-12-01 04:30:28.433364,0 days 00:00:20.735308,"{0: 1, 1: 10}",22.0,1.0,960,COMPLETE
