,number,value,datetime_start,datetime_complete,duration,params_class_weight,params_max_depth,params_max_features,params_n_estimators,state
1266,1266,0.7649963436617325,2022-12-01 05:21:54.486668,2022-12-01 05:22:14.407935,0 days 00:00:19.921267,"{0: 1, 1: 10}",11.0,1.0,910,COMPLETE
1267,1267,0.7644457713253129,2022-12-01 05:22:14.628726,2022-12-01 05:22:33.617365,0 days 00:00:18.988639,"{0: 1, 1: 10}",11.0,1.0,860,COMPLETE
1268,1268,0.7674483794281577,2022-12-01 05:22:33.843166,2022-12-01 05:22:53.761331,0 days 00:00:19.918165,"{0: 1, 1: 10}",11.0,1.0,910,COMPLETE
1269,1269,0.7712790843995344,2022-12-01 05:22:53.986611,2022-12-01 05:23:13.962647,0 days 00:00:19.976036,"{0: 1, 1: 10}",11.0,1.0,910,COMPLETE
1270,1270,0.7659750223575517,2022-12-01 05:23:14.185523,2022-12-01 05:23:34.139993,0 days 00:00:19.954470,"{0: 1, 1: 10}",11.0,1.0,910,COMPLETE
1271,1271,0.7686121603000867,2022-12-01 05:23:34.366857,2022-12-01 05:23:54.282706,0 days 00:00:19.915849,"{0: 1, 1: 10}",11.0,1.0,910,COMPLETE
1272,1272,0.7709131114932841,2022-12-01 05:23:54.511328,2022-12-01 05:24:15.101492,0 days 00:00:20.590164,"{0: 1, 1: 10}",11.0,1.0,960,COMPLETE
1273,1273,0.7728221358680477,2022-12-01 05:24:15.334036,2022-12-01 05:24:35.210808,0 days 00:00:19.876772,"{0: 1, 1: 10}",11.0,1.0,910,COMPLETE
1274,1274,0.7630265648341217,2022-12-01 05:24:35.450904,2022-12-01 05:24:55.978726,0 days 00:00:20.527822,"{0: 1, 1: 10}",11.0,1.0,960,COMPLETE
1275,1275,0.7697066552969993,2022-12-01 05:24:56.203974,2022-12-01 05:25:15.358629,0 days 00:00:19.154655,"{0: 1, 1: 10}",11.0,1.0,860,COMPLETE
1276,1276,0.7573924605276882,2022-12-01 05:25:15.589928,2022-12-01 05:25:34.746111,0 days 00:00:19.156183,"{0: 1, 1: 10}",4.0,1.0,910,COMPLETE
1277,1277,0.7685410722001152,2022-12-01 05:25:34.976085,2022-12-01 05:25:55.701900,0 days 00:00:20.725815,"{0: 1, 1: 10}",11.0,1.0,960,COMPLETE
1278,1278,0.7670164684798271,2022-12-01 05:25:55.926239,2022-12-01 05:26:16.690397,0 days 00:00:20.764158,"{0: 1, 1: 10}",21.0,1.0,960,COMPLETE
1279,1279,0.7673381635130221,2022-12-01 05:26:16.932151,2022-12-01 05:26:37.441795,0 days 00:00:20.509644,"{0: 1, 1: 10}",11.0,1.0,960,COMPLETE
1280,1280,0.7669908398621877,2022-12-01 05:26:37.664220,2022-12-01 05:26:57.634262,0 days 00:00:19.970042,"{0: 1, 1: 10}",24.0,1.0,910,COMPLETE
1281,1281,0.7597200915385109,2022-12-01 05:26:57.866279,2022-12-01 05:27:17.670227,0 days 00:00:19.803948,"{0: 1, 1: 10}",11.0,1.0,910,COMPLETE
1282,1282,0.7684232929764973,2022-12-01 05:27:17.901369,2022-12-01 05:27:38.535499,0 days 00:00:20.634130,"{0: 1, 1: 10}",11.0,1.0,960,COMPLETE
1283,1283,0.772432077324834,2022-12-01 05:27:38.764221,2022-12-01 05:27:57.928749,0 days 00:00:19.164528,"{0: 1, 1: 10}",11.0,1.0,860,COMPLETE
1284,1284,0.7712409337348327,2022-12-01 05:27:58.160482,2022-12-01 05:28:17.341054,0 days 00:00:19.180572,"{0: 1, 1: 10}",11.0,1.0,860,COMPLETE
1285,1285,0.7690764521746425,2022-12-01 05:28:17.557432,2022-12-01 05:28:38.118584,0 days 00:00:20.561152,"{0: 1, 1: 10}",11.0,1.0,960,COMPLETE
1286,1286,0.7718097350973306,2022-12-01 05:28:38.350956,2022-12-01 05:28:59.084237,0 days 00:00:20.733281,"{0: 1, 1: 10}",11.0,1.0,960,COMPLETE
1287,1287,0.7684818507619837,2022-12-01 05:28:59.311210,2022-12-01 05:29:19.966344,0 days 00:00:20.655134,"{0: 1, 1: 10}",11.0,1.0,960,COMPLETE
1288,1288,0.7652316908520999,2022-12-01 05:29:20.198133,2022-12-01 05:29:40.791974,0 days 00:00:20.593841,"{0: 1, 1: 10}",11.0,1.0,960,COMPLETE
1289,1289,0.761488633026136,2022-12-01 05:29:41.021002,2022-12-01 05:30:00.838547,0 days 00:00:19.817545,"{0: 1, 1: 10}",11.0,1.0,910,COMPLETE
1290,1290,0.7673907029213753,2022-12-01 05:30:01.061847,2022-12-01 05:30:21.600371,0 days 00:00:20.538524,"{0: 1, 1: 10}",11.0,1.0,960,COMPLETE
1291,1291,0.7741803077694117,2022-12-01 05:30:21.825037,2022-12-01 05:30:41.007437,0 days 00:00:19.182400,"{0: 1, 1: 10}",11.0,1.0,860,COMPLETE
1292,1292,0.7720405581315626,2022-12-01 05:30:41.234336,2022-12-01 05:31:00.324756,0 days 00:00:19.090420,"{0: 1, 1: 10}",11.0,1.0,860,COMPLETE
1293,1293,0.7703016316239046,2022-12-01 05:31:00.552121,2022-12-01 05:31:19.639894,0 days 00:00:19.087773,"{0: 1, 1: 10}",11.0,1.0,860,COMPLETE
1294,1294,0.7637547502137094,2022-12-01 05:31:19.877676,2022-12-01 05:31:38.903557,0 days 00:00:19.025881,"{0: 1, 1: 10}",11.0,1.0,860,COMPLETE
1295,1295,0.7666389294518602,2022-12-01 05:31:39.133202,2022-12-01 05:31:58.157382,0 days 00:00:19.024180,"{0: 1, 1: 10}",11.0,1.0,860,COMPLETE
1296,1296,0.7696697290828763,2022-12-01 05:31:58.382275,2022-12-01 05:32:17.471189,0 days 00:00:19.088914,"{0: 1, 1: 10}",11.0,1.0,860,COMPLETE
1297,1297,0.77030380357311,2022-12-01 05:32:17.688027,2022-12-01 05:32:36.839995,0 days 00:00:19.151968,"{0: 1, 1: 10}",11.0,1.0,860,COMPLETE
1298,1298,0.7643212179070197,2022-12-01 05:32:37.069409,2022-12-01 05:32:56.161881,0 days 00:00:19.092472,"{0: 1, 1: 10}",11.0,1.0,860,COMPLETE
1299,1299,0.7720213215002999,2022-12-01 05:32:56.392793,2022-12-01 05:33:15.398985,0 days 00:00:19.006192,"{0: 1, 1: 10}",11.0,1.0,860,COMPLETE
1300,1300,0.766706999138918,2022-12-01 05:33:15.623131,2022-12-01 05:33:34.708174,0 days 00:00:19.085043,"{0: 1, 1: 10}",11.0,1.0,860,COMPLETE
1301,1301,0.7690718730252808,2022-12-01 05:33:34.938944,2022-12-01 05:33:53.856205,0 days 00:00:18.917261,"{0: 1, 1: 10}",11.0,1.0,860,COMPLETE
1302,1302,0.7668731821108211,2022-12-01 05:33:54.085261,2022-12-01 05:34:13.322571,0 days 00:00:19.237310,"{0: 1, 1: 10}",11.0,1.0,860,COMPLETE
1303,1303,0.7728956338038852,2022-12-01 05:34:13.550068,2022-12-01 05:34:32.549164,0 days 00:00:18.999096,"{0: 1, 1: 10}",11.0,1.0,860,COMPLETE
1304,1304,0.7670381396758391,2022-12-01 05:34:32.779586,2022-12-01 05:34:51.795899,0 days 00:00:19.016313,"{0: 1, 1: 10}",11.0,1.0,860,COMPLETE
1305,1305,0.7651120716861886,2022-12-01 05:34:52.025205,2022-12-01 05:35:11.054589,0 days 00:00:19.029384,"{0: 1, 1: 10}",11.0,1.0,860,COMPLETE
1306,1306,0.7652996628695656,2022-12-01 05:35:11.290805,2022-12-01 05:35:30.249888,0 days 00:00:18.959083,"{0: 1, 1: 10}",11.0,1.0,860,COMPLETE
1307,1307,0.7671686778430232,2022-12-01 05:35:30.475899,2022-12-01 05:35:49.582703,0 days 00:00:19.106804,"{0: 1, 1: 10}",11.0,1.0,860,COMPLETE
1308,1308,0.7692279333134462,2022-12-01 05:35:49.813048,2022-12-01 05:36:08.899388,0 days 00:00:19.086340,"{0: 1, 1: 10}",11.0,1.0,860,COMPLETE
1309,1309,0.7667494618685451,2022-12-01 05:36:09.138237,2022-12-01 05:36:28.143406,0 days 00:00:19.005169,"{0: 1, 1: 10}",11.0,1.0,860,COMPLETE
1310,1310,0.7698525343735048,2022-12-01 05:36:28.368136,2022-12-01 05:36:47.505676,0 days 00:00:19.137540,"{0: 1, 1: 10}",11.0,1.0,860,COMPLETE
1311,1311,0.7683886013342537,2022-12-01 05:36:47.737404,2022-12-01 05:37:06.810964,0 days 00:00:19.073560,"{0: 1, 1: 10}",11.0,1.0,860,COMPLETE
1312,1312,0.7699633845233935,2022-12-01 05:37:07.039346,2022-12-01 05:37:25.949509,0 days 00:00:18.910163,"{0: 1, 1: 10}",11.0,1.0,860,COMPLETE
1313,1313,0.7634409586062653,2022-12-01 05:37:26.183598,2022-12-01 05:37:45.157317,0 days 00:00:18.973719,"{0: 1, 1: 10}",11.0,1.0,860,COMPLETE
1314,1314,0.7692121326487379,2022-12-01 05:37:45.382812,2022-12-01 05:38:04.381170,0 days 00:00:18.998358,"{0: 1, 1: 10}",11.0,1.0,860,COMPLETE
1315,1315,0.7631556503964758,2022-12-01 05:38:04.611309,2022-12-01 05:38:23.622452,0 days 00:00:19.011143,"{0: 1, 1: 10}",11.0,1.0,860,COMPLETE
1316,1316,0.7716577263142987,2022-12-01 05:38:23.848920,2022-12-01 05:38:42.812002,0 days 00:00:18.963082,"{0: 1, 1: 10}",11.0,1.0,860,COMPLETE
1317,1317,0.7735769150736986,2022-12-01 05:38:43.041298,2022-12-01 05:39:02.212651,0 days 00:00:19.171353,"{0: 1, 1: 10}",11.0,1.0,860,COMPLETE
1318,1318,0.7719257971915783,2022-12-01 05:39:02.435823,2022-12-01 05:39:21.405510,0 days 00:00:18.969687,"{0: 1, 1: 10}",11.0,1.0,860,COMPLETE
1319,1319,0.7678295300954502,2022-12-01 05:39:21.636067,2022-12-01 05:39:40.611982,0 days 00:00:18.975915,"{0: 1, 1: 10}",11.0,1.0,860,COMPLETE
1320,1320,0.7644153099626434,2022-12-01 05:39:40.842944,2022-12-01 05:39:59.704647,0 days 00:00:18.861703,"{0: 1, 1: 10}",11.0,1.0,860,COMPLETE
1321,1321,0.7647824316588328,2022-12-01 05:39:59.932042,2022-12-01 05:40:18.962556,0 days 00:00:19.030514,"{0: 1, 1: 10}",11.0,1.0,860,COMPLETE
1322,1322,0.7676271903794671,2022-12-01 05:40:19.196684,2022-12-01 05:40:38.294837,0 days 00:00:19.098153,"{0: 1, 1: 10}",11.0,1.0,860,COMPLETE
1323,1323,0.7665380331899014,2022-12-01 05:40:38.528442,2022-12-01 05:40:57.611049,0 days 00:00:19.082607,"{0: 1, 1: 10}",11.0,1.0,860,COMPLETE
1324,1324,0.7606741285463986,2022-12-01 05:40:57.853700,2022-12-01 05:41:16.903986,0 days 00:00:19.050286,"{0: 1, 1: 10}",11.0,1.0,860,COMPLETE
1325,1325,0.7685390080372999,2022-12-01 05:41:17.134563,2022-12-01 05:41:36.124825,0 days 00:00:18.990262,"{0: 1, 1: 10}",11.0,1.0,860,COMPLETE
1326,1326,0.769850618580409,2022-12-01 05:41:36.355099,2022-12-01 05:41:55.335842,0 days 00:00:18.980743,"{0: 1, 1: 10}",,1.0,860,COMPLETE
1327,1327,0.7677208470179007,2022-12-01 05:41:55.566633,2022-12-01 05:42:14.674098,0 days 00:00:19.107465,"{0: 1, 1: 10}",11.0,1.0,860,COMPLETE
1328,1328,0.7690954136215857,2022-12-01 05:42:14.905558,2022-12-01 05:42:33.982703,0 days 00:00:19.077145,"{0: 1, 1: 10}",11.0,1.0,860,COMPLETE
1329,1329,0.7660842728649475,2022-12-01 05:42:34.214181,2022-12-01 05:42:52.457062,0 days 00:00:18.242881,"{0: 1, 1: 10}",11.0,1.0,810,COMPLETE
1330,1330,0.7579567497092243,2022-12-01 05:42:52.687567,2022-12-01 05:43:09.898144,0 days 00:00:17.210577,"{0: 1, 1: 10}",3.0,1.0,860,COMPLETE
1331,1331,0.7709872553969042,2022-12-01 05:43:10.126182,2022-12-01 05:43:29.193840,0 days 00:00:19.067658,"{0: 1, 1: 10}",11.0,1.0,860,COMPLETE
1332,1332,0.7666820651530422,2022-12-01 05:43:29.425119,2022-12-01 05:43:47.706664,0 days 00:00:18.281545,"{0: 1, 1: 10}",11.0,1.0,810,COMPLETE
1333,1333,0.7693017269137915,2022-12-01 05:43:47.938604,2022-12-01 05:44:06.965526,0 days 00:00:19.026922,"{0: 1, 1: 10}",11.0,1.0,860,COMPLETE
1334,1334,0.7715667120687778,2022-12-01 05:44:07.191188,2022-12-01 05:44:26.143457,0 days 00:00:18.952269,"{0: 1, 1: 10}",25.0,1.0,860,COMPLETE
1335,1335,0.7699954475191041,2022-12-01 05:44:26.374759,2022-12-01 05:44:45.524151,0 days 00:00:19.149392,"{0: 1, 1: 10}",31.0,1.0,860,COMPLETE
1336,1336,0.7651576806536751,2022-12-01 05:44:45.752603,2022-12-01 05:45:03.960496,0 days 00:00:18.207893,"{0: 1, 1: 10}",11.0,1.0,810,COMPLETE
1337,1337,0.7727378702108447,2022-12-01 05:45:04.183314,2022-12-01 05:45:23.303362,0 days 00:00:19.120048,"{0: 1, 1: 10}",11.0,1.0,860,COMPLETE
1338,1338,0.7679020406732181,2022-12-01 05:45:23.534569,2022-12-01 05:45:42.692765,0 days 00:00:19.158196,"{0: 1, 1: 10}",11.0,1.0,860,COMPLETE
1339,1339,0.7693063201146166,2022-12-01 05:45:42.922517,2022-12-01 05:46:02.692707,0 days 00:00:19.770190,"{0: 1, 1: 10}",11.0,1.0,910,COMPLETE
1340,1340,0.7567638526486808,2022-12-01 05:46:02.922703,2022-12-01 05:46:21.495948,0 days 00:00:18.573245,"{0: 1, 1: 10}",4.0,1.0,860,COMPLETE
1341,1341,0.7671316266092351,2022-12-01 05:46:21.722070,2022-12-01 05:46:41.647758,0 days 00:00:19.925688,"{0: 1, 1: 10}",11.0,1.0,910,COMPLETE
1342,1342,0.7700463807966281,2022-12-01 05:46:41.878468,2022-12-01 05:47:00.319902,0 days 00:00:18.441434,"{0: 1, 1: 10}",21.0,1.0,810,COMPLETE
1343,1343,0.7636760558276952,2022-12-01 05:47:00.550160,2022-12-01 05:47:20.605202,0 days 00:00:20.055042,"{0: 1, 1: 10}",11.0,1.0,910,COMPLETE
1344,1344,0.7713786517522772,2022-12-01 05:47:20.834892,2022-12-01 05:47:40.575342,0 days 00:00:19.740450,"{0: 1, 1: 10}",11.0,1.0,910,COMPLETE
1345,1345,0.753066476110763,2022-12-01 05:47:40.804479,2022-12-01 05:47:59.660308,0 days 00:00:18.855829,"{0: 1, 1: 10}",7.0,1.0,860,COMPLETE
1346,1346,0.7682405304600318,2022-12-01 05:47:59.888864,2022-12-01 05:48:19.952839,0 days 00:00:20.063975,"{0: 1, 1: 10}",11.0,1.0,910,COMPLETE
1347,1347,0.7669755524569842,2022-12-01 05:48:20.183475,2022-12-01 05:48:39.242612,0 days 00:00:19.059137,"{0: 1, 1: 10}",11.0,1.0,860,COMPLETE
1348,1348,0.7666862234254831,2022-12-01 05:48:39.473344,2022-12-01 05:48:59.381771,0 days 00:00:19.908427,"{0: 1, 1: 10}",12.0,1.0,910,COMPLETE
1349,1349,0.7665863161068536,2022-12-01 05:48:59.619785,2022-12-01 05:49:18.735283,0 days 00:00:19.115498,"{0: 1, 1: 10}",11.0,1.0,860,COMPLETE
1350,1350,0.7656686539890184,2022-12-01 05:49:18.963737,2022-12-01 05:49:37.437796,0 days 00:00:18.474059,"{0: 1, 1: 10}",11.0,1.0,810,COMPLETE
1351,1351,0.7676697738611585,2022-12-01 05:49:37.671741,2022-12-01 05:49:57.555950,0 days 00:00:19.884209,"{0: 1, 1: 10}",,1.0,910,COMPLETE
1352,1352,0.7665516528477934,2022-12-01 05:49:57.788352,2022-12-01 05:50:17.587781,0 days 00:00:19.799429,"{0: 1, 1: 10}",11.0,1.0,910,COMPLETE
1353,1353,0.7666437833865241,2022-12-01 05:50:17.818738,2022-12-01 05:50:36.872710,0 days 00:00:19.053972,"{0: 1, 1: 10}",11.0,1.0,860,COMPLETE
1354,1354,0.765020359905221,2022-12-01 05:50:37.100436,2022-12-01 05:50:56.969635,0 days 00:00:19.869199,"{0: 1, 1: 10}",11.0,1.0,910,COMPLETE
1355,1355,0.7706650347068885,2022-12-01 05:50:57.201930,2022-12-01 05:51:16.254744,0 days 00:00:19.052814,"{0: 1, 1: 10}",27.0,1.0,860,COMPLETE
1356,1356,0.7600940889012255,2022-12-01 05:51:16.483550,2022-12-01 05:51:34.308184,0 days 00:00:17.824634,"{0: 1, 1: 10}",3.0,1.0,910,COMPLETE
1357,1357,0.7700239090977752,2022-12-01 05:51:34.542733,2022-12-01 05:51:54.363252,0 days 00:00:19.820519,"{0: 1, 1: 10}",11.0,1.0,910,COMPLETE
1358,1358,0.7652830628445322,2022-12-01 05:51:54.586506,2022-12-01 05:52:13.669702,0 days 00:00:19.083196,"{0: 1, 1: 10}",31.0,1.0,860,COMPLETE
1359,1359,0.7694623659039428,2022-12-01 05:52:13.899929,2022-12-01 05:52:33.575982,0 days 00:00:19.676053,"{0: 1, 1: 10}",11.0,1.0,910,COMPLETE
1360,1360,0.7696574902504647,2022-12-01 05:52:33.809497,2022-12-01 05:52:52.020396,0 days 00:00:18.210899,"{0: 1, 1: 10}",11.0,1.0,810,COMPLETE
1361,1361,0.769374264922424,2022-12-01 05:52:52.245597,2022-12-01 05:53:11.372648,0 days 00:00:19.127051,"{0: 1, 1: 10}",25.0,1.0,860,COMPLETE
1362,1362,0.7663233868116374,2022-12-01 05:53:11.610074,2022-12-01 05:53:31.441373,0 days 00:00:19.831299,"{0: 1, 1: 10}",11.0,1.0,910,COMPLETE
1363,1363,0.7690362512592052,2022-12-01 05:53:31.674372,2022-12-01 05:53:51.543993,0 days 00:00:19.869621,"{0: 1, 1: 10}",11.0,1.0,910,COMPLETE
1364,1364,0.7689415187166581,2022-12-01 05:53:51.770674,2022-12-01 05:54:11.662706,0 days 00:00:19.892032,"{0: 1, 1: 10}",11.0,1.0,910,COMPLETE
1365,1365,0.7658439150581555,2022-12-01 05:54:11.893090,2022-12-01 05:54:31.050754,0 days 00:00:19.157664,"{0: 1, 1: 10}",35.0,1.0,860,COMPLETE
1366,1366,0.7663126993311326,2022-12-01 05:54:31.282698,2022-12-01 05:54:49.682282,0 days 00:00:18.399584,"{0: 1, 1: 10}",18.0,1.0,810,COMPLETE
1367,1367,0.7641070736242487,2022-12-01 05:54:49.909454,2022-12-01 05:55:08.959268,0 days 00:00:19.049814,"{0: 1, 1: 10}",21.0,1.0,860,COMPLETE
1368,1368,0.7690433113792677,2022-12-01 05:55:09.190400,2022-12-01 05:55:29.116599,0 days 00:00:19.926199,"{0: 1, 1: 10}",11.0,1.0,910,COMPLETE
1369,1369,0.7676426294146029,2022-12-01 05:55:29.344297,2022-12-01 05:55:49.390233,0 days 00:00:20.045936,"{0: 1, 1: 10}",39.0,1.0,910,COMPLETE
1370,1370,0.757100017862131,2022-12-01 05:55:49.616660,2022-12-01 05:56:08.325370,0 days 00:00:18.708710,"{0: 1, 1: 10}",5.0,1.0,860,COMPLETE
1371,1371,0.7556566466978748,2022-12-01 05:56:08.563446,2022-12-01 05:56:27.952056,0 days 00:00:19.388610,"{0: 1, 1: 10}",4.0,1.0,910,COMPLETE
1372,1372,0.763354575444438,2022-12-01 05:56:28.190071,2022-12-01 05:56:47.171261,0 days 00:00:18.981190,"{0: 1, 1: 10}",19.0,1.0,860,COMPLETE
1373,1373,0.7674452981968943,2022-12-01 05:56:47.402890,2022-12-01 05:57:07.294993,0 days 00:00:19.892103,"{0: 1, 1: 10}",13.0,1.0,910,COMPLETE
1374,1374,0.7728963423410008,2022-12-01 05:57:07.529004,2022-12-01 05:57:26.766774,0 days 00:00:19.237770,"{0: 1, 1: 10}",11.0,1.0,860,COMPLETE
1375,1375,0.7673712692278212,2022-12-01 05:57:26.995144,2022-12-01 05:57:45.283940,0 days 00:00:18.288796,"{0: 1, 1: 10}",11.0,1.0,810,COMPLETE
1376,1376,0.7742716265432951,2022-12-01 05:57:45.511206,2022-12-01 05:58:04.543471,0 days 00:00:19.032265,"{0: 1, 1: 10}",11.0,1.0,860,COMPLETE
1377,1377,0.7656200403189108,2022-12-01 05:58:04.769847,2022-12-01 05:58:22.953602,0 days 00:00:18.183755,"{0: 1, 1: 10}",11.0,1.0,810,COMPLETE
1378,1378,0.7673729057157701,2022-12-01 05:58:23.190669,2022-12-01 05:58:41.641130,0 days 00:00:18.450461,"{0: 1, 1: 10}",11.0,1.0,810,COMPLETE
1379,1379,0.7662928243569398,2022-12-01 05:58:41.876883,2022-12-01 05:59:00.849651,0 days 00:00:18.972768,"{0: 1, 1: 10}",11.0,1.0,860,COMPLETE
1380,1380,0.7642420687417655,2022-12-01 05:59:01.081636,2022-12-01 05:59:20.140177,0 days 00:00:19.058541,"{0: 1, 1: 10}",11.0,1.0,860,COMPLETE
1381,1381,0.7684832287811725,2022-12-01 05:59:20.371787,2022-12-01 05:59:39.751182,0 days 00:00:19.379395,"{0: 1, 1: 10}",11.0,1.0,860,COMPLETE
1382,1382,0.7660773541561131,2022-12-01 05:59:39.978413,2022-12-01 05:59:58.324279,0 days 00:00:18.345866,"{0: 1, 1: 10}",11.0,1.0,810,COMPLETE
1383,1383,0.7666434350407343,2022-12-01 05:59:58.547325,2022-12-01 06:00:17.703038,0 days 00:00:19.155713,"{0: 1, 1: 10}",11.0,1.0,860,COMPLETE
1384,1384,0.7720928975155992,2022-12-01 06:00:17.934839,2022-12-01 06:00:37.140145,0 days 00:00:19.205306,"{0: 1, 1: 10}",11.0,1.0,860,COMPLETE
1385,1385,0.7706403240294134,2022-12-01 06:00:37.378131,2022-12-01 06:00:56.661160,0 days 00:00:19.283029,"{0: 1, 1: 10}",11.0,1.0,860,COMPLETE
1386,1386,0.7626687080955163,2022-12-01 06:00:56.885967,2022-12-01 06:01:15.206632,0 days 00:00:18.320665,"{0: 1, 1: 10}",12.0,1.0,810,COMPLETE
1387,1387,0.7670161167430616,2022-12-01 06:01:15.438408,2022-12-01 06:01:34.482412,0 days 00:00:19.044004,"{0: 1, 1: 10}",11.0,1.0,860,COMPLETE
1388,1388,0.7574386557514228,2022-12-01 06:01:34.725446,2022-12-01 06:01:52.907319,0 days 00:00:18.181873,"{0: 1, 1: 10}",7.0,1.0,810,COMPLETE
1389,1389,0.7695275962034566,2022-12-01 06:01:53.139407,2022-12-01 06:02:12.269762,0 days 00:00:19.130355,"{0: 1, 1: 10}",15.0,1.0,860,COMPLETE
1390,1390,0.7633630818080505,2022-12-01 06:02:12.500906,2022-12-01 06:02:31.526745,0 days 00:00:19.025839,"{0: 1, 1: 10}",11.0,1.0,860,COMPLETE
1391,1391,0.7607911620146601,2022-12-01 06:02:31.758820,2022-12-01 06:02:50.931224,0 days 00:00:19.172404,"{0: 1, 1: 10}",,1.0,860,COMPLETE
1392,1392,0.7646624196400955,2022-12-01 06:02:51.153333,2022-12-01 06:03:09.531367,0 days 00:00:18.378034,"{0: 1, 1: 10}",11.0,1.0,810,COMPLETE
1393,1393,0.7685202104457247,2022-12-01 06:03:09.761392,2022-12-01 06:03:28.917107,0 days 00:00:19.155715,"{0: 1, 1: 10}",11.0,1.0,860,COMPLETE
1394,1394,0.770161040476647,2022-12-01 06:03:29.150075,2022-12-01 06:03:48.305232,0 days 00:00:19.155157,"{0: 1, 1: 10}",11.0,1.0,860,COMPLETE
1395,1395,0.7668679163951914,2022-12-01 06:03:48.534839,2022-12-01 06:04:07.606577,0 days 00:00:19.071738,"{0: 1, 1: 10}",11.0,1.0,860,COMPLETE
1396,1396,0.7687834312915436,2022-12-01 06:04:07.842535,2022-12-01 06:04:26.870021,0 days 00:00:19.027486,"{0: 1, 1: 10}",11.0,1.0,860,COMPLETE
1397,1397,0.7591135327648517,2022-12-01 06:04:27.102343,2022-12-01 06:04:43.726939,0 days 00:00:16.624596,"{0: 1, 1: 10}",3.0,1.0,810,COMPLETE
1398,1398,0.7690073250516228,2022-12-01 06:04:43.953998,2022-12-01 06:05:03.022243,0 days 00:00:19.068245,"{0: 1, 1: 10}",27.0,1.0,860,COMPLETE
1399,1399,0.7689828000408238,2022-12-01 06:05:03.251043,2022-12-01 06:05:21.542441,0 days 00:00:18.291398,"{0: 1, 1: 10}",11.0,1.0,810,COMPLETE
1400,1400,0.7699193586536826,2022-12-01 06:05:21.766868,2022-12-01 06:05:40.752657,0 days 00:00:18.985789,"{0: 1, 1: 10}",11.0,1.0,860,COMPLETE
1401,1401,0.7617918344330812,2022-12-01 06:05:40.988021,2022-12-01 06:06:00.084457,0 days 00:00:19.096436,"{0: 1, 1: 10}",31.0,1.0,860,COMPLETE
1402,1402,0.7679552622754987,2022-12-01 06:06:00.328068,2022-12-01 06:06:20.124057,0 days 00:00:19.795989,"{0: 1, 1: 10}",16.0,1.0,910,COMPLETE
1403,1403,0.7698190743894667,2022-12-01 06:06:20.356130,2022-12-01 06:06:40.155536,0 days 00:00:19.799406,"{0: 1, 1: 10}",11.0,1.0,910,COMPLETE
1404,1404,0.769671974394659,2022-12-01 06:06:40.390334,2022-12-01 06:06:59.522631,0 days 00:00:19.132297,"{0: 1, 1: 10}",15.0,1.0,860,COMPLETE
1405,1405,0.771282928343733,2022-12-01 06:06:59.747887,2022-12-01 06:07:19.543846,0 days 00:00:19.795959,"{0: 1, 1: 10}",11.0,1.0,910,COMPLETE
1406,1406,0.7524533597001942,2022-12-01 06:07:19.775390,2022-12-01 06:07:38.507465,0 days 00:00:18.732075,"{0: 1, 1: 10}",6.0,1.0,860,COMPLETE
1407,1407,0.7625909570381831,2022-12-01 06:07:38.748919,2022-12-01 06:07:57.104142,0 days 00:00:18.355223,"{0: 1, 1: 10}",25.0,1.0,810,COMPLETE
1408,1408,0.7706165209318194,2022-12-01 06:07:57.334035,2022-12-01 06:08:17.050608,0 days 00:00:19.716573,"{0: 1, 1: 10}",35.0,1.0,910,COMPLETE
1409,1409,0.7680098155245064,2022-12-01 06:08:17.273942,2022-12-01 06:08:37.097378,0 days 00:00:19.823436,"{0: 1, 1: 10}",18.0,1.0,910,COMPLETE
1410,1410,0.7697833409352448,2022-12-01 06:08:37.329823,2022-12-01 06:08:56.322676,0 days 00:00:18.992853,"{0: 1, 1: 10}",11.0,1.0,860,COMPLETE
1411,1411,0.7686921941739376,2022-12-01 06:08:56.547451,2022-12-01 06:09:16.549208,0 days 00:00:20.001757,"{0: 1, 1: 10}",17.0,1.0,910,COMPLETE
1412,1412,0.7678467727702636,2022-12-01 06:09:16.775465,2022-12-01 06:09:35.740674,0 days 00:00:18.965209,"{0: 1, 1: 10}",14.0,1.0,860,COMPLETE
1413,1413,0.7723778781025239,2022-12-01 06:09:35.970636,2022-12-01 06:09:55.923392,0 days 00:00:19.952756,"{0: 1, 1: 10}",11.0,1.0,910,COMPLETE
1414,1414,0.7653441254538225,2022-12-01 06:09:56.151312,2022-12-01 06:10:16.248084,0 days 00:00:20.096772,"{0: 1, 1: 10}",39.0,1.0,910,COMPLETE
1415,1415,0.7594591231203474,2022-12-01 06:10:16.482064,2022-12-01 06:10:36.136979,0 days 00:00:19.654915,"{0: 1, 1: 10}",5.0,1.0,910,COMPLETE
1416,1416,0.7732067578985686,2022-12-01 06:10:36.371978,2022-12-01 06:10:56.111553,0 days 00:00:19.739575,"{0: 1, 1: 10}",11.0,1.0,910,COMPLETE
1417,1417,0.7536110771271428,2022-12-01 06:10:56.341281,2022-12-01 06:11:15.549608,0 days 00:00:19.208327,"{0: 1, 1: 10}",4.0,1.0,910,COMPLETE
